United Nations Assan 6o,"N . .
\\| Distr.: Limited
)\'\/, General Assembly 13 Decembe” 1999","it
\\&g 2/ 4
I Original: English",Fifty-fourth session,Agenda item 20 (b),"Strengthening of the coordination of humanitarian and disaster relief
assistance of the United Nations, including special economic assistance:
special economic assistance to individual countries or regions","Antigua and Barbuda, Argentina, Bahamas, Barbados, Belize, Brazil, Cape
Verde, China, Colombia, Costa Rica, Cuba, Cyprus, Dominica, Dominican
Republic, Ecuador, El Salvador, Eritrea, Fiji, France, Grenada, Guatemala,
Guyana, Haiti, Honduras, India, Italy, Jamaica, Mexico, Namibia, Netherlands,
Nicaragua, Norway, Panama, Saint Kitts and Nevis, Saint Lucia, Saint Vincent
and the Grenadines, Samoa, Senegal, Solomon Islands, Suriname, Trinidad and
Tobago, Ukraine, United States of America and Venezuela",,,,,,,,,,,,,
United Nations Assan76/add 1,"23 December 1999
English
Original: Spanish","\‘{V/ \“\', General Assembly Distr.: Limited
\\s- 74",Fifty-fourth session,Agenda item 20 (b),"Strengthening of the coordination of humanitarian and disaster relief
assistance of the United Nations, including special economic assistance:
special economic assistance to individual countries or regions",Venezuela,,,,,,,,,,,,,
