year,Council,Session,Agenda item,Agenda detail,cosponsored countries,body title number,body title detail,body text,date,file,filecountry,footnote,scanned
1999,Convention On The Rights Of The Child,N/A,N/A,UNITED NATIONS,"Afghanistan, Albania, Andorra, Antigua and Barbuda, Argentina, Azerbaijan, Bahamas, Bangladesh, Barbados, Belarus, Belize, Benin, Bhutan, Bosnia and Herzegovina, Bulgaria, Burundi, Cambodia, Cameroon, Cape Verde, China, Colombia, Costa Rica, Croatia, Democratic Republic of the Congo, Dijibouti, Dominica, Ecuador, El Salvador, Estonia, Fiji, Gabon, Gambia, Georgia, Ghana, Greece, Grenada, Guatemala, Haiti, Honduras, Iceland, India, Indonesia, Iran (Islamic Republic of), Italy, Japan, Jordan, Kazakhstan, Kenvya, Kyrgyzstan, Latvia, Lebanon, Lesotho, Liberia, Lithuania, Madagascar, Malaysia, Mali, Malta, Marshall Islands, Mauritania, Micronesia (Federated States of), Monaco, Mongolia, Mozambique, Myanmar, Nicaragua, Nigeria, Pakistan, Palau, Papua New Guinea, Paraquay, Peru, Philippines, Portugal, Qatar, Romania, Saint Kitts and Nevis, Saint Lucia, Saint Vincent and the Grenadines, San Marino, Sao Tome and Principe, Singapore, Solomon Islands, Spain, Sri Lanka, Sudan, Suriname, Switzerland, Tajikistan, the former Yugoslav Republic of Macedonia, Togo, Turkey, Turkmenistan, Ukraine, United Republic of Tanzania, Uzbekistan, Vanuatu, Viet Nam and Zimbabwe",N/A,N,"OTIFICATION OF CANDIDATURES TO THE COMMITTEE ON THE RIGHTS OF THE CHILD (ARTICLE 43, PARAGRAPH 4 OF THE CONVENTION) The Seventh Meeting of the States Parties to the Convention on the Rights of the Child, Recalling that, with regard to the election of members of the Committee on the Rights of the Child, article 43, paragraph 4 of the Convention states that ""... At least four months before the date of each election, the Secretary- General of the United Nations shall address a letter to States Parties inviting them to submit their nominations within two months. The Secretary-General shall subsequently prepare a list in alphabetical order of all persons thus nominated, & ) 110299 indicating States Parties which have nominated them, and shall submit it to the States Parties to the present Convention"", Recognizing the importance of ensuring that the said procedure be scrupulously followed,",02/11/1998,1999_1488406,Afghanistan,"Convention on theCRC/SCRCDistr.Rights of the Child LIMITEDP/1999/L.111 February 1998ORIGINAL: ENGLISHTMEETING OF STATES PARTIT] Seventh Meeting New York, 16 February 1999=3 n",yes
1999,Economic And Social Council,Fifty-fifth session,11 (c),Economic and Social,"Distr LIMITED E/CN.4/1999/L.52 20 April 1999 Origina ENGLISH CIVIL AND POLITICAL RIGHTS FR T, .EDOM OF EXPRESSION Afghanistan*, Albania*, Argentina, Australia*, Austria, Bangladesh, Belarus*, Belgium*, Botswana, Brazil*, Bulgaria*, Canada, Cape Verde, Chile, Cbte d'Ivoire*, Cyprus*, Czech Republic, Denmark*, Dominican Republic*,",N/A,"1l Salvador,","Estonia*, Finland*, France, Germany, Greece*, Hungary*, Tceland*, India, Ireland, Japan, Latvia, Liechtenstein*, Tuxemburg, Morocco, Nepal, Netherlands*, New Zealand*, Norway, Peru, Poland, Portugal*, Romania, Russian Federation, Slovakia*, Slovenia*, Spain*, Sweden*, Switzerland*, The former Yugoslav Republic of Macedonia*, Ukraine*, United States of America, United Kingdom of Great Britain and Northern Ireland: 1999/... Right to freedom of opinion and expression The Commission on Human Rights, Guided by the Universal Dec aration of Human Rights, right to freedom of opinion and expression, Mindful of the International which reaffirms, in article 19, the right of everyone to ho Covenant on Civil and Po which affirms the itical Rights, d opinions without interference, as well as the right to freedom of expression, including the the functional commissions of the [al - of the rul les of procedure of Economic and Social Council. E/CN.4/1999/L.52 page 2 freedom to seek, receive and impart information and ideas of all kinds, regardless of frontiers, either orally, in writing or in print, in the form of art or through any other media of their choice, Mindful also that the International Covenant on Civil and Political Rights also states that the exercise of the right to freedom of expression carries with it special duties and responsibilities and may therefore be subject to certain restrictions, but that these should be only such as are provided by law and are necessary for the respect of the rights and reputations of others, or for the protection of national security or public order (ordre public) or of public health or morals, and that any propaganda for war or any advocacy of national, racial or religious hatred that constitutes incitement to discrimination, hostility or violence shall be prohibited by law, Recalling the Johannesburg Principles on National Security, Freedom of Expression and Access to Information adopted by a group of experts meeting in South Africa on 1 October 1995 (E/CN.4/1996/39, annex), Mindful of the need to ensure that unjustified invocation of national security to restrict the right to freedom of expression and information does not take place, Noting that restrictions on the exercise of the right to freedom of opinion and expression could indicate a deterioration in the protection, respect for and enjoyment of other human rights and freedoms, Considering that the effective promotion and protection of the human rights of persons who exercise the right to freedom of opinion and expression are of fundamental importance to the safeguarding of human dignity, Reaffirming that education is an integral component of the full and effective participation of persons in a free society, in particular for the full enjoyment of the right to freedom of opinion and expression, and that the eradication of illiteracy is very important to the achievement of these goals and to the development of the human person, Deeply concerned at numerous reports of detention of, as well as discrimination, threats and acts of violence and harassment, including persecution and intimidation, against professionals in the field of information, Taking note of the need to raise awareness about all aspects of the interrelationship between the use and availability of new media of communication, including to freedom of expression E/CN.4/1999/L.52 page 3 modern telecommunications technology, and the right and information, and of the efforts made in this regard in a number of international and regional forums, and mindful of provisions of relevant instruments, Deeply concerned that for women there exists a gap between the right to freedom of opinion and expression, the right to information and the effective enjoyment of those rights, and that this gap contributes to inadequate action by Governments in the in mainstream of their huma tegration of the human rights of women into the n rights activities,",04/20/1999,1999_1489884,Afghanistan,"* In accordance with rule 69, paragraph 3,",yes
