year,Council,Session,Agenda item,Agenda detail,cosponsored countries,body title number,body title detail,body text,date,file,filecountry,footnote,scanned
1999,General Assembly,Fifty-fourth session,111,"Report of the United Nations High Commissioner for Refugees, questions relating to refugees, returnees and displaced persons and humanitarian questions","Afghanistan, Bangladesh, Botswana, Cameroon, Céte d’Ivoire, Dominican Republic, Ecuador, El Salvador, Ethiopia, Iran (Islamic Republic of), Jordan, Kenya, Madagascar, Malawi, Morocco, Nigeria, Pakistan, Panama, Qatar, Sierra Leone, Sudan, Syrian Arab Republic and Yemen",N/A,Assistance to unaccompanied refugee minors,"The General Assembly , Recalling itsresolutions 49/172 of 23 December 1994, 50/150 of 21 December 1995, 51/73 of 12 December 1996, 52/105 of 12 December 1997 and 53/122 of 9 December 1998, Aware of the fact that the majority of refugees are children and women, Bearing in mind that unaccompanied refugee minors are among the most vulnerable refugees and the most at risk of neglect, violence, forced military recruitment, sexual assault and other abuses and therefore require special assistance and care, Mindful ofthe fact that the ultimate solution to the plight ofunaccompanied minors is their return to and reunification with their families, Notingtherevised Guidelines on Refugee Children issued by the Office of the United Nations High Commissioner for Refugees in May 1994 and development of an emergency kit to facilitate coordination and enhance the quality of responses to the needs of unaccompanied minors by the Office of the High Commissioner, the United Nations Children’s Fund and non-governmental organizations, Noting with appreciation the efforts of the Office of the High Commissioner for Refugees and the United Nations Children’s Fund in the identification and tracing of unaccompanied minors, and welcoming their efforts in reunifying family members of refugees, A/C.3/54/L.94 Welcoming the efforts exerted by the United Nations High Commissioner for Refugees for reunification of family members of refugees, Noting the efforts of the High Commissioner to ensure the protection of and assistance to refugees, including children and unaccompanied minors, and that further enhanced efforts need to be exerted to this effect, Recalling the provisions of the Convention on the Rights ofthe Child,' and the 1951 Convention? and the 1967 Protocol relating to the Status of Refugees,’ 1. Takes note of the report of the Secretary-General;* 2. Also takes note of the report of the Special Representative of the Secretary- General for Children and Armed Conflict;’ 3. Expressesitsdeep concernatthe continued plight ofunaccompanied refugee minors, and emphasizes once again the urgent need for their early identification and for timely, detailed and accurate information on their number and whereabouts; 4. Stresses the importance that adequate resources need to be provided for programmes of identification and tracing of unaccompanied refugee minors; 5. Callsuponthe Office ofthe United Nations High Commissioner for Refugees, in cooperation with other relevant United Nations bodies, to incorporate into its programmes policies that aim at preventing refugee family separation, conscious of the importance of family unity; 6. Callsupon all Governments, the Secretary-General, the Office of the United Nations High Commissioner for Refugees, all United Nations organizations, other international organizations and non-governmental organizations concerned to exert the maximum effort to assist and protect refugee minors and to expedite the return and reunification with their families of unaccompanied refugee minors; 7. UrgestheOffice ofthe High Commissioner, all United Nations organizations, other international organizations and non-governmental organizations concerned to take appropriate steps to mobilize resources commensurate with the needs and interests of unaccompanied refugee minors and for their reunification with their families; 8. Callsuponall States and other parties toarmed conflict torespect international humanitarian law and, in this regard, calls upon States parties to respect fully the provisions of the Geneva Conventions of 12 August 1949°and related instruments, while bearing in mind resolution 2 adopted at the twenty-sixth International Conference of the Red Cross and Red Crescent, held at Geneva in December 1995, and to respect the provisions of the Convention on the Rights of the Child,"" which accord children affected by armed conflict special protection and treatment; 9. Condemns all acts of exploitation ofunaccompanied refugee minors; including their use as soldiers or human shields in armed conflict and their forced recruitment into military forces, and any other acts that endanger their safety and personal security; 10. Calls upon the Secretary-General, the United Nations High Commissioner for Refugees, the Office for the Coordination of Humanitarian Affairs of the United ! Resolution 44/25, annex. United Nations, Treaty Series, vol. 189, No. 2545. Ibid., vol. 606, No. 879 1. United Nations, Treaty Series, vol. 75, Nos. 970-973. Nations Secretariat, the United Nations Children’s Fund, other United Nations organizations and other international organizations to mobilize adequate assistance to unaccompanied refugee minorsin theareas ofrelief, education, health and psychological rehabilitation; 12. Requeststhe Secretary-General toreport to the General Assembly at its fifty- sixth session on the implementation ofthe presentresolution and to give special attention to the girl-child refugee in his report. A/C.3/54/L.94",11/17/1999,1999_359681,Afghanistan,"1 1. Encouragesthe Special Representative ofthe Secretary-General for Children and Armed Conflict in his efforts to raise awareness worldwide and to mobilize official and public opinion for the protection of children affected by armed conflict, including refugee minors;",yes
1999,General Assembly,Fifty-fourth session,43,The situation in the Middle East99-36189 (E),"Afghanistan, Algeria, Bahrain, Bangladesh, Comoros, Cuba, Djibouti, Egypt, Indonesia, Jordan, Kuwait, Lebanon, Malaysia, Mauritania, Morocco, Oman, Qatar, Saudi Arabia, Sudan, Tunisia, United Arab Emirates, Yemen and Palestine",N/A,Jerusalem,"The General Assembly , Recalling its resolutions 36/120 E of 10 December 1981, 37/123 C of 16 December 1982, 38/180 C of 19 December 1983, 39/146 C of 14 December 1984, 40/168 C of 16 December 1985, 41/162 C of 4 December 1986, 42/209 D of 11 December 1987, 43/54 C of 6 December 1988, 44/40 C of 4 December 1989, 45/83 C of 13 December 1990, 46/82 B of 16 December 1991, 47/63 B of 11 December 1992, 48/59 A of 14 December 1993, 49/87 A of 16 December 1994, 50/22 A of 4 December 1995, 51/27 of 4 December 1996, 52/53 of 9 December 1997 and 53/37 of 2 December 1998, in which it, inter alia, determined that all legislative and administrative measures and actions taken by Israel, the occupying Power, which have altered or purported to alter the character and status of the Holy City of Jerusalem, in particular the so-called “Basic Law” on Jerusalem and the proclamation of Jerusalem as the capital of Israel, were null and void and must be rescinded forthwith, Recalling also Security Council resolution 478 (1980) of 20 August 1980, in which the Council, inter alia, decided not to recognize the “Basic Law” and called upon those States which had established diplomatic missions at Jerusalem to withdraw such missions from the Holy City, Having considered the report of the Secretary-General,' 1. Determines that the decision of Israel to impose its laws, jurisdiction and administration on the Holy City of Jerusalem is illegal and therefore null and void and has no validity whatsoever; ' A/54/495. 261199 2. Deploresthetransfer by some States of their diplomatic missions to Jerusalem in violation of Security Council resolution 478 (1980) and their refusal to comply with the provisions of that resolution; 3. Calls once more upon those States to abide by the provisions of the relevant United Nations resolutions, in conformity with the Charter of the United Nations; 4. Requests the Secretary-General to report tothe General Assembly at its fifty- fifth session on the implementation of the present resolution.",11/24/1999,1999_372768,Afghanistan,N/A,yes
1999,General Assembly,Fifty-fourth session,N/A,United Nations,"Afghanistan, Algeria, Bahrain, Bangladesh, Comoros, Cuba, Djibouti, Indonesia, Jordan, Lebanon, Malaysia, Mauritania, Morocco, Oman, Qatar, Saudi Arabia, Sudan, Syrian Arab Republic, Tunisia, United Arab Emirates, Yemen and Palestine",N/A,The Syrian Golan,"The General Assembly , Having considered the item entitled “The situation in the Middle East”, Taking note of the report of the Secretary-General,' Recalling Security Council resolution 497 (1981) of 17 December 1981, Reaffirming the fundamental principle of the inadmissibility of the acquisition of territory by force, in accordance with international law and the Charter of the United Nations, Reaffirming once more the applicability of the Geneva Convention relative to the Protection of Civilian Persons in Time of War, of 12 August 1949,% to the occupied Syrian Golan, Deeply concerned that Israel has not withdrawn from the Syrian Golan, which has been under occupation since 1967, contrary to the relevant Security Council and General Assembly resolutions, Stressing the illegality of the Israeli settlement construction and activities in the occupied Syrian Golan since 1967, Noting with satisfaction the convening at Madrid on 30 October 1991 of the Peace Conference on the Middle East, on the basis of Security Council resolutions 242 (1967) of 22 November 1967, 338 (1973) of 22 October 1973 and 425 (1978) of 19 March 1978 and the formula of land for peace, ' A/54/495. 2 United Nations, Treaty Series, vol. 75, No. 973. 261199 Expressing grave concern over the halt in the peace process on the Syrian and Lebanese tracks, and expressing the hope that peace talks will soon resume from the point they had reached, 1. Declares that Israel has failed so far to comply with Security Council resolution 497 (1981); 2. Declares also thatthe Israeli decision of 14 December 1981 to impose its laws, jurisdiction and administration on the occupied Syrian Golan is null and void and has no validity whatsoever, as confirmed by the Security Council in its resolution 497 (1981), and calls upon Israel to rescind it; 3. Reaffirms its determination that all relevant provisions of the Regulations annexed to the Hague Convention of 1907,° and the Geneva Convention relative to the Protection of Civilian Persons in Time of War, of 12 August 1949,% continue to apply to the Syrian territory occupied by Israel since 1967, and calls upon the parties thereto to respect and ensure respect for their obligations under those instruments in all circumstances; 4. Determines once more that the continued occupation of the Syrian Golan and its de facto annexation constitute a stumbling block in the way of achieving a just, comprehensive and lasting peace in the region; 5. Calls upon Israel to resume the talks on the Syrian and Lebanese tracks and to respect the commitments and undertakings reached during the previous talks; 6. Demands once more that Israel withdraw from all the occupied Syrian Golan tothe line of4 June 1967 in implementation of the relevant Security Council resolutions; 7. Calls upon all the parties concerned, the co-sponsors of the peace process and the entire international community to exert all the necessary efforts to ensure the resumption of the peace process and its success; 8. Requeststhe Secretary-General toreport to the General Assembly at its fifty- fifth session on the implementation of the present resolution.",11/26/1999,1999_372826,Afghanistan,@ &General Assembly e 00Original: EnglishFifty-fourth sessionAgenda item43The situation in the Middle East99-36195 (E),yes
1999,General Assembly,English session,N/A,United Nations,"Afghanistan, Algeria, Bangladesh, Brunei Darussalam, Comoros, Cuba, Djibouti, Egypt, Indonesia, Jordan, Kuwait, Malaysia, Malta, Mauritania, Morocco, Niger, Qatar, Senegal, Tunisia, United Arab Emirates, Yemen and Palestine",N/A,Division for Palestinian Rights of the Secretariat,"The General Assembly , Having considered the report of the Committee on the Exercise of the Inalienable Rights of the Palestinian People,’ Taking note in particular of the relevant information contained in chapter V.B of that report, Recalling itsresolutions 32/40 B of 2 December 1977, 33/28 C of 7 December 1978, 34/65 D of 12 December 1979, 35/169 D of 15 December 1980, 36/120 B of 10 December 1981, 37/86 B of 10 December 1982, 38/58 B of 13 December 1983, 39/49 B of 11 December 1984, 40/96 B of 12 December 1985, 41/43 B of 2 December 1986, 42/66 B of 2 December 1987,43/175 B of 15 December 1988, 44/41 B of 6 December 1989,45/67 B of 6 December 1990, 46/74 B of 11 December 1991, 47/64 B of 11 December 1992, 48/158 B of 20 December 1993, 49/62 B of 14 December 1994, 50/84 B of 15 December 1995, 51/24 of 4 December 1996, 52/50 of 9 December 1997 and 53/40 of 2 December 1998, 1. Notes with appreciation the action taken by the Secretary-General in compliance with its resolution 53/40; 2. Considersthatthe Division for Palestinian Rights ofthe Secretariat continues to make a useful and constructive contribution; 3. Requests the Secretary-General to continue to provide the Division with the necessary resources and to ensure that it continues to carry out its programme of work as detailed in the relevant earlier resolutions, in consultation with the Committee on the ' A/54/457-S/1999/1050. 261199 Exercise of the Inalienable Rights of the Palestinian People and under its guidance, including, in particular, the organization of meetings in various regions with the participation of all sectors of the international community, the further development and expansion of the documents collection of the United Nations Information System on the Question of Palestine, the preparation and widest possible dissemination of publications and information materials on various aspects of the question of Palestine, the provision of assistance in completing the project on the modernization of the records of the United Nations Conciliation Commission for Palestine, and the provision of the annual training programme for staff of the Palestinian Authority; 4. Also requests the Secretary-General to ensure the continued cooperation of the Department of Public Information and other units of the Secretariat in enabling the Division to perform its tasks and in covering adequately the various aspects of the question of Palestine; 5. Invites all Governments and organizations to extend their cooperation to the Committee and the Division in the performance of their tasks; 6. Noteswithappreciation the action taken by Member States to observe annually on 29 November the International Day of Solidarity with the Palestinian People, requests them to continue to give the widest possible publicity to the observance, and requests the Committee and the Division to continue to organize, as part of the observance of the Day of Solidarity, an annual exhibit on Palestinian rights in cooperation with Permanent Observer Mission of Palestine to the United Nations.",11/24/1999,1999_372849,Afghanistan,V/ \ Distr.: Limited g@?\} General Assembly Distr: Limited SFifty-fourth Agenda itemOriginal: Englishsession 44Question of Palestine,yes
1999,General Assembly,English session,N/A,United Nations,"Afghanistan, Algeria, Bangladesh, Brunei Darussalam, the Comoros, Cuba, Djibouti, Egypt, Indonesia, Jordan, Kuwait, Malaysia, Malta, Mauritania, Morocco, Niger, Qatar, Senegal, Tunisia, the United Arab Emirates, Yemen and Palestine",N/A,Special information programme on the question of Palestine of the Department of Public Information of the United Nations Secretariat,"The General Assembly , Having considered the report of the Committee on the Exercise of the Inalienable Rights of the Palestinian People,’ Taking note in particular of the information contained in chapter VI of that report, Recalling its resolution 53/41 of 2 December 1998, Convinced that the worldwide dissemination of accurate and comprehensive information and the role of non-governmental organizations and institutions remain of vital importance in heightening awareness of and support for the inalienable rights of the Palestinian people, Aware of the Declaration of Principles on Interim Self-Government Arrangements signed by the Government of the State of Israel and the Palestine Liberation Organization at Washington, D.C., on 13 September 1993,% and of the subsequent implementation agreements, in particular the Israeli-Palestinian Interim Agreement on the West Bank and the Gaza Strip signed at Washington, D.C., on 28 September 1995,* and the Sharm el-Sheikh Memorandum of 4 September 1999, and their positive implications, ! Official Records of the General Assembly , Fifty-fourth Session, Supplement No. 35 (A/54/35). 241199 1. Notes with appreciation the action taken by the Department of Public Information of the United Nations Secretariat in compliance with General Assembly resolution 53/41; 2. Considersthatthespecial information programme on the question of Palestine ofthe Department is veryuseful in raising the awareness of the international community concerning the question of Palestine and the situation in the Middle East in general, including the achievements of the peace process, and that the programme is contributing effectively to an atmosphere conducive to dialogue and supportive of the peace process; 3. Requests the Department, in full cooperation and coordination with the Committee on the Exercise ofthe Inalienable Rights of the Palestinian People, to continue, with the necessary flexibility as may be required by developments affecting the question ofPalestine, its special information programme for the biennium 2000-2001, in particular: (a) Todisseminate information on all the activities of the United Nations system relating to the question of Palestine, including reports on the work carried out by the relevant United Nations organizations; (b) To continue to issue and update publications on the various aspects of the question of Palestinein all fields, including materials concerning therecent developments in that regard, in particular the prospects for peace; (c) Toexpanditscollection ofaudio-visual material on the question of Palestine and to continue the production of such material, including the updating of the exhibit in the Secretariat; (d) Toorganizeand promote fact-finding news missions for journaliststothearea, including the territories under the jurisdiction of the Palestinian Authority and the occupied territories; (e) Toorganize international, regional and national seminars or encounters for journalists, aiming in particular at sensitizing public opinion on the question of Palestine; (f) TocontinuetoprovideassistancetothePalestinian peopleinthefield ofmedia development, in particular to strengthen the training programme for Palestinian broadcasters and journalists initiated in 1995. 4. Requeststhe Department of Public Information to promote the Bethlehem 2000 Project, within existing resources and until the Bethlehem 2000 commemoration comes to a close, including the preparation and dissemination of publications, audio-visual material and the establishment ofa “Bethlehem 2000” site on the United Nations Internet home page.",11/24/1999,1999_372862,Afghanistan,V/ \ Distr.: Limited g@?\} General Assembly Distr: Limited SFifty-fourth Agenda itemOriginal: Englishsession 44Question of Palestine,yes
