year,Council,Committee,Session,Agenda item,Agenda detail,cosponsored countries,body title number,body title detail,body text,date,file,filecountry,footnote,scanned
2002,General Assembly,Second Committee,Fifty-seventh session,84 (c),Macroeconomic policy questions: science and technology for development,Tunisia and Switzerland,N/A,World Summit on the Information Society,"The General Assembly, Recalling its resolution 56/183 of 21 December 2001, Recalling its plenary meeting devoted to information and communication technologies for development, held in New York, from 17 to 18 June 2002, Welcoming the preparations for the World Summit on the Information Society undertaken at national level, and encouraging all countries to intensify their work, Encouraging non-governmental organizations, civil society and the private sector to further contribute to and actively participate in the intergovernmental preparatory process of the Summit and in the Summit itself, Welcoming the outcome of the regional conference held at Bamako, from 25 to 30 May 2002, Also welcoming the results of the first meeting of the intergovernmental preparatory committee, held in Geneva from 1 to 5 July 2002, Further welcoming the decision of the Information and Communication Technologies Task Force to contribute actively to the preparatory process for the Summit and, to that end, to hold its next meeting at Geneva on 21 and 22 February 2003, 1. Takes note of the report of the Secretary-General of the International Telecommunication Union,* submitted to the General Assembly through the Economic and Social Council on the ongoing preparatory process for the Summit; 02-64376 (E) 161002 *0264376°* 2. Invites the Members States concerned to participate actively in the regional conferences to be held in Bucharest in November 2002, in Santo Domingo in January 2003 and in Tokyo in January 2003; 3. Urges all relevant United Nations bodies and other intergovernmental organizations, including international and regional institutions, to further their cooperation in and support to the preparatory process of the Summit; 4. Recommends that all actors involved adopt an integrated and coordinated approach to addressing the needs of developing countries, in particular the least developed among them; 5. Requests the International Telecommunication Union, in the context of its leading managerial role in the preparatory process of the Summit, in close cooperation with the Department for Public Information of the Secretariat and in coordination with other information offices of the United Nations system, to launch a public information campaign to raise global awareness of the Summit, including through reprioritization of its budget and through voluntary contributions; 6. Reiterates its call to the international community to make voluntary contributions to the special trust fund established by the International Telecommunication Union to support the preparations for and the holding of the Summit, as well as to facilitate the effective participation of representatives of developing countries, in particular the least developed countries, in the regional meetings to be held in the first half of 2003, the preparatory meetings, to be held in 2003, and the Summit itself; 7. Invites countries to send representation at the highest political level to the Summit; 8. Invites the Secretary-General of the United Nations to inform all heads of State and Government of the importance of the forthcoming Summit; 9. Invites the Secretary-General of the International Telecommunication Union to submit to the General Assembly for information, at its fifty-eighth and fifty-ninth sessions, through the Economic and Social Council, a report on the preparations for the Summit.",10/16/2002,2002_1491323,Afghanistan,N/A,yes
2002,General Assembly,N/A,Fifty-sixth session,32,Multilingualism,"Afghanistan, Albania, Andorra, Angola, Argentina, Armenia, Austria, Azerbaijan, Bahamas, Belgium, Benin, Bolivia, Bulgaria, Burkina Faso, Burundi, Cambodia, Cameroon, Canada, Cape Verde, Central African Republic, Chad, Chile, China, Colombia, Comoros, Congo, Costa Rica, Céte d’Ivoire, Cuba, Cyprus, Czech Republic, Democratic Republic of the Congo, Dominica, Dominican Republic, Ecuador, Equatorial Guinea, France, Gabon, Georgia, Germany, Greece, Guatemala, Guinea, Guinea-Bissau, Haiti, Honduras, Hungary, Ireland, Italy, Kazakhstan, Lao People’s Democratic Republic, Latvia, Lebanon, Liechtenstein, Lithuania, Luxembourg, Madagascar, Mali, Mauritius, Mexico, Monaco, Morocco, Niger, Panama, Paraguay, Peru, Poland, Portugal, Republic of Moldova, Romania, Russian Federation, Rwanda, San Marino, Senegal, Seychelles, Slovakia, Slovenia, Spain, Sudan, the former Yugoslav Republic of Macedonia, Togo, Tunisia, Uruguay, Uzbekistan, Venezuela, Viet Nam and Yugoslavia",N/A,Multilingualism,"The General Assembly, Recognizing that the United Nations pursues multilingualism as a means of promoting, protecting and preserving diversity of languages and cultures globally, Also recognizing that genuine multilingualism promotes unity in diversity and international understanding, Recalling its resolution 47/135 of 18 December 1992, in which it adopted the Declaration on the Rights of Persons Belonging to National, Ethnic, Religious anf,_.| Linguistic Minorities, and the International Covenant on Civil and Political Rights, in particular its article 27 concerning the rights of persons belonging to ethnic, religious or linguistic minorities, Also recalling its resolutions 2 (I) of 1 February 1946, 2480 B (XXIII) of 21 December 1968, 50/11 of 2 November 1995, 52/23 of 25 November 1997, 54/64 of 6 December 1999, 55/258 of 14 June 2001, 56/64 B of 24 December 2001 and 56/242 of 24 December 2001, | suggested therein; 2. Takes note of the appointment of a coordinator for multilingualism; 3. Notes with satisfaction the willingness of the Secretariat to encourage staff members, in formal meetings with interpretation services, to use any of the six official languages of which they have a command; 4. Stresses that the employment of staff shall continue to be carried out in strict accordance with Article 101 of the Charter of the United Nations and in line with the relevant provisions of its resolutions; 5. Also stresses that the promotion of staff in the Professional and higher categories should be carried out in strict accordance with Article 101 of the Charter of the United Nations and in line with the provisions of its resolution 2480 B (XXIII) and the relevant provisions of its resolution 55/258; 6. Encourages United Nations staff members to continue using actively existing training facilities to acquire and enhance their proficiency in one or more official languages of the United Nations; 7. Takes note of the overhaul of the recruitment system undertaken by the Secretariat within the context of Project Galaxy, and requests the Secretariat to ensure that the system becomes effective and operational as soon as practical; 8. Recalls its resolution 56/242, in which it requested the Secretary-General to report on the utilization rates of interpretation services and conference facilities at all duty stations with a view to improving interpretation services, and requests the Secretary-General to carry out a comprehensive review of the reasons for holding informal calendar meetings without interpretation; 9. Also recalls its resolution 56/64 B, in which it noted the continuing efforts of the Secretary-General to enrich on a multilingual basis the stock of books and journals in the Library, and section V, paragraph 1, of its resolution 56/242, in which it requested the Secretary-General to submit a progress report on the use of information technology, including computerized terminology data banks; 10. Further recalls its resolution 56/64 B, and emphasizes the importance of multilingualism in the United Nations public relations and information activities; 11. Requests the Secretary-General to submit to it at its fifty-eighth session a comprehensive report on the implementation of its resolutions on multilingualism, including the implications of section I of the present resolution; I 12. Welcomes the decision by the General Conference of the United Nations Educational, Scientific and Cultural Organization on 17 November 1999 that 21 February be proclaimed “International Mother Language Day” and calls upon A/56/L.44/Rev.2 Member States and the Secretariat to promote the preservation and protection of all languages used by peoples of the world; 13. Requests the Secretary-General to report to it at its fifty-eighth session on the measures that can be taken by Member States and international organizations within the United Nations system in order to strengthen the protection, promotion and preservation of all languages, in particular languages spoken by persons belonging to linguistic minorities and languages facing extinction; III 14. Decides to include in the provisional agenda of its fifty-eighth session the item entitled “Multilingualism”.",02/14/2002,2002_458199,Afghanistan,"* Reissued for technical reasons. 1 See resolution 2200 A (XXI), annex. 1 Takes note of the report of the Secretary-Generalgand recalls the actions",yes
2002,Economic And Social Council,Commission On Human Rights,Fifty-eighth session,10,"ECONOMIC, SOCIAL AND CULTURAL RIGHTS","Algeria, Afghanistan*, Argentina, Austria, Bangladesh, Belgium, Brazil, Burundi, Cameroon, China, Cuba, Dominican Republic*, Finland, Georgia*, Greece*, Guatemala, Iraq*, Netherlands*, Panama*, Paraguay*, Peru, Portugal, Slovenia*, South Africa, Swaziland, Thailand, Uruguay, Venezuela",2002,The right of everyone to the enjoyment of the highest attainable standard of physical and mental health,"The Commission on Human Rights, Reaffirming the Universal Declaration of Human Rights, the International Covenant on Economic, Social and Cultural Rights, the International Convention on the Elimination of All Forms of Racial Discrimination, the Convention on the Elimination of All Forms of Discrimination against Women and the Convention on the Rights of the Child, Reaffirming also that the right of everyone to the enjoyment of the highest attainable standard of physical and mental health is a human right and that such right derives from the inherent dignity of the human person, Recalling the declarations and programmes of action adopted by the major United Nations conferences and summits and their follow-up meetings, Recalling also its previous resolutions on the realization of economic, social and cultural rights, in particular resolutions 2001/30 of 20 April 2001, 2001/33 of 23 April 2001 and 2001/51 of 24 April 2001, Taking note with interest of General Comment No. 14 (2000) on the right to the highest attainable standard of health (art. 12 of the International Covenant on Economic, Social and Cultural Rights), adopted by the Committee on Economic, Social and Cultural Rights at its twenty-second session in May 2000, Aware that, for millions of people throughout the world, the full enjoyment of the right to the highest attainable standard of physical and mental health still remains a distant goal and that, in many cases, especially for those living in poverty, this goal is becoming increasingly remote, Recognizing a need for States, in cooperation with international organizations and civil society, including non-governmental organizations and the private sector, to create favourable conditions at the national, regional and international levels to ensure the full and effective enjoyment of the right of everyone to the highest attainable standard of physical and mental health, Welcoming the recent initiatives by the Secretary-General and relevant United Nations bodies and programmes, such as the World Health Organization and the Joint United Nations Programme on HIV/AIDS, as well as public-private partnership initiatives, such as the Global Fund to Fight AIDS, Tuberculosis and Malaria, which contribute to improvements in addressing health issues worldwide, including in developing countries, while noting that further progress should be achieved in this regard, including in the mobilization of resources, Mindful of the need to promote and protect the progressive realization of the right of everyone to the enjoyment of the highest attainable standard of physical and mental health, 1. Urges States to take steps, individually and through international assistance and cooperation, especially economic and technical, to the maximum of their available resources for this purpose, with a view to achieving progressively the full realization of the right of everyone to the enjoyment of the highest attainable standard of physical and mental health by all appropriate means, including particularly the adoption of legislative measures; 2. Calls upon the international community to continue to assist the developing countries in promoting the full realization of the right of everyone to the enjoyment of the highest attainable standard of physical and mental health, including through financial and technical support as well as training of personnel, while recognizing that the primary responsibility for promoting and protecting all human rights rests with States; 3. Calls upon States to guarantee that the right of everyone to the enjoyment of the highest attainable standard of physical and mental health will be exercised without discrimination of any kind; 4. Decides to appoint, for a period of three years, a special rapporteur whose mandate will focus on the right of everyone to the enjoyment of the highest attainable standard of physical and mental health, as reflected in article 25, paragraph 1, of the Universal Declaration of Human Rights, article 12 of the International Covenant on Economic, Social and Cultural Rights, article 24 of the Convention on the Rights of the Child and article 12 of the Convention on the Elimination of All Forms of Discrimination against Women, as well as on the right to non-discrimination as reflected in article 5 (e) (iv) of the International Convention on the Elimination of All Forms of Racial Discrimination; 5. Requests the Special Rapporteur: (a) To gather, request, receive and exchange information from all relevant sources, including Governments, intergovernmental organizations and non-governmental organizations, on the realization of the right of everyone to the enjoyment of the highest attainable standard of physical and mental health; (b) To develop a regular dialogue and discuss possible areas of cooperation with all relevant actors, including Governments, relevant United Nations bodies, specialized agencies and programmes, in particular the World Health Organization and the Joint United Nations Programme on HIV/AIDS, as well as non-governmental organizations and international financial institutions; (c) To report on the status, throughout the world, of the realization of the right of everyone to the enjoyment of the highest attainable standard of physical and mental health, in accordance with the provisions of the instruments listed in paragraph 4 above, and on developments relating to this right, including on laws, policies and good practices most beneficial to its enjoyment and obstacles encountered domestically and internationally to its implementation; (d) To make recommendations on appropriate measures to promote and protect the realization of the right of everyone to the enjoyment of the highest attainable standard of physical and mental health, with a view to supporting States’ efforts to enhance public health; 6. Requests the Special Rapporteur to avoid in her or his work any duplication or overlapping with the work, competence and mandate of other international bodies active in health issues; 7. Invites the Special Rapporteur to apply a gender perspective in her or his work and to pay special attention to the needs of children in the realization of the right of everyone to the enjoyment of the highest attainable standard of physical and mental health; 8. Invites the Special Rapporteur to take into account in her or his work the relevant provisions of the Durban Declaration and Programme of Action, as well as of the declarations and programmes of action adopted by the major United Nations conferences and summits and their follow-up meetings, and to bear in mind General Comment No. 14 of the Committee on Economic, Social and Cultural Rights and General Recommendation No. 24 of the Committee on the Elimination of Discrimination against Women, as well as any other general comment that treaty bodies adopt on related provisions of relevant instruments; 9. Requests the United Nations High Commissioner for Human Rights to provide all the necessary resources for the effective fulfilment of the Special Rapporteur’s mandate from within existing resources; 10. Calls upon Governments to cooperate fully with the Special Rapporteur in the implementation of her or his mandate, to provide all information requested and to respond promptly to her or his communications; 11. Requests the Special Rapporteur to submit an annual report to the Commission on the activities performed under her or his mandate; 12. Decides to continue consideration of this matter at its fifty-ninth session under 10. 12. the same agenda item.",04/15/2002,2002_462364,Afghanistan,"* In accordance with rule 69, paragraph 3, of the rules of procedure of the functional commissions of the Economic and Social Council.",yes
