year,Council,Committee,Session,Agenda item,Agenda detail,cosponsored countries,body title number,body title detail,body text,date,file,filecountry,footnote,scanned
2002,General Assembly,First Committee,Fifty-seventh session,66,General and complete disarmament,"Afghanistan, Bhutan, Fiji, Georgia, India, Marshall Islands, Mauritius, Nauru, Papua New Guinea, Solomon Islands, Sri Lanka and Tuvalu: revised",N/A,Measures to prevent terrorists from acquiring weapons of mass destruction,"The General Assembly, Recognizing the determination of the international community to combat terrorism, as evident in relevant General Assembly and Security Council resolutions, Deeply concerned by the growing risk of linkages between terrorism and weapons of mass destruction, and in particular by the fact that terrorists may seek to acquire weapons of mass destruction, Acknowledging the consideration of issues relating to terroriﬁl and weapons of mass destruction by the Advisory Board on Disarmament Matters, Taking note of resolution GC(46)/RES/13, adopted by the General Conference of the International Atomic Energy Agency at its forty-sixth regular session,* and the setting up of an Advisory Group on Nuclear Security in the IAEA to advise the Director General on the Agency’s activities relating to nuclear security, Taking ntﬁe of the report of the Policy Working Group on the United Nations and Terrorism, Mindful of the urgent need for addressing this threat to humanity within the United Nations framework and through international cooperation, 2 See International Atomic Energy Agency, Resolutions and Other Decision of the General Conference, Forty-sixth regular session, 16-20 September 2002 (GC (46) RES/DEC (2002)). 02-64905 (E) 181002 *0264905* Emphasizing that progress is urgently needed in the area of disarmament and non-proliferation in order to help maintain international peace and security and to contribute to global efforts against terrorism, 1. Calls upon all Member States to support international efforts to prevent terrorists from acquiring weapons of mass destruction and their means of delivery; 2. Urges all Member States to undertake and strengthen national measures, as appropriate, to prevent terrorists from acquiring weapons of mass destruction, their means of delivery and materials and technologies related to their manufacture, and invites them to inform the Secretary-General, on a voluntary basis, of the measures taken in this regard; 3. Encourages cooperation among and between Member States and relevant regional and international organizations for strengthening national capacities in this regard; 4. Requests the Secretary-General to compile a report on measures already taken by international organizations on issues relating to the linkage between the fight against terrorism and the proliferation of weapons of mass destruction, to seek the views of Member States on additional relevant measures for tackling the global threat posed by terrorists acquiring weapons of mass destruction, and to report to the General Assembly at its fifty-eighth session; 5. Decides to include in the provisional agenda of its fifty-eighth session, the item entitled “Measures to prevent terrorist from acquiring weapons of mass destruction”.",10/18/2002,2002_476446,Afghanistan,N/A,yes
2002,General Assembly,Second Committee,Fifty-seventh session,86 (c),Sustainable development and international economic cooperation: culture and development,"Afghanistan, Algeria, Argentina, Armenia, Azerbaijan, Australia, Belarus, Belgium, Bhutan, Bosnia and Herzegovina, Brunei Darussalam, Bulgaria, Cambodia, Chile, China, Cyprus, Costa Rica, Egypt, Gabon, Georgia, Greece, Japan, Jordan, Israel, Kyrgyzstan, Lebanon, Malaysia, Mongolia, Morocco, Oman, Pakistan, Republic of Moldova, Romania, Russian Federation, Saudi Arabia, Singapore, Slovakia, South Africa, Switzerland, Syrian Arab Republic, Thailand, Turkey, Uganda, Ukraine and United States of America",N/A,Year of Kyrgyz Statehood,"The General Assembly, Recalling its resolution 53/22 of 4 November 1998, entitled “United Nations Year of Dialogue among Civilizations”, Also recalling its resolution 49/129 of 19 December 1994, entitled “Commemoration of the millennium of the Kyrgyz national epic, Manas”, Further recalling its resolution 56/8 of 21 November 2001, entitled “United Nations Year for Cultural Heritage, 20027, Stressing the importance of promoting education and raising public awareness in order to foster respect for national cultures, the cultural heritage of the world and civilizational diversity, which is essential for strengthening global peace and implementing international cooperation, Noting the richness of Kyrgyz culture and its national, regional and international significance, 1. Welcomes the efforts undertaken by the Government of the Kyrgyz Republic to declare 2003 as the Year of Kyrgyz Statehood and to organize activities in celebration of the year; 02-64911 (E) 181002 *0264911°* 2. Invites Member States, the United Nations, its specialized agencies and other international and intergovernmental organizations, as well as regional and non- governmental organizations and foundations, to take part in the events being organized by the Kyrgyz Republic to celebrate the year 2003.",10/18/2002,2002_476466,Afghanistan,N/A,yes
2002,General Assembly,N/A,Fifty-seventh session,98,"Social development, including questions relating to the world social situation and to youth, ageing, disabled persons and the family","Afghanistan, Andorra, Angola, Antigua and Barbuda, Argentina, Armenia, Australia, Austria, Bangladesh, Barbados, Belarus, Belgium, Benin, Bhutan, Bolivia, Bosnia and Herzegovina, Botswana, Brazil, Burkina Faso, Burundi, Cameroon, Canada, Cape Verde, Chile, China, Colombia, Costa Rica, Cote d’Ivoire, Croatia, Cuba, Cyprus, Czech Republic, Democratic Republic of the Congo, Denmark, Djibouti, Dominican Republic, Ecuador, Egypt, El Salvador, Ethiopia, Fiji, Finland, France, Germany, Greece, Guatemala, Guinea-Bissau, Guyana, Haiti, Hungary, Iceland, India, Ireland, Israel, Italy, Japan, Jordan, Latvia, Liechtenstein, Lithuania, Luxembourg, Madagascar, Malta, Mexico, Monaco, Mongolia, Mozambique, Namibia, Nepal, Netherlands, New Zealand, Nicaragua, Nigeria, Norway, Pakistan, Panama, Paraguay, Peru, Philippines, Poland, Portugal, Qatar, Republic of Korea, Romania, Russian Federation, San Marino, Senegal, Sierra Leone, South Africa, Spain, Sri Lanka, Sudan, Suriname, Swaziland, Sweden, Switzerland, Thailand, Togo, Trinidad and Tobago, Tunisia, Uganda, Ukraine, United Kingdom of Great Britain and Northern Ireland, United Republic of Tanzania, United States of America, Uruguay, Venezuela, Yugoslavia, Zambia and Zimbabwe",N/A,Follow-up to the International Year of Volunteers,"The General Assembly, Recalling its resolution 40/212 of 17 December 1985, in which it invited Governments to observe annually, on 5 December, an International Volunteer Day for Economic and Social Development, Recalling also its resolution 52/17 of 20 November 1997, in which it proclaimed the year 2001 as the International Year of Volunteers, and its resolution 55/57 of 4 December 2000 on the observance of the International Year of Volunteers, Recalling further and reaffirming its resolution 56/38 of 5 December 2001, which lays down recommendations for ways in which Governments and the United Nations system could support volunteering, Recognizing the valuable contribution of volunteering, including traditional forms of mutual aid and self-help, formal service delivery and other forms of civic 02-64749 (E) 221002 *0264749°* participation, to economic and social development, benefiting society at large, communities and the individual volunteer, Recognizing also that volunteerism is an important component of any strategy aimed at, inter alia, such areas as poverty reduction, sustainable development, health, disaster prevention and management and social integration and, in particular, overcoming social exclusion and discrimination, Recognizing further that volunteering, particularly at the community level, will help achieﬁ the development goals and objectives set in the Millennium Declaration* and in other major United Nations conferences, summits, special sessions and their follow-up meetings, Noting with appreciation the efforts to increase awareness of volunteerism through global information sharing and education, including efforts to develop an effective network for volunteers through, inter alia, the International Year of Volunteers web site and linked national sites, Acknowledging the existing contribution of the organizations of the United Nations system to supporting volunteering, including the work of United Nations volunteers around the world, Bearing in mind the need for an integrated and coordinated follow-up to the International Year of Volunteers to be pursued in the relevant parts of the United Nations system, 1. Welcomes the report of the Secretary-ﬂeneral on the outcome and follow- up of the International Year of Volunteers, 2001; 2. Welcomes also the successful observance of the International Year of Volunteers, 2001, with the support of one hundred twenty-three national International Year of Volunteers committees and the many regional and city International Year of Volunteers committees with broad representation from Governments, international organizations, civil society, including non-governmental organizations as well as the private sector, recognizes the contribution of States and civil society organizations and alliances at the international, regional, national and local levels to such a success, and encourages this network to be maintained and expanded, as appropriate, with a view to further engaging all stakeholders, undertaking volunteer-related research, disseminating information and experiences, providing preparation and training to volunteers, particularly from developing countries, and forging new partnerships at all levels; 3. Welcomes further the various developments of policies and the enactment of legislations for the growth and development of volunteerism taken up as a result of the international year, and recommends that Governments continue to acknowledge the valuable role of volunteers and further support voluntary activities, including through appropriate policies and enabling legislation; 4. Calls upon Governments and the United Nations system to implement further the recommendations contained in the annex to its resolution 56/38, bearing in mind the economic significance of volunteering; 1 See resolution 55/2. 2 A/57/352. A/57/L.8 5. Calls upon Governments, with the active support of the media, civil society and the private sector, to observe 5 December, International Volunteer Day for Economic and Social Development, and to include activities focused on follow- up on the achievements of the International Year of Volunteers in its public awareness-raising campaigns; 6. Reaffirms the need to recognize and promote all forms of volunteerism as an issue that involves and benefits all segments of society, including children, youth, older persons, persons with disabilities, minorities and immigrants and those who remain excluded for social or economic reasons; 7. Invites all stakeholders, especially from the private sector community and from private foundations, to support volunteerism as a strategic tool to enhance economic and social development, including by expanding corporate volunteering; 8. Welcomes the work of the United Nations Volunteers, as the focal point for the International Year of Volunteers, as well as its role in the preparations and implementation of the Year, and requests it to continue its efforts, together with other stakeholders, to raise awareness of volunteerism, increase reference and networking resources available and provide technical cooperation to developing countries, upon their request, in the field of volunteerism; 9. Invites the United Nations Volunteers to develop a global qnternet volunteer resource based on the International Year of Volunteers web site*and on national web sites with a view to enhancing network capabilities and to expanding information, knowledge and resource management, and encourages Governments and all stakeholders, in particular the private sector, to contribute on a voluntary basis to this initiative; 10. Calls for the relevant organizations and bodies of the United Nations system to integrate volunteerism in its various forms into their policies, programmes and reports, and encourages the recognition and inclusion of volunteer contributions in future United Nations and other relevant international conferences, such as the World Summit on the Information Society; 11. Requests the Secretary-General to factor such contributions made by volunteers in his reports on the implementation of the Millennium Declaration™and of other major United Nations conferences, summits, special sessions and their follow-up meetings; 12. Also requests the Secretary-General to take measures, in particular within the mandates and the existing resources of the United Nations Volunteers and the Department of Public Information, to ensure that the potential of the International Volunteer Day for Economic and Social Development in follow-up to the International Year of Volunteers is fully realized; 13. Further requests the Secretary-General to report to the General Assembly at its sixtieth session on the implementation of the current resolution, under the agenda item entitled “Social development, including questions relating to the world social situation and to youth, ageing, disabled persons and the family”. 3 http://www.iyv2001.org.",10/17/2002,2002_477024,Afghanistan,N/A,yes
2002,General Assembly,N/A,Fifty-seventh session,24,Culture of peace,"Afghanistan, Argentina, Azerbaijan, Bangladesh, Chile, Costa Rica, Cuba, El Salvador, Guatemala, India, Philippines, Senegal and the Former Yugoslav Republic of Macedonia",N/A,"International Decade for a Culture of Peace and Non-Violence for the Children of the World, 2001-2010","The General Assembly, Bearing in mind the Charter of the United Nations, including the purposes and principles contained therein, and especially the dedication to saving succeeding generations from the scourge of war, Recalling the Constitution of the United Nations Educational, Scientific and Cultural Organization, which states, “since wars begin in the minds of men, it is in the minds of men that the defences of peace must be constructed”, Recalling also its previous resolutions on a culture of peace, in particular resolution 52/15 of 20 November 1997, proclaiming 2000 as the International Year for the Culture of Peace, resolution 53/25 of 10 November 1998, proclaiming the period 2001-2010 as the International Decade for a Culture of Peace and Non- Violence for the Children of the World, and resolution 56/5 of 13 November 2001, Reaffirming the Declarationli—'land Programme of Actionl;lon a Culture of Peace, recognizing that they serve, inter alia, as the basis for the observance of the Decade, and convinced that the effective and successful observance of the Decade throughout the world will promote a culture of peace and non-violence that benefits humanity, in particular future generations, Recalling the United Nations Millennium DeclarationJ;I which calls for the active promotion of a culture of peace, 1 Resolution 53/243 A. 2 Resolution 53/243 B. 3 See resolution 55/2. 02-67352 (E) 011102 *0267352* Taking note of Commission on Humaﬁ]Rights resolution 2000/66 of 26 April 2000, entitled “Towards a culture of peace”, Taking note also of the report of the Secretary-General on the Internationali:| Decade for a Culture of Peace and Non-Violence for the Children of the World, including paragraph 28 thereof, which indicates that each of the ten years of the Decade will be marked with a different priority theme related to the Programme of Action, Noting the relevance of the World Summit on Sustainable Development, held in Johannesburg, South Africa, from 26 August to 4 September 2002, the International Conference on Financing for Development, held in Monterrey, Mexico, from 18 to 22 March 2002, the special session of the General Assembly on children, held in New York from 8 to 10 May 2002, the World Conference against Racism, Racial Discrimination, Xenophobia and Related Intolerance, held in Durban, South Africa, from 31 August to 7 September 2001, and the United Nations Decade for Human Rights Education, 1995-2004, for the International Decade for a Culture of Peace and Non-Violence for the Children of the World, 2001-2010, and the need to implement, as appropriate, the relevant decisions agreed upon therein, Recognizing that all efforts made by the United Nations system in general and the international community at large for peacekeeping, peace-building, the prevention of conflicts, disarmament, sustainable development, the promotion of human dignity and human rights, democracy, the rule of law and good governance at the national and international levels contribute greatly to the culture of peace, Taking into account the “Manifesto 2000 initiative of the United Nations Educational, Scientific and Cultural Organization promoting a culture of peace, which has so far received over seventy-five million signatures of endorsement throughout the world, Taking note with appreciation of the report of the Director-General of United Nations Educational, Scientific anﬂ]Cultural Organization on the implementation of General Assembly resolution 56/5, 1. Reiterates that the objective of the International Decade for a Culture of Peace and Non-Violence for the Children of the World is to further strengthen the global movement for a culture of peace following the observance of the International Year for the Culture of Peace in 2000; 2. Invites Member States to continue to place greater emphasis on and expand their activities promoting a culture of peace and non-violence, in particular during the Decade, at the national, regional and international levels and to ensure that peace and non-violence are fostered at all levels; 3. Commends the United Nations Educational, Scientific and Cultural Organization for recognizing the promotion of a culture of peace as the expression of its fundamental mandate, and encourages it, as the lead agency for the Decade, to further strengthen the activities it has undertaken for promoting a culture of peace, 4 See Official Records of the Economic and Social Council, Supplement No. 3 and corrigendum (E/2000/23 and Corr.1) chap. 11, sect. A. A/57/L.9/Rev.1 including the dissemination of the Declaration on a Culture of Peace' and the Programme of Action” and related materials in various languages across the world; 4. Also commends the relevant United Nations bodies, in particular the United Nations Children’s Fund, the United Nations Development Fund for Women and the University for Peace, for their activities in further promoting a culture of peace and non-violence, including the promotion of peace education and activities related to specific areas identified in the Programme of Action on a Culture of Peace, and encourages them to continue and further strengthen and expand their efforts;? 5. Encourages the appropriate authorities to provide education, in children’s schools, that includes lessons in mutual understanding, tolerance, active citizenship, human rights and the promotion of the culture of peace; 6. Encourages civil society, including non-governmental organizations, to strengthen its efforts in furtherance of the objectives of the Decade, inter alia, by adopting its own programme of activities to complement the initiatives of Member States, the organizations of the United Nations system and other international and regional organizations; 7. Also encourages the involvement of the mass media in education for a culture of peace and non-violence, with particular regard to children and young people, including through the planned expansion of the Culture of Peace News Network as a global network of Internet sites in many languages; 8. Welcomes the efforts made by the United Nations Educational, Scientific and Cultural Organization to continue the communication and networking arrangements established during the International Year for providing an instant update of developments related to the observance of the Decade; 9. Invites Member States to observe 21 September each year as the International Day of Peace, as a day of global ceasefire and non-violence, in accordance with General Assembly resolution 55/282 of 7 September 2001; 10. Also invites Member States as well as civil society, including non- governmental organizations, to provide information to the Secretary-General on the observance of the Decade and the activities undertaken to promote a culture of peace and non-violence; 11. Emphasizesﬁlhe significance of the plenary meetings on the item planned for its sixtieth session,” and in that regard encourages participation at a high level and decides to consider, at an appropriate time, the possibility of organizing those meetings as close as possible to the general debate; 12. Requests the Secretary-General to submit to the General Assembly at its fifty-eighth session a report on the implementation of the present resolution; 13. Decides to include in the provisional agenda of its fifty-eighth session the item entitled “Culture of peace”. 7 Resolution 55/47, para. 13.",11/01/2002,2002_477570,Afghanistan,N/A,yes
