year,Council,Committee,Session,Agenda item,Agenda detail,cosponsored countries,body title number,body title detail,body text,date,file,filecountry,footnote,scanned
2010,General Assembly,N/A,Sixty-fourth session,70 (a),"Strengthening of the coordination of humanitarian and disaster relief assistance of the United Nations, including special economic assistance: strengthening of the coordination of emergency humanitarian assistance","Australia, Brazil, Cameroon, Chile, Colombia, Dominican Republic, Japan, Kazakhstan, Norway, Peru, Philippines, Saint Vincent and the Grenadines, Spain and Uruguay",N/A,"Humanitarian assistance, emergency relief and rehabilitation for Haiti in response to the devastating effects of the earthquake in that country","Addendum Add the following countries to the list of sponsors of the resolution: Albania, Algeria, Andorra, Antigua and Barbuda, Argentina, Armenia, Austria, Azerbaijan, Bahamas, Bangladesh, Barbados, Belarus, Belgium, Belize, Benin, Bosnia and Herzegovina, Bulgaria, Burkina Faso, Burundi, Cambodia, Canada, Central African Republic, Comoros, Congo, Costa Rica, Croatia, Cuba, Cyprus, Czech Republic, Denmark, Ecuador, Egypt, El] Salvador, Eritrea, Estonia, Finland, France, Gambia, Georgia, Germany, Ghana, Greece, Grenada, Guatemala, Guyana, Haiti, Honduras, Hungary, Iceland, India, Indonesia, Iran (Islamic Republic of), Ireland, Israel, Italy, Jamaica, Jordan, Lao People’s Democratic Republic, Latvia, Lebanon, Liechtenstein, Lithuania, Luxembourg, Madagascar, Malta, Mauritius, Mexico, Monaco, Mongolia, Montenegro, Morocco, Nepal, Netherlands, New Zealand, Nigeria, Pakistan, Panama, Papua New Guinea, Poland, Portugal, Republic of Korea, Republic of Moldova, Romania, Russian Federation, Rwanda, Saint Lucia, San Marino, Senegal, Serbia, Seychelles, Singapore, Slovakia, Slovenia, South Africa, Sudan, Suriname, Sweden, Switzerland, Thailand, the former Yugoslav Republic of Macedonia, Tonga, Trinidad and Tobago, Tunisia, Turkey, Turkmenistan, Ukraine, United Kingdom of Great Britain and Northern Ireland, United Republic of Tanzania, United States of America, Viet Nam, Yemen and Zambia 10-21729 Hi 260110 CNY A A",01/22/2010,2010_675700,Albania,N/A,yes
2010,General Assembly,N/A,Sixty-fourth session,49,Culture of peace,"Afghanistan, Azerbaijan, Iran (Islamic Republic of), Kazakhstan, Kyrgyzstan, Tajikistan, Turkey and Turkmenistan",N/A,International Day of Nowruz*,"Addendum Add the following countries to the list of sponsors of the resolution: Albania, India and the former Yugoslav Republic of Macedonia 10-24975 Hil 250210 CAT A A A A",02/23/2010,2010_677315,Albania,"* Nowruz (Novruz, Navruz, Nooruz, Nevruz, Nauryz) means new day and is celebrated on 21 March of each year; its spelling and pronunciation may vary according to the country.",yes
2010,General Assembly,N/A,Sixty-fourth session,46,Global road safety crisis,"Argentina, Armenia, Azerbaijan, Bangladesh, Belarus, Belgium, Benin, Chile, Costa Rica, Cuba, Cyprus, Dominican Republic, Finland, France, Germany, Greece, Hungary, Iceland, India, Israel, Italy, Jamaica, Jordan, Kazakhstan, Lao People’s Democratic Republic, Lebanon, Luxembourg, Malaysia, Mexico, Mongolia, Morocco, Netherlands, Norway, Oman, Peru, Poland, Portugal, Republic of Moldova, Romania, Russian Federation, Saudi Arabia, Serbia, Seychelles, Singapore, Slovenia, Sri Lanka, Sweden, Tajikistan, Thailand, the former Yugoslav Republic of Macedonia, Turkey, Turkmenistan, United Kingdom of Great Britain and Northern Ireland, Uruguay, Uzbekistan, Venezuela (Bolivarian Republic of), Viet Nam and Yemen",N/A,Improving global road safety,"Addendum Add the following countries to the list of sponsors of the resolution: Albania, Algeria, Australia, Bahrain, Canada, Cape Verde, Colombia, Croatia, Czech Republic, Democratic People’s Republic of Korea, Denmark, Ecuador, Egypt, El Salvador, Estonia, Grenada, Haiti, Iraq, Ireland, Japan, Kuwait, Kyrgyzstan, Lithuania, Malta, Mauritius, Monaco, Montenegro, Myanmar, Nepal, New Zealand, Pakistan, Qatar, Saint Lucia, Slovakia, Spain, Sudan, Switzerland, Trinidad and Tobago, Tunisia, Ukraine, United Arab Emirates and United States of America 10-25985 Hil 080310 CAT A A A",03/02/2010,2010_677897,Albania,N/A,yes
2010,General Assembly,N/A,Sixty-fourth session,126,Sixty-fifth anniversary of the end of the Second World War,"Armenia, Azerbaijan, Belarus, Canada, Croatia, Cuba, Cyprus, Ecuador, Kazakhstan, Kyrgyzstan, Luxembourg, Mongolia, Nicaragua, Peru, Portugal, Republic of Moldova, Romania, Russian Federation, Serbia, Slovenia, South Africa, Tajikistan, Trinidad and Tobago, Turkmenistan, Ukraine, United States of America, Uzbekistan and Viet Nam",N/A,Sixty-fifth anniversary of the end of the Second World War,"Addendum Add the following countries to the list of sponsors of the resolution: Albania, Algeria, Andorra, Australia, Belgium, Benin, Cambodia, Congo, Czech Republic, Egypt, El Salvador, France, India, Iraq, Israel, Lao People’s Democratic Republic, Lebanon, Malta, Monaco, Montenegro, Netherlands, New Zealand, Papua New Guinea, Poland, Slovakia, Somalia, the former Yugoslav Republic of Macedonia, United Kingdom of Great Britain and Northern Ireland, Venezuela (Bolivarian Republic of) and Zambia 10-25991 Hil 080310 CAT A TA A",03/02/2010,2010_677905,Albania,N/A,yes
2010,General Assembly,Commission On Human Rights,Thirteenth session,3,"Promotion and protection of all human rights, civil, political, economic, social and cultural rights, including the right to development","Albania*, Austria*, Belarus*, Bolivia (Plurinational State of), Bosnia and Herzegovina, Canada*, Costa Rica*, Dominican Republic*, Estonia*, Finland*, France, Germany*, Greece*, Hungary, Ireland*, Italy, Luxembourg*, Mexico, Montenegro*, Morocco*, Netherlands, Norway, Peru*, Portugal*, Romania*, Serbia*, Slovakia, Slovenia, Spain*, Switzerland*, United Kingdom of Great Britain and Northern Ireland, Uruguay, Venezuela (Bolivarian Republic of)",N/A,"13/... Adequate housing as a component of the right to an adequate standard of living, in the context of the hosting of mega-events","The Human Rights Council, Recalling all previous resolutions on adequate housing of the Council and the Commission on Human Rights, in particular Council resolution 6/27 of 14 December 2007 and Commission resolution 2004/28 of 16 April 2004, Reaffirming that international human rights law instruments, including the International Covenant on Economic, Social and Cultural Rights and the Universal Declaration of Human Rights, entail obligations and commitments of States parties in relation to access to adequate housing, Recalling the principles and commitments with regard to adequate housing enshrined in the relevant provisions of declarations and programmes adopted by major United Nations conferences and summits and at special sessions of the General Assembly and by their follow-up meetings, inter alia, the Istanbul Declaration on Human Settlements and the Habitat Agenda (A/CONF. 165/14), and the Declaration on Cities and Other Human Settlements in the New Millennium adopted at the twenty-fifth special session of the Assembly, and annexed to its resolution S-25/2 of 9 June 2001, Noting the work of the United Nations treaty bodies, in particular the Committee on Economic, Social and Cultural Rights, in the promotion of the rights related to adequate housing, including its general comments Nos. 4, 7, 9 and 16, Please recycle ee A/HRC/13/L.6 Concerned that any deterioration in the general housing situation disproportionally affects persons living in conditions of poverty, low-income earners, women, children, persons belonging to minorities and indigenous peoples, migrants, the elderly and persons with disabilities, Recognizing that the hosting of “mega-events’, that is, large-scale events of limited duration and diverse nature, including major international sporting or cultural events, can provide a major opportunity to enhance the housing stock and to improve the related infrastructure in the host country, 1. Acknowledges with appreciation the work of the Special Rapporteur on adequate housing as a component of the right to an adequate standard of living, and on the right to non-discrimination in this context, including the undertaking of country missions; 2. Acknowledges the Special Rapporteur’s annual report on the realization of the right to adequate housing in the context of hosting mega-events (A/HRC/13/20); 3. Calls upon States, in the context of hosting mega-events, to promote the right to adequate housing and to create a sustainable, development-oriented housing legacy, and to strive in this regard: (a) | To integrate housing concerns into the bidding and planning process at an early stage and, in this regard, to assess the impact on the affected population throughout the process, as appropriate; (b) To ensure full transparency of the planning and implementation process and the meaningful participation of the affected local communities therein; (c) To pay particular attention to persons belonging to vulnerable and marginalized groups, including by respecting the principles of non-discrimination and gender equality; (d) To plan and develop the event venues with the post-event period in view, while taking into account the needs of socially disadvantaged persons for affordable housing; (e) To ensure, consistent with the domestic legal framework and international human rights obligations, that the right to adequate housing of affected persons in the context of the hosting of mega-events is respected, while giving due consideration to issues such as insecurity of tenure; (f) To explore alternatives to evictions and to undertake any such evictions as may be necessary in accordance with the domestic legal framework and in full compliance with the relevant provisions of international human rights law, including those for adequate and effective remedies; 4. Encourages States to share with the Special Rapporteur good practices with regard to the realization of the right to adequate housing in the context of the hosting of mega-events; 5. Requests the Special Rapporteur to consider, as appropriate, the issue of mega-events in the context of her work; 6. Notes with appreciation the cooperation extended to date to the Special Rapporteur by different actors, and calls upon States to continue to cooperate with the Special Rapporteur in the discharge of her mandate and to respond favourably to her requests for information and visits; GE. 10-12221 A/HRC/13/L.6 7. Requests the United Nations High Commissioner for Human Rights to continue to ensure that the Special Rapporteur receives the necessary resources to enable her to discharge her mandate fully; 8. Decides to continue its consideration of this matter under the same agenda item and in accordance with its programme of work. GE. 10-12221",03/18/2010,2010_679237,Albania,* Non-Member State of the Human Rights Council.,yes
2010,General Assembly,Commission On Human Rights,Thirteenth session,3,"Promotion and protection of all human rights, civil, political, economic, social and cultural rights, including the right to development","Albania*, Argentina, Armenia*, Austria*, Bosnia and Herzegovina, Brazil, Canada™*, Chile, Colombia*, Costa Rica*, Croatia*, Czech Republic*, Denmark’, Finland*, Germany“, Greece*, Guatemala*, Hungary, Ireland*, Italy, Luxembourg*, Malta*, Netherlands, Norway, Peru*, Poland*, Romania*, Russian Federation, Serbia*, Slovakia, Slovenia, Switzerland*, United Kingdom of Great Britain and Northern Ireland, Uruguay",N/A,"13/... Rights of persons belonging to national or ethnic, religious and linguistic minorities","The Human Rights Council, Recalling the International Covenant on Civil and Political Rights, the Convention on the Rights of the Child and the Declaration on the Rights of Persons Belonging to National or Ethnic, Religious and Linguistic Minorities, and bearing in mind article 27 of the International Covenant on Civil and Political Rights and other relevant existing international standards and national legislation, Recalling also all previous resolutions on the rights of persons belonging to national or ethnic, religious and linguistic minorities adopted by the General Assembly, the Commission on Human Rights and the Council, including Council resolutions 6/15 of 28 September 2007 and 7/6 of 27 March 2008, Emphasizing the need for reinforced efforts to meet the goal of the full realization of the rights of persons belonging to national or ethnic, religious and linguistic minorities, Stressing that the lack of equal opportunities and equal access to education for many persons belonging to minorities, in particular minority children, prevents them from contributing fully to their own communities and to the wider society, and perpetuates the cycle of poverty experienced acutely by persons belonging to minorities facing discrimination, economic marginalization and social exclusion, Please recycle ee A/HRC/13/L.11 Stressing also that the effective participation of persons belonging to minorities in national political, cultural, religious, economic and social processes of their societies is of paramount importance for their full and equal enjoyment of all human rights, and contributes to the alleviation of tensions, serves the purpose of conflict prevention and increases stability and social cohesion, 1. Urges States to review, enact and amend their legislation, where necessary, as well as their educational policies and systems, to ensure the realization of the right to education, as set out in the Universal Declaration of Human Rights, to eliminate discrimination and to provide for equal access to quality education for persons belonging to minorities, in particular minority children, while protecting their identity, as enshrined in the Declaration, and promoting integration, social inclusion and a prosperous and stable society; 2. Also urges States to develop appropriate mechanisms for effective participation of and consultation with persons belonging to minorities in order to take into account their views in decision-making processes affecting them, with a view to promoting greater participation in the political processes of the country and providing inclusive, informed and sustainable policymaking and implementation; 3. Welcomes the successful completion of the first two sessions of the Forum on Minority Issues addressing the right to education and the right to effective political participation and which, through the widespread participation of stakeholders, provided an important platform for promoting dialogue on these topics, and as part of its outcome identified in its recommendations best practices and challenges for the further implementation of the Declaration on the Rights of Persons Belonging to National or Ethnic, Religious and Linguistic Minorities, and encourages States to take into consideration, as appropriate, relevant recommendations of the Forum; 4. Commends the independent expert on minority issues for the work undertaken to date, for the important role that she has played in raising the level of awareness of and in giving added visibility to the rights of persons belonging to national or ethnic, religious and linguistic minorities, and for her guiding role in the preparation and work of the Forum on minority issues, which contributes to efforts to improve cooperation among all United Nations mechanisms relating to the rights of persons belonging to minorities; 5. Takes note of the reports of the independent expert (A/HRC/10/11 and A/HRC/13/23) and of the Secretary-General (A/HRC/9/8, AJHRC/10/38 and A/HRC/10/38 Add.1) providing, inter alia, an overview of minority-related activities of the Office of the United Nations High Commissioner for Human Rights and other United Nations mechanisms, such as the treaty bodies and the special procedures; 6. Welcomes the inter-agency cooperation of United Nations agencies, funds and programmes on minority issues, led by the Office of the High Commissioner, and urges them to further increase their cooperation by, inter alia, developing policies on the promotion and protection of rights of persons belonging to minorities, drawing also on relevant outcomes of the meetings of the Forum; 7. Invites the human rights treaty bodies and special procedures of the Council to continue to give attention, within their respective mandates, to the situations and rights of persons belonging to minorities and, in this regard, to take into consideration relevant recommendations of the Forum; 8. Requests the High Commissioner to present an annual report to the Council containing information on relevant developments of United Nations human rights bodies and mechanisms, as well as on the activities undertaken by the Office of the High GE. 10-12284 A/HRC/13/L.11 Commissioner at Headquarters and in the field that contribute to the promotion of and respect for the provisions of the Declaration on the Rights of Persons Belonging to National or Ethnic, Religious and Linguistic Minorities; 9. Requests the Office of the High Commissioner to prepare a compilation of existing manuals, guides, training material and other tools dealing with minority issues by various United Nations entities, and to present the compilation to the Council at its sixteenth session; 10. Requests the Secretary-General and the High Commissioner to continue to provide all the human, technical and financial assistance necessary for the effective fulfilment of the mandate of the independent expert and for the activities of the Office of the High Commissioner in the area of rights of persons belonging to minorities; 11. Decides to continue its consideration of this issue in accordance with its annual programme of work. GE. 10-12284",03/19/2010,2010_679680,Albania,* Non-Member State of the Human Rights Council.,yes
