year,Council,Committee,Session,Agenda item,Agenda detail,cosponsored countries,body title number,body title detail,body text,date,file,filecountry,footnote,scanned
2013,General Assembly,N/A,Sixty-seventh session,121 (g),Cooperation between the United Nations and regional and other organizations: cooperation between the United Nations and the Community of Portuguese-speaking Countries,"Angola, Brazil, Cape Verde, Guinea-Bissau, Mozambique, Portugal, Sao Tome and Principe and Timor-Leste",N/A,Cooperation between the United Nations and the Community of Portuguese-speaking Countries,"Addendum Add the following countries to the list of sponsors of the resolution: Albania, Andorra, Argentina, Australia, Austria, Azerbaijan, Belgium, Belize, Bosnia and Herzegovina, Bulgaria, Chile, Colombia, Costa Rica, Croatia, Cuba, Cyprus, Czech Republic, Democratic Republic of the Congo, Denmark, Dominican Republic, Estonia, Finland, France, Georgia, Germany, Greece, Guatemala, Guyana, Haiti, Hungary, Ireland, Italy, Latvia, Lithuania, Luxembourg, Malta, Mauritius, Mexico, Monaco, Montenegro, Morocco, Namibia, Netherlands, New Zealand, Nicaragua, Norway, Philippines, Poland, Republic of Moldova, Romania, Saint Lucia, Samoa, Serbia, Slovakia, Slovenia, Somalia, Spain, Swaziland, Sweden, Thailand, the former Yugoslav Republic of Macedonia, Ukraine, United States of America, Uruguay, Venezuela (Bolivarian Republic of), Zambia and Zimbabwe. 13-27130 iil 260313 CA MY A",03/26/2013,2013_746469,Azerbaijan,N/A,yes
2013,General Assembly,N/A,Sixty-seventh session,94,General and complete disarmament,"Albania, Antigua and Barbuda, Argentina, Australia, Austria, the Bahamas, Belgium, Bulgaria, Chile, Colombia, Costa Rica, Cote d’Ivoire, Croatia, Cyprus, Czech Republic, Denmark, Dominican Republic, Estonia, Finland, France, Germany, Ghana, Greece, Grenada, Guatemala, Guyana, Haiti, Hungary, Iceland, Italy, Jamaica, Japan, Kenya, Latvia, Liberia, Liechtenstein, Lithuania, Luxembourg, Mali, Mexico, Montenegro, Morocco, Namibia, the Netherlands, New Zealand, Nigeria, Norway, Peru, Poland, Portugal, Republic of Korea, Romania, Rwanda, Saint Lucia, Saint Vincent and the Grenadines, Slovakia, Slovenia, Spain, Sweden, Switzerland, Trinidad and Tobago, Turkey, United Kingdom of Great Britain and Northern Ireland and United States of America",N/A,The Arms Trade Treaty,"The General Assembly, Recalling its resolutions 63/240 of 24 December 2008 and 64/48 of 2 December 2009, and its decision 66/518 of 2 December 2011, Recalling also its resolution 67/234 of 24 December 2012, in which the General Assembly decided to remain seized of the matter of the Arms Trade Treaty during its sixty-seventh session, Having considered the report of the Final United Nations Conference on the Arms Trade Treaty as contained in document A/CONF.217/2013/2, 1. Adopts the Arms Trade Treaty as contained in the annex to document A/CONF.217/2013/L.3; 2. Requests the Secretary-General, as depositary of the Treaty, to reflect the date of adoption of the Treaty by the General Assembly in the final sentence of the Treaty; 3. Also requests the Secretary-General, as depositary of the Treaty, to open it for signature on 3 June 2013; Please recycle es 13-27427 iil 010413 CN NY A 4. Calls upon all States to consider signing and, thereafter, according to their respective constitutional processes, becoming parties to the Treaty at the earliest possible date; 5. Further requests the Secretary-General, as depositary of the Treaty, to report to the General Assembly at its sixty-eighth session on the status of signature and ratification of the Treaty. 13-27427",04/01/2013,2013_746683,Azerbaijan,N/A,yes
2013,Economic And Social Council,Commission On Human Rights,Twenty-second session,3,"Promotion and protection of all human rights, civil, political, economic, social and cultural rights, including the right to development","Algeria , Angola, Australia’, Austria, Azerbaijan , Belgium’, Bolivia (Plurinational State of)’, Bosnia and Herzegovina , Burkina Faso, Chile, Colombia , Costa Rica, Croatia’, Cuba , Czech Republic, Denmark , Djibouti , El Salvador , Estonia, Finland , France , Georgia , Germany, Guatemala, Honduras , Iceland’, Ireland, Latvia’, Maldives, Mexico’, Monaco , New Zealand , Norway , Panama , Paraguay , Peru, Poland, Portugal’, Slovakia , Spain, Sri Lanka , State of Palestine , Sweden , Thailand, Tunisia , Turkey , United States of America, Uruguay , Venezuela (Bolivarian Republic of), Zimbabwe",N/A,22/... Birth registration and the right of everyone to recognition everywhere as a person before the law,"The Human Rights Council, Guided by the purposes and principles contained in the Charter of the United Nations, Recalling General Assembly resolution 60/251 of 15 March 2006, in which the Assembly established the Human Rights Council, Reaffirming the human right of everyone to be recognized everywhere as a person before the law, which is enshrined in, inter alia, the Universal Declaration of Human Rights, the International Covenant on Civil and Political Rights, the Convention on the Rights of the Child, the Convention on the Rights of Persons with Disabilities and other relevant international instruments, Recalling the obligation of States to register all children immediately after birth, as provided for in the International Covenant on Civil and Political Rights, the Convention on the Rights of the Child, the International Convention on the Rights of All Migrant Workers and Members of Their Families and other relevant international instruments to which they are party, ” Non-Member State of the Human Rights Council. Please reeyele OO GE.13-12389 A/HRC/22/L.14/Rev.1 Recognizing the importance of a human rights-based approach to birth registration, based on international human rights obligations and commitments operationally directed to promoting and protecting human rights, Welcoming the continuing efforts of the Committee on the Rights of the Child towards universal birth registration, such as through recommendations widely addressed to States in this regard, Recalling the resolutions adopted by the General Assembly and the Human Rights Council calling upon States to ensure the registration of all children immediately after birth, the most recent being Assembly resolution 66/141 of 19 December 2011 and Council resolution 19/9 of 22 March 2012, Recognizing the importance of birth registration, including late birth registration and provision of documents of proof of birth, as a means for providing an official record of the existence of a person and the recognition of that individual as a person before the law; expressing concern that unregistered individuals have limited or no access to services and enjoyment of all the rights to which they are entitled; also taking into consideration that persons without birth registration are vulnerable to lack of protection; and aware that registering a person’s birth is a vital step towards the promotion and protection of all his or her human rights, and protection from violence, exploitation and abuse, Recognizing also the importance of birth registration, including late birth registration, for the development of vital statistics and the effective implementation of programmes and policies intended to achieve internationally agreed development goals, including the Millennium Development Goals, Recognizing further the efforts undertaken at the regional level to achieve universal birth registration, including the Conference of African Ministers responsible for Civil Registration, the Universal Civil Identity Program in the Americas, the High-level Meeting on the Improvement of Civil Registration and Vital Statistics in Asia and the Pacific, 1. Expresses concern at the high number of persons throughout the world whose birth is not registered; 2. Reminds States of their obligation to register births without discrimination of any kind and irrespective of the status of his or her parents; 3. Calls upon States to establish or strengthen existing institutions at all levels responsible for birth registration and the preservation and security of such records, to ensure adequate training for registration officers, to allocate sufficient and adequate human, technical and financial resources to fulfil their mandate, and to increase, as needed, the number of birth registration facilities, paying attention to the local community level; 4. Also calls upon States to take all appropriate measures to permanently store and protect civil registration records and to prevent the loss or destruction of records due to emergency situations; 5. Further calls upon States to ensure free birth registration, including free or low-fee late birth registration, by means of universal, accessible, simple, expeditious and effective registration procedures without discrimination of any kind; 6. Calls upon States to continuously raise awareness at national, regional and local levels of birth registration, including by engagement in collaboration with all relevant actors in public campaigns that raise awareness of the importance of birth registration for effective access to services and enjoyment of human rights; 7. Urges States to identify and remove physical, administrative, procedural and any other barriers that impede access to birth registration, including late registration, paying A/HRC/22/L.14/Rev.1 due attention to, among others, those barriers relating to poverty, disability, gender, nationality, displacement, illiteracy and detention contexts, and to persons in vulnerable situations; 8. Encourages States to request technical assistance, if required, from relevant United Nations bodies, agencies, funds and programmes, including the United Nations Children’s Fund, the United Nations Population Fund, the Department of Economic and Social Affairs, the Office of the United Nations High Commissioner for Refugees, the World Health Organization, the Office of the United Nations High Commissioner for Human Rights and the United Nations Development Programme, and other relevant stakeholders in order to fulfil their obligation to undertake birth registration as a means to respect the right of everyone to be recognized everywhere as a person before the law; 9. Invites the above-mentioned United Nations bodies, agencies, funds and programmes and other relevant stakeholders to cooperate with States in providing technical assistance, upon request, and calls upon them to ensure that persons with no birth registration are not discriminated against in any of their programmes; 10. Requests the Office of the United Nations High Commissioner for Human Rights to prepare a report, in consultation with States, United Nations agencies, funds and programmes, non-governmental organizations and other relevant stakeholders, on legal, administrative, economic, physical and any other barriers to access to universal birth registration and possession of documentary proof of birth, as well as on good practices adopted by States in fulfilling their obligation to ensure birth registration, to be submitted to the Human Rights Council at its twenty-seventh session; 11. | Decides to consider this issue in accordance with its annual programme of work.",03/19/7013,2013_746800,Azerbaijan,N/A,yes
2013,Convention On The Rights Of The Child,Commission On Human Rights,Twenty-second session,9,"Racism, racial discrimination, xenophobia and related forms of intolerance, follow-up to and implementation of the Durban Declaration and Programme of Action","Angola, Andorra , Argentina, Austria, Azerbaijan , Belgium , Bolivia (Plurinational State of)’, Bosnia and Herzegovina , Brazil, Cape Verde , Chile, Colombia , Costa Rica, Cuba’, El Salvador , Georgia , Germany, Ghana , Guatemala, Honduras , Italy, Libya, Luxembourg , Mozambique , Norway , Paraguay , Peru, Portugal , Romania, Russian Federation , Spain, State of Palestine , Sudan , Timor-Leste , Turkey , Uruguay , Venezuela (Bolivarian Republic of)",N/A,"22/... Education as a tool to prevent racism, racial discrimination, xenophobia and related intolerance","The Human Rights Council, Guided by the purposes and principles of the Charter of the United Nations, Guided also by the Universal Declaration of Human Rights, the International Covenants on Human Rights, the International Convention on the Elimination of All Forms of Racial Discrimination and other relevant international instruments, Recalling the commitment reached at the World Conference on Human Rights in 1993, and its outcome, the Vienna Declaration and Programme of Action, concerning the elimination of racism, racial discrimination, xenophobia and related intolerance, Recalling also the commitment reached at the World Conference against Racism, Racial Discrimination, Xenophobia and Related Intolerance in 2001, and its outcome, the Durban Declaration and Programme of Action and the outcome document of the Durban Review Conference, Recalling further all previous resolutions and decisions of the General Assembly, the Commission on Human Rights and the Human Rights Council on the elimination of racism, racial discrimination, xenophobia and related intolerance, and on the right to education, Reaffirming the human right of everyone to education, which is enshrined in, inter alia, the Universal Declaration of Human Rights, the International Covenant on Economic, ” Non-Member State of the Human Rights Council. Please reeyele OO GE.13-12303 A/HRC/22/L.6/Rev.1 Social and Cultural Rights, the International Convention on the Elimination of All Forms of Racial Discrimination, the Convention on the Rights of the Child, the Convention on the Elimination of All Forms of Discrimination against Women and the Convention on the Rights of Persons with Disabilities, the Convention against Discrimination in Education of the United Nations Educational, Scientific and Cultural Organization, the United Nations Declaration on Human Rights Education and Training, and other relevant international instruments, Acknowledging that the Durban Declaration and Programme of Action recognizes that education at all levels and all ages, including within the family, in particular human rights education, is a key to changing attitudes and behaviour based on racism, racial discrimination, xenophobia and related intolerance and to promoting tolerance and respect for diversity in societies, and affirms that such education is a determining factor in the promotion, dissemination and protection of the democratic values of justice and equity, which are essential to prevent and combat the spread of racism, racial discrimination, xenophobia and related intolerance, Recognizing the important role played by the United Nations Educational, Scientific and Cultural Organization in relation to education against racism, racial discrimination, xenophobia and related intolerance, in particular the Slave Route Project and the Teaching Respect for All initiative, Encouraging all States, in cooperation with the United Nations, the United Nations Educational, Scientific and Cultural Organization and other relevant international organizations, to initiate and develop cultural and educational programmes aimed at countering racism, racial discrimination, xenophobia and related intolerance in order to ensure respect for the dignity and worth of all human beings and to enhance mutual understanding among all cultures and civilizations, Welcoming the efforts made by the Office of the United Nations High Commissioner for Human Rights and by the Intergovernmental Working Group on the Effective Implementation of the Durban Declaration and Programme of Action in this regard, Affirming that the realization of the right to education, including for girls and persons belonging to vulnerable groups, contributes to the eradication of poverty and of racism, racial discrimination, xenophobia and related intolerance, 1. Underlines the need for increased political will and commitment in using education as a tool to prevent and combat racism, racial discrimination, xenophobia and related intolerance; 2. Reaffirms that education, development and the faithful implementation of all international human rights norms and obligations, including enactment of laws and political, social and economic policies, are crucial to combat racism, racial discrimination, xenophobia and related intolerance; 3. Recognizes that quality education, the elimination of illiteracy and access to free primary education for all can contribute to more inclusive societies, equity, stable and harmonious relations and friendship among nations, peoples, groups and individuals, and a culture of peace, fostering mutual understanding, solidarity, social justice and respect for all human rights for all; 4. Underlines the essential role of education, including human rights education and education that is sensitive to and respects cultural diversity, especially among children and young people, in the prevention and eradication of all forms of intolerance and discrimination, and welcomes the catalytic role that non-governmental organizations play in promoting human rights education and raising awareness about racism, racial discrimination, xenophobia and related intolerance; A/HRC/22/L.6/Rev.1 5. Urges States, in particular: (a) To adopt and implement laws that prohibit discrimination on the basis of race, colour, descent or national or ethnic origin, at all levels of education, both formal and non-formal; (b) To take all appropriate measures to eliminate obstacles limiting the access of children to education; (c) To ensure that all children have access without discrimination to education of good quality; (d) | Tosupport efforts to ensure safe school environments, free from violence and harassment motivated by racism, racial discrimination, xenophobia or related intolerance; 6. Also urges States to introduce and, as applicable, to reinforce anti- discrimination and anti-racism components in human rights programmes in school curricula, to develop and improve relevant educational material, including history and other textbooks, and to ensure that all teachers are effectively trained and adequately motivated to shape attitudes and behavioural patterns based on the principles of non-discrimination, mutual respect and tolerance; 7. Draws attention to the potential of increasing the use of the new information and communications technologies, including the Internet, to create educational and awareness-raising networks against racism, racial discrimination, xenophobia and related intolerance, both in and out of school, as well as to the ability of the Internet to promote universal respect for human rights and also respect for the value of cultural diversity; 8. Stresses the need for States parties to implement fully their obligations under the International Convention on the Elimination of All Forms of Racial Discrimination as the principal convention in the fight against racism, and in particular their obligations thereunder with respect to the elimination of racial discrimination, the right to education and training and their obligations to adopt immediate and effective measures in the fields of teaching, education, culture and information; 9. Recalls the importance of international cooperation in promoting education as a tool to prevent racism, racial discrimination, xenophobia and related intolerance and to share good practices; 10. Requests the Special Rapporteur on contemporary forms of racism, racial discrimination, xenophobia and related intolerance to continue to address the role of education to prevent racism, racial discrimination, xenophobia and related intolerance in his next reports as appropriate and, in this context, encourages all States and other stakeholders to provide information on good practices to the Special Rapporteur and to the Office of the United Nations High Commissioner for Human Rights, to be made publicly available on the website of the Special Rapporteur and entered into the global database, established by the Office of the High Commissioner, containing information on practical means to address racism, racial discrimination, xenophobia and related intolerance.",03/19/3013,2013_746802,Azerbaijan,N/A,yes
2013,General Assembly,N/A,Sixty-seventh session,20,Sustainable development,"Afghanistan, Armenia, Australia, Austria, Azerbaijan, Belarus, Belgium, Bulgaria, Burkina Faso, China, Croatia, Cuba, Cyprus, Czech Republic, Denmark, Estonia, Finland, France, Georgia, Germany, Greece, Hungary, Iran (Islamic Republic of), Ireland, Israel, Italy, Kazakhstan, Kyrgyzstan, Lao People’s Democratic Republic, Latvia, Lithuania, Luxembourg, Malaysia, Malta, Netherlands, New Zealand, Niger, Norway, Pakistan, Portugal, Republic of Moldova, Romania, Russian Federation, Serbia, Slovakia, Slovenia, Spain, Sri Lanka, Sweden, Tajikistan, the former Yugoslav Republic of Macedonia, Turkey, Turkmenistan, Ukraine and Uzbekistan",N/A,Reliable and stable transit of energy and its role in ensuring sustainable development and international cooperation,"The General Assembly, Recalling its resolution 63/210 of 19 December 2008, Recalling also the outcome document of the United Nations Conference on Sustainable Development, entitled “The future we want”, ! Bearing in mind the growing role of the transit of energy in global processes, Recognizing the important role of transportation hubs for the reliable and stable transit of energy to international markets, Noting that stable, efficient and reliable energy transportation, as a key factor of sustainable development, is in the interest of the entire international community, Welcoming efforts at the national, bilateral, subregional, regional and international levels in building energy transportation systems, and facilitating the trade of energy resources to promote sustainable development, Recognizing the importance of addressing the special needs of landlocked developing countries, inter alia, by establishing and promoting efficient transit transportation systems that link them to the international markets, and in this regard, 1 Resolution 66/288, annex. 13-33304 nn 150513 CA RYN AA reaffirming that the Almaty Programme of Action? constitutes a fundamental framework for genuine partnerships between landlocked and transit developing countries and their development partners at the national, bilateral, subregional, regional and global levels, Reiterating the principles of the Rio Declaration on Environment and Development? and of Agenda 21,4 and recalling the recommendations and conclusions contained in the Plan of Implementation of the World Summit on Sustainable Development® concerning energy for sustainable development, Noting the outcome of the High-level Conference on Reliable and Stable Transit of Energy and its Role in Ensuring Sustainable Development and International Cooperation, held in Ashgabat on 23 April 2009, Noting also the launching of the initiative of the Secretary-General “Sustainable Energy for All”, which focuses on access to energy, energy efficiency and renewable energies, as well as the decision of the General Assembly to declare the decade 2014-2024 the United Nations Decade of Sustainable Energy for All,® 1. Recognizes the need for extensive international cooperation for promoting the reliable transportation of energy to international markets through pipelines and other transportation systems; 2. Welcomes the proposal of the Government of Turkmenistan to host an international meeting of experts early in 2014 to follow up on the High-level Conference on Reliable and Stable Transit of Energy and its Role in Ensuring Sustainable Development and International Cooperation held in Ashgabat on 23 April 2009; 3. Invites the Secretary-General to seek the views of Member States and relevant entities of the United Nations system, including regional commissions, on issues relating to the reliable and stable transit of energy, as well as on possible modalities for international cooperation, and to communicate such views in a summary report of the Secretariat to the General Assembly at its sixty-ninth session for further consideration. 2 Report of the International Ministerial Conference of Landlocked and Transit Developing Countries and Donor Countries and International Financial and Development Institutions on Transit Transport Cooperation, Almaty, Kazakhstan, 28 and 29 August 2003 (A/CONF.202/3), annex II. 3 Report of the United Nations Conference on Environment and Development, Rio de Janeiro, 3-14 June 1992, vol. I, Resolutions Adopted by the Conference (United Nations publication, Sales No. E.93.1.8 and corrigendum), resolution 1, annex I. S Report of the World Summit on Sustainable Development, Johannesburg, South Africa, 26 August-4 September 2002 (United Nations publication, Sales No. E.03.11.A.1 and corrigendum), chap. I, resolution 2, annex.",05/14/2013,2013_749173,Azerbaijan,N/A,yes
