year,Council,Committee,Session,Agenda item,Agenda detail,cosponsored countries,body title number,body title detail,body text,date,file,filecountry,footnote,scanned
2002,General Assembly,N/A,Fifty-seventh session,22 (c),Cooperation between the United Nations and regional and other organizations: cooperation between the United Nations and the Caribbean Community,"Antigua and Barbuda, Bahamas, Barbados, Belize, Dominica, Grenada, Guyana, Haiti, Jamaica, Saint Kitts and Nevis, Saint Lucia, Saint Vincent and the Grenadines, Suriname and Trinidad and Tobago",N/A,Cooperation between the United Nations and the Caribbean Community,"The General Assembly, Recalling its resolutions 46/8 of 16 October 1991, 49/141 of 20 December 1994, 51/16 of 11 November 1996, 53/17 of 29 October 1998 and 55/17 of 7 November 2000, Noting with satisfaction the report of the Secretary=(General on cooperation between the United Nations and the Caribbean Community, Bearing in mind the provisions of Chapter VIII of the Charter of the United Nations on the existence of regional arrangements or agencies for dealing with such matters relating to the maintenance of international peace and security as are appropriate for regional action and other activities consistent with the purposes and principles of the United Nations, Bearing in mind also the assistance given by the United Nations towards the maintenance of peace and security in the Caribbean region, Noting with satisfaction that the first general meeting between representatives of the Caribbean Community and its associated institutions and of the United Nations system was held in New York on 27 and 28 May 1997, and that the second general meeting was held in Nassau on 27 and 28 March 2000, 02-69450 (E) 151102 *0269450°* Bearing in mind that, in resolutions 54/225 of 22 December 1999 and 55/203 of 20 December 2000, it recognized the importance of adopting an integrated management approach to the Caribbean Sea area in the context of sustainable development, Bearing in mind also that, in the United Nations Millennium Declaration, adopted by resolution 55/2 of 8 September 2000, heads of State and Government resolved to address the special needs of sm island developing States by implementing the Barbados Programme of Actj and the outcome of the twenty- second special session of the General Assembly>rapidly and in full, Noting that the World Summit for Sustainable Development held in Johannesburg, South Africa, from 26 August to 4 September 2002 considered the specific issues and problems facing small island developing States and the call to convene a special meﬁing in 2004 to review the implementation of the Barbados Programme of Action, Also noting that the Declaration of Commitment on HIV/AIDS adopted by the Assembly in resolution S-26/2 of 27 June 2001 recognized the Caribbean region as having the second-highest rate of infection after sub-Saharan Africa, Affirming the need to strengthen the cooperation that already exists between entities of the United Nations system and the Caribbean Community in the areas of economic and social development, as well as of political and humanitarian affairs, Convinced of the need for the coordinated utilization of available resources to promote the common objectives of the two organizations, 1. Takes note of the report of the Secretary-General on cooperation between the United Nations and the Caribbean Community,' as well as efforts to strengthen that cooperation; 2. Welcomes the signing on 27 May 1997 by the Secretary-General of the United Nations and the Secretary-General of the Caribbean Community of a cooperation agreement between the secretariats of the two organizations; 3. Calls upon the Secretary-General of the United Nations, in association with the Secretary-General of the Caribbean Community, as well as the relevant regional organizations, to continue to assist in furthering the development and maintenance of peace and security within the Caribbean region; 4. Invites the Secretary-General of the United Nations to continue to promote and expand cooperation and coordination between the United Nations and the Caribbean Community in order to increase the capacity of the two organizations to attain their objectives; 2 Programme of Action for the Sustainable Development of Small Island Developing States (Report of the Global Conference on the Sustainable Development of Small Island Developing States, Bridgetown, Barbados, 25 April-6May 1994 (United Nations publication, Sales No. E.94.1.18 and corrigenda), chap. I, resolution I, annex II). A/57/L.26 5. Urges the specialized agencies and other organizations and programmes of the United Nations system to cooperate with the Secretary-General of the United Nations and the Secretary-General of the Caribbean Community in order to initiate, maintain and increase consultations and programmes with the Caribbean Community and its associated institutions in the attainment of their objectives, with special attention to the areas and issues identified at the second general meeting held on 27 and 28 March 2000, as set out in the report of the Secretary-General, as well as resolutions 54/225, 55/203, 55/2 and S-26/2 and the decision of the World Summit on Sustainable Development® on the sustainable development of small island developing States; 6. Welcomes the initiatives of Member States in assisting in the cooperation between the United Nations and the Caribbean Community; 7. Recommends that the third general meeting between representatives of the Caribbean Community and its associated institutions and of the United Nations system be held in New York in March 2003 in order to review and appraise progress in the implementation of the agreed areas and issues and to hold consultations on such additional measures and procedures as may be required to facilitate and strengthen cooperation between the two organizations; 8. Requests the Secretary-General to submit to the General Assembly at its fifty-ninth session a report on the implementation of the present resolution; 9. Decides to include in the provisional agenda of its fifty-ninth session the item entitled “Cooperation between the United Nations and the Caribbean Community”.",11/14/2002,2002_1477234,Barbados,"4 See Report of the World Summit on Sustainable Development, Johannesburg, South Africa,",yes
2002,Economic And Social Council,Commission On Human Rights,Fifty-eighth session,10,"ECONOMIC, SOCIAL AND CULTURAL RIGHTS","Angola*, Barbados*, China, Cuba, Democratic People’s Republic of Korea, France, Iran (Islamic Republic of)*, Iraq*, Sudan, Syrian Arab Republic, Togo, Viet Nam, Yemen, Zambia",2002,Promotion of the enjoyment of the cultural rights of everyone and respect for different cultural identities,"The Commission on Human Rights, Recalling the Charter of the United Nations, the Universal Declaration of Human Rights and the International Covenant on Economic, Social and Cultural Rights, as well as other pertinent human rights instruments, Noting that numerous declarations within the United Nations system promote respect for cultural diversity, as well as for international cultural cooperation, in particular the Declaration of the Principles of International Cultural Cooperation and the Universal Declaration on Cultural Diversity, adopted by the General Conference of the United Nations Educational, Scientific and Cultural Organization in 1966 and 2001 respectively, Stressing the importance of the promotion of the cultural rights of everyone and of respect for different cultural identities, Convinced that international cooperation in promoting and encouraging respect for human rights and fundamental freedoms for all should be based on a profound understanding of the variety of problems existing in different societies, on full respect for their economic, social and cultural realities and on the full realization and recognition of the universality of all human rights and the principles of freedom, justice, equality and non-discrimination, Reaffirming that cultural diversity is a cherished asset for the advancement and welfare of humanity at large and should be valued, enjoyed, genuinely accepted and embraced as a permanent feature which enriches our societies, Noting the UNESCO Convention on the Means of Prohibiting and Preventing the Illicit Import, Export and Transfer of Ownership of Cultural Property, adopted on 17 November 1970, and the UNIDROIT Convention on Stolen or Illegally Exported Cultural Objects, adopted on 24 June 1995, Aware of the importance attached by the countries of origin to the return of cultural property which is of fundamental spiritual and cultural value to them, so that they may constitute collections representative of their cultural heritage, Expressing concern about the illicit traffic of cultural property and its damage to the cultural heritage of nations, Expressing our determination to prevent and mitigate cultural homogenization in the context of globalization, through increased intercultural exchange guided by the promotion and protection of cultural diversity, 1. Reaffirms that cultural rights are an integral part of human rights, which are universal, indivisible and interdependent; 2. Reiterates that everyone has the right freely to participate in the cultural life of the community, to enjoy the arts and to share in scientific advancement and its benefits; 3. Also reiterates that everyone has the right to the protection of the moral and material interests resulting from any scientific, literary or artistic production of which he/she is the author; 4. Affirms that each culture has a dignity and value which must be respected and preserved and that every people has the right and the duty to develop its culture; 5. Recognizes that States have the primary responsibility for the promotion of the full enjoyment of cultural rights by everyone and for the enhancement of respect for different cultural identities; 6. Also recognizes that the promotion and protection of the full enjoyment of cultural rights by everyone and the respect for different cultural identities is a vital element for the protection of cultural diversity in the context of the ongoing process of globalization; 7. Reaffirms that all peoples have the right of self-determination, by virtue of which they freely determine their political status and freely pursue their economic, social and cultural development; 8. Underlines that cultural cooperation is a right and a duty for all peoples and all nations, which should share with one another their knowledge and skills, and that international cooperation, while promoting the enrichment of all cultures through its beneficent action, should respect the distinctive character of each; 9. Emphasizes that cultural cooperation is specially concerned with the moral and intellectual education of young people in a spirit of friendship, international understanding and peace and should foster awareness among States of the need to stimulate talent and promote the training of the rising generations in the most varied sectors; 10. Recognizes that the promotion and protection of cultural diversity implies a commitment to human rights and fundamental freedoms guaranteed by international law and advances the application and the enjoyment of cultural rights by everyone; 11. Also recognizes that the promotion of the cultural rights of every one, of respect for the cultural identity of peoples and of protection of the cultural diversity of humanity advances the implementation and enjoyment of all human rights by all and fosters stable friendly relations among peoples and nations worldwide; 12. Stresses that, in the face of current imbalances in flows and exchanges of cultural goods and services at the global level, it is necessary to reinforce international cooperation and solidarity aimed at enabling all countries, especially developing countries and countries in transition, to establish cultural industries that are viable and competitive at national and international level, 11. 12. 13. Underlines that market forces alone cannot guarantee the preservation and promotion of cultural diversity, which is the key to sustainable human development, and from this perspective, recognizes that the pre-eminence of public policy, in partnership with the private sector and civil society, must be reaffirmed; 14. Requests the United Nations High Commissioner for Human Rights to consult States, intergovernmental and non-governmental organizations on the implementation of the present resolution and on the possibility of appointing a special rapporteur the basis of whose mandate would be the comprehensive implementation of the present resolution; 15. Also requests the High Commissioner for Human Rights to report on the results of the consultations requested in paragraph 14 to the Commission at its fifty-ninth session under the agenda item entitled “Economic, social and cultural rights”. 13. 14. 15.",04/15/2002,2002_462360,Barbados,"* In accordance with rule 69, paragraph 3, of the rules of procedure of the functional commissions of the Economic and Social Council.",yes
