year,Council,Committee,Session,Agenda item,Agenda detail,cosponsored countries,body title number,body title detail,body text,date,file,filecountry,footnote,scanned
2020,General Assembly,N/A,Seventy-fourth session,64 (b),New Partnership for Africa’s Development: progress in implementation and international support: causes of conflict and the promotion of durable peace and sustainable development in Africa,"Argentina, Gambia, Norway, Qatar and Rwanda",N/A,International Day of Reflection on the 1994 Genocide against the Tutsi in Rwanda,"Addendum Add the following countries to the list of sponsors of the resolution: Algeria, Angola, Armenia, Benin, Botswana, Burkina Faso, Canada, Chad, Chile, Colombia, Comoros, Costa Rica, Djibouti, Egypt, Equatorial Guinea, Eritrea, Eswatini, Ethiopia, Georgia, Guinea, Guinea-Bissau, Guyana, Hungary, Ireland, Israel, Kenya, Liberia, Mauritius, Morocco, Namibia, Niger, Nigeria, Saint Vincent and the Grenadines, Sao Tome and Principe, Senegal, Sierra Leone, Somalia, Sudan, Syrian Arab Republic, Tunisia, Turkey, Uganda, Ukraine and United Republic of Tanzania Hy Please recycle OO ol 20-05878 ii 230420 AUN A AA A",04/20/2020,2020_3858639,Benin,N/A,yes
2020,General Assembly,N/A,Seventy-fourth session,123,Strengthening of the United Nations system,"Andorra, Angola, Antigua and Barbuda, Argentina, Armenia, Azerbaijan, Barbados, Belize, Bosnia and Herzegovina, Canada, Central African Republic, Costa Rica, Cote d’Ivoire, Djibouti, Dominican Republic, Ecuador, El Salvador, Equatorial Guinea, Fiji, Gambia, Georgia, Ghana, Grenada, Guatemala, Guyana, Honduras, Iraq, Jamaica, Jordan, Kazakhstan, Kenya, Lebanon, Lesotho, Libya, Liechtenstein, Madagascar, Malawi, Maldives, Mauritius, Mexico, Micronesia (Federated States of), Morocco, Namibia, Nepal, Niger, Nigeria, Norway, Palau, Panama, Papua New Guinea, Paraguay, Peru, Republic of Korea, Rwanda, Saint Lucia, Saint Vincent and the Grenadines, Samoa, Senegal, Seychelles, Singapore, Sri Lanka, Sudan, Suriname, Tajikistan, Thailand, Timor-Leste, Trinidad and Tobago, Turkey, Turkmenistan, Ukraine, United Republic of Tanzania, Uruguay, Vanuatu, Viet Nam and Zimbabwe",N/A,"International cooperation to ensure global access to medicines, vaccines and medical equipment to face COVID-19","Addendum Add the following countries to the list of sponsors of the resolution: Afghanistan, Albania, Algeria, Austria, Bahamas, Bahrain, Bangladesh, Belarus, Belgium, Benin, Bhutan, Bolivia (Plurinational State of), Botswana, Brunei Darussalam, Bulgaria, Burkina Faso, Burundi, Cabo Verde, Cambodia, Cameroon, Chad, Chile, China, Colombia, Comoros, Congo, Croatia, Cuba, Cyprus, Czechia, Denmark, Dominica, Egypt, Eritrea, Estonia, Eswatini, Ethiopia, Finland, France, Germany, Greece, Guinea, Guinea-Bissau, Haiti, Iceland, India, Indonesia, Ireland, Israel, Italy, Japan, Kiribati, Kuwait, Kyrgyzstan, Lao People’s Democratic Republic, Latvia, Liberia, Lithuania, Luxembourg, Malaysia, Mali, Malta, Marshall Islands, Mauritania, Monaco, Mongolia, Montenegro, Mozambique, Myanmar, Nauru, Netherlands, New Zealand, Nicaragua, North Macedonia, Oman, Philippines, Poland, Portugal, Qatar, Republic of Moldova, Saint Kitts and Nevis, San Marino, Sao Tome and Principe, Saudi Arabia, Serbia, Sierra Leone, Slovakia, Solomon Islands, South Africa, South Sudan, Spain, Sweden, Switzerland, Syrian Arab Republic, Togo, Tonga, Tunisia, Tuvalu, Uganda, United Arab Emirates, United Kingdom of Great Britain and Northern Ireland, Uzbekistan, Yemen and Zambia Please recycle 20-05879 ii 230420 AY A A AA A",04/20/2020,2020_3858644,Benin,N/A,yes
2020,General Assembly,N/A,Seventy-fourth session,131,Seventy-fifth anniversary of the end of the Second World War,"Algeria, Armenia, Azerbaijan, Belarus, Benin, Burkina Faso, Burundi, Cambodia, Central African Republic, China, Comoros, Cuba, Democratic People’s Republic of Korea, Ecuador, Equatorial Guinea, Eritrea, Ghana, Iran (Islamic Republic of), Iraq, Kazakhstan, Kyrgyzstan, Lao People’s Democratic Republic, Nicaragua, Nigeria, Philippines, Russian Federation, Serbia, South Africa, Sudan, Suriname, Syrian Arab Republic, Tajikistan, Turkmenistan, Uzbekistan, Venezuela (Bolivarian Republic of), Viet Nam and Zambia: revised",N/A,Seventy-fifth anniversary of the end of the Second World War,"The General Assembly, Recalling its resolution 59/26 of 22 November 2004, in which it, inter alia, declared 8—9 May as a time of remembrance and reconciliation, while recognizing that Member States may have individual dates of victory, liberation and commemoration, Recalling that 2020 will mark the seventy-fifth anniversary of the end of the Second World War, a war which brought untold sorrow to mankind, particularly in Asia and Europe, Stressing that this historic event established the conditions for the creation of the United Nations, designed to save succeeding generations from the scourge of war, Noting that the United Nations has helped to shape the very structure of relations between nations in the modern age, including through the process of decolonization, and recalling in this regard the Declaration on the Granting of Independence to Colonial Countries and Peoples of 14 December 1960,! Emphasizing that the Victory in the Second World War is the common legacy of all Member States of the United Nations, and noting in this regard the importance of preservation and inadmissibility of desecration or destruction of monuments erected in remembrance of those who fought in that war on the side of the United Nations, Calling upon the States Members of the United Nations to unite their efforts in dealing with challenges and threats to international peace and security, with the ' Resolution 1514 (XV). oso 472 Please recycle OQ) ol 20-06345 Hi 050520 AY AT A A A United Nations playing a central role, and to make every effort to refrain in their international relations from the threat or use of force against the territorial integrity or political independence of any State, or in any other manner inconsistent with the purposes of the United Nations, and to settle all disputes by peaceful means in conformity with the Charter of the United Nations, Underlining the progress made since the end of the Second World War in overcoming its legacy and towards reconciliation, international and regional cooperation and the promotion of democratic values, human rights and fundamental freedoms, in particular through the United Nations, and the establishment of regional organizations and other appropriate frameworks, 1. Invites all Member States, organizations of the United Nations system, non-governmental organizations and individuals to observe these days in an appropriate manner to pay tribute to all victims of the Second World War; 2. Requests the President of the General Assembly to hold a special solemn meeting of the Assembly in the first week of September 2020 in commemoration of all victims of the war; 3. Requests the Secretary-General to bring the present resolution to the attention of all Member States and organizations of the United Nations system and to take measures necessary for its implementation. 20-06345 2/2",05/04/2020,2020_3860335,Benin,N/A,yes
