year,Council,Committee,Session,Agenda item,Agenda detail,cosponsored countries,body title number,body title detail,body text,date,file,filecountry,footnote,scanned
1992,General Assembly,First Committee,Forty-seventh session,61 (j),GENERAL AND COMPLETE DISARMAMENT: REGIONAL DISARMAMENT,"Antiqua and Barbuda, Austria, Belgium, Benin, Bolivia, Bosnia and Herzegovina, Cameroon, Canada, Cape Verde, tral African R ic hil 1 ia, Comoros Rica, Coéte d'Ivoire, Ecuador, Egypt, Estonia, Gabon, Germany, Ghana, Grenada, Guatemala, Guinea, Italy, Kyrgyzstan, Latvia, Lesotho, Liberia, Lithuania, Luxem r M sca ali shall Islands Mauritani Micronesia (Federated Sta £ Nepal N 1 New Zealan Niger, Norwa Pakistan, Pan Papua New Guinea, Peru, Poland, Rwanda, Saint Kitts_and Nevis, Saint Lucia, Saint Vincent and the Grenadines, Samoa, Saudi Arabia, Senegal, Solomon Islands, Spain, n rin waziland Tunisi Tu Turkmenistan, Ukraine, United Kingdom of Great Britain _and Northern Ireland, United States of America, Uruguay, Vanuatu, Venezuela and Zimbabwe",N/A,Regional disarmament,"The General Assembly, Recalling its resolutions 45/58 P of 4 December 1990 and 46/36 I of 6 December 1991 on regional disarmament, Believing that the efforts of the international community to move towards the ideal of general and complete disarmament are guided by the inherent human desire for genuine peace and security, the elimination of the danger of war and the release of economic, intellectual and other resources for peaceful pursuits, 2 Affirming the abiding commitment of all States to the purposes and principles enshrined in the Charter of the United Nations in the conduct of their international relatious, Noting that essential guidelines for progress towards general and complete disarmament were adopted at the tenth special session of the General Assembly, 1/ Welcoming the prospects of genuine progress in the field of disarmament engendered in recent years as a result of negotiations between the two super-Powers, Taking note of the recent proposals for disarmament and nculear non-proliferation at the regional and subregional levels, Recognizing the importance of confidence-building measures for regional and international peace and security, Convinced that endeavours by countries to promote regional disarmament, taking into account the specific characteristics of each region and in accordance with the principle of undiminished security at the lowest level of armaments would enhance the security of smaller States and would thus contribute to international peace and security by reducing the risk of regional conflicts, 1. Stresses that sustained efforts are needed, within the framework of the Conference on Disarmament and under the umbrella of the United Nations, to make progress on the entire range of disarmament issues; 2, Affirms that global and regional approaches to disarmament complement each other and should therefore be pursued simultaneously to promote regional and international peace and security: 3. Calls upon States to conclude agreements, wherever possible, for nuclear non-proliferation, disarmament and confidence-building measures at regional and subregional levels; 4. Welcomes the initiatives towards disarmament, nuclear non-proliferation and security undertaken by some countries at the regional and subregional levels: 5. Supports and encourages efforts aimed at promoting confidence-building measures at regional and subregional levels in order to ease regional tensions and to further disarmament and nuclear non-proliferation measures at regional and subregional levels; 6. Decides to include in the provisional agenda of its forty-eighth session the item entitled ""Regional disarmament"". 1/ Resolution S-10/2.",10/30/1992,1992_152921,Bosnia and Herzegovina,N/A,no
1992,Convention On The Rights Of The Child,Third Committee,Forty-seventh session,97 (b),"HUMAN RIGHTS QUESTIONS: HUMAN RIGHTS QUESTIONS, INCLUDING ALTERNATIVE APPROACHES FOR IMPROVING THE EFFECTIVE ENJOYMENT OF HUMAN RIGHTS AND FUNDAMENTAL FREEDOMS","Albania, Antigua and Barbuda, Argentina, Australia, Azerbaijan, Bahamas, Belarus, Belgium, Benin, Bosnia_and Herzegovina, Botswana, Bulgaria, Burkina Faso, Burundi, roon anada Ver ntral African R 1i Chad, Chile, Comoros, Congo, Costa Rica, Cdéte d‘'Ivoire, zechoslovaki Denmark, Djibouti, Dominican Republi oni Ethiopi Finland, France, Gabon, ambi rman r Gren atemal in Guinea-Bissau, Haiti, Honduras, Hungary, Iceland, Ireland, Italy, Jamaica, Japan, Latvia, Lesotho, Liberia, Libyan Arab Jamahiriya, Liechtenstein, Lithuania, Luxembourg, Madagascar, Mali, Malta, Marshall Islands, Mauritania, Micronesia (Federated States of), Mongolia, Morocco, Mozambique, Namibia, Netherlands, New Zealand, Niger, Nigeria, Norway, Panama, Papua New Guinea, Paraguay, Poland, Portugal, Romania, Russian Federation, Samoa, San Marino, Senegal, Sierra Leone, Slovenia, Solomon Islands, Spain, Suriname, Sweden, Togo, Tunisia, Turkey, Ukraine, United Kingdom of Great Britain and Northern Ireland, United States of America, Vanuatu, Venezuela and Zaire",N/A,World Conference on Human Rights,"The General Assembly, Mindful of the goal of the United Nations to promote and encourage respect for human rights and fundamental freedoms for all, without distinction 92-65449 44782 (E) 291092 as to race, sex, language or religion, as set out in the Charter of the United Nations and the Universal Declaration of Human Rights, 1/ Recognizing that all human rights and fundamental freedoms are indivisible and interrelated and that the promotion and protection of one category of rights should never exempt or excuse States from the promotion and protection of another, Recalling its resolutions 45/155 of 18 December 1990, in which it decided, inter alia, to convene at a high level a World Conference on Human Rights in 1993, and 46/116 of 17 December 1991, Taking note of Commission on Human Rights resolution 1991/30 of 5 March 1991, 2/ Convinced that the holding of a world conference on human rights could make a significant contribution to the effectiveness of the actions of the United Nations in the promotion and protection of human rights, Recognizing the urgency of adopting a agenda for the World Conference on Human Rights before the final session of the Preparatory Committee, 1. Takes note of the reports of the Preparatory Committee for the World Conference on Human Rights, on its second and third sessions; 3/ 2. Approves the rules of procedure for the World Conference on Human Rights, as recommended by the Preparatory Committee at its second and third sessions; 3. Decides that the distribution of the 29 Vice-Presidents of the World Conference on Human Rights should be in accordance with the established criteria of the General Assembly, based on equitable geographical distribution; 4. Also approves the recommendation of the Preparatory Committee at its third session regarding the participation of non-governmental organizations in regional meetings related to the preparatory process; 5. Further approves the provisional agenda for the World Conference on Human Rights, as annexed to the present resolution; 1/ Resolution 217 A (III). 2/ Official Records of the Economic and Social Council, 1991, Supplement No. 2 (E/1991/22), chap. II, sect. A. 3/ To be issued as A/47/24. feun 6. Decides, in accordance with the decisions adopted by the Preparatory Committee: (a) (i) That the Preparatory Committee shall meet for its fourth session, at Geneva, for a period of two weeks in April 1993; (ii) That the question of the final outcome of the World Conference shall be taken up by the Preparatory Committee at its fourth session, taking into consideration, inter alia, the preparatory work and conclusions of the regional meetings taking place at Tunis, San José and Bangkok: (iii) That the Secretary-Gemeral shall give the Conference and the preparatory process thereto the widest possible publicity and ensure full coordination of public information activities in the area of human rights within the United Nations system; (b) To renmew its invitation for contributions of extrabudgetary resources to meet the costs of participation of representatives of the least developed countries in the preparatory meetings, including regional meetings, and in the World Conference itself, and to request the Secretary-General to intensify his efforts in this regard: 7. Renews its reque to Governments, the specialized agencies, other international organizations, regional organizations and non-governmental organizations concerned with human rights and/or development to participate actively in the preparatory process and in the World Conference itself; 8. Requests the Secretary-General to report to the General Assembly at its forty-eighth session on the outcome of the World Conference on Human Rights, under the agenda item entitled ""Human rights questions"". Annex PROVISIONAL AGENDA FOR THE WORLD CONFERENCE ON HUMAN RIGHTS Opening of the Conference. Election of the President. Adoption of the rules of procedure. Election of other officers of the Conference. Item 5 Appointment of the Credentials Committee. Item 6 Establishment of Committees and Working Groups. Item 7 Adoption of the agenda. leen Item 10 Item 11 12 Item Commemoration of the International Year of the World's Indigenous People. General debate on the progress made in the field of human rights since the adoption of the Universal Declaration of Human Rights and on the identification of obstacles to further progress in this area, and ways in which they can be overcome. Consideration of the relationship between development, democracy and the universal enjoyment of all human rights, keeping in view the interrelationship and indivisibility of economic, social, cultural, civil and political rights. Consideration of contemporary trends in and new challenges to the full realization of all human rights of women and men, including those of persons belonging to vulnerable groups. Recommendations for: (a) Strengthening international cooperation in the field of human rights; (b) Ensuring the universality, objectivity and non-selectivity of the consideration of human rights issues; (c) Enhancing the effectiveness of United Nations activities and mechanisms; Item 8 Item 9 (d) Securing the necessary financial and other resources for United Nations activities in the area of human rights. Item 13 Adoption of the final documents and report of the Conference.",10/26/1992,1992_153272,Bosnia and Herzegovina,N/A,no
1992,General Assembly,First Committee,Forty-seventh session,62 (b),REVIEW AND IMPLEMENTATION OF THE CONCLUDING DOCUMENT OF THE TWELFTH SPECIAL SESSION OF THE GENERAL ASSEMBLY: REGIONAL CONFIDENCE-BUILDING MEASURES,"Afghanistan, Antigua and Barbuda, Australia, Austria, Bahamas, Bangladesh, Barbados, Belize, Benin, Bhutan, Bolivia, Bosnia and Herzegovina, Botswana, Brunei Darussalam, Bulgaria, Burkina Faso, Cambodia, Cameroon, Canada, Chile, China, Colombia, Comoros, Congo, Costa Rica, CSte d'Ivoire, Croatia, Cuba, Cyprus, Czechoslovakia, Democratic People's Republic of Korea, Djibouti, Ecuador, Egypt, E1 Salvador, Equatorial Guinea, Fiji, France, Gabon, Germany, Ghana, Grenada, Guatemala, Guinea, Guinea-Bissau, Guyana, Honduras, Hungary, India, Indonesia, Iran (Islamic Republic of), Italy, Jamaica, Japan, Kenya, Lao People's Democratic Republic, Lesotho, Liberia, Libyan Arab Jamahiriya, Madagascar, Malawi, Malaysia, Maldives, Mali, Marshall Islands, Mauritania, Mauritius, Mexico, Micronesia (Federated States of), Mongolia, Morocco, Mozambique, Myanmar, Namibia, Nepal, Netherlands, New Zealand, Nicaraqua, Nigeria, Norway, Oman, Pakistan, Panama, Papua New Guinea, Peru, Philippines, Poland, Republic of Korea, Republic of Moldova, Romania, Russian Federation, Rwanda, Saint Kitts and Nevis, Saint Lucia, Saint Vincent and the Grenadines, Samoa, Senegal, Seychelles, Sierra Leone, Singapore, Slovenia, Solomon Islands, Sri Lanka, Sudan, Suriname, Swaziland, Sweden, Thailand, Togo, Trinidad and Tobago, Turkey, Uganda, United Kingdom of Great Britain and Northern Ireland, United Republic of Tanzania, United States of America, Uruguay, Vanuatu, Venezuela, Viet Nam, Yemen, Zaire, Zambia and Zimbabwe",N/A,92-66590 4506Z (E) 301092 011192,"e Treaty of Amity and Cooperation in Southeast Asia The General Assembly, Recalling the purposes and principles of the United Nations and its primary responsibility for the maintenance of international peace and security in accordance with its Charter, Recalling also the Ten Principles adopted by the Asian-African Conference held at Bandung on 25 April 1955, the Declaration of the Association of South-East Asian Nations signed at Bangkok in August 1967 and the Declaration of the Fourth Summit of the Association of South-East Asian Nations, held at Singapore in January 1992, Noting that the Treaty of Amity and Cooperation in Southeast Asia, signed at Bali on 24 February 1976, which came into force on 15 July 1976 in respect of the Republic of Indonesia, Malaysia, the Republic of the Philippines, the Republic of Singapore and the Kingdom of Thailand, and on 7 January 1984 in respect of Brunei Darussalam, was registered with the United Nations on 20 October 1976, Noting also that Papua New Guinea acceded to the Treaty on 5 July 1989 and that the Socialist Republic of Viet Nam and the Lao People's Democratic Republic acceded to the Treaty on 22 July 1992, Noting further that the purpose of the Treaty is to promote perpetual peace, everlasting amity and cooperation amongst the peoples of South-East Asia, in accordance with the principles of the Charter of the United Nations, including, inter alia, mutual respect for the independence, sovereignty and territorial integrity of all nations, non-interference in the internal affairs of all nations, peaceful settlement of differences and disputes and renunciation of the threat or use of force, Aware that the Treaty includes provisions for the pacific settlement of disputes which are in accordance with the Charter of the United Nations, Recognizing that the Treaty provides a strong foundation for regional confidence-building and for regional cooperation and that it is consistent with the call by the Secretary-General of the United Nations, in his report entitled ""An Agenda for Peace"", 1/ for a closer relationship between the United Nations and regional associations, Endorses the purposes and principles of the Treaty of Amity and Cooperation in Southeast Asia and its provisions for the pacific settlement of regional disputes and for regional cooperation in order to achieve peace, amity and friendship amongst the peoples of South-East Asia, in accordance with the Charter of the United Nations, which are consistent with the current climate of enhancing regional and international cooperation. 1/ A/47/2717.",10/30/1992,1992_153322,Bosnia and Herzegovina,N/A,no
1992,General Assembly,Second Committee,Forty-seventh session,78 (e),DEVELOPMENT AND INTERNATIONAL ECONOMIC COOPERATION: INTERNATIONALCOOPERATION TO MITIGATE THE ENVIRONMENTAL CONSEQUENCES ON KUWAITAND OTHER COUNTRIES IN THE REGION RESULTING FROM THE SITUATION BETWEEN IRAQ AND KUWAIT,"Diib i, Dominican R i E r, E El Sal r i Gren mal ine uinea-Bi r i ran (I i i f Ruwai L non, L h M 1 i Maldi Mali, Mauritania, Mongolia, Namibia, Nepal, Nicaragua, Niger, Nigeria, Oman, Pakistan, Phillippines, Poland, Qatar, Romania, Rwanda, Saudi Arabia, Senegal, Singapore, Spain, Sri Lanka, Syrian Arab Republic, Thailand, Togo, Tunisi Turk United Ar Emirate nited Kingdom of Great Britain and Northern Ireland, Venezuela and Zaire:",N/A,International cooperation to mitigate the environmental consequences on KRuwait and other countries in the region resulting from the situation bewteen Iraq and Kuwait,"Th neral As 1y, Aware of the disastrous situation caused in Kuwait and neighbouring areas by the torching and destruction of hundreds of its oil wells and of the other environmental consequences on the atmosphere, land and marine life, Bearing in mind all relevant Security Council resolutions, in particular section E of resolution 687 (1991) of 3 April 1991, 161192 o Having taken note of the report submitted by the Secretary-General to the Security Council describing the nature and extent of the environmental damage suffered by Kuwait, 1/ Having also taken note of decision 16/11 A adopted by the Governing Council of the United Nations Environment Programme on 31 May 1991, 2/ Having also taken note of its resolution 46/216 of 20 December 1991, Having_also taken note of the report of the Secretary-General entitled “International cooperation to mitigate the environmental consequences on Kuwait and other countries in the region resulting from the situation between Iraq and Kuwait"", 3/ Profoundly concerned at the degradation of the environment as a consequence of the damage, especially the threat posed to the health and well-being of the people of Kuwait and the people of the region, and the adverse impact on the economic activities of Kuwait and other countries of the region, including the effects on livestock, agriculture and fishing, as well as on wildlife, Welcoming the recent Mount Mitchell Research Cruise, which took place under the sponsorship of the International Oceanographic Commission, the Regional Organization for the Protection of the Marine Environment and the United Nations Environment Programme in order to make a scientific assessment of envirommental conditions in the region, Awaiting the meetings due to be held in 1993, at which the results of the Mount Mitchell Research Cruise will be discussed and evaluated, Acknowledging the fact that dealing with this catastrophe goes beyond the capabilities of the countries of the region and, in that regard, recognizing the need for strengthened international cooperation to deal with the issue, Noting with appreciation the appointment by the Secretary-General of an Under-Secretary-General as his Personal Representative to coordinate United Nations efforts in this field, 1/ See §/22535 and Corr.l and 2, annex; see Official Records of the Security Council, Forty-sixth Year, Supplement for April, May and_June 1991, document S/22535. 2/ See Qfficial Records of the General Assembly, Forty-sixth Session, Supplement No. 25 (A/46/25), annex. 3/ A/47/265-E/1992/81. Iy Also noting with appreciation the efforts already undertaken by the Member States of the region, other States, the organizations of the United Nations system, and governmental and non-governmental organizations to study, mitigate and minimize the consequences of this environmental catastrophe, Bearing in mind the effective work of the Regional Organization for the Protection of the Marine Environment and the inter-agency task force established under the leadership of the United Nations Enviromment Programme especially for the environmental situation in the region, and the plan of action, Expressing its special appreciation to the Governments which have extended financial support to the two trust funds established for the purpose by the Secretary-General of the International Maritime Organization and the Executive Director of the United Nations Environment Programme, and to the Governments and organizations which supported the recent international research cruise conducted under the auspices of the International Oceanographic Commission, the Regional Organization for the Protection of the Marine Environment and the United Nations Environment Programme, 1. Appeals to all States Members of the United Nations, intergovernmental and non-governmental organizations, scientific bodies and individuals to provide assistance for programmes aimed at the study and mitigation of the environmental degradation of the region and for strengthening the Regional Organization for the Protection of the Marine Environment and its role in coordinating the implementation of these programmes ; 2, Calls upon the organizations and programmes of the United Nations system, in particular the International Maritime Organization and the United Nations Environment Programme, to pursue their efforts to assess the short-term as well as the long-term impact of the environmental degradation of the region and to consider measures which may be needed to counteract these effects; 3. Requests the Secretary-Gemeral, through his Personal Representative, to render assistance to the members of the Regional Organization for the Protection of the Marine Environment in the formulation and implementation of a coordinated and consolidated programme of action comprising costed project profiles, to help identify all possible resources for the programme of action and, inter alia, for strengthening the environmental capacities of the members of the Regional Organization for the Protection of the Marine Environment to deal with this problem, and to allocate, within existing resources, the minimum resources required to enable his Personal Representative to continue to help coordinate the activities of the United Nations system to that end; 4. Also requests the Secretary-Gemeral to submit to the General Assembly at its forty-ninth session, through the Economic and Social Council, a report on the implementation of the present resolution; 5. Decides to include in the provisional agenda of its forty-ninth session a sub-item entitled ""International cooperation to mitigate the environmental consequences on Kuwait and other countries in the region resulting from the situation between Irag and Kuwait"" under the item entitled ""Development and international economic cooperation"".",11/13/1992,1992_154241,Bosnia and Herzegovina,N/A,no
1992,General Assembly,Second Committee,Forty-seventh session,144,N/A,N/A,input,is,n o n e,11/18/1992,1992_154281,Bosnia and Herzegovina,N/A,no
1992,General Assembly,Second Committee,Forty-seventh session,78 (a),DEVELOPMENT AND INTERNATIONAL ECONOMIC COOPERATION: TRADE AND DEVELOPMENT,"Bulgaria, Croatia, Czechoslovakia, Estonia, Finland, Iceland, Kazakhstan, Latvia, Lithuania, Poland, Republic of Moldova, 4 i Romania, Russian Federation, Tajikistan, Turkmenistan and Ukraine;",N/A,N/A,"The General Assembly, Reaffirming its resolution S-18/3 of 1 May 1990, the annex to which contains the Declaration on International Economic Cooperation, in particular, the Revitalization of Economic Growth and Development of the Developing Countries, which states, inter alia, that, Eastern European countries should be supported in their efforts to integrate themselves into the internatiomal economy, and that this will benefit their own people and the rest of the world; Further reaffirming its resolution 45/199 of 21 December 1990, the annex to which contains the International Development Strateqgy for the Fourth United Nations Development Decade, which recognizes that the reform and restructuring of the economies of Eastern Europe and their integration into the world economy can contribute to the strength and dynamism of world trade; Recalling the Cartagena Commitment, adopted by the United Nations Conference on Trade and Development at its eighth session, 1/ which states, 1/ See TD/364, part one, sect. A. Jeew inter alia, that, early completion of the transformation of the economies of the countries of Central and Eastern Europe into market-based ones would strengthen the emerging new partnership for development; Further recalling Agenda 21, adopted by the United Nations Conference on Environment and Development, 2/ which recognizes that economies in tramsition are facing unprecedented challenges in transforming their economies; Aware of the historical dimension of the profound political and economic changes in Central and Eastern European and the newly independent States; Also aware of the tremendous problems facing economies in transition in their efforts to transform and restructure their economies; Noting that the World Economic Survey, 1992 indicates that the main cause of the decline in 1991 economic output, which was the first decline since the Second World War, was the fall in production in economies in transition; 1. Recognizes that the full integration of economies in transition into the world economy will have a positive impact on world trade and development; 2. Further recognizes the need for the international community to support the successful process of bringing about economic reforms and restructuring in the economies in transition; 3. Requests the Secretary-General to coordinate and strengthen the ability of the United Nations system to conduct analytical and policy advice activities regarding changes that take place in the economies in transition as they integrate into the world economy; 4. Requests the Secretary-General therefore to prepare within existing resources, with the full cooperation of relevant organizations and bodies of the United Nations system, including the World Bank and the International Monetary Fund, a report on the role of the United Nations system in addressing problems facing economies in transition, 1nc1ud1ng the difficulties that the economies in transition are encountering in their integration into the world economy, and to submit the report to the General Assembly at its forty-eighth session; 5. Decides to include in the agenda of its forty-eighth session a subitem entitled ""Integration of economies in transition into the world economy” under the item entitled ""Development and international economic cooperation”. 2/ See A/CONF.151/26 (Vol. I, II and Corr.l and III).",11/12/1992,1992_154282,Bosnia and Herzegovina,N/A,no
