year,Council,Committee,Session,Agenda item,Agenda detail,cosponsored countries,body title number,body title detail,body text,date,file,filecountry,footnote,scanned
1992,General Assembly,N/A,Forty-sixth session,150,THE SITUATION IN BOSNIA AND HERZEGOVINA,"Afghanistan, Albania, Algeria, Azerbaijan, Bangladesh, Bosnia and Herzegovin omoros, Dijibouti, E t uin Indonesia, Iran (Islamic Republic of Jordan, Ruwait Latvia, Lithuania, Malaysia, Mauritania, Morgcco man Pakistan, Saudi Arabia, Senegal, Slovenia, Sudan, Tunisia, Turkey and United Arab Emirates",N/A,N/A,"The General Assembly, Having considered the item entitled ""The situation in Bosnia and Herzegovina', Reaffirming the purposes and principles of the Charter of the United Nations and guided by the need to implement them, Aware of its responsibility to promote and encourage respect for international legitimacy, Considering that the United Nations, pursuant to the provisions of its Charter, has a major role to play in, and responsibility for, the maintenance of international peace and security, Recalling the relevant resolutions of the Security Council, the United Nations Educational, Scientific and Cultural Organization and the Commission on Human Rights, as well as decision 1992/305 of the Economic and Social Council, Noting that a large number of States have reserved their position regarding the succession of the Socialist Federal Republic of Yugoslavia by the Federal Republic of Yugoslavia (Serbia and Montenegro), Distr. LIMITED General Assembly A/46/L.76 24 August 1992 ORIGINAL: ENGLISH THE SITUATION IN BOSNIA AND HERZEGOVINA Afghanistan, Albania, Algeria, Azerbaijan, Bangladesh, Bosnia and Herzegovin omoros, Dijibouti, E t uin Indonesia, Iran (Islamic Republic of Jordan, Ruwait Latvia, Lithuania, Malaysia, Mauritania, Morgcco man Pakistan, Saudi Arabia, Senegal, Slovenia, Sudan, Tunisia, Turkey and United Arab Emirates resolution The General Assembly, Having considered the item entitled ""The situation in Bosnia and Herzegovina', Reaffirming the purposes and principles of the Charter of the United Nations and guided by the need to implement them, Aware of its responsibility to promote and encourage respect for international legitimacy, Considering that the United Nations, pursuant to the provisions of its Charter, has a major role to play in, and responsibility for, the maintenance of international peace and security, Recalling the relevant resolutions of the Security Council, the United Nations Educational, Scientific and Cultural Organization and the Commission on Human Rights, as well as decision 1992/305 of the Economic and Social Council, Noting that a large number of States have reserved their position regarding the succession of the Socialist Federal Republic of Yugoslavia by the Federal Republic of Yugoslavia (Serbia and Montenegro), /lll Deploring the grave situation in Bosnia and Herzegovina and the serious deterioration of the living condition of the people there, especially the Moslem and Croat population, arising from the aggression against the territory of the Republic of Bosnia and Herzegovina, which constltutes a threat to international peace and security, Alarmed by the prospect of further escalation of the fighting in the region, Expressing grave alarm at continuing reports of widespread violations of international humanitarian law occurring within the territory of the former Yugoslavia and especially in Bosnia and Herzegovina, including reports of mass forcible expulsion and deportation of civilians, imprisonment and abuse of civilians in detention centres and deliberate attacks on non-combatants, hospitals and ambulances, impeding the delivery of food and medical supplies to the civilian population, as well as wanton devastation and destruction of property, Strongly condemning the abhorrent practice of ""ethnic cleansing"", which constitutes a grave and serious violation of international humanitarian law, Recalling the report of the Secretary-Gemeral of 12 May 1992, 1/ in which he states that ""all international observers agree that what is happening is a concerted effort by the Serbs of Bosnia and Herzegovina, with the acquiescence of, and at least some support from the Yugoslav People's Army, to create 'ethnically pure’ regions in the context of negotiations on the ‘cantonization' of the Republic in the Conference of the European Community on Bosnia and Herzegovina"", Expressing grave concern that, despite the relevant Security Council resolutions, no effective measure has been implemented to stop the abhorrent practice of ""ethnic cleansing"", or to reverse and discourage the policies and proposals that might encourage it, Appalled at the continuing reports of widespread, massive and grave violations of human rights perpetrated within the territory of the former Yugoslavia and especially in Bosnia and Herzegovina, including reports of summary and arbitrary executions, forced disappearances, torture, rape and other cruel, inhuman or degrading treatment, as well as arbitrary arrest and detention, eate emands by the Security Council, the cease-fire agreed upon by all parties has not been respected, Concerned that other demands in relevant Security Council resolutions, especially resolutions 752 (1992) of 15 May 1992, 757 (1992) of 30 May 1992, 764 (1992) of 13 July 1992 and 770 (1992) and 771 (1992) of 13 August 1992, have not been complied with, © 1/ §/23900, para. 5. /ora Reaffirming the necessity of respecting the sovereignty, territorial integrity, political independence and national unity of the Republic of Bosnia and Herzegovina, and rejecting any attempt to change the boundaries of that Republic, Reaffirming also the inherent right of the Republic of Bosnia and Herzegovina to individual and collective self-defence in accordance with Article 51 of the Charter of the United Nations, Underlining the imperative need for an urgent peaceful solution to the situation in Bosnia and Herzegovina, in conformity with the Charter of the United Nations and the principles of international law, and in particular the principles of respect for sovereignty and territorial integrity of States, non-recognition of the fruits of aggression and non-recognition of acquisition of territory by force, and welcoming in this context the International Conference on the Former Yugoslavia, scheduled to be convened in Londen on Commending the efforts of the Secretary-Gemeral, the Security Council, United Natioms agencies, including the Office of the United Nations High Commissioner for Refugees and other international and relief organizatioms, including the Organization of the Islamic Conference, the European Community, the Conference on Security and Cooperation in Europe and the International Committee of the Red Cross, Commending also the United Nations Protection Force for its continuing action in support of the relief operation in Sarajevo and other parts of Bosnia and Herzegovina, Deeply concerned about the safety of the personnel of the United Nations Protection Force and expressing sympathy for the losses suffered by them, 1. Demands that all parties tc the conflict immediately stop fighting and find a peaceful solution in line with the Charter of the United Nations and the principles of intermational law, and in particular the principles of respect for sovereignty and territorial integrity of States, non-recognition of the fruits of aggression and non-recognition of acquisition of territory by force; 2. Demands also that all forms of interference from outside the Republic of Bosnia and Herzegovina cease immediately; 3. Demands further that those units of the Yugoslav People's Army and elements of the Croatian Army now in Bosnia and Herzegovina must either be withdrawn, or be subject to the authority of the Government of Bosnia and Herzegovina, or be disbanded and disarmed with their weapons placed under effective international monitoring, and requests the Secretary-General to consider without delay what kind of international assistance could be provided in this connection; /s Reaffirming the necessity of respecting the sovereignty, terr%torial _ integrity, political independence and national unity of the Repu?llc of Bosnia and Herzegovina, and rejecting any attempt to change the boundaries of that Republic, Reaffirming also the inherent right of the Republic of Bosnia and Herzegovina to individual and collective self-defence in accordance with Article 51 of the Charter of the United Nations, Underlining the imperative need for an urgent peaceful solution to the situation in Bosnia and Herzegovina, in conformity with the Charter of the United Nations and the principles of international law, and in particular the principles of respect for sovereignty and territorial integrity of States, non-recognition of the fruits of aggression and non-recognition of acquisition of territory by force, and welcoming in this context the International Conference on the Former Yugoslavia, scheduled to be convened in Londen on Commending the efforts of the Secretary-Gemeral, the Security Council, United Natioms agencies, including the Office of the United Nations High Commissioner for Refugees and other international and relief organizatioms, including the Organization of the Islamic Conference, the European Community, the Conference on Security and Cooperation in Europe and the International Committee of the Red Cross, Commending also the United Nations Protection Force for its continuing action in support of the relief operation in Sarajevo and other parts of Bosnia and Herzegovina, Deeply concerned about the safety of the personnel of the United Nations Protection Force and expressing sympathy for the losses suffered by them, 1. Demands that all parties tc the conflict immediately stop fighting and find a peaceful solution in line with the Charter of the United Nations and the principles of intermational law, and in particular the principles of respect for sovereignty and territorial integrity of States, non-recognition of the fruits of aggression and non-recognition of acquisition of territory by force; 2. Demands also that all forms of interference from outside the Republic of Bosnia and Herzegovina cease immediately; 3. Demands further that those units of the Yugoslav People's Army and elements of the Croatian Army now in Bosnia and Herzegovina must either be withdrawn, or be subject to the authority of the Government of Bosnia and Herzegovina, or be disbanded and disarmed with their weapons placed under effective international monitoring, and requests the Secretary-General to consider without delay what kind of international assistance could be provided in this connection; /s 4. Reaffirms its support for the Government and people of the Republic of Bosnia and Herzegovina in their just struggle to safeguard their sovereignty, political independence, territorial integrity and unity; 5. Urges the Security Council to consider, on an urgent basis, taking further appropriate measures, as provided in Chapter VII of the Charter of the United Nations, to put am end to the fighting and to restore the unity and the territorial integrity of the Republic of Bosnia and Herzegovina; 6. Condemns the violation of the sovereignty, territorial integrity and political independence of the Republic of Bosnia and Herzegovina as well as the massive violations of human rights and international humanitarian law, in particular the abhorrent practice of ""ethnic cleansing""”, and demands that this practice be immediately brought to an end and that further steps be taken, on an urgent basis, to stop the massive and forcible displacement of population from and within the Republic of Bosnia and Herzegovina, as well as all other forms of violation of human rights in the former Yugoslavia; T. Affirms that States are to be held accountable for violations of human rights which their agents commit upon the territory of another State; 8. Calls upon all States and international organizations not to recognize the consequences of the acquisition of territory by force and of the abhorrent practice of ""ethnic cleansing""; 9. Demands that the International Committee of the Red Cross be granted immediate, unimpeded and continued access to all camps, prisons and other places of detention within the territory of the former Yugoslavia and that all parties ensure complete safety and freedom of movement for the International Committee and otherwise facilitate such access; 10. Demands also the safe, unconditional and honourable repatriation of the refugees and deportees to their homes in Bosnia and Herzegovina and recognizes their right to receive reparation for their losses: 11. Calls upon organs of the United Nations and all international relief agencies to facilitate the return of the displaced people to their homes in the Republic of Bosnia and Herzegovina, as well as their rehabilitation; 12, Commends the untiring efforts and the bravery of the United Nations Protection Force in securing the relief operation in the Republic of Bosnia and Herzegovina, as well as the efforts of the O0ffice of the United Nations High Commissioner for Refugees and other relief agencies; 13. Urges all parties and others concerned to take the necessary measures to secure the safety of the United Nations Protection Force and all other United Nations personnel; 14. Urges all States to support the ongoing efforts to be taken in accordance with the relevant Security Council resolutions to facilitate the /ooo 4. Reaffirms its support for the Government and people of the Republic of Bosnia and Herzegovina in their just struggle to safeguard their sovereignty, political independence, territorial integrity and unity; 5. Urges the Security Council to consider, on an urgent basis, taking further appropriate measures, as provided in Chapter VII of the Charter of the United Nations, to put am end to the fighting and to restore the unity and the territorial integrity of the Republic of Bosnia and Herzegovina; 6. Condemns the violation of the sovereignty, territorial integrity and political independence of the Republic of Bosnia and Herzegovina as well as the massive violations of human rights and international humanitarian law, in particular the abhorrent practice of ""ethnic cleansing""”, and demands that this practice be immediately brought to an end and that further steps be taken, on an urgent basis, to stop the massive and forcible displacement of population from and within the Republic of Bosnia and Herzegovina, as well as all other forms of violation of human rights in the former Yugoslavia; T. Affirms that States are to be held accountable for violations of human rights which their agents commit upon the territory of another State; 8. Calls upon all States and international organizations not to recognize the consequences of the acquisition of territory by force and of the abhorrent practice of ""ethnic cleansing""; 9. Demands that the International Committee of the Red Cross be granted immediate, unimpeded and continued access to all camps, prisons and other places of detention within the territory of the former Yugoslavia and that all parties ensure complete safety and freedom of movement for the International Committee and otherwise facilitate such access: 10. Demands also the safe, unconditional and honourable repatriation of the refugees and deportees to their homes in Bosnia and Herzegovina and recognizes their right to receive reparation for their losses: 11. Calls upon organs of the United Nations and all international relief agencies to facilitate the return of the displaced people to their homes in the Republic of Bosnia and Herzegovina, as well as their rehabilitation; 12, Commends the untiring efforts and the bravery of the United Nations Protection Force in securing the relief operation in the Republic of Bosnia and Herzegovina, as well as the efforts of the O0ffice of the United Nations High Commissioner for Refugees and other relief agencies; 13. Urges all parties and others concerned to take the necessary measures to secure the safety of the United Nations Protection Force and all other United Nations personnel; 14. Urges all States to support the ongoing efforts to be taken in accordance with the relevant Security Council resolutions to facilitate the /ooo delivery of humanitarian assistance to all parts of the Republic of Bosnia and Herzegovina} el «Cyoviila, 15, Requests the Secretary-General to report to the General Assembly at its forty-seventh session on the implementation of the present resolution; 16. Decides to remain seized of the matter and to continue its consideration of this item at its forty-seventh session,",08/24/1992,1992_149377,Bosnia and Herzegovina,"26 August 1992, 26 August 1992,",no
1992,General Assembly,N/A,Forty-seventh session,8,ADOPTION OF THE AGENDA AND ORGANIZATION OF WORK,"Belgium, Denmark, France, Germany, Greece, Ireland, Italy, Luxembourqg, Morocco, Netherlands, Portugal, Spain and the United Kingdom of Great Britain and Northern Ireland.",N/A,N/A,"Recommendation of the Security Council of 19 September 1992 Addendum Add the following countries to the list of sponsors of the resolution Afghanistan, Albania, Australia, Austria, Bahrain, Bangladesh, Bosnia and Herzegovina, Canada, Comoros, Croatia, Eqypt, Finland, Iceland, Iran (Islamic Republic of), Jordan, Liechtenstein, Malaysia, Malta, Mauritania, New Zealand, Norway, Oman, Pakistan, Qatar, Saudi Arabia, Senegal, Slovenia, Sweden, Tunisia, Turkey, United Arab Emirates and United States of America ——— o - I_,ﬁ |",09/22/1992,1992_150785,Bosnia and Herzegovina,N/A,no
1992,General Assembly,First Committee,Forty-seventh session,60,A/C.1/747/L.1 7 October 1992CHEMICAL AND BACTERIOLOGICAL (BIOLOGICAL) WEAPOVNS,"Afghanistan, Albania, Antigua and Barbuda, Argentina, Armenia, Australia, Austria, Azerbaijan, Bahamas, Bangladesh, Barbados, Belarus, Belgium, Beliz Benin Bolivia, Bosnia and Herzegovina, Botswana, Brazil, Brunei Darussalam, Bulgaria, Cameroon, Canada, Cape Verde, Central African Republic, Chad, Chile, Colombia, Comoros, Congo, Costa Rica, Cote d'Ivoire, Croatia, Cyprus, Czechoslovakia, Denmark, Dmonica, Dominican Republic, Ecuador, El Salvador, Estonia, Ethiopia, Fiji, Finlan France, Gabon mbia Georgia, Germany, Ghana, Greece, Grenada, Guatemala, Guinea, Haiti, Honduras, Hungary, Iceland, India, Indonesia, Iran_(Islamic Republic of), Ireland, Italy. Jamaica, Japan, Kenya, Kyrgyzstan, Latvia, Lesotho, Liberia, Liechtenstein, Lithuania, Luxembourg, Madagascar, Malaysia, Maldives, Mali, Malta, Marshall Islands, Mauritania, Mauritius, Mexico, Micronesia (Federated States of), Mongolia, Mozambique, Myanmar, Namibia, Nepal, Netherlands, New Zealand, Nicaraqua, Nigeria, Norway, Panama, Papua New Guinea, Paraguay, Peru, Philippines, Poland, Portugal, Republic of Korea, Republic of Moldova, Romania, Saint Kitts and Nevis, Saint Lucia, Saint Vincent and the Grenadines, Samoa, San Marino, Sao Tome and Principe, Senegal, Singapore, Slovenia, Solomon Islands, Spain, Sri Lanka, Suriname, Swaziland, Sweden, Tajikistan, Thailand, Togo, Turkey, Turkmenistan, Ukraine, United Kingdom of Great Britain and Northern Ireland, United States of America, Uruquay, Uzbekistan, Vanuatu, Venezuela, Zaire and Zambia",N/A,e,"Convention on the Prohibition of the Development, Production, Stockpiling and Use of Chemical Weapons and on Their Destruction The General Assembly, Recalling the long-standing determination of the international community to achieve the effective prohibition of the development, production, stockpiling and use of chemical weapons, and their destruction, as well as the continuing support for measures to uphold the authority of the Protocol for the Prohibition of the Use in War of Asphyxiating, Poisonous or Other Gases, and of Bacteriological Methods of Warfare, signed at Geneva on 17 June 1925, 1/ as expressed by consensus in many previous resolutions, Recalling in particular its resolution 46/35 C of 6 December 1991, in which the Assembly strongly urged the Conference on Disarmament, as a matter of the highest priority, to resolve outstanding issues so as to achieve a final agreement on a convention on the prohibition of the development, production, stockpiling and use of chemical weapons and on their destruction during its 1992 session, Bearing in mind the Final Declaration 2/ of the Conference of States Parties to the 1925 Geneva Protocol and Other Interested States, held in Paris from 7 to 11 January 1989, in which participating States stressed their determination to prevent any recourse to chemical weapons by completely eliminating them, Determined to make progress towards general and complete disarmament under strict and effective international control, including the prohibition and elimination of all types of weapons of mass destruction, Convinced, therefore, of the urgent necessity of a total ban on chemical weapons, so as to abolish an entire category of weapons of mass destruction, and thus eliminate the risk to mankind of renewed use of these inhumane weapons, Welcoming the Convention on the Prohibition of the Development, Production, Stockpiling and Use of Chemical Weapons and on Their Destruction, adopted by the Conference on Disarmament and contained in its report dated 3 September 1992, the result of many years of intensive negotiations, which constitutes a historic achievement in the field of arms control and disarmament, Convinced that the Convention will improve the security of all States, and therefore merits the strong support of the international community, 1/ League of Nations, Treaty Series, vol. XCIV (1929), No. 2138. 2/ A/44/88, annex. laen Convinced further that the Convention will promote expanded international trade, technological development and economic cooperation in the chemical sector and thereby advance the economic interests of States parties, Recalling the support for the prohibition of chemical weapons expressed in the declaration by representatives of the world's chemical industry at the Government-Industry Conference against Chemical Weapons, held at Canberra from 18 to 22 September 1989, 3/ Welcoming the invitation of the President of the French Republic to participate in a ceremony to sign the Convention in Paris on ... January 1993, 1. Commends the Convention on the Prohibition of the Development, Production, Stockpiling and Use of Chemical Weapons and on Their Destruction, as contained in the report of the Conference on Disarmament, dated 3 September 1992; 2. Regquests the Secretary-General, as Depositary of the Convention, to open it for signature in Paris on ... January 1993; 3. Calls upon all States to sign and thereafter to become parties to the Convention at the earliest possible date, thus contributing to its rapid entry into force and to the early achievement of universal adherence; 4, Further calls upon all States to ensure the effective implementation of this unprecedented, global, comprehensive and verifiable multilateral disarmament agreement, thereby enhancing cooperative multilateralism as a basis for international peace and security; 5. Requests the Secretary-General, as Depositary of the Convention, to report to the General Assembly at its forty-eighth session on the status of signatures and ratifications of the Convention. 3/ See A/C.1/44/4.",10/07/1992,1992_151498,Bosnia and Herzegovina,N/A,no
