year,Council,Committee,Session,Agenda item,Agenda detail,cosponsored countries,body title number,body title detail,body text,date,file,filecountry,footnote,scanned
2010,General Assembly,N/A,Sixty-fourth session,70 (a),"Strengthening of the coordination of humanitarian and disaster relief assistance of the United Nations, including special economic assistance: strengthening of the coordination of emergency humanitarian assistance","Australia, Brazil, Cameroon, Chile, Colombia, Dominican Republic, Japan, Kazakhstan, Norway, Peru, Philippines, Saint Vincent and the Grenadines, Spain and Uruguay",N/A,"Humanitarian assistance, emergency relief and rehabilitation for Haiti in response to the devastating effects of the earthquake in that country","Addendum Add the following countries to the list of sponsors of the resolution: Albania, Algeria, Andorra, Antigua and Barbuda, Argentina, Armenia, Austria, Azerbaijan, Bahamas, Bangladesh, Barbados, Belarus, Belgium, Belize, Benin, Bosnia and Herzegovina, Bulgaria, Burkina Faso, Burundi, Cambodia, Canada, Central African Republic, Comoros, Congo, Costa Rica, Croatia, Cuba, Cyprus, Czech Republic, Denmark, Ecuador, Egypt, El] Salvador, Eritrea, Estonia, Finland, France, Gambia, Georgia, Germany, Ghana, Greece, Grenada, Guatemala, Guyana, Haiti, Honduras, Hungary, Iceland, India, Indonesia, Iran (Islamic Republic of), Ireland, Israel, Italy, Jamaica, Jordan, Lao People’s Democratic Republic, Latvia, Lebanon, Liechtenstein, Lithuania, Luxembourg, Madagascar, Malta, Mauritius, Mexico, Monaco, Mongolia, Montenegro, Morocco, Nepal, Netherlands, New Zealand, Nigeria, Pakistan, Panama, Papua New Guinea, Poland, Portugal, Republic of Korea, Republic of Moldova, Romania, Russian Federation, Rwanda, Saint Lucia, San Marino, Senegal, Serbia, Seychelles, Singapore, Slovakia, Slovenia, South Africa, Sudan, Suriname, Sweden, Switzerland, Thailand, the former Yugoslav Republic of Macedonia, Tonga, Trinidad and Tobago, Tunisia, Turkey, Turkmenistan, Ukraine, United Kingdom of Great Britain and Northern Ireland, United Republic of Tanzania, United States of America, Viet Nam, Yemen and Zambia 10-21729 Hi 260110 CNY A A",01/22/2010,2010_675700,Central African Republic,N/A,yes
2010,General Assembly,Commission On Human Rights,Thirteenth session,5,Human rights bodies and mechanisms,"Angola, Argentina, Austria*, Benin*, Bolivia (Plurinational State of), Bosnia and Herzegovina, Botswana‘, Brazil, Bulgaria*, Burkina Faso, Burundi*, Cameroon Canada*, Central African Republic*, Chad*, Chile, Colombia*, Congo*, Costa Rica*, Cote d’Ivoire*, Croatia*, Cyprus*, Democratic Republic of the Congo*, Djibouti, Dominican Republic*, Egypt, El Salvador*, Ethiopia*, France, Gabon, Germany*, Guinea*, Greece*, Honduras*, Hungary, Indonesia, Ireland*, Italy, Jordan, Kenya*, Kyrgyzstan, Lesotho*, Lithuania*, Luxembourg*, Malta*, Mauritania*, Mexico, Monaco*, Morocco*, Niger*, Nigeria, Norway, Pakistan*, Palestine*, Panama’, Paraguay*, Peru*, Philippines, Portugal*, Romania*, Rwanda*, Senegal, Serbia‘, Slovakia, Slovenia, Somalia*, Spain*, Sudan*, Switzerland*, Togo*, Tunisia*, Turkey*, Uganda*, United Republic of Tanzania*, Uruguay, Venezuela (Bolivarian Republic of)*, Zimbabwe*",N/A,13/... United Nations declaration on human rights education and training,"The Human Rights Council, Recalling Council resolutions 6/10 of 28 September 2007 and 10/28 of 27 March 2009, in which the Council mandated the Advisory Committee to elaborate a United Nations declaration on human rights education and training and to submit it to the Council at its thirteenth session, Welcoming the open and rich debate witnessed during the high-level discussion on the declaration, held on 2 March 2010, in accordance with Council decision 12/118 of 1 October 2009, Welcoming also the submission of the declaration by the Advisory Committee contained in its study submitted to the Council (A/HRC/13/41), 1. Decides to establish an open-ended intergovernmental working group with the mandate of negotiating, finalizing and submitting to the Council the United Nations declaration on human rights education and training on the basis of the submitted by the Advisory Committee; A/HRC/13/L.22 2. Also decides that the working group shall meet for a maximum of five working days before its sixteenth session; 3. Welcomes the decision of the Platform on Human Rights Education and Training to hold open-ended informal consultations prior to the convening of the working group, 4. Requests the Office of the United Nations High Commissioner for Human Rights to provide the working group with the necessary assistance for it to fulfil its mandate, including by circulating to all Member States and in all official languages of the United Nations the declaration contained in the study of the Advisory Committee; 5. Requests the President of the Council to invite the Rapporteur of the Advisory Committee drafting group on the declaration to participate in the meetings of the working group. GE.10-12324",03/19/2010,2010_679269,Central African Republic,* Non-Member State of the Human Rights Council.,yes
2010,General Assembly,N/A,Sixty-fourth session,N/A,United Nations A\/64/u..61/Add.1,"Afghanistan, Cambodia, Canada, Congo, Costa Rica, El Salvador, Fiji, Honduras, Ireland, Japan, Jordan, Kazakhstan, Madagascar, Malawi, Mali, Marshall Islands, Mexico, Micronesia (Federated States of), Mongolia, Nauru, Nepal, Nigeria, Norway, Palau, Papua New Guinea, Philippines, Samoa, Senegal, Slovenia, Switzerland, Thailand, Tonga, Tuvalu, United Republic of Tanzania, United States of America and Vanuatu",N/A,Follow-up to paragraph 143 on human security of the 2005 World Summit Outcome,"Addendum Add the following countries to the list of sponsors of the resolution: Armenia, Australia, Austria, Benin, Central African Republic, Chile, Greece, Guatemala, India, Kenya, Liberia, Mauritius, Morocco, Mozambique, New Zealand, Saint Lucia, South Africa, Uganda and Uzbekistan 10-45500 Hil 190710 CA YA AAA",07/16/2010,2010_686548,Central African Republic,N/A,yes
2010,General Assembly,N/A,Sixty-fourth session,48,"Integrated and coordinated implementation of and follow-up to the outcomes of the major United Nations conferences and summits in the economic, social and related fields","Antigua and Barbuda, Bahrain, Bangladesh, Benin, Bolivia (Plurinational State of), Central African Republic, Congo, Cuba, Dominica, Dominican Republic, Ecuador, El Salvador, Fiji, Georgia, Madagascar, Nicaragua, Paraguay, Saint Lucia, Saint Vincent and the Grenadines, Samoa, Saudi Arabia, Serbia, Seychelles, Solomon Islands, Sri Lanka, Tuvalu, United Republic of Tanzania, Uruguay, Vanuatu, Venezuela (Bolivarian Republic of), Yemen",N/A,The human right to water and sanitation,"The General Assembly, Recalling its resolutions 54/175 of 17 December 1999, on the right to development, 55/196 of 20 December 2000, proclaiming 2003 as the International Year of Freshwater, 58/217 of 23 December 2003, proclaiming the International Decade for Action, “Water for Life” (2005-2015), 59/228 of 22 December 2004, 61/192 of 20 December 2006, proclaiming 2008 as the International Year of Sanitation, and 64/198 of 21 December 2009, regarding the midterm comprehensive review of the implementation of the International Decade for Action, “Water for Life”, Agenda 21 of June 1992,! the Habitat Agenda of 1996,2 the Mar del Plata Action Plan of 1977, adopted by the United Nations Water Conference, and the Rio Declaration on Environment and Development of June 1992,3 Recalling also the Universal Declaration of Human Rights,4 the International Covenant on Economic, Social and Cultural Rights,® the International Covenant on 1 Report of the United Nations Conference on Environment and Development, Rio de Janeiro, 3-14 June 1992, vol. I, Resolutions Adopted by the Conference (United Nations publication, Sales No. E.93.1.8 and corrigendum), resolution 1, annex II. 2 Report of the United Nations Conference on Human Settlements (Habitat II), Istanbul, 3-14 June 1996 (United Nations publication, Sales No. E.97.IV.6), chap. I, resolution 1, annex II. 3 Report of the United Nations Conference on Environment and Development, Rio de Janeiro, 3-14 June 1992, vol. I, Resolutions Adopted by the Conference (United Nations publication, Sales No. E.93.1.8 and corrigendum), resolution 1, annex I. 10-46108 Hil 230710 UA AA A Civil and Political Rights,’ the International Convention on the Elimination of All Forms of Racial Discrimination, ® the Convention on the Elimination of All Forms of Discrimination against Women,’ the Convention on the Rights of the Child,® the Convention on the Rights of Persons with Disabilities? and the Geneva Convention relative to the Protection of Civilian Persons in Time of War of 12 August 1949, 1° Recalling further all previous resolutions of the Human Rights Council on “human rights and access to safe drinking water and sanitation”, including Council resolutions 7/22 of 28 March 2008 and 12/8 of 1 October 2009, related to the human right to safe and clean drinking water and sanitation, General Comment No. 15 (2002) of the Committee on Economic, Social and Cultural Rights on the right to water (articles 11 and 12 of the International Covenant on Economic, Social and Cultural Rights),!! the report of the United Nations High Commissioner for Human Rights on the scope and content of the relevant human rights obligations related to equitable access to safe drinking water and sanitation under international human rights instruments, !? as well as the report of the independent expert on the issue of human rights obligations related to access to safe drinking water and sanitation, !3 Deeply concerned that approximately 884 million people lack access to safe drinking water and that more than 2.6 billion do not have access to basic sanitation, and alarmed that approximately 1.5 million children under 5 years of age die and 443 million school days are lost each year as a result of water- and sanitation-related diseases, Acknowledging the importance of equitable, safe and clean drinking water and sanitation as an integral component of the realization of human rights, Reaffirming the responsibility of States for the promotion and protection of all human rights, which are universal, indivisible, interdependent and interrelated, and must be treated globally, in a fair and equal manner, on the same footing and with the same emphasis, Bearing in mind the commitment made by the international community to fully achieve the Millennium Development Goals, and stressing, in that context, the resolve of heads of State and Government, as expressed in the United Nations Millennium Declaration,!4 to halve, by 2015, the proportion of people unable to reach or afford safe drinking water, and to halve the proportion of people without access to basic sanitation, as agreed in the Plan of Implementation of the World Summit on Sustainable Development (“Johannesburg Plan of Implementation”), 15 11 See Official Records of the Economic and Social Council, 2003, Supplement No. 2 (E/2003/22), annex IV. 15 Report of the World Summit on Sustainable Development, Johannesburg, South Africa, 26 August-4 September 2002 (United Nations publication, Sales No. E.03.11.A.1 and corrigendum), chap. I, resolution 2, annex. A/64/L.63 1. Declares the right to safe and clean drinking water and sanitation as a human right that is essential for the full enjoyment of the right to life; 2. Calls upon States and international organizations to provide financial resources, capacity-building and technology transfer, through international assistance and cooperation, in particular to developing countries, in order to scale up efforts to provide safe, clean, accessible and affordable water and sanitation for all; 3. Welcomes the decision by the Human Rights Council to request that the independent expert on the issue of human rights obligations related to access to safe drinking water and sanitation present an annual report to the General Assembly, 1© and invites the independent expert, in consultation with all relevant United Nations agencies, funds and programmes, to include in her report to the Assembly, at its sixty-sixth session, the principal challenges related to the realization of the human right to water and sanitation and their impact on the achievement of the Millennium Development Goals. 16 See Human Rights Council resolution 12/8.",07/22/2010,2010_686926,Central African Republic,N/A,yes
2010,General Assembly,N/A,Sixty-fourth session,48,"Integrated and coordinated implementation of and follow-up to the outcomes of the major United Nations conferences and summits in the economic, social and related fields","Antigua and Barbuda, Bahrain, Bangladesh, Benin, Bolivia (Plurinational State of), Burundi, Central African Republic, Congo, Cuba, Dominica, Dominican Republic, Ecuador, El Salvador, Fiji, Georgia, Haiti, Madagascar, Mauritius, Nicaragua, Nigeria, Paraguay, Saint Lucia, Saint Vincent and the Grenadines, Samoa, Saudi Arabia, Serbia, Seychelles, Solomon Islands, Sri Lanka, Tuvalu, Uruguay, Vanuatu, Venezuela (Bolivarian Republic of) and Yemen",N/A,The human right to water and sanitation,"The General Assembly, Recalling its resolutions 54/175 of 17 December 1999, on the right to development, 55/196 of 20 December 2000, proclaiming 2003 as the International Year of Freshwater, 58/217 of 23 December 2003, proclaiming the International Decade for Action, “Water for Life” (2005-2015), 59/228 of 22 December 2004, 61/192 of 20 December 2006, proclaiming 2008 as the International Year of Sanitation, and 64/198 of 21 December 2009, regarding the midterm comprehensive review of the implementation of the International Decade for Action, “Water for Life”, Agenda 21 of June 1992,! the Habitat Agenda of 1996,2 the Mar del Plata Action Plan of 19773 adopted by the United Nations Water Conference, and the Rio Declaration on Environment and Development of June 1992,4 1 Report of the United Nations Conference on Environment and Development, Rio de Janeiro, 3-14 June 1992, vol. I, Resolutions Adopted by the Conference (United Nations publication, Sales No. E.93.1.8 and corrigendum), resolution 1, annex II. 2 Report of the United Nations Conference on Human Settlements (Habitat II), Istanbul, 3-14 June 1996 (United Nations publication, Sales No. E.97.IV.6), chap. I, resolution 1, annex II. 3 Report of the United Nations Water Conference, Mar del Plata, 14-25 March 1977 (United Nations publication, Sales No. E.77.1I.A.12), chap. I. 4 Report of the United Nations Conference on Environment and Development, Rio de Janeiro, 3-14 June 1992, vol. I, Resolutions Adopted by the Conference (United Nations publication, Sales No. E.93.1.8 and corrigendum), resolution 1, annex I. 10-46464* ill 270710 CAT A A A a Recalling also the Universal Declaration of Human Rights,®° the International Covenant on Economic, Social and Cultural Rights,® the International Covenant on Civil and Political Rights,° the International Convention on the Elimination of All Forms of Racial Discrimination,” the Convention on the Elimination of All Forms of Discrimination against Women,® the Convention on the Rights of the Child,° the Convention on the Rights of Persons with Disabilities !° and the Geneva Convention relative to the Protection of Civilian Persons in Time of War of 12 August 1949, 11 Recalling further all previous resolutions of the Human Rights Council on “human rights and access to safe drinking water and sanitation”, including Council resolutions 7/22 of 28 March 2008 and 12/8 of 1 October 2009, related to the human right to safe and clean drinking water and sanitation, General Comment No. 15 (2002) of the Committee on Economic, Social and Cultural Rights, on the right to water (articles 11 and 12 of the International Covenant on Economic, Social and Cultural Rights)12 and the report of the United Nations High Commissioner for Human Rights on the scope and content of the relevant human rights obligations related to equitable access to safe drinking water and sanitation under international human rights instruments,!° as well as the report of the independent expert on the issue of human rights obligations related to access to safe drinking water and sanitation, 14 Deeply concerned that approximately 884 million people lack access to safe drinking water and that more than 2.6 billion do not have access to basic sanitation, and alarmed that approximately 1.5 million children under 5 years of age die and 443 million school days are lost each year as a result of water- and sanitation-related diseases, Acknowledging the importance of equitable, safe and clean drinking water and sanitation as an integral component of the realization of all human rights, Reaffirming the responsibility of States for the promotion and protection of all human rights, which are universal, indivisible, interdependent and interrelated, and must be treated globally, in a fair and equal manner, on the same footing and with the same emphasis, Bearing in mind the commitment made by the international community to fully achieve the Millennium Development Goals, and stressing, in that context, the resolve of Heads of State and Government, as expressed in the United Nations Millennium Declaration,!5 to halve, by 2015, the proportion of people unable to reach or afford safe drinking water, and to halve the proportion of people without 12 See Official Records of the Economic and Social Council, 2003, Supplement No. 2 (E/2003/22), annex IV. A/64/L.63/Rev.1 access to basic sanitation, as agreed in the Plan of Implementation of the World Summit on Sustainable Development (“Johannesburg Plan of Implementation”), 16 1. Declares the right to safe and clean drinking water and sanitation as a human right that is essential for the full enjoyment of life and all human rights; 2. Calls upon States and international organizations to provide financial resources, capacity-building and technology transfer, through international assistance and cooperation, in particular to developing countries, in order to scale up efforts to provide safe, clean, accessible and affordable drinking water and sanitation for all; 3. Welcomes the decision by the Human Rights Council to request that the independent expert on the issue of human rights obligations related to access to safe drinking water and sanitation present an annual report to the General Assembly, 1” and encourages her to continue working on all aspects of her mandate and, in consultation with all relevant United Nations agencies, funds, and programmes, to include in her report to the Assembly, at its sixty-sixth session, the principal challenges related to the realization of the human right to safe and clean drinking water and sanitation and their impact on the achievement of Millennium Development Goals. 16 Report of the World Summit on Sustainable Development, Johannesburg, South Africa, 26 August-4 September 2002 (United Nations publication, Sales No. E.03.11.A.1 and corrigendum), chap. I, resolution 2, annex.",07/26/2010,2010_686927,Central African Republic,* Reissued for technical reasons on 27 July 2010.,yes
2010,General Assembly,First Committee,Sixty-fifth session,97 (r),General and complete disarmament: measures to prevent terrorists from acquiring weapons of mass destruction,"Afghanistan, Albania, Argentina, Armenia, Australia, Austria, Azerbaijan, Bangladesh, Belgium, Bhutan, Bolivia (Plurinational State of), Bulgaria, Central African Republic, Chile, Congo, Croatia, Cyprus, Czech Republic, Democratic Republic of the Congo, Denmark, E] Salvador, Estonia, Fiji, Finland, France, Germany, Greece, Guatemala, Guyana, Haiti, Hungary, Iceland, India, Ireland, Italy, Jamaica, Kuwait, Lithuania, Luxembourg, Malta, Mauritius, Monaco, Montenegro, Myanmar, Nepal, Norway, Philippines, Poland, Portugal, Romania, Russian Federation, Serbia, Singapore, Slovakia, Slovenia, Spain, Sri Lanka, Thailand, Turkey and United Kingdom of Great Britain and Northern Ireland",N/A,Measures to prevent terrorists from acquiring weapons of mass destruction,"The General Assembly, Recalling its resolution 64/38 of 2 December 2009, Recognizing the determination of the international community to combat terrorism, as evidenced in relevant General Assembly and Security Council resolutions, Deeply concerned by the growing risk of linkages between terrorism and weapons of mass destruction, and in particular by the fact that terrorists may seek to acquire weapons of mass destruction, Cognizant of the steps taken by States to implement Security Council resolution 1540 (2004) on the non-proliferation of weapons of mass destruction, adopted on 28 April 2004, Welcoming the entry into force of the International Convention for the Suppression of Acts of Nuclear Terrorism, on 7 July 2007,1 10-58611 HN 181010 AY A A A Welcoming also the adoption, by consensus, of amendments to strengthen the Convention on the Physical Protection of Nuclear Material? by the International Atomic Energy Agency on 8 July 2005, Noting the support expressed in the Final Document of the Fifteenth Summit Conference of Heads of State and Government of the Movement of Non-Aligned Countries, which was held in Sharm el-Sheikh, Egypt, from 11 to 16 July 2009,3 for measures to prevent terrorists from acquiring weapons of mass destruction, Noting also that the Group of Eight, the European Union, the Regional Forum of the Association of Southeast Asian Nations and others have taken into account in their deliberations the dangers posed by the likely acquisition by terrorists of weapons of mass destruction and the need for international cooperation in combating it, and that the Global Initiative to Combat Nuclear Terrorism has been launched jointly by the Russian Federation and the United States of America, Noting further the Nuclear Security Summit held on 12 and 13 April 2010 in Washington, D.C., Acknowledging the consideration of issues relating to terrorism and weapons of mass destruction by the Advisory Board on Disarmament Matters,+ Taking note of the relevant resolutions adopted by the General Conference of the International Atomic Energy Agency at its fifty-fourth regular session, ° Taking note also of the 2005 World Summit Outcome adopted at the High-level Plenary Meeting of the General Assembly in September 2005® and the adoption of the United Nations Global Counter-Terrorism Strategy on 8 September 2006,” Taking note further of the report of the Secretary-General, submitted pursuant to paragraph 5 of resolution 64/38, 8 Mindful of the urgent need for addressing, within the United Nations framework and through international cooperation, this threat to humanity, Emphasizing that progress is urgently needed in the area of disarmament and non-proliferation in order to maintain international peace and security and to contribute to global efforts against terrorism, 1. Calls upon all Member States to support international efforts to prevent terrorists from acquiring weapons of mass destruction and their means of delivery; 2. Appeals to all Member States to consider early accession to and ratification of the International Convention for the Suppression of Acts of Nuclear Terrorism;' 3. | Urges all Member States to take and strengthen national measures, as appropriate, to prevent terrorists from acquiring weapons of mass destruction, their means of delivery and materials and technologies related to their manufacture; 5 See International Atomic Energy Agency, Resolutions and Other Decisions of the General Conference, Fifty-fourth Regular Session, 20-24 September 2010 (GC(54)/RES/DEC(2010)). A/C.1/65/L.29 4. Encourages cooperation among and between Member States and relevant regional and international organizations for strengthening national capacities in this regard; 5. | Requests the Secretary-General to compile a report on measures already taken by international organizations on issues relating to the linkage between the fight against terrorism and the proliferation of weapons of mass destruction and to seek the views of Member States on additional relevant measures, including national measures, for tackling the global threat posed by the acquisition by terrorists of weapons of mass destruction and to report to the General Assembly at its sixty-sixth session; 6. Decides to include in the provisional agenda of its sixty-sixth session the item entitled “Measures to prevent terrorists from acquiring weapons of mass destruction”. 10-58611",10/15/2010,2010_692032,Central African Republic,N/A,yes
