year,Council,Committee,Session,Agenda item,Agenda detail,cosponsored countries,body title number,body title detail,body text,date,file,filecountry,footnote,scanned
2012,General Assembly,N/A,Sixty-sixth session,34,Prevention of armed conflict,"Andorra, Australia, Bahrain, Comoros, Croatia, Denmark, Egypt, Finland, France, Greece, Hungary, Jordan, Kuwait, Libya, Montenegro, Morocco, Norway, Oman, Panama, Qatar, Republic of Korea, Saudi Arabia, Somalia, Tunisia, Turkey, United Arab Emirates, United Kingdom of Great Britain and Northern Ireland and United States of America",N/A,The situation in the Syrian Arab Republic Addendum,"Add the following countries to the list of sponsors of the resolution: Albania, Austria, Belgium, Bosnia and Herzegovina, Bulgaria, Burkina Faso, Burundi, Canada, Cape Verde, Central African Republic, Colombia, Cote d’Ivoire, Cyprus, Czech Republic, Djibouti, Estonia, Germany, Honduras, Iceland, Ireland, Italy, Japan, Latvia, Liechtenstein, Lithuania, Luxembourg, Malta, Micronesia (Federated States of), Monaco, Netherlands, New Zealand, Palau, Poland, Portugal, Republic of Moldova, Romania, San Marino, Seychelles, Slovakia, Slovenia, Spain, Sweden, Switzerland and the former Yugoslav Republic of Macedonia 12-23548 Hi 210212 CAAT A",02/16/2012,2012_721194,Central African Republic,N/A,yes
2012,General Assembly,Commission On Human Rights,Twenty-first session,3,"Promotion and protection of all human rights, civil, political, economic, social and cultural rights, including the right to development","Andorra , Angola, Australia , Austria, Belgium, Benin, Bosnia and Herzegovina , Botswana, Bulgaria , Burkina Faso, Central African Republic , Chad’, Colombia , Congo, Cote d'Ivoire , Croatia’, Cyprus , Czech Republic, Democratic Republic of the Congo, Denmark’, Djibouti, Dominican Republic , Ecuador, Equatorial Guinea , Estonia , Finland , France , Germany , Ghana’, Greece , Guatemala, Iceland’, Italy, J apan , Lithuania , Luxembourg , Mexico, Monaco , Montenegro , Netherlands , Nicaragua , Nigeria, Norway, Peru, Portugal’, Republic of Korea , Romania, Serbia , Slovakia , Slovenia , Spain, Sweden’, Thailand, Tunisia , Turkey , United Kingdom of Great Britain and Northern Ireland , Uruguay, Venezuela (Bolivarian Republic of)’",N/A,21/.... Preventable maternal mortality and morbidity and human rights,"The Human Rights Council, Recalling its resolutions 11/8 of 17 June 2009, 15/17 of 30 September 2010 and 18/2 of 28 September 2011 on preventable maternal mortality and morbidity and human rights, Reaffirming the Beijing Declaration and Platform for Action, the Programme of Action of the International Conference on Population and Development and its review conferences, including the outcome document of the 15-year review of the Programme of Action contained in Commission on Population and Development resolution 2009/1 of 3 April 2009, Commission on the Status of Women resolutions 54/5 of 12 March 2010 and 56/3 of 9 March 2012, the targets and commitments regarding the reduction of maternal mortality and universal access to reproductive health, including those contained in the 2000 Millennium Declaration, the 2005 World Summit Outcome and the outcome document of the High-level Plenary Meeting of the sixty-fifth session of the General Assembly on the Millennium Development Goals, and Commission on Population and Development resolution 2012/1 of 27 April 2012, Taking note of the various processes within the United Nations system to review the implementation of the Programme of Action of the International Conference on Population Please reeyele OO GE.12-16910 A/HRC/21/L.10 and Development, to review the realization of the Millennium Development Goals and to prepare for a post-2015 development framework, Welcomes the organization by the United Nations High Commissioner for Human Rights, in cooperation with other relevant entities of the United Nations system, of an expert workshop and a public consultation in April 2012, with the participation of Governments, regional organizations, relevant United Nations bodies and civil society organizations, and the preparation of concise technical guidance on the application of a human rights-based approach to the implementation of policies and programmes to reduce preventable maternal mortality and morbidity, ' Convinced that increased political will and commitment, cooperation and technical assistance at all levels are urgently required to reduce the unacceptably high global rate of preventable maternal mortality and morbidity, and that the integration of a human rights- based approach can contribute positively to the common goal of reducing this rate, 1. Requests all States to renew their political commitment to eliminate preventable maternal mortality and morbidity at the local, national, regional and international levels, and to redouble their efforts to ensure the full and effective implementation of their human rights obligations, the Beijing Declaration and Platform for Action, the Programme of Action of the International Conference on Population and Development and its review processes, including the commitments relating to sexual and reproductive health and reproductive rights, the Millennium Declaration and the Millennium Development Goals, in particular the goals on improving maternal health and promoting gender equality and empowering women, including through the allocation of necessary domestic resources to health systems and the provision of the necessary information and health services addressing the sexual and reproductive health of women and girls; 2. Requests States and other relevant actors to give renewed emphasis to maternal mortality and morbidity initiatives in their development partnerships and cooperation arrangements, including by honouring existing commitments and considering new ones, and the exchange of effective practices and technical assistance to strengthen national capacities, and to integrate a human rights-based perspective into such initiatives, addressing the impact that discrimination against women has on maternal mortality and morbidity; 3. Encourages States and other relevant stakeholders, including national human rights institutions and non-governmental organizations, to take action at all levels to address the interlinked root causes of maternal mortality and morbidity, such as poverty, malnutrition, harmful practices, lack of accessible and appropriate health-care services, information and education, and gender inequality, and to pay particular attention to eliminating all forms of violence against women and girls; 4. Welcomes the technical guidance on the application of a human rights-based approach to the implementation of policies and programmes to reduce preventable maternal mortality and morbidity, and calls upon all relevant actors, including Governments, regional organizations, relevant United Nations agencies, national human rights institutions, and civil society organizations to disseminate the technical guidance and apply it, as appropriate, when designing, implementing and reviewing policies and evaluating programmes to reduce preventable maternal mortality and morbidity; ' A/ARC/21/22 and Corr. 1 and 2. A/HRC/21/L.10 5. Calls upon all relevant United Nation agencies to provide technical cooperation and assistance to States, as requested, to support the implementation of the technical guidance; 6. Encourages the Office of the United Nations High Commissioner for Human Rights to bring the technical guidance to the attention of the Secretary-General and all United Nations entities with mandates relevant to maternal mortality and morbidity and human rights, and to continue dialogue on the issue of preventable maternal mortality and morbidity with all relevant actors in order to accelerate the realization of the rights of women and girls and the achievement of Millennium Development Goal 5 by 2015; 7. Requests the Office of the High Commissioner to prepare, from within existing resources, in consultation with States, United Nations agencies, in particular the World Health Organization, the United Nations Population Fund, the United Nations Children’s Fund and the United Nations Entity for Gender Equality and the Empowerment of Women and all other relevant stakeholders, a report on how the technical guidance has been applied by States and other relevant actors, to be presented to the Human Rights Council at its twenty-seventh session; 8. Requests the Secretary-General to transmit the technical guidance to the General Assembly as a contribution to the review of the realization of the Millennium Development Goals and the implementation of the Programme of Action of the International Conference on Population and Development, including at its special event in 2013 to follow up on efforts made towards achieving the Millennium Development Goals and its special session on the theme, “the ICPD beyond 2014”; 9. Decides to continue considering the issue under the same agenda item.",09/21/2012,2012_736248,Central African Republic,* Non-Member State of the Human Rights Council.,yes
2012,General Assembly,Third Committee,Sixty-seventh session,68,Right of peoples to self-determination,"Albania, Algeria, Angola, Armenia, Azerbaijan, Bahrain, Bangladesh, Belarus, Benin, Bolivia (Plurinational State of), Brunei Darussalam, Burkina Faso, Burundi, Cameroon, Central African Republic, China, Comoros, Congo, Cote d’Ivoire, Ecuador, Egypt, El Salvador, Eritrea, Gabon, Ghana, Grenada, Guinea, Guyana, Honduras, Iran (Islamic Republic of), Jordan, Kenya, Kuwait, Lebanon, Lesotho, Liberia, Malawi, Malaysia, Mozambique, Namibia, Nicaragua, Niger, Nigeria, Oman, Pakistan, Qatar, Russian Federation, Rwanda, Saudi Arabia, Senegal, Sierra Leone, Singapore, Somalia, South Africa, Sudan, Swaziland, Togo, United Arab Emirates, United Republic of Tanzania, Venezuela (Bolivarian Republic of), Zambia and Zimbabwe",N/A,Universal realization of the right of peoples to self-determination,"The General Assembly, Reaffirming the importance, for the effective guarantee and observance of human rights, of the universal realization of the right of peoples to self-determination enshrined in the Charter of the United Nations and embodied in the International Covenants on Human Rights,! as well as in the Declaration on the Granting of Independence to Colonial Countries and Peoples contained in General Assembly resolution 1514 (XV) of 14 December 1960, Welcoming the progressive exercise of the right to self-determination by peoples under colonial, foreign or alien occupation and their emergence into sovereign statehood and independence, Deeply concerned at the continuation of acts or threats of foreign military intervention and occupation that are threatening to suppress, or have already suppressed, the right to self-determination of peoples and nations, Expressing grave concern that, as a consequence of the persistence of such actions, millions of people have been and are being uprooted from their homes as refugees and displaced persons, and emphasizing the urgent need for concerted international action to alleviate their condition, 12-57565 Hil 071112 CAT AA A Recalling the relevant resolutions regarding the violation of the right of peoples to self-determination and other human rights as a result of foreign military intervention, aggression and occupation, adopted by the Commission on Human Rights at its sixty-first? and previous sessions, Reaffirming its previous resolutions on the universal realization of the right of peoples to self-determination, including resolution 66/145 of 19 December 2011, Reaffirming also its resolution 55/2 of 8 September 2000, containing the United Nations Millennium Declaration, and recalling its resolution 60/1 of 16 September 2005, containing the 2005 World Summit Outcome, which, inter alia, upheld the right to self-determination of peoples under colonial domination and foreign occupation, Taking note of the report of the Secretary-General on the right of peoples to self-determination, 3 1. Reaffirms that the universal realization of the right of all peoples, including those under colonial, foreign and alien domination, to self-determination is a fundamental condition for the effective guarantee and observance of human rights and for the preservation and promotion of such rights; 2. Declares its firm opposition to acts of foreign military intervention, aggression and occupation, since these have resulted in the suppression of the right of peoples to self-determination and other human rights in certain parts of the world; 3. Calls upon those States responsible to cease immediately their military intervention in and occupation of foreign countries and territories and all acts of repression, discrimination, exploitation and maltreatment, in particular the brutal and inhuman methods reportedly employed for the execution of those acts against the peoples concerned; 4. Deplores the plight of millions of refugees and displaced persons who have been uprooted as a result of the aforementioned acts, and reaffirms their right to return to their homes voluntarily in safety and with honour; 5. | Requests the Human Rights Council to continue to give special attention to violations of human rights, especially the right to self-determination, resulting from foreign military intervention, aggression or occupation; 6. | Requests the Secretary-General to report on the question to the General Assembly at its sixty-eighth session under the item entitled “Right of peoples to self-determination”. 2 See Official Records of the Economic and Social Council, 2005, Supplement No. 3 and corrigenda (E/2005/23 and Corr.1 and 2), chap. II, sect. A. 3 A/67/276.",11/06/2012,2012_737327,Central African Republic,N/A,yes
