year,Council,Committee,Session,Agenda item,Agenda detail,cosponsored countries,body title number,body title detail,body text,date,file,filecountry,footnote,scanned
2014,General Assembly,Third Committee,Sixty-ninth session,67,Right of peoples to self-determination,"Albania, Algeria, Angola, Antigua and Barbuda, Armenia, Azerbaijan, Bahrain, Bangladesh, Belarus, Belize, Benin, Bolivia (Plurinational State of), Brazil, Brunei Darussalam, Burkina Faso, Burundi, Cameroon, Central African Republic, Chad, China, Comoros, Congo, Cote d’Ivoire, Ecuador, Egypt, El Salvador, Eritrea, Gabon, Ghana, Guinea, Guyana, Haiti, Honduras, Iran (Islamic Republic of), Jamaica, Jordan, Kenya, Kuwait, Lebanon, Lesotho, Liberia, Libya, Malawi, Malaysia, Maldives, Mozambique, Namibia, Nicaragua, Niger, Nigeria, Oman, Pakistan, Paraguay, Qatar, Russian Federation, Rwanda, Saudi Arabia, Senegal, Sierra Leone, Singapore, Somalia, South Africa, South Sudan, Sudan, Swaziland, Tajikistan, Thailand, Togo, Tunisia, United Arab Emirates, Venezuela (Bolivarian Republic of), Viet Nam and Zimbabwe",N/A,Universal realization of the right of peoples to self-determination,"The General Assembly, Reaffirming the importance, for the effective guarantee and observance of human rights, of the universal realization of the right of peoples to self-determination enshrined in the Charter of the United Nations and embodied in the International Covenants on Human Rights,! as well as in the Declaration on the Granting of Independence to Colonial Countries and Peoples contained in General Assembly resolution 1514 (XV) of 14 December 1960, Welcoming the progressive exercise of the right to self-determination by peoples under colonial, foreign or alien occupation and their emergence into sovereign statehood and independence, Deeply concerned at the continuation of acts or threats of foreign military intervention and occupation that are threatening to suppress, or have already suppressed, the right to self-determination of peoples and nations, Expressing grave concern that, as a consequence of the persistence of such actions, millions of people have been and are being uprooted from their homes as Please recycle ! Resolution 2200 A (XXI), annex. 14-63891 (E) 051114 CNY A A refugees and displaced persons, and emphasizing the urgent need for concerted international action to alleviate their condition, Recalling the relevant resolutions regarding the violation of the right of peoples to self-determination and other human rights as a result of foreign military intervention, aggression and occupation, adopted by the Commission on Human Rights at its sixty-first? and previous sessions, Reaffirming its previous resolutions on the universal realization of the right of peoples to self-determination, including resolution 68/153 of 18 December 2013, Reaffirming also its resolution 55/2 of 8 September 2000, containing the United Nations Millennium Declaration, and recalling its resolution 60/1 of 16 September 2005, containing the 2005 World Summit Outcome, which, inter alia, upheld the right to self-determination of peoples under colonial domination and foreign occupation, Taking note of the report of the Secretary-General on the right of peoples to self-determination,? 1. Reaffirms that the universal realization of the right of all peoples, including those under colonial, foreign and alien domination, to self-determination is a fundamental condition for the effective guarantee and observance of human rights and for the preservation and promotion of such rights; 2. Declares its firm opposition to acts of foreign military intervention, aggression and occupation, since these have resulted in the suppression of the right of peoples to self-determination and other human rights in certain parts of the world; 3. Calls upon those States responsible to cease immediately their military intervention in and occupation of foreign countries and territories and all acts of repression, discrimination, exploitation and maltreatment, in particular the brutal and inhuman methods reportedly employed for the execution of those acts against the peoples concerned; 4. _Deplores the plight of millions of refugees and displaced persons who have been uprooted as a result of the aforementioned acts, and reaffirms their right to return to their homes voluntarily in safety and with honour; 5. Requests the Human Rights Council to continue to give special attention to violations of human rights, especially the right to self-determination, resulting from foreign military intervention, aggression or occupation; 6. Requests the Secretary-General to report on the question to the General Assembly at its seventieth session under the item entitled “Right of peoples to self-determination”. 2 See Official Records of the Economic and Social Council, 2005, Supplement No. 3 and corrigenda (E/2005/23 and Corr.1 and 2), chap. I, sect. A. 3 A/69/342. 2/2",11/04/2014,2014_782330,Central African Republic,N/A,yes
2014,General Assembly,Third Committee,Sixty-ninth session,68 (b),"Promotion and protection of human rights: human rights questions, including alternative approaches for improving the effective enjoyment of human rights and fundamental freedoms","Albania, Andorra, Argentina, Armenia, Australia, Austria, Azerbaijan, Belgium, Benin, Bosnia and Herzegovina, Brazil, Bulgaria, Burkina Faso, Central African Republic, Chile, Colombia, Costa Rica, Croatia, Cyprus, Czech Republic, Denmark, EI Salvador, Estonia, Finland, France, Georgia, Germany, Ghana, Greece, Guatemala, Hungary, Iceland, Ireland, Israel, Italy, Japan, Latvia, Lebanon, Liechtenstein, Lithuania, Luxembourg, Maldives, Mali, Malta, Monaco, Mongolia, Montenegro, Morocco, Netherlands, Norway, Panama, Paraguay, Peru, Poland, Portugal, Qatar, Republic of Korea, Republic of Moldova, Romania, San Marino, Serbia, Slovakia, Slovenia, Somalia, Spain, Sweden, Switzerland, Tunisia, Turkey, Ukraine, United Kingdom of Great Britain and Northern Ireland and Uruguay",N/A,The safety of journalists and the issue of impunity,"The General Assembly, Guided by the purposes and principles of the Charter of the United Nations, Reaffirming the Universal Declaration of Human Rights,! and recalling relevant international human rights treaties, including the International Covenant on Civil and Political Rights? and the International Convention for the Protection of All Persons from Enforced Disappearance,? as well as the Geneva Conventions of 12 August 19494 and the Additional Protocols thereto,> Recalling its resolution 68/163 of 18 December 2013 on the safety of journalists and the issue of impunity, in which it proclaimed 2 November as the International Day to End Impunity for Crimes against Journalists, ! Resolution 217 A (IID). 4 United Nations, Treaty Series, vol. 75, Nos. 970-973. 5 Tbid., vol. 1125, Nos. 17512 and 17513. Please recycle 14-64957 (E) 181114 CAT A A A Welcoming the report of the Secretary-General,® Taking note with appreciation of the United Nations Plan of Action on the Safety of Journalists and the Issue of Impunity, endorsed by the United Nations System Chief Executives Board for Coordination on 12 April 2012, in which United Nations agencies, funds and programmes were invited to work with Member States towards a free and safe environment for journalists and media workers in both conflict and non-conflict situations, with a view to strengthening peace, democracy and development worldwide, Recalling Human Rights Council resolutions 21/12 of 27 September 20127 and 27/5 of 25 September 20148 on the safety of journalists, 20/8 of 5 July 2012 on the promotion, protection and enjoyment of human rights on the Internet,? and 27/12 of 25 September 2014* on the World Programme for Human Rights Education, as well as Security Council resolution 1738 (2006) of 23 December 2006, Welcoming the panel discussion of the Human Rights Council on the issue of the safety of journalists, held on 11 June 2014, and taking note with appreciation of the summary report of the Office of the United Nations High Commissioner for Human Rights thereon, submitted to the Human Rights Council at its twenty- seventh session,!° as well the 2014 United Nations Educational, Scientific and Cultural Organization report entitled World Trends in Freedom of Expression and Media Development,'! Taking note of all relevant reports of the special procedures of the Human Rights Council with regard to the safety of journalists, in particular the reports of the Special Rapporteur on the promotion and protection of the right to freedom of opinion and expression!? and the Special Rapporteur on extrajudicial, summary or arbitrary executions,!? submitted to the Human Rights Council at its twentieth session, and the interactive dialogue thereon, Commending the role and the activities of the Office of the United Nations High Commissioner for Human Rights and the United Nations Educational, Scientific and Cultural Organization with regard to the safety of journalists and the issue of impunity, and their facilitation of the commemoration of the International Day to End Impunity for Crimes against Journalists, in consultation with relevant entities within the United Nations system, Governments and relevant stakeholders, Taking note with appreciation of the report of the Office of the High Commissioner for Human Rights on good practices concerning the safety of journalists,!+ submitted to the Human Rights Council at its twenty-fourth session, © A/69/268. 7 Official Records of the General Assembly, Sixty-seventh Session, Supplement No. 53A (A/67/53/Add.1), chap. III. ° Ibid., Sixty-seventh Session, Supplement No. 53 (A/67/53). 2/5 Noting with appreciation the international conference on the safety of journalists, held in Warsaw on 23 and 24 April 2013, and its specific recommendations, !5 Mindful that the right to freedom of opinion and expression is a human right guaranteed to all in accordance with article 19 of the Universal Declaration of Human Rights and of the International Covenant on Civil and Political Rights, and that it constitutes one of the essential foundations of a democratic society and one of the basic conditions for its progress and development, Acknowledging that journalism is continuously evolving to include inputs from media institutions, private individuals and a range of organizations that seek, receive and impart information and ideas of all kinds, online as well as offline, in the exercise of freedom of opinion and expression, in accordance with article 19 of the International Covenant on Civil and Political Rights, thereby contributing to the shaping of public debate, Recognizing the relevance of freedom of expression and of free media, online as well as offline, in building inclusive and peaceful knowledge societies and democracies and in fostering intercultural dialogue, peace and good governance, as well as understanding and cooperation, Recognizing also that the work of journalists often puts them at specific risk of intimidation, harassment and violence, Noting the good practices of different countries aimed at the protection of journalists, as well as, inter alia, those designed for the protection of human rights defenders that can, where applicable, be relevant to the protection of journalists, Recognizing that the number of people whose lives are influenced by the way information is presented is significant and that journalism influences public opinion, Bearing in mind that impunity for attacks against journalists remains one of the biggest challenges to the safety of journalists and that ensuring accountability for crimes committed against journalists is a key element in preventing future attacks, Recalling in this regard that journalists, media professionals and associated personnel engaged in dangerous professional missions in areas of armed conflict shall be considered as civilians and shall be respected and protected as such, provided that they take no action adversely affecting their status as civilians, Deeply concerned by all human rights violations and abuses committed in relation to the safety of journalists, including killing, torture, enforced disappearance, arbitrary arrest and arbitrary detention, expulsion, intimidation, harassment, threats and other forms of violence, Expressing deep concern at the increased number of journalists and media workers who have been killed or detained in recent years as a direct result of their profession, Expressing deep concern also at the growing threat to the safety of journalists posed by non-State actors, including terrorist groups and criminal organizations, 3/5 Acknowledging the specific risks faced by women journalists in the exercise of their work, and underlining, in this context, the importance of taking a gender- sensitive approach when considering measures to address the safety of journalists, Acknowledging also the particular vulnerability of journalists to becoming targets of unlawful or arbitrary surveillance or interception of communications in violation of their rights to privacy and to freedom of expression, 1. Condemns unequivocally all attacks and violence against journalists and media workers, such as torture, extrajudicial killings, enforced disappearances, arbitrary arrest and arbitrary detention, as well as intimidation and harassment in both conflict and non-conflict situations; 2. Strongly condemns the prevailing impunity for attacks and violence against journalists, and expresses grave concern that the vast majority of these crimes go unpunished, which in turn contributes to the recurrence of these crimes; 3. Urges the immediate release of journalists and media workers who have been taken as hostages or who have become victims of enforced disappearances; 4. Encourages States to take the opportunity of the proclamation of 2 November as the International Day to End Impunity for Crimes against Journalists to raise awareness regarding the issue of the safety of journalists and to launch concrete initiatives in this regard; 5. Requests the United Nations Educational, Scientific and Cultural Organization, in consultation with relevant entities of the United Nations system, and mindful of the provisions of the annex to Economic and Social Council resolution 1980/67 of 25 July 1980, to continue facilitating the implementation of the International Day in collaboration with Governments and relevant stakeholders; 6. Urges Member States to do their utmost to prevent violence, threats and attacks against journalists and media workers, to ensure accountability through the conduct of impartial, speedy, thorough, independent and effective investigations into all alleged violence, threats and attacks against journalists and media workers falling within their jurisdiction, to bring perpetrators, including those who command, conspire to commit, aid and abet or cover up such crimes to justice, and to ensure that victims and their families have access to appropriate remedies; 7. Calls upon States to create and maintain, in law and in practice, a safe and enabling environment for journalists to perform their work independently and without undue interference, including by means of: (a) legislative measures; (b) awareness-raising in the judiciary and among law enforcement officers and military personnel, as well as among journalists and in civil society, regarding international human rights and humanitarian law obligations and commitments relating to the safety of journalists; (c) the monitoring and reporting of attacks against journalists; (d) publicly and systematically condemning violence and attacks; and (e) dedicating the resources necessary to investigate and prosecute such attacks and to develop and implement strategies for combating impunity for attacks and violence against journalists, including by using, where appropriate, good practices such as those identified in Human Rights Council resolution 27/5 of 25 September 2014; 8. Stresses the need to ensure better cooperation and coordination at the international level, including through technical assistance and capacity-building, 4/5 with regard to ensuring the safety of journalists, including with regional organizations; 9. Calls upon States to cooperate with relevant United Nations entities, in particular the United Nations Educational, Scientific and Cultural Organization, as well as international and regional human rights mechanisms and to share information on a voluntary basis on the status of investigations into attacks and violence against journalists; 10. Invites the relevant agencies, organizations, funds and programmes of the United Nations system to actively exchange information, including through already identified focal points, about the implementation of the United Nations Plan of Action on the Safety of Journalists and the Issue of Impunity, in cooperation with Member States and under the overall coordination of the United Nations Educational, Scientific and Cultural Organization; 11. Requests the Secretary-General to report to the General Assembly at its seventieth session and to the Human Rights Council at its thirtieth session on the implementation of the present resolution. 14-64957 5/5",11/17/2014,2014_783133,Central African Republic,N/A,yes
2014,General Assembly,N/A,Sixty-ninth session,124,Global health and foreign policy,"Afghanistan, Algeria, Angola, Argentina, Armenia, Australia, Austria, Azerbaijan, Bahamas, Bangladesh, Barbados, Belarus, Belize, Benin, Bhutan, Bolivia (Plurinational State of), Brunei Darussalam, Bulgaria, Burundi, Cabo Verde, Canada, Central African Republic, Chad, Chile, China, Colombia, Cote d’Ivoire, Croatia, Cuba, Cyprus, Denmark, Djibouti, Dominica, Dominican Republic, Ecuador, Egypt, El Salvador, Equatorial Guinea, Eritrea, Ethiopia, Fiji, Finland, France, Gabon, Gambia, Georgia, Germany, Ghana, Greece, Grenada, Guatemala, Guinea, Guinea-Bissau, Haiti, Honduras, Iceland, India, Indonesia, Iran (Islamic Republic of), Iraq, Ireland, Israel, Jamaica, Japan, Kazakhstan, Kenya, Kiribati, Kyrgyzstan, Lao People’s Democratic Republic, Lebanon, Liechtenstein, Luxembourg, Madagascar, Malawi, Maldives, Marshall Islands, Mauritius, Mexico, Mongolia, Montenegro, Morocco, Mozambique, Myanmar, Nepal, Netherlands, New Zealand, Nicaragua, Nigeria, Norway, Oman, Palau, Papua New Guinea, Peru, Portugal, Qatar, Republic of Korea, Russian Federation, Rwanda, Saint Kitts and Nevis, Saint Lucia, Saint Vincent and the Grenadines, Samoa, Sao Tome and Principe, Senegal, Serbia, Sierra Leone, Singapore, South Africa, Spain, Sri Lanka, Sudan, Suriname, Sweden, Syrian Arab Republic, Tajikistan, Thailand, Timor-Leste, Tonga, Turkey, Turkmenistan, Tuvalu, Uganda, United Arab Emirates, United Kingdom of Great Britain and Northern Ireland, United States of America, Uruguay, Vanuatu, Venezuela (Bolivarian Republic of) and Viet Nam",N/A,International Day of Yoga,"The General Assembly, Recalling its resolutions 66/2 of 19 September 2011 on the Political Declaration of the High-level Meeting of the General Assembly on the Prevention and Control of Non-communicable Diseases and 68/98 of 11 December 2013 on global health and foreign policy, Reaffirming General Assembly resolutions 53/199 of 15 December 1998 and 61/185 of 20 December 2006 on the proclamation of international years, and Economic and Social Council resolution 1980/67 of 25 July 1980 on international years and anniversaries, Wee sa oe re . agen So Please recycle 14-64292* (E) 191114 CA A A A Noting the importance of individuals and populations making healthier choices and following lifestyle patterns that foster good health, Underscoring the fact that global health is a long-term development objective that requires closer international cooperation through the exchange of best practices aimed at building better individual lifestyles devoid of excesses of all kinds, Recognizing that yoga provides a holistic approach to health and well-being, Recognizing also that wider dissemination of information about the benefits of practising yoga would be beneficial for the health of the world population, 1. Decides to proclaim 21 June the International Day of Yoga; 2. Invites all Member and observer States, the organizations of the United Nations system and other international and regional organizations, as well as civil society, including non-governmental organizations and individuals, to observe the International Day, in an appropriate manner and in accordance with national priorities, in order to raise awareness of the benefits of practising yoga; 3. Stresses that the cost of all activities that may arise from the implementation of the present resolution should be met from voluntary contributions; 4. Requests the Secretary-General to bring the present resolution to the attention of all Member and observer States and the organizations of the United Nations system. 14-64292 2/2",11/07/2014,2014_783301,Central African Republic,* Reissued for technical reasons on 19 November 2014.,yes
