year,Council,Committee,Session,Agenda item,Agenda detail,cosponsored countries,body title number,body title detail,body text,date,file,filecountry,footnote,scanned
2014,Security Council,N/A,N/A,N/A,United Nations S$ 2014/348,"Albania, Andorra, Australia, Austria, Belgium, Botswana, Bulgaria, Canada, Central African Republic, Chile, Céte d’Ivoire, Croatia, Cyprus, Czech Republic, Democratic Republic of the Congo, Denmark, Estonia, Finland, France, Georgia, Germany, Greece, Hungary, Iceland, Ireland, Italy, Japan, Jordan, Latvia, Libya, Liechtenstein, Lithuania, Luxembourg, Malta, Marshall Islands, Mexico, Monaco, Montenegro, Netherlands, New Zealand, Norway, Panama, Poland, Portugal, Qatar, Republic of Korea, Republic of Moldova, Romania, Samoa, San Marino, Saudi Arabia, Senegal, Serbia, Seychelles, Slovakia, Slovenia, Spain, Sweden, Switzerland, The former Yugoslav Republic of Macedonia, Turkey, Ukraine, United Arab Emirates, United Kingdom of Great Britain and Northern Ireland and United States of America",N/A,N/A,"The Security Council, Recalling its resolutions 2042 (2012), 2043 (2012), 2118 (2013) and 2139 (2014), and its Presidential Statements of 3 August 2011, 21 March 2012, 5 April 2012 and 2 October 2013, Reaffirming its strong commitment to the sovereignty, independence, unity and territorial integrity of the Syrian Arab Republic, and to the purposes and principles of the Charter of the United Nations, Recalling its full endorsement of the Geneva Communiqué of 30 June 2012 which states that accountability for acts committed during the present conflict in the Syrian Arab Republic must be addressed, Taking note of the reports of the independent international commission of inquiry on the Syrian Arab Republic, mandated by the Human Rights Council to investigate all alleged violations of international human rights law since March 2011 in the Syrian Arab Republic, to establish the facts and circumstances that may amount to such violations and of the crimes perpetrated and, where possible, to identify those responsible with a view to ensuring that perpetrators of violations, including those that may constitute crimes against humanity, are held accountable, Recalling the statements made by the Secretary-General and the United Nations High Commissioner for Human Rights that crimes against humanity and war crimes are likely to have been committed in the Syrian Arab Republic, ra aR Please rec eed Li UT . lo 14-53881 (E}) 220514 CAT A A A S/2014/348 Noting the repeated encouragement by the United Nations High Commissioner for Human Rights for the Security Council to refer the situation to the International Criminal Court, Determining that the situation in the Syrian Arab Republic constitutes a threat to international peace and security, Acting under Chapter VII of the Charter of the United Nations, 1. Reaffirms its strong condemnation of the widespread violations of human rights and international humanitarian law by the Syrian authorities and pro-government militias, as well as the human rights abuses and violations of international humanitarian law by non-State armed groups, all committed in the course of the ongoing conflict in the Syrian Arab Republic since March 2011; 2. Decides to refer the situation in the Syrian Arab Republic described in paragraph 1 above since March 2011 to the Prosecutor of the International Criminal Court; 3. Decides also that the Government of the Syrian Arab Republic shall cooperate fully with and provide any necessary assistance to the Court and the Prosecutor, including by implementing fully the Agreement on the Privileges and Immunities of the International Criminal Court, pursuant to this resolution and, while recognizing that States not party to the Rome Statute have no obligation under the Statute, strongly urges all States and concerned regional and other international organizations to cooperate fully with the Court and the Prosecutor; 4. Demands that non-State armed groups in the Syrian Arab Republic also cooperate fully with and provide any necessary assistance to the Court and the Prosecutor in connection with investigations and prosecutions undertaken pursuant to this resolution; 5. Expresses its commitment to an effective follow-up of the present resolution; 6. Recalls the guidance issued by the Secretary-General on contacts with persons who are the subject of arrest warrants or summonses issued by the International Criminal Court; 7. Decides that nationals, current or former officials or personnel from a State outside the Syrian Arab Republic which is not a party to the Rome Statute of the International Criminal Court shall be subject to the exclusive jurisdiction of that State for all alleged acts or omissions arising out of or related to operations in the Syrian Arab Republic established or authorized by the Council, unless such exclusive jurisdiction has been expressly waived by the State; 8. Recognizes that none of the expenses incurred in connection with the referral, including expenses related to investigations or prosecutions in connection with that referral, shall be borne by the United Nations and that such costs shall be borne by the parties to the Rome Statute and those States that wish to contribute voluntarily and encourages States to make such contributions, noting the need for funding of expenses related to investigations or prosecutions of the International Criminal Court, including in connection with situations referred to the Court by the Security Council, as stated in General Assembly resolution 67/295; 2/3 S/2014/348 9. Invites the Prosecutor to address the Council within two months of the date of adoption of this resolution and every six months thereafter on actions taken pursuant to this resolution and requests the Secretary-General to circulate the report of the Prosecutor as a document of the Council, in advance of such briefings; 10. Decides to remain seized of the matter. 14-53881 3/3",05/22/2014,2014_771366,Central African Republic,N/A,yes
2014,General Assembly,First Committee,Sixty-ninth session,94 (a),Prevention of an arms race in outer space,"Bangladesh, Belarus, Bolivia (Plurinational State of), Brazil, Burkina Faso, Central African Republic, China, Comoros, Cuba, Democratic People’s Republic of Korea, Democratic Republic of the Congo, Djibouti, Dominican Republic, Ecuador, Egypt, El Salvador, Ghana, Guatemala, Honduras, India, Iraq, Kazakhstan, Kenya, Kuwait, Kyrgyzstan, Libya, Madagascar, Malaysia, Mongolia, Myanmar, Namibia, Nepal, Nigeria, Pakistan, Russian Federation, Saudi Arabia, Senegal, Sri Lanka, Sudan, Syrian Arab Republic, Trinidad and Tobago, Yemen and Zambia",N/A,Prevention of an arms race in outer space,"The General Assembly, Recognizing the common interest of all mankind in the exploration and use of outer space for peaceful purposes, Reaffirming the will of all States that the exploration and use of outer space, including the Moon and other celestial bodies, shall be for peaceful purposes and shall be carried out for the benefit and in the interest of all countries, irrespective of their degree of economic or scientific development, Reaffirming also the provisions of articles HI and IV of the Treaty on Principles Governing the Activities of States in the Exploration and Use of Outer Space, including the Moon and Other Celestial Bodies, ! Recalling the obligation of all States to observe the provisions of the Charter of the United Nations regarding the use or threat of use of force in their international relations, including in their space activities, Reaffirming paragraph 80 of the Final Document of the Tenth Special Session of the General Assembly,” in which it is stated that, in order to prevent an arms race in outer space, further measures should be taken and appropriate international negotiations held in accordance with the spirit of the Treaty, Recalling its previous resolutions on this issue, and taking note of the proposals submitted to the General Assembly at its tenth special session and at its ! United Nations, Treaty Series, vol. 610, No. 8843. 2 Resolution S-10/2. oF *, 1 . r oy ie] er abe Please recycle OO 14-62698 (E) 171014 UR UAHA regular sessions and of the recommendations made to the competent organs of the United Nations and to the Conference on Disarmament, Recognizing that the prevention of an arms race in outer space would avert a grave danger for international peace and security, Emphasizing the paramount importance of strict compliance with existing arms limitation and disarmament agreements relevant to outer space, including bilateral agreements, and with the existing legal regime concerning the use of outer space, Considering that wide participation in the legal regime applicable to outer space could contribute to enhancing its effectiveness, Noting that the Ad Hoc Committee on the Prevention of an Arms Race in Outer Space, taking into account its previous efforts since its establishment in 1985 and seeking to enhance its functioning in qualitative terms, continued the examination and identification of various issues, existing agreements and existing proposals, as well as future initiatives relevant to the prevention of an arms race in outer space, and that this contributed to a better understanding of a number of problems and to a clearer perception of the various positions, Noting also that there were no objections in principle in the Conference on Disarmament to the re establishment of the Ad Hoc Committee, subject to re-examination of the mandate contained in the decision of the Conference on Disarmament of 13 February 1992, Emphasizing the mutually complementary nature of bilateral and multilateral efforts for the prevention of an arms race in outer space, and hoping that concrete results will emerge from those efforts as soon as possible, Convinced that further measures should be examined in the search for effective and verifiable bilateral and multilateral agreements in order to prevent an arms race in outer space, including the weaponization of outer space, Stressing that the growing use of outer space increases the need for greater transparency and better information on the part of the international community, Recalling, in this context, its previous resolutions, in particular resolutions 45/55 B of 4 December 1990, 47/51 of 9 December 1992 and 48/74 A of 16 December 1993, in which, inter alia, it reaffirmed the importance of confidence - building measures as a means conducive to ensuring the attainment of the objective of the prevention of an arms race in outer space, Conscious of the benefits of confidence- and security-building measures in the military field, Recognizing that negotiations for the conclusion of an international agreement or agreements to prevent an arms race in outer space remain a priority task of the Conference on Disarmament and that the concrete proposals on confidence -building measures could form an integral part of such agreements, Noting with satisfaction the constructive, structured and focused debate on the prevention of an arms race in outer space at the Conference on Disarmament in 2009, 2010, 2011, 2012 2013 and 2014, 3 See Official Records of the General Assembly, Forty-seventh Session, Supplement No. 27 (A/47/27), para. 76. 2/3 Noting the introduction by China and the Russian Federation at the Conference on Disarmament of the treaty on the prevention of the placement of weapons in outer space and of the threat or use of force against outer space objects,* Taking note of the decision of the Conference on Disarmament to establish for its 2009 session a working group to discuss, substantially, without limitation, all issues related to the prevention of an arms race in outer space, 1. Reaffirms the importance and urgency of preventing an arms race in outer space and the readiness of all States to contribute to that common objective, in conformity with the provisions of the Treaty on Principles Governing the Activities of States in the Exploration and Use of Outer Space, including the Moon and Other Celestial Bodies; ! 2. Reaffirms its recognition, as stated in the report of the Ad Hoc Committee on the Prevention of an Arms Race in Outer Space, that the legal regime applicable to outer space by itself does not guarantee the prevention of an arms race in outer space, that the regime plays a significant role in the prevention of an arms race in that environment, that there is a need to consolidate and reinforce that regime and enhance its effectiveness and that it is important to comply strictly with existing agreements, both bilateral and multilateral; 3. Emphasizes the necessity of further measures with appropriate and effective provisions for verification to prevent an arms race in outer space; 4. Calls upon all States, in particular those with major space capabilities, to contribute actively to the objective of the peaceful use of outer space and of the prevention of an arms race in outer space and to refrain from actions contrary to that objective and to the relevant existing treaties in the interest of maintaining international peace and security and promoting international cooperation; 5. Reiterates that the Conference on Disarmament, as the sole multilateral disarmament negotiating forum, has the primary role in the negotiation of a multilateral agreement or agreements, as appropriate, on the prevention of an arms race in outer space in all its aspects; 6. Invites the Conference on Disarmament to establish a working group under its agenda item entitled “Prevention of an arms race in outer space” as early as possible during its 2015 session; 7. Recognizes, in this respect, the growing convergence of views on the elaboration of measures designed to strengthen transparency, confidence and security in the peaceful uses of outer space; 8. Urges States conducting activities in outer space, as well as States interested in conducting such activities, to keep the Conference on Disarmament informed of the progress of bilateral and multilateral negotiations on the matter, if any, so as to facilitate its work; 9. Decides to include in the provisional agenda of its seventieth session the item entitled “Prevention of an arms race in outer space”. 4 See CD/1839 and CD/1985. 3/3",10/15/2014,2014_781153,Central African Republic,N/A,yes
2014,General Assembly,First Committee,Sixty-ninth session,96 (b),"General and complete disarmament: compliance with non-proliferation, arms limitation and disarmament agreements and commitments","Afghanistan, Australia, Bulgaria, Canada, Central African Republic, Colombia, Costa Rica, Croatia, Cyprus, Czech Republic, Denmark, El Salvador, Estonia, Finland, France, Georgia, Germany, Greece, Grenada, Honduras, Hungary, Iceland, Ireland, Israel, Italy, Japan, Latvia, Lesotho, Liechtenstein, Lithuania, Luxembourg, Madagascar, Malta, Monaco, Montenegro, Netherlands, New Zealand, Norway, Poland, Portugal, Republic of Korea, Republic of Moldova, Romania, Sao Tome and Principe, Serbia, Slovakia, Slovenia, Spain, Sweden, Switzerland, Trinidad and Tobago, Turkey, Ukraine, United Kingdom of Great Britain and Northern Ireland, United Republic of Tanzania, United States of America and Uruguay",N/A,"Compliance with non-proliferation, arms limitation and disarmament agreements and commitments","The General Assembly, Recalling its resolution 66/49 of 2 December 2011 and other relevant resolutions on the question, Recognizing the abiding concern of all Member States for ensuring respect for the rights and obligations arising from treaties to which they are parties and from other sources of international law, Convinced that observance by Member States of the Charter of the United Nations and compliance with non-proliferation, arms limitation and disarmament agreements to which they are parties and with other agreed obligations are essential for regional and global peace, security and stability, Stressing that failure by States parties to comply with such agreements and with other agreed obligations not only adversely affects the security of States parties but also can create security risks for other States relying on the constraints and commitments stipulated in those agreements, Please ween 14-62918(E) 211014 CAT A A Stressing also that the viability and effectiveness of non-proliferation, arms limitation and disarmament agreements and of other agreed obligations require that those agreements be fully complied with and enforced, Concerned by non-compliance by some States with their respective obligations, Noting that verification and compliance, and enforcement in a manner consistent with the Charter, are integrally related, Recognizing the importance of and support for effective national, regional and international capacities for such verification, compliance and enforcement, Recognizing also that full compliance by States with all their respective non-proliferation, arms limitation and disarmament agreements and with other agreed obligations they have undertaken contributes to efforts to prevent the development and proliferation, contrary to international obligations, of weapons of mass destruction, related technologies and means of delivery, as well as to efforts to deny non-State actors access to such capabilities, 1. Underscores the contribution that compliance with non-proliferation, arms limitation and disarmament agreements and with other agreed obligations makes to enhancing confidence and to strengthening international security and stability; 2. Urges all States to implement and to comply fully with their respective obligations; 3. Welcomes efforts by all States to pursue additional areas of cooperation, aS appropriate, that can increase confidence in compliance with existing non-proliferation, arms limitation and disarmament agreements and commitments and reduce the possibility of misinterpretation and misunderstanding; 4. Calls upon all Member States to encourage and, for those States in a position to do so, to appropriately assist States which request assistance to increase their capacity to implement fully their obligations; 5. Calls upon Member States to support efforts aimed at the resolution of compliance questions by means consistent with such agreements and with international law; 6. Welcomes the role that the United Nations has played and continues to play in maintaining the integrity of certain arms limitation and disarmament and non-proliferation agreements and in addressing threats to international peace and security; 7. Calls upon all concerned States to take concerted action, in a manner consistent with relevant international law, to encourage, through bilateral and multilateral means, the compliance by all States with their respective non-proliferation, arms limitation and disarmament agreements and with other agreed obligations, and to hold those not in compliance with such agreements accountable for their non-compliance in a manner consistent with the Charter of the United Nations; 2/3 8. Urges those States not currently in compliance with their respective obligations and commitments to make the strategic decision to come back into compliance; 9. Encourages efforts by all States, the United Nations and _ other international organizations, pursuant to their respective mandates, to take action, consistent with the Charter, to prevent serious damage to international security and stability arising from non-compliance by States with their existing non-proliferation, arms limitation and disarmament obligations; 10. Decides to include in the provisional agenda of its seventy-second session, under the item entitled “General and complete disarmament”, the sub-item entitled “Compliance with non-proliferation, arms limitation and disarmament agreements and commitments”. 14-62918 3/3",10/17/2014,2014_781337,Central African Republic,N/A,yes
2014,General Assembly,First Committee,Sixty-ninth session,96 (r),"General and complete disarmament: women, disarmament, non-proliferation and arms control","Australia, Austria, Bolivia (Plurinational State of), Bulgaria, Burkina Faso, Central African Republic, Chile, Colombia, Comoros, Costa Rica, Cyprus, Czech Republic, Democratic Republic of the Congo, Denmark, Finland, France, Guatemala, Guyana, Ireland, Jamaica, Kyrgyzstan, Lithuania, Luxembourg, Malta, Mexico, Netherlands, New Zealand, Nigeria, Norway, Portugal, Saint Kitts and Nevis, Saint Lucia, Saint Vincent and the Grenadines, Slovakia, Slovenia, South Africa, Spain, Sweden, Switzerland, Thailand, Trinidad and Tobago, Turkey and United States of America",N/A,"Women, disarmament, non-proliferation and arms control","The General Assembly, Recalling that the Charter of the United Nations reaffirms the equal rights of women and men, Recalling also its resolutions 65/69 of 8 December 2010, 67/48 of 3 December 2012 and 68/33 of 5 December 2013, Recalling further General Assembly and Security Council resolutions on the issue of women and peace and security, Welcoming the call for women’s full and meaningful participation in efforts to prevent, combat and eradicate the illicit transfer of small arms, pursuant to Security Council resolutions 2106 (2013), 2117 (2013) and 2122 (2013), Reaffirming that the equal, full and effective participation of both women and men is one of the essential factors for the promotion and attainment of sustainable peace and security, Recognizing the valuable contribution of women to practical disarmament measures carried out at the local, national, subregional and regional levels in the prevention and reduction of armed violence and armed conflict, and in promoting disarmament, non-proliferation and arms control, gS Please recycle 14-62923 Hil 211014 A A A A Recognizing also that the role of women in disarmament, non-proliferation and arms control should be further developed, in particular the need to facilitate the participation and representation of women in policymaking, planning and implementation processes related to disarmament, non-proliferation and arms control, Noting the imminent entry into force of the Arms Trade Treaty,! and therefore encouraging States parties to fully implement the provisions of the Treaty, including the provision on serious acts of gender-based violence or serious acts of violence against women and children, Noting with appreciation the efforts of Member States to increase the participation of women in their national and regional coordination mechanisms on disarmament-related matters, including in efforts to prevent, combat and eradicate the illicit trade in small arms and light weapons in all its aspects, 1. Urges Member States, relevant subregional and regional organizations, the United Nations and the specialized agencies to promote equal opportunities for the representation of women in all decision-making processes with regard to matters related to disarmament, non-proliferation and arms control, in particular as it relates to the prevention and reduction of armed violence and armed conflict; 2. Welcomes the report of the Secretary-General on the measures taken by Member States to implement General Assembly resolution 68/33; 2 3. Also welcomes the continuing efforts of the United Nations organs, agencies, funds and programmes to accord high priority to the issue of women and peace and security, and in this regard notes the role of the United Nations Entity for Gender Equality and the Empowerment of Women (UN-Women) in promoting the implementation of all resolutions related to women in the context of peace and security; 4. Encourages Member States to better understand the impact of armed violence, in particular the impact of the illicit trafficking in small arms and light weapons on women and girls through, inter alia, strengthening the collection of data disaggregated by sex and age; 5. | Urges Member States to support and strengthen the effective participation of women in organizations in the field of disarmament at the local, national, subregional and regional levels; 6. Calls upon all States to empower women, including through capacity- building efforts, as appropriate, to participate in the design and implementation of disarmament, non-proliferation and arms control efforts; 7. Also calls upon all States to develop appropriate and effective national risk assessment criteria to facilitate the prevention of the use of arms to commit gender-based violence or violence against women and girls; 8. Requests the relevant United Nations organs, agencies, funds and programmes to assist States, upon request, in promoting the role of women in disarmament, non-proliferation and arms control, including in preventing, combating and eradicating the illicit trade in small arms and light weapons; 1 See resolution 67/234 B. 2 A/69/114 and Add.1. 2/3 9. Requests the Secretary-General to seek the views of Member States on ways and means of promoting the role of women in disarmament, non-proliferation and arms control and to report to the General Assembly at its seventy-first session on the implementation of the present resolution; 10. Decides to include in the provisional agenda of its seventy-first session, under the item entitled “General and complete disarmament”, the sub-item entitled “Women, disarmament, non-proliferation and arms control”. 14-62923 3/3",10/17/2014,2014_781425,Central African Republic,N/A,yes
