year,Council,Committee,Session,Agenda item,Agenda detail,cosponsored countries,body title number,body title detail,body text,date,file,filecountry,footnote,scanned
2014,General Assembly,Commission On Human Rights,Twenty-seventh session,3,"Promotion and protection of all human rights, civil, political, economic, social and cultural rights, including the right to development","Argentina, Australia,* Austria, Belgium,* Benin, Bosnia and Herzegovina,* Brazil, Bulgaria,* Burkina Faso, Canada,* Central African Republic,* Colombia,* Costa Rica, Croatia,* Cyprus,* Czech Republic, Denmark,* Estonia, Finland,* France, Georgia,* Germany, Greece,* Guatemala,* Honduras,* Hungary,* Iceland,* Ireland, Italy, Latvia,* Lebanon,* Liechtenstein,* Lithuania,* Luxembourg,* Maldives, Mexico, Montenegro, Morocco, Netherlands,* New Zealand,* Nigeria,* Norway,* Paraguay,* Peru, Poland,* Portugal,* Qatar,* Republic of Moldova,* Romania, Saint Kitts and Nevis,* Serbia,* Slovakia,* Slovenia,* Spain,* State of Palestine,* Sweden,* Switzerland,* the former Yugoslav Republic of Macedonia, Tunisia,* Turkey,* United Kingdom of Great Britain and Northern Ireland, United States of America, Yemen:*",N/A,27/... The safety of journalists,"The Human Rights Council, Guided by the purposes and principles of the Charter of the United Nations, Reaffirming the Universal Declaration of Human Rights and recalling relevant international human rights treaties, including the International Covenant on Civil and Political Rights and the International Convention for the Protection of All Persons from Enforced Disappearance, as well as the Geneva Conventions of 12 August 1949 and the Additional Protocols thereto of 8 June 1977, Recalling General Assembly resolution 68/163 of 18 December 2013 on the safety of journalists and the issue of impunity, as well as Security Council resolution 1738 (2006) of 23 December 2006 on the protection of civilians in armed conflict, Recalling also Human Rights Council resolution 21/12 of 27 September 2012 on the safety of journalists, Council decision 24/116 of 26 September 2013 on a panel discussion on the safety of journalists, and all other relevant resolutions of the Commission on Human Please recycle) A/HRC/27/L.7 Rights and the Council, in particular Council resolution 12/16 of 2 October 2009 and all other resolutions on the right to freedom of opinion and expression, Council resolution 13/24 of 26 March 2010 on the protection of journalists in situations of armed conflict, and Council resolution 26/13 of 26 June 2014, on the promotion, protection and enjoyment of human rights on the Internet, Mindful that the right to freedom of opinion and expression is a human right guaranteed to all in accordance with articles 19 of the Universal Declaration of Human Rights and of the International Covenant on Civil and Political Rights, and that it constitutes one of the essential foundations of a democratic society and one of the basic conditions for its progress and development, Recalling all relevant reports of the special procedures of the Human Rights Council with regard to the safety of journalists, in particular the reports of the Special Rapporteur on the promotion and protection of the right to freedom of opinion and expression and the Special Rapporteur on extrajudicial, summary or arbitrary executions, presented to the Council at its twentieth session,' and the interactive dialogue thereon, Taking note with appreciation of the report of the Office of the United Nations High Commissioner for Human Rights on good practices on the safety of journalists, submitted to the Human Rights Council at its twenty-fourth session,” Welcoming the panel discussion of the Human Rights Council on the issue of the safety of journalists, held on 11 June 2014, and taking note with appreciation of the summary report of the Office of the High Commissioner thereon, submitted to the Human Rights Council at its twenty-seventh session,* Welcoming the important work of the United Nations Educational, Scientific and Cultural Organization for the safety of journalists, Noting with appreciation the international conference on the safety of journalists, held in Warsaw on 23 and 24 April 2013, and its specific recommendations, Recognizing that the work of journalists often puts them at specific risk of intimidation, harassment and violence, Deeply concerned by all human rights violations and abuses committed in relation to the safety of journalists, including through killing, torture, enforced disappearance, arbitrary detention, expulsion, intimidation, harassment, threats and acts of other forms of violence, Expressing serious concern at the recent attacks and violence against journalists and media workers, in particular in situations of armed conflict, and recalling in this regard that journalists and media workers engaged in dangerous professional missions in areas of armed conflict shall be considered as civilians and shall be protected as such, provided that they take no action adversely affecting their status as civilians, Acknowledging the specific risks faced by women journalists in the exercise of their work, and underlining in this context the importance of taking a gender-sensitive approach when considering measures to address the safety of journalists, Acknowledging also the particular vulnerability of journalists to becoming targets of unlawful or arbitrary surveillance and/or interception of communications in violation of their rights to privacy and to freedom of expression, ' A/HRC/20/17 and A/HRC/20/22. > A/HRC/24/23. 3 A/HRC/27/35. A/HRC/27/L.7 Bearing in mind that impunity for attacks and violence against journalists constitutes one of the main challenges to strengthening the protection of journalists, and emphasizing that ensuring accountability for crimes committed against journalists is a key element in preventing future attacks, 1. Condemns unequivocally all attacks and violence against journalists and media workers, such as torture, extrajudicial killings, enforced disappearances and arbitrary detention, and intimidation and harassment in both conflict and non-conflict situations; 2. Strongly condemns the prevailing impunity for attacks and violence against journalists, and expresses grave concern that the vast majority of these crimes go unpunished, which in turn contributes to the recurrence of these crimes; 3. Urges States to promote a safe and enabling environment for journalists to perform their work independently and without undue interference, to prevent attacks and violence against journalists and media workers, to ensure accountability through the conduct of impartial, speedy, thorough, independent and effective investigations into all alleged violence against journalists and media workers falling within their jurisdiction, to bring perpetrators including, inter alia, those who command, conspire to commit, aid and abet or cover up such crimes to justice, and to ensure that victims and their families have access to appropriate remedies; 4. Takes note of the good practices of different countries aiming at the protection of journalists, as well as, inter alia, those designed for the protection of human rights defenders that can, where applicable, be relevant to the protection of journalists; 5. Calls upon States to develop and implement strategies for combating impunity for attacks and violence against journalists, including by using, where appropriate, good practices such as those identified during the panel discussion held on 11 June 2014 and/or compiled in the report of the Office of the United Nations High Commissioner for Human Rights on good practice on the safety of journalists, inter alia: (a) The creation of special investigative units or independent commissions; (b) The appointment of a specialized prosecutor; (c) The adoption of specific protocols and methods of investigation and prosecution; (d) The training of prosecutors and judiciary regarding the safety of journalists; (e) The establishment of information-gathering mechanisms, such as databases, to permit the gathering of verified information about threats and attacks against journalists; (f) The establishment of an early warning and rapid response mechanism to give journalists, when threatened, immediate access to the authorities and protective measures; 6. Emphasizes the important role that media organizations can play in providing adequate safety, risk awareness, digital security and self-protection training and guidance to employees, along with protective equipment, where necessary; 7. Welcomes the proclamation by the General Assembly, in its resolution 68/163, of 2 November as the International Day to End Impunity for Crimes against Journalists; 8. Stresses the need to ensure better cooperation and coordination at the international level, including through technical assistance and capacity-building, with regard to ensuring the safety of journalists, including with regional organizations, and A/HRC/27/L.7 invites United Nations agencies, funds and programmes, other international and regional organizations, Member States and all relevant stakeholders, when applicable and in the scope of their mandates, to cooperate further in the implementation of the United Nations Plan of Action on the Safety of Journalists and the Issue of Impunity, and to this end also calls upon States to cooperate with relevant United Nations entities, in particular the United Nations Educational, Scientific and Cultural Organization, as well as international and regional human rights mechanisms, and to share information on a voluntary basis on the status of investigations into attacks and violence against journalists; 9. Acknowledges the importance of addressing the issue of the safety of journalists through the process of the universal periodic review; 10. Encourages national, subregional, regional and international human rights mechanisms and bodies, including the relevant special procedures of the Human Rights Council, treaty bodies and national human rights institutions, in the framework of their mandates, to continue to address the relevant aspects of the safety of journalists in their work; 11. Decides to continue its consideration of the safety of journalists in accordance with its programme of work, no later than at its thirty-third session.",09/19/2014,2014_781628,Central African Republic,* Non-member State of the Human Rights Council. *1416614*,yes
2014,General Assembly,First Committee,Sixty-ninth session,94 (a),Prevention of an arms race in outer space,"Algeria, Armenia, Bangladesh, Belarus, Bolivia (Plurinational State of), Brazil, Burkina Faso, Central African Republic, China, Comoros, Congo, Cuba, Democratic People’s Republic of Korea, Democratic Republic of the Congo, Djibouti, Dominican Republic, Ecuador, Egypt, El] Salvador, Ghana, Guatemala, Honduras, India, Indonesia, Iraq, Kazakhstan, Kenya, Kuwait, Kyrgyzstan, Libya, Madagascar, Malaysia, Mongolia, Myanmar, Namibia, Nepal, Nigeria, Oman, Pakistan, Russian Federation, Saudi Arabia, Senegal, Sri Lanka, Sudan, Syrian Arab Republic, Trinidad and Tobago, Uganda, Yemen, Zambia and Zimbabwe",N/A,Prevention of an arms race in outer space,"The General Assembly, Recognizing the common interest of all mankind in the exploration and use of outer space for peaceful purposes, Reaffirming the will of all States that the exploration and use of outer space, including the Moon and other celestial bodies, shall be for peaceful purposes and shall be carried out for the benefit and in the interest of all countries, irrespective of their degree of economic or scientific development, Reaffirming also the provisions of articles HI and IV of the Treaty on Principles Governing the Activities of States in the Exploration and Use of Outer Space, including the Moon and Other Celestial Bodies, ! Recalling the obligation of all States to observe the provisions of the Charter of the United Nations regarding the use or threat of use of force in their international relations, including in their space activities, Reaffirming paragraph 80 of the Final Document of the Tenth Special Session of the General Assembly,” in which it is stated that, in order to prevent an arms race in outer space, further measures should be taken and appropriate international negotiations held in accordance with the spirit of the Treaty, ! United Nations, Treaty Series, vol. 610, No. 8843. 2 Resolution S-10/2. et Please recycle OO 14-63222 (E) 241014 CA A Recalling its previous resolutions on this issue, and taking note of the proposals submitted to the General Assembly at its tenth special session and at its regular sessions and of the recommendations made to the competent organs of the United Nations and to the Conference on Disarmament, Recognizing that the prevention of an arms race in outer space would avert a grave danger for international peace and security, Emphasizing the paramount importance of strict compliance with existing arms limitation and disarmament agreements relevant to outer space, including bilateral agreements, and with the existing legal regime concerning the use of outer space, Considering that wide participation in the legal regime applicable to outer space could contribute to enhancing its effectiveness, Noting that the Ad Hoc Committee on the Prevention of an Arms Race in Outer Space, taking into account its previous efforts since its establishment in 1985 and seeking to enhance its functioning in qualitative terms, continued the examination and identification of various issues, existing agreements and existing proposals, as well as future initiatives relevant to the prevention of an arms race in outer space, and that this contributed to a better understanding of a number of problems and to a clearer perception of the various positions, Noting also that there were no objections in principle in the Conference on Disarmament to the re-establishment of the Ad Hoc Committee, subject to re-examination of the mandate contained in the decision of the Conference on Disarmament of 13 February 1992, Emphasizing the mutually complementary nature of bilateral and multilateral efforts for the prevention of an arms race in outer space, and hoping that concrete results will emerge from those efforts as soon as possible, Convinced that further measures should be examined in the search for effective and verifiable bilateral and multilateral agreements in order to prevent an arms race in outer space, including the weaponization of outer space, Stressing that the growing use of outer space increases the need for greater transparency and better information on the part of the international community, Recalling, in this context, its previous resolutions, in particular resolutions 45/55 B of 4 December 1990, 47/51 of 9 December 1992 and 48/74 A of 16 December 1993, in which, inter alia, it reaffirmed the importance of confidence- building measures as a means conducive to ensuring the attainment of the objective of the prevention of an arms race in outer space, Conscious of the benefits of confidence- and security-building measures in the military field, Recognizing that negotiations for the conclusion of an international agreement or agreements to prevent an arms race in outer space remain a priority task of the Conference on Disarmament and that the concrete proposals on confidence-building measures could form an integral part of such agreements, Noting with satisfaction the constructive, structured and focused debate on the prevention of an arms race in outer space at the Conference on Disarmament in 2009, 2010, 2011, 2012, 2013 and 2014, 3 See Official Records of the General Assembly, Forty-seventh Session, Supplement No. 27 (A/47/27), para. 76. 2/3 Noting the introduction by China and the Russian Federation at the Conference on Disarmament of the treaty on the prevention of the placement of weapons in outer space and of the threat or use of force against outer space objects in 2008 and the submission of its updated version in 2014,4 Taking note of the decision of the Conference on Disarmament to establish for its 2009 session a working group to discuss, substantially, without limitation, all issues related to the prevention of an arms race in outer space, 1. Reaffirms the importance and urgency of preventing an arms race in outer space and the readiness of all States to contribute to that common objective, in conformity with the provisions of the Treaty on Principles Governing the Activities of States in the Exploration and Use of Outer Space, including the Moon and Other Celestial Bodies; ! 2. Reaffirms its recognition, as stated in the report of the Ad Hoc Committee on the Prevention of an Arms Race in Outer Space, that the legal regime applicable to outer space by itself does not guarantee the prevention of an arms race in outer space, that the regime plays a significant role in the prevention of an arms race in that environment, that there is a need to consolidate and reinforce that regime and enhance its effectiveness and that it is important to comply strictly with existing agreements, both bilateral and multilateral; 3. Emphasizes the necessity of further measures with appropriate and effective provisions for verification to prevent an arms race in outer space; 4. Calls upon all States, in particular those with major space capabilities, to contribute actively to the objective of the peaceful use of outer space and of the prevention of an arms race in outer space and to refrain from actions contrary to that objective and to the relevant existing treaties in the interest of maintaining international peace and security and promoting international cooperation; 5. Reiterates that the Conference on Disarmament, as the sole multilateral disarmament negotiating forum, has the primary role in the negotiation of a multilateral agreement or agreements, as appropriate, on the prevention of an arms race in outer space in all its aspects; 6. Invites the Conference on Disarmament to establish a working group under its agenda item entitled “Prevention of an arms race in outer space” as early as possible during its 2015 session; 7. Recognizes, in this respect, the growing convergence of views on the elaboration of measures designed to strengthen transparency, confidence and security in the peaceful uses of outer space; 8. Urges States conducting activities in outer space, as well as States interested in conducting such activities, to keep the Conference on Disarmament informed of the progress of bilateral and multilateral negotiations on the matter, if any, so as to facilitate its work; 9. Decides to include in the provisional agenda of its seventieth session the item entitled “Prevention of an arms race in outer space”. 4 See CD/1839 and CD/1985. 3/3",10/23/2014,2014_781656,Central African Republic,N/A,yes
2014,General Assembly,First Committee,Sixty-ninth session,96 (p),General and complete disarmament: the Arms Trade Treaty,"Angola, Australia, Austria, Benin, Bulgaria, Burkina Faso, Central African Republic, Colombia, Congo, Costa Rica, Céte d’Ivoire, Croatia, Cyprus, Czech Republic, Democratic Republic of the Congo, Denmark, El Salvador, Estonia, Finland, France, Gabon, Georgia, Germany, Ghana, Greece, Guatemala, Guyana, Honduras, Ireland, Italy, Jamaica, Japan, Latvia, Lithuania, Luxembourg, Malawi, Mali, Mexico, Montenegro, Namibia, Netherlands, Nigeria, Norway, Peru, Philippines, Poland, Portugal, Saint Vincent and the Grenadines, Senegal, Serbia, Sierra Leone, Slovakia, Slovenia, South Africa, Spain, Suriname, Sweden, Switzerland, Thailand, Togo, Trinidad and Tobago, Ukraine, United Kingdom of Great Britain and Northern Ireland and Vanuatu:",N/A,The Arms Trade Treaty,"The General Assembly, Recalling its resolutions 61/89 of 6 December 2006, 63/240 of 24 December 2008, 64/48 of 2 December 2009, 67/234 A of 24 December 2012, 67/234 B of 2 April 2013 and 68/31 of 5 December 2013, and its decision 66/518 of 2 December 2011, 1. Welcomes the 54 ratifications of the Arms Trade Treaty! to date and its forthcoming entry into force on 24 December 2014; 2. Also welcomes the offer by Mexico to host the first Conference of States Parties to the Treaty in 2015; 3. Calls upon all States that have not yet done so to sign and, thereafter, according to their respective constitutional processes, ratify, accept or approve the Treaty at the earliest possible date; 4. Calls upon those States in a position to do so to provide technical and/or financial assistance to requesting States in order to promote the universalization and effective implementation of the Treaty; 5. Decides to remain seized of the matter. 2 Y ~ >) s ba 7) an Ss =~ — ! See resolution 67/234 B. 14-63318 (E) 271014 {AMI MO IO",10/24/2014,2014_781835,Central African Republic,N/A,yes
2014,General Assembly,First Committee,Sixty-ninth session,96 (p),General and complete disarmament:the Arms Trade Treaty,"Angola, Australia, Austria, Benin, Bulgaria, Burkina Faso, Central African Republic, Colombia, Congo, Costa Rica, Céte d’Ivoire, Croatia, Cyprus, Czech Republic, Democratic Republic of the Congo, Denmark, El Salvador, Estonia, Finland, France, Gabon, Georgia, Germany, Ghana, Greece, Guatemala, Guyana, Honduras, Ireland, Italy, Jamaica, Japan, Latvia, Lithuania, Luxembourg, Malawi, Mali, Mexico, Montenegro, Namibia, Netherlands, Nigeria, Norway, Peru, Philippines, Poland, Portugal, Saint Vincent and the Grenadines, Senegal, Serbia, Sierra Leone, Slovakia, Slovenia, South Africa, Spain, Suriname, Sweden, Switzerland, Thailand, Togo, Trinidad and Tobago, Ukraine, United Kingdom of Great Britain and Northern Ireland and Vanuatu",N/A,The Arms Trade Treaty,"The General Assembly, Recalling its resolutions 61/89 of 6 December 2006, 63/240 of 24 December 2008, 64/48 of 2 December 2009, 67/234 A of 24 December 2012, 67/234 B of 2 April 2013 and 68/31 of 5 December 2013, and its decision 66/518 of 2 December 2011, 1. Welcomes the 53 ratifications of the Arms Trade Treaty! to date and its forthcoming entry into force on 24 December 2014; 2. Also welcomes the offer by Mexico to host the first Conference of States Parties to the Treaty in 2015; 3. Calls upon all States that have not yet done so to sign and, thereafter, according to their respective constitutional processes, ratify, accept or approve the Treaty at the earliest possible date; 4. Calls upon those States in a position to do so to provide technical and/or financial assistance to requesting States in order to promote the universalization and effective implementation of the Treaty; 5. Decides to remain seized of the matter. i Cee Please recycle OO ! See resolution 67/234 B. 14-62864 (E) 201014 CNY A TA A",10/17/2014,2014_781836,Central African Republic,N/A,yes
