year,Council,Committee,Session,Agenda item,Agenda detail,cosponsored countries,body title number,body title detail,body text,date,file,filecountry,footnote,scanned
2008,Economic And Social Council,Commission On Human Rights,Ninth session,3,"PROMOTION AND PROTECTION OF ALL HUMAN RIGHTS, CIVIL, POLITICAL, ECONOMIC, SOCIAL AND CULTURAL RIGHTS, INCLUDING THE RIGHT TO DEVELOPMENT","Algeria*, Angola, Austria*, Azerbaijan, Bahrain, Bangladesh, Belarus*, Belgium”, Bolivia, Bosnia and Herzegovina, Bostwana*, Burkina Faso, Cameroon, Chad*, Congo*, Croatia*, Cuba, Cyprus*, Democratic People’s Republic of Korea*, Democratic Republic of the Congo*, Djibouti, Finland*, France, Gabon, Germany, Greece*, Guatemala*, Guinea*, Haiti*, Honduras*, Iran (Islamic Republic of)*, Ireland*, Italy, Kenya*, Lesotho*, Luxembourg*, Libyan Arab Jamahiriya*, Madagascar, Malaysia, Mauritania*, Mexico, Monaco*, Morocco*, Mozambique*, Nepal*, Netherlands, Nicaragua, Norway“, Palestine*, Panama‘, Peru*, Philippines, Portugal*, Qatar, Saudi Arabia, Singapore*, Slovenia, Sri Lanka*, Sudan*, Switzerland, Syrian Arab Republic*, the former Yugoslav Republic of Macedonia*, Turkey*, Uganda*, Uruguay, Venezuela (Bolivarian Republic of)*, Viet Nam*, Zambia*, Zimbabwe*",N/A,9/.... Follow-up to the seventh special session of the Human Rights Council on the negative impact of the worsening of the world food crisis on the realization of the right to food for all,"The Human Rights Council, Reaffirming all previous resolutions and decisions on the right to food adopted in the framework of the United Nations, in particular Council resolution S-7/1 of 22 May 2008, Recalling the United Nations Millennium Declaration, in particular the first Millennium Development Goal of eradicating hunger and extreme poverty by 2015, Noting the outcome of the High-level Conference on World Food Security: the Challenges of Climate Change and Bioenergy, held from 3 to 5 June 2008, in Rome, Resolved to act to ensure that the human rights perspective is taken into account at the national, regional and international levels in measures to address the current world food crisis, Welcoming the holding of the panel discussion entitled “The human right to food and the global food crisis: root causes and responses”, held in New York, on 29 August 2008, Acknowledging the task force established by the Secretary-General, and supporting the Secretary-General to continue his efforts in this regard, Recognizing the complex character of the current global food crisis, as a combination of several major factors, both structural and conjunctural, also impacted negatively by, inter alia, environmental degradation, drought and desertification, global climate change, natural disasters and the lack of the necessary technology, and recognizing also that a strong commitment from national Governments and the international community as a whole is required to confront the major threats to food security, 1. Acknowledges with appreciation the report of the Special Rapporteur on the right to food (A/HRC/9/23), and takes note of his recommendations; 2. Expresses grave concern at the fact that the current world food crisis still seriously undermines the realization of the right to food for all, and especially for one sixth of the world population, mainly in developing and least developed countries, suffering from hunger, malnutrition and food insecurity; 3. Encourages States to mainstream the human rights perspective in building and reviewing their national strategies for the realization of the right to adequate food for all, which could include, inter alia, the mapping of the food insecure, the adoption of relevant legislation and policies with a right to food framework, the establishment of mechanisms to ensure accountability so that rights-holders are able to claim their right to food, and the establishment of mechanisms and processes which ensure participation of rights-holders, particularly the most vulnerable, in the design and monitoring of such legislation and policies; 4. Also encourages all States to invest or promote investment in agriculture and rural infrastructure in a manner that empowers the most vulnerable and affected by the current crisis in order to ensure their realization of the right to food; 5. Calls upon States, individually and through international cooperation and assistance, relevant multilateral institutions and other relevant stakeholders, to take all necessary measures to ensure the realization of the right to food as an essential human rights objective, and to consider reviewing any policy or measure that could have a negative impact on the realization of the right to food, particularly the right of everyone to be free from hunger, before instituting such a policy or measure; 6. Stresses that States have a primary obligation to make their best efforts to meet the vital food needs of their own populations, especially of vulnerable groups and households, such as by enhancing programmes to combat mother-child malnutrition, and to increase local production for this purpose, while the international community should provide, through a coordinated response and upon request, support for national and regional efforts by providing the necessary assistance for increasing food production, particularly through agricultural development assistance, the transfer of technology, food crop rehabilitation assistance and food aid, with a special focus on the gender-sensitive dimension; 7. Encourages all relevant international organizations and agencies to bring to their studies, research, reports and resolutions on the issue of food security a human rights perspective and the need for the realization of the right to food for all; 8. Requests the Special Rapporteur on the right to food to continue the promotion of the right to food and the follow-up to the current world food crisis in all relevant forums, especially in the framework of the United Nations and all the relevant international organizations and agencies of the United Nations system, in order to contribute to identifying means to implement the right to food; 9. Also requests the Special Rapporteur to report on the implementation of the present resolution to the Council at its twelfth session, including on the progress made and obstacles encountered in relation with the implementation at the national level of the measures and best practices adopted by States to respond to the global food crisis; 10. Requests the United Nations High Commissioner for Human Rights to bring the present resolution to the attention of all relevant international organizations and agencies; 11. Decides to remain seized of the implementation of the present resolution.",09/19/2008,2008_637725,Chad,* Non-member State of the Human Rights Council.,yes
2008,General Assembly,First Committee,Sixty-third session,89 (e),General and complete disarmament: consolidation of peace through practical disarmament measures,"Afghanistan, Albania, Angola, Argentina, Australia, Austria, Bangladesh, Belgium, Bosnia and Herzegovina, Bulgaria, Canada, Chad, Chile, Comoros, Congo, Costa Rica, Céte d’Ivoire, Croatia, Cyprus, Czech Republic, Denmark, Dominican Republic, El Salvador, Estonia, Ethiopia, Finland, France, Gabon, Germany, Ghana, Greece, Guatemala, Guinea, Haiti, Hungary, Iraq, Ireland, Israel, Italy, Jamaica, Kazakhstan, Kenya, Latvia, Liberia, Liechtenstein, Lithuania, Luxembourg, Madagascar, Micronesia (Federated States of), Monaco, Netherlands, New Zealand, Nicaragua, Niger, Nigeria, Norway, Panama, Paraguay, Peru, Philippines, Poland, Portugal, Republic of Korea, Romania, Russian Federation, Senegal, Serbia, Singapore, Slovakia, Slovenia, South Africa, Spain, Sweden, Switzerland, the former Yugoslav Republic of Macedonia, Timor-Leste, Trinidad and Tobago, Turkey, Ukraine, United Kingdom of Great Britain and Northern Ireland, United Republic of Tanzania, Uzbekistan and Vanuatu",N/A,Consolidation of peace through practical disarmament measures,"The General Assembly, Recalling its resolutions 51/45 N of 10 December 1996, 52/38 G of 9 December 1997, 53/77 M of 4 December 1998, 54/54 H of 1 December 1999, 55/33 G of 20 November 2000, 56/24 P of 29 November 2001 and 57/81 of 22 November 2002, its decision 58/519 of 8 December 2003 as well as its resolutions 59/82 of 3 December 2004 and 61/76 of 6 December 2006 entitled “Consolidation of peace through practical disarmament measures”, Convinced that a comprehensive and integrated approach towards certain practical disarmament measures often is a prerequisite to maintaining and consolidating peace and security and thus provides a basis for effective post-conflict peacebuilding; such measures include collection and responsible disposal, preferably through destruction, of weapons obtained through illicit trafficking or illicit manufacture as well as of weapons and ammunition declared by competent national authorities to be surplus to requirements, particularly with regard to small arms and light weapons, unless another form of disposition or use has been officially authorized and provided that such weapons have been duly marked and 08-55715 HI 221008 AR A AA registered; confidence-building measures; disarmament, demobilization and reintegration of former combatants; demining; and conversion, Noting with satisfaction that the international community is more than ever aware of the importance of such practical disarmament measures, especially with regard to the growing problems arising from the excessive accumulation and uncontrolled spread of small arms and light weapons, including their ammunition, which pose a threat to peace and security and reduce the prospects for economic development in many regions, particularly in post-conflict situations, Stressing that further efforts are needed in order to develop and effectively implement programmes of practical disarmament in affected areas as part of disarmament, demobilization and reintegration measures so as to complement, on a case-by-case basis, peacekeeping and peacebuilding efforts, Taking note with appreciation of the report of the Secretary-General on prevention of armed conflict,! which, inter alia, refers to the role which the proliferation and the illicit transfer of small arms and light weapons play in the context of the build-up and sustaining of conflicts, Taking note of the statement by the President of the Security Council of 31 August 20012 underlining the importance of practical disarmament measures in the context of armed conflicts, and, with regard to disarmament, demobilization and reintegration programmes, emphasizing the importance of measures to contain the security risks stemming from the use of illicit small arms and light weapons, Taking note also of the report of the Secretary-General prepared with the assistance of the Group of Governmental Experts on Small Arms? and, in particular, the recommendations contained therein, as an important contribution to the consolidation of the peace process through practical disarmament measures, Welcoming the work of the United Nations Coordinating Action on Small Arms mechanism, which was established by the Secretary-General to bring about a holistic and multidisciplinary approach to this complex and multifaceted global problem, Welcoming also the establishment, within the United Nations system, of the Programme of Action Implementation Support System, which provides a comprehensive tool to facilitate international cooperation and assistance for the implementation of practical disarmament measures, including the matching of assistance needs with available resources, Welcoming further the reports of the First, Second and Third Biennial Meetings of States to Consider the Implementation of the Programme of Action to Prevent, Combat and Eradicate the Illicit Trade in Small Arms and Light Weapons in All Its Aspects, held in New York from 7 to 11 July 2003,4 from 11 to 15 July 2005,° and from 14 to 18 July 2008,° 2 §/PRST/2001/21; see Resolutions and Decisions of the Security Council, 1 January 2001- 31 July 2002. A/C.1/63/L.36 1. Stresses the particular relevance of the “Guidelines on conventional arms control/limitation and disarmament, with particular emphasis on consolidation of peace in the context of General Assembly resolution 51/45 N”,” adopted by the Disarmament Commission by consensus at its 1999 substantive session;’ 2. Takes note of the report of the Secretary-General on the consolidation of peace through practical disarmament measures, submitted pursuant to resolution 61/76 of 6 December 2006,® and once again encourages Member States as well as regional arrangements and agencies to lend their support to the implementation of recommendations contained therein; 3. Emphasizes the importance of including in United Nations-mandated peacekeeping missions, as appropriate and with the consent of the host State, practical disarmament measures aimed at addressing the problem of the illicit trade in small arms and light weapons in conjunction with disarmament, demobilization and reintegration programmes aimed at former combatants, with a view to promoting an integrated comprehensive and effective weapons management strategy that would contribute to a sustainable peacebuilding process; 4. Welcomes the activities undertaken by the Group of Interested States, and invites the Group to continue to promote, on the basis of lessons learned from previous disarmament and peacebuilding projects, new practical disarmament measures to consolidate peace, especially as undertaken or designed by affected States themselves, regional and subregional organizations as well as United Nations agencies; 5. Encourages Member States, also in the framework of the Group of Interested States, to continue to lend their support to the Secretary-General, relevant international, regional and subregional organizations, in accordance with Chapter VIII of the Charter of the United Nations, and non-governmental organizations in responding to requests by Member States to collect and destroy small arms and light weapons, including their ammunition, in post-conflict situations; 6. | Welcomes the synergies within the multi-stakeholder process, including Governments, the United Nations system, regional and subregional organizations and institutions as well as non-governmental organizations in support of practical disarmament measures and the Programme of Action to Prevent, Combat and Eradicate the Illicit Trade in Small Arms and Light Weapons in All Its Aspects;9 7. Requests the Secretary-General to submit to the General Assembly at its sixty-fifth session a report on the implementation of practical disarmament measures, taking into consideration the activities of the Group of Interested States in this regard; 8. Decides to include in the provisional agenda of its sixty-fifth session the item entitled “Consolidation of peace through practical disarmament measures”. 7 Official Records of the General Assembly, Fifty-fourth Session, Supplement No. 42 (A/54/42), annex III. 9 See Report of the United Nations Conference on the Illicit Trade in Small Arms and Light Weapons in All Its Aspects, New York, 9-20 July 2001 (A/CONF.192/15), chap. IV, para. 24.",10/17/2008,2008_639843,Chad,N/A,yes
2008,General Assembly,First Committee,Sixty-third session,90 (g),Review and implementation of the Concluding Document of the Twelfth Special Session of the General Assembly: regional confidence-building measures: activities of the United Nations Standing Advisory Committee on Security Questions in Central Africa,"Angola, Benin, Burundi, Cameroon, Central African Republic, Chad, Congo, Democratic Republic of the Congo, Equatorial Guinea, Gabon, Liberia, Rwanda, Sao Tome and Principe, Sierra Leone and Zimbabwe",N/A,Regional confidence-building measures: activities of the United Nations Standing Advisory Committee on Security Questions in Central Africa,"The General Assembly, Recalling its previous relevant resolutions, in particular resolution 62/53 of 5 December 2007, Recalling also the guidelines for general and complete disarmament adopted at its tenth special session, the first special session devoted to disarmament, Bearing in mind the establishment by the Secretary-General on 28 May 1992 of the United Nations Standing Advisory Committee on Security Questions in Central Africa, the purpose of which is to encourage arms limitation, disarmament, non-proliferation and development in the subregion, Convinced that the resources released by disarmament, including regional disarmament, can be devoted to economic and social development and to the protection of the environment for the benefit of all peoples, in particular those of the developing countries, Considering the importance and effectiveness of confidence-building measures taken on the initiative and with the participation of all States concerned and taking into account the specific characteristics of each region, since such measures can contribute to regional stability and to international peace and security, 08-55859 HI UN A i Convinced that development can be achieved only in a climate of peace, security and mutual confidence both within and among States, Recalling the Brazzaville Declaration on Cooperation for Peace and Security in Central Africa,! the Bata Declaration for the Promotion of Lasting Democracy, Peace and Development in Central Africa? and the Yaoundé Declaration on Peace, Security and Stability in Central Africa, Bearing in mind resolutions 1196 (1998) and 1197 (1998), adopted by the Security Council on 16 and 18 September 1998 respectively, following its consideration of the report of the Secretary-General on the causes of conflict and the promotion of durable peace and sustainable development in Africa,* Emphasizing the need to strengthen the capacity for conflict prevention and peacekeeping in Africa and welcoming the partnership established between the United Nations and the Economic Community of Central African States for that purpose, 1. Reaffirms its support for efforts aimed at promoting confidence-building measures at the regional and subregional levels in order to ease tensions and conflicts in Central Africa and to further peace, stability and sustainable development in the subregion; 2. Reaffirms the importance of disarmament, demobilization and reintegration programmes, and encourages the United Nations Peacebuilding Commission to support efforts for the political stabilization and reconstruction of post-conflict countries; 3. Welcomes the significant progress made by the States members of the United Nations Standing Advisory Committee on Security Questions in Central Africa, under the “Sao Tome Initiative”, with respect to the ing of a legal instrument on the control of small arms and light weapons in Central Africa and of a code of conduct for defence and security forces in Central Africa, in particular the decision by the twenty-seventh ministerial meeting of the Standing Advisory Committee, held in Luanda from 13 to 15 May 2008, to complete the process of ing the code of conduct with a view to its possible adoption during the twenty- eighth ministerial meeting and the decision to examine during the same meeting a text containing elements drawn from relevant legal instruments on small arms and light weapons, and encourages interested countries to provide their financial support for the implementation of these two projects; 4. Encourages the States members of the Standing Advisory Committee to continue their efforts to promote peace and security in their subregion; 5. Also encourages the States members of the Standing Advisory Committee to continue their efforts to render the early-warning mechanism for Central Africa fully operational as an instrument for analysing and monitoring the political situation in the subregion within the framework of the prevention of crises and armed conflicts, and requests the Secretary-General to provide the necessary assistance for its smooth functioning; 2 A/53/258-S/1998/763, annex II, appendix I. 3 A/53/868-S/1999/303, annex II. A/C.1/63/L.46 6. Emphasizes the importance of providing the States members of the Standing Advisory Committee with the essential support they need to carry out the full programme of activities which they adopted at their ministerial meetings; 7. Appeals to the international community to support the efforts undertaken by the States concerned to implement disarmament, demobilization and reintegration programmes; 8. Requests the Secretary-General and the Office of the United Nations High Commissioner for Refugees to continue their assistance to the countries of Central Africa in tackling the problems of refugees and displaced persons in their territories; 9. Requests the Secretary-General and the United Nations High Commissioner for Human Rights to continue to provide their full assistance for the proper functioning of the Subregional Centre for Human Rights and Democracy in Central Africa; 10. Urges Member States and intergovernmental and non-governmental organizations to support the activities of the Standing Advisory Committee effectively through voluntary contributions to the Trust Fund for the United Nations Standing Advisory Committee on Security Questions in Central Africa; 11. Requests the Secretary-General to continue to support the ongoing efforts of the States members of the Standing Advisory Committee, including through provision of the assistance needed to ensure the success of their regular biannual meetings; 12. Calls upon the Secretary-General to submit to the General Assembly at its sixty-fourth session a report on the implementation of the present resolution; 13. Decides to include in the provisional agenda of its sixty-fourth session the item entitled “Regional confidence-building measures: activities of the United Nations Standing Advisory Committee on Security Questions in Central Africa”. 08-55859",10/20/2008,2008_639847,Chad,N/A,yes
2008,General Assembly,Third Committee,Sixty-third session,64 (b),"Promotion and protection of human rights: human rights questions, including alternative approaches for improving the effective enjoyment of human rights and fundamental freedoms","Algeria, Angola, Benin, Burkina Faso, Burundi, Cameroon, Central African Republic, Chad, Congo, Céte d’Ivoire, Democratic Republic of the Congo, Egypt, Equatorial Guinea, Gabon, Ghana, Guinea, Kenya, Madagascar, Mali, Rwanda, Sao Tome and Principe, Senegal and Swaziland",N/A,Subregional Centre for Human Rights and Democracy in Central Africa,"The General Assembly, Recalling its resolution 55/105 of 4 December 2000 concerning regional arrangements for the promotion and protection of human rights, Recalling also its resolutions 55/34 B of 20 November 2000 and 55/233 of 23 December 2000, section III of its resolution 55/234 of 23 December 2000, resolution 56/253 of 24 December 2001, and its resolutions 58/176 of 22 December 2003, 59/183 of 20 December 2004, 60/151 of 16 December 2005, 61/158 of 19 December 2006 and 62/221 of 22 December 2007 on the Subregional Centre for Human Rights and Democracy in Central Africa, Recalling further that the World Conference on Human Rights recommended that more resources be made available for the strengthening of regional arrangements for the promotion and protection of human rights under the programme of technical cooperation in the field of human rights of the Office of the United Nations High Commissioner for Human Rights, ! Recalling the report of the High Commissioner, 2 1 See A/CONF.157/24 (Part I), chap. III. 2 Official Records of the General Assembly, Fifty-sixth Session, Supplement No. 36, addendum (A/56/36/Add.1). 0511 08-58205 HN 08 AR AA Taking note of the holding of the twenty-seventh ministerial meeting of the United Nations Standing Advisory Committee on Security Questions in Central Africa, in Luanda from 13 to 15 May 2008, Taking note also of the report of the Secretary-General,* Welcoming the 2005 World Summit Outcome,‘+ in particular the decision confirmed therein to double the regular budget of the Office of the High Commissioner over the next five years, 1. | Welcomes the activities of the Subregional Centre for Human Rights and Democracy in Central Africa at Yaoundé; 2. Notes with satisfaction the support provided for the establishment of the Centre by the host country; 3. Takes note of the implementation of the new three-year strategy for the Centre, which aims to reinforce its activities;° 4. Notes the efforts of the Secretary-General and the United Nations High Commissioner for Human Rights to ensure the full implementation of the relevant resolutions of the General Assembly® in order to provide sufficient funds and human resources for the Centre’s missions; 5. | Requests the Secretary-General and the High Commissioner to continue to provide additional funds and human resources within the existing resources of the Office of the United Nations High Commissioner for Human Rights to enable the Centre to respond positively and effectively to the growing needs in the promotion and protection of human rights and in developing a culture of democracy and the rule of law in the Central African subregion; 6. | Requests the Secretary-General to submit to the General Assembly at its sixty-fourth session a report on the implementation of the present resolution. 3 A/63/367.",10/31/2008,2008_640823,Chad,N/A,yes
