year,Council,Committee,Session,Agenda item,Agenda detail,cosponsored countries,body title number,body title detail,body text,date,file,filecountry,footnote,scanned
2007,General Assembly,Third Committee,Sixty-second session,70 (e),Promotion and protection of human rights: Convention on the Rights of Persons with Disabilities,"Angola, Antigua and Barbuda, Argentina, Armenia, Austria, Belgium, Bolivia, Bosnia and Herzegovina, Botswana, Bulgaria, Cameroon, Canada, Cape Verde, Chile, Congo, Costa Rica, Cote d’Ivoire, Croatia, Czech Republic, Denmark, Dominican Republic, Ecuador, El Salvador, Estonia, Finland, France, Germany, Greece, Guatemala, Honduras, Hungary, Iceland, Ireland, Israel, Italy, Jamaica, Japan, Jordan, Latvia, Liberia, Lithuania, Mauritius, Mexico, Moldova, Montenegro, Morocco, Namibia, Netherlands, New Zealand, Nicaragua, Nigeria, Panama, Paraguay, Philippines, Poland, Portugal, Republic of Korea, Romania, San Marino, Senegal, Serbia, Sierra Leone, Slovakia, Slovenia, South Africa, Spain, Sweden, the former Yugoslav Republic of Macedonia, Trinidad and Tobago, Tunisia, Turkey, Uganda, United Kingdom of Great Britain and Northern Ireland and Uruguay",N/A,Convention on the Rights of Persons with Disabilities and its Optional Protocol,"The General Assembly, Recalling its previous relevant resolutions, the most recent of which was resolution 61/106 of 13 December 2006, as well as relevant resolutions of the Commission for Social Development and the Commission on Human Rights, 1. | Welcomes the adoption of the Convention on the Rights of Persons with Disabilities! and its Optional Protocol on 13 December 2006,2 and expresses the hope that they will enter into force at an early date; 2. Also welcomes the fact that since the opening for signature of the Convention and Optional Protocol on 30 March 2007, one hundred and eighteen States have already signed and seven States have ratified the Convention and sixty- seven States have signed and three States have ratified the Optional Protocol, and 1 Resolution 61/106, annex I. 2 Tbid., annex II. 07-58983 HN 091107 ARO A A A calls upon those States which have not yet done so to consider signing and ratifying the Convention and the Optional Protocol as a matter of priority; 3. Invites the Secretary-General to intensify efforts to assist States to become parties to the Convention and its Optional Protocol, including through providing assistance with a view to achieving universal adherence; 4. Requests the Secretary-General to provide the staff and facilities necessary to support the effective performance of the functions of the Conference of States Parties and also to foresee all the necessary requirements for the installation and functioning of the Committee under the Convention and the Optional Protocol after the entry into force of the Convention, as well as for the dissemination of information on the Convention and the Optional Protocol; 5. Also requests the Secretary-General to continue the progressive implementation of standards and guidelines for the accessibility of facilities and services of the United Nations system, taking into account relevant provisions of the Convention, in particular when undertaking renovations; 6. Requests United Nations agencies and organizations, and invites intergovernmental and non-governmental organizations, to continue undertaking efforts to disseminate accessible information on the Convention and the Optional Protocol, to promote their understanding, to prepare for their entry into force and to assist States parties in implementing their obligations under these instruments; 7. Requests the Secretary-General to submit to the General Assembly at its sixty-third session a report on the status of the Convention and the Optional Protocol and the implementation of the present resolution. 07-58983",11/08/2007,2007_611363,Costa Rica,N/A,yes
2007,General Assembly,N/A,Sixty-second session,12,Support by the United Nations system of the efforts of Governments to promote and consolidate new or restored democracies,"Egypt, Iceland, Mongolia, Oman, Panama, Qatar, Romania, Turkey and Uruguay",N/A,Support by the United Nations system of the efforts of Governments to promote and consolidate new or restored democracies,"Addendum Add the following countries to the list of sponsors of the resolution: Albania, Argentina, Armenia, Austria, Bahamas, Bahrain, Belgium, Bosnia and Herzegovina, Brazil, Bulgaria, Cambodia, Cape Verde, Comoros, Costa Rica, Cyprus, Czech Republic, Democratic Republic of the Congo, El Salvador, Estonia, Finland, Germany, Greece, Guatemala, Haiti, Hungary, Iraq, Ireland, Japan, Kuwait, Kyrgyzstan, Latvia, Libyan Arab Jamahiriya, Lithuania, Luxembourg, Madagascar, Maldives, Mali, Moldova, Monaco, Montenegro, Morocco, Netherlands, Philippines, Poland, Portugal, Republic of Korea, San Marino, Saudi Arabia, Serbia, Slovakia, Slovenia, Spain, Sweden, Thailand, Ukraine, United Arab Emirates, United Kingdom of Great Britain and Northern Ireland and Yemen 07-58995 HN 091107 ARCO A A A",11/08/2007,2007_611379,Costa Rica,N/A,yes
2007,General Assembly,Third Committee,Sixty-second session,69,Right of peoples to self-determination,"Afghanistan, Albania, Algeria, Angola, Armenia, Austria, Azerbaijan, Bahrain, Bangladesh, Barbados, Belarus, Belize, Benin, Bosnia and Herzegovina, Botswana, Brazil, Brunei Darussalam, Burkina Faso, Burundi, Cape Verde, China, Comoros, Congo, Costa Rica, Cote d’Ivoire, Cuba, Cyprus, Democratic People’s Republic of Korea, Democratic Republic of the Congo, Djibouti, Ecuador, Egypt, Eritrea, Finland, France, Gabon, Gambia, Greece, Guinea, Guinea-Bissau, Guyana, Hungary, Iceland, India, Indonesia, Iraq, Ireland, Jamaica, Jordan, Kenya, Kuwait, Lao People’s Democratic Republic, Lebanon, Lesotho, Liberia, Libyan Arab Jamahiriya, Lithuania, Madagascar, Malaysia, Maldives, Mali, Mauritania, Morocco, Myanmar, Namibia, New Zealand, Nicaragua, Niger, Nigeria, Norway, Oman, Pakistan, Poland, Portugal, Qatar, Romania, Saint Lucia, Saint Vincent and Grenadines, Saudi Arabia, Senegal, Sierra Leone, South Africa, Sri Lanka, Sudan, Sweden, Switzerland, Togo, Tunisia, Turkey, United Arab Emirates, Uzbekistan, Venezuela (Bolivarian Republic of), Viet Nam, Yemen, Zambia, Zimbabwe and Palestine",N/A,The right of the Palestinian people to self-determination,"The General Assembly, Aware that the development of friendly relations among nations, based on respect for the principle of equal rights and self-determination of peoples, is among the purposes and principles of the United Nations, as defined in the Charter, Recalling, in this regard, its resolution 2625 (XXV) of 24 October 1970 entitled “Declaration on Principles of International Law concerning Friendly Relations and Cooperation among States in accordance with the Charter of the United Nations”, Bearing in mind the International Covenants on Human Rights,! the Universal Declaration of Human Rights,? the Declaration on the Granting of Independence to 1 Resolution 2200 A (XXI), annex. 2 Resolution 217 A (III). 07-59147 i 121107 ART A Colonial Countries and Peoples? and the Vienna Declaration and Programme of Action adopted at the World Conference on Human Rights on 25 June 1993,4 Recalling the Declaration on the Occasion of the Fiftieth Anniversary of the United Nations,® Recalling also the United Nations Millennium Declaration, ® Recalling further the advisory opinion rendered on 9 July 2004 by the International Court of Justice on the Legal Consequences of the Construction of a Wall in the Occupied Palestinian Territory,’ and noting in particular the reply of the Court, including on the right of peoples to self-determination, which is a right erga omnes,® Recalling the conclusion of the Court, in its advisory opinion of 9 July 2004, that the construction of the wall by Israel, the occupying Power, in the Occupied Palestinian Territory, including East Jerusalem, along with measures previously taken, severely impedes the right of the Palestinian people to self-determination,? Expressing the urgent need for the resumption of negotiations within the Middle East peace process on its agreed basis and for the speedy achievement of a just, lasting and comprehensive peace settlement between the Palestinian and Israeli sides, Stressing the need for respect for and preservation of the territorial unity, contiguity and integrity of all of the Occupied Palestinian Territory, including East Jerusalem, Recalling its resolution 61/152 of 19 December 2006, Affirming the right of all States in the region to live in peace within secure and internationally recognized borders, 1. Reaffirms the right of the Palestinian people to self-determination, including the right to their independent State of Palestine; 2. Urges all States and the specialized agencies and organizations of the United Nations system to continue to support and assist the Palestinian people in the early realization of their right to self-determination. 3 Resolution 1514 (XV). 4 A/CONF.157/24 (Part I), chap. III. 5 See resolution 50/6. 8 Tbid., advisory opinion, para. 88. 9 Tbid., para. 122.",11/09/2007,2007_611482,Costa Rica,N/A,yes
2007,General Assembly,Third Committee,Sixty-second session,63,Advancement of women,"Afghanistan, Albania, Armenia, Austria, Belgium, Bosnia and Herzegovina, Bulgaria, Burundi, Cambodia, Chile, Costa Rica, Croatia, Cyprus, Czech Republic, Democratic Republic of the Congo, Denmark, Dominican Republic, Estonia, Finland, France, Georgia, Germany, Greece, Guatemala, Haiti, Hungary, Iceland, Indonesia, Iraq, Ireland, Italy, Japan, Latvia, Liberia, Lithuania, Luxembourg, Malta, Marshall Islands, Micronesia (Federated States of), Moldova, Monaco, Montenegro, Nauru, Netherlands, Norway, Palau, Panama, Poland, Portugal, Republic of Korea, Romania, Samoa, San Marino, Slovakia, Slovenia, Spain, Sweden, the former Yugoslav Republic of Macedonia, Timor-Leste, Turkey, United Kingdom of Great Britain and Northern Ireland, United States of America and Vanuatu",N/A,"Eliminating rape and other forms of sexual violence in all their manifestations, including as instruments to achieve political objectives","The General Assembly, Reaffirming the obligation of all States to promote and protect human rights and fundamental freedoms in accordance with the Charter of the United Nations, and guided by the purposes and principles of the Charter, Reaffirming also that discrimination on the basis of sex is contrary to the Convention on the Elimination of All Forms of Discrimination against Women! and other international human rights instruments and that its elimination is an integral part of efforts towards the elimination of all forms of violence against women, Reaffirming further the obligations of States parties to the Convention on the Rights of the Child,2 the Geneva Conventions of 19493 and their Additional 1 United Nations, Treaty Series, vol. 1249, No. 20378. 2 Ibid., vol. 1577, No. 27531. 3 Tbid., vol. 75, Nos. 970-973. 07-59506 i 131107 CAT RAO AA A Protocols¢ and the International Convention on the Elimination of All Forms of Racial Discrimination, ° Reaffirming the goals, objectives and commitments of the Beijing Declaration and Platform for Action® and those contained in the outcome document of the twenty-third special session of the General Assembly entitled “Women 2000: gender equality, development and peace for the twenty-first century”” with respect to sexual violence and to women in armed conflict, Recalling all previous General Assembly resolutions on violence against women and violence against children, including resolution 61/143 of 19 December 2006, on intensification of efforts to eliminate all forms of violence against women, and its other relevant resolutions, as well as Security Council resolutions 1325 (2000) of 31 October 2000, on women and peace and security, 1612 (2005) of 26 July 2005, on children affected by armed conflict, and 1674 (2006) of 28 April 2006, on the protection of civilians in armed conflict, the Economic and Social Council resolutions on women and on the girl child, Commission on Human Rights resolution 2005/41 of 19 April 2005, on the elimination of violence against women,® and Subcommission on the Promotion and Protection of Human Rights resolution 2001/20 of 16 August 2001, on systematic rape, sexual slavery and slavery-like practices, 9 Recalling also the inclusion of rape and other forms of gender-related crimes and crimes of sexual violence in the Rome Statute of the International Criminal Court, 1° Recalling further the recognition by the ad hoc international criminal tribunals that rape can constitute a war crime, a crime against humanity, or a constitutive act with respect to genocide, Welcoming the United Nations inter-agency initiative “Stop Rape Now: United Nations Action against Sexual Violence in Conflict”, Recognizing that violence against women is an offence against the dignity and integrity of the victim, which often inflicts serious physical and psychological harm, and that all forms of violence against women seriously violate and impair or nullify the enjoyment by women of all human rights and fundamental freedoms and constitute a major impediment to the ability of women to make use of their capabilities, Recognizing also that violence against women is rooted in historically unequal power relations between men and women, Recognizing further that violence against women impedes the social and economic development of communities and States, as well as the achievement of the 6 Report of the Fourth World Conference on Women, Beijing, 4-15 September 1995 (United Nations publication, Sales No. E.96.IV.13), chap. I, resolution 1, annexes I and II. 8 See Official Records of the Economic and Social Council, 2005, Supplement No. 3 and corrigendum (E/2005/23 and Corr.1), chap. II, sect. A. A/C.3/62/L.16/Rev.2 internationally agreed development goals, including the Millennium Development Goals, Expressing concern that civilians, particularly women and children, account for the vast majority of those adversely affected by armed conflict, including as refugees and internally displaced persons, and increasingly are targeted by combatants and armed elements, and recognizing the consequent impact this has on durable peace and reconciliation, Recognizing that States bear primary responsibility to respect and ensure the human rights of all individuals, including their own citizens, within their territory and as provided by relevant international law, Stressing that States have the obligation to promote and protect all human rights and fundamental freedoms of women and girls, and must exercise due diligence to prevent, investigate and punish the perpetrators of violence against women and girls, and to provide protection to the victims, and that failure to do so violates and impairs or nullifies the enjoyment of the human rights and fundamental freedoms of the victims, Strongly condemning all acts of violence against women and girls, whether these acts are perpetrated by persons acting on behalf of the State, by private persons, or by non-State actors, calling for the elimination of all forms of gender- based violence in the family, within the general community, and where perpetrated or condoned by the State, and stressing the need to treat all forms of violence against women and girls as a criminal offence, punishable by law, Stressing that rape or other forms of sexual violence must not be used or condoned in any circumstance by any individual, State or non-State actor, Recognizing that rape or any other form of sexual violence is unlawful in all circumstances and in all places, regardless of the sex or age of the victim, including in detention and in jails, whether or not in the course of an international or non-international armed conflict, or in areas under foreign occupation, Deeply concerned at rape and other forms of sexual violence in all their manifestations, which are typically committed against women and girls, and which when used to achieve political objectives often target victims associated with communities, ethnic groups or other groups regarded as antagonistic to or insufficiently supportive of the group or entity whose forces commit the crime, and are frequently calculated to humiliate, dominate, instil fear in, disperse and/or forcibly relocate members of such groups, including, but not limited to, the victims and their families, Deeply concerned also at reports of rape, including in the course of attempting to achieve political objectives, Affirming the need for States to ensure that perpetrators of rape or other forms of sexual violence committed on their territory do not operate with impunity and that the perpetrators of such acts are brought to justice as provided for by national law and obligations under international law, and also affirming the need to penalize persons in authority found guilty of sexually assaulting victims, A/C.3/62/L.16/Rev.2 Determined to bring an end to rape and other forms of sexual violence in all their manifestations, including when used as instruments to achieve political objectives, 1. Urges States to: (a) Take special measures to protect women and girls from gender-based violence, in particular rape and other forms of sexual violence; (b) End impunity by ensuring that all rape victims, particularly women and girls, have equal protection under the law and equal access to justice, and by investigating, prosecuting and punishing any person responsible for rape and other forms of sexual violence, including government officials, with full respect for international law, including international humanitarian law; (c) Provide victims with access to appropriate health care, including sexual and reproductive health care, psychological care, and trauma counselling, as well as to rehabilitation, social reintegration and, as appropriate, effective and sufficient compensation, in accordance with relevant international and national law; (d) Develop and implement at all levels, as required, a comprehensive and integrated strategy of prevention and prosecution of rape, which should include the training of, inter alia, all relevant government and military personnel, in particular military commanders, law enforcement officials, judicial system personnel, health workers, teachers and social workers, as well as community leaders and the news media, in all appropriate aspects of the prevention and prosecution of rape and other forms of sexual violence and of protection and support for victims of such violence; (e) Promote human rights education, including on all aspects of rape and other forms of sexual violence, ensuring factual accounts of such violence, in an effort to encourage better understanding among all peoples, with a view to the prevention and elimination of rape and other forms of sexual violence; (f) Increase significantly their voluntary financial support for activities related to preventing and eliminating all forms of violence against women, the empowerment of women and gender equality carried out by the specialized agencies and the United Nations funds and programmes, including the United Nations Trust Fund in Support of Actions to Eliminate Violence against Women; (g) Monitor the progress of their efforts to address rape, including through the regular collection, analysis and dissemination of data, and work towards overcoming the difficulties and challenges of collecting information on the practice; (h) Consider ratifying or acceding to all human rights treaties, including, as a matter of priority, the Convention on the Elimination of All Forms of Discrimination against Women’ and the Optional Protocol thereto; 11 2. Calls upon the United Nations system to: (a) Support efforts to address rape, including through the regular collection, analysis and dissemination of data, to facilitate such efforts and, in particular, to work towards overcoming the difficulties and challenges of collecting information on the practice; A/C.3/62/L.16/Rev.2 (b) Integrate to the maximum extent possible the needs of all victims of sexual violence into United Nations humanitarian assistance programmes; (c) Assign, within existing resources, adequate resources within the United Nations system to those bodies, specialized agencies, funds and programmes responsible for the promotion of gender equality and women’s rights and to efforts throughout the United Nations system to eliminate violence against women and girls; 3. Urges States, in cooperation with the private sector, non-governmental organizations and other civil society actors, as appropriate, to: (a) Conduct public education and awareness campaigns at the national and grass-roots levels in order to raise awareness about the causes and consequences of rape and other forms of sexual violence; (b) Establish reception centres and shelters for victims, take other appropriate measures to promote and protect women’s rights, and provide protection, safe shelter, medical assistance, including sexual and reproductive health care, all necessary medications, including antiretroviral drugs and antibiotics, counselling for victims and their families, comprehensive information and education, legal aid, rehabilitation, and reintegration of victims and their offspring into society, in cooperation with State efforts towards protecting and supporting victims, in particular appropriate compensation that is effective and sufficient, maintaining due confidentiality and privacy of the victims and their families; (c) Support programmes to eliminate rape and other forms of sexual violence in all their manifestations; (d) Address the long-term consequences faced by victims of rape and other forms of sexual violence, including legal discrimination and social stigmatization, as well as the effects on children born as a consequence; 4. Invites non-governmental organizations and other civil society actors to: (a) Advocate at the local, national, regional and international levels against rape and other forms of sexual violence, including as instruments to achieve political objectives, inter alia, through building and strengthening networks among those who may be in a position to provide information on its occurrence, and to call attention to its adverse consequences; (b) Increase coordination and cooperation in addressing this problem and continue to present their observations and conclusions to Governments; 5. | Requests the Secretary-General to report on the implementation of the present resolution to the sixty-third session of the General Assembly, including with respect to all situations in which rape or other forms of sexual violence are being used as instruments to achieve political objectives. 07-59506",11/12/2007,2007_611726,Costa Rica,N/A,yes
