year,Council,Committee,Session,Agenda item,Agenda detail,cosponsored countries,body title number,body title detail,body text,date,file,filecountry,footnote,scanned
2004,General Assembly,Second Committee,Fifty-ninth session,91,"Permanent sovereignty of the Palestinian people in the Occupied Palestinian Territory, including East Jerusalem, and of the Arab population in the occupied Syrian Golan over their natural resources","Algeria, Bahrain, Comoros, Djibouti, Egypt, Indonesia, Iraq, Jordan, Kuwait, Malaysia, Morocco, Oman, Qatar, Saudi Arabia, Somalia, Sudan, Tunisia, United Arab Emirates and Yemen",N/A,"Permanent sovereignty of the Palestinian people in the Occupied Palestinian Territory, including East Jerusalem, and of the Arab population in the occupied Syrian Golan over their natural resources","The General Assembly, Recalling its resolution 58/229 of 23 December 2003, and taking note of Economic and Social Council resolution 2004/54 of 23 July 2004, Recalling also its resolution 58/292 of 6 May 2004, Reaffirming the principle of the permanent sovereignty of peoples under foreign occupation over their natural resources, Guided by the principles of the Charter of the United Nations, affirming the inadmissibility of the acquisition of territory by force, and recalling relevant Security Council resolutions, including resolutions 242 (1967) of 22 November 1967, 465 (1980) of 1 March 1980 and 497 (1981) of 17 December 1981, Recalling its resolution 2625 (XXV) of 24 October 1970, Reaffirming the applicability of the Geneva Convention relative to the Protection of Civilian Persons in Time of War, of 12 August 1949, to the Occupied Palestinian Territory, including East Jerusalem, and other Arab territories occupied by Israel since 1967, 04-60825 (E) 161104 *0460825* Taking into account the advisory opinion rendered on 9 July 2004 by the International Court of Justice entitled “Legal Consequences of the Construction of a Wall in the Occupied Palestinian Territory”,! Expressing its concern at the exploitation by Israel, the occupying Power, of the natural resources of the Occupied Palestinian Territory, including East Jerusalem, and other Arab territories occupied by Israel since 1967, Expressing its concern also at the extensive destruction by Israel, the occupying Power, of agricultural land and orchards in the Occupied Palestinian Territory during the recent period, including the uprooting of a vast number of olive trees, Aware of the detrimental impact of the Israeli settlements on Palestinian and other Arab natural resources, especially as a result of the confiscation of land and the forced diversion of water resources, and of the dire economic and social consequences in this regard, Aware also of the detrimental impact on Palestinian natural resources being caused by the unlawful construction of the wall by Israel, the occupying Power, in the Occupied Palestinian Territory, including in and around East Jerusalem, and of its grave effect on the economic and social conditions of the Palestinian people, Reaffirming the need for the immediate resumption of negotiations within the Middle East peace process, on the basis of Security Council resolutions 242 (1967), 338 (1973) of 22 October 1973, 425 (1978) of 19 March 1978 and 1397 (2002) of 12 March 2002, the principle of land for peace and the Quartet performance-based road map to a permanent two-State solution to the Israeli-Palestinian conflict,? as endorsed by Security Council resolution 1515 (2003) of 19 November 2003, and for the achievement of a final settlement on all tracks, Recalling the need to end all acts of violence, including acts of terror, provocation, incitement and destruction, Taking note of the note by the Secretary-General transmitting the report prepared by the Economic and Social Commission for Western Asia on the economic and social repercussions of the Israeli occupation on the living conditions of the Palestinian people in the Occupied Palestinian Territory, including Jerusalem, and of the Arab population in the occupied Syrian Golan;3 1. Reaffirms the inalienable rights of the Palestinian people and the population of the occupied Syrian Golan over their natural resources, including land and water; 2. Calls upon lIsrael, the occupying Power, not to exploit, damage, cause loss or depletion of or endanger the natural resources in the Occupied Palestinian Territory, including East Jerusalem, and in the occupied Syrian Golan; 3. Recognizes the right of the Palestinian people to claim restitution as a result of any exploitation, damage, loss or depletion, or endangerment of their natural resources, and expresses the hope that this issue will be dealt with in the framework of the final status negotiations between the Palestinian and Israeli sides; 1 A/ES-10/273 and Corr.1. 2 See S/2003/529, annex. 3 A/59/89-E/2004/21. A/C.2/59/L.41 4. Requests the Secretary-General to report to it at its sixtieth session on the implementation of the present resolution, and decides to include in the agenda of its sixtieth session the item entitled “Permanent sovereignty of the Palestinian people in the Occupied Palestinian Territory, including East Jerusalem, and of the Arab population in the occupied Syrian Golan over their natural resources”.",11/15/2004,2004_535049,Djibouti,N/A,yes
2004,General Assembly,Third Committee,Fifty-ninth session,105 (b),"Human rights questions: human rights questions, including alternative approaches for improving the effective enjoyment of human rights and fundamental freedoms","Algeria, Bahrain, Bangladesh, China, Djibouti, Egypt, Indonesia, Iran (Islamic Republic of), Libyan Arab Jamahiriya, Malaysia, Mauritania, Morocco, Nigeria, Oman, Pakistan, Qatar, Saudi Arabia, Senegal, Sudan, Syrian Arab Republic, United Arab Emirates, United Republic of Tanzania and Zimbabwe: amendments",N/A,"Extrajudicial, summary or arbitrary executions","1. In the third preambular paragraph, replace the words “Mindful of” with “Noting”. 2. In operative paragraph 3, replace the words “mass murder, ethnic cleansing or genocide” with the words “crimes against humanity or genocide, as defined in the Convention on the Prevention and Punishment of the Crime of Genocide”. 3. In operative paragraph 7, replace the words “in which the death penalty has not been abolished” with the words “in order to prevent extrajudicial, summary or arbitrary executions”. 4. Replace operative paragraph 8 (c) with the following text: “Urges all Governments to undertake all necessary and possible measures to prevent the occurrence of extrajudicial, summary or arbitrary executions, including those occurring in custody;” 5. Replace operative paragraph 8 (e) with the following text: “Reaffirms the obligation of Governments to ensure the protection of the right to life of all persons under their jurisdiction, and calls upon Governments concerned to investigate promptly and thoroughly all cases of extrajudicial, summary or arbitrary executions, including for any discriminatory reasons, to bring those responsible to justice before a competent, independent and impartial judiciary and to ensure that such executions are neither condoned nor sanctioned by government officials or personnel;” 04-61367 (E) 181104 *0461367F* Replace operative paragraph 11 with the following text: “Takes note of the interim report of the Special Rapporteur to the General Assembly, while being mindful that reports should remain within the mandate of the Special Rapporteur;”",11/17/2004,2004_535172,Djibouti,N/A,yes
2004,General Assembly,Third Committee,Fifty-ninth session,105 (b),"Human rights questions: human rights questions, including alternative approaches for improving the effective enjoyment of human rights and fundamental freedoms","Algeria, Bahrain, Bangladesh, China, Djibouti, Egypt, Indonesia, Iran (Islamic Republic of), Libyan Arab Jamahiriya, Malaysia, Mauritania, Morocco, Nigeria, Oman, Pakistan, Qatar, Saudi Arabia, Senegal, Sudan, Syrian Arab Republic, United Arab Emirates, United Republic of Tanzania and Zimbabwe: amendments",N/A,"Extrajudicial, summary or arbitrary executions","1. In operative paragraph 7, replace the words “in which the death penalty has not been abolished” with the words “in order to prevent extrajudicial, summary or arbitrary executions”. 2. Replace operative paragraph 8 (c) with the following text: “Reaffirms the obligation of Governments to ensure the protection of the right to life of all persons under their jurisdiction, and calls upon Governments concerned to investigate promptly and thoroughly all cases of extrajudicial, summary or arbitrary executions, including for any discriminatory reasons, to bring those responsible to justice before a competent, independent and impartial judiciary and to ensure that such executions are neither condoned nor sanctioned by government officials or personnel”. 04-61373 (E) 181104 *0461373°*",11/17/2004,2004_535174,Djibouti,N/A,yes
2004,General Assembly,Third Committee,Fifty-ninth session,104,Right of peoples to self-determination,"Algeria, Armenia, Bahrain, Bangladesh, Barbados, Belize, Brunei Darussalam, Burkina Faso, Cape Verde, China, Comoros, Congo, Cuba, Democratic People’s Republic of Korea, Democratic Republic of the Congo, Djibouti, Ecuador, Egypt, Eritrea, Gambia, Guinea, Guinea-Bissau, Guyana, India, Indonesia, Iraq, Jordan, Kenya, Kuwait, Lao People’s Democratic Republic, Lebanon, Lesotho, Libyan Arab Jamahiriya, Malawi, Malaysia, Mali, Malta, Mauritania, Morocco, Namibia, Niger, Nigeria, Oman, Pakistan, Qatar, Saint Lucia, Saudi Arabia, Senegal, Somalia, South Africa, Sudan, Timor-Leste, Tunisia, Turkey, United Arab Emirates, Viet Nam, Yemen, Zambia, Zimbabwe and Palestine*: revised",N/A,The right of the Palestinian people to self-determination,"The General Assembly, Aware that the development of friendly relations among nations, based on respect for the principle of equal rights and self-determination of peoples, is among the purposes and principles of the United Nations, as defined in the Charter, Recalling in this regard its resolution 2625 (XXV) of 24 October 1970, entitled “Declaration on Principles of International Law concerning Friendly Relations and Cooperation among States in accordance with the Charter of the United Nations”, Bearing in mind the International Covenants on Human Rights,! the Universal Declaration of Human Rights,2 the Declaration on the Granting of Independence to Colonial Countries and Peoples3 and the Vienna Declaration and Programme of Action adopted at the World Conference on Human Rights on 25 June 1993,4 04-61821 (E) 221104 *0461821* Recalling the Declaration on the Occasion of the Fiftieth Anniversary of the United Nations,> Recalling also the United Nations Millennium Declaration,® Recalling further the advisory opinion rendered on 9 July 2004 by the International Court of Justice on the Legal Consequences of the Construction of a Wall in the Occupied Palestinian Territory,” and noting in particular the reply of the Court, including on the right of peoples to self-determination, which is a right erga omnes, Recalling the conclusion of the Court, in its advisory opinion of 9 July 2004, that the construction of the wall by Israel, the occupying Power, in the Occupied Palestinian Territory, including East Jerusalem, along with measures previously taken, severely impedes the right of the Palestinian people to self-determination. Expressing the urgent need for the resumption of negotiations within the Middle East peace process on its agreed basis and for the speedy achievement of a final settlement between the Palestinian and Israeli sides, Recalling its resolution 58/292 of 6 May 2004, Affirming the right of all States in the region to live in peace within secure and internationally recognized borders, 1. Reaffirms the right of the Palestinian people to self-determination, including the right to their independent State of Palestine; 2. Urges all States and the specialized agencies and organizations of the United Nations system to continue to support and assist the Palestinian people in the early realizationd of their right to self-determination. 5 See resolution 50/6. 6 See resolution 55/2. 7 See A/ES.10/273 and Corr.1.",11/19/2004,2004_535428,Djibouti,"* In accordance with General Assembly resolution 52/250. 1 Resolution 2200 A (XXI), annex.",yes
2004,General Assembly,Special Political And Decolonization Committee,Fifty-ninth session,76,Report of the Special Committee to Investigate Israeli Practices Affecting the Human Rights of the Palestinian,"Algeria, Bahrain, Bangladesh, Brunei Darussalam, Comoros, Cuba, Djibouti, Egypt, Guinea, Indonesia, Iraq, Jordan, Kuwait, Malaysia, Mali, Morocco, Namibia, Oman, Qatar, Saudi Arabia, Senegal, Somalia, Sudan, Tunisia, United Arab Emirates, Yemen and Palestine",N/A,"Israeli practices affecting the human rights of the Palestinian people in the Occupied Palestinian Territory, including East Jerusalem","The General Assembly, Recalling its relevant resolutions, including resolution 58/292 of 6 May 2004, as well as those adopted at its tenth emergency special session, Recalling also the relevant resolutions of the Commission on Human Rights, Bearing in mind the relevant resolutions of the Security Council, Having considered the report of the Special Committee to Investigate Israeli Practices Affecting the Human Rights of the Palestinian People and Other Arabs of the Occupied Territories! and the report of the Secretary-General,2 Taking note of the report of the Human Rights Inquiry Commission established by the Commission on Human Rights3 and the recent reports of the Special Rapporteur of the Commission on Human Rights on the situation of human rights in the Palestinian territories occupied by Israel since 1967,4 04-62072 (E) 221104 *0462072* Recalling the Advisory Opinion rendered on 9 July 2004 by the International Court of Justice,> and recalling also General Assembly resolution ES-10/15 of 20 July 2004, Noting in particular the Court’s reply, including that the construction of the wall by Israel, the occupying Power, in the Occupied Palestinian Territory, including in and around East Jerusalem, and its associated regime are contrary to international law, Recalling also the International Covenant on Civil and Political Rights,® the International Covenant on Economic, Social and Cultural Rights® and the Convention on the Rights of the Child” and the determination by the Court that these instruments are applicable in the Occupied Palestinian Territory, Aware of the responsibility of the international community to promote human rights and ensure respect for international law, and recalling in this regard its resolution 2625 (XXV) of 24 October 1970, Reaffirming the principle of the inadmissibility of the acquisition of territory by force, Reaffirming also the applicability of the Geneva Convention relative to Civilian Persons in Time of War, of 12 August 1949,8 to the Occupied Palestinian Territory, including East Jerusalem, and other Arab territories occupied by Israel since 1967, Reaffirming further the obligation of the States parties to the Fourth Geneva Convention® under articles 146, 147 and 148 with regard to penal sanctions, grave breaches and responsibilities of the High Contracting Parties, Stressing the need for full compliance with the Israeli-Palestinian agreements reached within the context of the Middle East peace process and the implementation of the Quartet road map to a permanent two-State solution to the Israeli-Palestinian conflict,® Concerned about the continuing systematic violation of the human rights of the Palestinian people by Israel, the occupying Power, including that arising from the excessive and indiscriminate use of force, the use of collective punishment, the reoccupation and closure of areas, the confiscation of land, the establishment and expansion of settlements, the construction of the wall inside the Occupied Palestinian Territory in departure from the Armistice Line of 1949, the destruction of property and all other actions by it designed to change the legal status, geographical nature and demographic composition of the Occupied Palestinian Territory, including East Jerusalem, Gravely concerned by the military actions that have been carried out since 28 September 2000 and that have led to thousands of deaths among Palestinian civilians, including hundreds of children, and tens of thousands of injuries, 8 United Nations, Treaty Series, vol. 75, No. 973. 9 S/2003/529, annex. A/C.4/59/L.17/Rev.1 Gravely concerned also by the use of suicide bombing attacks against Israeli civilians resulting in extensive loss of life and injury, Expressing deep concern about the extensive destruction caused by the Israeli occupying forces, including of religious, cultural and historical sites, of vital infrastructure and institutions of the Palestinian Authority, and of agricultural land throughout Palestinian cities, towns, villages and refugee camps, Expressing deep concern also about the Israeli policy of closure and the severe restrictions, including curfews, that continue to be imposed on the movement of persons and goods, including medical and humanitarian personnel and goods, throughout the Occupied Palestinian Territory, including East Jerusalem, and the consequent negative impact on the socio-economic situation of the Palestinian people, which remains that of a dire humanitarian crisis, Expressing concern that thousands of Palestinians continue to be held in Israeli prisons or detention centres under harsh conditions that impair their well-being, and also expressing concern about the ill-treatment and harassment of any Palestinian prisoners and all reports of torture, Convinced of the need for an international presence to monitor the situation, to contribute to ending the violence and protecting the Palestinian civilians and to help the parties to implement agreements reached, and, in this regard, recalls the positive contribution of the Temporary International Presence in Hebron, Stressing the necessity for the full implementation of all relevant Security Council resolutions, 1. Reiterates that all measures and actions taken by Israel, the occupying Power, in the Occupied Palestinian Territory, including East Jerusalem, in violation of the relevant provisions of the Geneva Convention relative to the Protection of Civilian Persons in Time of War, of 12 August 1949, and contrary to the relevant resolutions of the Security Council, are illegal and have no validity; 2. Demands that Israel, the occupying Power, comply fully with the provisions of the Fourth Geneva Convention of 1949% and cease immediately all measures and actions taken in violation and in breach of the Convention, including the extrajudicial executions; 3. Condemns all acts of violence, including all acts of terror, provocation, incitement and destruction, especially the excessive and indiscriminate use of force by the Israeli occupying forces against Palestinian civilians, resulting in extensive loss of life, vast numbers of injuries and massive destruction of homes, properties, agricultural lands and vital infrastructure; 4. Condemns also the events that have occurred in the Jenin refugee camp in April 2002, including the loss of life, injury, widespread destruction and displacement inflicted on many of its civilian inhabitants; 5. Condemns further the killing of Palestinian civilians and the widespread demolition of homes by Israel, the occupying Power, in the Rafah refugee camp in May 2004 and in the Jabiliya refugee camp in October 2004; 6. Demands that Israel, the occupying Power, cease all practices and actions which violate the human rights of the Palestinian people, and calls upon Israel to respect human rights law and to comply with its obligations; A/C.4/59/L.17/Rev.1 7. Demands also that Israel, the occupying Power, comply with its legal obligations under international law, as mentioned in the advisory opinion rendered on 9 July 2004 by the International Court of Justice® and as demanded in resolution ES-10/15,° and that, accordingly, it cease the construction of the wall in the Occupied Palestinian Territory, including in and around East Jerusalem, dismantle forthwith the structure situated therein, repeal or render ineffective all legislative and regulatory acts relating thereto, and make reparation for all damage caused by the construction of the wall; 8. Stresses the need to preserve the territorial integrity of all the Occupied Palestinian Territory and to guarantee the freedom of movement of persons and goods within the Palestinian territory, including the removal of restrictions on movement into and from East Jerusalem, and the freedom of movement to and from the outside world; 9. Requests the Secretary-General to report to the General Assembly at its sixtieth session on the implementation of the present resolution.",11/22/2004,2004_535551,Djibouti,N/A,yes
