year,Council,Committee,Session,Agenda item,Agenda detail,cosponsored countries,body title number,body title detail,body text,date,file,filecountry,footnote,scanned
1993,Security Council,N/A,N/A,N/A,UNITED NATIONS,"Afghanistan, Albania, Algeria, Cape Verde, Comoros, Djibouti, Eqypt, Estonia, Indonesia, Iran (Islamic Republic of), Jordan, Latvia, Libyan Arab Jamahiriya, Malaysia, Morocco, Pakistan, Senegal, Syrian Arab Republic, Turkey, Tunisia, United Arab Emirates and Venezuela",N/A,N/A,"The Security Council, Recalling all its previous resolutions on the conflict in the Republic of Bosnia and Herzegovina, Recognizing that the Republic of Bosnia and Herzegovina is a sovereign, independent State and a Member of the United Nations, Reaffirming that the Republic of Bosnia and Herzegovina, as a State Member of the United Nations, enjoys the rights provided for in the Charter of the United Nations, Noting that the Republic of Bosnia and Herzegovina has continued to be subjected to armed hostilities in contravention of Security Council resolution 713 (1991) and other relevant Security Council resolutions and that, despite ail efforts by the United Nations as well as regional organizations and arrangements, the Bosnian Serb party continues to refuse to comply with all relevant resolutions in flagrant contempt of the Security Council, Commending the Government of the Republic of Bosnia and Herzegovina for its constructive and responsible policies as manifested in its acceptance of all the documents negotiated in the peace process, Affirming that the international community has the responsibility to secure fully the independence, territorial integrity and unity of the Republic of Bosnia and Herzegovina, as well as to prevent acts of genocide and of crimes against humanity, Reaffirming once again its total and complete rejection of the acquisition of territory through the use of force and the practice of ""ethnic cleansing"", Stressing that a solution to the conflict in Bosnia and Herzegovina must be based on the following principles: 2906393 (a) Immediate cessation of hostilities; (b) Withdrawal from the territories occupied by force and ethnic cleansing; (c) Reversal of the consequences of the reprehensible policy of ethnic cleansing and recognition of the right of all Bosnian refugees to return to their homes; (d) Restoration of the territorial integrity and unity of the Republic of Bosnia and Herzegovina; Taking note that the International Court of Justice in its Order of 8 April 1993 in the case concerning application of the Convention on the Prevention and Punishment of the Crime of Genocide (Bosnia and Herzegovina v. Yugoslavia (Serbia and Montenegro)) unanimously indicated as a provisional measure that the Government of the Federal Republic of Yugoslavia (Serbia and Montenegro) should immediately, in pursuance of its undertaking in the Convention on the Prevention and Punishment of the Crime of Genocide of 9 December 1948, take all measures within its power to prevent the commission of the crime of genocide, Recalling also the call made to it by the World Conference on Human Rights to take the necessary measures to end the genocide taking place in Bosnia and Herzegovina, in particular in Gorazde, Mindful of its duties and responsibilities under the Charter of the United Nations for the maintenance and preservation of international peace and security, Determining that the grave situation in the Republic of Bosnia and Herzegovina continues to be a threat to international peace and security, Acting under Chapter VII of the Charter, 1. Reaffirms the sovereignty, territorial integrity and political independence of the Republic of Bosnia and Herzegovina; 2. Demands that all hostilities within the territory of the Republic of Bosnia and Herzegovina be halted forthwith and the consequences of hostilities against the Republic of Bosnia and Herzegovina be reversed in accordance with the principles outlined above; 3. Decides to exempt the Government of the Republic of Bosnia and Herzegovina from the arms embargo imposed on former Yugoslavia by its resolution 713 (1991) with the sole purpose of enabling the Republic of Bosnia and Herzegovina to exercise its inherent right of self-defence; Decides to remain actively seized of the matter.",06/29/1993,1993_169240,Djibouti,N/A,no
1993,General Assembly,N/A,Forty-seventh session,19,ADMISSION OF NEW MEMBERS TO THE UNITED NATIONS,"Austria, Belgium, China, Finland, France, Greece, Iceland, Ireland, Israel, Luxembourg, Malta, Mexico, Norway, Romania, Singapore, Spain, Sweden, Thailand, Turkey and United Kingdom of Great Britain and Northern Ireland",N/A,Admission of the Principality of Andorra to membership in the United Nations,"Addendum Add the following countries to the list of sponsors of the resolution: Albania, Australia, Bulgaria, Croatia, Cyprus, Djibouti, Egypt, El Salvador, Guatemala, Liechtenstein, Lithuania, Morocco, Nicaragua, Panama, Philippines, Poland, Portugal, Senegal and Slovenia",07/28/1993,1993_171328,Djibouti,N/A,no
1993,General Assembly,N/A,Forty-eighth session,167,BUILDING A PEACEFUL AND BETTER WORLD THROUGH SPORT,"Algeria, Andorra, Antigua _ and Barbuda, Australia, Austria, Bahamas, Barbados, Belgium, Benin, Bolivia, Bosnia and Herzegovina, Botswana, Burkina Faso, Burundi, Cameroon, Cape Verde, Chad, Colombia, Comoros, Congo, Céte d’Ivoire, Croatia, Cuba, Cyprus, Djibouti, Dominica, Dominican Republic, Egypt, Ethiopia, Fiji, France, Gabon, Gambia, Greece, Grenada, Guinea, Guinea-Bissau, Guyana, Honduras, Indonesia, Kenya, Kyrgyzstan, Lesotho, Libyan Arab Jamahiriya, Liechtenstein, Luxembourg, Madagascar, Mali, Malta, Mauritania, Mauritius, Micronesia (Federated States of), Monaco, Mongolia, Morocco, Mozambique, Namibia, Niger, Nigeria, Norway, Pakistan, Paraguay, Peru, Poland, Romania, Russian Federation, Rwanda, Saint Kitts and Nevis, Saint Vincent and the Grenadines, Samoa, San Marino, Sao Tome and Principe, Senegal, Sierra Leone, Slovakia, Slovenia, Spain, Sudan, Suriname, Swaziland, Togo, Tunisia, Turkey, Uganda, United Republic of Tanzania, United States of America, Uruguay, Vanuatu, Yemen, Zaire, Zambia and Zimbabwe:",N/A,International Year of Sport and the Olympic Ideal,"The General Assembly, Recalling that the International Olympic Committee, founded on the initiative of a Frenchman, Pierre de Coubertin, will be celebrating the centenary of its founding in 1994, Taking into account its decision 35/424 of 5 December 1980 regarding guidelines for international years and anniversaries, Noting that the organization of the celebration for the International Year of Sport and the Olympic Ideal at the national and international level will be coordinated by the International Olympic Committee, with the collaboration of the International Sports Federations and the National Olympic Committees, 221093 Recognizing that the goal of the Olympic Movement is to build a better and peaceful world by educating the youth of the world through sport and culture, Recognizing also that the Olympic ideal is to promote international understanding among the youth of the world through sport and culture and is therefore relevant to the International Year of the Family, which will be commemorated in 1994, in accordance with General Assembly resolution 44/82 of 8 December 1989, Noting that the preparation for the International Year of Sport and the Olympic Ideal will not involve any financial implications for the United Nations or its Member States, nor will it require the setting up of any administrative structure, Proclaims 1994 as International Year of Sport and the Olympic Ideal; 2. Commends the Olympic Movement for its ideal to promote international understanding among the youth of the world through sport and culture; 3. Endorses the appeal launched by the International Olympic Committee to build a peaceful and better world through sport, contained in resolution CM/Res.1472 (LVIII), adopted by the Council of Ministers of the Organization of African Unity at its fifty-eighth ordinary session, held at Cairo from 21 to 26 June 1993; 4. Invites all States, organizations of the United Nations system and interested non-governmental organizations to participate in the observance of the Year and to cooperate with the Secretary-General in achieving the objectives of the Year; 5. Requests the Secretary-General to cooperate with the International Olympic Committee in its endeavours to promote the observance of the Year.",10/22/1993,1993_174981,Djibouti,N/A,no
1993,General Assembly,N/A,Forty-eighth session,167,BUILDING A PEACEFUL AND BETTER WORLD THROUGH SPORT,"Algeria, Antigua and Barbuda, Australia, Bahamas, Barbados, Belgium, Benin, Botswana, Burkina Faso, Burundi, Cameroon, Cape Verde, Colombia, Comoros, Congo, Céte d’ Ivoire, Croatia, Cyprus, Djibouti, Egypt, Ethiopia, France, Gabon, Gambia, Greece, Guinea, Honduras, Kenya, Lesotho, Libyan Arab Jamahiriya, Luxembourg, Madagascar, Mali, Malta, Mauritania, Mauritius, Monaco, Namibia, Niger, Nigeria, Pakistan, Paraguay, Saint Kitts and Nevis, Sao Tome and Principe, Senegal, Sierra Leone, Slovenia, Spain, Sudan, Togo, Tunisia, Uganda, United Republic of Tanzania, Uruguay, Vanuatu, Yemen, Zaire and Zambia",N/A,Observance of the Olympic Truce,"The General Assembly, Considering the appeal launched by the International Olympic Committee for an Olympic Truce, which was endorsed by the National Olympic Committees of one hundred eighty-four countries and presented to the Secretary-General, Recognizing that the goal of the Olympic Movement is to build a better and peaceful world by educating the youth of the world through sport, practised without discrimination of any kind and in the Olympic spirit, which requires mutual understanding, promoted by friendship, solidarity and fair play, Recognizing also the efforts of the International Olympic Committee to restore the ancient Greek tradition of the Ekecheria, or ""Olympic Truce"", in the interest of contributing to international understanding and the maintenance of peace, Recalling resolution CM/Res.1472(LVIII), which supports the appeal for an Olympic Truce, adopted by the Council of Ministers of the Organization of African Unity at its fifty-eighth ordinary session, held at Cairo from 21 to 26 June 1993, and endorsed by the Assembly of Heads of State and Government of that organization, 191093 Recognizing the valuable contribution that the appeal launched by the International Olympic Committee for an Olympic Truce could make towards advancing the purposes and principles of the Charter of the United Nations, 1. Commends the International Olympic Committee, the International Sports Federations and the National Olympic Committees for their efforts to mobilize the youth of the world in the cause of peace; 2. Endorses the appeal launched by the International Olympic Committee for an Olympic Truce, and calls upon Member States to observe the Olympic Truce from the seventh day before the opening and the seventh day following the closing of each of the Olympic Games; 3. Takes note of the idea of the ""Olympic Truce"", as dedicated in ancient Greece to the spirit of fraternity and understanding between peoples, and urges Member States to take the initiative to abide by the Truce, individually and collectively, and to pursue in conformity with the purposes and principles of the Charter of the United Nations the peaceful settlement of all international conflicts; 4. Calls upon all Member States to cooperate with the International Olympic Committee in its efforts to promote the Olympic Truce; 5. Requests the Secretary-General to promote the observance of the Olympic Truce among Member States, drawing the attention of world public opinion to the contribution such a truce would make to the promotion of international understanding and the maintenance of peace and goodwill, and to cooperate with the International Olympic Committee in the realization of this objective.",10/19/1993,1993_175513,Djibouti,N/A,no
1993,General Assembly,N/A,Forty-eighth session,167,BUILDING A PEACEFUL AND BETTER WORLD THROUGH SPORT,"Algeria, Andorra, Antigua _ and Barbuda, Australia, Austria, Bahamas, Barbados, Belgium, Benin, Bolivia, Bosnia and Herzegovina, Botswana, Burkina Faso, Burundi, Cameroon, Cape Verde, Chad, Colombia, Comoros, Congo, Céte d’Ivoire, Croatia, Cuba, Cyprus, Djibouti, Dominica, Dominican Republic, Egypt, Ethiopia, Fiji, France, Gabon, Gambia, Greece, Grenada, Guinea, Guinea-Bissau, Guyana, Honduras, Indonesia, Kenya, Kyrgyzstan, Lesotho, Libyan Arab Jamahiriya, Liechtenstein, Luxembourg, Madagascar, Mali, Malta, Mauritania, Mauritius, Micronesia (Federated States of), Monaco, Mongolia, Morocco, Mozambique, Namibia, Niger, Nigeria, Norway, Pakistan, Paraguay, Peru, Poland, Romania, Russian Federation, Rwanda, Saint Kitts and Nevis, Saint Vincent and the Grenadines, Samoa, San Marino, Sao Tome and Principe, Senegal, Sierra Leone, Slovakia, Slovenia, Spain, Sudan, Suriname, Swaziland, Togo, Tunisia, Turkey, Uganda, United Republic of Tanzania, United States of America, Uruguay, Vanuatu, Yemen, Zaire, Zambia and Zimbabwe:",N/A,Observance of the Olympic Truce,"The General Assembly, Considering the appeal launched by the International Olympic Committee for an Olympic Truce, which was endorsed by the National Olympic Committees of one hundred eighty-four countries and presented to the Secretary-General, Recognizing that the goal of the Olympic Movement is to build a better and peaceful world by educating the youth of the world through sport, practised without discrimination of any kind and in the Olympic spirit, which requires mutual understanding, promoted by friendship, solidarity and fair play, 221093 Recognizing also the efforts of the International Olympic Committee to restore the ancient Greek tradition of the Ekecheria, or ""Olympic Truce"", in the interest of contributing to international understanding and the maintenance of peace, Recalling resolution CM/Res.1472(LVIII), which supports the appeal for an Olympic Truce, adopted by the Council of Ministers of the Organization of African Unity at its fifty-eighth ordinary session, held at Cairo from 21 to 26 June 1993, and endorsed by the Assembly of Heads of State and Government of that organization, Recognizing the valuable contribution that the appeal launched by the International Olympic Committee for an Olympic Truce could make towards advancing the purposes and principles of the Charter of the United Nations, 1. Commends the International Olympic Committee, the International Sports Federations and the National Olympic Committees for their efforts to mobilize the youth of the world in the cause of peace; 2. Urges Member States to observe the Olympic Truce from the seventh day before the opening and the seventh day following the closing of each of the Olympic Games, in accordance with the appeal launched by the International Olympic Committee; 3. Takes note of the idea of the ""Olympic Truce"", as dedicated in ancient Greece to the spirit of fraternity and understanding between peoples, and urges Member States to take the initiative to abide by the Truce, individually and collectively, and to pursue in conformity with the purposes and principles of the Charter of the United Nations the peaceful settlement of all international conflicts; 4. Calls upon all Member States to cooperate with the International Olympic Committee in its efforts to promote the Olympic Truce; 5. Requests the Secretary-General to promote the observance of the Olympic Truce among Member States, drawing the attention of world public opinion to the contribution such a truce would make to the promotion of international understanding and the maintenance of peace and goodwill, and to cooperate with the International Olympic Committee in the realization of this objective.",10/22/1993,1993_175554,Djibouti,N/A,no
1993,General Assembly,First Committee,Forty-eighth session,74,ISRAELI NUCLEAR ARMAMENT,"Djibouti, Iraq, Jordan, Kuwait, Lebanon, Qatar, Saudi Arabia, Sudan, United Arab Emirates and Yemen",N/A,Israeli nuclear armament,"The General Assembly, Bearing in mind relevant United Nations resolutions, Taking note of relevant resolutions adopted by the General Conference of the International Atomic Energy Agency, the latest of which is GC (XXXVII) /RES/627 of 1 October 1993, Aware of the recent positive developments in the Middle East peace process, 1. Calls upon Israel to renounce possession of nuclear weapons and to accede to the Treaty on the Non-Proliferation of Nuclear Weapons; 1/ 2. Calls upon the States of the region to place all their nuclear facilities under International Atomic Energy Agency safeguards; 3. Requests the Secretary-General to report to the General Assembly on the implementation of the present resolution; 4. Decides to include in the provisional agenda of its forty-ninth session the item entitled ""Israeli nuclear armament"". United Nations, Treaty Series, vol. 729, No. 10485. 041193",11/04/1993,1993_176463,Djibouti,N/A,no
1993,General Assembly,Third Committee,Forty-eighth session,108 (a),RIGHT OF PEOPLES TO SELF-DETERMINATION,"Afghanistan, Azerbaijan, Bahrain, Bosnia and Herzegovina, Brunei Darussalam, Cape Verde, Chile, Colombia, Comoros, Costa Rica, Djibouti, Dominican Republic, Ecuador, Egypt, El Salvador, Gabon, Guatemala, Iran (Islamic Republic of), Jordan, Kuwait, Malaysia, Mauritania, Morocco, Nicaragua, Oman, Pakistan, Papua New Guinea, Qatar, Sierra Leone, Singapore, Thailand and United Arab Emirates",N/A,Universal realization of the right of peoples,"to self-determination The General Assembly, Reaffirming the importance, for the effective guarantee and observance of human rights, of the universal realization of the right of peoples to self-determination enshrined in the Charter of the United Nations and embodied in the International Covenants on Human Rights, 1/ as well as in the Declaration on the Granting of Independence to Colonial Countries and Peoples contained in General Assembly resolution 1514 (XV) of 14 December 1960, Welcoming the progressive exercise of the right to self-determination by peoples under colonial, foreign or alien occupation and their emergence into sovereign statehood and independence, Deeply concerned at the continuation of acts or threats of foreign military intervention and occupation that are threatening to suppress, or have already suppressed, the right to self-determination of an increasing number of sovereign peoples and nations, Resolution 2200 A (XXI), annex. 93-60658 (E) 041193 Expressing grave concern that, as a consequence of the persistence of such actions, millions of people have been and are being uprooted from their homes as refugees and displaced persons, and emphasizing the urgent need for concerted international action to alleviate their condition, Recalling the relevant resolutions regarding the violation of the right of peoples to self-determination and other human rights as a result of foreign military intervention, aggression and occupation, adopted by the Commission on Human Rights at its thirty-sixth, 2/ thirty-seventh, 3/ thirty-eighth, 4/ thirty-ninth, 5/ fortieth, 6/ forty-first, 7/ forty-second, 8/ forty- third, 9/ forty-fourth, 10/ forty-fifth, 11/ forty-sixth, 12/ forty-seventh, 13/ forty-eighth, 14/ and forty-ninth 15/ sessions, 2/ See Official Records of the Economic and Social Council, 1980, Supplement No. 3 and corrigendum (E/1980/13 and Corr.1), chap. XXVI, sect. A. 3/ Ibid., 1981, Supplement No. 5 and corrigendum (E/1981/25 and Corr.1), chap. XXVIII, sect. A. A/ Ibid., 1982, Supplement No. 2 and corrigendum (E/1982/12 and Corr.1), chap. XXVI, sect. A. 5/ Ibid., 1983, Supplement No. 3 and corrigendum (E/1983/13 and Corr.1), chap. XXVII, sect. A. 6/ Ibid., 1984, Supplement No. 4 and corrigendum (E/1984/14 and Corr.1), chap. II, sect. A. Ibid., 1985, Supplement No. 2 (E/1985/22), chap. II, sect. A. Ibid., 1986, Supplement No. 2 (E/1986/22), chap. II, sect. A. 9/ Ibid., 1987, Supplement No. 5 and corrigenda (E/1987/18 and Corr.1 and 2), chap. II, sect. A. 10/ Ibid., 1988, Supplement No. 2 and corrigendum (E/1988/12 and Corr.1), chap. II, sect. A. 1/ Ibid., 1989, Supplement No. 2 (E/1989/20), chap. II, sect. A. 12/ Ibid., 1990, Supplement No. 2 and corrigendum (E/1990/22 and Corr.1), chap. II, sect. A. 13/ Ibid., 1991, Supplement No. 2 (E/1991/22), chap. II, sect. A. 14/ Ibid., 1992, Supplement No. 2 (E/1992/22), chap. II, sect. A. 15/ Ibid., 1993, Supplement No. 2 (E/1993/22), chap. II, sect. A. Reaffirming its resolutions 35/35 B of 14 November 1980, 36/10 of 28 October 1981, 37/42 of 3 December 1982, 38/16 of 22 November 1983, 39/18 of 23 November 1984, 40/24 of 29 November 1985, 41/100 of 4 December 1986, 42/94 of 7 December 1987, 43/105 of 8 December 1988, 44/80 of 8 December 1989, 45/131 of 14 December 1990, 46/88 of 16 December 1991 and 47/83 of 16 December 1992, Taking note of the report of the Secretary-General, 1. Reaffirms that the universal realization of the right of all peoples, including those under colonial, foreign and alien domination, to self-determination is a fundamental condition for the effective guarantee and observance of human rights and for the preservation and promotion of such rights; 2. Declares its firm opposition to acts of foreign military intervention, aggression and occupation, since these have resulted in the suppression of the right of peoples to self-determination and other human rights in certain parts of the world; 3. Calls upon those States responsible to cease immediately their military intervention in and occupation of foreign countries and territories and all acts of repression, discrimination, exploitation and maltreatment, particularly the brutal and inhuman methods reportedly employed for the execution of these acts against the peoples concerned; 4. Deplores the plight of the millions of refugees and displaced persons who have been uprooted as a result of the aforementioned acts, and reaffirms their right to return to their homes voluntarily in safety and honour; 5. Requests the Commission on Human Rights to continue to give special attention to the violation of human rights, especially the right to self-determination, resulting from foreign military intervention, aggression or occupation; 6. Requests the Secretary-General to report on this issue to the General Assembly at its forty-ninth session under the item entitled ""Right of peoples to self—-determination"".",11/03/1993,1993_176707,Djibouti,N/A,no
