year,Council,Committee,Session,Agenda item,Agenda detail,cosponsored countries,body title number,body title detail,body text,date,file,filecountry,footnote,scanned
2004,General Assembly,Third Committee,Fifty-ninth session,105 (b),"Human rights questions: Human rights questions, including alternative approaches for improving the effective enjoyment of human rights and fundamental freedoms","Afghanistan, Azerbaijan, Bangladesh, Burkina Faso, China, Congo, Cuba, Democratic Republic of the Congo, Djibouti, Egypt, Eritrea, Ghana, Indonesia, Iran (Islamic Republic of), Libyan Arab Jamahiriya, Malaysia, Mauritius, Morocco, Namibia, Pakistan, Saudi Arabia, South Africa, Sudan, Syrian Arab Republic, Togo, Uganda, United Arab Emirates and Zimbabwe",N/A,Globalization and its impact on the full enjoyment of all human rights,"The General Assembly, Guided by the purposes and principles of the Charter of the United Nations, and expressing in particular the need to achieve international cooperation in promoting and encouraging respect for human rights and fundamental freedoms for all without distinction, Recalling the Universal Declaration of Human Rights,! as well as the Vienna Declaration and Programme of Action adopted by the World Conference on Human Rights on 25 June 1993,2 Recalling also the International Covenant on Civil and Political Rights3 and the International Covenant on Economic, Social and Cultural Rights,3 Recalling further the Declaration on the Right to Development adopted by the General Assembly in its resolution 41/128 of 4 December 1986, Recalling the United Nations Millennium Declaration* and the outcome documents of the twenty-third> and twenty-fourth® special sessions of the General 5 Resolution S-23/2, annex, and resolution S-23/3, annex. 6 Resolution S-24/2, annex. 04-58326 (E) 021104 *0458326°* Assembly, held, respectively, in New York from 5 to 10 June 2000 and in Geneva from 26 June to 1 July 2000, Recalling also its resolution 58/193 of 22 December 2003, Recalling further Commission on Human Rights resolution 2004/24 of 16 April 2004 on globalization and its impact on the full enjoyment of human rights,? Recognizing that all human rights are universal, indivisible, interdependent and interrelated and that the international community must treat human rights globally in a fair and equal manner, on the same footing and with the same emphasis, Realizing that globalization affects all countries differently and makes them more exposed to external developments, positive as well as negative, inter alia, in the field of human rights, Realizing also that globalization is not merely an economic process, but that it also has social, political, environmental, cultural and legal dimensions, which have an impact on the full enjoyment of all human rights, Realizing further the need to undertake a thorough, independent and comprehensive assessment of the social, environmental and cultural impact of globalization on societies, Recognizing in each culture a dignity and value that deserve recognition, respect and preservation, and convinced that, in their rich variety and diversity and in the reciprocal influences that they exert on one another, all cultures form part of the common heritage belonging to all humankind, and aware that the risk of a global monoculture poses more of a threat if the developing world remains poor and marginalized, Recognizing also that multilateral mechanisms have a unique role to play in meeting the challenges and opportunities presented by globalization, Expressing concern at the negative impact of international financial turbulence on social and economic development and on the full enjoyment of all human rights, Deeply concerned that the widening gap between the developed and the developing countries, and within countries, has contributed, inter alia, to deepening poverty and has adversely affected the full enjoyment of all human rights, in particular in developing countries, Noting that human beings strive for a world that is respectful of human rights and cultural diversity and that, in this regard, they work to ensure that all activities, including those affected by globalization, are consistent with those aims, 1. Recognizes that, while globalization, by its impact on, inter alia, the role of the State, may affect human rights, the promotion and protection of all human rights is first and foremost the responsibility of the State; 2. Reaffirms that narrowing the gap between rich and poor, both within and between countries, is an explicit goal at the national and international levels, as part of the effort to create an enabling environment for the full enjoyment of all human rights; N See Official Records of the Economic and Social Council, 2004, Supplement No. 3 (E/2004/23), chap. I, sect. A. A/C.3/59/L.35 3. Reaffirms also the commitment to creating an environment at both the national and the global level that is conducive to development and to the elimination of poverty through, inter alia, good governance within each country and at the international level, transparency in the financial, monetary and trading systems and commitment to an open, equitable, rule-based, predictable and non-discriminatory multilateral trading and financial system; 4. Recognizes that, while globalization offers great opportunities, the fact that its benefits are very unevenly shared and its costs unevenly distributed represents an aspect of the process that affects the full enjoyment of all human rights, in particular in developing countries; 5. Welcomes the report of the United Nations High Commissioner for Human Rights on globalization and its impact on the full enjoyment of human rights,® which focuses on the liberalization of agricultural trade and its impact on the realization of the right to development, including the right to food, and takes note of the conclusions and recommendations contained therein; 6. Calls upon Member States, relevant agencies of the United Nations system, intergovernmental organizations and civil society to promote equitable and environmentally sustainable economic growth for managing globalization, so that poverty is systematically reduced and the international development targets are achieved; 7. Recognizes that only through broad and sustained efforts, including policies and measures at the global level to create a shared future based upon our common humanity in all its diversity, can globalization be made fully inclusive and equitable and have a human face, thus contributing to the full enjoyment of all human rights; 8. Underlines the urgent need to establish an equitable, transparent and democratic international system in which poor people and countries have a more effective voice; 9. Affirms that globalization is a complex process of structural transformation, with numerous interdisciplinary aspects, which has an impact on the enjoyment of civil, political, economic, social and cultural rights, including the right to development; 10. Affirms also that the international community should strive to respond to the challenges and opportunities posed by globalization in a manner that ensures respect for the cultural diversity of all; 11. Underlines, therefore, the need to continue to analyse the consequences of globalization for the full enjoyment of all human rights; 12. Takes note of the report of the Secretary-General,” and requests the Secretary-General to seek further the views of Member States and relevant agencies of the United Nations system and to submit a substantive report on this subject to the General Assembly at its sixtieth session. 8 E/CN.4/2002/54. 9 A/59/320.",11/01/2004,2004_534427,Djibouti,N/A,yes
2004,General Assembly,N/A,Fifty-ninth session,56 (i),Cooperation between the United Nations and regional and other organizations: cooperation between the United Nations and the International Organization of la Francophonie,"Albania, Andorra, Angola, Armenia, Austria, Barbados, Belgium, Benin, Bulgaria, Burkina Faso, Burundi, Cambodia, Cameroon, Canada, Cape Verde, Central African Republic, Chad, Chile, Colombia, Comoros, Congo, Cote d’Ivoire, Croatia, Cyprus, Czech Republic, Democratic Republic of the Congo, Djibouti, Dominica, Egypt, Equatorial Guinea, France, Gabon, Georgia, Greece, Guinea, Guinea-Bissau, Haiti, Honduras, Hungary, Kazakhstan, Lao People’s Democratic Republic, Lebanon, Lesotho, Lithuania, Luxembourg, Madagascar, Mali, Mauritania, Mauritius, Monaco, Morocco, Niger, Norway, Peru, Poland, Portugal, Republic of Moldova, Romania, Rwanda, Saint Lucia, Sao Tome and Principe, Senegal, Seychelles, Slovakia, Slovenia, Switzerland, Tajikistan, the former Yugoslav Republic of Macedonia, Timor-Leste, Togo, Trinidad and Tobago, Tunisia, Turkey, Tuvalu, Ukraine, Vanuatu and Viet Nam",N/A,Cooperation between the United Nations and the International Organization of la Francophonie,"The General Assembly, Recalling its resolutions 33/18 of 10 November 1978, 50/3 of 16 October 1995, 52/2 of 17 October 1997, 54/25 of 15 November 1999, 56/45 of 7 December 2001 and 57/43 of 21 November 2002, as well as its decision 53/453 of 18 December 1998, Considering that the International Organization of la Francophonie brings together a considerable number of States Members of the United Nations, among which it promotes multilateral cooperation in areas of interest to the United Nations, Bearing in mind the Articles of the Charter of the United Nations which encourage the promotion of the purposes and principles of the United Nations through regional cooperation, 04-58559* (E) 051104 051104 *0458559"" Bearing in mind further that, according to its charter, the objectives of the International Organization of la Francophonie are to assist in the establishment and development of democracy, the prevention of conflicts and support for the rule of law and for human rights, the intensification of dialogue between cultures and civilizations, the establishment of closer ties among peoples through mutual knowledge and strengthening of their solidarity through multilateral cooperation activities with a view to promoting the growth of their economies, Welcoming the steps taken by the International Organization of la Francophonie to tighten its ties with the organizations of the United Nations system and with international and regional organizations with a view to attaining its objectives, Noting with satisfaction the commitment to multilateral cooperation in the search for solutions to the major international problems expressed by the heads of State and Government of countries using French as a common language at their ninth summit conference, held in Beirut from 18 to 20 October 2002, and their determination to extend the scope of francophone collaboration and cooperation in order to fight poverty and contribute to the emergence of a more equitable form of globalization that will bring progress, peace, democracy and human rights, in full respect for cultural and linguistic diversity, in the interests of the most vulnerable populations and the development of all countries, Having considered the report of the Secretary-General,! Noting with satisfaction the substantial progress achieved in cooperation between the United Nations, the specialized agencies and other United Nations bodies and programmes and the International Organization of la Francophonie, Convinced that strengthening cooperation between the United Nations and the International Organization of la Francophonie serves the purposes and principles of the United Nations, Noting the desire of the two organizations to consolidate, develop and tighten the ties that exist between them in the political, economic, social and cultural fields, 1. Takes note with satisfaction of the report of the Secretary-General on the implementation of resolution 57/43,' and welcomes the increasingly close and productive cooperation between the United Nations and the International Organization of la Francophonie; 2. Notes with satisfaction that the International Organization of la Francophonie participates actively in the work of the United Nations, to which it makes a valuable contribution; 3. Notes with great satisfaction the initiatives taken by the International Organization of la Francophonie in the areas of conflict prevention, the promotion of peace and support for democracy, the rule of law and human rights, and commends it on the genuine contribution it makes, in cooperation with the United Nations, in Haiti, the Comoros, Céte d’Ivoire, Burundi, the Democratic Republic of the Congo and the Central African Republic; A/59/L.19 4. Welcomes the initiation of cooperation between the United Nations and the International Organization of la Francophonie, with the participation of other regional and subregional organizations, as well as non-governmental organizations, in the fields of early warning and conflict prevention, and encourages the pursuit of this initiative with a view to formulating practical recommendations to facilitate the establishment of relevant operational mechanisms, where necessary; 5. Expresses its gratitude to the International Organization of Ila Francophonie for the steps it has taken in recent years to promote cultural and linguistic diversity and dialogue between cultures and civilizations; 6. Expresses its appreciation to the Secretary-General of the United Nations and the Secretary-General of the International Organization of la Francophonie for their sustained efforts to strengthen cooperation and coordination between the two organizations, thereby serving their mutual interests in the political, economic, social and cultural fields; 7. Welcomes the fact that the tenth summit conference of la Francophonie was devoted to solidarity for sustainable development, and calls on the specialized agencies and the funds and programmes of the United Nations to enhance their cooperation with the International Organization of la Francophonie in the area of sustainable development; 8. Welcomes the involvement of the countries that use French as a common language, particularly through the International Organization of la Francophonie, in the preparation for, conduct of and follow-up to international conferences organized under United Nations auspices; 9. Also commends the high-level meetings held periodically between the United Nations Secretariat and the secretariat of the International Organization of la Francophonie, and advocates the participation of those secretariats in major meetings of the two organizations; 10. Expresses its appreciation to the Secretary-General for including the International Organization of la Francophonie in the periodic meetings he holds with heads of regional organizations, and invites him to continue doing so, taking into account the role played by the International Organization of la Francophonie in conflict prevention and support for democracy and the rule of law; 11. Notes with satisfaction the continued collaboration between the United Nations and the International Organization of la Francophonie in the area of electoral monitoring and assistance, and advocates the strengthening of cooperation between the two organizations in that area; 12. Requests the Secretary-General of the United Nations, acting in cooperation with the Secretary-General of the International Organization of la Francophonie, to encourage the holding of periodic meetings between representatives of the United Nations Secretariat and representatives of the secretariat of the International Organization of la Francophonie in order to promote the exchange of information, coordination of activities and identification of new areas of cooperation; 13. Invites the Secretary-General of the United Nations to take the necessary steps, in consultation with the Secretary-General of the International Organization A/59/L.19 of la Francophonie, to continue to promote cooperation between the two organizations; 14. Invites the specialized agencies and funds and programmes of the United Nations, as well as the regional commissions, including the Economic Commission for Africa, to collaborate to this end with the Secretary-General of the International Organization of la Francophonie by identifying new synergies in favour of development, in particular in the areas of poverty elimination, energy, sustainable development, education, training and the development of new information technologies; 15. Requests the Secretary-General to submit to the General Assembly at its sixty-first session a report on the implementation of the present resolution; 16. Decides to include in the provisional agenda of its sixty-first session the item entitled “Cooperation between the United Nations and the International Organization of la Francophonie”.",11/04/2004,2004_534431,Djibouti,* Reissued for technical reasons.,yes
2004,General Assembly,N/A,Fifty-ninth session,56 (j),Cooperation between the United Nations and regional and other organizations: cooperation between the United Nations and the Inter-Parliamentary Union,"Albania, Algeria, Andorra, Argentina, Armenia, Austria, Azerbaijan, Bangladesh, Belarus, Belgium, Benin, Bolivia, Bosnia and Herzegovina, Brazil, Bulgaria, Burkina Faso, Cambodia, Canada, Central African Republic, Chile, China, Costa Rica, Cote d’Ivoire, Croatia, Cuba, Czech Republic, Denmark, Ecuador, Egypt, El Salvador, Finland, France, Gabon, Germany, Ghana, Greece, Guatemala, Guinea, Hungary, Iceland, Indonesia, Ireland, Israel, Italy, Japan, Jordan, Kazakhstan, Kenya, Kuwait, Kyrgyzstan, Latvia, Liechtenstein, Lithuania, Luxembourg, Madagascar, Mali, Malta, Mexico, Monaco, Mongolia, Morocco, Namibia, Netherlands, New Zealand, Nigeria, Norway, Pakistan, Panama, Paraguay, Peru, Philippines, Poland, Portugal, Republic of Korea, Republic of Moldova, Romania, Russian Federation, San Marino, Serbia and Montenegro, Slovakia, Slovenia, South Africa, Spain, Sri Lanka, Sweden, Switzerland, Syrian Arab Republic, Thailand, Timor-Leste, Turkey, Uganda, Ukraine, United Kingdom of Great Britain and Northern Ireland, Uruguay, Viet Nam and Zambia: revised",N/A,Cooperation between the United Nations and the Inter-Parliamentary Union,"Addendum Add the following countries to the list of sponsors of the resolution: Australia, Burundi, Cameroon, Cyprus, Democratic Republic of the Congo, Djibouti, Estonia, Nauru, the former Yugoslav Republic of Macedonia and Tunisia 04-59784 (E) 101104 *0459784-*",11/08/2004,2004_534696,Djibouti,N/A,yes
2004,General Assembly,Special Political And Decolonization Committee,Fifty-ninth session,75,United Nations Relief and Works Agency for Palestine Refugees in the Near East,"Algeria, Bahrain, Comoros, Djibouti, Egypt, Guinea, Indonesia, Iraq, Jordan, Kuwait, Malaysia, Morocco, Oman, Qatar, Saudi Arabia, Somalia, Sudan, Tunisia, United Arab Emirates, Yemen and Palestine",N/A,Assistance to Palestine refugees,"The General Assembly, Recalling its resolution 194 (III) of 11 December 1948 and all its subsequent resolutions on the question, including resolution 58/91 of 9 December 2003, Recalling also its resolution 302 (IV) of 8 December 1949, by which, inter alia, it established the United Nations Relief and Works Agency for Palestine Refugees in the Near East, Recalling further relevant Security Council resolutions, Aware of the fact that, for more than five decades, the Palestine refugees have suffered from the loss of their homes, lands and means of livelihood, Affirming the imperative of resolving the problem of the Palestine refugees for the achievement of justice and for the achievement of lasting peace in the region, Acknowledging the essential role that the United Nations Relief and Works Agency for Palestine Refugees in the Near East has played for more than fifty-four years since its establishment in ameliorating the plight of the Palestine refugees in the fields of education, health and relief and social services, Taking note of the report of the Commissioner-General of the United Nations Relief and Works Agency for Palestine Refugees in the Near East covering the period from 1 July 2003 to 30 June 2004,! U Official Records of the General Assembly, Fifty-ninth Session, Supplement No. 13 (A/59/13). 04-59838 (E) 101104 *0459838* Aware of the continuing needs of Palestine refugees throughout all the fields of operation, namely Jordan, Lebanon, the Syrian Arab Republic and the Occupied Palestinian Territory, Expressing grave concern at the especially difficult situation of the Palestine refugees under occupation, including with regard to their safety, well-being and living conditions, and the continuous deterioration of those conditions during the recent period, Noting the signing of the Declaration of Principles on Interim Self- Government Arrangements on 13 September 1993 by the Government of Israel and the Palestine Liberation Organization2 and the subsequent implementation agreements, Aware of the important role to be played in the peace process by the Multilateral Working Group on Refugees of the Middle East peace process, 1. Notes with regret that repatriation or compensation of the refugees, as provided for in paragraph 11 of its resolution 194 (III), has not yet been effected and that, therefore, the situation of the Palestine refugees continues to be a matter of grave concern; 2. Also notes with regret that the United Nations Conciliation Commission for Palestine has been unable to find a means of achieving progress in the implementation of paragraph 11 of General Assembly resolution 194 (III), and requests the Commission to exert continued efforts towards the implementation of that paragraph and to report to the Assembly as appropriate, but not later than 1 September 2005; 3. Affirms the necessity for the continuation of the work of the United Nations Relief and Works Agency for Palestine Refugees in the Near East and the importance of its operation and its services for the well-being of the Palestine refugees and for the stability of the region, pending the resolution of the question of the Palestine refugees; 4. Calls upon all donors to continue to make the most generous efforts possible to meet the anticipated needs of the Agency, including those mentioned in recent emergency appeals; 5. Decides to extend the mandate of the Agency until 30 June 2008, without prejudice to the provisions of paragraph 11 of its resolution 194 (III). 2 A/48/486-S/26560, annex.",11/09/2004,2004_534722,Djibouti,N/A,yes
2004,General Assembly,Special Political And Decolonization Committee,Fifty-ninth session,75,United Nations Relief and Works Agency for,"Algeria, Bahrain, Brunei Darussalam, Comoros, Djibouti, Egypt, Guinea, Indonesia, Iraq, Jordan, Kuwait, Malaysia, Morocco, Oman, Qatar, Saudi Arabia, Somalia, Sudan, Tunisia, United Arab Emirates, Yemen and Palestine",N/A,Persons displaced as a result of the June 1967 and subsequent hostilities,"The General Assembly, Recalling its resolutions 2252 (ES-V) of 4 July 1967, 2341 B (XXII) of 19 December 1967 and all subsequent related resolutions, Recalling also Security Council resolutions 237 (1967) of 14 June 1967 and 259 (1968) of 27 September 1968, Taking note of the report of the Secretary-General submitted in pursuance of its resolution 58/92 of 9 December 2003,! Taking note also of the report of the Commissioner-General of the United Nations Relief and Works Agency for Palestine Refugees in the Near East covering the period from 1 July 2003 to 30 June 2004,2 Concerned about the continuing human suffering resulting from the June 1967 and subsequent hostilities, Taking note of the relevant provisions of the Declaration of Principles on Interim Self-Government Arrangements of 19933 with regard to the modalities for the admission of persons displaced in 1967, and concerned that the process agreed upon has not yet been effected, 1 A/59/151. 2 Official Records of the General Assembly, Fifty-ninth Session, Supplement No. 13 (A/59/13). 3 A/48/486-S/26560, annex. 04-59856 (E) 091104 *0459856* 1. Reaffirms the right of all persons displaced as a result of the June 1967 and subsequent hostilities to return to their homes or former places of residence in the territories occupied by Israel since 1967; 2. Expresses deep concern that the mechanism agreed upon by the parties in article XII of the Declaration of Principles on Interim Self-Government Arrangements of 1993 on the return of displaced persons has not been complied with, and stresses the necessity for an accelerated return of displaced persons; 3. Endorses, in the meanwhile, the efforts of the Commissioner-General of the United Nations Relief and Works Agency for Palestine Refugees in the Near East to continue to provide humanitarian assistance, as far as practicable, on an emergency basis, and as a temporary measure, to persons in the area who are currently displaced and in serious need of continued assistance as a result of the June 1967 and subsequent hostilities; 4. Strongly appeals to all Governments and to organizations and individuals to contribute generously to the Agency and to the other intergovernmental and non- governmental organizations concerned for the above-mentioned purposes; 5. Requests the Secretary-General, after consulting with the Commissioner- General, to report to the General Assembly before its sixtieth session on the progress made with regard to the implementation of the present resolution.",11/09/2004,2004_534723,Djibouti,N/A,yes
