year,Council,Committee,Session,Agenda item,Agenda detail,cosponsored countries,body title number,body title detail,body text,date,file,filecountry,footnote,scanned
2004,General Assembly,N/A,Fifty-ninth session,35,Culture of peace,"Algeria, Azerbaijan, Bangladesh, Costa Rica, Djibouti, Egypt, Iran (Islamic Republic of), Kazakhstan, Morocco, Pakistan, Panama, Sudan, Togo and Tunisia:",N/A,"Promotion of religious and cultural understanding, harmony and cooperation","The General Assembly, Reaffirming the purposes and principles enshrined in the Charter of the United Nations and the Universal Declaration of Human Rights,! in particular the rights to freedom of thought, conscience and religion, Underlining the importance of promoting understanding, tolerance and friendship among human beings in all their diversity of religion, belief, culture and language, and recalling that all States have pledged themselves under the Charter to promote and encourage universal respect for and observance of human rights and fundamental freedoms for all, without distinction as to race, sex, language or religion, Affirming that interreligious dialogue is an integral part of the efforts to translate shared values, as reflected in the United Nations Millennium Declaration,2 into actions, in particular the efforts to promote a culture of peace and dialogue among civilizations, Recalling its resolution 58/128 of 19 December 2003 as well as its resolution 57/6 of 4 November 2002, in which it invited Member States to expand their activities promoting a culture of peace and non-violence at the national, regional and international levels, and other relevant resolutions, Taking note of different initiatives aimed at promoting religious and cultural understanding, harmony and cooperation and noting that at its tenth session held at Putrajaya, Malaysia, from 16 to 18 October 2003, the Islamic Summit Conference endorsed the concept of “enlightened moderation”, which contained the principles 1 Resolution 217 A (I1I). 2 See resolution 55/2. 04-59952 (E) 111104 *0459952~ of enhancing human welfare, freedom and progress everywhere, of forging harmony and understanding among all peoples and of seeking peaceful solution of conflicts and disputes, Recalling with satisfaction the proclamation of the Global Agenda for Dialogue among Civilizations,? bearing in mind the valuable contribution that dialogue among civilizations can make to an improved awareness and understanding of the common values shared by all humankind, Recalling the Universal Declaration on Cultural Diversity of the United Nations Educational, Scientific and Cultural Organization* and the principles contained therein, Emphasizing the need, at all levels of society and among nations, for strengthening freedom, justice, democracy, tolerance, solidarity, cooperation, pluralism, respect for diversity of culture and religion or belief, dialogue and understanding, which are important elements for peace and convinced that the guiding principles of democratic society need to be actively promoted by the international community, Reaffirming that freedom of expression, media pluralism, multilingualism, equal access to art and to scientific and technological knowledge, including in digital form, and the possibility for all cultures to have access to the means of expression and dissemination are the guarantees of cultural diversity, and that in ensuring the free flow of ideas by word and image, care should be exercised that all cultures can express themselves and make themselves known, Recognizing all efforts made by the United Nations system and other international and regional organizations to promote understanding, tolerance and friendship among human beings in all their diversity of culture, religion, belief and language, including the initiative of the United Nations Educational, Scientific and Cultural Organization to proclaim 2006 the International Year of Global Consciousness and the Ethics of Dialogue among Peoples, Alarmed that serious instances of intolerance and discrimination on the grounds of religion or belief, including acts of violence, intimidation and coercion motivated by religious intolerance, are on the increase in many parts of the world and threaten the enjoyment of human rights and fundamental freedoms, Considering that tolerance for cultural, ethnic, and religious and linguistic diversities, as well as dialogue among and within civilizations, is essential for peace, understanding and friendship among individuals and people of different cultures and nations of the world, while manifestations of cultural prejudice, intolerance and xenophobia towards different cultures and religions generate hatred and violence among peoples and nations throughout the world, Emphasizing that combating hatred, prejudice, intolerance and stereotyping on the basis of religion or culture represents a significant global challenge that requires further action, 4 United Nations Educational, Scientific and Cultural Organization, Records of the General Conference, Thirty-first Session, Paris, 15 October-3 November 2001, vol. 1: Resolutions, chap. V, resolution 25, annex I. A/59/L.17/Rev.1 1. Takes note of the report transmitted by the Secretary-General in accordance with resolution 58/128;5 2. Acknowledges that respect for the diversity of religions and cultures, tolerance, dialogue and cooperation in a climate of mutual trust and understanding can contribute to the combating of ideologies and practices based on discrimination, intolerance and hatred and help reinforce world peace, social justice and friendship among peoples; 3. Reaffirms the solemn commitment of all States to fulfil their obligations to promote universal respect for, and observance and protection of, all human rights and fundamental freedoms for all in accordance with the Charter of the United Nations, other instruments relating to human rights, and international law; the universal nature of these rights and freedoms is beyond question; 4. Also reaffirms the importance for all peoples and nations to hold, develop and preserve their cultural heritage and traditions in a national and international atmosphere of peace, tolerance and mutual respect; 5. Recognizes that respect for religious and cultural diversity in an increasingly globalizing world contributes to international cooperation, promotes enhanced dialogue among religions, cultures and civilizations, and helps to create an environment conducive to the exchange of human experience; 6. Also recognizes that all cultures and civilizations share a common set of universal values; 7. Further recognizes that, while the significance of national and regional particularities and various historical, cultural and religious backgrounds must be borne in mind, it is the duty of States, regardless of their political, economic and cultural systems, to promote and protect all human rights and fundamental freedoms; 8. Reaffirms that the promotion and protection of the rights of persons belonging to national or ethnic, religious and linguistic minorities contribute to political and social stability and peace and enrich the cultural diversity and heritage of society as a whole in the States in which such persons live, and urges States to ensure that their political and legal systems reflect the multicultural diversity within their societies and, where necessary, to improve democratic and political institutions, organizations and practices so that they are more fully participatory and avoid the marginalization and exclusion of, and discrimination against, specific sectors of society; 9. Encourages Governments to promote, including through education, understanding, tolerance and friendship among human beings in all their diversity of religion, belief, culture and language, which will address the cultural, social, economic, political and religious sources of intolerance, and to apply a gender perspective while doing so, in order to promote understanding, tolerance, peace and friendly relations among nations and all racial and religious groups, recognizing that education at all levels is one of the principal means to build a culture of peace; 10. Calls upon all States to exert their utmost efforts to ensure that religious and cultural sites are fully respected and protected in compliance with their A/59/L.17/Rev.1 international obligations and in accordance with their national legislation, and to adopt adequate measures aimed at preventing acts or threats of damage to and destruction of these sites; 11. Urges States, in compliance with their international obligations, to take all necessary action to combat incitement to or acts of violence, intimidation and coercion motivated by hatred and intolerance based on culture, religion or belief, which may cause discord and disharmony within and among societies; 12. Also urges States to take effective measures to prevent and eliminate discrimination on the grounds of religion or belief in the recognition, exercise and enjoyment of human rights and fundamental freedoms in all fields of civil, economic, political, social and cultural life and to make all efforts to enact or rescind legislation, where necessary, to prohibit any such discrimination, and to take all appropriate measures to combat intolerance on the grounds of religion or beliefs; 13. Further urges States to ensure that, in the course of their official duties, members of law enforcement bodies and the military, civil servants, educators and other public officials respect different religions and beliefs and do not discriminate against persons professing other religions or beliefs, and that any necessary and appropriate education or training is provided; 14. Welcomes the efforts of States, relevant entities of the United Nations system and other intergovernmental organizations, civil society, including religion- based and other non-governmental organizations, and the media in developing a culture of peace, and encourages them to continue such efforts, including the promotion of interreligious and intercultural interaction within and among societies through, inter alia, congresses, conferences, seminars, workshops, research work and related processes; 15. Requests the Secretary-General to ensure the widest dissemination of the relevant United Nations material related to the present resolution in as many different languages as possible through United Nations system, including the United Nations information centres, within available resources; 16. Also requests the Secretary-General, in the context of his report to the General Assembly at its sixtieth session under the item entitled “Culture of peace”, to include information on the implementation of the present resolution.",11/09/2004,2004_534799,Djibouti,N/A,yes
2004,General Assembly,Special Political And Decolonization Committee,Fifty-ninth session,76,Report of the Special Committee to Investigate Israeli Practices Affecting the Human Rights of the Palestinian People and Other Arabs of the Occupied Territories,"Algeria, Bahrain, Brunei Darussalam, Comoros, Cuba, Djibouti, Egypt, Guinea, Indonesia, Iraq, Jordan, Kuwait, Malaysia, Mali, Morocco, Oman, Qatar, Saudi Arabia, Somalia, Sudan, Tunisia, United Arab Emirates, Yemen and Palestine",N/A,"Applicability of the Geneva Convention relative to the Protection of Civilian Persons in Time of War, of 12 August 1949, to the Occupied Palestinian Territory, including East Jerusalem, and the other occupied Arab territories","The General Assembly, Recalling its relevant resolutions, including its resolution 58/292 of 6 May 2004, Bearing in mind the relevant resolutions of the Security Council, Recalling the Regulations annexed to the Hague Convention IV of 1907,! the Geneva Convention relative to the Protection of Civilian Persons in Time of War, of 12 August 1949,2 and relevant provisions of customary law, including those codified in Additional Protocol 13 to the four Geneva Conventions,4 1 See Carnegie Endowment for International Peace, The Hague Conventions and Declarations of 1899 and 1907 (New York, Oxford University Press, 1915). 04-59875 (E) 101104 *0459875* Having considered the report of the Special Committee to Investigate Israeli Practices Affecting the Human Rights of the Palestinian People and Other Arabs of the Occupied Territories> and the relevant reports of the Secretary-General,® Considering that the promotion of respect for the obligations arising from the Charter of the United Nations and other instruments and rules of international law is among the basic purposes and principles of the United Nations, Taking into account the advisory opinion rendered on 9 July 2004 by the International Court of Justice,” and noting in particular the Court’s finding that the Fourth Geneva Convention remains applicable in the Occupied Palestinian Territory, including East Jerusalem, and that Israel is in breach of several of the provisions of the Convention, Noting the convening for the first time, on 15 July 1999, of a Conference of High Contracting Parties to the Fourth Geneva Convention, as recommended by the General Assembly in its resolution ES-10/6 of 9 February 1999, on measures to enforce the Convention in the Occupied Palestinian Territory, including East Jerusalem, and to ensure respect thereof in accordance with article 1 common to the four Geneva Conventions, and aware of the statement adopted by the Conference, Welcoming the reconvening of the Conference of High Contracting Parties to the Fourth Geneva Convention on 5 December 2001 in Geneva and stressing the importance of the Declaration adopted by the Conference, and underlining the need for the parties to follow up the implementation of the Declaration, Welcoming and encouraging the initiatives by States parties to the Convention, both individually and collectively, according to article 1 common to the four Geneva Conventions, aimed at ensuring respect for the Convention, Stressing that Israel, the occupying Power, should comply strictly with its obligations under international law, including international humanitarian law, 1. Reaffirms that the Geneva Convention relative to the Protection of Civilian Persons in Time of War, of 12 August 1949,% is applicable to the Occupied Palestinian Territory, including East Jerusalem, and other Arab territories occupied by Israel since 1967; 2. Demands that Israel accept the de jure applicability of the Convention in the Occupied Palestinian Territory, including East Jerusalem, and other Arab territories occupied by Israel since 1967, and that it comply scrupulously with the provisions of the Convention; 3. Calls upon all High Contracting Parties to the Convention, in compliance with article 1 common to the four Geneva Conventions and in respect of the advisory opinion of the International Court of Justice of 9 July 2004, to continue to exert all efforts to ensure respect for its provisions by Israel, the occupying Power, in the Occupied Palestinian Territory, including East Jerusalem, and other Arab territories occupied by Israel since 1967; 5 A/59/381. 6 A/59/338, A/59/339 and A/59/343-A/59/345. 7 See A/ES-10/273. A/C.4/59/L.15 4. Reiterates the need for speedy implementation of the relevant recommendations contained in its resolutions of the tenth emergency special session, including resolution ES-10/15 of 20 July 2004, with regard to ensuring respect by Israel, the occupying Power, for the provisions of the Convention; 5. Requests the Secretary-General to report to the General Assembly at its sixtieth session on the implementation of the present resolution.",11/09/2004,2004_534800,Djibouti,N/A,yes
2004,General Assembly,Special Political And Decolonization Committee,Fifty-ninth session,76,Report of the Special Committee to Investigate Israeli Practices Affecting the Human Rights of the Palestinian People and Other Arabs of the Occupied Territories,"Algeria, Bahrain, Brunei Darussalam, Comoros, Cuba, Djibouti, Egypt, Guinea, Indonesia, Iraq, Jordan, Kuwait, Malaysia, Mali, Morocco, Oman, Qatar, Saudi Arabia, Somalia, Sudan, Tunisia, United Arab Emirates, Yemen and Palestine",N/A,"Israeli practices affecting the human rights of the Palestinian people in the Occupied Palestinian Territory, including East Jerusalem","The General Assembly, Recalling its relevant resolutions, including resolution 58/292 of 6 May 2004, as well as those adopted at its tenth emergency special session, including resolution ES-10/15 of 20 July 2004, Recalling also the relevant resolutions of the Commission on Human Rights, Bearing in mind the relevant resolutions of the Security Council, Having considered the report of the Special Committee to Investigate Israeli Practices Affecting the Human Rights of the Palestinian People and Other Arabs of the Occupied Territories! and the report of the Secretary-General,2 Taking note of the report of the Human Rights Inquiry Commission established by the Commission on Human Rights3 and the recent reports of the Special Rapporteur of the Commission on Human Rights on the situation of human rights in the Palestinian territories occupied by Israel since 1967,4 04-59891 (E) 101104 *0459891~* A/C.A4/59/L.17 Taking into account the advisory opinion rendered on 9 July 2004 by the International Court of Justice,5 and noting in particular the conclusion of the Court that the construction of the wall by Israel, the occupying Power, in the Occupied Palestinian Territory, including in and around East Jerusalem, constitutes breaches by Israel of a number of its obligations under the applicable international humanitarian laws and human rights instruments, Bearing in mind the International Covenant on Civil and Political Rights,¢ the International Covenant on Economic, Social and Cultural Rights® and the Convention on the Rights of the Child” and the determination by the Court that these instruments are applicable in the Occupied Palestinian Territory and that the protection offered by human rights conventions does not cease in case of armed conflict, Aware of the responsibility of the international community to promote human rights and ensure respect for international law, and recalling in this regard its resolution 2625 (XXV) of 24 October 1970, Reaffirming the principle of the inadmissibility of the acquisition of territory by force, Reaffirming also the applicability of the Geneva Convention relative to the Civilian Persons in Time of War, of 12 August 1949,8 to the Occupied Palestinian Territory, including East Jerusalem, and other Arab territories occupied by Israel since 1967, Reaffirming further the obligation of the States parties to the Fourth Geneva Convention® under articles 146, 147 and 148 with regard to penal sanctions, grave breaches and responsibilities of the High Contracting Parties, Stressing the need for full compliance with the Israeli-Palestinian agreements reached within the context of the Middle East peace process and the implementation of the Quartet road map to a permanent two-State solution to the Israeli-Palestinian conflict,® Concerned about the continuing systematic violation of the human rights of the Palestinian people by Israel, the occupying Power, including that arising from the excessive and indiscriminate use of force, the use of collective punishment, the reoccupation and closure of areas, the confiscation of land, the establishment and expansion of settlements, the construction of the wall inside the Occupied Palestinian Territory in departure from the Armistice Line of 1949, the destruction of property and all other actions by it designed to change the legal status, geographical nature and demographic composition of the Occupied Palestinian Territory, including East Jerusalem, Gravely concerned by the military attacks that have occurred since 28 September 2000 and that have led to thousands of deaths among Palestinian civilians, including more than 750 children, and tens of thousands of injuries, 8 United Nations, Treaty Series, vol. 75, No. 973. 9 S/2003/529, annex. A/C.4/59/L.17 Gravely concerned also by the use of suicide bombing attacks against Israeli civilians resulting in extensive loss of life and injury, Expressing deep concern about the extensive destruction caused by the Israeli occupying forces, including the destruction of homes and properties, of religious, cultural and historical sites, of vital infrastructure and institutions of the Palestinian Authority, and of agricultural land throughout Palestinian cities, towns, villages and refugee camps, Expressing deep concern also about the Israeli policy of closure and the severe restrictions, including curfews, that continue to be imposed on the movement of persons and goods, including medical and humanitarian personnel and goods, throughout the Occupied Palestinian Territory, including East Jerusalem, and the consequent negative impact on the socio-economic situation of the Palestinian people, which remains that of a dire humanitarian crisis, Expressing concern that thousands of Palestinians continue to be held in Israeli prisons or detention centres under harsh conditions that impair their well-being, and also expressing concern about the ill-treatment and harassment of any Palestinian prisoners and all reports of torture, Convinced of the need for an international presence to monitor the situation, to contribute to ending the violence and protecting the Palestinian civilians and to help the parties to implement agreements reached, and, in this regard, recalls the positive contribution of the Temporary International Presence in Hebron, Stressing the necessity for the full implementation of all relevant Security Council resolutions, 1. Determines that all measures and actions taken by Israel, the occupying Power, in the Occupied Palestinian Territory, including East Jerusalem, in violation of the relevant provisions of the Geneva Convention relative to the Protection of Civilian Persons in Time of War, of 12 August 1949, and contrary to the relevant resolutions of the Security Council, are illegal and have no validity; 2. Demands that Israel, the occupying Power, comply fully with the provisions of the Fourth Geneva Convention of 1949% and cease immediately all measures and actions taken in violation and in grave breach of the Convention, including the extrajudicial executions; 3. Condemns all acts of violence, including all acts of terror, provocation, incitement and destruction, especially the excessive and indiscriminate use of force by the Israeli occupying forces against Palestinian civilians, resulting in extensive loss of life, vast numbers of injuries and massive destruction of homes, properties, agricultural lands and vital infrastructure; 4. Condemns also all unlawful actions taken by Israel, the occupying Power, in the Occupied Palestinian Territory since September 2000, including, inter alia, in the Jenin refugee camp in April 2002, the Rafah refugee camp in May 2004 and the Jabaliya refugee camp in October 2004, which led to extensive loss of life, injury, widespread destruction and the displacement and dispossession of many Palestinian civilians; A/C.A4/59/L.17 5. Demands that Israel, the occupying Power, cease all practices and actions which violate the human rights of the Palestinian people and that it abide scrupulously by its obligations under human rights law; 6. Demands also that Israel, the occupying Power, comply with its legal obligations under international law, as mentioned in the advisory opinion rendered on 9 July 2004 by the International Court of Justice® and as demanded in resolution ES-10/15,° and that, accordingly, it cease the construction of the wall in the Occupied Palestinian Territory, including in and around East Jerusalem, dismantle forthwith the structure situated therein, repeal or render ineffective all legislative and regulatory acts relating thereto, and make reparation for all damage caused by the construction of the wall; 7. Stresses the need to preserve the territorial integrity of all the Occupied Palestinian Territory and to guarantee the freedom of movement of persons and goods within the Palestinian territory, including the removal of restrictions on movement into and from East Jerusalem, and the freedom of movement to and from the outside world; 8. Requests the Secretary-General to report to the General Assembly at its sixtieth session on the implementation of the present resolution.",11/08/2004,2004_534801,Djibouti,N/A,yes
