year,Council,Committee,Session,Agenda item,Agenda detail,cosponsored countries,body title number,body title detail,body text,date,file,filecountry,footnote,scanned
2004,General Assembly,N/A,Fifty-eighth session,N/A,United Nations AssiLs7/add.1,"Azerbaijan, Bangladesh, Colombia, El Salvador, Israel, Japan, Kazakhstan, Kuwait, Lebanon, Liechtenstein, Mongolia, Nicaragua, Norway, Paraguay, Peru, Poland, Qatar, Romania, Seychelles, South Africa, Suriname, Ukraine and Yemen",N/A,"Sixth International Conference of New or Restored Democracies, to be held in Doha in 2006","Addendum Add the following countries to the list of sponsors of the resolution: Afghanistan, Argentina, Armenia, Belarus, Belize, Brazil, Bulgaria, Burkina Faso, Cambodia, Canada, Chile, Costa Rica, Djibouti, Ecuador, Egypt, Guatemala, Iceland, India, Madagascar, Mali, Mauritius, Oman, Philippines, Republic of Korea, Republic of Moldova, Sudan and Thailand 04-23480 (E) 110204 = OAZ2=3A80¢",02/09/2004,2004_515251,Djibouti,N/A,yes
2004,General Assembly,N/A,Fifty-eighth session,160,Global road safety crisis,Oman,N/A,Improving global road safety,"Addendum Add the following countries to the list of sponsors of the resolution: Afghanistan, Algeria, Argentina, Armenia, Australia, Azerbaijan, Bahrain, Bangladesh, Brunei Darussalam, China, Costa Rica, Djibouti, Ecuador, Egypt, Fiji, France, Germany, Guatemala, Guyana, Iceland, Indonesia, Iran (Islamic Republic of), Ireland, Israel, Kazakhstan, Kuwait, Lebanon, Liechtenstein, Luxembourg, Malaysia, Monaco, Morocco, Nauru, Nepal, Pakistan, Panama, Portugal, Qatar, Republic of Korea, Republic of Moldova, Romania, Russian Federation, Rwanda, Saudi Arabia, Senegal, Singapore, Slovenia, South Africa, Sudan, Switzerland, Syrian Arab Republic, Thailand, the former Yugoslav Republic of Macedonia, Trinidad and Tobago, Tunisia, Turkey, Turkmenistan, United Arab Emirates, United Kingdom of Great Britain and Northern Ireland, Venezuela, Viet Nam, Yemen and Zambia 04-31082 (E) 150404 A1",04/14/2004,2004_519535,Djibouti,N/A,yes
2004,General Assembly,N/A,Fifty-eighth session,38,Question of Palestine,"Algeria, Bahrain, Bangladesh, Comoros, Cuba, Djibouti, Egypt, Indonesia, Jordan, Kuwait, Lebanon, Libyan Arab Jamahiriya, Malaysia, Mauritania, Morocco, Namibia, Oman, Qatar, Saudi Arabia, Senegal, Somalia, South Africa, Sudan, Syrian Arab Republic, Tunisia, United Arab Emirates, Yemen and Palestine",N/A,"Status of the Occupied Palestinian Territory, including East Jerusalem","The General Assembly, Recalling its resolutions 3237 (XXIX) of 22 November 1974, 43/177 of 15 December 1988 and 52/250 of 7 July 1998, Recalling also Security Council resolutions 242 (1967), 338 (1973), 1397 (2002) and 1515 (2003), Recalling further the relevant provisions of international law, as well as relevant United Nations resolutions, with regard to Israeli settlements and to Occupied East Jerusalem, Reaffirming the principle of the inadmissibility of the acquisition of territory by force, Noting that Palestine, in its capacity as observer and pending its attainment of full membership in the United Nations, does not present credentials to the General Assembly, Affirming the need to enable the Palestinian people to exercise sovereignty over the territory occupied by Israel since 1967 and to achieve independence in their State, Palestine, Desirous of contributing to the achievement of the inalienable rights of the Palestinian people and the attainment of a just and comprehensive negotiated peace settlement in the Middle East resulting in two viable, sovereign and independent 04-33752 (E) 040504 *0433752* States, Israel and Palestine, based on the Armistice Line of 1949 and living side by side in peace and security, Affirms that the status of the Palestinian territory occupied since 1967, including East Jerusalem, remains one of military occupation, and affirms, in accordance with the rules and principles of international law, that the Palestinian people have the right to self-determination and to sovereignty over this territory and that Israel, the occupying Power, has no sovereignty over any part of this territory.",05/03/2004,2004_520589,Djibouti,N/A,yes
2004,General Assembly,N/A,Fifty-eighth session,38,Question of Palestine,"Algeria, Bahrain, Bangladesh, Brunei Darussalam, Comoros, Cuba, Djibouti, Egypt, Indonesia, Jordan, Kuwait, Lebanon, Libyan Arab Jamahiriya, Malaysia, Mauritania, Morocco, Namibia, Oman, Qatar, Saudi Arabia, Senegal, Somalia, South Africa, Sudan, Syrian Arab Republic, Tunisia, United Arab Emirates, Yemen and Palestine",N/A,"Status of the Occupied Palestinian Territory, including East Jerusalem","The General Assembly, Recalling its resolutions 3237 (XXIX) of 22 November 1974, 43/177 of 15 December 1988 and 52/250 of 7 July 1998, Recalling also Security Council resolutions 242 (1967) of 22 November 1967, 338 (1973) of 22 October 1973, 1397 (2002) of 12 March 2002 and 1515 (2003) of 19 November 2003, Recalling further the relevant provisions of international law as well as relevant United Nations resolutions with regard to Israeli settlements and to Occupied East Jerusalem, Reaffirming the principle of the inadmissibility of the acquisition of territory by force, Noting that Palestine, in its capacity as observer and pending its attainment of full membership in the United Nations, does not present credentials to the General Assembly, Affirming the need to enable the Palestinian people to exercise sovereignty and to achieve independence in their State, Palestine, 1. Affirms that the status of the Palestinian territory occupied since 1967, including East Jerusalem, remains one of military occupation, and affirms, in accordance with the rules and principles of international law and relevant resolutions of the United Nations, including Security Council resolutions, that the Palestinian people have the right to self-determination and to sovereignty over their territory and that Israel, the occupying Power, has only the duties and obligations of 04-34128 (E) 060504 *0434128* an occupying Power under the Fourth Geneva Convention! and the Regulations annexed to the Hague Convention Respecting the Laws and Customs of War of 1907;2 2. Expresses its determination to contribute to the achievement of the inalienable rights of the Palestinian people and the attainment of a just and comprehensive negotiated peace settlement in the Middle East resulting in two viable, sovereign and independent States, Israel and Palestine, based on the pre-1967 borders and living side by side in peace and security. 1 United Nations, Treaty Series, vol. 75, No. 973. 2 See Carnegie Endowment for International Peace, The Hague Conventions and Declarations of 1899 and 1907 (New York, Oxford University Press, 1915).",05/06/2004,2004_520743,Djibouti,N/A,yes
2004,Economic And Social Council,N/A,Substantive session,11,"Economic and social repercussions of the Israeli occupation on the living conditions of the Palestinian people in the occupied Palestinian territory, including Jerusalem, and the Arab population in the occupied Syrian Golan","Algeria,* Bahrain,* Cuba, Djibouti,* Egypt,* Lebanon,* Qatar, Saudi Arabia, Somalia,* Sudan,* Tunisia and Yemen:*",N/A,"Economic and social repercussions of the Israeli occupation on the living conditions of the Palestinian people in the occupied Palestinian territory, including Jerusalem, and the Arab population in the occupied Syrian Golan","The Economic and Social Council, Recalling General Assembly resolution 58/229 of 23 December 2003, Also recalling its resolution 2003/59 of 24 July 2003, Guided by the principles of the Charter of the United Nations affirming the inadmissibility of the acquisition of territory by force, and recalling relevant Security Council resolutions, including resolutions 242 (1967) of 22 November 1967, 338 (1973) of 22 October 1973, 446 (1979) of 22 March 1979, 452 (1979) of 20 July 1979, 465 (1980) of 1 March 1980, 476 (1980) of 30 June 1980, 478 (1980) of 20 August 1980, 497 (1981) of 17 December 1981, 904 (1994) of 18 March 1994, 1073 (1996) of 28 September 1996, 1397 (2002) of 12 March 2002, 1515 (2003) of 19 November 2003 and 1544 (2004) of 19 May 2004, Recalling the resolutions of the tenth emergency special session of the General Assembly, including resolutions ES-10/13 of 21 October 2003 and ES-10/14 of 8 December 2003, Reaffirming the applicability of the Geneva Convention relative to the Protection of Civilian Persons in Time of War, of 12 August 1949,! to the Occupied 04-42819 (E) 160704 *0442819~* Palestinian Territory, including East Jerusalem, and other Arab territories occupied by Israel since 1967, Stressing the importance of the revival of the Middle East peace process on the basis of Security Council resolutions 242 (1967), 338 (1973), 425 (1978) of 19 March 1978, 1397 (2002), 1515 (2003) and 1544 (2004) and the principle of land for peace, as well as compliance with the agreements reached between the Government of Israel and the Palestine Liberation Organization, the representative of the Palestinian people, Reaffirming the principle of the permanent sovereignty of peoples under foreign occupation over their natural resources, Convinced that the Israeli occupation has gravely impeded the efforts to achieve sustainable development and a sound economic environment in the Occupied Palestinian Territory, including East Jerusalem, and the occupied Syrian Golan, Gravely concerned about the deterioration of the economic and living conditions of the Palestinian people in the Occupied Palestinian Territory, including East Jerusalem, and of the Arab population of the occupied Syrian Golan and the exploitation by Israel, the occupying Power, of their natural resources, Alarmed by the grave impact on the economic and social conditions of the Palestinian people caused by the construction of the wall by Israel inside the Occupied Palestinian Territory and the resulting violation of their economic and social rights, including the rights to work, to health, to education and to an adequate standard of living, Gravely concerned at the extensive destruction by Israel, the occupying Power, of agricultural land and orchards in the Occupied Palestinian Territory, including East Jerusalem, during the recent period, including, and in particular, as a result of the construction of the wall, Welcoming the Advisory Opinion rendered on 9 July 2004 by the International Court of Justice on the Legal Consequences of the Construction of a Wall in the Occupied Palestinian Territory,2 Expressing grave concern about the continuation of the recent tragic and violent events since September 2000 that have led to many deaths and injuries, Aware of the important work being done by the United Nations and the specialized agencies in support of the economic and social development of the Palestinian people, as well as the assistance being provided in the humanitarian field, Conscious of the urgent need for the reconstruction and development of the economic and social infrastructure of the Occupied Palestinian Territory, including East Jerusalem, as well as the urgent need to address the dire humanitarian crisis facing the Palestinian people, 1. Stresses the need to preserve the national unity and the territorial integrity of the Occupied Palestinian Territory, including East Jerusalem, and to guarantee the freedom of movement of persons and goods in the Territory, including E/2004/L.25 the removal of restrictions on going into and from East Jerusalem, and the freedom of movement to and from the outside world; 2. Also stresses the vital importance of the construction and operation of the seaport in Gaza and safe passage for the economic and social development of the Palestinian people; 3. Demands the complete cessation of all acts of violence, including all acts of terror, provocation, incitement and destruction; 4. Calls upon Israel, the occupying Power, to end its occupation of Palestinian cities, towns and other populated centres, to end the imposition of all forms of closure and curfew and to cease its destruction of homes and properties, economic institutions and agricultural fields; 5. Reaffirms the inalienable right of the Palestinian people and the Arab population of the occupied Syrian Golan to all their natural and economic resources, and calls upon Israel, the occupying Power, not to exploit, endanger or cause loss or depletion of these resources; 6. Also reaffirms that Israeli settlements in the Occupied Palestinian Territory, including East Jerusalem, and the occupied Syrian Golan, are illegal and an obstacle to economic and social development; 7. Stresses the importance of the work of the organizations and agencies of the United Nations and of the United Nations Special Coordinator for the Middle East Peace Process and Personal Representative of the Secretary-General to the Palestine Liberation Organization and the Palestinian Authority; 8. Urges Member States to encourage private foreign investment in the Occupied Palestinian Territory, including East Jerusalem, in infrastructure, job- creation projects and social development in order to alleviate the hardship of the Palestinian people and improve their living conditions; 9. Requests the Secretary-General to submit to the General Assembly at its fifty-ninth session, through the Economic and Social Council, a report on the implementation of the present resolution and to continue to include, in the report of the United Nations Special Coordinator, an update on the living conditions of the Palestinian people, in collaboration with relevant United Nations agencies; 10. Decides to include the item entitled “Economic and social repercussions of the Israeli occupation on the living conditions of the Palestinian people in the Occupied Palestinian Territory, including East Jerusalem, and the Arab population in the occupied Syrian Golan” in the agenda of its substantive session of 2005.",07/12/2004,2004_526131,Djibouti,"* In accordance with rule 72 of the rules of procedure of the Economic and Social Council. 1 United Nations, Treaty Series, vol. 75, No. 973.",yes
2004,General Assembly,N/A,special session,5,Illegal Israeli actions in Occupied East Jerusalem and the rest of the Occupied Palestinian Territory,"Algeria, Bahrain, Bangladesh, Belize, Brunei Darussalam, Comoros, Cuba, Djibouti, Egypt, Guinea, Indonesia, Iraq, Jordan, Kuwait, Lebanon, Libyan Arab Jamahiriya, Malaysia, Mauritania, Morocco, Namibia, Oman, Pakistan, Qatar, Saudi Arabia, Senegal, Somalia, South Africa, Sudan, Syrian Arab Republic, Tunisia, United Arab Emirates, Yemen and Palestine: revised",N/A,"Advisory Opinion of the International Court of Justice on the Legal Consequences of the Construction of a Wall in the Occupied Palestinian Territory, including in and around East Jerusalem","The General Assembly, Guided by the principles enshrined in the Charter of the United Nations, Considering that the promotion of respect for the obligations arising from the Charter and other instruments and rules of international law is among the basic purposes and principles of the United Nations, Recalling General Assembly resolution 2625 (XXV) of 24 October 1970, on the Declaration on Principles of International Law concerning Friendly Relations and Cooperation among States in accordance with the Charter of the United Nations, Reaffirming the illegality of any territorial acquisition resulting from the threat or use of force, Recalling the Regulations annexed to the Hague Convention respecting the Laws and Customs of War on Land, of 1907,! I See Carnegie Endowment for International Peace, The Hague Conventions and Declarations of 1899 and 1907 (New York, Oxford University Press, 1915). 04-43347 (E) 210704 *0443347* A/ES-10/L.18/Rev.1 Recalling also the Geneva Convention relative to the Protection of Civilian Persons in Time of War, of 12 August 1949,2 and relevant provisions of customary law, including those codified in Protocol I Additional to the Geneva Conventions,3 Recalling further the International Covenant on Civil and Political Rights,* the International Covenant on Economic, Social and Cultural Rights® and the Convention on the Rights of the Child,> Reaffirming the permanent responsibility of the United Nations towards the question of Palestine until it is resolved in all aspects in a satisfactory manner on the basis of international legitimacy, Recalling relevant Security Council resolutions, including resolutions 242 (1967) of 22 November 1967, 338 (1973) of 22 October 1973, 446 (1979) of 22 March 1979, 452 (1979) of 20 July 1979, 465 (1980) of 1 March 1980, 476 (1980) of 30 June 1980, 478 (1980) of 20 August 1980, 904 (1994) of 18 March 1994, 1073 (1996) of 28 September 1996, 1397 (2002) of 12 March 2002, 1515 (2003) of 19 November 2003 and 1544 (2004) of 19 May 2004, Recalling also the resolutions of its tenth emergency special session on illegal Israeli actions in Occupied East Jerusalem and the rest of the Occupied Palestinian Territory, Reaffirming the most recent resolution of the fifty-eighth session of the General Assembly, resolution 58/292 of 6 May 2004, on the status of the Occupied Palestinian Territory, including East Jerusalem, Reaffirming also the right of the Palestinian people to self-determination, including their right to their independent State of Palestine, Reaffirming further the commitment to the two-State solution of Israel and Palestine, living side by side in peace and security within recognized borders, based on the pre-1967 borders, Condemning all acts of violence, terrorism and destruction, Calling upon both parties to fulfil their obligations under relevant provisions of the road map, the Palestinian Authority to undertake visible efforts on the ground to arrest, disrupt and restrain individuals and groups conducting and planning violent attacks and the Government of Israel to take no actions undermining trust, including deportations and attacks on civilians and extrajudicial killings, Reaffirming that all States have the right and the duty to take actions in conformity with international law and international humanitarian law to counter deadly acts of violence against their civilian population in order to protect the lives of their citizens, Recalling its resolution ES-10/13 of 21 October 2003, in which it demanded that Israel stop and reverse the construction of the wall in the Occupied Palestinian Territory, including in and around East Jerusalem, 2 United Nations, Treaty Series, vol. 75, No. 973. 3 Ibid., vol. 1125, No. 17512. A/ES-10/L.18/Rev.1 Recalling also its resolution ES-10/14 of 8 December 2003, in which it requested the International Court of Justice to urgently render an advisory opinion on the following question: “What are the legal consequences arising from the construction of the wall being built by Israel, the occupying Power, in the Occupied Palestinian Territory, including in and around East Jerusalem, as described in the report of the Secretary-General, considering the rules and principles of international law, including the Fourth Geneva Convention, of 1949, and relevant Security Council and General Assembly resolutions?” Having received with respect the Advisory Opinion of the International Court of Justice on the Legal Consequences of the Construction of a Wall in the Occupied Palestinian Territory,® rendered on 9 July 2004, Noting in particular that the Court replied to the question put forth by the General Assembly in its resolution ES-10/14 as follows:” “A. “B . “C. “D. “E. The construction of the wall being built by Israel, the occupying Power, in the Occupied Palestinian Territory, including in and around East Jerusalem, and its associated regime, are contrary to international law; Israel is under an obligation to terminate its breaches of international law; it is under an obligation to cease forthwith the works of construction of the wall being built in the Occupied Palestinian Territory, including in and around East Jerusalem, to dismantle forthwith the structure therein situated, and to repeal or render ineffective forthwith all legislative and regulatory acts relating thereto, in accordance with paragraph 151 of this Opinion; Israel is under an obligation to make reparation for all damage caused by the construction of the wall in the Occupied Palestinian Territory, including in and around East Jerusalem; All States are under an obligation not to recognize the illegal situation resulting from the construction of the wall and not to render aid or assistance in maintaining the situation created by such construction; all States Parties to the Fourth Geneva Convention Relative to the Protection of Civilian Persons in Time of War of 12 August 1949 have in addition the obligation, while respecting the United Nations Charter and international law, to ensure compliance by Israel with international humanitarian law as embodied in that Convention; The United Nations, and especially the General Assembly and the Security Council, should consider what further action is required to bring to an end the illegal situation resulting from the construction of the wall and the associated regime, taking due account of the present Advisory Opinion.” 6 A/ES-10/273 and Corr.1. 7 Ibid., para. 163. A/ES-10/L.18/Rev.1 Noting that the Court concluded that “the Israeli settlements in the Occupied Palestinian Territory (including East Jerusalem) have been established in breach of international law”,8 Noting also the statement made by the Court that “Israel and Palestine are under an obligation scrupulously to observe the rules of international humanitarian law, one of the paramount purposes of which is to protect civilian life”,® and that “in the Court’s view, this tragic situation can be brought to an end only through implementation in good faith of all relevant Security Council resolutions, in particular resolutions 242 (1967) and 338 (1973)”,’ Considering that respect for the International Court of Justice and its functions is essential to the rule of law and reason in international affairs, 1. Acknowledges the Advisory Opinion of the International Court of Justice of 9 July 2004 on the Legal Consequences of the Construction of a Wall in the Occupied Palestinian Territory,® including in and around East Jerusalem; 2. Demands that Israel, the occupying Power, comply with its legal obligations as mentioned in the Advisory Opinion; 3. Calls upon all States Members of the United Nations to comply with their legal obligations as mentioned in the Advisory Opinion; 4. Requests the Secretary-General to establish a register of damage caused to all natural or legal persons concerned in connection with paragraphs 152 and 153 of the Advisory Opinion; 5. Decides to reconvene to assess the implementation of the present resolution, with the aim of ending the illegal situation resulting from the construction of the wall and its associated regime in the Occupied Palestinian Territory, including East Jerusalem; 6. Calls on both the Government of Israel and the Palestinian Authority to immediately implement their obligations under the road map, in cooperation with the Quartet, as endorsed by Security Council resolution 1515 (2003), to achieve the vision of two States living side by side in peace and security, and emphasizes that both Israel and the Palestinian Authority are under an obligation scrupulously to observe the rules of international humanitarian law; 7. Calls upon all States Parties to the Fourth Geneva Convention of 19497 to ensure respect by Israel for the Convention, and invites Switzerland, in its capacity as the depositary of the Geneva Conventions, to conduct consultations and to report to the General Assembly on the matter, including with regard to the possibility of resuming the Conference of High Contracting Parties to the Fourth Geneva Convention; 8. Decides to adjourn the tenth emergency special session temporarily and to authorize the President of the General Assembly at its most recent session to resume its meeting upon request from Member States. 8 Ibid., para. 120. 9 Ibid., para. 162.",07/20/2004,2004_526466,Djibouti,N/A,yes
