year,Council,Committee,Session,Agenda item,Agenda detail,cosponsored countries,body title number,body title detail,body text,date,file,filecountry,footnote,scanned
2010,General Assembly,N/A,Sixty-fourth session,70 (a),"Strengthening of the coordination of humanitarian and disaster relief assistance of the United Nations, including special economic assistance: strengthening of the coordination of emergency humanitarian assistance","Australia, Brazil, Cameroon, Chile, Colombia, Dominican Republic, Japan, Kazakhstan, Norway, Peru, Philippines, Saint Vincent and the Grenadines, Spain and Uruguay",N/A,"Humanitarian assistance, emergency relief and rehabilitation for Haiti in response to the devastating effects of the earthquake in that country","Addendum Add the following countries to the list of sponsors of the resolution: Albania, Algeria, Andorra, Antigua and Barbuda, Argentina, Armenia, Austria, Azerbaijan, Bahamas, Bangladesh, Barbados, Belarus, Belgium, Belize, Benin, Bosnia and Herzegovina, Bulgaria, Burkina Faso, Burundi, Cambodia, Canada, Central African Republic, Comoros, Congo, Costa Rica, Croatia, Cuba, Cyprus, Czech Republic, Denmark, Ecuador, Egypt, El] Salvador, Eritrea, Estonia, Finland, France, Gambia, Georgia, Germany, Ghana, Greece, Grenada, Guatemala, Guyana, Haiti, Honduras, Hungary, Iceland, India, Indonesia, Iran (Islamic Republic of), Ireland, Israel, Italy, Jamaica, Jordan, Lao People’s Democratic Republic, Latvia, Lebanon, Liechtenstein, Lithuania, Luxembourg, Madagascar, Malta, Mauritius, Mexico, Monaco, Mongolia, Montenegro, Morocco, Nepal, Netherlands, New Zealand, Nigeria, Pakistan, Panama, Papua New Guinea, Poland, Portugal, Republic of Korea, Republic of Moldova, Romania, Russian Federation, Rwanda, Saint Lucia, San Marino, Senegal, Serbia, Seychelles, Singapore, Slovakia, Slovenia, South Africa, Sudan, Suriname, Sweden, Switzerland, Thailand, the former Yugoslav Republic of Macedonia, Tonga, Trinidad and Tobago, Tunisia, Turkey, Turkmenistan, Ukraine, United Kingdom of Great Britain and Northern Ireland, United Republic of Tanzania, United States of America, Viet Nam, Yemen and Zambia 10-21729 Hi 260110 CNY A A",01/22/2010,2010_675700,Ecuador,N/A,yes
2010,General Assembly,Commission On Human Rights,special session,N/A,United Nations Avurcys-13/L.1,"Algeria’, Angola, Argentina, Armenia’, Austria’, Bahrain, Belarus’, Belgium, Bangladesh, Bolivia (Plurinational State of), Bosnia and Herzegovina, Botswana’, Brazil, Bulgaria*, Burkina Faso, Chile, China, Colombia’, Costa Rica’, Croatia’, Cuba, Cyprus’, Djibouti, Denmark’, Dominican Republic’, Ecuador’, Estonia’, Finland’, France, Gabon, Germany’, Ghana, Greece’, Guatemala’, Haiti’, Hungary, Iceland’, India, Ireland’, Italy, Japan, Kenya’, Kuwait’, Latvia’, Lebanon’, Lithuania’, Luxembourg’, Malta’, Mexico, Morocco’, Nicaragua, Nigeria, Norway, Panama’, Paraguay , Peru’, Philippines, Poland’, Portugal’, Qatar, Republic of Korea, Romania’, Russian Federation, Saudi Arabia, Senegal, Slovakia, Slovenia, Somalia’, Spain’, Syrian Arab Republic’, Trinidad and Tobago’, Tunisia’, Turkey’, Ukraine, United Kingdom of Great Britain and Northern Ireland, Uruguay, Venezuela (Bolivarian Republic of)"", Viet Nam* and Zambia",N/A,"S-13/... The support of the Human Rights Council to the Recovery Process in Haiti after the Earthquake of January 12, 2010: a Human Rights Approach","The Human Rights Council, Expressing its sincere condolences and deepest sympathy and solidarity for all victims and their families, including all UN personnel, as well as for the government and the people of Haiti affected by the devastating earthquake of 12 January 2010, Reaffirming its previous outcomes on the situation of Human Rights in Haiti, in particular Presidential Statements PRST/9/1 and PRST/6/1, Concerned by the dire human and material losses and suffering sustained as a result of the earthquake, as well as of its impact on the full enjoyment of all human rights in the affected country, Concerned also that the effects of the earthquake further exacerbated existing challenges to the full enjoyment of all human rights in Haiti and expressing concern over the medium and long-term consequences of the disaster, including its social, economic and development aspects, “ Non-member State of the Human Rights Council. GE.10- 10505 A/HRC/S-13/L.1 Reiterating that the promotion and protection of all human rights — economic, civil, social, political and cultural rights, including the right to development — are indispensable elements for peace, stability and development, Acknowledging the extraordinary situation in Haiti, particularly in Port au Prince, Léogane and Jacmel, which requires an equally extraordinary response led by the government of Haiti, in collaboration with the international community, Expressing its appreciation for the prompt response, solidarity and assistance provided by the U.N. system, through U.N. agencies, programs and funds, and the United Nations Stabilization Mission in Haiti (MINUSTAH), as well as by the U.N. Member States, the international community, civil society, the private sector and individuals, Reiterating the need for the United Nations system to respond swiftly to requests for assistance by the affected country and to ensure that the assistance provided is timely, adequate, effective and coherent and coordinated among all development actors, in particular the government of Haiti. Underscoring the need for long-term and sustainable support of the international community for the government of Haiti to promote the respect for human rights, the rule of law and good governance, Recalling the primary responsibility and competence of the Haitian government to promoting and protecting all human rights in the country, Bearing in mind that the tragedy has obliterated the ongoing efforts of the Haitian government to prepare the national report to be presented in May, 2010, at the eighth session of the Working Group of the Universal Periodic Review (UPR), Mindful of UN General Assembly Resolution A/64/250, 1. Calls upon the international community to continue to ensure adequate and coordinated support to the government and the people of Haiti in their efforts to overcome the challenges arising from the earthquake, keeping in mind the importance of integrating a human-rights approach; 2. Reaffirms the sovereignty of Haiti and its territorial integrity and stresses the central role of the Haitian government in establishing national priorities for the recovery process; 3. Underscores the importance of renewed and sustainable commitment to address the existing and the additional challenges to promote and protect all human rights in Haiti, and further encourages the government of Haiti to continue its efforts to promote and protect all human rights in the country; 4. Expresses its concern about the present human rights situation in Haiti, in particular the vulnerable situation of children, women, internally displaced persons, the elderly, persons with disabilities and wounded; 5. Underlines the need to address the additional obstacles arising from the devastation in such areas as access to food, adequate housing, health care, water and sanitation, education, work and the civil registry; 6. Emphasizes, in this context, the importance of reconstructing national institutions and of providing cooperation, capacity-building and technical assistance to the government and the people of Haiti, in accordance with the needs and the requests made by the concerned country; A/HRC/S-13/L.1 7. Welcomes and further encourages the responses provided by the U.N. system and by the international community at large to assist the government of Haiti to promote and protect all human rights in Haiti in the aftermath of the earthquake, such as, inter alia, those resources aiming at providing cash and food for work, as well as those aiming at securing the full protection of the rights of all those in vulnerable situations, especially children and women; 8. Underlines the importance of protecting children from any violence, injury or abuse, mal-treatment or exploitation, and of ensuring that separated or unaccompanied children do re-unite with their families and those left orphaned receive immediate attention and necessary protection, and, in this context, underscores the need of cooperation and assistance to the government of Haiti from all U.N. members and relevant organs and bodies of the U.N. systems, in particular UNICEF; 9. Emphasizes the need to apply a gender based approach in the recovery process; 10. Decides to act favourably, in view of the exceptional circumstances that confront it, upon the request of Haiti, to postpone relevant deadlines related to its Universal Periodic Review within the Human Rights Council to a date no later than December 2011; 11. Welcomes the initiative to establish a joint protection team with the participation of the High Commissioner for Human Rights; 12. Invites the United Nations High Commissioner for Human Rights to identify, in collaboration with the Haitian government, areas for cooperation and technical assistance with Haiti, on the basis of the expertise and the presence of the U.N. system on the ground, in particular the Office of the High Commissioner for Human Rights, in collaboration with special procedures, a view to present suggestions in this regard to the Human Rights Council in its 14"""" Regular Session.",01/27/2010,2010_676238,Ecuador,N/A,yes
2010,General Assembly,N/A,Sixty-fourth session,126,Sixty-fifth anniversary of the end of the Second World War,"Armenia, Azerbaijan, Belarus, Canada, Croatia, Cuba, Cyprus, Ecuador, Kazakhstan, Kyrgyzstan, Luxembourg, Mongolia, Nicaragua, Peru, Portugal, Republic of Moldova, Romania, Russian Federation, Serbia, Slovenia, South Africa, Tajikistan, Trinidad and Tobago, Turkmenistan, Ukraine, United States of America, Uzbekistan and Viet Nam",N/A,Sixty-fifth anniversary of the end of the Second World War,"The General Assembly, Recalling its resolution 59/26 of 22 November 2004, in which it, inter alia, declared 8 and 9 May as a time of remembrance and reconciliation, Recalling that 2010 will mark the sixty-fifth anniversary of the end of the Second World War, a war which brought untold sorrow to mankind, Stressing that this historic event established the conditions for the creation of the United Nations, designed to save succeeding generations from the scourge of war, Calling upon the States Members of the United Nations to unite their efforts in dealing with new challenges and threats, with the United Nations playing a central role, and to make every effort to settle all disputes by peaceful means in conformity with the Charter of the United Nations and in such a manner that international peace and security are not endangered, Underlining the progress made since the end of the Second World War in overcoming its legacy and towards establishing reconciliation, international and regional cooperation and the promotion of democratic values, human rights and fundamental freedoms, in particular through the United Nations, and the establishment of regional organizations and other appropriate frameworks, 1. Invites all Member States, organizations of the United Nations system, non-governmental organizations and individuals to observe these days in an appropriate manner to pay tribute to all victims of the Second World War; 10-24416 Hil 180210 CAT A A A 2. Requests the President of the General Assembly to hold a special solemn meeting of the General Assembly in the second week of May 2010 in commemoration of all victims of the war; 3. Requests the Secretary-General to bring the present resolution to the attention of all Member States and organizations of the United Nations system and to take measures necessary for its implementation. 10-24416",02/17/2010,2010_676867,Ecuador,N/A,yes
2010,General Assembly,N/A,Sixty-fourth session,46,Global road safety crisis,"Argentina, Armenia, Azerbaijan, Bangladesh, Belarus, Belgium, Benin, Chile, Costa Rica, Cuba, Cyprus, Dominican Republic, Finland, France, Germany, Greece, Hungary, Iceland, India, Israel, Italy, Jamaica, Jordan, Kazakhstan, Lao People’s Democratic Republic, Lebanon, Luxembourg, Malaysia, Mexico, Mongolia, Morocco, Netherlands, Norway, Oman, Peru, Poland, Portugal, Republic of Moldova, Romania, Russian Federation, Saudi Arabia, Serbia, Seychelles, Singapore, Slovenia, Sri Lanka, Sweden, Tajikistan, Thailand, the former Yugoslav Republic of Macedonia, Turkey, Turkmenistan, United Kingdom of Great Britain and Northern Ireland, Uruguay, Uzbekistan, Venezuela (Bolivarian Republic of), Viet Nam and Yemen",N/A,Improving global road safety,"Addendum Add the following countries to the list of sponsors of the resolution: Albania, Algeria, Australia, Bahrain, Canada, Cape Verde, Colombia, Croatia, Czech Republic, Democratic People’s Republic of Korea, Denmark, Ecuador, Egypt, El Salvador, Estonia, Grenada, Haiti, Iraq, Ireland, Japan, Kuwait, Kyrgyzstan, Lithuania, Malta, Mauritius, Monaco, Montenegro, Myanmar, Nepal, New Zealand, Pakistan, Qatar, Saint Lucia, Slovakia, Spain, Sudan, Switzerland, Trinidad and Tobago, Tunisia, Ukraine, United Arab Emirates and United States of America 10-25985 Hil 080310 CAT A A A",03/02/2010,2010_677897,Ecuador,N/A,yes
2010,General Assembly,Commission On Human Rights,Thirteenth session,5,Human rights bodies and mechanisms,"Algeria*, Bangladesh, Belarus*, Bolivia (Plurinational State of), Cuba, Democratic People’s Republic of Korea*, Ecuador*, Indonesia, Iran (Islamic Republic of)*, Nicaragua, Nigeria, Palestine*, Peru*, Sri Lanka*, Uruguay, Venezuela (Bolivarian Republic of)*, Viet Nam*, Zimbabwe*",N/A,13/... The Social Forum,"The Human Rights Council, Recalling all previous resolutions and decisions adopted on the Social Forum by the Commission on Human Rights and its Subcommission on the Promotion and Protection of Human Rights, as well as by the Economic and Social Council, Recalling also its resolutions 5/1 of 18 June 2007, 6/13 of 28 September 2007, 10/4 of 25 March 2009 and 10/29 of 27 March 2009, Bearing in mind that the reduction of poverty and the elimination of extreme poverty remain an ethical and moral imperative of humankind, based on respect for human dignity, and noting the report of the Chairperson-Rapporteur of the 2009 Social Forum (A/HRC/13/51), held in Geneva from 31 August to 2 September 2009, which focused on questions relating to best practices of States in implementing social security programmes from a human rights perspective, the negative impact of economic and financial crises on efforts to combat poverty, and international assistance and cooperation in combating poverty, Reaffirming the unique nature within the United Nations of the Social Forum, which makes possible a dialogue and an exchange between the representatives of Member States, civil society, including grass-roots organizations and intergovernmental organizations, and stressing that the current reform of the United Nations should take into account the contribution of the Social Forum as a vital space for open and fruitful dialogue on issues linked with the national and international environment needed for the promotion of the enjoyment of all human rights by all, Please recycle ee A/HRC/13/L.16 1. Takes note with satisfaction of the report of the 2009 Social Forum submitted by the Chairman-Rapporteur; 2. Takes note with interest of the conclusions and recommendations of the 2009 Social Forum and of the innovative nature of many of them, and calls upon States, international organizations, in particular those with a mandate for poverty eradication, non- governmental organizations, civil society organizations, trade unions and other relevant actors to take them into account when designing and implementing poverty eradication programmes and strategies; 3. Reaffirms the Social Forum as a unique space for interactive dialogue between the United Nations human rights machinery and various stakeholders, including grass-roots organizations, and stresses the need to ensure greater participation of grass-roots organizations and of those living in poverty, particularly women, especially from developing countries, in the Social Forum sessions, and to this end, considers, inter alia, the possibility of the establishment of a voluntary United Nations fund to contribute to providing resources to these organizations so that they may participate in and contribute to the deliberations of future sessions; 4. Underlines the importance of coordinated efforts at the national, regional and international levels for the promotion of social cohesion based on the principles of social justice, equity and solidarity and of addressing the social dimension and challenges of the ongoing globalization process and the negative impact of the current economic and financial crises; 5. Decides that the Social Forum will meet for three working days in 2010, in Geneva, on dates suitable for the participation of representatives of States Members of the United Nations and of the broadest possible range of other stakeholders, especially from developing countries, and decides that, at its next meeting, the Social Forum should focus on: (a) The negative effects of climate change on the full enjoyment of human rights; (b) Measures and actions to address the impact of climate change on the full enjoyment of human rights at the local, national, regional and international levels, including on most vulnerable groups, particularly women and children; (c) | The importance of international assistance and cooperation in addressing the human rights-related impact of climate change; 6. Requests the President of the Council to appoint, as early as possible, from candidates nominated by regional groups, the Chairperson-Rapporteur for the 2010 Social Forum, bearing in mind the principle of regional rotation; 7. Requests the United Nations High Commissioner for Human Rights to consult all actors identified in the present resolution on the issues referred to in paragraph 5 above and to submit a report as a background contribution for the dialogues and debates that will be held at the 2010 Social Forum; 8. Also requests the High Commissioner to facilitate participation in the 2010 Social Forum, in order to contribute to interactive dialogues and debate at the Forum and assist the Chairperson-Rapporteur as resource persons, of up to four relevant Council thematic procedures mandate holders, in particular the independent expert on the question of human rights and extreme poverty and the independent expert on human rights and international solidarity; 9. Decides that the Social Forum will remain open to the participation of representatives of States Members of the United Nations and all other interested stakeholders, such as intergovernmental organizations, different components of the United GE. 10-12242 A/HRC/13/L.16 Nations system, especially mandate holders of thematic procedures and mechanisms of the human rights machinery, regional economic commissions, and specialized agencies and organizations, as well as representatives designated by human rights national institutions and non-governmental organizations in consultative status with the Economic and Social Council, and shall also be open to other non-governmental organizations, whose aims and purposes are in conformity with the spirit, purposes and principles of the Charter of the United Nations, in particular newly emerging actors such as small groups and rural and urban associations from the North and the South, anti-poverty groups, peasants’ and farmers’ organizations and their national and international associations, voluntary organizations, environmental organizations and activists, youth associations, community organizations, trade unions and associations of workers, as well as representatives of the private sector, based on arrangements including Economic and Social Council resolution 1996/31 of 25 July 1996, and practices observed by the Commission on Human Rights, through an open and transparent accreditation procedure, in accordance with the rules of procedure of the Human Rights Council, while ensuring the most effective contribution of these entities; 10. Requests the Office of the High Commissioner to seek effective means of ensuring consultation and the broadest possible participation of representatives from every region, especially those from developing countries, in the Social Forum, including by establishing partnerships with non-governmental organizations, the private sector and international organizations; 11. Requests the Secretary-General to take the appropriate measures to disseminate information about the Social Forum, invite the relevant individuals and organizations to the Social Forum and take all practical measures required for the success of this initiative; 12. Invites the 2010 Social Forum to submit a report containing conclusions and recommendations to the Council; 13. | Requests the Secretary-General to provide the Social Forum with all the services and facilities necessary to fulfil its activities, and requests the High Commissioner to provide all the necessary support to facilitate the convening and proceedings of the Forum; 14. Decides to continue consideration of this issue under the relevant agenda item when the report of the 2010 Social Forum is submitted to the Council. GE. 10-12242",03/18/2010,2010_679296,Ecuador,* Non-Member State of the Human Rights Council.,yes
2010,General Assembly,Commission On Human Rights,Thirteenth session,3,"Promotion and protection of all human rights, civil, political, economic, social and cultural rights, including the right to development","Armenia*, Austria*, Belarus*, Bolivia (Plurinational State of), Bosnia and Herzegovina, Brazil, Canada*, Chile, Colombia*, Costa Rica*, Croatia*, Czech Republic*, Cyprus*, Ecuador*, Egypt, Finland*, France, Germany*, Greece*, Hungary, Latvia*, Lithuania*, Luxembourg*, Mexico, Montenegro*, Netherlands, Nicaragua, Nigeria, Norway, Panama’, Peru*, Philippines, Portugal*, Serbia*, Slovakia, Slovenia, Switzerland*, Togo*, United Kingdom of Great Britain and Northern Ireland, Uruguay, Viet Nam*",N/A,"13/... Trafficking in persons, especially women and children","At its ... meeting, on ... March 2010, the Human Rights Council decided to adopt the following text: “The Human Rights Council, Reaffirming all previous resolutions by the General Assembly, the Commission on Human Rights and the Council on the problem of trafficking in persons, especially women and children, in particular Council resolutions 8/12 of 18 June 2008 and 11/3 of 17 June 2009, decides: (a) To hold a panel discussion at its fourteenth session to give voice to victims of trafficking in persons, with due consideration for the psychological well- being of the victims involved, with a view to reinforcing the centrality of their human rights and needs, and taking into account their recommendations when devising actions to combat human trafficking; (b) To request the Office of the United Nations High Commissioner for Human Rights to organize the panel, within existing resources, with the participation of the High Commissioner, the Special Rapporteur on trafficking in persons, especially women and children, and the victims of trafficking in persons; A/HRC/13/L.25 (c) To also request the Office of the High Commissioner to encourage the presence of relevant human rights mechanisms and specialized agencies and programmes, as well as civil society and national human rights institutions, in the panel session.” GE.10-12315",03/19/2010,2010_679298,Ecuador,* Non-member State of the Human Rights Council.,yes
