year,Council,Committee,Session,Agenda item,Agenda detail,cosponsored countries,body title number,body title detail,body text,date,file,filecountry,footnote,scanned
2006,General Assembly,N/A,Sixty-first session,N/A,United Nations AssiLs,"Bosnia and Herzegovina, Ecuador, Gambia, Japan and Liechtenstein",N/A,Appointment of the Secretary-General of the United Nations,"The General Assembly, Having considered the recommendation contained in Security Council resolution 1715 (2006) of 9 October 2006, Appoints Mr. Ban Ki-moon Secretary-General of the United Nations for a term of office beginning on 1 January 2007 and ending on 31 December 2011. 06-56539 ﬁEi 111006 N0 A",10/11/2006,2006_584461,Gambia (Republic of The),N/A,yes
2006,General Assembly,Third Committee,Sixty-first session,67 (b),"Promotion and protection of human rights: human rights questions, including alternative approaches for improving the effective enjoyment of human rights and fundamental freedoms","Algeria, Angola, Belgium, Benin, Burkina Faso, Burundi, Cameroon, Cape Verde, Central African Republic, Chad, Congo, Céte d’Ivoire, Democratic Republic of the Congo, Ethiopia, France, Gabon, Gambia, Germany, Guinea, Kenya, Mali, Morocco, Nigeria, Rwanda, Sao Tome and Principe, Togo and United Republic of Tanzania",N/A,Subregional Centre for Human Rights and Democracy in Central Africa,"The General Assembly, Recalling its resolution 55/105 of 4 December 2000 concerning regional arrangements for the promotion and protection of human rights, Recalling also its resolutions 55/34 B of 20 November 2000 and 55/233 of 23 December 2000, section III of resolution 55/234 of 23 December 2000, and its resolutions 58/176 of 22 December 2003, 59/183 of 20 December 2004 and 60/151 of 16 December 2005 on the Subregional Centre for Human Rights and Democracy in Central Africa, Recalling that the World Conference on Human Rights recommended that more resources be made available for the strengthening of regional arrangements for the promotion and protection of human rights under the programme of technical cooperation in the field of human rights of the Office of the United Nations High Commissioner for Human Rights,! Recalling also the report of the High Commissioner, 2 Taking note of the holding of the twenty-third and twenty-fourth ministerial meetings of the United Nations Standing Advisory Committee on Security Questions 1 See A/CONF.157/24 (Part I), chap. III. 2 Official Records of the General Assembly, Fifty-sixth Session, Supplement No. 36, addendum (A/56/36/Add.1). 06-59964 ﬁEf 031106 N0 in Central Africa in Brazzaville from 29 August to 2 September 2006, and in Kigali from 25 to 29 September 2006, Taking note also of the report of the Secretary-General,3 Welcoming the 2005 World Summit Outcome,* in particular the decision confirmed therein to double the regular budget of the Office of the High Commissioner over the next five years, 1. Welcomes the activities of the Subregional Centre for Human Rights and Democracy in Central Africa at Yaoundé; 2. Notes with satisfaction the support provided for the establishment of the Centre by the host country; 3. Requests the Secretary-General and the United Nations High Commissioner for Human Rights to provide additional funds and human resources to enable the Centre to respond positively and effectively to the growing needs in the promotion and protection of human rights and in developing a culture of democracy in the Central African subregion; 4. Requests the Secretary-General to submit to the General Assembly at its sixty-second session a report on the implementation of the present resolution. 3 A/61/352. 4 See resolution 60/1.",11/02/2006,2006_585863,Gambia (Republic of The),N/A,yes
2006,General Assembly,Third Committee,Sixty-first session,67 (b),"Promotion and protection of human rights: human rights questions, including alternative approaches for improving the effective enjoyment of human rights and fundamental freedoms","Argentina, Azerbaijan, Bangladesh, Belize, Benin, Bolivia, Brazil, Burkina Faso, Cape Verde, Chile, Congo, Costa Rica, Cuba, Democratic Republic of the Congo, Ecuador, El Salvador, Egypt, Ethiopia, Gambia, Ghana, Guatemala, Honduras, Kenya, Kyrgyzstan, Lebanon, Mali, Mexico, Morocco, Niger, Nigeria, Paraguay, Peru, Philippines, Saint Vincent and the Grenadines, Senegal, Tajikistan and Uruguay",N/A,Protection of migrants,"The General Assembly, Recalling all its previous resolutions on the protection of migrants, the most recent of which is resolution 60/169 of 16 December 2005, and recalling also Commission on Human Rights resolution 2005/47 of 19 April 2005, Reaffirming the Universal Declaration of Human Rights,! which proclaims that all human beings are born free and equal in dignity and rights and that everyone is entitled to all the rights and freedoms set out therein, without distinction of any kind, in particular as to race, colour or national origin, Reaffirming also that everyone has the right to freedom of movement and residence within the borders of each State, and to leave any country, including his own, and return to his country, Recalling the International Covenant on Civil and Political Rights and the International Covenant on Economic, Social and Cultural Rights,2 the Convention against Torture and Other Cruel, Inhuman or Degrading Treatment or Punishment,3 the Convention on the Elimination of All Forms of Discrimination against Women,* I Resolution 217 A (III). 3 United Nations, Treaty Series, vol. 1465, No. 24841. 4 Ibid., vol. 1249, No. 20378. 06-62079 ﬁEf 201106 N0 A the Convention on the Rights of the Child,> the International Convention on the Elimination of All Forms of Racial Discrimination® and the International Convention on the Protection of the Rights of All Migrant Workers and Members of Their Families,” Recalling also the provisions concerning migrants contained in the outcomes of all major United Nations conferences and summits, Welcoming the establishment of the Human Rights Council, which is responsible for promoting universal respect for the protection of all human rights and fundamental freedoms for all, without distinction of any kind and in a fair and equal manner, Welcoming also the convening of the High-level Dialogue on International Migration and Development, held in New York on 14 and 15 September 2006 with the purpose of discussing the multidimensional aspects of international migration and development, which recognized the relationship between international migration, development and human rights, Bearing in mind that policies and initiatives on the issue of migration, including those that refer to the orderly management of migration, should promote holistic approaches that take into account the causes and consequences of the phenomenon, as well as the full respect for the human rights and fundamental freedoms of migrants, Noting that many migrant women are employed in the informal economy and in less skilled work compared with that of men, which puts those women at greater risk of abuse and exploitation, Concerned about the large and growing number of migrants, especially women and children, who place themselves in a vulnerable situation by attempting to cross international borders without the required travel documents, and underlining the obligation of States to respect the human rights of those migrants, Underlining the importance for States, in cooperation with non-governmental organizations, to undertake information campaigns aimed at clarifying opportunities, limitations and rights in the event of migration, so as to enable everyone to make informed decisions and to prevent them from utilizing dangerous means to cross international borders, Emphasizing the global character of the migratory phenomenon, the importance of international, regional and bilateral cooperation and dialogue in this regard, as appropriate, and the need to protect the human rights of migrants, particularly at a time in which migration flows have increased in the globalized economy and take place in a context of new security concerns, 1. Requests States effectively to promote and protect the human rights and fundamental freedoms of all migrants, regardless of their immigration status, especially those of women and children; 5 Ibid. vol. 1577, No. 27531. 6 Resolution 2106 A (XX), annex. 7 United Nations, Treaty Series, vol. 2220, No. 39481. A/C.3/61/L.29/Rev.1 2. Takes note with interest of the interim report of the Special Rapporteur on the human rights of migrants;3 3. Calls upon States that have not done so to consider signing and ratifying or acceding to the International Convention on the Protection of the Rights of All Migrant Workers and Members of Their Families’ as a matter of priority, and requests the Secretary-General to continue his efforts to raise awareness and promote the Convention; 4. Urges States parties to the United Nations Convention against Transnational Organized Crime® and the supplementing protocols thereto, namely, the Protocol against the Smuggling of Migrants by Land, Sea and Air'® and the Protocol to Prevent, Suppress and Punish Trafficking in Persons, Especially Women and Children,!! to implement them fully, and calls upon States that have not done so to consider ratifying them as a matter of priority; 5. Takes note of the report of the Committee on the Protection of the Rights of All Migrant Workers and Members of Their Families on its third and fourth sessions; 12 6. Requests all States, international organizations and relevant stakeholders to take into account in their policies and initiatives on migration issues the global character of the migratory phenomenon and to give due consideration to international, regional and bilateral cooperation in this field, including by undertaking dialogues on migration that include countries of origin, destination and transit, as well as civil society, including migrants, with a view to addressing, in a comprehensive manner, inter alia, its causes and consequences and the challenge of undocumented or irregular migration, granting priority to the protection of the human rights of migrants; 7. Expresses concern about legislation and measures adopted by some States that may restrict the human rights and fundamental freedoms of migrants, and reaffirms that when exercising their sovereign right to enact and implement migratory and border security measures, States have the duty to comply with their obligations under international law, including international human rights law, in order to ensure full respect for the human rights of migrants; 8. Requests States to adopt concrete measures to prevent the violation of the human rights of migrants while in transit, including in ports and airports and at borders and migration checkpoints, to train public officials who work in those facilities and in border areas to treat migrants respectfully and in accordance with the law, and to prosecute, in conformity with applicable law, any act of violation of the human rights of migrants, inter alia, arbitrary detention, torture and violations of the right to life, including extrajudicial executions, during their transit from their country of origin to the country of destination and vice versa, including their transit through national borders; A/C.3/61/L.29/Rev.1 9. Calls wupon States to address international migration through international, regional or bilateral cooperation and dialogue and through a comprehensive and balanced approach, recognizing the roles and responsibilities of countries of origin, transit and destination in protecting and promoting the human rights of migrants and avoiding approaches that may aggravate their vulnerability; 10. Strongly condemns the manifestations and acts of racism, racial discrimination, xenophobia and related intolerance against migrants and the stereotypes often applied to them, including on the basis of religion or belief, and urges States to apply the existing laws when xenophobic or intolerant acts, manifestations or expressions against migrants occur, in order to eradicate impunity for those who commit xenophobic and racist acts; 11. Requests all States, in conformity with national legislation and applicable international legal instruments to which they are party, to enforce labour law effectively, including by addressing violations of such law, with regard to migrant workers’ labour relations and working conditions, inter alia, those related to their remuneration and conditions of health, safety at work and the right to freedom of association; 12. Encourages all States to remove obstacles that may prevent the safe, unrestricted and expeditious transfer of remittances of migrants to their country of origin or to any other countries, in conformity with applicable legislation, and to consider, as appropriate, measures to solve other problems that may impede such transfers; 13. Welcomes immigration programmes, adopted by some countries, that allow migrants to integrate fully into the host countries, facilitate family reunification and promote a harmonious, tolerant and respectful environment, and encourages States to consider the possibility of adopting these types of programmes; 14. Requests Member States, the United Nations system, international organizations, civil society and all relevant stakeholders, especially the United Nations High Commissioner for Human Rights and the Special Rapporteur on the human rights of migrants, to ensure that the perspective of the human rights of migrants is included among the priority issues in the ongoing discussions on international migration and development within the United Nations system, bearing in mind the discussions of the High-level Dialogue on International Migration and Development held pursuant to General Assembly resolution 58/208 of 23 December 2003; 15. Requests the Secretary-General to report on the implementation of the present resolution at its sixty-second session and decides to examine the question further under the item entitled “Human rights questions”. 06-62079",11/17/2006,2006_586944,Gambia (Republic of The),N/A,yes
2006,General Assembly,N/A,Sixty-first session,74,Report of the International Criminal Court,"Albania, Andorra, Argentina, Australia, Austria, Barbados, Belgium, Belize, Benin, Bolivia, Bosnia and Herzegovina, Brazil, Bulgaria, Burkina Faso, Canada, Chile, Colombia, Croatia, Cyprus, Czech Republic, Denmark, Democratic Republic of the Congo, Dominican Republic, Ecuador, Estonia, Fiji, Finland, France, Georgia, Germany, Ghana, Greece, Guyana, Honduras, Hungary, Iceland, Ireland, Italy, Jordan, Kenya, Latvia, Lesotho, Liechtenstein, Lithuania, Luxembourg, Malawi, Mali, Malta, Mexico, Mongolia, Namibia, Nauru, Netherlands, New Zealand, Niger, Nigeria, Norway, Paraguay, Peru, Poland, Portugal, Republic of Korea, Romania, Samoa, San Marino, Senegal, Serbia, Sierra Leone, Slovakia, Slovenia, South Africa, Spain, Sweden, Switzerland, the former Yugoslav Republic of Macedonia, Trinidad and Tobago, Ukraine, United Kingdom of Great Britain and Northern Ireland, United Republic of Tanzania, Uruguay and Venezuela (Bolivarian Republic of)",N/A,Report of the International Criminal Court,"Addendum Add the following countries to the list of sponsors of the resolution: Antigua and Barbuda, Burundi, Cambodia, Central African Republic, Comoros, Congo, Costa Rica, Djibouti, Dominica, Gabon, Gambia, Haiti, Jamaica, Liberia, Madagascar, Marshall Islands, Montenegro, Panama, Saint Kitts and Nevis, Saint Vincent and the Grenadines, Tajikistan, Timor-Leste, Uganda and Zambia 06-62295 ﬁEf 211106 O",11/20/2006,2006_587175,Gambia (Republic of The),N/A,yes
2006,General Assembly,N/A,Sixty-first session,155,Commemoration of the two-hundredth anniversary of the abolition of the trans-Atlantic slave trade,"Algeria, Angola, Antigua and Barbuda, Argentina, Austria, Azerbaijan, Bahamas, Bahrain, Bangladesh, Barbados, Belarus, Belgium, Belize, Benin, Bolivia, Botswana, Brazil, Brunei Darussalam, Bulgaria, Burkina Faso, Burundi, Cameroon, Canada, Cape Verde, Central African Republic, Chad, Chile, China, Colombia, Comoros, Congo, Costa Rica, Céote d’Ivoire, Cuba, Cyprus, Democratic Republic of the Congo, Denmark, Djibouti, Dominica, Dominican Republic, Ecuador, Egypt, El Salvador, Equatorial Guinea, Eritrea, Ethiopia, Fiji, Finland, France, Gabon, Gambia, Ghana, Greece, Grenada, Guatemala, Guinea, Guinea-Bissau, Guyana, Haiti, Honduras, Hungary, Iceland, India, Indonesia, Iran (Islamic Republic of), Ireland, Italy, Jamaica, Jordan, Kenya, Kuwait, Lebanon, Lesotho, Liberia, Libyan Arab Jamahiriya, Luxembourg, Madagascar, Malawi, Malaysia, Mali, Malta, Mauritius, Mexico, Micronesia (Federated States of), Morocco, Mozambique, Myanmar, Namibia, Nauru, Nepal, Netherlands, Nicaragua, Niger, Nigeria, Pakistan, Panama, Papua New Guinea, Paraguay, Peru, Philippines, Portugal, Russian Federation, Rwanda, Saint Kitts and Nevis, Saint Lucia, Saint Vincent and the Grenadines, Samoa, Saudi Arabia, Senegal, Sierra Leone, Singapore, Somalia, South Africa, Spain, Sri Lanka, Sudan, Suriname, Swaziland, Sweden, Syrian Arab Republic, Thailand, Timor-Leste, Togo, Tonga, Trinidad and Tobago, Uganda, United Kingdom of Great Britain and Northern Ireland, United Republic of Tanzania, Uruguay, Uzbekistan, Vanuatu, Venezuela (Bolivarian Republic of), Viet Nam, Yemen, Zambia and Zimbabwe",N/A,Commemoration of the two-hundredth anniversary of the abolition of the trans-Atlantic slave trade,"The General Assembly, Reaffirming the Universal Declaration of Human Rights! which proclaimed that no one shall be held in slavery or servitude and that slavery and the slave trade shall be prohibited in all their forms, I Resolution 217 A (I1I). 06-62313 ﬁEf 211106 O 0 Recalling that the trans-Atlantic slave trade, which operated between the fifteenth and late nineteenth centuries, involved the forced transportation of millions of Africans as slaves, mostly from West Africa to the Americas, thereby enriching the imperial empires of the time, Honouring the memory of those who died as a result of slavery, including through exposure to the horrors of the middle passage and in revolt against and resistance to enslavement, Recognizing that the slave trade and slavery are among the worst violations of human rights in the history of humanity, bearing in mind particularly their scale and duration, Deeply concerned that it has taken the international community almost two hundred years to acknowledge that slavery and the slave trade are a crime against humanity and that they should always be deemed so, Recalling that slavery and the slave trade were declared a crime against humanity by the World Conference against Racism, Racial Discrimination, Xenophobia and Related Intolerance, held in Durban, South Africa, from 31 August to 8 September 2001, Acknowledging that the slave trade and the legacy of slavery are at the heart of situations of profound social and economic inequality, hatred, bigotry, racism and prejudice, which continue to affect people of African descent today, Recalling paragraphs 98 through 106 of the Durban Declaration? and emphasizing, in particular, the importance of the “provision of effective remedies, recourse, redress, and compensatory and other measures at the national, regional and international levels™, aimed at countering the continued impact of slavery and the slave trade, Recognizing the knowledge gap that exists with regard to the consequences created by the slave trade and slavery, and with regard to the interactions, past and present, generated among the peoples of Europe, Africa, Asia and the Americas, including the Caribbean, Welcoming the work of the International Scientific Committee of the Slave Route Project of the United Nations Educational, Scientific and Cultural Organization, which aims to correct this knowledge gap, and looks forward to its report in due course, Recalling resolution 28 adopted by the General Conference of the United Nations Educational, Scientific and Cultural Organization at its thirty-first session,3 proclaiming 2004 as the International Year to Commemorate the Struggle against Slavery and its Abolition, and recalling also 23 August as that Organization’s International Day for the Remembrance of the Slave Trade and its Abolition, Noting that 2007 will mark the two-hundredth anniversary of the abolition of the trans-Atlantic slave trade, which contributed significantly to the abolition of slavery, 3 See Records of the General Conference of the United Nations Educational, Scientific and Cultural Organization, Thirty-first Session, Paris, 15 October-3 November 2001, vol. 1, Resolutions (Paris, 2002), chap. V. A/61/L.28 1. Decides to designate 25 March 2007 as the International Day for the Commemoration of the Two-hundredth Anniversary of the Abolition of the Trans- Atlantic Slave Trade; 2. Urges Member States that have not already done so to develop educational programmes designed to educate and inculcate in future generations, including through school curricula, an understanding of the lessons, history and consequences of slavery and the slave trade; 3. Decides to convene, on 25 March 2007, a special commemorative meeting of the General Assembly on the International Day for the Commemoration of the Two-hundredth Anniversary of the Abolition of the Trans-Atlantic Slave Trade; 4. Requests the Secretary-General to establish a programme of outreach, with the involvement of Member States and civil society, including non-governmental organizations, to appropriately commemorate the two-hundredth anniversary of the abolition of the trans-Atlantic slave trade; 5. Also requests the Secretary-General to submit to the General Assembly at its sixty-second session a special report on initiatives taken by States to implement paragraphs 101 and 102 of the Durban Declaration aimed at countering the legacy of slavery and contributing to the restoration of the dignity of the victims of slavery and the slave trade. 06-62313",11/20/2006,2006_587176,Gambia (Republic of The),N/A,yes
