year,Council,Committee,Session,Agenda item,Agenda detail,cosponsored countries,body title number,body title detail,body text,date,file,filecountry,footnote,scanned
2005,General Assembly,Third Committee,Sixtieth session,64,Advancement of women,"Argentina, Bangladesh, Bolivia, Burkina Faso, Cameroon, Chile, China, Colombia, Congo, Costa Rica, Cote d’Ivoire, Democratic People’s Republic of Korea, Democratic Republic of the Congo, Dominican Republic, Ecuador, Ethiopia, Fiji, Ghana, Guatemala, Haiti, Indonesia, Kenya, Kyrgyzstan, Madagascar, Malawi, Malaysia, Mali, Mexico, Mongolia, Morocco, Mozambique, Namibia, Niger, Nigeria, Panama, Philippines, Senegal, Sierra Leone, Thailand, Timor-Leste, Togo, Tunisia, United Republic of Tanzania, Zimbabwe",N/A,Improvement of the situation of women in rural areas,"The General Assembly, Recalling its resolutions 56/129 of 19 December 2001 and 58/146 of 22 December 2003, Recalling also the importance attached to the problems of rural women in the Nairobi Forward-looking Strategies for the Advancement of Women,! the Beijing Declaration? and Platform for Action3 adopted by the Fourth World Conference on Women, the outcome documents of the twenty-third special session of the General Assembly4 and their ten-year review and appraisal> and the Convention on the Elimination of All Forms of Discrimination against Women,¢ 1 Report of the World Conference to Review and Appraise the Achievements of the United Nations Decade for Women: Equality, Development and Peace, Nairobi, 15-26 July 1985 (United Nations publication, Sales No. E.85.1V.10), chap. I, sect. A. 2 Report of the Fourth World Conference on Women, Beijing, 4-15 September 1995 (United Nations publication, Sales No. E.96.1V.13), chap. I, resolution 1, annex I. 5 See Official Records of the General Assembly, Sixtieth Session, Supplement No. 38 (A/60/38), part I, annex 1. 05-57040 (E) 261005 *0557040° Recalling further the United Nations Millennium Declaration,” in which Member States resolved, inter alia, to promote gender equality and the empowerment of women as effective ways to combat poverty, hunger and disease and to stimulate development that is truly sustainable, and the 2005 World Summit Outcome,® where they also resolved to promote gender equality and eliminate pervasive gender discrimination by taking all necessary resolute action, Welcoming the declaration adopted by the Commission on the Status of Women at its forty-ninth session® in the context of the ten-year review and appraisal of the Beijing Platform for Action and the outcome document of the twenty-third special session of the General Assembly, Welcoming also the agreed conclusions on women’s participation in and access to the media, and information and communication technologies and their impact on and use as an instrument for the advancement and empowerment of women, adopted by the Commission on the Status of Women at its forty-seventh session, 10 Welcoming further the Monterrey Consensus of the International Conference on Financing for Development,!! as well as the Johannesburg Declaration on Sustainable Development!2 and the Plan of Implementation of the World Summit on Sustainable Development (“Johannesburg Plan of Implementation”),!3 which called upon Governments to mainstream the gender perspective into development at all levels and in all sectors, Welcoming the ministerial declaration of the high-level segment of the substantive session of 2003 of the Economic and Social Council, adopted on 2 July 2003,14 which stressed the need for rural development to become an integral part of national and international development policies and of the activities and programmes of the United Nations system, and called for an enhanced role for rural women at all levels of rural development, including decision-making, Recognizing the critical role and contribution of rural women in enhancing agricultural and rural development, improving food security and eradicating rural poverty, Noting that some effects of globalization may deepen the socio-economic marginalization of rural women, Noting also that the globalization process has had some benefits by providing opportunities for wage employment for rural women in new sectors, 7 See resolution 55/2. 8 Resolution 60/1. 9 Official Records of the Economic and Social Council, 2005, Supplement No. 7 and corrigendum (E/2005/27 and Corr.1), chap. L.A. 10 See Official Records of the Economic and Social Council, 2003, Supplement No. 7 (E/2003/27), chap. I, sect. A; see also Economic and Social Council resolution 2003/44. 11 Report of the International Conference on Financing for Development, Monterrey, Mexico, 18-22 March 2002 (United Nations publication, Sales No. E.02.11.A.7), chap. I, resolution 1, annex. 26 August-4 September 2002 (United Nations publication, Sales No. E.03.1I.A.1 and corrigendum), chap. I, resolution 1, annex. 14 See Official Records of the General Assembly, Fifty-eighth Session, Supplement No. 3 (A/58/3/Rev.1), chap. III, para. 35. A/C.3/60/L.14/Rev.1 Mindful of the fact that the available data and existing tools of measurement and analysis are insufficient for a full understanding of the gender implications of the processes of globalization and rural change, and their impact on rural women, Recognizing the urgent need to take appropriate measures aimed at further improving the situation of women in rural areas, 1. Takes note of the report of the Secretary-General; !> 2. Invites Member States, in collaboration with the organizations of the United Nations and civil society, as appropriate, to continue their efforts to implement the outcome of and to ensure an integrated and coordinated follow-up to United Nations conferences and summits, including their reviews, and to attach greater importance to the improvement of the situation of rural women, including indigenous women, in their national, regional and global development strategies by, inter alia: (a) Creating an enabling environment for improving the situation of rural women and ensuring attention to their needs and contributions, including through enhanced cooperation and a gender perspective, and their full participation in the development, implementation and monitoring of macroeconomic policies and programmes and poverty reduction strategies, including poverty reduction strategy papers, based on the Millennium Development Goals; (b) Pursuing the political and socio-economic empowerment of rural women and supporting their full and equal participation in decision-making at all levels, including through affirmative action, where appropriate, and support for women’s organizations, labour union or other associations and civil society groups promoting rural women'’s rights; (c) Integrating a gender perspective into the design, implementation, monitoring and evaluation of development policies and programmes, including budget policies, paying increased attention to the needs of rural women so as to ensure that they benefit from policies and programmes adopted in all spheres and that the disproportionate number of rural women living in poverty is reduced; (d) Ensuring that the perspectives of rural women are taken into account and that they participate in the design, implementation, monitoring and evaluation of policies and activities related to emergencies, natural disasters, humanitarian assistance, peacebuilding and post-conflict reconstruction; (e) Investing in and strengthening efforts to meet the basic needs of rural women through improving availability, access to and use of critical rural infrastructure, such as energy and transport, capacity-building and human resources development measures and the provision of a safe and reliable water supply and sanitation, nutritional programmes, affordable housing programmes, education and literacy programmes and health and social support measures, including in the area of sexual and reproductive health and HIV/AIDS treatment, care and support; (f) Designing and implementing policies that promote and protect the enjoyment by rural women and girls of all human rights and fundamental freedoms and creating an environment that does not tolerate violations of their rights, A/C.3/60/L.14/Rev.1 including domestic violence, sexual violence and other forms of gender-based violence; (g) Developing specific assistance programmes and advisory services to promote economic skills of rural women in banking, modern trading and financial procedures and providing microcredit and other financial and business services to a greater number of women in rural areas, in particular female-headed households, for their economic empowerment; (h) Consider adopting, where appropriate, national legislation to protect the knowledge, innovations and practices of women in indigenous and local communities relating to traditional medicines, biodiversity and indigenous technologies; (i) Taking steps towards ensuring that women’s unpaid work and contributions to on-farm and off-farm production, including income generated in the informal sector, are visible and supporting remunerative non-agricultural employment of rural women, improving working conditions and increasing access to productive resources; () Addressing the lack of timely, reliable and sex-disaggregated data, including through intensifying efforts to include women’s unpaid work in official statistics, and developing a systematic and comparative research base on rural women that will inform policy and programme decisions; (k) Designing and revising laws to ensure that, where private ownership of land and property exists, rural women are accorded full and equal rights to own land and other property, including through the right to inheritance, and undertaking administrative reforms and other necessary measures to give women the same right as men to credit, capital, appropriate technologies and access to markets and information; (I) Promoting programmes to enable rural women and men to reconcile their work and family responsibilities and to encourage men to share equally with women household and childcare responsibilities; (m) Mobilizing resources, including at the national level and through official development assistance, for increasing women’s access to existing savings and credit schemes, as well as targeted programmes that provide women with capital, knowledge and tools that enhance their economic capacities; (n) Supporting a gender-sensitive educational system that considers rural women’s specific needs in order to eliminate gender stereotypes and discriminatory tendencies affecting them; 3. Invites the Commission on the Status of Women to continue to pay due attention to the situation of rural women in the consideration of the priority themes; 4. Invites the relevant organizations and bodies of the United Nations system, in particular those dealing with issues of development to address and support the empowerment of rural women and their specific needs in their programmes and strategies, including in the context of globalization; 5. Stresses the need to identify the best practices for ensuring that rural women have access to and full participation in the area of information and communication technologies, and invites the World Summit on the Information A/C.3/60/L.14/Rev.1 Society, at its second phase in Tunis, to take into consideration, while addressing gender issues, the priorities and needs of rural women and girls as active users of information and ensure their participation in developing and implementing global information and communication technology strategies; 6. Invites Member States, the United Nations and the relevant organizations of its system to ensure that the needs of rural women are mainstreamed into the integrated process of follow-up to the major summits and conferences in the economic and social fields, in particular the Millennium Summit, the World Summit on Sustainable Development, the International Conference on Financing for Development, the 2005 review of the progress achieved in implementing all the commitments made in the Beijing Platform for Action and the outcome documents of the twenty-third special session of the General Assembly, entitled “Women 2000: gender equality, development and peace for the twenty-first century”, and the 2005 World Summit; 7. Invites Member States to take into consideration the concluding comments and recommendations of the Committee on the Elimination of Discrimination against Women concerning their reports to the Committee when formulating policies and designing programmes focused on the improvement of the situation of rural women, including those to be developed and implemented in cooperation with relevant international organizations; 8. Requests the Secretary-General to report to the General Assembly at its sixty-second session on the implementation of the present resolution, addressing different aspects of the empowerment of rural women.",10/25/2005,2005_559329,Haiti,"12 Report of the World Summit on Sustainable Development, Johannesburg, South Africa,",yes
2005,General Assembly,N/A,Sixtieth session,72,Holocaust remembrance,"Albania, Andorra, Argentina, Australia, Austria, Belarus, Belgium, Benin, Bolivia, Bosnia and Herzegovina, Brazil, Bulgaria, Cameroon, Canada, Central African Republic, Chile, China, Colombia, Costa Rica, Cote d’Ivoire, Croatia, Cyprus, Czech Republic, Democratic Republic of the Congo, Denmark, Dominican Republic, El Salvador, Estonia, Ethiopia, Fiji, Finland, France, Georgia, Germany, Greece, Guatemala, Haiti, Honduras, Hungary, Iceland, Ireland, Israel, Italy, Japan, Kazakhstan, Latvia, Liechtenstein, Lithuania, Luxembourg, Madagascar, Malta, Marshall Islands, Micronesia (Federated States of), Monaco, Mongolia, Mozambique, Nauru, Netherlands, New Zealand, Norway, Palau, Paraguay, Peru, Poland, Portugal, Republic of Korea, Republic of Moldova, Romania, Russian Federation, Rwanda, Samoa, San Marino, Serbia and Montenegro, Singapore, Slovakia, Slovenia, Spain, Sweden, Switzerland, the former Yugoslav Republic of Macedonia, Timor-Leste, Tonga, Trinidad and Tobago, Turkey, Uganda, Ukraine, United Kingdom of Great Britain and Northern Ireland, United States of America, Uruguay and Uzbekistan",N/A,Holocaust remembrance,"The General Assembly, Reaffirming the Universal Declaration of Human Rights,! which proclaims that everyone is entitled to all the rights and freedoms set forth therein, without distinction of any kind, such as race, religion or other status, Recalling article 3 of the Universal Declaration of Human Rights, which states that everyone has the right to life, liberty and security of person, Recalling also article 18 of the Universal Declaration of Human Rights and article 18 of the International Covenant on Civil and Political Rights,2 which state that everyone has the right to freedom of thought, conscience and religion, 1 Resolution 217 A (I11). 2 See resolution 2200 A (XXI), annex. 05-57270 (E) 271005 *0557270* Bearing in mind that the founding principle of the Charter of the United Nations, “to save succeeding generations from the scourge of war”, is testimony to the indelible link between the United Nations and the unique tragedy of the Second World War, Recalling the Convention on the Prevention and Punishment of the Crime of Genocide,3 which was adopted in order to avoid repetition of genocides such as those committed by the Nazi Regime, Recalling also the preamble of the Universal Declaration of Human Rights, which states that disregard and contempt for human rights have resulted in barbarous acts which have outraged the conscience of mankind, Taking note of the fact that the sixtieth session of the General Assembly is taking place during the sixtieth year of the defeat of Nazi regime, Recalling the twenty-eighth special session of the General Assembly, a unique event, held in commemoration of the liberation of the Nazi concentration camps, Honouring the courage and dedication shown by the soldiers who liberated the concentration camps, Reaffirming that the Holocaust, which resulted in the murder of one third of the Jewish people along with countless members of other minorities, will forever be a warning to all people of the dangers of hatred, bigotry, racism and prejudice, 1. Resolves that the United Nations will designate 27 January as an annual International Day of Commemoration in memory of the victims of the Holocaust; 2. Urges Member States to develop educational programmes that will inculcate future generations with the lessons of the Holocaust in order to help prevent future acts of genocide, and in this context commends the Task Force for International Cooperation on Holocaust Education, Remembrance and Research; 3. Rejects any denial of the Holocaust as an historical event, either in full or part; 4. Commends those States which have actively engaged in preserving those sites that served as Nazi death camps, concentration camps, forced labour camps and prisons during the Holocaust; 5. Condemns without reserve all manifestations of religious intolerance, incitement, harassment or violence against persons or communities based on ethnic origin or religious belief, wherever they occur; 6. Requests the Secretary-General to establish a programme of outreach on the subject of the “Holocaust and the United Nations” as well as measures to mobilize civil society for Holocaust remembrance and education, in order to help prevent future acts of genocide, to report to the General Assembly on the establishment of this programme within six months from the date of the adoption of the present resolution and to report thereafter on the implementation of the programme at its sixty-third session. 3 Resolution 260 A (I1I).",10/26/2005,2005_559330,Haiti,N/A,yes
2005,General Assembly,First Committee,Sixtieth session,97 (dd),General and complete disarmament: problems arising from the accumulation of conventional ammunition stockpiles in surplus,"Austria, Belgium, Bosnia and Herzegovina, Bulgaria, Canada, Croatia, Cyprus, Czech Republic, Denmark, Estonia, Finland, France, Georgia, Germany, Ghana, Greece, Haiti, Hungary, Italy, Latvia, Liberia, Liechtenstein, Lithuania, Luxembourg, Mali, Netherlands, Norway, Poland, Portugal, Republic of Moldova, Romania, Senegal, Serbia and Montenegro, Slovakia, Slovenia, Spain, Sweden, Switzerland, the Former Yugoslav Republic of Macedonia, Timor-Leste, Turkey, Ukraine and United Kingdom of Great Britain and Northern Ireland: revised",N/A,Problems arising from the accumulation of conventional ammunition stockpiles in surplus,"The General Assembly, Mindful of contributing to the process initiated in the framework of the United Nations reform to make the Organization more effective in maintaining peace and security by giving it the resources and tools it needs for conflict prevention, peaceful resolution of disputes, peacekeeping, post-conflict peacebuilding and reconstruction, Underlining the importance of a comprehensive and integrated approach to disarmament through the development of practical measures, Taking note of the report of the Group of Experts on ammunition and explosives,! Recalling the recommendation contained in paragraph 27 of the report submitted by the Chairman of the Open-ended Working Group to Negotiate an International Instrument to Enable States to Identify and Trace, in a Timely and Reliable Manner, Illicit Small Arms and Light Weapons,? namely to address the 1 See A/54/155. 2 A/60/88 and Corr.2. 05-57475 (E) 271005 *0557475* issue of small arms and light weapons ammunition in a comprehensive manner as part of a separate process conducted within the framework of the United Nations, Underlining the challenges posed to law enforcement authorities in affected countries in regulating possession of conventional weapons and access to their ammunition and preventing illicit trafficking accordingly, and the consequences that may result from inadequate control over them, Noting with satisfaction the work and measures pursued at the regional and subregional levels with regard to the issue of conventional ammunition, Recalling its decision 59/515 of 3 December 2004 to include the question of conventional ammunition stockpiles in surplus in the agenda of its sixtieth session, 1. Encourages all interested States to assess, on a voluntary basis, whether, in conformity with their legitimate security needs, parts of their stockpiles of conventional ammunition should be considered to be in surplus; 2. Recognizes that the security of stockpiles must be taken into consideration and that appropriate controls with regard to the security and safety of stockpiles of conventional ammunition are indispensable at the national level in order to eliminate the risk of explosion, pollution or diversion; 3. Appeals to all interested States to determine the size and nature of their surplus stockpiles of conventional ammunition, whether they represent a security risk, if appropriate, their means of destruction, and whether external assistance is needed to eliminate this risk; 4. Encourages States in a position to do so to assist interested States in a bilateral framework or through international or regional organizations, on a voluntary and transparent basis, in elaborating and implementing programmes to eliminate surplus stockpiles or to improve their management; 5. Encourages all Member States to examine the possibility of developing and implementing, within a national, regional or subregional framework, measures to combat illicit trafficking in conventional ammunition; 6. Requests the Secretary-General to seek the views of Member States regarding the risks arising from the accumulation of conventional ammunition stockpiles in surplus and regarding national ways of strengthening controls on conventional ammunition, and to submit a report to the General Assembly at its sixty-first session; 7. Decides to include in the provisional agenda of its sixty-first session the item entitled “Problems arising from the accumulation of conventional ammunition stockpiles in surplus”.",10/27/2005,2005_559354,Haiti,N/A,yes
2005,General Assembly,First Committee,Sixtieth session,97 (t),General and complete disarmament: the illicit trade in small arms and light weapons in all its aspects,"Angola, Armenia, Australia, Austria, Bangladesh, Belgium, Bulgaria, Burkina Faso, Canada, Croatia, Cyprus, Czech Republic, Denmark, Djibouti, Eritrea, Estonia, Finland, France, Germany, Greece, Haiti, Hungary, Iceland, India, Indonesia, Ireland, Israel, Italy, Japan, Kenya, Liechtenstein, Lithuania, Luxembourg, Madagascar, Malta, Monaco, Netherlands, Norway, Poland, Portugal, Republic of Moldova, Romania, Russian Federation, Samoa, Senegal, Serbia and Montenegro, Sierra Leone, Slovakia, Slovenia, Spain, Switzerland, Thailand, Timor-Leste, Turkey, Ukraine, United Kingdom of Great Britain and Northern Ireland, United States of America and Zambia",N/A,"International instrument to enable States to identify and trace, in a timely and reliable manner, illicit small arms and light weapons","The General Assembly decides to adopt the International Instrument to Enable States to Identify and Trace, in a Timely and Reliable Manner, Illicit Small Arms and Light Weapons contained in the annex to the report of the Open-ended Working Group.! 1 A/60/88 and Corr.2. 05-54971 ﬁEf 141005 0 0",10/12/2005,2005_559519,Haiti,N/A,yes
