year,Council,Committee,Session,Agenda item,Agenda detail,cosponsored countries,body title number,body title detail,body text,date,file,filecountry,footnote,scanned
2005,General Assembly,First Committee,Sixtieth session,98 (f),Review and implementation of the Concluding Document of the Twelfth Special Session of the General Assembly: Convention on the Prohibition of the Use of,"Bangladesh, Bhutan, Brunei Darussalam, Burkina Faso, Colombia, Congo, Cuba, Democratic People’s Republic of Korea, Ecuador, Egypt, Fiji, Haiti, India, Indonesia, Iran (Islamic Republic of), Jordan, Kenya, Lao People’s Democratic Republic, Libyan Arab Jamahiriya, Madagascar, Malaysia, Mauritius, Myanmar, Nepal, Sudan, Viet Nam and Zambia",N/A,Convention on the Prohibition of the Use of Nuclear Weapons,"The General Assembly, Convinced that the use of nuclear weapons poses the most serious threat to the survival of mankind, Bearing in mind the advisory opinion of the International Court of Justice of 8 July 1996 on the Legality of the Threat or Use of Nuclear Weapons,? Convinced that a multilateral, universal and binding agreement prohibiting the use or threat of use of nuclear weapons would contribute to the elimination of the nuclear threat and to the climate for negotiations leading to the ultimate elimination of nuclear weapons, thereby strengthening international peace and security, Conscious that some steps taken by the Russian Federation and the United States of America towards a reduction of their nuclear weapons and the improvement in the international climate can contribute towards the goal of the complete elimination of nuclear weapons, Recalling that, in paragraph 58 of the Final Document of the Tenth Special Session of the General Assembly,? it is stated that all States should actively participate in efforts to bring about conditions in international relations among 1 A/51/218, annex; see also Legality of the Threat or Use of Nuclear Weapons, Advisory Opinion, 1.C.J. Reports 1996, p. 226. 2 See resolution S-10/2. 05-54917 (E) 141005 *0554917* States in which a code of peaceful conduct of nations in international affairs could be agreed upon and that would preclude the use or threat of use of nuclear weapons, Reaffirming that any use of nuclear weapons would be a violation of the Charter of the United Nations and a crime against humanity, as declared in its resolutions 1653 (XVI) of 24 November 1961, 33/71 B of 14 December 1978, 34/83 G of 11 December 1979, 35/152 D of 12 December 1980 and 36/92 1 of 9 December 1981, Determined to achieve an international convention prohibiting the development, production, stockpiling and use of nuclear weapons, leading to their ultimate destruction, Stressing that an international convention on the prohibition of the use of nuclear weapons would be an important step in a phased programme towards the complete elimination of nuclear weapons, with a specified framework of time, Noting with regret that the Conference on Disarmament, during its 2004 session, was unable to undertake negotiations on this subject as called for in General Assembly resolution 58/64 of 8 December 2003, 1. Reiterates its request to the Conference on Disarmament to commence negotiations in order to reach agreement on an international convention prohibiting the use or threat of use of nuclear weapons under any circumstances; 2. Requests the Conference on Disarmament to report to the General Assembly on the results of those negotiations.",10/12/2005,2005_558458,Haiti,N/A,yes
2005,General Assembly,First Committee,Sixtieth session,97 (z),General and complete disarmament: information on confidence-building measures in the field of conventional arms,"Albania, Andorra, Angola, Antigua and Barbuda, Argentina, Armenia, Australia, Bangladesh, Barbados, Belarus, Belize, Bolivia, Brazil, Burkina Faso, Cameroon, Canada, Chad, Chile, Colombia, Congo, Costa Rica, Céte d’Ivoire, Dominican Republic, Ecuador, El Salvador, Fiji, Georgia, Germany, Guatemala, Guinea, Haiti, Indonesia, Israel, Jamaica, Kenya, Liberia, Madagascar, Malawi, Malaysia, Mexico, Nicaragua, Norway, Panama, Paraguay, Peru, Philippines, Romania, Russian Federation, Saint Vincent and the Grenadines, Senegal, Seychelles, Sierra Leone, Spain, Suriname, Thailand, Timor-Leste, Trinidad and Tobago, Turkey, Ukraine, United Republic of Tanzania, Uruguay, Venezuela, Zambia and Zimbabwe",N/A,Information on confidence-building measures in the field of conventional arms,"The General Assembly, Guided by the purposes and principles enshrined in the Charter of the United Nations, Bearing in mind the contribution of confidence-building measures in the field of conventional arms, adopted on the initiative and with the agreement of the States concerned, to the improvement of the overall international peace and security situation, Convinced that the relationship between the development of confidence- building measures in the field of conventional arms and the international security environment can also be mutually reinforcing, Considering the important role that confidence-building measures in the field of conventional arms can also play in creating favourable conditions for progress in the field of disarmament, Recognizing that the exchange of information on confidence-building measures in the field of conventional arms contributes to mutual understanding and confidence among Member States, 05-54929 ﬁEf 141005 R 1. Welcomes all confidence-building measures in the field of conventional arms already undertaken by Member States as well as the information on such measures voluntarily provided; 2. Encourages Member States to continue to adopt confidence-building measures in the field of conventional arms and to provide information in that regard; 3. Also encourages Member States to continue the dialogue on confidence- building measures in the field of conventional arms; 4. Requests the Secretary-General to establish, with the financial support of States in a position to do so, an electronic database containing information provided by Member States and to assist them, at their request, in the organization of seminars, courses and workshops aimed at enhancing the knowledge of new developments in this field; 5. Decides to include in the provisional agenda of its sixty-first session the item entitled “Information on confidence-building measures in the field of conventional arms”.",10/12/2005,2005_558459,Haiti,N/A,yes
2005,General Assembly,Third Committee,Sixtieth session,64,Advancement of women,"Andorra, Antigua and Barbuda, Austria, Azerbaijan, Barbados, Belgium, Brazil, Canada, Congo, Costa Rica, Cote d’Ivoire, Croatia, Cyprus, Czech Republic, Democratic Republic of the Congo, Denmark, Estonia, Finland, France, Germany, Greece, Guatemala, Haiti, Hungary, Iceland, Ireland, Italy, Japan, Jordan, Latvia, Liechtenstein, Lithuania, Luxembourg, Madagascar, Mali, Malta, Mexico, Monaco, Morocco, Netherlands, New Zealand, Niger, Norway, Panama, Peru, Poland, Portugal, Republic of Korea, Romania, Rwanda, Senegal, Slovakia, Slovenia, Spain, Sweden, Switzerland, Thailand, the former Yugoslav Republic of Macedonia, Timor-Leste, Togo, Turkey and United Kingdom of Great Britain and Northern Ireland",N/A,In-depth study on all forms of violence against women,"The General Assembly, Recalling its resolution 58/185 of 22 December 2003, entitled “In-depth study on all forms of violence against women”, 1. Takes note of the report of the Secretary-General on the status of preparations for the study;! 2. Welcomes: (a) The work undertaken so far in conducting the study, in particular at the expert group meeting on data and statistics on violence against women, held in Geneva from 11 to 14 April 2005, and the expert group meeting on good practices in combating violence against women, held in Vienna from 17 to 20 May 2005; (b) The initiatives taken at the national, regional and international levels to highlight the study and contribute to its preparation, including the workshop on violence against women, held in Paris on 28 and 29 April 2005, and the consultation at United Nations Headquarters, on 6 and 7 September 2005; 05-55298 (E) 141005 *0555298* 3. Stresses once again the importance, when conducting the study, of close cooperation with: (a) All relevant United Nations bodies, funds and programmes, including the United Nations Development Fund for Women, the United Nations Children’s Fund, the United Nations Development Programme, the United Nations Population Fund, the World Health Organization and the United Nations International Research and Training Institute for the Advancement of Women; (b) All relevant parts of the Secretariat, in particular the Office of the United Nations High Commissioner for Human Rights and the regional commissions; (c) United Nations treaty bodies, in particular the Committee on the Elimination of Discrimination against Women; (d) Special procedures of the Commission on Human Rights, in particular the Special Rapporteur on violence against women, its causes and consequences; 4. Requests the Secretary-General: (a) To seize all opportunities to raise awareness on the conduct of the study and solicit contributions, and in this regard notes with appreciation the launch of a website dedicated to the study and the online discussion that took place from 26 September to 15 October 2005; (b) To ensure that the conduct of the study on all forms of violence against women will be carried out in close cooperation with the in-depth study on the question of violence against children requested in its resolution 56/138 of 19 December 2001 so as to enable the exchange of appropriate information; (¢) To continue to provide opportunities for consultations with Member States and other stakeholders and to solicit information, including on strategies, policies, programmes and best practices, including from regional organizations; (d) To continue and, where appropriate, to strengthen cooperation with relevant non-governmental organizations in the preparation of the study; 5. Urges all relevant United Nations bodies, funds and programmes to fully cooperate with the Secretary-General in the conduct of the study; 6. Encourages Member States to contribute to the funding of the in-depth study on all forms of violence against women in order to meet the budgetary requirements for the study; 7. Decides: (a) To extend to the sixty-first session of the General Assembly the deadline for submission of the report mentioned in subparagraph (d) of its resolution 58/185, in time for its in-depth consideration at that session, at the latest by early September 2006; (b) To consider the report at its sixty-first session under the item entitled “Advancement of women”.",10/13/2005,2005_558461,Haiti,N/A,yes
2005,General Assembly,First Committee,Sixtieth session,85 (b),"Reduction of military budgets: objective information on military matters, including transparency of military expenditures","Argentina, Armenia, Australia, Austria, Belgium, Bolivia, Bosnia and Herzegovina, Brazil, Bulgaria, Burkina Faso, Canada, Chile, Costa Rica, Cote d’Ivoire, Croatia, Cyprus, Czech Republic, Denmark, Ecuador, Estonia, Finland, France, Georgia, Germany, Ghana, Greece, Guatemala, Haiti, Hungary, Iceland, Ireland, Italy, Japan, Kazakhstan, Latvia, Lesotho, Liechtenstein, Lithuania, Luxembourg, Madagascar, Malta, Monaco, Netherlands, New Zealand, Norway, Peru, Poland, Portugal, Republic of Moldova, Romania, Russian Federation, San Marino, Senegal, Serbia and Montenegro, Sierra Leone, Slovakia, Slovenia, Solomon Islands, Spain, Sweden, Switzerland, Thailand, Trinidad and Tobago, Turkey, Ukraine, United Kingdom of Great Britain and Northern Ireland, United States of America and Uruguay",N/A,"Objective information on military matters, including transparency of military expenditures","The General Assembly, Recalling its resolutions 53/72 of 4 December 1998, 54/43 of 1 December 1999, 56/14 of 29 November 2001 and 58/28 of 8 December 2003 on objective information on military matters, including transparency of military expenditures, Also recalling its resolution 35/142 B of 12 December 1980, which introduced the United Nations system for the standardized reporting of military expenditures, and its resolutions 48/62 of 16 December 1993, 49/66 of 15 December 1994, 51/38 of 10 December 1996 and 52/32 of 9 December 1997, calling upon all Member States to participate in it, and its resolution 47/54 B of 9 December 1992, endorsing the guidelines and recommendations for objective information on military matters and inviting Member States to provide the Secretary-General with relevant information regarding their implementation, Noting that since then, national reports on military expenditures and on the guidelines and recommendations for objective information on military matters have 05-54935 (E) 141005 *0554925~* been submitted by a number of Member States belonging to different geographic regions, Convinced that the improvement of international relations forms a sound basis for promoting further openness and transparency in all military matters, Also convinced that transparency in military matters is an essential element for building a climate of trust and confidence between States worldwide and that a better flow of objective information on military matters can help to relieve international tension and is therefore an important contribution to conflict prevention, Noting the role of the standardized reporting system, as instituted through its resolution 35/142 B, as an important instrument to enhance transparency in military matters, Conscious that the value of the standardized reporting system would be enhanced by a broader participation of Member States, Welcoming, therefore, the report of the Secretary-General! on ways and means to implement the guidelines and recommendations for objective information on military matters, including, in particular, how to strengthen and broaden participation in the standardized reporting system, Recalling that the guidelines and recommendations for objective information on military matters recommended certain areas for further consideration, such as the improvement of the standardized reporting system, Noting the efforts of several regional organizations to promote transparency of military expenditures, including standardized annual exchanges of relevant information among their member States, 1. Calls upon Member States to report annually, by 30 April, to the Secretary-General their military expenditures for the latest fiscal year for which data are available, using, preferably and to the extent possible, the reporting instrument as recommended in its resolution 35/142 B or, as appropriate, any other format developed in conjunction with similar reporting on military expenditures to other international or regional organizations, and, in the same context, encourages Member States to submit nil returns, if appropriate; 2. Recommends the guidelines and recommendations for objective information on military matters to all Member States for implementation, fully taking into account specific political, military and other conditions prevailing in a region, on the basis of initiatives and with the agreement of the States of the region concerned; 3. Encourages relevant international bodies and regional organizations to promote transparency of military expenditures and to enhance complementarity among reporting systems, taking into account the particular characteristics of each region, and to consider the possibility of an exchange of information with the United Nations; A/C.1/60/L.42 4. Takes note of the reports of the Secretary-General on objective information on military matters, including transparency of military expenditures;2 5. Requests the Secretary-General, within available resources: (a) To continue the practice of sending an annual note verbale to Member States requesting the submission of data to the United Nations system for the standardized reporting of military expenditures, together with the reporting format and related instructions, and to publish in a timely fashion in appropriate United Nations media the due date for transmitting data on military expenditures; (b) To circulate annually the reports on military expenditures as received from Member States; (c) To continue consultations with relevant international bodies, with a view to ascertaining requirements for adjusting the present instrument, with a view to encouraging wider participation, and to make recommendations, based on the outcome of those consultations and taking into account the views of Member States, on necessary changes to the content and structure of the standardized reporting system,; (d) To encourage relevant international bodies and organizations to promote transparency of military expenditures and to consult with those bodies and organizations with emphasis on examining possibilities for enhancing complementarity among international and regional reporting systems and for exchanging related information between those bodies and the United Nations; (e) To encourage the United Nations regional centres for peace and disarmament in Africa, in Asia and the Pacific, and in Latin America and the Caribbean to assist Member States in their regions in enhancing their knowledge of the standardized reporting system; (f) To promote international and regional/subregional symposiums and training seminars to explain the purpose of the standardized reporting system and to give relevant technical instructions; (g) To report on experiences gained during such symposiums and training seminars; 6. Encourages Member States: (a) To inform the Secretary-General about possible problems with the standardized reporting system and their reasons for not submitting the requested data; (b) To continue to provide the Secretary-General, in time for deliberation by the General Assembly at its sixty-second session, with their views and suggestions on ways and means to strengthen and broaden participation in the standardized reporting system, including necessary changes to its content and structure; 7. Decides to include in the provisional agenda of its sixty-second session the item entitled “Objective information on military matters, including transparency of military expenditures”. 2 A/58/202, A/59/192 and A/60/159.",10/12/2005,2005_558476,Haiti,N/A,yes
2005,General Assembly,First Committee,Sixtieth session,97 (t),General and complete disarmament: the illicit trade in small arms and light weapons in all its aspects,"Algeria, Andorra, Armenia, Bangladesh, Bolivia, Canada, Chile, Colombia, Costa Rica, Cote d’Ivoire, Fiji, Guatemala, Haiti, Japan, Kazakhstan, Mongolia, Nepal, Panama, Paraguay, Peru, Romania, Russian Federation, Solomon Islands, South Africa, Switzerland, Timor-Leste, Uruguay and Zambia",N/A,The illicit trade in small arms and light weapons in all its aspects,"The General Assembly, Recalling its resolutions 56/24 V of 24 December 2001, 57/72 of 22 November 2002, 58/241 of 23 December 2003 and 59/86 of 3 December 2004, Emphasizing the importance of the early and full implementation of the Programme of Action to Prevent, Combat and Eradicate the Illicit Trade in Small Arms and Light Weapons in All Its Aspects, adopted by the United Nations Conference on the Illicit Trade in Small Arms and Light Weapons in All Its Aspects, ! Welcoming the efforts by Member States to submit, on a voluntary basis, national reports on their implementation of the Programme of Action, Noting with satisfaction regional and subregional efforts being undertaken in support of the implementation of the Programme of Action, and commending the progress that has already been made in this regard, including tackling both supply and demand factors that are relevant to addressing the illicit trade in small arms and light weapons, Recognizing the efforts undertaken by non-governmental organizations in the provisions of assistance to States for the implementation of the Programme of Action, Taking into account the relevant paragraphs on the illicit trade in small arms and light weapons in the 2005 World Summit Outcome,? Welcoming the report of the Second Biennial Meeting of States to Consider the Implementation of the Programme of Action to Prevent, Combat and Eradicate the Illicit Trade in Small Arms and Light Weapons in All Its Aspects, held in New York from 11 to 15 July 2005,3 and expressing its appreciation for the efforts undertaken by the Chair of the Meeting, Taking note of the report of the Open Ended Working Group to Negotiate an International Instrument to Enable States to Identify and Trace, in a Timely and Reliable Manner, Illicit Small Arms and Light Weapons, 4 Recognizing that illicit brokering in small arms and light weapons is a serious problem that the international community should address urgently and, in this regard, welcoming the broad-based consultations held by the Secretary-General with all Member States and interested regional and subregional organizations on further steps to enhance international cooperation in preventing, combating and eradicating illicit brokering in small arms and light weapons, Taking note of the report of the Secretary-General on the implementation of resolution 59/86,> Conscious of its decision to convene in New York the United Nations conference to review progress made in the implementation of the Programme of Action to Prevent, Combat and Eradicate the Illicit Trade in Small Arms and Light Weapons in All Its Aspects for a period of two weeks, from 26 June to 7 July 2006, and its preparatory committee for two weeks from 9 to 20 January 2006, followed by, if necessary, a subsequent session of up to two weeks in duration, which is especially relevant in order to set the agenda for activities of the international community for continuing to tackle problems in this field beyond 2006, 1. Encourages all initiatives, including those of the United Nations, other international organizations, regional and subregional organizations, non- governmental organizations, and civil society, for the successful conclusion of the United Nations conference to review progress made in the implementation of the Programme of Action to Prevent, Combat and Eradicate the Illicit Trade in Small Arms and Light Weapons in All Its Aspects' in order to set the agenda for tackling problems in the illicit trade in small arms and light weapons by the international community beyond 2006, and calls upon all Member States to continue to contribute towards the preparation of the conference and to make every effort to fully implement the Programme of Action; 2. Calls upon all States to implement the International Instrument to Enable States to Identify and Trace, in a Timely and Reliable Manner, Illicit Small Arms and Light Weapons;© 3. Decides to establish a group of governmental experts, appointed by the Secretary-General on the basis of equitable geographical representation, 3 A/CONF.192/BMS/2005/1. 4 A/60/88 and Corr.2. A/C.1/60/L.57 commencing after the review conference and no later than 2007, to consider further steps to enhance international cooperation in preventing, combating and eradicating illicit brokering in small arms and light weapons in three sessions of one week’s duration each, and to submit the report on the outcome of its study to the General Assembly at its sixty-second session; 4. Requests the Secretary-General to provide the group of governmental experts with any assistance and services that may be required for the discharge of its tasks; 5. Continues to encourage all initiatives, including regional and subregional ones, to mobilize resources and expertise to promote the implementation of the Programme of Action and to provide assistance to States in its implementation; 6. Requests the Secretary-General to continue to collate and circulate data and information provided by States on a voluntary basis, including national reports, on their implementation of the Programme of Action, and encourages Member States to submit such reports; 7. Also requests the Secretary-General to report to the General Assembly at its sixty-first session on the implementation of the present resolution; 8. Decides to include in the provisional agenda of its sixty-first session the item entitled “The illicit trade in small arms and light weapons in all its aspects”.",10/20/2005,2005_558582,Haiti,"* Reissued for technical reasons. 1 See Report of the United Nations Conference on the Illicit Trade in Small Arms and Light Weapons in All Its Aspects, New York, 9-20 July 2001 (A/CONF.192/15), chap. IV. para. 24.",yes
