year,Council,Committee,Session,Agenda item,Agenda detail,cosponsored countries,body title number,body title detail,body text,date,file,filecountry,footnote,scanned
2005,General Assembly,N/A,Fifty-ninth session,39,"Strengthening of the coordination of humanitarian and disaster relief assistance of the United Nations, including special economic assistance","Andorra, Australia, Austria, Azerbaijan, Belarus, Belgium, Brunei Darussalam, Cambodia, Canada, China, Cyprus, Czech Republic, Denmark, Estonia, France, Greece, Indonesia, Iran (Islamic Republic of), Ireland, Italy, Jamaica, Japan, Kazakhstan, Lao People’s Democratic Republic, Lithuania, Luxembourg, Malaysia, Maldives, Mauritius, Monaco, Mongolia, Morocco, Myanmar, Netherlands, New Zealand, Pakistan, Philippines, Republic of Korea, Russian Federation, Senegal, Serbia and Montenegro, Singapore, Slovenia, Somalia, Spain, Sri Lanka, Sweden, Tajikistan, Thailand, Timor-Leste, United Kingdom of Great Britain and Northern Ireland, Uzbekistan, Viet Nam",N/A,"Strengthening emergency relief, rehabilitation, reconstruction and prevention in the aftermath of the Indian Ocean tsunami disaster","Addendum Add the following countries to the list of sponsors of the resolution: Albania, Algeria, Argentina, Armenia, Bangladesh, Bolivia, Bosnia and Herzegovina, Brazil, Bulgaria, Cameroon, Central African Republic, Chile, Croatia, Cuba, Djibouti, Egypt, El Salvador, Ethiopia, Finland, Madagascar, Gabon, Gambia, Germany, Ghana, Grenada, Guatemala, Guinea, Guyana, Haiti, Hungary, Iceland, India, Israel, Kenya, Kuwait, Kyrgyzstan, Latvia, Lesotho, Liberia, Libyan Arab Jamahiriya, Liechtenstein, Mali, Malta, Mexico, Mozambique, Namibia, Nauru, Nepal, Nicaragua, Nigeria, Norway, Peru, Poland, Portugal, Qatar, Republic of Moldova, Romania, San Marino, Samoa, Saudi Arabia, Slovakia, South Africa, Spain, Sudan, Switzerland, Syrian Arab Republic, the former Yugoslav Republic of Macedonia, Togo, Trinidad and Tobago, Tunisia, Turkey, Turkmenistan, Ukraine, United States of America, Uruguay, Vanuatu, Yemen In order for the General Assembly to be able to consider the present resolution, it will be necessary to reopen consideration of agenda item 39. 05-21390 (E) 190105 *0521390*",01/19/2005,2005_539612,Haiti,*,yes
2005,Economic And Social Council,Commission On Human Rights,Sixty-first session,10,"ECONOMIC, SOCIAL AND CULTURAL RIGHTS","Andorra*, Austria*, Bangladesh*, Belarus*, Bhutan, Botswana*, Burkina Faso, Cameroon*, Congo, Cote d’Ivoire*, Croatia*, Cuba, China, Democratic Republic of the Congo*, Ecuador, Egypt, El Salvador*, Eritrea, Estonia*, Ethiopia, Finland, Germany, Guatemala, Guinea, Haiti*, Honduras, Indonesia, Islamic Republic of Iran*, Kenya, Libyan Arab Jamahiriya*, Madagascar*, Malaysia, Mali*, Mexico, Mozambique*, Nepal, Nigeria, Norway*, Pakistan, Portugal*, Qatar, Romania, Rwanda*, Senegal*, Slovenia*, South Africa, Spain*, Sri Lanka, Sudan, Swaziland, Switzerland*, Syrian Arab Republic*, Thailand*, Togo, Tunisia*, Turkey*, United Republic of Tanzania*, Venezuela*, Yemen*, Zambia*",2005,The right to food,"The Commission on Human Rights, Recalling the Universal Declaration of Human Rights, which provides that everyone has the right to a standard of living adequate for her/his health and well-being, including food, Recalling also the provisions of the International Covenant on Economic, Social and Cultural Rights in which the fundamental right of every person to be free from hunger is recognized, Recalling further the Universal Declaration on the Eradication of Hunger and Malnutrition as well as the United Nations Millennium Declaration, Bearing in mind the Rome Declaration on World Food Security and the Plan of Action of the World Food Summit, held in Rome from 13 to 17 November 1996, and bearing in mind also the Declaration of the World Food Summit: five years later - International Alliance against Hunger, held in Rome from 10 to 13 June 2002, Welcoming the concrete recommendations contained in the Voluntary Guidelines to Support the Progressive Realization of the Right to Adequate Food in the Context of National Food Security adopted by the Council of the Food and Agricultural Organization of the United Nations, Reaffirming that all human rights are universal, indivisible and interdependent and interrelated, Recalling all its previous resolutions in this regard, in particular resolution 2004/19 of 16 April 2004, Recognizing that the problem of hunger and food insecurity has global dimensions and that they are likely to persist and even to increase dramatically in some regions unless urgent, determined and concerted action is taken, given the anticipated increase in the world’s population and the strain on natural resources, Reaffirming that a peaceful, stable and enabling political, social and economic environment, both at a national and an international level, is the essential foundation which will enable States to give adequate priority to food security and poverty eradication, Reiterating, as did the Rome Declaration as well as the Declaration of the World Food Summit: five years later, that food should not be used as an instrument of political or economic pressure, and reaffirming in this regard the importance of international cooperation and solidarity, as well as the necessity of refraining from unilateral measures not in accordance with international law and the Charter of the United Nations which endanger food security, Convinced that each State must adopt a strategy consistent with its resources and capacities to achieve its individual goals in implementing the recommendations contained in the Rome Declaration and Plan of Action of the World Summit and, at the same time, cooperate regionally and internationally in order to organize collective solutions to global issues of food security in a world of increasingly interlinked institutions, societies and economies, where coordinated efforts and shared responsibilities are essential, Stressing the importance of reversing the continuing decline of official development assistance devoted to agriculture and rural development, both in real terms and as a share of total official development assistance, Expressing its deep concern at the number and scale of natural disasters, diseases and agricultural pests and their increasing impact in recent years, which have resulted in a massive loss of life and livelihood and threatened agricultural production and food security, in particular in developing countries, Welcoming the solidarity and humanity expressed by the international community towards the victims and the Governments of the States that suffered huge losses of life and socio-economic and environmental damage as a result of the unprecedented tsunami disaster that struck the Indian Ocean and South-East Asian region on 26 December 2004, 1. Reaffirms that hunger constitutes an outrage and a violation of human dignity and, therefore, requires the adoption of urgent measures at the national, regional and international levels for its elimination,; 2. Also reaffirms the right of everyone to have access to safe and nutritious food, consistent with the right to adequate food and the fundamental right of everyone to be free from hunger so as to be able fully to develop and maintain their physical and mental capacities; 3. Considers it intolerable that there are around 852 million undernourished people in the world, that every five seconds a child under the age of five dies, directly or indirectly, of hunger or hunger-related disease somewhere in the world and that one person loses his/her eyesight every four minutes as a result of a lack of vitamin A when, according to the Food and Agriculture Organization of the United Nations, the planet could produce enough food to provide 2,100 kilocalories per person per day to 12 billion people, twice the world’s present population; 4. Expresses its concern that women are disproportionately affected by hunger, food insecurity and poverty, in part as a result of gender inequality, that in many countries gitls are twice as likely as boys to die from malnutrition and preventable childhood diseases and that it is estimated that almost twice as many women as men suffer from malnutrition and, in that sense, encourages the Special Rapporteur to continue mainstreaming a gender perspective in the fulfilment of his mandate; 5. Stresses the need to make efforts to mobilize and optimize the allocation and utilization of technical and financial resources from all sources, including external debt relief for developing countries, to reinforce national actions to implement sustainable food security policies; 6. Recognizes that the promises made at the World Food Summit in 1996 to halve the number of undernourished persons are not being fulfilled and that, on the contrary, global hunger increased yet again this year, and invites once again all international financial and developmental institutions, as well as the relevant United Nations agencies and funds, to give priority and provide necessary funding to help realize the aim to halve by the year 2015 the proportion of people who suffer from hunger, as well as to realize the right to food; 7. Encourages all States to take steps with a view to achieving progressively the full realization of the right to food, including steps to promote the conditions for everyone to be free from hunger and as soon as possible enjoy fully the right to food, as well as to elaborate and adopt national plans to combat hunger; 8. Requests all States and private actors, as well as international organizations within their respective mandates, to take fully into account the need to promote the effective realization of the right to food for all, including in the ongoing negotiations in different fields; 9. Takes note of the report of the Special Rapporteur on the right to food (E/CN.4/2005/47 and Add.1 and 2) and also takes note of his valuable work in the promotion of the right to food in all parts of the world; 10. Calls upon all Governments to cooperate with and assist the Special Rapporteur in his task, to supply all necessary information requested by him and to give serious consideration to responding favourably to the Special Rapporteur’s requests to visit their countries, so as to enable him to fulfil his mandate even more effectively; 10. 11. Requests the United Nations High Commissioner for Human Rights to provide all necessary human and financial resources for the effective fulfilment of the mandate of the Special Rapporteur; 11. 12. Welcomes the work already done by the Committee on Economic, Social and Cultural Rights in promoting the right to adequate food, in particular its general comment No. 12 (1999) on the right to adequate food (article 11 of the International Covenant on Economic, Social and Cultural Rights), in which the Committee affirmed, inter alia, that the right to adequate food is indivisibly linked to the inherent dignity of the human person and is indispensable for the fulfilment of other human rights enshrined in the International Bill of Human Rights and is also inseparable from social justice, requiring the adoption of appropriate economic, environmental and social policies, at both the national and international levels, oriented to the eradication of poverty and the fulfilment of all human rights for all; 12. 13. Recalls general comment No. 15 (2002) on the right to water (articles 11 and 12 of the Covenant) adopted by the Committee on Economic, Social and Cultural Rights, in which the Committee notes, inter alia, the importance of ensuring sustainable water resources for human consumption and agriculture in the realization of the right to adequate food; 13. 14. Welcomes the meeting of world leaders for action against hunger and poverty, convened by the Presidents of Brazil, Chile and France and the Prime Minister of Spain, with the support of the Secretary-General, and the resulting New York Declaration on Action against Hunger and Poverty, which has been supported by more that one hundred countries to date, and recommends the continuation of efforts aimed at identifying additional sources of financing for 14. the fight against hunger and poverty; 15. Also welcomes the adoption by the Council of the Food and Agricultural Organization of the United Nations of the Voluntary Guidelines to Support the Progressive Realization of the Right to Adequate Food in the Context of National Food Security, which marks an important step in the progress towards the promotion, protection and implementation of human rights for all; 15. 16. Requests the Special Rapporteur to submit an interim report to the General Assembly at its sixtieth session and to report to the Commission at its sixty-second session on the implementation of the present resolution; 16. 17. Invites Governments, relevant United Nations agencies, funds and programmes, treaty bodies, civil society actors, including non-governmental organizations, as well as the private sector, to cooperate fully with the Special Rapporteur in the fulfilment of his mandate, inter alia through the submission of comments and suggestions on ways and means of realizing the right to food; 17. Decides to continue its consideration of this matter at its sixty-second session, 18. under the same agenda item.",04/11/2005,2005_545548,Haiti,"* In accordance with rule 69, paragraph 3, of the rules of procedure of the functional commissions of the Economic and Social Council.",yes
