year,Council,Committee,Session,Agenda item,Agenda detail,cosponsored countries,body title number,body title detail,body text,date,file,filecountry,footnote,scanned
2019,General Assembly,N/A,Seventy-third session,72,"Elimination of racism, racial discrimination, xenophobia and related intolerance","Indonesia, Japan, Kuwait, Malaysia, Pakistan, Qatar, Samoa, Somalia, Suriname and Turkey",N/A,Combating terrorism and other acts of violence based on religion or belief,"Addendum Add the following countries to the list of sponsors of the resolution: Algeria, Azerbaijan, Bahrain, Bangladesh, Belarus, Ecuador, Egypt, Fiji, [ran (Islamic Republic of), Jordan, Kazakhstan, Kyrgyzstan, Lebanon, Libya, Maldives, Mali, Morocco, Nigeria, Panama, Paraguay, Philippines, Russian Federation, Saudi Arabia, Serbia, Spain, Tajikistan, Tunisia, Turkmenistan, Uzbekistan, Venezuela (Bolivarian Republic of), Viet Nam, Zimbabwe and State of Palestine Remove the following country from the list of sponsors of the resolution: Japan Please recycle 19-05483 iii 040419 A A",04/02/2019,2019_3799138,Iran (Islamic Republic of),N/A,yes
2019,General Assembly,N/A,Seventy-third session,128 (i),Cooperation between the United Nations and regional and other organizations: cooperation between the United Nations and the Economic Cooperation Organization,"Equatorial Guinea, Guinea, Kyrgyzstan, Tajikistan and Uzbekistan",N/A,Cooperation between the United Nations and the Economic Cooperation Organization,"Addendum Add the following countries to the list of sponsors of the resolution: Afghanistan, Angola, Azerbaijan, Benin, Bolivia (Plurinational State of), [ran (Islamic Republic of), Kazakhstan, Pakistan, Palau, Panama and Turkey Please recycle eS 19-12756 Hi 310719 A TT A A",07/25/2019,2019_3813834,Iran (Islamic Republic of),N/A,yes
2019,General Assembly,N/A,Seventy-fourth session,N/A,United Nations Av74/293,"Letter dated 16 August 2019 from the representatives of China, Cambodia, the Islamic Republic of Iran, Kyrgyzstan, the Lao People’s Democratic Republic, Mongolia, Myanmar, Nepal, Pakistan, Singapore, Uzbekistan and Viet Nam to the United Nations addressed to the Secretary-General Pursuant to rule 14 of the rules of procedure of the General Assembly, we have the honour to jointly request the inclusion in the agenda of the seventy-fourth session of the General Assembly of a supplementary item entitled “Observer status for the Boao Forum for Asia in the General Assembly”. The Boao Forum for Asia is a non-profit international organization dedicated to providing a high-level venue for dialogue among Governments, businesses and academic leaders in Asia and other regions on major Asian and global issues. The Forum strives to promote economic exchanges, interaction and cooperation within the region, as well as between the region and other parts of the world in the pursuit of common development. It holds its annual conference in Hainan Province, China, organizes regional and international conferences to discuss the economic and social development of Asia and beyond, as well as key issues concerning technology and innovation, education, health, culture and the media, and to propose initiatives to strengthen cooperation between Governments and businesses. Twenty-nine countries, namely, the Commonwealth of Australia, the People’s Republic of Bangladesh, Brunei Darussalam, the Kingdom of Cambodia, the People’s Republic of China, the Republic of India, the Republic of Indonesia, the Islamic Republic of Iran, the State of Israel, Japan, the Republic of Kazakhstan, the Kyrgyz Republic, the Lao People’s Democratic Republic, the Republic of Maldives, Malaysia, Mongolia, the Republic of the Union of Myanmar, the Federal Democratic Republic of Nepal, New Zealand, the Islamic Republic of Pakistan, the Republic of the Philippines, the Republic of Korea, the Republic of Singapore, the Democratic Socialist Republic of Sri Lanka, the Republic of Tajikistan, the Kingdom of Thailand, OF ao :ay2 Please recycle OQ ol 19-14083 HA 230819 A A A A/74/293 Turkmenistan, the Republic of Uzbekistan and the Socialist Republic of Viet Nam are initial countries of the Forum. Membership is open to all members of the United Nations. The Forum signed a cooperation agreement with the Department of Economic and Social Affairs of the United Nations Secretariat in 2019 to advance their shared goals. In accordance with rule 20 of the rules of procedure of the General Assembly, an explanatory memorandum (annex J)",N/A,We have the honour to request that the present letter and its annexes be circulated as a document of the General Assembly.,"(Signed) Zhang Jun Permanent Representative of the People’s Republic of China to the United Nations (Signed) Sovann Ke Permanent Representative of the Kingdom of Cambodia to the United Nations (Signed) Majid Takht Ravanchi Permanent Representative of the Islamic Republic of Iran to the United Nations (Signed) Mirgul Moldoisaeva Permanent Representative of the Kyrgyz Republic to the United Nations (Signed) Khiane Phansourivong Permanent Representative of the Lao People’s Democratic Republic to the United Nations (Signed) Baasankhuu Purev Chargé d’affaires a.i. of the Permanent Mission of Mongolia to the United Nations (Signed) Hau Do Suan Permanent Representative of the Republic of the Union of Myanmar to the United Nations (Signed) Amrit Bahadur Rai Permanent Representative of the Federal Democratic Republic of Nepal to the United Nations (Signed) Maleeha Lodhi Permanent Representative of the Islamic Republic of Pakistan to the United Nations (Signed) Burhan Gafoor Permanent Representative of the Republic of Singapore to the United Nations (Signed) Bakhtiyor Ibragimov Permanent Representative of the Republic of Uzbekistan to the United Nations (Signed) Dang Dinh Quy Permanent Representative of the Socialist Republic of Viet Nam to the United Nations 2/6 A/74/293 Annex I Explanatory memorandum The Boao Forum for Asia is an international organization jointly initiated by 29 Asia-Pacific countries (see the attached list). The objectives of the Forum include (1) to promote and deepen economic exchange, interaction and cooperation within Asia as well as between Asia and other parts of the world; and (2) to provide a high- level venue for dialogue among Governments, businesses, experts and scholars to discuss economic, social, environmental and other issues important for Asia and the world. On the proposal of Fidel V. Ramos, former President of the Philippines, Bob Hawke, former Prime Minister of Australia, and Morihiro Hosokawa, former Prime Minister of Japan, representatives of 25 countries met in Hainan Province, China, on 19 November 2000, and agreed that the Boao Forum for Asia would be established and its headquarters permanently located at Boao. On 27 February 2001, the Charter of the Boao Forum for Asia was unanimously adopted by the representatives of all the participating countries, and 26 countries including China became initial countries of the Forum. In 2006 and 2016, upon the requests of their Governments, the Forum accepted Israel, New Zealand and the Maldives as initial countries in addition to the original list. The Boao Forum for Asia consists of the General Meeting of Members, the Board of Directors, the Secretariat, the Research and Training Institute and the Council of Advisers. The General Meeting of Members is the ultimate authority of the Forum, and includes 234 political and business leaders, government agencies, companies and think tanks from 36 countries and regions around the world (as at 31 July 2019). The Board of Directors functions as the supreme executive body of the General Meeting. The 19 board members include former political leaders, business leaders and former heads of international organizations, who are nominated by Governments of relevant countries and approved by the General Meeting. The incumbent Chair of the Board of Directors is Mr. Ban Ki-moon, former Secretary- General of the United Nations. In accordance with the Charter of the Boao Forum for Asia and the laws of China, the host country, the Forum possesses full juridical personality and has full capacity to contract, to acquire and to dispose of immovable and movable property, and to institute legal proceedings. In 2005, a memorandum of understanding was signed by the Chinese Government and the Forum, which ensures for the Forum treatment as an intergovernmental international organization with regard to premises, tax concessions, entry and exit and the like. To help Asian countries to achieve common development and deepen economic cooperation with other regions, the Boao Forum for Asia holds its annual conference in Boao in the spring. State leaders, business elites and opinion leaders from various countries are invited to discuss key issues on the economic and social development of Asia and the world, such as finance, trade, investment and the environment. During the annual conference, consensus is reached, and regional and international initiatives are launched through exchanges on an equal footing. At the invitation of Governments, businesses and think tanks, the Boao Forum for Asia organizes conferences in various countries in Asia and beyond to forge partnerships between the public and private sectors and promote trade and investment facilitation. The Boao Forum for Asia works closely with the United Nations specialized agencies and major international economic organizations in co-hosting conferences 3/6 A/74/293 in specialized areas, conducting joint studies and releasing reports on regional and global economic trends. In 2019, the Forum signed a cooperation agreement with the Department of Economic and Social Affairs of the United Nations Secretariat and held the Global Health Forum with the World Health Organization to advance their shared goals. We believe that the Boao Forum for Asia, which is based in Asia and with a global outlook, provides intellectual support for the sustainable development of the Asian economy and actively promotes economic globalization. It commits to safeguarding the international system with the United Nations at the core and to upholding a multilateral trading system that is open, transparent, inclusive, just and equitable. As an international public good and a platform for exchange of ideas, the Forum is jointly initiated and operated by Asian countries and receives support from around the world. Its activities are consistent with the purposes and principles of the United Nations in the socioeconomic fields. We are convinced that granting the Boao Forum for Asia observer status in the General Assembly will help to facilitate deeper and long-term cooperation between the Forum and the United Nations. This will not only support the collaboration between the Asian countries in the pursuit of the 2030 Sustainable Development Goals, but also promote the robust, inclusive and sustainable growth of the world economy. 4/6 A/74/293 List of initial countries of the Boao Forum for Asia — er nN anw FF YN NO NY NY NY WN KN NY NY NO RO RR ee ee NAAR HN = SSH NDA BR wWN FS The Commonwealth of Australia The People’s Republic of Bangladesh Brunei Darussalam The Kingdom of Cambodia The People’s Republic of China The Republic of India The Republic of Indonesia The Islamic Republic of Iran The State of Israel Japan The Republic of Kazakhstan The Kyrgyz Republic The Lao People’s Democratic Republic The Republic of Maldives Malaysia Mongolia The Republic of the Union of Myanmar The Federal Democratic Republic of Nepal New Zealand The Islamic Republic of Pakistan The Republic of the Philippines The Republic of Korea The Republic of Singapore The Democratic Socialist Republic of Sri Lanka The Republic of Tajikistan The Kingdom of Thailand Turkmenistan The Republic of Uzbekistan The Socialist Republic of Viet Nam 5/6 A/74/293 Annex IT Draft resolution Observer status for the Boao Forum for Asia in the General Assembly The General Assembly, Noting the aspiration of the Boao Forum for Asia to develop its cooperation with the United Nations, 1. Decides to invite the Boao Forum for Asia to participate in the sessions and the work of the General Assembly in the capacity of observer; 2. Requests the Secretary-General to take the action necessary to implement the present resolution. 19-14083 6/6",08/19/2019,2019_3825179,Iran (Islamic Republic of),N/A,yes
2019,General Assembly,N/A,Seventy-third session,15,Culture of peace,"Azerbaijan, Belarus, Canada, Central African Republic, Cuba, Ecuador, Guinea, India, Indonesia, Kyrgyzstan, Lebanon, Nicaragua, Norway, Paraguay, Qatar, Russian Federation, Saudi Arabia, Sierra Leone, Singapore, Sri Lanka, Turkey, Turkmenistan, Uzbekistan, Venezuela (Bolivarian Republic of) and Viet Nam",N/A,"International Year of Peace and Trust, 2021","Addendum Add the following countries to the list of sponsors of the resolution: Algeria, Armenia, Bahrain, Bangladesh, Benin, Bolivia (Plurinational State of), Bosnia and Herzegovina, Botswana, Brazil, Chad, China, Cote d’Ivoire, Democratic People’s Republic of Korea, Djibouti, Equatorial Guinea, Eritrea, Georgia, Greece, Guyana, Iran (Islamic Republic of), Ireland, Jordan, Lao People’s Democratic Republic, Lesotho, Libya, Malawi, Mongolia, Montenegro, Morocco, Myanmar, Oman, Pakistan, Panama, Peru, Poland, Republic of Korea, Republic of Moldova, Samoa, Serbia, Somalia, Sudan, Thailand, Timor-Leste, Tonga, Tunisia, Uganda, United Arab Emirates and Zimbabwe edie Please recycle OQ ol 19-15694 1 160919 A A A",09/12/2019,2019_3827496,Iran (Islamic Republic of),N/A,yes
2019,General Assembly,First Committee,Seventy-fourth session,98 (x),"General and complete disarmament: follow-up to nuclear disarmament obligations agreed to at the 1995, 2000 and 2010 Review Conferences of the Parties to the Treaty on the Non-Proliferation of Nuclear Weapons",Islamic Republic of Iran,N/A,"Follow-up to nuclear disarmament obligations agreed to at the 1995, 2000 and 2010 Review Conferences of the Parties to the Treaty on the Non-Proliferation of Nuclear Weapons","The General Assembly, Recalling its various resolutions in the field of nuclear disarmament, including resolutions 60/72 of 8 December 2005, 62/24 of 5 December 2007, 64/31 of 2 December 2009, 66/28 of 2 December 2011, 68/35 of 5 December 2013, 69/43 and 69/48 of 2 December 2014, 70/38 of 7 December 2015 and 72/29 of 4 December 2017, Bearing in mind its resolution 2373 (XXID) of 12 June 1968, the annex to which contains the Treaty on the Non-Proliferation of Nuclear Weapons, ! Noting the provisions of article VII, paragraph 3, of the Treaty regarding the convening of review conferences at five-year intervals, Recalling its resolution 50/70 Q of 12 December 1995, in which the General Assembly noted that the States parties to the Treaty affirmed the need to continue to move with determination towards the full realization and effective implementation of the provisions of the Treaty, and accordingly adopted a set of principles and objectives, Recalling also that, on 11 May 1995, the 1995 Review and Extension Conference of the Parties to the Treaty on the Non-Proliferation of Nuclear Weapons adopted three decisions on, respectively, strengthening the review process for the Treaty, principles and objectives for nuclear non-proliferation and disarmament, and extension of the Treaty,” ' See also United Nations, Treaty Series, vol. 729, No. 10485. 2 See 1995 Review and Extension Conference of the Parties to the Treaty on the Non-Proliferation of Nuclear Weapons, Final Document, Part I (NPT/CONF.1995/32 (Part I) and NPT/CONF. 1995/32 (Part I)/Corr.2), annex. g3 Please recycle 19-16868 Hi 031019 A AA I Reaffirming the resolution on the Middle East adopted on 11 May 1995 by the 1995 Review and Extension Conference,” in which the Conference reaffirmed the importance of the early realization of universal adherence to the Treaty and placement of nuclear facilities under full-scope International Atomic Energy Agency safeguards, Reaffirming also its resolution 55/33 D of 20 November 2000, in which the General Assembly welcomed the adoption by consensus on 19 May 2000 of the Final Document of the 2000 Review Conference of the Parties to the Treaty on the Non-Proliferation of Nuclear Weapons, ? including, in particular, the documents entitled “Review of the operation of the Treaty, taking into account the decisions and the resolution adopted by the 1995 Review and Extension Conference” and “Improving the effectiveness of the strengthened review process for the Treaty”,* Taking into consideration the unequivocal undertaking by the nuclear-weapon States, in the Final Document of the 2000 Review Conference, to accomplish the total elimination of their nuclear arsenals leading to nuclear disarmament, to which all States parties to the Treaty are committed under article VI of the Treaty, Expressing concern that the ninth Review Conference of the Parties to the Treaty on the Non-Proliferation of Nuclear Weapons, held from 27 April to 22 May 2015, was not able to reach agreement on a substantive final document, 1. Recalls that the 2010 Review Conference of the Parties to the Treaty on the Non-Proliferation of Nuclear Weapons reaffirmed the continued validity of the practical steps agreed to in the Final Document of the 2000 Review Conference of the Parties to the Treaty on the Non-Proliferation of Nuclear Weapons;> 2. Determines to pursue practical steps for systematic and progressive efforts to implement article VI of the Treaty on the Non-Proliferation of Nuclear Weapons! and paragraphs 3 and 4 (c) of the decision on principles and objectives for nuclear non-proliferation and disarmament of the 1995 Review and Extension Conference of the Parties to the Treaty on the Non-Proliferation of Nuclear Weapons; 3. Calls for practical steps, as agreed to at the 2000 Review Conference of the Parties to the Treaty on the Non-Proliferation of Nuclear Weapons, to be taken by all nuclear-weapon States, that would lead to nuclear disarmament in a way that promotes international stability and, based on the principle of undiminished security for all: (a) Further efforts to be made by the nuclear-weapon States to reduce their nuclear arsenals unilaterally; (b) Increased transparency by the nuclear-weapon States with regard to nuclear weapons capabilities and the implementation of agreements pursuant to article VI of the Treaty and as a voluntary confidence-building measure to support further progress in nuclear disarmament; (c) The further reduction of non-strategic nuclear weapons, based on unilateral initiatives and as an integral part of the nuclear arms reduction and disarmament process; (d) Concrete agreed measures to reduce further the operational status of nuclear weapons systems; 3 2000 Review Conference of the Parties to the Treaty on the Non-Proliferation of Nuclear Weapons, Final Document, vols. I-HI (NPT/CONF.2000/28 (Parts I and IH), NPT/CONF.2000/28 (Part Ill) and NPT/CONF.2000/28 (Part IV)). 2/3 (e) A diminishing role for nuclear weapons in security policies so as to minimize the risk that these weapons will ever be used and to facilitate the process of their total elimination; (f) The engagement, as soon as appropriate, of all the nuclear-weapon States in the process leading to the total elimination of their nuclear weapons; 4. Notes that the 2000 and 2010 Review Conferences agreed that legally binding security assurances by the five nuclear-weapon States to the non-nuclear- weapon States parties to the Treaty strengthen the nuclear non-proliferation regime; 5. Urges the States parties to the Treaty to follow up on the implementation of the nuclear disarmament obligations under the Treaty agreed to at the 1995, 2000 and 2010 Review Conferences within the framework of review conferences and their preparatory committees; 6. Decides to include in the provisional agenda of its seventy-sixth session, under the item entitled “General and complete disarmament”, the sub-item entitled “Follow-up to nuclear disarmament obligations agreed to at the 1995, 2000 and 2010 Review Conferences of the Parties to the Treaty on the Non-Proliferation of Nuclear Weapons”. 19-16868 3/3",10/01/2019,2019_3829559,Iran (Islamic Republic of),N/A,yes
2019,General Assembly,N/A,Seventy-third session,15,Culture of peace,"Afghanistan, Armenia, Benin, Equatorial Guinea, Hungary, Kuwait, Lebanon, Morocco, Poland, Suriname and Venezuela (Bolivarian Republic of)",N/A,Academy for Human Encounters and Dialogue,"Addendum Add the following countries to the list of sponsors of the resolution: Albania, Algeria, Andorra, Angola, Antigua and Barbuda, Argentina, Austria, Azerbaijan, Bahamas, Bahrain, Bangladesh, Barbados, Belarus, Belgium, Belize, Bhutan, Bolivia (Plurinational State of), Bosnia and Herzegovina, Botswana, Brazil, Brunei Darussalam, Bulgaria, Burkina Faso, Burundi, Cabo Verde, Cambodia, Cameroon, Canada, Central African Republic, Chad, Chile, China, Colombia, Comoros, Congo, Costa Rica, Croatia, Cuba, Cyprus, Czechia, Cote d’Ivoire, Democratic People’s Republic of Korea, Democratic Republic of the Congo, Denmark, Djibouti, Dominica, Dominican Republic, Ecuador, Egypt, El Salvador, Eritrea, Estonia, Eswatini, Ethiopia, Fiji, Finland, France, Gabon, Gambia, Germany, Ghana, Greece, Grenada, Guatemala, Guinea, Guinea- Bissau, Guyana, Haiti, Honduras, Iceland, India, Indonesia, Iran (Islamic Republic of), Iraq, Ireland, Italy, Jamaica, Japan, Jordan, Kazakhstan, Kenya, Kiribati, Kyrgyzstan, Lao People’s Democratic Republic, Latvia, Lesotho, Liberia, Libya, Liechtenstein, Lithuania, Luxembourg, Madagascar, Malawi, Malaysia, Maldives, Mali, Malta, Mauritania, Mauritius, Mexico, Monaco, Mongolia, Montenegro, Mozambique, Myanmar, Namibia, Nepal, Netherlands, New Zealand, Nicaragua, Niger, Nigeria, North Macedonia, Norway, Oman, Pakistan, Palau, Panama, Papua New Guinea, Paraguay, Peru, Philippines, Portugal, Qatar, Republic of Korea, Republic of Moldova, Romania, Rwanda, Saint Kitts and Nevis, Saint Lucia, Saint Vincent and the Grenadines, San Marino, Sao Tome and Principe, Saudi Arabia, Senegal, Serbia, Seychelles, Sierra Leone, Singapore, Slovakia, Slovenia, Somalia, South Africa, South Sudan, Spain, Sri Lanka, Sudan, Sweden, Switzerland, Syrian Arab Republic, Thailand, Timor-Leste, Togo, Trinidad and Tobago, Tunisia, Turkey, Turkmenistan, Uganda, United Arab Emirates, United Republic of Tanzania, Uruguay, Uzbekistan, Vanuatu, Viet Nam, Yemen, Zambia, Zimbabwe and State of Palestine Please recycle eS 19-15852 1 041019 A A",09/16/2019,2019_3829881,Iran (Islamic Republic of),N/A,yes
2019,General Assembly,Sixth Committee,Seventy-fourth session,174,Observer status for the Boao Forum for Asia in the General Assembly,"Cambodia, China, Indonesia, Iran (Islamic Republic of), Kazakhstan, Kyrgyzstan, Lao People’s Democratic Republic, Mongolia, Myanmar, Nepal, Pakistan, Philippines, Republic of Korea, Saudi Arabia, Singapore, Sri Lanka, Thailand, Uzbekistan and Viet Nam",N/A,Observer status for the Boao Forum for Asia in the General Assembly,"The General Assembly, Wishing to promote cooperation between the United Nations and the Boao Forum for Asia, 1. Decides to invite the Boao Forum for Asia to participate in the sessions and the work of the General Assembly in the capacity of observer; 2. Requests the Secretary-General to take the action necessary to implement the present resolution. ORO ar Please recycle OQ ol 19-17706 i 161019 A AA A",10/14/2019,2019_3832240,Iran (Islamic Republic of),N/A,yes
