year,Council,Committee,Session,Agenda item,Agenda detail,cosponsored countries,body title number,body title detail,body text,date,file,filecountry,footnote,scanned
2021,General Assembly,N/A,Seventy-fifth session,112,Countering the use of information and communications technologies for criminal purposes,United Kingdom of Great Britain and Northern Ireland,N/A,Ad Hoc Committee to Elaborate a Comprehensive International Convention on Countering the Use of Information and Communications Technologies for Criminal Purposes,"Addendum Add the following countries to the list of sponsors of the decision: Australia, Austria, Belgium, Bulgaria, Canada, Chile, Colombia, Croatia, Cyprus, Czechia, Denmark, Dominica, Estonia, Finland, France, Georgia, Germany, Greece, Honduras, Hungary, Iceland, Ireland, Israel, Italy, Japan, Latvia, Liechtenstein, Lithuania, Luxembourg, Malta, Netherlands, New Zealand, Nigeria, Norway, Poland, Portugal, Republic of Korea, Romania, Slovakia, Slovenia, Spain, Sweden, Switzerland, Ukraine and United States of America decide to consider agenda item 112 directly in plenary meeting. 21-00558 ﬁEf 200121 Please recvele 0 0 0 D !",01/15/2021,2021_3898158,Israel,N/A,yes
2021,General Assembly,N/A,Seventy-fifth session,10,Implementation of the Declaration of Commitment on HIV/AIDS and the political declarations on HIV/AIDS,"Albania, Austria, Belgium, Bulgaria, Costa Rica, Croatia, Cyprus, Czechia, Denmark, Estonia, Finland, France, Georgia, Germany, Greece, Hungary, Iceland, Ireland, Israel, Italy, Latvia, Lithuania, Luxembourg, Malta, Netherlands, Norway, Poland, Portugal, Republic of Korea, Romania, Slovakia, Slovenia, Spain, Sweden, United Kingdom of Great Britain and Northern Ireland and United States of America",N/A,Organization of the 2021 high-level meeting on HIV/AIDS,"Replace operative paragraph 11 with the following text: Requests the President of the General Assembly to draw up a list of representatives of other relevant non-governmental organizations, civil society organizations, academic institutions and the private sector who may participate in the high-level meeting, including its panel discussions, taking into account the principles of transparency and equitable geographical representation, with due regard for gender parity, to submit the proposed list to Member States for their consideration on a non-objection basis!® and to bring the list to the attention of the Assembly for a final decision by the Assembly on participation in the high-level meeting; 10 The list will include proposed as well as final names. The general basis of any objections, if requested by one or more States Members of the United Nations or States members of the specialized agencies, will be made known to the Office of the President of the General Assembly and the requester. Please recycle @ 21-02404 iIEi 220221 0 T 1 O T",02/22/2021,2021_3901815,Israel,N/A,yes
2021,General Assembly,N/A,Seventy-fifth session,33,The role of diamonds in fuelling conflict,"Angola, Armenia, Botswana and Russian Federation",N/A,The role of diamonds in fuelling conflict: breaking the link between the illicit transaction of rough diamonds and armed conflict as a contribution to prevention and settlement of conflicts,"Addendum Add the following countries to the list of sponsors of the resolution: Albania, Austria, Belgium, Bulgaria, Canada, Croatia, Cyprus, Czechia, Denmark, Estonia, Finland, France, Germany, Greece, Hungary, India, Ireland, Israel, Italy, Latvia, Lithuania, Luxembourg, Malta, Montenegro, Netherlands, Poland, Portugal, Romania, Singapore, Slovakia, Slovenia, South Africa, Spain, Sri Lanka, Sweden, Switzerland, United Arab Emirates, United Kingdom of Great Britain and Northern Ireland and Zimbabwe ] A Please rccyclc@ E 21-02949 1Ei 050321 0 0 0 T",03/03/2021,2021_3904075,Israel,N/A,yes
2021,Economic And Social Council,Commission On Human Rights,Forty-sixth session,3,"Promotion and protection of all human rights, civil, political, economic, social and cultural rights, including the right to development","Australia,* Austria, Belgium,* Bosnia and Herzegovina,* Bulgaria, Chile,* Croatia,* Cyprus,* Czechia, Denmark, Ecuador,* Estonia,* Fiji, Finland,* France, Germany, Greece,* Ireland,* Israel,* Italy, Latvia,* Liechtenstein,* Lithuania,* Luxembourg,* Maldives,* Malta,* Mexico, Monaco,* Montenegro,* Morocco,* Netherlands, New Zealand,* North Macedonia,* Norway,* Paraguay,* Peru,* Poland, Portugal,* Republic of Korea, Republic of Moldova,* Romania,* Slovakia,* Slovenia,* Spain,* Sweden,* Tunisia,* Ukraine, United Kingdom of Great Britain and Northern Ireland, United States of America* and Uruguay",N/A,"46/... Human rights, democracy and the rule of law","The Human Rights Council, Guided by the purposes and principles of the Charter of the United Nations, Reaffirming the Universal Declaration of Human Rights and the Vienna Declaration and Programme of Action, Reaffirming also the International Covenant on Civil and Political Rights and the International Covenant on Economic, Social and Cultural Rights, and other relevant international human rights instruments, Acknowledging that, by adopting the 2030 Agenda for Sustainable Development, Member States have pledged to leave no one behind in the implementation of the Sustainable Development Goals, including, inter alia, Goal 16, on promoting peaceful and inclusive societies for sustainable development, providing access to justice for all and building effective, accountable and inclusive institutions at all levels, Acknowledging also that human rights, democracy and the rule of law create an environment in which countries can promote development, protect individuals from discrimination and ensure equal access to justice for all by involving Governments, parliaments, the United Nations system and other international organizations, local authorities, national human rights institutions, indigenous peoples, persons belonging to minorities, human rights defenders, civil society, business and the private sector, the scientific and academic communities, as well as all other interested stakeholders, Recalling all previous resolutions on democracy and the rule of law adopted by the General Assembly, the Commission on Human Rights and the Human Rights Council, in particular Council resolutions 19/36 of 23 March 2012, 28/14 of 26 March 2015, 34/41 of 24 March 2017 and 40/9 of 21 March 2019, in which the Council, inter alia, established the GE.21-03247(E) A/HRC/46/L.2 Forum on Human Rights, Democracy and the Rule of Law and decided on the themes of its first three sessions, Recognizing the link between human rights, democracy, the rule of law and good governance, and recalling the Human Rights Council resolutions and all other resolutions relevant to the role of good governance in the promotion of human rights, Convinced that the independence and impartiality of the judiciary, the integrity of the judicial system and an independent legal profession are essential prerequisites for the protection of human rights, the rule of law, good governance and democracy and for ensuring that there is no discrimination in the administration of justice, and should therefore be respected in all circumstances, Recalling the right of every citizen to vote and to be elected at genuine periodic elections, which shall be by universal and equal suffrage and shall be held by secret ballot or by equivalent free-voting procedures, guaranteeing the free expression of the will of the electors, Reaffirming that democracy is based on the freely expressed will of people, including through free and fair elections that are transparent and inclusive, to determine their own political, economic, social and cultural systems and their full participation in all aspects of their lives, Reaffirming also that, while democracies share common features, there is no single model of democracy and that democracy does not belong to any country or region, and reaffirming further the necessity of due respect for sovereignty, territorial integrity and the right to self-determination, Bearing in mind that challenges to democracy arise in all democratic societies, Recognizing that the coronavirus disease (COVID-19) pandemic requires a global and inclusive response, and reaffirming that emergency measures taken by Governments in response to the COVID-19 pandemic must be necessary, proportionate to the evaluated risk and applied in a non-discriminatory way, have a specific focus and duration, and be in accordance with the State’s obligations under applicable international human rights law, Recognizing also the need for all stakeholders to be part of the responses to the COVID-19 pandemic, to have access to timely and accurate information online and offline, to be involved in decisions that affect them, and also the need to facilitate contributions by civil society as well as the private sector to these responses, Acknowledging the fundamental importance of education and training for human rights in consolidating democracy and contributing to the promotion, protection and effective realization of all human rights, Underlining that, while States have the primary responsibility for safeguarding and strengthening democracy and the rule of law, the United Nations has a critical role in providing assistance and coordinating international efforts to support States, on their request, in their democratization processes, Urging States to acknowledge the important contribution of civil society, including human rights defenders, journalists and media workers, to the promotion of human rights, democracy and the rule of law, and to ensure a safe and enabling environment for their work, both online and offline, Recognizing the value of the Forum on Human Rights, Democracy and the Rule of Law for exchange, dialogue, mutual understanding and cooperation on the interrelationship between human rights, democracy and the rule of law, in accordance with the principles and purposes of the Charter, and acknowledging the importance of existing regional formats in the field of human rights, Stressing that human rights, democracy and the rule of law are interdependent and mutually reinforcing, and in this regard recalling the report of the Secretary-General on A/HRC/46/L.2 strengthening and coordinating United Nations rule of law activities,' in which the Secretary- General addressed the ways and means of developing further the linkages between the rule of law and the three main pillars of the United Nations, namely, peace and security, human rights and development, 1. Notes the rescheduling, to November 2021, of the third session of the Forum on Human Rights, Democracy and the Rule of Law with the theme, “Equal access to justice for all: a necessary element of democracy, rule of law and human rights protection”, owing to the restrictions imposed due to the COVID-19 pandemic; 2. Encourages States, with the cooperation of all stakeholders involved in the context of the COVID-19 recovery process, to promote good governance at all levels and to develop effective, accountable and transparent institutions and more responsive, inclusive, participatory and representative decision-making processes while also reaffirming their full commitment to the 2030 Agenda for Sustainable Development as a blueprint for building back better after the pandemic; 3. Decides that the theme of the fourth session of the Forum, to be held in 2022, will be “Strengthening democracies to build back better: challenges and opportunities”; 4. Also decides that participation in the fourth session of the Forum will be in accordance with the modalities set out by the Human Rights Council in its resolutions 28/14, 34/41 and 40/9; 5. Encourages States and all stakeholders to pay particular attention to promoting the broadest possible and most equitable participation in the Forum, with due regard to geographical and gender balance, and considering the participation of youth; 6. Requests the Secretary-General and the United Nations High Commissioner for Human Rights to continue to provide the Forum, at its fourth session, with all the necessary services and facilities, including interpretation in all official languages of the United Nations. 1 A/75/284.",03/11/2021,2021_3904208,Israel,* State not a member of the Human Rights Council.,yes
