year,Council,Committee,Session,Agenda item,Agenda detail,cosponsored countries,body title number,body title detail,body text,date,file,filecountry,footnote,scanned
2012,General Assembly,N/A,Sixty-sixth session,123 (b),Strengthening of the United Nations system: central role of the United Nations system in global governance,"Argentina, Australia, Austria, Bahamas, Barbados, Belgium, Brazil, Bulgaria, Chile, Costa Rica, Croatia, Denmark, Dominican Republic, El Salvador, Finland, Germany, Greece, Guatemala, Honduras, Ireland, Italy, Kenya, Latvia, Liechtenstein, Lithuania, Luxembourg, Malaysia, Malta, Mexico, Montenegro, Morocco, New Zealand, Norway, Panama, Paraguay, Peru, Portugal, Romania, Singapore, Slovakia, Slovenia, Spain, Sweden, Switzerland and Uruguay",N/A,The United Nations in global governance,"The General Assembly, Recalling its resolution 65/94 of 8 December 2010, Reaffirming its respect for the purposes and principles of the Charter of the United Nations, Acknowledging the vital importance of an inclusive, transparent and effective multilateral system in order to better address the urgent global challenges of today, recognizing the universality of the United Nations, and reaffirming its commitment to promote and strengthen the effectiveness and efficiency of the United Nations system, Reaffirming the role and authority of the General Assembly on global matters of concern to the international community, as set out in the Charter, Welcoming the informal thematic debate of the General Assembly, at its sixty- fifth session, on the theme “The United Nations in global governance”, organized by the President of the General Assembly on 28 June 2011, Welcoming also the convening of the regional seminar on the same theme, held at the Economic Commission for Latin America and the Caribbean, in Santiago, on 8 and 9 August 2011, Taking into account the preparatory process of the United Nations Conference on Sustainable Development, to be held in Rio de Janeiro, Brazil, from 20 to 12-25060 Hil 060312 CA AA a 22 June 2012, and the follow-up processes of all major United Nations conferences and summits in the economic, social and related fields, as appropriate, 1. Reiterates the need for inclusive, transparent and effective multilateral approaches to managing global challenges, and in this regard reaffirms the central role of the United Nations in ongoing efforts to find common solutions to such challenges; 2. | Takes note with appreciation of the report of the Secretary-General on global economic governance and development; 3. Recognizes the importance and benefit of a continuing interaction between the General Assembly and international, regional and subregional forums, organizations and groups dealing with global matters of concern to the international community, as appropriate; 4. Decides to include in the provisional agenda of its sixty-seventh session, under the item entitled “Strengthening of the United Nations system”, the sub-item entitled “Central role of the United Nations system in global governance”, and in this regard requests the Secretary-General to submit to the General Assembly, by the end of February 2013, an analytical report focusing on global economic governance and development, with further concrete recommendations to be prepared in consultation with Member States and relevant organizations of the United Nations system, taking into account the United Nations Conference on Sustainable Development and the follow-up processes of all major United Nations conferences and summits in the economic, social and related fields, as appropriate; 5. Invites, in this regard, the President of the General Assembly and the President of the Economic and Social Council to consider organizing, in a coordinated manner, informal thematic debates on the subject of the present resolution; 6. Also invites the United Nations system, including the regional commissions, as well as international financial and trade institutions, civil society, academia, the private sector and other stakeholders, to contribute to these deliberations as appropriate. 1 A/66/506.",03/02/2012,2012_722117,Kenya,N/A,yes
2012,Economic And Social Council,Commission On Human Rights,Nineteenth session,3,"Promotion and protection of all human rights, civil, political, economic, social and cultural rights, including the right to development","Albania , Algeria , Bosnia and Herzegovina , Botswana, Cambodia , Chad , Congo, Costa Rica, Céte d’Ivoire , Croatia , Democratic Republic of the Congo, Dominican Republic, Ecuador, France , Georgia’, Germany’ , Greece , Honduras’ , Hungary, Ireland , Israel, Kenya , Latvia , Liechtenstein , Lithuania , Luxembourg , Maldives, Mauritania, Manritius, Montenegro , Morocco , Nigeria, Palestine , Panama , Paraguay "", Peru, Poland, Portugal , Romania, Serbia*, Slovenia“, Somalia’ , Spain, Sudan’, Switzerland, the former Yugoslav Republic of Macedonia’, Timor-Leste , Tunisia , United Republic of Tanzania , Uruguay, Zimbabwe",N/A,19/... Human rights and the environment,"The Human Rights Council, Reaffirming the purposes and principles of the Charter of the United Nations, Recalling Human Rights Council resolutions relevant to the relationship between human rights and the environment, including resolution 16/11 of 24 March 2011 on human rights and the environment, resolutions 7/23 of 28 March 2008, 10/4 of 25 March 2009 and 18/22 of 30 September 2011 on human rights and climate change, resolutions 9/1 of 24 September 2008 and 12/18 of 2 October 2009 on the adverse effects of the movement and dumping of toxic and dangerous products and wastes on the enjoyment of human rights, and resolution 18/11 of 29 September 2011 on the mandate of the Special Rapporteur on the implications for human rights of the environmentally sound management and disposal of hazardous substances and wastes, as well as relevant Commission on Human Rights resolutions, including resolutions 2003/71 of 25 April 2003 and 2005/60 of 20 April 2005 on human rights and the environment as part of sustainable development, Bearing in mind General Assembly resolution 60/251 of 15 March 2006, Human Rights Council resolution 16/21 of 25 March 2011 and General Assembly resolution 65/28 1 of 17 June 2011, Recalling Human Rights Council resolutions 5/1, on institution-building of the Council, and 5/2, on the code of conduct for special procedures mandate holders of the ” Non-Member State of the Human Rights Council. Please reeyele OO GE. 12-12064 A/HRC/19/L.8 Council, of 18 June 2007, and stressing that the mandate holder shall discharge his or her duties in accordance with those resolutions and the annexes thereto, Recalling also the Universal Declaration of Human Rights, the International Covenant on Economic, Social and Cultural Rights, the International Covenant on Civil and Political Rights, the International Convention on the Elimination of All Forms of Racial Discrimination, the Convention on the Elimination of All Forms of Discrimination against Women and the Convention on the Rights of the Child, Recalling further the Declaration of the United Nations Conference on the Human Environment, the Rio Declaration on Environment and Development, Agenda 21, the Programme for the Further Implementation of Agenda 21, the Johannesburg Declaration on Sustainable Development and the Plan of Implementation of the World Summit on Sustainable Development, Recalling the principles of the Rio Declaration on Environment and Development, Cognizant of the importance of the United Nations Conference on Sustainable Development, to be held in Rio de Janeiro, Brazil, in June 2012, Reaffirming the Millennium Development Goals, in particular Goal 7 on ensuring environmental sustainability, as well as the commitments made by the international community, as contained in the outcome document of the High-level Plenary Meeting of the sixty-fifth session of the General Assembly,' to make every effort to achieve the Millennium Development Goals, Recognizing that human beings are at the centre of concerns for sustainable development, that the right to development must be fulfilled in order to meet the development and environment needs of present and future generations equitably, and that the human person is the central subject of development and should be the active participant and beneficiary of the right to development, Recalling the guiding principles on business and human rights, as endorsed by the Human Rights Council in its resolution 17/4 of 16 June 2011, Mindful that certain aspects of human rights obligations related to the enjoyment of a safe, clean, healthy and sustainable environment require further study and clarification, 1. Welcomes the analytical study on the relationship between human rights and the environment* submitted by the United Nations High Commissioner for Human Rights pursuant to Human Rights Council resolution 16/11; 2. Decides to appoint, for a period of three years, an independent expert on the issue of human rights obligations related to the enjoyment of a safe, clean, healthy and sustainable environment, whose tasks will be: (a) To study, in consultation with Governments, relevant international organizations and intergovernmental bodies, including the United Nations Environment Programme and relevant multilateral environment agreements, human rights mechanisms, local authorities, national human rights institutions, civil society organizations, including those representing indigenous peoples and other persons in vulnerable situations, the private sector and academic institutions, the human rights obligations, including non- discrimination obligations, relating to the enjoyment of a safe, clean, healthy and sustainable environment; ' See resolution 65/1. 2 A/HRC/19/34. A/HRC/19/L.8 (b) — To identify, promote and exchange views on best practices relating to the use of human rights obligations and commitments to inform, support and strengthen environmental policymaking, especially in the area of environmental protection, and, in that regard, to prepare a compendium of best practices; (c) To make recommendations, consistent with her or his mandate, that could help the realization of the Millennium Development Goals, in particular of Goal 7; (d) To take into account the results of the United Nations Conference on Sustainable Development to be held in Rio de Janeiro, Brazil in June 2012, and to contribute, consistent with her or his mandate, to follow-up processes; (e) To apply a gender perspective by, inter alia, considering the particular situation of women and girls and identifying gender-specific discrimination and vulnerabilities; (f) To work in close coordination, while avoiding unnecessary duplication, with other special procedures and subsidiary organs of the Human Rights Council, relevant United Nations bodies and the treaty bodies, taking into account the views of other stakeholders, including relevant regional human rights mechanisms, national human rights institutions, civil society organizations and academic institutions; (g) To submit a first report, including conclusions and recommendations, to the Human Rights Council at its twenty-second session and annually thereafter; 3. Requests the High Commissioner to ensure that the Independent Expert receives the resources necessary to enable him or her to discharge the mandate fully; 4. Calls upon all States, United Nations agencies, other relevant international organizations and non-governmental organizations, the private sector and national human rights institutions to cooperate fully with the independent expert, and invites them to share best practices with the independent expert, and to provide him or her with all the necessary information relating to the mandate to enable him or her to fulfil the mandate; 5. Encourages the Office of the High Commissioner to participate in the United Nations Conference on Sustainable Development, in order to promote a human rights perspective; 6. Decides to continue its consideration of the matter under the same agenda item at its twenty-second session.",03/15/7012,2012_729370,Kenya,N/A,yes
2012,General Assembly,Commission On Human Rights,Nineteenth session,3,"Promotion and protection of all human rights, civil, political, economic, social and cultural rights, including the right to development","Albania , Bosnia and Herzegovina , Bots wana, Cambodia’, Chad’, Congo, Costa Rica, Cote d’lwire , Croatia, Democratic Republic of the Congo , Dominican Republic” , Ecuador, France , Georgia’, Germany ? Greece , Honduras ; Hungary, Ireland , Israel” , Kenya , Latvia , Liechtenstein’, Lithuania , Luxembourg , Maldives, | Mauritania, Matritius, Montenegro , Morocco » Nigeria, Palestine , Panama’ 5 Paraguay , Peru, Poland, Portugal , Romania, Serbia*, Slovenia*, Somalia’, Spain, Sudan , Switzerland, the former Yugoslav Republic of Macedonia’ , Timor-Leste , Tunisia , United Republic of Tanzania , Uruguay, Zimbabwe",N/A,19/... Human rights and the environment,"The Human Rights Council, Reaffirming the purposes and principles of the Charter of the United Nations, Recalling Human Rights Council resolutions relevant to the relationship between human rights and the environment, including resolution 16/11 of 24 March 2011 on human rights and the environment, resolutions 7/23 of 28 March 2008, 10/4 of 25 March 2009 and 18/22 of 30 September 2011 on human rights and climate change, resolutions 9/1 of 24 September 2008 and 12/18 of 2 October 2009 on the adverse effects of the movement and dumping of toxic and dangerous products and wastes on the enjoyment of human rights, and resolution 18/11 of 29 September 2011 on the mandate of the Special Rapporteur on the implications for human rights of the environmentally sound management and disposal of hazardous substances and wastes, as well as relevant Commission on Human Rights resolutions, including resolutions 2003/71 of 25 April 2003 and 2005/60 of 20 April 2005 on human nights and the environment as part of sustainable development, Bearing in mind General Assembly resolution 60/251 of 15 March 2006, Human Rights Council resolution 16/21 of 25 March 2011 and General Assembly resolution 65/281 of 17 June 2011, Recalling Human Rights Council resolutions 5/1, on institution-building of the Council, and 5/2, on the code of conduct for special procedures mandate holders of the Please reeyele OO GE.12-12351 A/HRC/19/L.8/Rev.1 Council, of 18 June 2007, and stressing that the mandate holder shall discharge his or her duties in accordance with those resolutions and the annexes thereto, Recalling also the Universal Declaration of Human Rights, the International Covenant on Economic, Social and Cultural Rights, the International Covenant on Civil and Political Rights, the International Convention on the Elimination of All Forms of Racial Discrimination, the Convention on the Elimination of All Forms of Discrimination against Women and the Convention on the Rights of the Child, Recalling further the Declaration of the United Nations Conference on the Human Environment, the Rio Declaration on Environment and Development, Agenda 21, the Programme for the Further Implementation of Agenda 21, the Johannesburg Declaration on Sustainable Development and the Plan of Implementation of the World Summit on Sustainable Development, Recalling the principles of the Rio Declaration on Environment and Development, Cognizant of the importance of the United Nations Conference on Sustainable Development, to be held in Rio de Janeiro, Brazil, in June 2012, Reaffirming the Millennium Development Goals, in particular Goal 7 on ensuring environmental sustainability, as well as the commitments made by the international community, as contained in the outcome document of the High-level Plenary Meeting of the sixty-fifth session of the General Assembly,' to make every effort to achieve the Millennium Development Goals, Recognizing that human beings are at the centre of concerns for sustainable development, that the right to development must be fulfilled in order to meet the development and environment needs of present and future generations equitably, and that the human person is the central subject of development and should be the active participant and beneficiary of the nght to development, Recalling the guiding principles on business and human rights, as endorsed by the Human Rights Council in its resolution 17/4 of 16 June 2011, Mindful that certain aspects of human rights obligations related to the enjoyment of a safe, clean, healthy and sustainable environment require further study and clarification, 1. Notes with appreciation the analytical study on the relationship between human rights and the environment? submitted by the United Nations High Commissioner for Human Rights pursuant to Human Rights Council resolution 16/11; 2. Decides to appoint, for a period of three years, an independent expert on the issue of human rights obligations related to the enjoyment of a safe, clean, healthy and sustainable environment, whose tasks will be: (a) To study, in consultation with Governments, relevant international organizations and intergovernmental bodies, including the United Nations Environment Programme and relevant multilateral environment agreements, human rights mechanisms, local authorities, national human rights institutions, civil society organizations, including those representing indigenous peoples and other persons in vulnerable situations, the private sector and academic institutions, the human rights obligations, including non- discrimination obligations, relating to the enjoyment of a safe, clean, healthy and sustainable environment; ' See resolution 65/1. 2 A/HRC/19/34. A/HRC/19/L.8/Rev.1 (b) _ To identify, promote and exchange views on best practices relating to the use of human rights obligations and commitments to inform, support and strengthen environmental policymaking, especially in the area of environmental protection, and, in that regard, to prepare a compendium of best practices; (c) To make recommendations, consistent with her or his mandate, that could help the realization of the Millennium Development Goals, in particular of Goal 7; (d) To take into account the results of the United Nations Conference on Sustainable Development to be held in Rio de Janeiro, Brazil in June 2012, and to contribute a human rights perspective to follow-up processes; (e) To apply a gender perspective by, inter alia, considering the particular situation of women and girls and identifying gender-specific discrimination and vulnerabilities; (f) To work in close coordination, while avoiding unnecessary duplication, with other special procedures and subsidiary organs of the Human Rights Council, relevant United Nations bodies and the treaty bodies, taking into account the views of other stakeholders, including relevant regional human rights mechanisms, national human rights institutions, civil society organizations and academic institutions; (g) To submit a first report, including conclusions and recommendations, to the Human Rights Council at its twenty-second session and annually thereafter; 3. Requests the High Commissioner to ensure that the Independent Expert receives the resources necessary to enable himor her to discharge the mandate fully; 4. Calls upon all States, United Nations agencies, other relevant international organizations and non-governmental organizations, the private sector and national human rights institutions to cooperate fully with the independent expert, and invites themto share best practices with the independent expert, and to provide him or her with all the necessary information relating to the mandate to enable him or her to fulfil the mandate; 5. Encourages the Office of the High Commissioner to participate in the United Nations Conference on Sustainable Development, in order to promote a human rights perspective; 6. Decides to continue its consideration of the matter under the same agenda item at its twenty-second session.",03/20/2012,2012_729373,Kenya,* Non-Member State of the Human Rights Council.,yes
