year,Council,Committee,Session,Agenda item,Agenda detail,cosponsored countries,body title number,body title detail,body text,date,file,filecountry,footnote,scanned
2002,General Assembly,N/A,Fifty-sixth session,22,Final review and appraisal of the implementation of the United Nations New Agenda for the Development of Africa in the 1990s,United Republic of Tanzania,N/A,Final review and appraisal of the United Nations New Agenda for the Development of Africa in the 1990s,"Addendum Add the following countries to the list of sponsors of the resolution: Algeria, Angola, Austria, Azerbaijan, Bangladesh, Belgium, Benin, Botswana, Burkina Faso, Burundi, Cameroon, Canada, Cape Verde, Central African Republic, Chad, China, Congo, Cote d’Ivoire, Cuba, Czech Republic, Denmark, Djibouti, Egypt, Equatorial Guinea, Eritrea, Ethiopia, Fiji, Finland, France, Gabon, Germany, Ghana, Greece, Grenada, Guyana, Haiti, Ireland, Italy, Japan, Kenya, Lesotho, Libyan Arab Jamahiriya, Luxembourg, Madagascar, Mali, Mauritania, Mauritius, Mongolia, Morocco, Mozambique, Namibia, Netherlands, Niger, Nigeria, Norway, Pakistan, Philippines, Portugal, Republic of Korea, Senegal, Sierra Leone, Singapore, South Africa, Spain, Sri Lanka, Sudan, Swaziland, Sweden, Togo, Tunisia, Uganda, United Kingdom of Great Britain and Northern Ireland, Uruguay, Zambia and Zimbabwe",03/01/2002,2002_455320,Kenya,* Reissued for technical reasons.,yes
2002,Economic And Social Council,Commission On Human Rights,Fifty-eighth session,10,"ECONOMIC, SOCIAL AND CULTURAL RIGHTS","Albania*, Belgium, Bulgaria*, Cameroon, Denmark*, Ecuador, Finland*, France, Georgia*, Germany, Guatemala, Ireland*, Italy, Kenya, Luxembourg*, Mexico, Netherlands*, Nicaragua*, Poland, Portugal, Romania*, Senegal, Slovenia*, South Africa, Spain, Switzerland*, The former Yugoslav Republic of Macedonia*, Tunisia*",2002,Adequate housing as a component of the right to an adequate standard of living,"The Commission on Human Rights, Recalling its resolution 2000/9 of 17 April 2000, in which it decided to appoint, for a period of three years, a special rapporteur whose mandate would focus on adequate housing as a component of the right to an adequate standard of living, and resolution 2001/28 of 20 April 2001 on adequate housing as a component of the right to an adequate standard of living, as well as resolution 2001/34 of 23 April 2001 on women’s equal ownership of, access to and control over land and the equal rights to own property and to adequate housing, Noting the work of the United Nations treaty bodies, in particular of the Committee on Economic, Social and Cultural Rights, in the promotion of the rights related to adequate housing, 2002/... Concerned that any deterioration in the general housing situation disproportionately affects the poor, as well as women and children, and members of groups requiring special protection, 1. 1. Takes note of the report of the Special Rapporteur on adequate housing as a component of the right to an adequate standard of living (E/CN.4/2002/59 and Corr.1) and of relevant parts of the report of the Secretary-General on economic, social and cultural rights (E/CN.4/2002/50); 2. Welcomes the participation of the Special Rapporteur in the Third United Nations Conference on the Least Developed Countries, held in May 2001, in the five-year review of the Habitat Agenda, held in June 2001, in the World Conference against Racism, Racial Discrimination, Xenophobia and Related Intolerance, held in September 2001, and in the preparatory process for the International Conference on Financing for Development, held in March 2002, and in this connection encourages the Special Rapporteur, in accordance with his mandate, to bring the issue of adequate housing to the attention of relevant review processes of United Nations conferences and summits, such as the World Summit on Sustainable Development, to be held in September 2002, and the special session of the General Assembly on children, to be held in June 2002, including, where possible, through contributing to and participating in these events; 3. Encourages the Special Rapporteur to strengthen the integration of the rights relevant to his mandate into the Global Campaign for Secure Tenure launched by the United Nations Human Settlements Programme and into other operational activities of the United Nations system, notably into processes and initiatives that are oriented towards poverty reduction, and to develop to this effect a dialogue with Governments, relevant United Nations bodies, in particular the Programme and the Office of the United Nations High Commissioner for Refugees, specialized agencies, international organizations, non-governmental organizations and international financial institutions; 4. Also encourages the Special Rapporteur to cooperate, in accordance with his mandate, with other rapporteurs, representatives, experts, notably the independent expert on the question of human rights and extreme poverty, members and chairpersons of working groups of the Commission and United Nations bodies, including human rights treaty bodies; 5. Requests the Special Rapporteur, in the fulfilment of his mandate: (a) To give particular emphasis to practical solutions with regard to the implementation of the rights relevant to his mandate, on the basis of pertinent information, notably on best practices, including on domestic legal enforcement of these rights, from Governments, relevant United Nations agencies and non-governmental organizations; (b) To facilitate the provision of technical assistance; 6. Also requests the Special Rapporteur, within the limits of his mandate, further to review the interrelatedness of adequate housing as a component of the right to an adequate standard of living with other human rights; 7. Further requests the Special Rapporteur to report to the Commission at its (b) fifty-ninth session; 8. Requests the United Nations High Commissioner for Human Rights to support cooperation between the Special Rapporteur and other rapporteurs, representatives, experts, members and chairpersons of working groups of the Commission and United Nations bodies, including human rights treaty bodies, that are relevant to the mandate of the Special Rapporteur; 9. Requests the Office of the United Nations High Commissioner for Human Rights and the United Nations Human Settlements Programme to strengthen their cooperation and to continue to develop a joint housing rights programme; 10. Calls upon all States: (a) To give full effect to housing rights, including through domestic development policies at the appropriate level of government and with international assistance and cooperation, giving particular attention to the individuals, most often women and children, and communities living in extreme poverty, and to security of tenure; (b) To ensure the observance of all their legally binding national standards in the area of housing; (c) To cooperate with the Special Rapporteur; (d) To submit to the Special Rapporteur information on different experiences, notably on best practices, in areas related to his mandate; 10. (e) Without distinction of any kind, such as to race, colour, sex, language, religion, political or other opinion, national or social origin, property, birth or other status: (1) To counter social exclusion and marginalization of people who suffer from discrimination on multiple grounds, in particular by ensuring non-discriminatory access to adequate housing for indigenous people and persons belonging to minorities; (i) To promote participation in decision-making processes, in particular at the local level, when developing an adequate standard of living and housing; 11. Invites the United Nations Human Settlements Programme and the Office of the High Commissioner further to explore possibilities to support the Special Rapporteur; 12. Requests the Secretary-General to provide the Special Rapporteur with the assistance necessary for the execution of his mandate. (i) 11. 12.",04/12/2002,2002_462279,Kenya,"* In accordance with rule 69, paragraph 3, of the rules of procedure of the functional commissions of the Economic and Social Council.",yes
2002,Economic And Social Council,Commission On Human Rights,Fifty-eighth session,10,"ECONOMIC, SOCIAL AND CULTURAL RIGHTS","Algeria, Bangladesh*, Belarus*, Bhutan*, Botswana*, Burundi, Cameroon, China, Congo*, Cote d’Ivoire*, Cuba, Democratic People’s Republic of Korea*, Democratic Republic of the Congo, Dominican Republic*, Ecuador, Egypt®, El Salvador*, Equatorial Guinea*, Eritrea*, Ethiopia*, Ghana*, Haiti*, India, Indonesia, Iran (Islamic Republic of)*, Iraq*, Kenya, Lao People’s Democratic Republic*, Libyan Arab Jamahiriya, Madagascar*, Malaysia, Mauritania*, Mexico, Mongolia*, Mozambique*, Nepal*, Niger*, Pakistan, Philippines*, Rwanda*, Sierra Leone, South Africa, Sri Lanka*, Sudan, Swaziland, Syrian Arab Republic, Thailand, Togo, Tunisia*, Turkey*, United Republic of Tanzania*, Venezuela, Viet Nam, Yemen*, Zambia, Zimbabwe*",2002,The right to food,"The Commission on Human Rights, Recalling the Universal Declaration of Human Rights, which provides that everyone has the right to a standard of living adequate for her/his health and well-being, including food, Recalling also the provisions of the International Covenant on Economic, Social and Cultural Rights in which the fundamental right of every person to be free from hunger is recognized, Recalling further the Universal Declaration on the Eradication of Hunger and Malnutrition, Bearing in mind the Rome Declaration on World Food Security and the Plan of Action of the World Food Summit, held in Rome from 13 to 17 November 1996, Recalling all its previous resolutions in this regard, in particular resolution 2001/25 of 20 April 2001, as well as General Assembly resolution 56/155 of 19 December 2001, Reaffirming that all human rights are universal, indivisible and interdependent and interrelated, Recognizing that the problem of hunger and food insecurity has global dimensions and that they are likely to persist and even to increase dramatically in some regions, unless urgent, determined and concerted action is taken, given the anticipated increase in the world’s population and the strain on natural resources, Reaffirming that a peaceful, stable and enabling political, social and economic environment, both at a national and an international level, is the essential foundation which will enable States to give adequate priority to food security and poverty eradication, Reiterating, as did the Rome Declaration, that food should not be used as an instrument of political or economic pressure, and reaffirming in this regard the importance of international cooperation and solidarity, as well as the necessity of refraining from unilateral measures not in accordance with international law and the Charter of the United Nations which endanger food security, Convinced that each State must adopt a strategy consistent with its resources and capacities to achieve its individual goals in implementing the recommendations contained in the Rome Declaration and Plan of Action of the World Summit and, at the same time, cooperate regionally and internationally in order to organize collective solutions to global issues of food security in a world of increasingly interlinked institutions, societies and economies, where coordinated efforts and shared responsibilities are essential, Stressing the importance of reversing the continuing decline of official development assistance devoted to agriculture, both in real terms and as a share of total official development assistance, 1. 1. Reaffirms that hunger constitutes an outrage and a violation of human dignity and, therefore, requires the adoption of urgent measures at the national, regional and international levels for its elimination,; 2. Also reaffirms the right of everyone to have access to safe and nutritious food, consistent with the right to adequate food and the fundamental right of everyone to be free from hunger so as to be able fully to develop and maintain their physical and mental capacities; 3. Considers it intolerable that there are around 815 million undernourished people in the world and that every year 36 million people die, directly or indirectly, as a result of hunger and nutritional deficiencies, most of them women and children, particularly in developing countries, in a world that already produces enough food to feed the whole global population; 4. Stresses the need to make efforts to mobilize and optimize the allocation and utilization of technical and financial resources from all sources, including external debt relief for developing countries, to reinforce national actions to implement sustainable food security policies; 5. Invites all international financial and developmental institutions, as well as the 5. Invites all international financial and developmental institutions, as well as the relevant United Nations agencies and funds, to give priority to and provide necessary funding for the eradication of hunger and food insecurity, as well as the realization of the right to food; 6. Encourages all States to take steps with a view to achieving progressively the full realization of the right to food, including steps to promote the conditions for everyone to be free from hunger and as soon as possible enjoy fully the right to food, as well as to elaborate and adopt national plans to combat hunger; 7. Recalls The State of the World’s Children 2001 report on early childhood of the United Nations Children’s Fund and, in this context, that the nurturing of young children merits the highest priority; 8. Takes note with appreciation of the report of the Special Rapporteur on the right to food (E/CN.4/2002/58 and Add.1), and commends the Special Rapporteur for his valuable work in promoting the right to food; 9. Reiterates the request to the Special Rapporteur to contribute effectively to the medium-term review of the implementation of the Rome Declaration on World Food Security and the Plan of Action of the World Food Summit, to be held in Rome from 10 to 13 June 2002, by submitting to the United Nations High Commissioner for Human Rights his recommendations on all aspects of the right to food, and to attend this event in order to contribute fully to the proceedings in the light of his mandate; 10. Welcomes the three expert consultations on the right to food convened by the High Commissioner and her personal commitment to the promotion and realization of the right to food and, in this context, requests the High Commissioner to submit to the forthcoming World Food Summit a comprehensive report, building on the work already done by the Special Rapporteur of the Commission and the outcome of the three expert consultations convened by her Office in relation with this matter; 11. Encourages the Special Rapporteur to mainstream a gender perspective in the fulfilment of his mandate; 12. Requests the High Commissioner to provide all necessary human and financial resources for the effective fulfilment of the mandate of the Special Rapporteur; 13. Welcomes the work already done by the Committee on Economic, Social and Cultural Rights in promoting the right to adequate food, in particular its General Comment No. 12 (1999) on the right to adequate food (art. 11 of the International Covenant on Economic, Social and Cultural Rights), in which the Committee affirmed, inter alia, that the right to adequate food is indivisibly linked to the inherent dignity of the human person and is indispensable for the fulfilment of other human rights enshrined in the International Bill of Human Rights and is also inseparable from social justice, requiring the adoption of appropriate economic, environmental and social policies, at both the national and international levels, oriented to the eradication of poverty and the fulfilment of all human rights for all; 14. Requests the Special Rapporteur to submit a report to the General Assembly at its fifty-seventh session and to report to the Commission at its fifty-eighth session on the implementation of the present resolution; 15. Invites Governments, relevant United Nations agencies, funds and programmes, treaty bodies, as well as non-governmental organizations to cooperate fully with the Special Rapporteur in the fulfilment of his mandate, inter alia through the submission of comments and suggestions on ways and means of realizing the right to food. 10. 12. 13. 14. 15.",04/12/2002,2002_462359,Kenya,"* In accordance with rule 69, paragraph 3, of the rules of procedure of the functional commissions of the Economic and Social Council.",yes
