year,Council,Committee,Session,Agenda item,Agenda detail,cosponsored countries,body title number,body title detail,body text,date,file,filecountry,footnote,scanned
2020,General Assembly,N/A,Seventy-fourth session,123,Strengthening of the United Nations system,"Andorra, Angola, Antigua and Barbuda, Argentina, Armenia, Azerbaijan, Barbados, Belize, Bosnia and Herzegovina, Canada, Central African Republic, Costa Rica, Céte d’Ivoire, Djibouti, Dominican Republic, Ecuador, El] Salvador, Equatorial Guinea, Fiji, Gambia, Georgia, Ghana, Grenada, Guatemala, Guyana, Honduras, Iraq, Jamaica, Jordan, Kazakhstan, Kenya, Lebanon, Lesotho, Libya, Liechtenstein, Madagascar, Malawi, Maldives, Mauritius, Mexico, Micronesia (Federated States of), Morocco, Namibia, Nepal, Niger, Nigeria, Norway, Palau, Panama, Papua New Guinea, Paraguay, Peru, Republic of Korea, Rwanda, Saint Lucia, Saint Vincent and the Grenadines, Samoa, Senegal, Seychelles, Singapore, Sri Lanka, Sudan, Suriname, Tajikistan, Thailand, Timor-Leste, Trinidad and Tobago, Turkey, Turkmenistan, Ukraine, United Republic of Tanzania, Uruguay, Vanuatu, Viet Nam and Zimbabwe",N/A,"International cooperation to ensure global access to medicines, vaccines and medical equipment to face COVID-19","The General Assembly, Recalling its resolutions 74/270 of 2 April 2020 and 74/2 of 10 October 2019, Noting with concern the threat to human health, safety and well-being caused by the coronavirus disease 2019 (COVID-19) pandemic, which has spread all around the globe, as well as the unprecedented and multifaceted effects of the pandemic, including the severe disruption to societies, economies, global trade and travel and the devastating impact on the livelihoods of people, Recognizing the competence, generosity and personal sacrifice of health-care professionals and services in the exercise of their duties to contain the spread of the pandemic, Reaffirming the right of every human being, without distinction of any kind, to the enjoyment of the highest attainable standard of physical and mental health, Recognizing that the poor and the most vulnerable people are the most affected and that the impact of the pandemic will have repercussions on development gains, ae Please recycle OQ ee: 20-05435 ili 130420 CATA A AAA A A/7TA/L.56 hampering progress in the achievement of the Sustainable Development Goals, including target 3.8,! Underscoring that equitable access to health products is a global priority and that the availability, accessibility, acceptability and affordability of health products of assured quality are fundamental to tackling the pandemic, Recognizing the importance of international cooperation and effective multilateralism in helping to ensure that all States have in place effective national protective measures, access to and flow of vital medical supplies, medicines and vaccines, in order to minimize negative effects in all affected States and to avoid relapses of the pandemic, Recognizing also that the COVID-19 global pandemic requires a global response based on unity, solidarity and multilateral cooperation, 1. Reaffirms the fundamental role of the United Nations system in coordinating the global response to control and contain the spread of the coronavirus disease (COVID-19) and in supporting Member States, and in this regard acknowledges the crucial leading role played by the World Health Organization; 2. Requests the Secretary-General, in close collaboration with the World Health Organization and other relevant agencies of the United Nations system, including the international financial institutions, to identify and recommend options, including approaches to rapidly scaling manufacturing and strengthening supply chains that promote and ensure fair, transparent, equitable, efficient and timely access to and distribution of preventive tools, laboratory testing, reagents and supporting materials, essential medical supplies, new diagnostics, drugs and future COVID-19 vaccines, with a view to making them available to all those in need, in particular in developing countries; 3. Encourages Member States to work in partnership with all relevant stakeholders to increase research and development funding for vaccines and medicines, leverage digital technologies, and strengthen scientific international cooperation necessary to combat COVID-19 and to bolster coordination, including with the private sector, towards rapid development, manufacturing and distribution of diagnostics, antiviral medicines, personal protective equipment and vaccines, adhering to the objectives of efficacy, safety, equity, accessibility, and affordability; 4. — Calls upon Member States and other relevant stakeholders to immediately take steps to prevent, within their respective legal frameworks, speculation and undue stockpiling that may hinder access to safe, effective and affordable essential medicines, vaccines, personal protective equipment and medical equipment as may be required to effectively address COVID-19; 5. Requests the Secretary-General, in close collaboration with the World Health Organization, to take the necessary steps to effectively coordinate and follow up on the efforts of the United Nations system to promote and ensure global access to medicines, vaccines and medical equipment needed to face COVID-19, and, in this regard, to consider establishing, within existing resources, an inter-agency task force, and to brief the General Assembly on such efforts, as appropriate. ! See resolution 70/1. 2/2",04/08/2020,2020_3856748,Kenya,N/A,yes
2020,General Assembly,N/A,Seventy-fourth session,123,Strengthening of the United Nations system,"Angola, Bahrain, Bangladesh, Brunei Darussalam, Canada, Comoros, Djibouti, Ecuador, Egypt, Equatorial Guinea, Eritrea, Gambia, Ghana, Indonesia, Iraq, Jordan, Kenya, Kuwait, Lebanon, Libya, Malaysia, Morocco, Nigeria, Oman, Palau, Saudi Arabia, Seychelles, Singapore, Sri Lanka, Sudan, Thailand, Tunisia, Uganda, United Arab Emirates, Uzbekistan and Yemen",N/A,United response against global health threats: combating COVID-19,"The General Assembly, Expressing grave concern and deep sadness at the global crisis triggered by the novel disease COVID-19 pandemic and its unprecedented negative health, economic and social impacts on the international community, Acknowledging that the unprecedented COVID-19 pandemic is a powerful reminder of our interconnectedness and vulnerabilities, as the virus respects no borders, and that combating this pandemic calls for an open, transparent, robust, coordinated, large-scale, science-based and inclusive global response in the spirit of solidarity, Noting the importance of utilizing all available policy tools to safeguard the global economy, financial markets, trade and global supply chains in order to minimize the economic damage from the pandemic, restore global growth and maintain market stability, Recognizing the essential role of the United Nations as the body that can effectively bring together a global response to control and contain the spread of COVID-19 and address the critical interlinkages between health, trade, finance and economic and social development, and acknowledging that the disease will negatively impact endeavours aimed at achieving the Sustainable Development Goals by 2030, Recognizing also the great effort undertaken by people around the world to follow the measures recommended by the World Health Organization and national authorities in order to control and fight the spread of the pandemic, Expressing deep concern about the serious risks posed to all countries, in particular developing and least developed countries, and notably African countries and small island developing States, where health systems and economies may be less Oe ar Please recycle OO ol 20-05609 il 160420 AY A AA A A A/7A/L.57 able to cope with the challenge, as well as the particular risk faced by refugees and displaced persons, Commending the United Nations for its recommitment to the timely implementation of the 2030 Agenda for Sustainable Development ! and its determination to lead a recovery that is inclusive and sustainable, Emphasizing the urgent need for initiatives, on a voluntary basis, that focus on preventing threats from emerging pandemics and on building an effective global defence against outbreaks of deadly infectious diseases should such threats emerge, Welcoming the initiative taken by the Secretary-General, noting the initiatives by the International Monetary Fund and the World Bank Group, and acknowledging the role of the World Health Organization, Recalling the high-level meeting on universal health coverage, held in New York on 23 September 2019, and reaffirming its political declaration, entitled “Universal health coverage: moving together to build a healthier world”? as a means of strengthening health systems, and recalling also its resolution 74/270 of 2 April 2020, entitled “Global solidarity to fight the coronavirus disease 2019 (COVID-19)”, Expressing profound gratitude to all front-line health-care workers as the fight against the pandemic continues, and emphasizing the importance of providing them with the necessary protection and support, Welcoming the outcomes of the virtual Extraordinary Summit of the Group of 20, chaired by the Kingdom of Saudi Arabia, President of the Group for 2020, on 26 March 2020, and the call therein for effective and coordinated action to fight this global health crisis, 1. Calls for intensified international cooperation and multilateral efforts in handling disease outbreaks, including by sharing timely, accurate and transparent information, exchanging epidemiological and clinical data, sharing materials necessary for research and development, and implementing the International Health Regulations (IHR 2005)? and relevant guidance; 2. Emphasizes the need for the United Nations system, as well as relevant regional and international organizations and financial institutions, to collaborate in order to ensure that the adverse social, economic, humanitarian and financial impacts of COVID-19 are addressed in a timely and non-discriminatory manner; 3. Also emphasizes the need for full respect for human rights, and stresses further that there is no place for any form of discrimination, racism and xenophobia in the response to the pandemic; 4. Stresses the necessity of urgent short-term actions to step up the global efforts to fight global health crises and pandemics and maintain economic stability, including by taking the following steps: (a) Swift delivery of medical supplies, especially diagnostic tools, treatments, medicines and vaccines; (b) Increasing research and development funding for vaccines and medicines, leveraging digital technologies and strengthening scientific international cooperation; ' Resolution 70/1. ? Resolution 74/2. 3 World Health Organization, document WHA58/2005/REC/1, resolution 58.3, annex. 2/3 (c) Expanding manufacturing capacity to meet the increasing needs for medical supplies and ensuring that these are made widely available, at an affordable price, on an equitable basis, where they are most needed and as quickly as possible; (d) Engaging with the front-line international organizations, notably the United Nations, the World Health Organization, the International Monetary Fund, the World Bank Group and multilateral and regional development banks, to deploy robust, coherent, coordinated and rapid financial packages to strengthen global financial safety nets; 5. Reaffirms the necessity to support economies, protect workers, businesses, especially micro-, small and medium-sized enterprises, and the sectors most affected, and shield the vulnerable through adequate social protection, and in this context welcomes the statement by the leaders of the Group of 20 on injecting 5 trillion United States dollars into the global economy, as part of targeted fiscal policy, economic measures and guarantee schemes to counteract the social, economic and financial impacts of the pandemic; 6. Calls upon the international community, regional and international organizations and relevant stakeholders to give high priority to people, particularly the elderly, women and girls, displaced persons and refugees and persons with disabilities, and areas that are most vulnerable, particularly developing and least developed countries, in order to mitigate any drawback towards achieving the Sustainable Development Goals, and highlights the need to address risks of debt vulnerabilities in developing countries, including least developed countries, landlocked developing countries, small island developing States and African countries, as well as middle-income countries, due to the pandemic; 7. Calls upon Member States to enhance coordination on public health and financial measures as well as cooperation at the national, regional and international levels to confront and combat this pandemic; 8. Stresses the need to give appropriate consideration to the issue of halting and reversing the global threats posed by epidemics through the implementation of the 2030 Agenda for Sustainable Development;! 9. Urges Member States, in conjunction with the United Nations, the World Health Organization, the International Monetary Fund, the World Bank Group and other regional and international organizations, working within their existing mandates, to embark on sustainable pandemic preparedness, response and recovery planning, taking into account strengthening the capacity of health sector institutions in developing countries; 10. Requests the Secretary-General to mobilize the United Nations system in support of global action towards sustainable recovery, including through the work of the United Nations resident coordinators and United Nations country teams, especially in the most vulnerable countries; 11. Decides to remain seized of the matter, and requests the Secretary-General to coordinate and follow up on the various relevant initiatives and to report to the General Assembly on the implementation of the present resolution in a timely manner. 20-05609 3/3",04/14/2020,2020_3856786,Kenya,N/A,yes
2020,General Assembly,N/A,Seventy-fourth session,64 (b),New Partnership for Africa’s Development: progress in implementation and international support: causes of conflict and the promotion of durable peace and sustainable development in Africa,"Argentina, Gambia, Norway, Qatar and Rwanda",N/A,International Day of Reflection on the 1994 Genocide against the Tutsi in Rwanda,"Addendum Add the following countries to the list of sponsors of the resolution: Algeria, Angola, Armenia, Benin, Botswana, Burkina Faso, Canada, Chad, Chile, Colombia, Comoros, Costa Rica, Djibouti, Egypt, Equatorial Guinea, Eritrea, Eswatini, Ethiopia, Georgia, Guinea, Guinea-Bissau, Guyana, Hungary, Ireland, Israel, Kenya, Liberia, Mauritius, Morocco, Namibia, Niger, Nigeria, Saint Vincent and the Grenadines, Sao Tome and Principe, Senegal, Sierra Leone, Somalia, Sudan, Syrian Arab Republic, Tunisia, Turkey, Uganda, Ukraine and United Republic of Tanzania Hy Please recycle OO ol 20-05878 ii 230420 AUN A AA A",04/20/2020,2020_3858639,Kenya,N/A,yes
2020,General Assembly,N/A,Seventy-fourth session,117,Follow-up to the outcome of the Millennium Summit,"Argentina, Armenia, Austria, Canada, Costa Rica, Croatia, France, Ireland, Italy, Jordan, Kyrgyzstan, Luxembourg, Malta, Netherlands, Peru, Poland, Portugal, Qatar, Romania, San Marino, Spain, Turkey, Ukraine and Uruguay",N/A,International Day to Protect Education from Attack,"Addendum Add the following countries to the list of sponsors of the resolution: Andorra, Antigua and Barbuda, Belgium, Bosnia and Herzegovina, Bulgaria, Burkina Faso, Cote d’Ivoire, Czechia, Denmark, Djibouti, Ecuador, El Salvador, Estonia, Finland, Georgia, Germany, Greece, Kenya, Latvia, Lebanon, Madagascar, Mexico, Monaco, Montenegro, Morocco, Nigeria, Norway, Palau, Rwanda, Serbia, Slovakia, Slovenia, Somalia, Sweden, Turkmenistan and Zambia Please recycle eS = 20-07171 iit 020620 AUN A AA A",05/28/2020,2020_3863524,Kenya,N/A,yes
