year,Council,Committee,Session,Agenda item,Agenda detail,cosponsored countries,body title number,body title detail,body text,date,file,filecountry,footnote,scanned
2008,General Assembly,Second Committee,Sixty-third session,38,Permanent sovereignty of the Palestinian people,"Algeria, Bahrain, Brunei Darussalam, Comoros, Cuba, Djibouti, Egypt, Indonesia, Iraq, Jordan, Kuwait, Lebanon, Libyan Arab Jamahiriya, Malaysia, Mauritania, Morocco, Namibia, Nicaragua, Oman, Qatar, Saudi Arabia, Senegal, Somalia, South Africa, Sudan, Tunisia, United Arab Emirates, Venezuela (Bolivarian Republic of), Yemen and Palestine:*",N/A,"Permanent sovereignty of the Palestinian people in the Occupied Palestinian Territory, including East Jerusalem, and of the","Arab population in the occupied Syrian Golan over their natural resources The General Assembly, Recalling its resolution 62/181 of 19 December 2007, and taking note of Economic and Social Council resolution 2008/31 of 25 July 2008, Recalling also its resolutions 59/251 of 22 December 2004 and 58/292 of 6 May 2004, Reaffirming the principle of the permanent sovereignty of peoples under foreign occupation over their natural resources, Guided by the principles of the Charter of the United Nations, affirming the inadmissibility of the acquisition of territory by force, and recalling relevant Security Council resolutions, including resolutions 242 (1967) of 22 November 1967, 465 (1980) of 1 March 1980 and 497 (1981) of 17 December 1981, Recalling its resolution 2625 (XXV) of 24 October 1970, 08-56492 nil 241008 AR A A A Reaffirming the applicability of the Geneva Convention relative to the Protection of Civilian Persons in Time of War, of 12 August 1949,! to the Occupied Palestinian Territory, including East Jerusalem, and other Arab territories occupied by Israel since 1967, Recalling, in this regard, the International Covenant on Civil and Political Rights? and the International Covenant on Economic, Social and Cultural Rights,” and affirming that these human rights instruments must be respected in the Occupied Palestinian Territory, including East Jerusalem, as well as in the occupied Syrian Golan, Recalling also the advisory opinion rendered on 9 July 2004 by the International Court of Justice on the Legal Consequences of the Construction of a Wall in the Occupied Palestinian Territory,? and recalling further its resolutions ES-10/15 of 20 July 2004 and ES-10/17 of 15 December 2006, Expressing its concern at the exploitation by Israel, the occupying Power, of the natural resources of the Occupied Palestinian Territory, including East Jerusalem, and other Arab territories occupied by Israel since 1967, Expressing its grave concern at the extensive destruction by Israel, the occupying Power, of agricultural land and orchards in the Occupied Palestinian Territory, including the uprooting of a vast number of fruit-bearing trees, Expressing its concern at the widespread destruction caused by Israel, the occupying Power, to vital infrastructure, including water pipelines and sewage networks, in the Occupied Palestinian Territory, which, inter alia, pollutes the environment and negatively affects the natural resources of the Palestinian people, Aware of the detrimental impact of the Israeli settlements on Palestinian and other Arab natural resources, especially as a result of the confiscation of land and the forced diversion of water resources, and of the dire socio-economic consequences in this regard, Aware also of the detrimental impact on Palestinian natural resources being caused by the unlawful construction of the wall by Israel, the occupying Power, in the Occupied Palestinian Territory, including in and around East Jerusalem, and of its grave effect as well on the economic and social conditions of the Palestinian people, Reaffirming the need for the advancement of negotiations within the Middle East peace process, on the basis of Security Council resolutions 242 (1967), 338 (1973) of 22 October 1973, 425 (1978) of 19 March 1978 and 1397 (2002) of 12 March 2002, the principle of land for peace, the Arab Peace Initiative,+ and the Quartet performance-based road map to a permanent two-State solution to the Israeli-Palestinian conflict,5 as endorsed by the Security Council in its resolution 1515 (2003) of 19 November 2003, for the achievement of a final settlement on all tracks, 4 A/56/1026-S/2002/932, annex II, resolution 14/221. 5 See S/2003/529, annex. A/C.2/63/L.5 Noting the Israeli withdrawal from within the Gaza Strip and parts of the northern West Bank and the importance of the dismantlement of settlements therein as a step towards the implementation of the road map, Stressing the need for respect and preservation of the territorial unity, contiguity and integrity of all of the Occupied Palestinian Territory, including East Jerusalem, Recalling the need to end all acts of violence, including acts of terror, provocation, incitement and destruction, Taking note with appreciation of the note by the Secretary-General transmitting the report prepared by the Economic and Social Commission for Western Asia on the economic and social repercussions of the Israeli occupation on the living conditions of the Palestinian people in the Occupied Palestinian Territory, including East Jerusalem, and of the Arab population in the occupied Syrian Golan, ® 1. Reaffirms the inalienable rights of the Palestinian people and the population of the occupied Syrian Golan over their natural resources, including land and water; 2. Calls upon Israel, the occupying Power, not to exploit, damage, cause loss or depletion of, or endanger the natural resources in the Occupied Palestinian Territory, including East Jerusalem, and in the occupied Syrian Golan; 3. Recognizes the right of the Palestinian people to claim restitution as a result of any exploitation, damage, loss or depletion, or endangerment of their natural resources resulting from illegal measures taken by Israel, the occupying Power, in the Occupied Palestinian Territory, including East Jerusalem, and expresses the hope that this issue will be dealt with in the framework of the final status negotiations between the Palestinian and Israeli sides; 4. Stresses that the wall being constructed by Israel in the Occupied Palestinian Territory, including in and around East Jerusalem, is contrary to international law and is seriously depriving the Palestinian people of their natural resources, and calls in this regard for full compliance with the legal obligations mentioned in the 9 July 2004 advisory opinion of the International Court of Justice® and in resolution ES-10/15; 5. Calls upon Israel, the occupying Power, to comply strictly with its obligations under international law, including international humanitarian law, with respect to the alteration of the character and status of the Occupied Palestinian Territory, including East Jerusalem; 6. Also calls upon Israel, the occupying Power, to cease the dumping of all kinds of waste materials in the Occupied Palestinian Territory, including East Jerusalem, and in the occupied Syrian Golan, which gravely threaten their natural resources, namely water and land resources, and pose an environmental hazard and health threat to the civilian populations; 7. Further calls upon Israel to cease its destruction of vital infrastructure, including water pipelines and sewage networks, which, inter alia, has a negative impact on the natural resources of the Palestinian people; A/C.2/63/L.5 8. Requests the Secretary-General to report to it at its sixty-fourth session on the implementation of the present resolution, and decides to include in the provisional agenda of its sixty-fourth session the item entitled “Permanent sovereignty of the Palestinian people in the Occupied Palestinian Territory, including East Jerusalem, and of the Arab population in the occupied Syrian Golan over their natural resources”. 08-56492",10/22/2008,2008_639939,Kuwait,* Tn accordance with resolution 52/250.,yes
2008,General Assembly,N/A,Sixty-third session,114 (b),Cooperation between the United Nations and regional and other organizations: cooperation between the United Nations and the Asian-African Legal Consultative Organization,"China, Democratic People’s Republic of Korea, Egypt, Ghana, India, Indonesia, Iraq, Japan, Jordan, Kenya, Kuwait, Lebanon, Malaysia, Mauritius, Morocco, Myanmar, Nigeria, Oman, Philippines, Senegal, Somalia, South Africa, Sri Lanka, Sudan, Thailand, Turkey, United Arab Emirates, United Republic of Tanzania and Yemen",N/A,Cooperation between the United Nations and the Asian-African Legal Consultative Organization,"The General Assembly, Recalling its resolutions 36/38 of 18 November 1981, 37/8 of 29 October 1982, 38/37 of 5 December 1983, 39/47 of 10 December 1984, 40/60 of 9 December 1985, 41/5 of 17 October 1986, 43/1 of 17 October 1988, 45/4 of 16 October 1990, 47/6 of 21 October 1992, 49/8 of 25 October 1994, 51/11 of 4 November 1996, 53/14 of 29 October 1998, 55/4 of 25 October 2000, 57/36 of 21 November 2002, 59/3 of 22 October 2004 and 61/5 of 20 October 2006, Having considered the report of the Secretary-General on cooperation between the United Nations and the Asian-African Legal Consultative Organization, ! Having heard the statement made by the Secretary-General of the Asian- African Legal Consultative Organization on the steps taken by the Consultative Organization to ensure continuing, close and effective cooperation between the two organizations, Acknowledging in particular the close interaction between the Consultative Organization and the Sixth Committee, 1. Takes note with appreciation of the report of the Secretary-General;' 08-57091 Hil 281008 ATE A A 2. Recognizes the continuing efforts of the Asian-African Legal Consultative Organization towards strengthening the role and function of the United Nations and its various organs in enhancing the rule of law and wider adherence to related international instruments; 3. Notes with satisfaction the commendable progress achieved towards enhancing cooperation between the United Nations, its agencies, other international organizations and the Consultative Organization; 4. Notes with appreciation the work of the Consultative Organization aimed at strengthening the efforts of the United Nations in respect of issues such as combating corruption, international terrorism and trafficking in women and children, as well as human rights issues; 5. Also notes with appreciation the initiative and efforts the Consultative Organization has undertaken to promote the objectives and principles set out in the United Nations Millennium Declaration,’ including wider acceptance of treaties deposited with the Secretary-General; 6. | Recommends that, with a view to promoting close interaction between the Consultative Organization and the Sixth Committee, the consideration of the sub-item entitled “Cooperation between the United Nations and the Asian-African Legal Consultative Organization” should be scheduled to coincide with the deliberations of the Committee on the work of the International Law Commission; 7. Requests the Secretary-General to submit to the General Assembly at its sixty-fifth session a report on cooperation between the United Nations and the Consultative Organization; 8. Decides to include in the provisional agenda of its sixty-fifth session the sub-item entitled “Cooperation between the United Nations and the Asian-African Legal Consultative Organization”. 2 See resolution 55/2.",10/27/2008,2008_640195,Kuwait,N/A,yes
2008,General Assembly,Special Political And Decolonization Committee,Sixty-third session,29,United Nations Relief and Works Agency for Palestine Refugees in the Near East,"Algeria, Austria, Bahrain, Bangladesh, Belgium, Brunei Darussalam, Comoros, Cyprus, Czech Republic, Denmark, Egypt, Estonia, Finland, France, Germany, Greece, Hungary, Iraq, Ireland, Italy, Jordan, Kuwait, Latvia, Lebanon, Lithuania, Luxembourg, Malaysia, Malta, Mauritania, Morocco, Netherlands, Nicaragua, Oman, Qatar, Poland, Portugal, Romania, Saudi Arabia, Senegal, Slovenia, Somalia, South Africa, Spain, Tunisia, United Arab Emirates, Yemen and Palestine",N/A,Palestine refugees’ properties and their revenues,"The General Assembly, Recalling its resolutions 194 (III) of 11 December 1948 and 36/146 C of 16 December 1981 and all its subsequent resolutions on the question, Taking note of the report of the Secretary-General submitted pursuant to resolution 62/105 of 17 December 2007,1 as well as that of the United Nations Conciliation Commission for Palestine for the period from 1 September 2007 to 31 August 2008, 2 Recalling that the Universal Declaration of Human Rights? and the principles of international law uphold the principle that no one shall be arbitrarily deprived of his or her property, Recalling in particular its resolution 394 (V) of 14 December 1950, in which it directed the Conciliation Commission, in consultation with the parties concerned, to prescribe measures for the protection of the rights, property and interests of the Palestine refugees, 1 A/63/269. 2 See A/63/317. 3 Resolution 217 A (III). 041 08-58486 HN 108 AR AA Noting the completion of the programme of identification and evaluation of Arab property, as announced by the Conciliation Commission in its twenty-second progress report,+ and the fact that the Land Office had a schedule of Arab owners and a file of documents defining the location, area and other particulars of Arab property, Expressing its appreciation for the preservation and modernization of the existing records, including the land records, of the Conciliation Commission and the importance of such records for a just resolution of the plight of the Palestine refugees in conformity with resolution 194 (III), Recalling that, in the framework of the Middle East peace process, the Palestine Liberation Organization and the Government of Israel agreed, in the Declaration of Principles on Interim Self-Government Arrangements of 13 September 1993,5 to commence negotiations on permanent status issues, including the important issue of the refugees, 1. Reaffirms that the Palestine refugees are entitled to their property and to the income derived therefrom, in conformity with the principles of equity and justice; 2. Requests the Secretary-General to take all appropriate steps, in consultation with the United Nations Conciliation Commission for Palestine, for the protection of Arab property, assets and property rights in Israel; 3. Calls once again upon Israel to render all facilities and assistance to the Secretary-General in the implementation of the present resolution; 4. Calls upon all the parties concerned to provide the Secretary-General with any pertinent information in their possession concerning Arab property, assets and property rights in Israel that would assist him in the implementation of the present resolution; 5. | Urges the Palestinian and Israeli sides, as agreed between them, to deal with the important issue of Palestine refugees’ properties and their revenues within the framework of the final status negotiations of the Middle East peace process; 6. | Requests the Secretary-General to report to the General Assembly at its sixty-fourth session on the implementation of the present resolution. 4 Official Records of the General Assembly, Nineteenth Session, Annexes, Annex No. 11, document A/5700. 5 A/48/486-S/26560, annex.",11/03/2008,2008_640725,Kuwait,N/A,yes
2008,General Assembly,Special Political And Decolonization Committee,Sixty-third session,29,United Nations Relief and Works Agency for Palestine Refugees in the Near East,"Algeria, Austria, Bahrain, Bangladesh, Belgium, Comoros, Cyprus, Czech Republic, Denmark, Djibouti, Egypt, Estonia, Finland, France, Germany, Greece, Hungary, Iraq, Ireland, Italy, Jordan, Kuwait, Latvia, Lebanon, Lithuania, Luxembourg, Malaysia, Malta, Mauritania, Morocco, Netherlands, Nicaragua, Oman, Poland, Portugal, Qatar, Romania, Saudi Arabia, Senegal, Slovenia, Somalia, South Africa, Spain, Tunisia, United Arab Emirates, Yemen and Palestine",N/A,Assistance to Palestine refugees,"The General Assembly, Recalling its resolution 194 (III) of 11 December 1948 and all its subsequent resolutions on the question, including resolution 62/102 of 17 December 2007, Recalling also its resolution 302 (IV) of 8 December 1949, by which, inter alia, it established the United Nations Relief and Works Agency for Palestine Refugees in the Near East, Recalling further relevant Security Council resolutions, Aware of the fact that, for six decades, the Palestine refugees have suffered from the loss of their homes, lands and means of livelihood, Affirming the imperative of resolving the problem of the Palestine refugees for the achievement of justice and for the achievement of lasting peace in the region, Acknowledging the essential role that the United Nations Relief and Works Agency for Palestine Refugees in the Near East has played for 59 years since its establishment in ameliorating the plight of the Palestine refugees through its provision of education, health, relief and social services and emergency assistance, 041 08-58504 HN 108 UU LLL Taking note of the report of the Commissioner-General of the United Nations Relief and Works Agency for Palestine Refugees in the Near East covering the period from 1 January to 31 December 2007,! Aware of the continuing needs of the Palestine refugees throughout all the fields of operation, namely, Jordan, Lebanon, the Syrian Arab Republic and the Occupied Palestinian Territory, Expressing grave concern at the especially difficult situation of the Palestine refugees under occupation, including with regard to their safety, well-being and socio-economic living conditions, Expressing grave concern in particular at the humanitarian situation in the Gaza Strip, and underlining the importance of emergency and humanitarian assistance, Noting the signing of the Declaration of Principles on Interim Self- Government Arrangements? on 13 September 1993 by the Government of Israel and the Palestine Liberation Organization and the subsequent implementation agreements, Aware of the role to be played by the Multilateral Working Group on Refugees of the Middle East peace process, 1. Notes with regret that repatriation or compensation of the refugees, as provided for in paragraph 11 of General Assembly resolution 194 (III), has not yet been effected, and that, therefore, the situation of the Palestine refugees continues to be a matter of grave concern and the Palestine refugees continue to require assistance to meet basic health, education and living needs; 2. Also notes with regret that the United Nations Conciliation Commission for Palestine has been unable to find a means of achieving progress in the implementation of paragraph 11 of General Assembly resolution 194 (III), and reiterates its request to the Conciliation Commission to continue exerting efforts towards the implementation of that paragraph and to report to the Assembly as appropriate, but no later than 1 September 2009; 3. Affirms the necessity for the continuation of the work of the United Nations Relief and Works Agency for Palestine Refugees in the Near East and the importance of its unimpeded operation and its provision of services for the well- being and human development of the Palestine refugees and for the stability of the region, pending the just resolution of the question of the Palestine refugees; 4. Calls upon all donors to continue to make the most generous efforts possible to meet the anticipated needs of the Agency, including with regard to increased expenditures arising from the continuing deterioration of the socio-economic and humanitarian situation in the region, particularly in the Occupied Palestinian Territory, and those mentioned in recent emergency appeals; 5. Decides to commemorate the work of the United Nations Relief and Works Agency for Palestine Refugees in the Near East on the occasion of the sixtieth anniversary of its establishment at a high-level meeting to be convened on 1 Official Records of the General Assembly, Sixty-third Session, Supplement No. 13 (A/63/13). 2 A/48/486-S/26560, annex. A/C.4/63/L.11 30 September 2009, during the sixty-fourth session of the General Assembly, and encourages the participation of Member States at the ministerial level; 6. Decides also to invite Finland and Ireland, in accordance with the criterion set forth in General Assembly decision 60/522 of 8 December 2005, to become members of the Advisory Commission of the United Nations Relief and Works Agency for Palestine Refugees in the Near East. 08-58504",11/03/2008,2008_640811,Kuwait,N/A,yes
