year,Council,Committee,Session,Agenda item,Agenda detail,cosponsored countries,body title number,body title detail,body text,date,file,filecountry,footnote,scanned
2008,General Assembly,N/A,Sixty-second session,46,Global road safety crisis,"Albania, Argentina, Austria, Bahamas, Bahrain, Bosnia and Herzegovina, Costa Rica, Cuba, Dominican Republic, Egypt, El Salvador, France, Greece, Iceland, Indonesia, Iran (Islamic Republic of), Iraq, Jamaica, Jordan, Kuwait, Lebanon, Libyan Arab Jamahiriya, Malaysia, Mauritania, Morocco, Niger, Oman, Philippines, Portugal, Qatar, Russian Federation, Saudi Arabia, Somalia, South Africa, Sudan, Thailand, Tunisia, Ukraine, United Arab Emirates, Viet Nam and Yemen",N/A,Improving global road safety,"The General Assembly, Recalling its resolutions 57/309 of 22 May 2003, 58/9 of 5 November 2003, 58/289 of 14 April 2004 and 60/5 of 26 October 2005 on improving global road safety, Having considered the report of the Secretary-General on improving global road safety, ! Noting with appreciation the adoption on 23 May 2007 of World Health Assembly resolution 60.22 on emergency care systems, Underlining the importance for Member States to continue using the World Report on Road Traffic Injury Prevention as a framework for road safety efforts and implementing its recommendations by paying particular attention to five of the main risk factors identified, namely, the non-use of safety belts and child restraints; the non-use of helmets; drinking and driving; inappropriate and excessive speed; and lack of appropriate infrastructure, and by paying particular attention also to the needs of vulnerable road users such as pedestrians, cyclists and motorcyclists and users of public transport, and improving post-crash care for victims of road crashes, Commending the World Health Organization for its role in implementing the mandate conferred upon it by the General Assembly to work with the United Nations regional commissions to coordinate road safety issues within the United Nations system, and the progress of the United Nations Road Safety Collaboration 08-28412 Hii 270308 ATR AT as a coordination mechanism whose members are providing Governments and civil society with good-practice guidelines to support action to tackle the major road safety risk factors, Recognizing the United Nations regional commissions and their subsidiary bodies for increasing their road safety activities and advocating for increased political commitment to road safety, and in this context, also recognizing the continuing commitment of the Economic Commission for Europe to global action in the elaboration of safety-related global technical vehicle regulations and amendments to the Vienna Convention on Road Traffic, the Vienna Convention on Road Signs and Signals, Economic and Social Commission for Asia and the Pacific resolution 63/9 of 23 May 2007, in which the Commission encouraged members to continue to act upon recommendations contained in the ministerial declaration on improving road safety in Asia and the Pacific, the Accra Declaration of African ministers of transport and health of 8 February 2007, the San José Declaration on road safety of 14 September 2006 and Economic and Social Commission for Western Asia resolution 279 (XXIV) of 11 May 2006 on follow-up to the implementation of the components of the integrated transport system in the Arab Mashreq, including follow-up on road safety, Commending the World Bank for its initiative in establishing the Global Road Safety Facility, the first funding mechanism designed to support capacity-building and provide technical support for road safety at the global, regional and country levels, welcoming the financial assistance given to the Facility by the Governments of Australia, the Netherlands and Sweden, and by the FIA Foundation for the Automobile and Society, and encouraging more financial contributions to the Facility, Also commending the World Health Organization and the United Nations regional commissions for organizing, in collaboration with the other members of the United Nations Road Safety Collaboration, the first United Nations Global Road Safety Week in April 2007, during which hundreds of events were held all over the world, including the World Youth Assembly and the second Stakeholders’ Forum in Geneva, and which helped draw attention to the fact that road traffic crashes have become the leading cause of death among young people aged between 10 and 24, Taking note of all national and regional initiatives to improve awareness of road safety issues, including the second European Union Road Safety Day, to be observed on 13 October 2008, Also taking note of the report Make Roads Safe: A New Priority for Sustainable Development from the Commission for Global Road Safety, which links road safety with sustainable development and which calls for increased resources for road safety, a new commitment for road infrastructure assessment and a global ministerial conference on road safety under the auspices of the United Nations, Expressing its concern at the continued increase in road traffic fatalities and injuries worldwide, in particular in developing countries, Reaffirming the need for the further strengthening of international cooperation and knowledge-sharing in road safety, taking into account the needs of developing countries, A/62/L.43 1. Invites Member States to actively participate in the development of the global road safety status report being prepared by the World Health Organization; 2. Invites all Member States to participate in the projects to be implemented by the United Nations regional commissions to assist low- and middle-income countries in setting their own national road traffic casualty reduction targets, as well as regional targets; 3... Reaffirms the importance of addressing global road safety issues and the need for the further strengthening of international cooperation, taking into account the needs of developing countries by building capacities in the field of road safety, and providing financial and technical support for their efforts; 4. Encourages Member States to continue to strengthen their commitment to road safety, including by observing the World Day of Remembrance for Road Traffic Victims on the third Sunday in November of every year; 5. | Invites the World Health Organization and the United Nations regional commissions, in cooperation with other partners in the United Nations Road Safety Collaboration, to promote multisectoral collaboration by organizing, when appropriate, United Nations Global Road Safety Weeks, including the global Stakeholders’ Forums; 6. | Encourages organizations in both the private and the public sector with vehicle fleets, including agencies of the United Nations system, to develop and implement policies and practices that will reduce crash risks for vehicle occupants and other road users; 7. Welcomes the offer by the Government of the Russian Federation to host and provide the necessary financial support for the first global high-level (ministerial) conference on road safety, to be held in 2009, to bring together delegations of ministers and representatives dealing with transport, health, education, safety and related traffic law enforcement issues, to discuss progress in implementing the recommendations of the World Report on Road Traffic Injury Prevention and the General Assembly resolutions on improving global road safety and provide an opportunity for Member States to exchange information and best practices; 8. Decides to include in the provisional agenda of its sixty-fourth session the item entitled “Global road safety crisis”, and requests the Secretary-General to report to the General Assembly at that session on the progress made in improving global road safety. 08-28412",03/26/2008,2008_623497,Kuwait,N/A,yes
2008,Economic And Social Council,Commission On Human Rights,Ninth session,3,"PROMOTION AND PROTECTION OF ALL HUMAN RIGHTS, CIVIL, POLITICAL, ECONOMIC, SOCIAL AND CULTURAL RIGHTS, INCLUDING THE RIGHT TO DEVELOPMENT","Algeria*, Argentina, Bahrain, Brazil, Chile, Cote d’Ivoire*, Cuba, Democratic Republic of the Congo*, Ecuador, Egypt, Ghana, Kenya*, Kuwait*, Mali*, Mauritania*, Mexico, Morocco*, Nigeria, Oman*, Pakistan, Qatar, Saudi Arabia, Sudan“, Switzerland, Syrian Arab Republic*, Tunisia*, Uganda’, United Arab Emirates*, Uruguay, Yemen*, Zambia and Zimbabwe*",N/A,9/... Protection of the human rights of civilians in armed conflict,"The Human Rights Council, Guided by the Charter of the United Nations and the Universal Declaration of Human a Rights, Recalling the International Covenant on Economic, Social and Cultural Rights, the International Covenant on Civil and Political Rights, the Convention on the Prevention and Punishment of the Crime of Genocide, the Geneva Conventions of 12 August 1949, the Additional Protocols thereto of 8 June 1977, other international human rights law and international humanitarian law instruments, and the Vienna Declaration and Programme of Action, Bearing in mind General Assembly resolution 60/251 of 15 March 2006, in which the Assembly states that the Human Rights Council shall be responsible for promoting universal respect for the protection of all human rights and fundamental freedoms for all, without distinction of any kind and in fair and equal manner, Recalling resolution 2005/63 of 20 April 2005 of the Commission on Human Rights, and taking note of decision 2006/21 of 24 August 2006 adopted by the Sub-Commission on the Promotion and Protection of Human Rights at its final session, Acknowledging that human rights law and international humanitarian law are complementary and mutually reinforcing, Gravely concerned at violations of human rights law and international humanitarian law during armed conflicts, wherever they occur, and their impact on the civilian population, especially women, children and vulnerable groups, Reiterating that effective measures to guarantee and monitor the implementation of human rights should be taken in respect of civilian populations in situations of armed conflict, including people under foreign occupation, and that effective protection against violations of their human rights should be provided, in accordance with international human rights law and applicable international humanitarian law, particularly Geneva Convention IV relative to the Protection of Civilian Persons in Time of War, of 12 August 1949, and other applicable international instruments, Emphasizing that States parties to the Geneva Conventions of 1949 have undertaken to respect and ensure respect for these Conventions in all circumstances, Considering that all human rights require protection equally and that the protection provided by human rights law continues in armed conflict situations, taking into account when international humanitarian law applies as a lex specialis, Recalling that, in accordance with article 4 of the International Covenant on Civil and Political Rights, certain rights are recognized as non-derogable in all circumstances and that any measures derogating from the provisions of the Covenant must be in accordance with its article 4 in all cases, and underlining the exceptional and temporary nature of any such derogations, 1. Emphasizes that conduct that violates international humanitarian law, including grave breaches of the Geneva Conventions of 12 August 1949, or of the Protocols Additional thereto of 8 June 1977, may also constitute a gross violation of human rights; 2. Expresses its deep concern at the wide gap between the obligations of States under international humanitarian law and international human rights law and their implementation, which undermines the protection of human rights of civilians in armed conflicts; Calls upon all States to respect the human rights of civilians in armed conflicts; 4. Stresses the importance of combating impunity in order to prevent violations of international human rights law and international humanitarian law perpetrated against civilians in armed conflicts, and urges States, in accordance with their international obligations, to bring perpetrators of such crimes to justice; Invites the international community to support regional efforts aimed at the protection of civilians in armed conflicts; 6. Resolves to address, in accordance with its mandate established by the General Assembly in its resolution 60/251, systematic and gross violations of the human rights of civilians in armed conflicts, and calls upon States involved in such conflicts to facilitate the work of any mechanism that the Council may decide to establish, as and where appropriate, in response to such violations, including, inter alia, fact-finding missions or commissions of enquiry; 7. Requests relevant special procedures and the Human Rights Council Advisory Committee, and invites human rights treaty bodies, within their respective mandates, to continue to address the relevant aspects of the protection of human rights of civilians in armed conflicts in their work; 8. Invites the Office of the High Commissioner for Human Rights to convene, within existing resources, an expert consultation, open to the participation of Governments, regional organizations, relevant United Nations bodies and civil society organizations, and in consultation with the International Committee of the Red Cross, on the issue of protecting the human rights of civilians in armed conflict, and requests the Office of the High Commissioner for Human Rights to report on the outcome of this consultation, in the form of a summary of discussions on the above-mentioned issue, to the Council at its eleventh session; 9. Requests the Advisory Committee to elaborate a comprehensive study, drawing upon the work previously undertaken by the Sub-Commission on the Promotion and Protection of Human Rights, and bearing in mind the outcome of the above-mentioned expert consultation and the input received from all relevant stakeholders, with a view to identify mechanisms, modalities, procedures and methods for enhancing the protection of human rights of civilians in armed conflicts, and to present concrete recommendations thereon for consideration by the Council at its thirteenth session; 10. Decides to continue consideration of this question at its twelfth session under the same agenda item.",09/19/2008,2008_637853,Kuwait,* Non-member State of the Human Rights Council.,yes
2008,General Assembly,First Committee,Sixty-third session,92,The risk of nuclear proliferation in the Middle East,"Algeria, Bahrain, Comoros, Djibouti, Egypt, Iraq, Jordan, Kuwait, Lebanon, Libyan Arab Jamahiriya, Morocco, Oman, Qatar, Saudi Arabia, Sudan, Syrian Arab Republic, Tunisia, United Arab Emirates, Yemen and Palestine",N/A,The risk of nuclear proliferation in the Middle East,"The General Assembly, Bearing in mind its relevant resolutions, Taking note of the relevant resolutions adopted by the General Conference of the International Atomic Energy Agency, the latest of which is resolution GC(52)/RES/15, adopted on 4 October 2008, 4 Cognizant that the proliferation of nuclear weapons in the region of the Middle East would pose a serious threat to international peace and security, Mindful of the immediate need for placing all nuclear facilities in the region of the Middle East under full-scope safeguards of the Agency, Recalling the decision on _ principles and _ objectives for nuclear non-proliferation and disarmament adopted by the 1995 Review and Extension Conference of the Parties to the Treaty on the Non-Proliferation of Nuclear Weapons on 11 May 1995, in which the Conference urged universal adherence to the Treaty® as an urgent priority and called upon all States not yet parties to the Treaty to accede to it at the earliest date, particularly those States that operate unsafeguarded nuclear facilities, 1 See International Atomic Energy Agency, Resolutions and Other Decisions of the General Conference, Fifty-second Regular Session, 29 September-4 October 2008 (GC(52)/RES/DEC(2008)). 2 See 1995 Review and Extension Conference of the Parties to the Treaty on the Non-Proliferation of Nuclear Weapons, Final Document, Part I (NPT/CONF.1995/32 (Part I) and Corr.2), annex. 08-54331 ui 131008 AE AAT Recognizing with satisfaction that, in the Final Document of the 2000 Review Conference of the Parties to the Treaty on the Non-Proliferation of Nuclear Weapons, the Conference undertook to make determined efforts towards the achievement of the goal of universality of the Treaty, called upon those remaining States not parties to the Treaty to accede to it, thereby accepting an international legally binding commitment not to acquire nuclear weapons or nuclear explosive devices and to accept Agency safeguards on all their nuclear activities, and underlined the necessity of universal adherence to the Treaty and of strict compliance by all parties with their obligations under the Treaty,+ Recalling the resolution on the Middle East adopted by the 1995 Review and Extension Conference on 11 May 1995,’ in which the Conference noted with concern the continued existence in the Middle East of unsafeguarded nuclear facilities, reaffirmed the importance of the early realization of universal adherence to the Treaty and called upon all States in the Middle East that had not yet done so, without exception, to accede to the Treaty as soon as possible and to place all their nuclear facilities under full-scope Agency safeguards, Noting that Israel remains the only State in the Middle East that has not yet become party to the Treaty, Concerned about the threats posed by the proliferation of nuclear weapons to the security and stability of the Middle East region, Stressing the importance of taking confidence-building measures, in particular the establishment of a nuclear-weapon-free zone in the Middle East, in order to enhance peace and security in the region and to consolidate the global non-proliferation regime, Emphasizing the need for all parties directly concerned seriously to consider taking the practical and urgent steps required for the implementation of the proposal to establish a nuclear-weapon-free zone in the region of the Middle East in accordance with the relevant resolutions of the General Assembly and, as a means of promoting this objective, inviting the countries concerned to adhere to the Treaty and, pending the establishment of the zone, to agree to place all their nuclear activities under Agency safeguards, Noting that one hundred and eighty States have signed the Comprehensive Nuclear-Test-Ban Treaty,° including a number of States in the region, 1. Welcomes the conclusions on the Middle East of the 2000 Review Conference of the Parties to the Treaty on the Non-Proliferation of Nuclear Weapons; ® 2. Reaffirms the importance of Israel’s accession to the Treaty on the Non-Proliferation of Nuclear Weapons’ and placement of all its nuclear facilities 4 See 2000 Review Conference of the Parties to the Treaty on the Non-Proliferation of Nuclear Weapons, Final Document, vol. I (NPT/CONF.2000/28 (Parts I and II)), part I, section entitled “Article IX”. 6 See 2000 Review Conference of the Parties to the Treaty on the Non-Proliferation of Nuclear Weapons, Final Document, vol. I (NPT/CONF.2000/28 (Parts I and II)), part I, section entitled “Article VII and the security of non-nuclear-weapon States”, para.16. A/C.1/63/L.2 under comprehensive International Atomic Energy Agency safeguards, in realizing the goal of universal adherence to the Treaty in the Middle East; 3. Calls upon that State to accede to the Treaty without further delay and not to develop, produce, test or otherwise acquire nuclear weapons, and to renounce possession of nuclear weapons, and to place all its unsafeguarded nuclear facilities under full-scope Agency safeguards as an important confidence-building measure among all States of the region and as a step towards enhancing peace and security; 4. Requests the Secretary-General to report to the General Assembly at its sixty-fourth session on the implementation of the present resolution; 5. Decides to include in the provisional agenda of its sixty-fourth session the item entitled “The risk of nuclear proliferation in the Middle East”. 08-54331",10/09/2008,2008_639031,Kuwait,N/A,yes
2008,General Assembly,N/A,Sixty-third session,108,Follow-up to the commemoration of the two-hundredth anniversary of the abolition of the transatlantic slave trade,"Antigua and Barbuda, Argentina, Australia, Austria, Bahamas, Barbados, Belize, Brazil, Chile, Costa Rica, Cuba, Denmark, Dominica, Grenada, Guatemala, Guyana, Haiti, Hungary, Iceland, India, Ireland, Israel, Italy, Jamaica, Kenya,* Kuwait, Luxembourg, Netherlands, Nicaragua, Norway, Panama, Paraguay, Portugal, Saint Kitts and Nevis, Saint Lucia, Saint Vincent and the Grenadines, Singapore, Slovakia, Spain, Sri Lanka, Suriname, Trinidad and Tobago and Venezuela (Bolivarian Republic of)",N/A,Permanent memorial to and remembrance of the victims of slavery and the transatlantic slave trade,"The General Assembly, Recalling its resolution 61/19 of 28 November 2006, entitled “Commemoration of the two-hundredth anniversary of the abolition of the transatlantic slave trade”, and resolution 62/122 of 17 December 2007, entitled “Permanent memorial to and remembrance of the victims of slavery and the transatlantic slave trade”, Recalling also the designation of 25 March as the annual International Day of Remembrance of the Victims of Slavery and the Transatlantic Slave Trade, beginning in 2008, as a complement to the existing International Day for the Remembrance of the Slave Trade and its Abolition of the United Nations Educational, Scientific and Cultural Organization, Noting the initiatives undertaken by States in reaffirming their commitment to implement paragraphs 101 and 102 of the Durban Declaration of the World Conference against Racism, Racial Discrimination, Xenophobia and Related Intolerance aimed at countering the legacy of slavery and contributing to the restoration of the dignity of the victims of slavery and the slave trade, ! 08-55387 HI 171008 ATR TAT Stressing the importance of educating and informing future generations about the causes, consequences and lessons of the transatlantic slave trade and slavery, Recognizing how little is known about the four-hundred-year-long transatlantic slave trade and its lasting consequences, felt throughout the world, and welcoming the increased attention that the General Assembly commemoration brought to the issue, including the raising of its profile in many States, Recalling in particular paragraph 101 of the Durban Declaration which, inter alia, invited the international community and its members to honour the memory of the victims, 1. Welcomes the initiative of the States members of the Caribbean Community to erect, at a place of prominence at United Nations Headquarters that is easily accessible to delegates, United Nations staff and visitors, a permanent memorial in acknowledgement of the tragedy and in consideration of the legacy of slavery and the transatlantic slave trade; 2. Welcomes also the establishment of a committee of interested States to oversee the permanent memorial project, drawn from all geographical regions of the world, with Member States from the Caribbean Community and the African Union playing a primary role, in collaboration with the United Nations Educational, Scientific and Cultural Organization, representatives of the Secretariat, the Schomburg Center for Research in Black Culture of the New York Public Library and civil society; 3. Notes that the committee will oversee the voluntary fund established for the erection of the permanent memorial to the victims of the transatlantic slave trade and slavery; 4. Expresses sincere appreciation to those Member States which have already made contributions to the fund, and invites Member States and other interested parties that have not done so to do likewise; 5. Also expresses appreciation to the Secretary-General, the Secretariat and members of the committee, for their invaluable support, technical advice and assistance towards the implementation of the project; 6. Reiterates its request contained in resolution 61/19 of 28 November 2006 for Member States that have not already done so to develop educational programmes, including through school curricula, designed to educate and inculcate in future generations an understanding of the lessons, history and consequences of slavery and the slave trade; 7. Takes note with appreciation of the report of the Secretary-General? on the programme of outreach on the transatlantic slave trade and slavery, which highlights developments relating to a diverse educational outreach strategy to increase awareness of and to educate future generations about the causes, consequences, lessons and legacy of the four-hundred-year-long slave trade and to communicate the dangers of racism and prejudice, and encourages continued action in this regard; A/63/L.5 8. Requests the Secretary-General to report to the General Assembly at its sixty-fourth session on continued action to implement the programme of educational outreach, including action by Member States; 9. Decides to include in the provisional agenda of its sixty-fourth session an item entitled “Follow-up to the commemoration of the two-hundredth anniversary of the abolition of the transatlantic slave trade”. 08-55387",10/16/2008,2008_639539,Kuwait,"* On behalf of the States Members of the United Nations that are members of the Group of African States. 1 See A/CONF.189/12 and Corr.1, chap. I.",yes
