year,Council,Committee,Session,Agenda item,Agenda detail,cosponsored countries,body title number,body title detail,body text,date,file,filecountry,footnote,scanned
2007,General Assembly,N/A,Sixty-first session,114,Multilingualism,"Afghanistan, Albania, Andorra, Argentina, Armenia, Austria, Bangladesh, Belarus, Belgium, Benin, Bolivia, Botswana, Bulgaria, Burkina Faso, Burundi, Cameroon, Canada, Cape Verde, Central African Republic, Chad, China, Comoros, Congo, Costa Rica, Cote d’Ivoire, Croatia, Cyprus, Czech Republic, Democratic Republic of the Congo, Djibouti, Dominican Republic, Egypt, El Salvador, France, Gabon, Gambia, Georgia, Germany, Greece, Guatemala, Guinea, Haiti, Honduras, Hungary, Ireland, Israel, Kazakhstan, Kyrgyzstan, Latvia, Lebanon, Libyan Arab Jamahiriya, Liechtenstein, Lithuania, Luxembourg, Madagascar, Mali, Mauritania, Mauritius, Mexico, Moldova, Monaco, Morocco, Mozambique, Niger, Nigeria, Oman, Palau, Panama, Paraguay, Portugal, Qatar, Romania, Russian Federation, San Marino, Sao Tome and Principe, Senegal, Seychelles, Slovakia, Slovenia, Somalia, South Africa, Spain, Sudan, Switzerland, Tajikistan, the former Yugoslav Republic of Macedonia, Togo, Tunisia, Turkmenistan, Ukraine, United Republic of Tanzania, Viet Nam and Yemen",N/A,Multilingualism,"The General Assembly, Recognizing that the United Nations pursues multilingualism as a means of promoting, protecting and preserving diversity of languages and cultures globally, Recognizing also that genuine multilingualism promotes unity in diversity and international understanding, and recognizing the importance of the capacity to communicate to the peoples of the world in their own language, including in formats accessible to persons with disabilities, Stressing the need for strict observance of the resolutions and rules establishing language arrangements for the different bodies and organs of the United Nations, Recalling its resolution 47/135 of 18 December 1992, by which it adopted the Declaration on the Rights of Persons Belonging to National or Ethnic, Religious and 07-33757 nn 110507 GM TILL Linguistic Minorities, and the International Covenant on Civil and Political Rights, ! in particular article 27 thereof, concerning the rights of persons belonging to ethnic, religious or linguistic minorities, Recalling also its resolutions 2 (1) of 1 February 1946, 2480 B (XXIII) of 21 December 1968, 42/207 C of 11 December 1987, 50/11 of 2 November 1995, 52/23 of 25 November 1997, 54/64 of 6 December 1999, 56/262 of 15 February 2002, 59/309 of 22 June 2005, 61/121 B of 14 December 2006 and 61/236 and 61/244 of 22 December 2006, Having considered the report of the Secretary-General? and the letter dated 26 February 2007 from the Director-General of the United Nations Educational, Scientific and Cultural Organization to the Secretary-General on the proclamation of the year 2008 as International Year of Languages, ? 1. Takes note of the report of the Secretary-General’ and the letter dated 26 February 2007 from the Director-General of the United Nations Educational, Scientific and Cultural Organization to the Secretary-General on the proclamation of the year 2008 as International Year of Languages;” 2. Emphasizes the paramount importance of the equality of the six official languages of the United Nations; 3. Underlines the need for full implementation of the resolutions establishing language arrangements for the official languages of the United Nations and the working languages of the Secretariat; 4. Requests the Secretary-General to ensure that all language services are given equal treatment and are provided with equally favourable working conditions and resources, with a view to achieving maximum quality of those services, with full respect for the specificities of the six official languages and taking into account their respective workloads; 5. Reiterates its request to the Secretary-General to complete the task of uploading all important older United Nations documents onto the United Nations website in all six official languages on a priority basis, so that these archives are also available to Member States through that medium; 6. Reiterates that all content-providing offices in the Secretariat should continue their efforts to translate into all official languages all English language materials and databases posted on the United Nations website in the most practical, efficient and cost-effective manner; 7. Requests the Secretary-General to continue to ensure, through the provision of documentation services and meetings and publishing services under conference management, including high-quality translation and _ interpretation, effective multilingual communication among representatives of Member States in intergovernmental organs and members of expert bodies of the United Nations equally in all the official languages of the United Nations; 1 See resolution 2200 A (XXJ), annex. 2 A/61/317. 3 A/61/780, annex. A/61/L.56 8. Stresses the importance of providing United Nations information, technical assistance and training materials, whenever possible, in the local languages of the beneficiary countries; 9. Recalls its resolution 61/236 of 22 December 2006, in which it reaffirmed the provisions relating to conference services of its resolutions on multilingualism; 10. Also recalls its resolution 61/121 B of 14 December 2006, and emphasizes the importance of multilingualism in United Nations public relations and information activities; 11. Notes with satisfaction the willingness of the Secretariat to encourage staff members, in meetings with interpretation services, to use any of the six official languages of which they have a command; 12. Requests the Secretary-General to appoint a new Coordinator for Multilingualism and takes note of the proposal contained in the report of the Secretary-General regarding the informal network of focal points to support the Coordinator; 13. Emphasizes the importance of: (a) Making appropriate use of all the official languages of the United Nations in all the activities of the Department of Public Information of the Secretariat, with the aim of eliminating the disparity between the use of English and the use of the five other official languages; (b) Ensuring the full and equitable treatment of all the official languages of the United Nations in all the activities of the Department of Public Information; and, in this regard, reaffirms its request to the Secretary-General to ensure that the Department has appropriate staffing capacity in all the official languages of the United Nations to undertake all its activities; 14. Reaffirms the need to achieve full parity among the six official languages on the United Nations websites, and in this regard: (a) Encourages the Secretary-General to continue his efforts to develop multilingual United Nations websites; (b) Reaffirms that the United Nations website is an essential tool for the media, non-governmental organizations, educational institutions, Member States and the general public, and reiterates the continued need for efforts by the Department of Public Information to maintain and improve it; (c) Reaffirms its request to the Secretary-General to ensure, while maintaining an up-to-date and accurate website, the adequate distribution of financial and human resources within the Department of Public Information allocated to the United Nations website among all official languages, taking into consideration the specificity of each official language on a continuous basis; (d) Notes that the multilingual development and enrichment of the United Nations website has improved, although at a slower rate than expected owing to constraints that need to be addressed; A/61/L.56 (e) Requests the Department of Public Information, in coordination with content-providing offices, to improve the actions taken to achieve parity among the six official languages on the United Nations website, in particular by expediting the filling of current vacant posts in some sections; (f) Recognizes that some official languages use non-Latin and bidirectional scripts and that technological infrastructures and supportive applications in the United Nations are based on Latin script, which leads to difficulties in processing non-Latin and bidirectional scripts, and requests the Department of Public Information, in cooperation with the Information Technology Services Division of the Department of Management of the Secretariat, to continue its efforts to ensure that technological infrastructures and supportive applications in the United Nations fully support Latin, non-Latin and bidirectional scripts in order to enhance the equality of all official languages on the United Nations website; 15. Welcomes the cooperative arrangements undertaken by the Department of Public Information with academic institutions to increase the number of web pages available in some official languages, and requests the Secretary-General to explore additional cost-neutral ways to further extend these cooperative arrangements, in coordination with content-providing offices, so as to include all the official languages of the United Nations, bearing in mind the necessity of adherence to United Nations standards and guidelines; 16. Notes with satisfaction the official launch of iSeek in Geneva in the two working languages of the Secretariat and encourages the Secretariat to continue its efforts to implement iSeek at all duty stations as well as to develop and implement cost-neutral measures to provide Member States with secure access to the information currently accessible only on the Intranet of the Secretariat; 17. Note with appreciation the work carried out by the United Nations information centres, including the United Nations Regional Information Centre, in favour of the publication of United Nations information materials and the translation of important documents into languages other than the official languages of the United Nations, with a view to reaching the widest possible audience and extending the United Nations message to all corners of the world in order to strengthen international support for the activities of the Organization; and encourages United Nations information centres to continue their multilingual activities in the interactive and proactive aspects of their work, especially by arranging seminars and debates to further the spread of information and the understanding and exchange of views regarding United Nations activity at the local level; 18. Recalls its resolution 61/244 of 22 December 2006, in which it reaffirmed the need to respect the equality of the two working languages of the Secretariat, reaffirmed the use of additional working languages in specific duty stations as mandated, and in that regard requested the Secretary-General to ensure that vacancy announcements specified the need for either of the working languages of the Secretariat, unless the functions of the post required a specific working language; 19. Also recalls paragraph 17 of section II of its resolution 61/244, in which it acknowledged that the interaction of the United Nations with the local population in the field was essential and that language skills constituted an important element of the selection and training processes, and therefore affirmed that a good command A/61/L.56 of the official language(s) spoken in the country of residence should be taken into account as an additional asset during those processes; 20. Stresses that the employment of staff shall continue to be carried out in strict accordance with Article 101 of the Charter of the United Nations and in line with the relevant provisions of General Assembly resolutions; 21. Also stresses that the promotion of staff in the Professional and higher categories should be carried out in strict accordance with Article 101 of the Charter and in line with the provisions of resolution 2480 B (XXIII) of 21 December 1968 and the relevant provisions of resolution 55/258 of 14 June 2001; 22. Encourages United Nations staff members to continue to use actively existing training facilities to acquire and enhance their proficiency in one or more of the official languages of the United Nations; 23. Recalls that linguistic diversity is an important element of cultural diversity and takes note of the entering into force on 18 March 2007 of the Convention on the Protection and Promotion of the Diversity of Cultural Expressions; 24. Welcomes the decision taken by the General Conference of the United Nations Educational, Scientific and Cultural Organization on 17 November 1999 that 21 February should be proclaimed International Mother Language Day, and calls upon Member States and the Secretariat to promote the preservation and protection of all languages used by peoples of the world; 25. Proclaims 2008, International Year of Languages, pursuant to the resolution adopted by the General Conference of the United Nations Educational, Scientific and Cultural Organization at its thirty-third session on 20 October 2005, invites the United Nations Educational, Scientific and Cultural Organization to serve as the lead agency for the Year, and in this context: (a) Invites Member States, the United Nations system and all other relevant stakeholders to develop, support and intensify activities aimed at fostering respect for and the promotion and protection of all languages (in particular endangered languages), linguistic diversity and multilingualism; (b) Invites the Director-General of the United Nations Educational, Scientific and Cultural Organization to report to the General Assembly at its sixty- third session on the impact of the activities carried out during the International Year of Languages; 26. Reaffirms its resolution 61/185 of 20 December 2006 concerning the proclamation of international years, in which it stressed the need to take into account and apply the criteria and procedures contained in the annex to Economic and Social Council resolution 1980/67 on international years and anniversaries, of 25 July 1980 in considering future proposals for international years; 27. Requests the Secretary-General to submit to the General Assembly at its sixty-third session a comprehensive report on the full implementation of its resolutions on multilingualism; 28. Decides to include in the provisional agenda of its sixty-third session the item entitled “Multilingualism”. 07-33757",05/09/2007,2007_599989,Kyrgyzstan,N/A,yes
2007,General Assembly,N/A,Sixty-first session,44,Culture of peace,"Afghanistan, Albania, Algeria, Angola, Antigua and Barbuda, Argentina, Armenia, Austria, Bangladesh, Belarus, Benin, Bhutan, Bolivia, Botswana, Brazil, Bulgaria, Burkina Faso, Burundi, Cambodia, Cameroon, Chile, China, Colombia, Costa Rica, Cote d’Ivoire, Croatia, Czech Republic, Denmark, Dominica, Ecuador, Egypt, El Salvador, Eritrea, Estonia, Ethiopia, Fiji, Finland, France, Gabon, Germany, Ghana, Grenada, Guatemala, Guinea, Guinea-Bissau, Guyana, Honduras, Iceland, India, Indonesia, Iraq, Ireland, Italy, Jamaica, Lebanon, Lesotho, Lithuania, Madagascar, Malaysia, Maldives, Mali, Mauritius, Mexico, Micronesia (Federated States of), Monaco, Mongolia, Montenegro, Morocco, Mozambique, Myanmar, Nauru, Nepal, Netherlands, Nicaragua, Nigeria, Oman, Palau, Papua New Guinea, Philippines, Poland, Portugal, Qatar, Romania, Russian Federation, Saint Lucia, Saint Vincent and the Grenadines, Samoa, Senegal, Serbia, Sierra Leone, Singapore, Slovakia, Slovenia, Solomon Islands, South Africa, Spain, Sri Lanka, Sudan, Sweden, Switzerland, Thailand, the former Yugoslav Republic of Macedonia, Timor-Leste, Tuvalu, Uganda, Ukraine, United Kingdom of Great Britain and Northern Ireland, United Republic of Tanzania, Uzbekistan, Vanuatu, Venezuela (Bolivarian Republic of), Viet Nam, Zambia and Zimbabwe",N/A,International Day of Non-Violence,"Addendum Add the following countries to the list of sponsors of the resolution: Andorra, Azerbaijan, Belize, Brunei Darussalam, Canada, Central African Republic, Cuba, Cyprus, Djibouti, Greece, Hungary, Israel, Japan, Jordan, Kazakhstan, Kuwait, Kyrgyzstan, Lao People’s Democratic Republic, Liechtenstein, Moldova, Panama, Peru, Suriname, Syrian Arab Republic, Tonga, Tunisia, Turkey and Uruguay 07-38532 i 180607 ARUN A",06/15/2007,2007_601733,Kyrgyzstan,N/A,yes
2007,General Assembly,N/A,Sixty-second session,N/A,United Nations Avo2/194,"Letter dated 2 August 2007 from the Permanent Representatives of Belarus, Kazakhstan, the Kyrgyz Republic, the Russian Federation, Tajikistan and Uzbekistan to the United Nations addressed to the Secretary-General In accordance with rule 14 of the rules of procedure of the General Assembly, we have the honour to request the inclusion in the agenda of the sixty-second session of the General Assembly of a supplementary item entitled “Observer status for the Eurasian Development Bank in the General Assembly”. The Eurasian Development Bank is an international intergovernmental organization that promotes socio-economic development and integration processes in the Eurasian area. The Bank was established through an agreement between the Governments of the Russian Federation and the Republic of Kazakhstan and is open for additional States to join as members. In accordance with rule 20 of the rules of procedure of the General Assembly, an explanatory memorandum (annex J)",N/A,We should be grateful if you would have the text of this letter and its annexes circulated as a document of the General Assembly.,"(Signed) S. A. Rachkov Acting Permanent Representative of the Republic of Belarus to the United Nations (Signed) B. S. Aitimova Permanent Representative of the Republic of Kazakhstan to the United Nations (Signed) N. J. Jeenbaev Permanent Representative of the Kyrgyz Republic to the United Nations (Signed) V. I. Churkin Permanent Representative of the Russian Federation to the United Nations (Signed) S. M. Aslov Permanent Representative of the Republic of Tajikistan to the United Nations (Signed) A. V. Vohidov Permanent Representative of the Republic of Uzbekistan to the United Nations A/62/194 Annex I [Original: Russian] Explanatory memorandum 1. The Eurasian Development Bank (EDB) is an international institution for promoting development established by an Agreement between the Governments of the Republic of Kazakhstan and the Russian Federation of 12 January 2006. The Bank began its work on 27 June 2006. EDB is an international organization and a subject of international law; it has international legal capacity and can, in particular, conclude international agreements within the purview of its competence. Under the Agreement mentioned above, the Bank is guided in its activities by the generally recognized principles and norms of international law applicable under international agreements and also adheres to the generally recognized principles of banking. The Bank and its bodies are prohibited by its charter from participating in political activity. Other States and international organizations may accede to the Agreement on the establishment of EDB. 2. The Bank’s mission is to promote the development of the market economy, economic growth and the expansion of trade and economic ties through investment activities, including the financing of large-scale investment projects, in the Eurasian area. The Bank facilitates the strengthening of international financial and economic cooperation, by participating in the work of other international financial and banking organizations and associations. In the future, EDB is expected to become a consolidating element in the financial infrastructure of the single economic space and a partner of member countries in expanding integration processes and equalizing the levels of socio-economic development of the member States of the Eurasian Economic Community. 3. In order to achieve its objectives, the Bank carries out the following basic functions: «It engages in investment activities by financing projects and programmes, providing guarantees and contributing to the registered capital of organizations, using its own capital and funds obtained on international and national financial markets as well as other available resources for this purpose; ¢ It advises the members of the Bank on questions of economic development, the effective use of resources, and the expansion of trade and economic ties and conducts information and analysis activities in the field of State and international finance; ¢ It cooperates with international organizations, States, national institutions and the economic entities of the member States of the Bank and other countries interested in financing economic development. A/62/194 EDB investment activities aim to modernize the energy, transport, communication and agro-industrial infrastructure, achieve structural improvements in the economies of member States and increase the output of high-technology products with high added value in non-commodity sectors. 4. The Bank’s registered capital consists of US$ 1.5 billion. The Bank is located in the city of Almaty, Republic of Kazakhstan. It is expected that, by the end of 2009, the value of the Bank’s investment project portfolio will exceed $3.5 billion and that of its assets will reach $5.5 billion. Accordingly, the Bank constitutes the largest integration project in our region in the financial and economic field. 5. We believe that powerful international institutions like the Eurasian Development Bank provide tangible assistance to socio-economic development and give further impetus to the processes of regional economic integration. Through its activities, the Bank is helping the countries in our region to achieve the Millennium Development Goals and is promoting their optimal inclusion in the world economy as full-fledged and advantageous partners. Thus, the activities of EDB as an international institution for promoting development are consonant with the purposes and principles of the United Nations in the socio-economic field. The Bank is one of the key regional partners of the United Nations system in our region. We are convinced that granting the Bank observer status in the General Assembly would help establish a firm basis for regular and well-organized cooperation between EDB and the United Nations in order to carry out the common and related tasks facing them. A/62/194 Annex IT [Original: Russian] Draft resolution submitted by Belarus, Kazakhstan, the Kyrgyz Republic, the Russian Federation, Tajikistan and Uzbekistan Observer status for the Eurasian Development Bank in the General Assembly The General Assembly, Noting the aspiration of the Eurasian Development Bank to develop its cooperation with the United Nations, 1. Decides to invite the Eurasian Development Bank to participate in the sessions and the work of the General Assembly in the capacity of observer; 2. Requests the Secretary-General to take the necessary action to implement the present resolution. 07-48868",08/23/2007,2007_606147,Kyrgyzstan,N/A,yes
