year,Council,Committee,Session,Agenda item,Agenda detail,cosponsored countries,body title number,body title detail,body text,date,file,filecountry,footnote,scanned
2012,General Assembly,N/A,Sixty-seventh session,121 (f),Cooperation between the United Nations and regional and other organizations: cooperation between the United Nations and the Collective Security Treaty Organization,"Armenia, Belarus, Kazakhstan, Kyrgyzstan, Russian Federation and Tajikistan",N/A,Cooperation between the United Nations and the Collective Security Treaty Organization,"The General Assembly, Having considered the report of the Secretary-General on cooperation between the United Nations and regional and other organizations, ! Referring to the Articles of the Charter of the United Nations that encourage measures for regional cooperation to advance the purposes and principles of the United Nations, Referring also to its resolution 59/50 of 2 December 2004, in which it granted the Collective Security Treaty Organization observer status in the General Assembly, Referring further to its resolutions 64/256 of 2 March 2010 and 65/122 of 13 December 2010 on cooperation between the United Nations and the Collective Security Treaty Organization and to its Declaration on the Enhancement of Cooperation between the United Nations and Regional Arrangements or Agencies in the Maintenance of International Peace and Security, 2 Referring to all previous relevant resolutions of the Security Council, including resolution 1631 (2005) of 17 October 2005, and the relevant statements by its President, including the statement of 13 January 2010,? which underline the importance of developing effective partnerships between the United Nations and regional and subregional organizations, in accordance with the Charter and the relevant statutes of regional and subregional organizations, 1 A/67/280-S/2012/614. 2 Resolution 49/57, annex. 3 S/PRST/2010/1. 12-58652 HN 141112 CAT A A Noting the twentieth anniversary of the signing of the Treaty on Collective Security and the tenth anniversary of the establishment of the Collective Security Treaty Organization, Noting with satisfaction that, during its existence, the Collective Security Treaty Organization has transformed into a multifunctional structure with the potential to provide an adequate response to a wide range of threats and challenges within the area of its responsibility, Welcoming the efforts of the States members of the Collective Security Treaty Organization to attain objectives consistent with the purposes and principles of the United Nations, Welcoming also the practical steps of the Collective Security Treaty Organization to implement the United Nations Global Counter-Terrorism Strategy, in particular through the joint ministerial plan of action adopted in Ashgabat on 30 November 2011 for the implementation of the Strategy in Central Asia, Acknowledging the importance of the efforts of the regional anti-drug operation, “Kanal”, of the Collective Security Treaty Organization to combat the smuggling of Afghan opiates and the cannabis group of drugs, cocaine and synthetic substances into the territory of the Eurasian region and to counter the activities of organized drug groups and their leaders, Welcoming the continuing role of the Collective Security Treaty Organization in implementing, during the period from 2009 to 2019, the Political Declaration and Plan of Action on International Cooperation towards an Integrated and Balanced Strategy to Counter the World Drug Problem,* adopted by the General Assembly at its sixty-fourth session,® Welcoming also the signing of the memorandum of understanding between the secretariat of the Collective Security Treaty Organization and the Department of Peacekeeping Operations, aimed at promoting more extensive and intensive cooperation in the maintenance of peace, including through encouraging the States members of the Collective Security Treaty Organization to make contributions to the peacekeeping operations of the United Nations, Noting the progress in developing the potential of the collective rapid reaction forces and the formation of peacekeeping forces of the Collective Security Treaty Organization, Welcoming the significance of the statement by the Secretary-General of the United Nations at the meeting of the Permanent Council of the Collective Security Treaty Organization, held in April 2011, with a view to further strengthening dialogue, cooperation and coordination between the United Nations and the Collective Security Treaty Organization, Noting the firm intention of both organizations to further strengthen existing cooperation by developing specific proposals in the priority areas of cooperation, 4 See Official Records of the Economic and Social Council, 2009, Supplement No. 8 (E/2009/28), chap. I, sect. C. S Resolution 64/182, para. 1. A/67/L.5 1. Takes note with appreciation of the report of the Secretary-General,' and acknowledges the development of mutually beneficial cooperation between the United Nations and the Collective Security Treaty Organization; 2. Notes with appreciation the significant contribution and efforts of the Collective Security Treaty Organization to strengthen the system of regional security and stability, to counter terrorism and transnational organized crime, illegal trafficking in drugs and weapons, and illegal migration and human trafficking, to combat natural and man-made disasters and to strengthen its peacekeeping capacities, which contribute to the attainment of the purposes and principles of the United Nations; 3. | Welcomes the efforts of the Secretariats of the United Nations and the Collective Security Treaty Organization to enhance coordination and cooperation in the areas of mutual interest and to develop concrete modalities for such cooperation, and encourages them to continue their collaboration, including the exchange of information; 4. Invites the Secretary-General of the United Nations to continue regular consultations with the Secretary-General of the Collective Security Treaty Organization, utilizing the appropriate inter-institutional forums and formats, including the annual consultations between the Secretary-General of the United Nations and the heads of regional organizations; 5. Invites the United Nations and the Collective Security Treaty Organization to continue their cooperation in the interest of consistent and comprehensive implementation of the United Nations Global Counter-Terrorism Strategy; 6. Invites increased cooperation and coordination among the specialized agencies and programmes of the United Nations system and the Collective Security Treaty Organization, as well as for the development of their direct contacts in areas of mutual interest; 7. Encourages both organizations to continue to examine possible ways to enhance their cooperation in the area of peacekeeping; 8. Requests the Secretary-General of the United Nations to submit to the General Assembly at its sixty-ninth session a report on the implementation of the present resolution; 9. Decides to include in the provisional agenda of its sixty-ninth session, under the item entitled “Cooperation between the United Nations and regional and other organizations”, the sub-item entitled “Cooperation between the United Nations and the Collective Security Treaty Organization”. 12-58652",11/12/2012,2012_737438,Kyrgyzstan,N/A,yes
2012,General Assembly,Third Committee,Sixty-seventh session,69 (b),"Promotion and protection of human rights: human rights questions, including alternative approaches for improving the effective enjoyment of human rights and fundamental freedoms","Albania, Algeria, Andorra, Angola, Argentina, Armenia, Australia, Austria, Belgium, Benin, Bolivia (Plurinational State of), Bosnia and Herzegovina, Brazil, Bulgaria, Burundi, Cambodia, Cape Verde, Chile, Colombia, Congo, Costa Rica, Cote d’Ivoire, Croatia, Cyprus, Czech Republic, Denmark, Ecuador, Estonia, Finland, France, Gabon, Georgia, Germany, Greece, Guinea-Bissau, Haiti, Honduras, Hungary, Iceland, Ireland, Israel, Italy, Kyrgyzstan, Latvia, Liechtenstein, Lithuania, Luxembourg, Mali, Malta, Marshall Islands, Mexico, Micronesia (Federated States of), Monaco, Mongolia, Montenegro, Mozambique, Netherlands, New Zealand, Norway, Palau, Panama, Paraguay, Philippines, Poland, Portugal, Republic of Moldova, Romania, Samoa, San Marino, Sao Tome and Principe, Serbia, Slovakia, Slovenia, Somalia, South Africa, Spain, Sweden, Switzerland, the former Yugoslav Republic of Macedonia, Timor-Leste, Turkey, Ukraine, United Kingdom of Great Britain and Northern Ireland, Uruguay and Vanuatu",N/A,Moratorium on the use of the death penalty,"The General Assembly, Guided by the purposes and principles contained in the Charter of the United Nations, Reaffirming the Universal Declaration of Human Rights,! the International Covenant on Civil and Political Rights? and the Convention on the Rights of the Child,? Reaffirming its resolutions 62/149 of 18 December 2007, 63/168 of 18 December 2008 and 65/206 of 21 December 2010 on the question of a 1 Resolution 217 A (IID). 2 See resolution 2200 A (XXI), annex. 3 United Nations, Treaty Series, vol. 1577, No. 27531. 12-59301 i 151112 CAT A A moratorium on the use of the death penalty, in which the General Assembly called upon States that still maintain the death penalty to establish a moratorium on executions with a view to abolishing it, Welcoming Human Rights Council decision 18/117 of 28 September 2011,4 Mindful that any miscarriage or failure of justice in the implementation of the death penalty is irreversible and irreparable, Convinced that a moratorium on the use of the death penalty contributes to respect for human dignity and to the enhancement and progressive development of human rights, and considering that there is no conclusive evidence of the deterrent value of the death penalty, Noting ongoing local and national debates and regional initiatives on the death penalty, as well as the readiness of an increasing number of Member States to make available to the public information on the use of the death penalty, Noting also the technical cooperation among Member States in relation to moratoriums on the death penalty, 1. Expresses its deep concern about the continued application of the death penalty; 2. Welcomes the report of the Secretary-General on the implementation of resolution 65/206° and the recommendations contained therein; 3. Also welcomes the steps taken by some Member States to reduce the number of offences for which the death penalty may be imposed and the decisions made by an increasing number of States, at all levels of Government, to apply a moratorium on executions, followed in many cases by the abolition of the death penalty; 4. Calls upon all States: (a) To respect international standards that provide safeguards guaranteeing protection of the rights of those facing the death penalty, in particular the minimum standards, as set out in the annex to Economic and Social Council resolution 1984/50 of 25 May 1984, as well as to provide the Secretary-General with information in this regard; (b) To make available relevant information with regard to their use of the death penalty, inter alia, the number of persons sentenced to death, the number of persons on death row and the number of executions carried out, which can contribute to possible informed and transparent national and international debates, including on the obligations of States pertaining to the use of the death penalty; (c) To progressively restrict the use of the death penalty and not to impose capital punishment for offences committed by persons below eighteen years of age and on pregnant women; (d) To reduce the number of offences for which the death penalty may be imposed; 4 See Official Records of the General Assembly, Sixty-sixth Session, Supplement No. 53A and corrigendum (A/66/53/Add.1 and Corr.1), chap. III. S A/65/280 and Corr.1. A/C.3/67/L.44/Rev.1 (e) To establish a moratorium on executions with a view to abolishing the death penalty; 5. Calls upon States which have abolished the death penalty not to reintroduce it, and encourages them to share their experience in this regard; 6. Also calls upon States that have not yet done so to consider acceding to or ratifying the Second Optional Protocol to the International Covenant on Civil and Political Rights, aiming at the abolition of the death penalty;® 7. Requests the Secretary-General to report to the General Assembly at its sixty-ninth session on the implementation of the present resolution; 8. | Decides to continue consideration of the matter at its sixty-ninth session under the item entitled “Promotion and protection of human rights”. 6 United Nations, Treaty Series, vol. 1642, No. 14668.",11/15/2012,2012_737644,Kyrgyzstan,N/A,yes
2012,General Assembly,N/A,Sixty-seventh session,121 (k),Cooperation between the United Nations and regional and other organizations: cooperation between the United Nations and the Eurasian Economic Community,"Belarus, Kazakhstan, Kyrgyzstan, Russian Federation and Tajikistan",N/A,Cooperation between the United Nations and the Eurasian Economic Community,"The General Assembly, Recalling its resolutions 58/84 of 9 December 2003, in which it granted the Eurasian Economic Community observer status in the General Assembly, 62/79 of 6 December 2007, 63/15 of 3 November 2008 and 65/125 of 13 December 2010, Recalling also that one of the purposes of the United Nations is to achieve international cooperation in solving international problems of an economic, social, cultural and humanitarian nature, Recalling further the Articles of the Charter of the United Nations that encourage activities through regional cooperation for the promotion of the purposes and principles of the United Nations, Taking note of the fact that the membership of the Eurasian Economic Community includes countries with economies in transition, and recalling in this regard its resolution 61/210 of 20 December 2006, in which it invited the United Nations system to enhance dialogue with and increase support to the regional and subregional cooperation organizations whose membership includes countries with economies in transition and whose efforts include assisting their members to fully integrate into the world economy, Recalling its resolution 64/208 of 21 December 2009, in which it invited the United Nations development system, in particular the funds and programmes, and at the regional level, in accordance with their respective mandates, to improve support, as appropriate, to middle-income countries, 12-59098 i 151112 CAT A A A Noting that the Treaty on the Establishment of the Eurasian Economic Community! reaffirms the commitment of the States members of the Community to the principles of the Charter and also to the generally accepted principles and norms of international law, Convinced that the strengthening of cooperation between the United Nations and other organizations of the United Nations system and the Eurasian Economic Community contributes to the promotion of the purposes and principles of the United Nations, Recognizing that the issues of water and energy resources management, as well as the development, dissemination and transfer of technologies, have particular importance for the sustainable development of the countries members of the Eurasian Economic Community, Recognizing also that the Eurasian Economic Community includes some landlocked countries, and in this regard underlining the key role of regional integration institutions such as the Eurasian Economic Community in the implementation of the Almaty Programme of Action: Addressing the Special Needs of Landlocked Developing Countries within a New Global Framework for Transit Transport Cooperation for Landlocked and Transit Developing Countries, ? Recognizing further the value of regional and subregional cooperation efforts in meeting the challenges of the global economic and financial crisis, and in this regard noting the creation within the Eurasian Economic Community of the Anti-crisis Fund as a useful contribution to the multilateral response to the crisis, Noting the progress achieved in the area of regional economic integration through the establishment of the Customs Union by Belarus, Kazakhstan and the Russian Federation, Noting with appreciation the activities of the Eurasian Development Bank in support of development and integration of the States members of the Eurasian Economic Community, 1. Takes note of the report of the Secretary-General on the implementation of General Assembly resolution 65/125,3 and expresses satisfaction with regard to the mutually beneficial interaction between the United Nations and the Eurasian Economic Community; 2. Also takes note of the activities of the States members of the Eurasian Economic Community in support of United Nations goals through the strengthening of regional cooperation in such areas as trade and economic development, the establishment of a customs union, energy, transport, agriculture and agro-industry, the regulation of migration, banking and finance, communications, education, health care and pharmaceuticals, biotechnology, environmental protection and natural disaster risk reduction; 1 United Nations, Treaty Series, vol. 2212, No. 39321. 2 Report of the International Ministerial Conference of Landlocked and Transit Developing Countries and Donor Countries and International Financial and Development Institutions on Transit Transport Cooperation, Almaty, Kazakhstan, 28 and 29 August 2003 (A/CONF.202/3), annex I. A/67/L.9 3. Recognizes efforts in strengthening regional economic integration within the Customs Union of Belarus, Kazakhstan and the Russian Federation, including through the single economic space launched on 1 January 2012, and notes the importance of ensuring that the regional integration efforts of the single economic space continue to be consistent with applicable international trading commitments; 4. Notes the beginning of operation of the Eurasian Economic Commission as a single permanent regulatory body of the Customs Union and the single economic space; 5. Also notes the aspiration of the States members of the Customs Union to elaborate the single codified document and, on that basis, to facilitate the establishment of the Eurasian Economic Union; 6. Notes with appreciation the progress achieved in cooperation between the Eurasian Economic Community and the Economic Commission for Europe, the Economic and Social Commission for Asia and the Pacific and the United Nations Development Programme, as well as the United Nations Industrial Development Organization, the United Nations Educational, Scientific and Cultural Organization, the International Atomic Energy Agency and the United Nations Conference on Trade and Development, including in the fields of water and energy resources management, the rehabilitation of territories affected by the uranium mining industry, energy efficiency, the development, dissemination and transfer of technologies, trade facilitation, transport, the environment, capacity-building, education, science and innovation, biotechnology and nanotechnology and investment promotion; 7. Welcomes the promotion of effective interaction within the framework of the United Nations Special Programme for the Economies of Central Asia; 8. Emphasizes the importance of strengthening dialogue, cooperation and coordination between the United Nations system and the Eurasian Economic Community; 9. Invites the specialized agencies and other organizations, programmes and funds of the United Nations system, as well as international financial institutions, to further enhance cooperation and direct contacts with the Eurasian Economic Community for the purpose of undertaking joint implementation of programmes to achieve their goals; 10. Requests the Secretary-General to submit to the General Assembly at its sixty-ninth session a report on the implementation of the present resolution; 11. Decides to include in the provisional agenda of its sixty-ninth session the sub-item entitled “Cooperation between the United Nations and the Eurasian Economic Community”. 12-59098",11/14/2012,2012_737650,Kyrgyzstan,N/A,yes
