year,Council,Committee,Session,Agenda item,Agenda detail,cosponsored countries,body title number,body title detail,body text,date,file,filecountry,footnote,scanned
2012,Commonwealth Of Independent States,Commission On Human Rights,Nineteenth session,10,Technical assistance and capacity-building,"Albania , Australia’, Austria, Azerbaijan , Bangladesh, Barbados , Benin, Bosnia and Herzegovina , Botswana, Brazil’, Burkina Faso, Cameroon, Cape Verde , Chad*, Chile, Congo, Céte d’Ivoire , Croatia , Cuba, Cyprus , Denmark’, Djibouti, Dominican Republic , Ecuador, Finland , France , Germany , Georgia , Greece , Honduras , Hungary, India, Indonesia, Ireland’, Italy, Kyrgyzstan, Lebanon’, Libya, Lithuania’ , Luxembourg’, Malaysia, Maldives, Mali 7 Malta’ » Mauritania, Matritius, Mexico, Montenegro , Morocco , Nepal , Netherlands , Nicaragua , Nigeria, Norway, Palestine*, Peru, Philippines, Poland, Portugal , Romania, Russian Federation, Saint Kitts and Nevis"", Saudi Arabia, Senegal (on behalf of the African Group), Singapore , Slovenia , Solomon Islands , Spain, Sri Lanka , Sudan’, Sweden , Switzerland, Thailand, Tunisia , Turkey , Turkmenistan , Uganda, United Kingdom of Great Britain and Northern Ireland , United States of America, Venezuela (Bolivarian Republic of), Viet Nam’, Yemen",N/A,19/... Terms of reference for the Voluntary Technical Assistance Trust,"Fund to Support the Participation of Least Developed Countries and Small Island Developing States in the work of the Human Rights Council The Human Rights Council, Recalling its resolution 16/21 of 25 March 2011 and the outcome of the review of the work and functioning of the Human Rights Council annexed thereto, and in particular paragraph 62 thereof, Recalling also General Assembly resolution 65/281 of 17 June 2011 on the review of the Human Rights Council, 1. Decides to establish the Voluntary Technical Assistance Trust Fund to Support the Participation of Least Developed Countries and Small Island Developing States in the work of the Human Rights Council; 2. Also decides that the Trust Fund will support activities designed to enhance the institutional and human capacity of Least Developed Countries and Small Island ” Non-Member State of the Human Rights Council. Please reeyele OO GE.12-12050 A/HRC/19/L.6 Developing States, to enable their delegations to participate more fully in the work of the Human Rights Council, upon their request, and to encourage their effective and informed participation in consultative and decision-making processes, including negotiation sessions; 3. Requests the Office of the United Nations High Commissioner for Human Rights to make arrangements for the operationalization of the Trust Fund; 4. Decides that the Trust Fund will be used to support the participation of Least Developed Countries and Small Island Developing States in the work of the Human Rights Council by providing funding for: (a) Training and capacity-building, including e-Learning. In partnership with the Office of the High Commissioner and the United Nations Institute for Training and Research and/or relevant academic/training institutions, the Trust Fund will support the development of, and the participation of Least Developed Countries and Small Island Developing States in, targeted training courses for officials on the international human rights system, international human rights law and the rules and functioning of the Human Rights Council and its mechanisms; (b) Travel and accommodation for Government officials to participate in Human Rights Council sessions. The Trust Fund will help Least Developed Countries and Small Island Developing States, represented or not represented in Geneva, to participate in Council sessions or to bring in supplementary support; (c) Fellowship programmes. Such programmes will cover subsistence costs to allow officials of Least Developed Countries and Small Island Developing States to undertake three-month work placements in their respective delegations to the Human Rights Council; (d) Induction training. The Trust Fund will support the organization, by the Office of the High Commissioner, of induction training sessions for diplomats from Least Developed Countries and Small Island Developing States assigned to cover the sessions of the Human Rights Council and the multilateral human rights system. Training sessions will be organized to coincide with the main periods of arrival and departure from Geneva. During the sessions, diplomats will receive focused, practical training on the work procedure of the Council and its mechanisms.",03/15/7012,2012_725222,Kyrgyzstan,N/A,yes
2012,General Assembly,N/A,Sixty-sixth session,12,Global road safety crisis,"Albania, Algeria, Andorra, Argentina, Australia, Bahrain, Barbados, Belarus, China, Cuba, Egypt, Estonia, France, Germany, Greece, Iceland, Ireland, Israel, Jamaica, Japan, Jordan, Kazakhstan, Kuwait, Lithuania, Luxembourg, Mexico, Monaco, Montenegro, Oman, Peru, Portugal, Republic of Moldova, Romania, Russian Federation, Saudi Arabia, Serbia, Singapore, Slovenia, Sri Lanka, Switzerland, Tajikistan, Ukraine, United Arab Emirates, United States of America, Uruguay and Uzbekistan",N/A,Improving global road safety,"Addendum Add the following countries to the list of sponsors of the resolution: Austria, Azerbaijan, Bangladesh, Belgium, Bosnia and Herzegovina, Brazil, Bulgaria, Croatia, Cyprus, Czech Republic, Democratic People’s Republic of Korea, Dominican Republic, Ecuador, Finland, Honduras, Hungary, India, Italy, Kyrgyzstan, Latvia, Lebanon, Malaysia, Malta, Mongolia, Morocco, Nicaragua, Panama, Poland, Qatar, San Marino, Spain, Sudan, Syrian Arab Republic, Thailand, the former Yugoslav Republic of Macedonia, Turkmenistan, United Kingdom of Great Britain and Northern Ireland, Venezuela (Bolivarian Republic of) and Viet Nam 12-30190 iT 230412 CA TY A A",04/19/2012,2012_725470,Kyrgyzstan,N/A,yes
2012,Economic And Social Council,Commission On Human Rights,Fifty-fifth session,6 (a),Implementation of the Political Declaration and Plan of Action on International Cooperation towards an Integrated and Balanced Strategy to Counter the World Drug Problem: demand reduction and related measures,"Burkina Faso, Georgia, Kyrgyzstan, Thailand, Turkmenistan and Ukraine:",N/A,"Promoting programmes aimed at the treatment, rehabilitation and reintegration of drug-dependent persons released from prison settings","The Commission on Narcotic Drugs, Recalling the Political Declaration adopted by the General Assembly at its twentieth special session! and the Political Declaration and Plan of Action on International Cooperation towards an Integrated and Balanced Strategy to Counter the World Drug Problem,? Recalling also the Single Convention on Narcotic Drugs of 1961 as amended by the 1972 Protocol? and, in particular, the need to assist drug abusers, to the extent possible, in their rehabilitation and social reintegration, Recalling further the Salvador Declaration on Comprehensive Strategies for Global Challenges: Crime Prevention and Criminal Justice Systems and Their Development in a Changing World,+ adopted by the Twelfth United Nations Congress on Crime Prevention and Criminal Justice, in which Member States expressed their conviction of the importance of preventing youth crime and supporting the rehabilitation of young offenders and their reintegration into society, 2 See Official Records of the Economic and Social Council, 2009, Supplement No. 8 (E/2009/28), chap. I, sect. C. Please reeyele & including efforts to prevent their revictimization, as well as of, in general, addressing the treatment of prisoners, Considering that in prison settings in many countries of the world there are a significant number of drug-dependent persons and that the need for treatment, care, rehabilitation, social reintegration and related support services aimed at promoting health and social well-being among individuals, families and communities is common all over the world, Concerned that drug-dependent persons released from prison settings are at high risk of relapse or reoffending unless provided with appropriate continued treatment, care, rehabilitation, social reintegration and related support services, Considering that such a situation may lead to high levels of drug-related crime, Stressing the importance of a multisectoral and fully coordinated approach in which multiple government agencies and non-governmental organizations within communities participate in order to support the development of a full continuum of policies and programmes that promote prevention, early detection and intervention, treatment, care, rehabilitation, social reintegration and related support services, Bearing in mind that the United Nations Office on Drugs and Crime, acting within its mandate, can play an important role in addressing the strategies focusing on the treatment, care, rehabilitation and social reintegration of persons released from prison settings, 1. Invites Member States to develop, implement and enhance measures, as appropriate, facilitating continued treatment, care, rehabilitation, social reintegration and related support services for drug-dependent persons being released from prison settings; 2. Also invites Member States to consider, as appropriate, developing or strengthening regulatory frameworks for the implementation of the measures mentioned above; 3. Calls upon Member States to consider, where appropriate and in accordance with national legislation, developing and implementing pre-release and post-release programmes aimed at preventing relapse and reoffending; 4. Encourages Member States to integrate those measures addressing the specific needs of drug-dependent persons released from prison settings into comprehensive national strategies on drug demand reduction; 5. Recommends that Member States ensure that service providers have access to the training and acquire the skills necessary to work with drug-dependent persons in pre-release and post-release programmes, in order to assist their treatment, care, rehabilitation, social reintegration and related support services; 6. Urges the United Nations Office on Drugs and Crime, in cooperation with the World Health Organization, to collect and disseminate information on relevant experiences of evidence-based treatment, rehabilitation and reintegration programmes and measures, subject to the availability of extrabudgetary resources; 7. Requests the United Nations Office on Drugs and Crime to include rehabilitation- and reintegration-oriented modules for drug-dependent persons being V.12-51670 released from prison settings in its relevant technical assistance and training programmes that are aimed at promoting health and social well-being among individuals, families and communities; 8. Invites Member States and other donors to provide extrabudgetary resources for those purposes in accordance with the rules and procedures of the United Nations; 9. Requests the United Nations Office on Drugs and Crime to report to the Commission, at its fifty-seventh session, on the implementation of the present resolution.",03/14/2012,2012_734632,Kyrgyzstan,N/A,yes
2012,Economic And Social Council,Commission On Human Rights,Fifty-fifth session,6,Implementation of the Political Declaration and Plan of Action on International Cooperation towards an Integrated and Balanced Strategy to Counter the World Drug Problem,"Australia, Belarus, France, Kyrgyzstan, Norway, Russian Federation and Thailand",N/A,Follow-up to the Third Ministerial Conference of the Paris Pact Partners on Combating Illicit Traffic in Opiates Originating in Afghanistan,"The Commission on Narcotic Drugs, Reaffirming the commitments undertaken by Member States in the Political Declaration and Plan of Action on International Cooperation towards an Integrated and Balanced Strategy to Counter the World Drug Problem,! in which Member States recognized that action against the world drug problem was a common and shared responsibility and expressed their conviction that it must be addressed in a multilateral setting, Welcoming the Paris Pact initiative, one of the most important frameworks in the fight against opiates originating in Afghanistan and aimed at the reduction of illicit traffic in opiates, including opium poppy cultivation and production and global consumption of heroin and other opiates, and at the establishment of a broad international coalition to combat illicit traffic in opiates, Welcoming also the international conferences of the Paris Pact partners at the ministerial level, held in Paris in 2003 and in Moscow in 2006, and looking forward to future such ministerial meetings on a regular basis, ! Official Records of the Economic and Social Council, 2009, Supplement No. 8 (E/2009/28), chap. I, sect. C. Please reeyele & Taking note with concern of the report of the United Nations Office on Drugs and Crime entitled Afghanistan: Opium Survey 2011, in which it was stated that, despite the continued efforts of the Government of Afghanistan and the international community, in 2011, following a decrease in previous years, caused mostly by plant disease, estimated opium production there had significantly increased, Noting with concern that the number of poppy-free provinces in the country decreased from 20 in 2010 to 17 in 2011 following increases in previous years, and acknowledging the strong link between lack of security and opium poppy cultivation, Noting also the report of the International Narcotics Control Board for 2011, on precursors and chemicals frequently used in the illicit manufacture of narcotic drugs and psychotropic substances,? in which the Board stressed the need to implement the tools of precursor control provided by the international system of controls more comprehensively within countries and at the global level and emphasized that the diversion of some chemicals, such as acetic anhydride, from domestic distribution channels — with subsequent cross-border smuggling — had become the most common method of obtaining precursor chemicals for use in the illicit manufacture of drugs, including heroin, Aware of the need to enhance coordinated, comprehensive and effective measures to reduce the cultivation of opium poppy and the production of, trafficking in and consumption of opiates, and noting that Paris Pact partners, in the Vienna Declaration adopted by the Third Ministerial Conference of the Paris Pact Partners on Combating Illicit Traffic in Opiates Originating in Afghanistan,? recognized the threat they pose to international peace and stability in different regions of the world, Acknowledging the principle of full respect for the sovereignty and territorial integrity of States and the principle of non-intervention in the internal affairs of States, Noting that the sustained menace of illicit drugs adversely affects the social, economic, cultural and political foundations of society and undermines sustainable development, Recalling Economic and Social Council resolution 2007/11 of 25 July 2007, entitled “Support to the counter-narcotics measures and programmes of Afghanistan”, Welcoming the ongoing efforts of the Government of Afghanistan in the fight against narcotic drugs, Commending the activities carried out by the States neighbouring Afghanistan to promote cooperation aimed at countering the illicit traffic in opiates and the smuggling of their precursor chemicals into Afghanistan, Expressing its support for the efforts of Member States aimed at strengthening international and regional cooperation in order to counter the threat to the 2 Precursors and Chemicals Frequently Used in the Illicit Manufacture of Narcotic Drugs and Psychotropic Substances: Report of the International Narcotics Control Board for 2011 on the Implementation of Article 12 of the United Nations Convention against Illicit Traffic in Narcotic Drugs and Psychotropic Substances of 1988 (United Nations publication, Sales No. E.12.XI.4). V.12-51745 international community posed by illicit traffic in opiates, paying due attention to strengthening and implementing regional initiatives to combat illicit traffic in opiates, detecting and blocking financial flows linked thereto, preventing the diversion of precursor chemicals used in illicit manufacturing of opiates in Afghanistan and reducing drug abuse and dependence through a comprehensive approach, Acknowledging the importance of a regional approach in tackling the illicit cultivation of opium poppy and the production of and trafficking in opiates originating in Afghanistan, Supporting the United Nations Office on Drugs and Crime in its efforts to coordinate effective and results-oriented assistance to Afghanistan and neighbouring countries, including through its regional programme for Afghanistan and neighbouring countries, Bearing in mind the outcomes of the international conferences on Afghanistan held in Istanbul, Turkey, in November 2011 and in Bonn, Germany, in December 2011, which included counter-narcotics as a cross-cutting theme, Recalling its resolution 54/7 of 25 March 2011, in which it welcomed the decision taken by the reconvened meeting of the Paris Pact Policy Consultative Group, held in Vienna on 17 March 2011, to convene in Vienna in the second half of 2011, in continuation of the Paris Pact initiative, an international conference at the ministerial level, and encouraged that conference to contribute to strengthening the commitment of Member States to combating the illicit trade in opiates, Convinced that the results of the Third Ministerial Conference of the Paris Pact Partners on Combating Illicit Traffic in Opiates Originating in Afghanistan, held in Vienna on 16 February 2012, should be translated into effective action by States, the United Nations Office on Drugs and Crime, competent organs of the United Nations and other relevant actors, 1. Takes note with appreciation of the report of the Executive Director of the United Nations Office on Drugs and Crime on the Paris Pact initiative;+ 2. Welcomes the outcome of the Third Ministerial Conference of the Paris Pact Partners on Combating Illicit Traffic in Opiates Originating in Afghanistan, facilitated by the United Nations Office on Drugs and Crime in cooperation with the Governments of Austria, France and the Russian Federation, in continuation of the Paris Pact initiative; 3. Expresses its satisfaction with the spirit of international solidarity and cooperation that made the preparations for the Conference and the Conference itself a success; 4. Calls upon Member States, in cooperation with the United Nations Office on Drugs and Crime, the International Narcotics Control Board and other competent international organizations, to promote the full implementation of the Vienna Declaration adopted by the Conference,> including, as appropriate, by means of facilitating partnerships with the private sector and civil society; 4 E/CN.7/2012/10. 5 See E/CN.7/2012/17. V.12-51745 5. Calls upon the international community, including the Government of Afghanistan, to continue those efforts while making them more comprehensive, effective and results-oriented; 6. Encourages Member States to enhance coordination through existing regional mechanisms, including through the Paris Pact initiative, in order to strengthen cross-border cooperation and information exchange with a view to countering trafficking in opiates originating in Afghanistan; 7. Notes the importance of taking measures to ensure effective follow-up to the Conference; 8. Takes note with appreciation of the initiative of the Executive Director of the United Nations Office on Drugs and Crime to prepare a compendium of concrete ideas and proposals, aimed at strengthening the Paris Pact initiative and implementing the Vienna Declaration, expressed by Paris Pact partners at the Conference, which may be used by the United Nations Office on Drugs and Crime in its programme activities in consultation with Member States; 9. | Welcomes the third phase of the Paris Pact and the operational outcome it is to deliver, and also welcomes the intention of Paris Pact partners to discuss the modalities of a fourth phase at their next Policy Consultative Group meeting after due evaluation of the third phase; 10. Requests the United Nations Office on Drugs and Crime to continue to cooperate with Member States in identifying and meeting the needs for technical assistance, including in the priority areas mentioned in the Vienna Declaration; 11. Expresses its appreciation to the United Nations Office on Drugs and Crime for the work done in the preparations for and facilitation of the organization of the Conference; 12. Expresses its gratitude to the Governments of Austria and the Russian Federation for providing the extrabudgetary resources and facilities that were necessary to convene the Conference; 13. Requests the Executive Director of the United Nations Office on Drugs and Crime to report to the Commission at its fifty-sixth session on the measures taken and on progress achieved in the implementation of the present resolution; 14. Invites Member States and other donors to contribute extrabudgetary resources for these purposes in accordance with the rules and regulations of the United Nations.",03/15/2012,2012_734686,Kyrgyzstan,N/A,yes
2012,General Assembly,Sixth Committee,Sixty-seventh session,166,Observer status for the Cooperation Council of Turkic-speaking States in the General Assembly,"Azerbaijan, Kazakhstan, Kyrgyzstan and Turkey",N/A,Observer status for the Cooperation Council of Turkic-speaking States in the General Assembly,"The General Assembly, Wishing to promote cooperation between the United Nations and the Cooperation Council of Turkic-speaking States, 1. Decides to invite the Cooperation Council of Turkic-speaking States to participate in the sessions and the work of the General Assembly in the capacity of observer; 2. Requests the Secretary-General to take the necessary action to implement the present resolution. 12-53135 HH 051012 CA AT A A",10/04/2012,2012_735497,Kyrgyzstan,N/A,yes
