year,Council,Committee,Session,Agenda item,Agenda detail,cosponsored countries,body title number,body title detail,body text,date,file,filecountry,footnote,scanned
2010,General Assembly,N/A,Sixty-fourth session,70 (a),"Strengthening of the coordination of humanitarian and disaster relief assistance of the United Nations, including special economic assistance: strengthening of the coordination of emergency humanitarian assistance","Australia, Brazil, Cameroon, Chile, Colombia, Dominican Republic, Japan, Kazakhstan, Norway, Peru, Philippines, Saint Vincent and the Grenadines, Spain and Uruguay",N/A,"Humanitarian assistance, emergency relief and rehabilitation for Haiti in response to the devastating effects of the earthquake in that country","Addendum Add the following countries to the list of sponsors of the resolution: Albania, Algeria, Andorra, Antigua and Barbuda, Argentina, Armenia, Austria, Azerbaijan, Bahamas, Bangladesh, Barbados, Belarus, Belgium, Belize, Benin, Bosnia and Herzegovina, Bulgaria, Burkina Faso, Burundi, Cambodia, Canada, Central African Republic, Comoros, Congo, Costa Rica, Croatia, Cuba, Cyprus, Czech Republic, Denmark, Ecuador, Egypt, El] Salvador, Eritrea, Estonia, Finland, France, Gambia, Georgia, Germany, Ghana, Greece, Grenada, Guatemala, Guyana, Haiti, Honduras, Hungary, Iceland, India, Indonesia, Iran (Islamic Republic of), Ireland, Israel, Italy, Jamaica, Jordan, Lao People’s Democratic Republic, Latvia, Lebanon, Liechtenstein, Lithuania, Luxembourg, Madagascar, Malta, Mauritius, Mexico, Monaco, Mongolia, Montenegro, Morocco, Nepal, Netherlands, New Zealand, Nigeria, Pakistan, Panama, Papua New Guinea, Poland, Portugal, Republic of Korea, Republic of Moldova, Romania, Russian Federation, Rwanda, Saint Lucia, San Marino, Senegal, Serbia, Seychelles, Singapore, Slovakia, Slovenia, South Africa, Sudan, Suriname, Sweden, Switzerland, Thailand, the former Yugoslav Republic of Macedonia, Tonga, Trinidad and Tobago, Tunisia, Turkey, Turkmenistan, Ukraine, United Kingdom of Great Britain and Northern Ireland, United Republic of Tanzania, United States of America, Viet Nam, Yemen and Zambia 10-21729 Hi 260110 CNY A A",01/22/2010,2010_675700,Madagascar,N/A,yes
2010,General Assembly,N/A,Sixty-fourth session,N/A,United Nations Avea/..61,"Afghanistan, Cambodia, Canada, Congo, Costa Rica, El Salvador, Fiji, Honduras, Ireland, Japan, Jordan, Kazakhstan, Madagascar, Malawi, Mali, Marshall Islands, Mexico, Micronesia (Federated States of), Mongolia, Nauru, Nepal, Nigeria, Norway, Palau, Papua New Guinea, Philippines, Samoa, Senegal, Slovenia, Switzerland, Thailand, Tonga, Tuvalu, United Republic of Tanzania, United States of America and Vanuatu",N/A,Follow-up to paragraph 143 on human security of the 2005 World Summit Outcome,"The General Assembly, Reaffirming its respect for all the purposes and principles of the Charter of the United Nations, Recalling the 2005 World Summit Outcome,! especially paragraph 143 thereof, 1. Takes note of the first formal debate organized by the President of the General Assembly on 20 and 21 May 2010, in which different views on the notion of human security were presented by Member States, including on the report of the Secretary-General;? 2. Also takes note of the ongoing efforts to define the notion of human security, and recognizes the need to continue the discussion and to achieve an agreement on the definition thereof in the General Assembly; 1 See resolution 60/1. 2 A/64/701. 10-45105 Hil 150710 CACY A AA A 3. Requests the Secretary-General to seek the views of the Member States on the notion of human security, including on a possible definition thereof, and to submit a report to the General Assembly at its sixty-sixth session; 4. Decides to continue its consideration of the notion of human security. 10-45105",07/14/2010,2010_686224,Madagascar,N/A,yes
2010,General Assembly,N/A,Sixty-fourth session,48,"Integrated and coordinated implementation of and follow-up to the outcomes of the major United Nations conferences and summits in the economic, social and related fields","Antigua and Barbuda, Bahrain, Bangladesh, Benin, Bolivia (Plurinational State of), Central African Republic, Congo, Cuba, Dominica, Dominican Republic, Ecuador, El Salvador, Fiji, Georgia, Madagascar, Nicaragua, Paraguay, Saint Lucia, Saint Vincent and the Grenadines, Samoa, Saudi Arabia, Serbia, Seychelles, Solomon Islands, Sri Lanka, Tuvalu, United Republic of Tanzania, Uruguay, Vanuatu, Venezuela (Bolivarian Republic of), Yemen",N/A,The human right to water and sanitation,"The General Assembly, Recalling its resolutions 54/175 of 17 December 1999, on the right to development, 55/196 of 20 December 2000, proclaiming 2003 as the International Year of Freshwater, 58/217 of 23 December 2003, proclaiming the International Decade for Action, “Water for Life” (2005-2015), 59/228 of 22 December 2004, 61/192 of 20 December 2006, proclaiming 2008 as the International Year of Sanitation, and 64/198 of 21 December 2009, regarding the midterm comprehensive review of the implementation of the International Decade for Action, “Water for Life”, Agenda 21 of June 1992,! the Habitat Agenda of 1996,2 the Mar del Plata Action Plan of 1977, adopted by the United Nations Water Conference, and the Rio Declaration on Environment and Development of June 1992,3 Recalling also the Universal Declaration of Human Rights,4 the International Covenant on Economic, Social and Cultural Rights,® the International Covenant on 1 Report of the United Nations Conference on Environment and Development, Rio de Janeiro, 3-14 June 1992, vol. I, Resolutions Adopted by the Conference (United Nations publication, Sales No. E.93.1.8 and corrigendum), resolution 1, annex II. 2 Report of the United Nations Conference on Human Settlements (Habitat II), Istanbul, 3-14 June 1996 (United Nations publication, Sales No. E.97.IV.6), chap. I, resolution 1, annex II. 3 Report of the United Nations Conference on Environment and Development, Rio de Janeiro, 3-14 June 1992, vol. I, Resolutions Adopted by the Conference (United Nations publication, Sales No. E.93.1.8 and corrigendum), resolution 1, annex I. 10-46108 Hil 230710 UA AA A Civil and Political Rights,’ the International Convention on the Elimination of All Forms of Racial Discrimination, ® the Convention on the Elimination of All Forms of Discrimination against Women,’ the Convention on the Rights of the Child,® the Convention on the Rights of Persons with Disabilities? and the Geneva Convention relative to the Protection of Civilian Persons in Time of War of 12 August 1949, 1° Recalling further all previous resolutions of the Human Rights Council on “human rights and access to safe drinking water and sanitation”, including Council resolutions 7/22 of 28 March 2008 and 12/8 of 1 October 2009, related to the human right to safe and clean drinking water and sanitation, General Comment No. 15 (2002) of the Committee on Economic, Social and Cultural Rights on the right to water (articles 11 and 12 of the International Covenant on Economic, Social and Cultural Rights),!! the report of the United Nations High Commissioner for Human Rights on the scope and content of the relevant human rights obligations related to equitable access to safe drinking water and sanitation under international human rights instruments, !? as well as the report of the independent expert on the issue of human rights obligations related to access to safe drinking water and sanitation, !3 Deeply concerned that approximately 884 million people lack access to safe drinking water and that more than 2.6 billion do not have access to basic sanitation, and alarmed that approximately 1.5 million children under 5 years of age die and 443 million school days are lost each year as a result of water- and sanitation-related diseases, Acknowledging the importance of equitable, safe and clean drinking water and sanitation as an integral component of the realization of human rights, Reaffirming the responsibility of States for the promotion and protection of all human rights, which are universal, indivisible, interdependent and interrelated, and must be treated globally, in a fair and equal manner, on the same footing and with the same emphasis, Bearing in mind the commitment made by the international community to fully achieve the Millennium Development Goals, and stressing, in that context, the resolve of heads of State and Government, as expressed in the United Nations Millennium Declaration,!4 to halve, by 2015, the proportion of people unable to reach or afford safe drinking water, and to halve the proportion of people without access to basic sanitation, as agreed in the Plan of Implementation of the World Summit on Sustainable Development (“Johannesburg Plan of Implementation”), 15 11 See Official Records of the Economic and Social Council, 2003, Supplement No. 2 (E/2003/22), annex IV. 15 Report of the World Summit on Sustainable Development, Johannesburg, South Africa, 26 August-4 September 2002 (United Nations publication, Sales No. E.03.11.A.1 and corrigendum), chap. I, resolution 2, annex. A/64/L.63 1. Declares the right to safe and clean drinking water and sanitation as a human right that is essential for the full enjoyment of the right to life; 2. Calls upon States and international organizations to provide financial resources, capacity-building and technology transfer, through international assistance and cooperation, in particular to developing countries, in order to scale up efforts to provide safe, clean, accessible and affordable water and sanitation for all; 3. Welcomes the decision by the Human Rights Council to request that the independent expert on the issue of human rights obligations related to access to safe drinking water and sanitation present an annual report to the General Assembly, 1© and invites the independent expert, in consultation with all relevant United Nations agencies, funds and programmes, to include in her report to the Assembly, at its sixty-sixth session, the principal challenges related to the realization of the human right to water and sanitation and their impact on the achievement of the Millennium Development Goals. 16 See Human Rights Council resolution 12/8.",07/22/2010,2010_686926,Madagascar,N/A,yes
2010,General Assembly,N/A,Sixty-fourth session,48,"Integrated and coordinated implementation of and follow-up to the outcomes of the major United Nations conferences and summits in the economic, social and related fields","Antigua and Barbuda, Bahrain, Bangladesh, Benin, Bolivia (Plurinational State of), Burundi, Central African Republic, Congo, Cuba, Dominica, Dominican Republic, Ecuador, El Salvador, Fiji, Georgia, Haiti, Madagascar, Mauritius, Nicaragua, Nigeria, Paraguay, Saint Lucia, Saint Vincent and the Grenadines, Samoa, Saudi Arabia, Serbia, Seychelles, Solomon Islands, Sri Lanka, Tuvalu, Uruguay, Vanuatu, Venezuela (Bolivarian Republic of) and Yemen",N/A,The human right to water and sanitation,"The General Assembly, Recalling its resolutions 54/175 of 17 December 1999, on the right to development, 55/196 of 20 December 2000, proclaiming 2003 as the International Year of Freshwater, 58/217 of 23 December 2003, proclaiming the International Decade for Action, “Water for Life” (2005-2015), 59/228 of 22 December 2004, 61/192 of 20 December 2006, proclaiming 2008 as the International Year of Sanitation, and 64/198 of 21 December 2009, regarding the midterm comprehensive review of the implementation of the International Decade for Action, “Water for Life”, Agenda 21 of June 1992,! the Habitat Agenda of 1996,2 the Mar del Plata Action Plan of 19773 adopted by the United Nations Water Conference, and the Rio Declaration on Environment and Development of June 1992,4 1 Report of the United Nations Conference on Environment and Development, Rio de Janeiro, 3-14 June 1992, vol. I, Resolutions Adopted by the Conference (United Nations publication, Sales No. E.93.1.8 and corrigendum), resolution 1, annex II. 2 Report of the United Nations Conference on Human Settlements (Habitat II), Istanbul, 3-14 June 1996 (United Nations publication, Sales No. E.97.IV.6), chap. I, resolution 1, annex II. 3 Report of the United Nations Water Conference, Mar del Plata, 14-25 March 1977 (United Nations publication, Sales No. E.77.1I.A.12), chap. I. 4 Report of the United Nations Conference on Environment and Development, Rio de Janeiro, 3-14 June 1992, vol. I, Resolutions Adopted by the Conference (United Nations publication, Sales No. E.93.1.8 and corrigendum), resolution 1, annex I. 10-46464* ill 270710 CAT A A A a Recalling also the Universal Declaration of Human Rights,®° the International Covenant on Economic, Social and Cultural Rights,® the International Covenant on Civil and Political Rights,° the International Convention on the Elimination of All Forms of Racial Discrimination,” the Convention on the Elimination of All Forms of Discrimination against Women,® the Convention on the Rights of the Child,° the Convention on the Rights of Persons with Disabilities !° and the Geneva Convention relative to the Protection of Civilian Persons in Time of War of 12 August 1949, 11 Recalling further all previous resolutions of the Human Rights Council on “human rights and access to safe drinking water and sanitation”, including Council resolutions 7/22 of 28 March 2008 and 12/8 of 1 October 2009, related to the human right to safe and clean drinking water and sanitation, General Comment No. 15 (2002) of the Committee on Economic, Social and Cultural Rights, on the right to water (articles 11 and 12 of the International Covenant on Economic, Social and Cultural Rights)12 and the report of the United Nations High Commissioner for Human Rights on the scope and content of the relevant human rights obligations related to equitable access to safe drinking water and sanitation under international human rights instruments,!° as well as the report of the independent expert on the issue of human rights obligations related to access to safe drinking water and sanitation, 14 Deeply concerned that approximately 884 million people lack access to safe drinking water and that more than 2.6 billion do not have access to basic sanitation, and alarmed that approximately 1.5 million children under 5 years of age die and 443 million school days are lost each year as a result of water- and sanitation-related diseases, Acknowledging the importance of equitable, safe and clean drinking water and sanitation as an integral component of the realization of all human rights, Reaffirming the responsibility of States for the promotion and protection of all human rights, which are universal, indivisible, interdependent and interrelated, and must be treated globally, in a fair and equal manner, on the same footing and with the same emphasis, Bearing in mind the commitment made by the international community to fully achieve the Millennium Development Goals, and stressing, in that context, the resolve of Heads of State and Government, as expressed in the United Nations Millennium Declaration,!5 to halve, by 2015, the proportion of people unable to reach or afford safe drinking water, and to halve the proportion of people without 12 See Official Records of the Economic and Social Council, 2003, Supplement No. 2 (E/2003/22), annex IV. A/64/L.63/Rev.1 access to basic sanitation, as agreed in the Plan of Implementation of the World Summit on Sustainable Development (“Johannesburg Plan of Implementation”), 16 1. Declares the right to safe and clean drinking water and sanitation as a human right that is essential for the full enjoyment of life and all human rights; 2. Calls upon States and international organizations to provide financial resources, capacity-building and technology transfer, through international assistance and cooperation, in particular to developing countries, in order to scale up efforts to provide safe, clean, accessible and affordable drinking water and sanitation for all; 3. Welcomes the decision by the Human Rights Council to request that the independent expert on the issue of human rights obligations related to access to safe drinking water and sanitation present an annual report to the General Assembly, 1” and encourages her to continue working on all aspects of her mandate and, in consultation with all relevant United Nations agencies, funds, and programmes, to include in her report to the Assembly, at its sixty-sixth session, the principal challenges related to the realization of the human right to safe and clean drinking water and sanitation and their impact on the achievement of Millennium Development Goals. 16 Report of the World Summit on Sustainable Development, Johannesburg, South Africa, 26 August-4 September 2002 (United Nations publication, Sales No. E.03.11.A.1 and corrigendum), chap. I, resolution 2, annex.",07/26/2010,2010_686927,Madagascar,* Reissued for technical reasons on 27 July 2010.,yes
2010,General Assembly,First Committee,Sixty-fifth session,98 (d),Review and implementation of the Concluding Document,"Afghanistan, Angola, Bangladesh, Bhutan, Chile, Cuba, Democratic Republic of the Congo, Egypt, El Salvador, Haiti, India, Indonesia, Madagascar, Malaysia, Mauritius, Myanmar, Nepal, Nicaragua, Sri Lanka, Trinidad and Tobago, Viet Nam and Zambia",N/A,Convention on the Prohibition of the Use of Nuclear Weapons,"The General Assembly, Convinced that the use of nuclear weapons poses the most serious threat to the survival of mankind, Bearing in mind the advisory opinion of the International Court of Justice of 8 July 1996 on the Legality of the Threat or Use of Nuclear Weapons, 1 Convinced that a multilateral, universal and binding agreement prohibiting the use or threat of use of nuclear weapons would contribute to the elimination of the nuclear threat and to the climate for negotiations leading to the ultimate elimination of nuclear weapons, thereby strengthening international peace and security, Conscious that some steps taken by the Russian Federation and the United States of America towards a reduction of their nuclear weapons and the improvement in the international climate can contribute towards the goal of the complete elimination of nuclear weapons, Recalling that paragraph 58 of the Final Document of the Tenth Special Session of the General Assembly,? states that all States should actively participate in efforts to bring about conditions in international relations among States in which a code of peaceful conduct of nations in international affairs could be agreed upon and that would preclude the use or threat of use of nuclear weapons, 1 A/51/218, annex; see also Legality of the Threat or Use of Nuclear Weapons, Advisory Opinion, I.C.J. Reports 1996, p. 226. 2 See resolution S-10/2. 10-58507 HN 181010 TOU TIL ILL Reaffirming that any use of nuclear weapons would be a violation of the Charter of the United Nations and a crime against humanity, as declared in its resolutions 1653 (XVI) of 24 November 1961, 33/71 B of 14 December 1978, 34/83 G of 11 December 1979, 35/152 D of 12 December 1980 and 36/92 I of 9 December 1981, Determined to achieve an international convention prohibiting the development, production, stockpiling and use of nuclear weapons, leading to their ultimate destruction, Stressing that an international convention on the prohibition of the use of nuclear weapons would be an important step in a phased programme towards the complete elimination of nuclear weapons, with a specified framework of time, Noting with regret that the Conference on Disarmament, during its 2010 session, was unable to undertake negotiations on this subject as called for in General Assembly resolution 64/59 of 2 December 2009, 1. Reiterates its request to the Conference on Disarmament to commence negotiations in order to reach agreement on an international convention prohibiting the use or threat of use of nuclear weapons under any circumstances; 2. Requests the Conference on Disarmament to report to the General Assembly on the results of those negotiations. 10-58507",10/15/2010,2010_692024,Madagascar,N/A,yes
