year,Council,Committee,Session,Agenda item,Agenda detail,cosponsored countries,body title number,body title detail,body text,date,file,filecountry,footnote,scanned
2019,General Assembly,N/A,Seventy-third session,128 (j),Cooperation between the United Nations and regional and other organizations: cooperation between the United Nations and the International Organization of la Francophonie,"Andorra, Armenia, Austria, Belgium, Benin, Bosnia and Herzegovina, Bulgaria, Canada, Céte d’Ivoire, Estonia, France, Ireland, Lebanon, Monaco, North Macedonia, Norway, Qatar, Romania, Slovakia, Slovenia, Switzerland and Tunisia",N/A,Cooperation between the United Nations and the International Organization of la Francophonie,"Addendum Add the following countries to the list of sponsors of the resolution: Comoros, Croatia, Cyprus, Finland, Greece, Guinea, Latvia, Liechtenstein, Lithuania, Luxembourg, Madagascar, Malta, Mauritius, Morocco, Poland, Portugal, Samoa, Senegal, Serbia, Sweden, Thailand and Togo "" "" = — Please recycle OQ . ch 19-06363 Hi 170419 AT A A A AT",04/15/2019,2019_3800310,Madagascar,N/A,yes
2019,General Assembly,Commission On Human Rights,Seventy-third session,74,Promotion and protection of human rights,"Albania, Angola, Argentina, Armenia, Australia, Austria, Belgium, Bosnia and Herzegovina, Brazil, Bulgaria, Cabo Verde, Canada, Chile, Croatia, Cyprus, Czechia, Denmark, El Salvador, Estonia, Finland, France, Georgia, Germany, Greece, Hungary, Iceland, Ireland, Italy, Latvia, Lebanon, Lithuania, Luxembourg, Malta, Mongolia, Montenegro, Netherlands, New Zealand, North Macedonia, Norway, Paraguay, Poland, Portugal, Republic of Moldova, Romania, San Marino, Slovakia, Slovenia, Spain, Sweden, Ukraine and United Kingdom of Great Britain and Northern Ireland",N/A,"Towards torture-free trade: examining the feasibility, scope and parameters for possible common international standards","Addendum Add the following countries to the list of sponsors of the resolution: Colombia, Ecuador, Honduras, Liechtenstein, Madagascar, Mexico, Panama, Serbia, Switzerland, Turkey and Uruguay a or Please recycle OQ h 19-11076 Hi 030719 CA TT A A",06/28/2019,2019_3811716,Madagascar,N/A,yes
2019,General Assembly,N/A,Seventy-third session,127,Multilingualism,"Bolivia (Plurinational State of), Dominican Republic, Equatorial Guinea, France, Greece, Hungary, Lebanon, Malta, Morocco, Palau, Philippines, Republic of Moldova, Romania and Russian Federation",N/A,Multilingualism,"Addendum Add the following countries to the list of sponsors of the resolution: Albania, Andorra, Argentina, Armenia, Austria, Bangladesh, Belgium, Benin, Bulgaria, Burkina Faso, Burundi, Cabo Verde, Cameroon, Canada, Central African Republic, Chad, Chile, Colombia, Comoros, Congo, Costa Rica, Cote d’Ivoire, Croatia, Czechia, Democratic Republic of the Congo, Ecuador, El Salvador, Gabon, Guinea, Haiti, Honduras, Indonesia, Jordan, Libya, Liechtenstein, Lithuania, Luxembourg, Madagascar, Mauritania, Mexico, Monaco, Montenegro, Nicaragua, Nigeria, North Macedonia, Panama, Paraguay, Senegal, Serbia, Slovenia, South Sudan, Spain, Sudan, Switzerland, Syrian Arab Republic, Thailand, Togo, Uruguay, Uzbekistan and Viet Nam 19-15856 1 180919 A A A",09/16/2019,2019_3827603,Madagascar,N/A,yes
2019,General Assembly,N/A,Seventy-third session,15,Culture of peace,"Afghanistan, Armenia, Benin, Equatorial Guinea, Hungary, Kuwait, Lebanon, Morocco, Poland, Suriname and Venezuela (Bolivarian Republic of)",N/A,Academy for Human Encounters and Dialogue,"Addendum Add the following countries to the list of sponsors of the resolution: Albania, Algeria, Andorra, Angola, Antigua and Barbuda, Argentina, Austria, Azerbaijan, Bahamas, Bahrain, Bangladesh, Barbados, Belarus, Belgium, Belize, Bhutan, Bolivia (Plurinational State of), Bosnia and Herzegovina, Botswana, Brazil, Brunei Darussalam, Bulgaria, Burkina Faso, Burundi, Cabo Verde, Cambodia, Cameroon, Canada, Central African Republic, Chad, Chile, China, Colombia, Comoros, Congo, Costa Rica, Croatia, Cuba, Cyprus, Czechia, Cote d’Ivoire, Democratic People’s Republic of Korea, Democratic Republic of the Congo, Denmark, Djibouti, Dominica, Dominican Republic, Ecuador, Egypt, El Salvador, Eritrea, Estonia, Eswatini, Ethiopia, Fiji, Finland, France, Gabon, Gambia, Germany, Ghana, Greece, Grenada, Guatemala, Guinea, Guinea- Bissau, Guyana, Haiti, Honduras, Iceland, India, Indonesia, Iran (Islamic Republic of), Iraq, Ireland, Italy, Jamaica, Japan, Jordan, Kazakhstan, Kenya, Kiribati, Kyrgyzstan, Lao People’s Democratic Republic, Latvia, Lesotho, Liberia, Libya, Liechtenstein, Lithuania, Luxembourg, Madagascar, Malawi, Malaysia, Maldives, Mali, Malta, Mauritania, Mauritius, Mexico, Monaco, Mongolia, Montenegro, Mozambique, Myanmar, Namibia, Nepal, Netherlands, New Zealand, Nicaragua, Niger, Nigeria, North Macedonia, Norway, Oman, Pakistan, Palau, Panama, Papua New Guinea, Paraguay, Peru, Philippines, Portugal, Qatar, Republic of Korea, Republic of Moldova, Romania, Rwanda, Saint Kitts and Nevis, Saint Lucia, Saint Vincent and the Grenadines, San Marino, Sao Tome and Principe, Saudi Arabia, Senegal, Serbia, Seychelles, Sierra Leone, Singapore, Slovakia, Slovenia, Somalia, South Africa, South Sudan, Spain, Sri Lanka, Sudan, Sweden, Switzerland, Syrian Arab Republic, Thailand, Timor-Leste, Togo, Trinidad and Tobago, Tunisia, Turkey, Turkmenistan, Uganda, United Arab Emirates, United Republic of Tanzania, Uruguay, Uzbekistan, Vanuatu, Viet Nam, Yemen, Zambia, Zimbabwe and State of Palestine Please recycle eS 19-15852 1 041019 A A",09/16/2019,2019_3829881,Madagascar,N/A,yes
2019,General Assembly,First Committee,Seventy-fourth session,98 (ee),General and complete disarmament: humanitarian consequences of nuclear weapons,"Algeria, Andorra, Angola, Antigua and Barbuda, Austria, Bahamas, Bolivia (Plurinational State of), Brazil, Cabo Verde, Chile, Colombia, Costa Rica, Céte d’Ivoire, Democratic Republic of the Congo, Dominican Republic, Egypt, Eritrea, Eswatini, Gambia, Ghana, Guatemala, Guinea-Bissau, Guyana, Indonesia, Iraq, Ireland, Jamaica, Libya, Liechtenstein, Madagascar, Malawi, Malta, Mexico, Myanmar, Namibia, Nepal, New Zealand, Nigeria, North Macedonia, Paraguay, Peru, Philippines, Republic of Moldova, Saint Vincent and the Grenadines, Samoa, San Marino, Singapore, South Africa, Suriname, Sweden, Switzerland, Thailand, Uganda, Uruguay, Vanuatu and Viet Nam",N/A,Humanitarian consequences of nuclear weapons,"The General Assembly, Recalling its resolutions 70/47 of 7 December 2015, 71/46 of 5 December 2016, 72/30 of 4 December 2017 and 73/47 of 5 December 2018, Reiterating the deep concern about the catastrophic consequences of nuclear weapons, Stressing that the immense and uncontrollable destructive capability and indiscriminate nature of nuclear weapons cause unacceptable humanitarian consequences, as has been demonstrated through their past use and testing, Recalling that concern about the humanitarian consequences of nuclear weapons has been reflected in numerous United Nations resolutions, including the first resolution adopted by the General Assembly, on 24 January 1946, Recalling also that at the first special session of the General Assembly devoted to disarmament, in 1978, the Assembly stressed that nuclear weapons posed the greatest danger to mankind and to the survival of civilization, ! Welcoming the renewed interest and resolve of the international community, together with the International Committee of the Red Cross and international ' See resolution S-10/2. 8 Please recycle 19-17529 vit 231019 A AA humanitarian organizations, to address the catastrophic consequences of nuclear weapons, Recalling that the 2010 Review Conference of the Parties to the Treaty on the Non-Proliferation of Nuclear Weapons expressed deep concern at the catastrophic humanitarian consequences of any use of nuclear weapons,” Noting the resolution of 26 November 2011 of the Council of Delegates of the International Red Cross and Red Crescent Movement entitled “Working towards the elimination of nuclear weapons”, Recalling the joint statements on the humanitarian consequences of nuclear weapons delivered to the General Assembly and during the 2010-2015 cycle of the review of the Treaty on the Non-Proliferation of Nuclear Weapons, Welcoming the facts-based discussions on the effects of a nuclear weapon detonation that were held at the conferences on the humanitarian impact of nuclear weapons, convened by Norway, on 4 and 5 March 2013, Mexico, on 13 and 14 February 2014, and Austria, on 8 and 9 December 2014, Cognizant that a key message from experts and international organizations at those conferences was that no State or international body could address the immediate humanitarian emergency caused by a nuclear weapon detonation or provide adequate assistance to victims, Firmly believing that it is in the interest of all States to engage in discussions on the humanitarian consequences of nuclear weapons with the aim of further broadening and deepening the understanding of this matter, and welcoming civil society’s ongoing engagement, Reaffirming the role of civil society, in partnership with Governments, in raising awareness about the unacceptable humanitarian consequences of nuclear weapons, Emphasizing that the catastrophic consequences of nuclear weapons affect not only Governments but each and every citizen of our interconnected world and have deep implications for human survival, for the environment, for socioeconomic development, for our economies and for the health of future generations, 1. Stresses that it is in the interest of the very survival of humanity that nuclear weapons never be used again, under any circumstances; 2. Emphasizes that the only way to guarantee that nuclear weapons will never be used again is their total elimination; 3. Stresses that the catastrophic effects of a nuclear weapon detonation, whether by accident, miscalculation or design, cannot be adequately addressed; 4. Expresses its firm belief that awareness of the catastrophic consequences of nuclear weapons must underpin all approaches and efforts towards nuclear disarmament; 5. Calls upon all States, in their shared responsibility, to prevent the use of nuclear weapons, to prevent their vertical and horizontal proliferation and to achieve nuclear disarmament; 6. Urges States to exert all efforts to totally eliminate the threat of these weapons of mass destruction; 2 See 2010 Review Conference of the Parties to the Treaty on the Non-Proliferation of Nuclear Weapons, Final Document, vol. | (NPT/CONF.2010/50 (Vol. I)), part I, Conclusions and recommendations for follow-on actions. 2/3 7. Decides to include in the provisional agenda of its seventy-fifth session, under the item entitled “General and complete disarmament”, the sub-item entitled “Humanitarian consequences of nuclear weapons”. 19-17529 3/3",10/21/2019,2019_3833255,Madagascar,N/A,yes
2019,General Assembly,First Committee,Seventy-fourth session,98 (y),General and complete disarmament: the Arms Trade Treaty,"Angola, Antigua and Barbuda, Argentina, Australia, Austria, Bahamas, Belgium, Belize, Bosnia and Herzegovina, Botswana, Bulgaria, Canada, Chile, China, Croatia, Cyprus, Czechia, Denmark, Dominican Republic, El Salvador, Estonia, Finland, France, Georgia, Germany, Ghana, Greece, Guinea-Bissau, Guyana, Hungary, Iceland, Ireland, Italy, Jamaica, Japan, Kazakhstan, Latvia, Liechtenstein, Lithuania, Luxembourg, Madagascar, Malawi, Malta, Mexico, Montenegro, Netherlands, New Zealand, Nigeria, North Macedonia, Norway, Paraguay, Peru, Philippines, Poland, Portugal, Republic of Korea, Republic of Moldova, Romania, Saint Kitts and Nevis, Samoa, San Marino, Serbia, Slovakia, Slovenia, South Africa, Spain, Suriname, Sweden, Switzerland, Thailand, Trinidad and Tobago and Uruguay",N/A,The Arms Trade Treaty,"The General Assembly, Recalling its resolutions 61/89 of 6 December 2006, 63/240 of 24 December 2008, 64/48 of 2 December 2009, 67/234 A of 24 December 2012, 67/234 B of 2 April 2013, 68/31 of 5 December 2013, 69/49 of 2 December 2014, 70/58 of 7 December 2015, 71/50 of S December 2016, 72/44 of 4 December 2017 and 73/36 of 5 December 2018 and its decision 66/518 of 2 December 2011, Recognizing that disarmament, arms control and non-proliferation are essential for the maintenance of international peace and security, Recognizing also the security, social, economic and humanitarian consequences of the illicit and unregulated trade in conventional arms, Recognizing further the legitimate political, security, economic and commercial interests of States in the international trade in conventional arms, Underlining the urgent need to prevent and eradicate the illicit trade in conventional arms and to prevent their diversion to the illicit market, or for unauthorized end use and end users, including the commission of terrorist acts, thereby preventing the exacerbation of armed violence and the violation of international humanitarian law and international human rights law, OR ao 472 Please recycle OQ ol 19-18102 1 221019 A TA Emphasizing the responsibility of all States, in accordance with their respective international obligations, to effectively regulate the international trade in conventional arms, Recalling the contribution made by the Programme of Action to Prevent, Combat and Eradicate the Illicit Trade in Small Arms and Light Weapons in All Its Aspects,! as well as the Protocol against the Illicit Manufacturing of and Trafficking in Firearms, Their Parts and Components and Ammunition, supplementing the United Nations Convention against Transnational Organized Crime,” and the International Instrument to Enable States to Identify and Trace, in a Timely and Reliable Manner, Illicit Small Arms and Light Weapons, Highlighting the relevance of the Arms Trade Treaty,’ including its links and synergies with other relevant instruments on conventional arms, to efforts to meet Sustainable Development Goal 16 of the 2030 Agenda for Sustainable Development, ° and specifically target 16.4, which aims at significantly reducing illicit arms flows by 2030, Recalling the Secretary-General’s disarmament agenda, Securing Our Common Future: An Agenda for Disarmament, in particular the section of the agenda entitled “Disarmament that saves lives”, Recognizing the negative impact of the illicit and unregulated trade in conventional arms and related ammunition on the lives of women, men, girls and boys, and that the Arms Trade Treaty was the first international agreement to identify and call upon States to address the link between conventional arms transfers and the risk of serious acts of gender-based violence and serious acts of violence against women and children, Recognizing also the important role that civil society organizations, including non-governmental organizations, and industry play, by raising awareness, in efforts to prevent and eradicate the illicit and unregulated trade in conventional arms, including in preventing their diversion, and in supporting the implementation of the Treaty, Recalling the adoption by the General Assembly and the entry into force of the Treaty on 2 April 2013 and 24 December 2014, respectively, and noting that the Treaty remains open for accession by any State that has not signed it, Welcoming the latest ratifications of and accessions to the Treaty, bearing in mind that the universalization of the Treaty is essential to achieving its object and purpose, Noting the efforts by the States parties to the Treaty to continue to explore ways and means to enhance national implementation of the Treaty through the working group on effective treaty implementation and the voluntary trust fund for the implementation of the Treaty, 1. | Welcomes the decisions taken at the Fifth Conference of States Parties to the Arms Trade Treaty, held in Geneva from 26 to 30 August 2019, and notes that the Sixth Conference of States Parties will be held in Geneva from 17 to 21 August 2020; ' Report of the United Nations Conference on the Illicit Trade in Small Arms and Light Weapons in All Its Aspects, New York, 9-20 July 2001 (A/CONF.192/15), chap. IV, para. 24. ? United Nations, Treaty Series, vol. 2326, No. 39574. > Resolution 70/1. 2/4 2. Also welcomes the progress made by the standing working groups on effective treaty implementation, on transparency and reporting, and on universalization in advancing the object and purpose of the Arms Trade Treaty; * 3. Recognizes that the consolidation of the institutional structure of the Treaty provides a framework for supporting further work under the Treaty, in particular its effective implementation, in this regard welcomes the efforts undertaken at the Fifth Conference of States Parties to address the Treaty’s financial situation, expresses concern about the unpaid assessed contributions of States and the potential adverse implications that this has for the Treaty processes, and calls upon States that have not yet done so to address their financial obligations under the Treaty in a prompt and timely manner; 4. Calls upon all States that have not yet done so to ratify, accept, approve or accede to the Treaty, in accordance with their respective constitutional processes, in order to achieve its universalization; 5. Calls upon all States parties to submit and encourages them to make available, in a timely manner, and to update, as appropriate, their initial report, as well as their annual report for the preceding calendar year, as required under article 13 of the Treaty, thereby enhancing confidence, transparency, trust and accountability, and notes the endorsement by the Second Conference of States Parties of templates that may facilitate the reporting; 6. Calls upon those States parties in a position to do so to provide assistance, including legal or legislative assistance, institutional capacity-building and technical, material or financial assistance, to requesting States in order to promote the implementation and universalization of the Treaty; 7. Stresses the vital importance of the full and effective implementation of and compliance with all provisions of the Treaty by States parties, and urges States parties to meet their obligations under the Treaty, thereby contributing to international and regional peace, security and stability, to the reduction of human suffering and to the promotion of cooperation, transparency and responsible action; 8. Recognizes the complementarity among all relevant international instruments on conventional arms and the Treaty, and to this end urges all States to implement effective national measures to prevent, combat and eradicate the illicit and unregulated trade in conventional arms and ammunition in fulfilment of their respective international obligations and commitments; 9. Also recognizes the added value of the adoption in June 2018 of the report of the third United Nations Conference to Review Progress Made in the Implementation of the Programme of Action to Prevent, Combat and Eradicate the Illicit Trade in Small Arms and Light Weapons in All Its Aspects,° including the outcome document annexed thereto, and acknowledges synergies between the Programme of Action and the Treaty; 10. Encourages further steps to enable States to increasingly prevent and tackle the diversion of conventional arms and ammunition to unauthorized end uses and end users, and recognizes that enhancing reporting rates, transparency and information sharing, in line with Treaty obligations, are fundamental measures to achieve this goal; 11. Welcomes the adoption of action-oriented decisions on gender and gender- based violence and the fact that States parties agreed to review progress on these two aspects on an ongoing basis, and in that respect encourages States parties and ® A/CONF.192/2018/RC/3. 3/4 signatory States to ensure the full and equal participation of women and men in pursuing the object and purpose of the Treaty; 12. Also welcomes the successful operationalization of the voluntary trust fund for the implementation of the Treaty, encourages eligible States to make best use of the voluntary trust fund, and encourages all States parties in a position to do so to contribute to the voluntary trust fund; 13. Encourages States parties and signatory States in a position to do so to provide funding to the Treaty sponsorship programme to support participation in meetings under the Treaty for those States that would otherwise be unable to attend; 14. Encourages States parties to strengthen their cooperation with civil society, including non-governmental organizations, industry and_ relevant international organizations and to work with other States parties at the national and regional levels, and invites those stakeholders, in particular those that are underrepresented in Treaty processes, to engage further with States parties with the aim of ensuring the effective implementation and universalization of the Treaty; 15. Decides to include in the provisional agenda of its seventy-fifth session, under the item entitled “General and complete disarmament”, the sub-item entitled “The Arms Trade Treaty”, and to review the implementation of the present resolution at that session. 19-18102 4/4",10/21/2019,2019_3833260,Madagascar,* See resolution 67/234 B.,yes
