year,Council,Committee,Session,Agenda item,Agenda detail,cosponsored countries,body title number,body title detail,body text,date,file,filecountry,footnote,scanned
2019,General Assembly,First Committee,Seventy-fourth session,96 (c),Prevention of an arms race in outer space: further practical measures for the prevention of an arms race in outer space,"Algeria, Angola, Armenia, Belarus, Bolivia (Plurinational State of), Burundi, China, Cuba, Egypt, Eritrea, Iran (Islamic Republic of), Kazakhstan, Kyrgyzstan, Lao People’s Democratic Republic, Madagascar, Myanmar, Nicaragua, Russian Federation, South Africa, Suriname, Syrian Arab Republic, Tajikistan and Venezuela (Bolivarian Republic of)",N/A,Further practical measures for the prevention of an arms race in outer space,"The General Assembly, Recalling its resolutions 71/31 and 71/32 of 5 December 2016, 71/90 of 6 December 2016, 72/250 of 24 December 2017, 73/6 of 26 October 2018, 73/91 of 7 December 2018 and its decision 73/512 of 5 December 2018, as well as its other resolutions and decisions on this subject, Recognizing the catastrophic consequences of the weaponization of outer space or any military conflicts in outer space and that the prevention of an arms race in outer space would avert a grave danger for international peace and security, Emphasizing the importance of article IV of the Treaty on Principles Governing the Activities of States in the Exploration and Use of Outer Space, including the Moon and Other Celestial Bodies, ! Bearing in mind that all Member States, in particular those with major space capabilities, should contribute actively to the prevention of an arms race in outer space with a view to promoting and strengthening international cooperation in the exploration and use of outer space for peaceful purposes, with the objective of shaping a community of shared future for humankind, Recognizing that, while the existing international treaties related to outer space and the legal regime provided for therein play a positive role in regulating outer space activities, they are unable to fully prevent the placement of weapons in outer space ' United Nations, Treaty Series, vol. 610, No. 8843. Oe Ao ar Please recycle OQ ol 19-18906 1 011119 A A A and therefore avert an arms race there, and that there is a need to consolidate and reinforce this regime, Expressing serious concern over the plans declared by certain States that include the placement of weapons, in particular strike combat systems, in outer space, Convinced that further measures should be examined in the search for effective and verifiable bilateral and multilateral agreements in order to prevent the weaponization of outer space and, as a consequence, an arms race in outer space, Welcoming, in this regard, the treaty on the prevention of the placement of weapons in outer space and of the threat or use of force against outer space objects, introduced by China and the Russian Federation at the Conference on Disarmament in 2008,” and the submission of its updated version in 2014,° Stressing the importance of the political statements made by a number of States* that they would not be the first to place weapons in outer space, Recognizing the primary role and responsibility of the Conference on Disarmament in the negotiation of a multilateral agreement or agreements on the prevention of an arms race in outer space, 1. Welcomes the deliberations held in 2018 and 2019 by the Group of Governmental Experts on Further Practical Measures for the Prevention of an Arms Race in Outer Space, which is tasked with considering and making recommendations on substantial elements of an international legally binding instrument on the prevention of an arms race in outer space, including, inter alia, on the prevention of the placement of weapons in outer space; 2. Emphasizes that the work of the Group of Governmental Experts has constituted an important contribution to international efforts to conclude the above- mentioned international legally binding instrument; 3. Expresses regret that, due to the position of one expert, consensus could not be reached on the final report of the Group of Governmental Experts; 4. Recommends that the work of the Group of Governmental Experts be taken into account in the search for further practical measures for the prevention of an arms race in outer space, in particular in the course of future negotiations at the Conference on Disarmament on the international legally binding instrument in this regard; 5. Requests the former Chair of the Group of Governmental Experts to report to the relevant multilateral forums, including the First Committee, the Conference on Disarmament, the Disarmament Commission and the Committee on the Peaceful Uses of Outer Space, on the work done by the Group; 6. Urges the international community to continue its efforts aimed at preventing an arms race, including the placement of weapons, in outer space, with a view to maintaining international peace and strengthening global security; 7. Decides to include in the provisional agenda of its seventy-fifth session, under the item entitled “Prevention of an arms race in outer space”, the sub-item entitled “Further practical measures for the prevention of an arms race in outer space”. 2 See CD/1839. 4 Argentina, Armenia, Belarus, Bolivia (Plurinational State of), Brazil, Cambodia, Cuba, Ecuador, Guatemala, Indonesia, Kazakhstan, Kyrgyzstan, Nicaragua, Pakistan, the Russian Federation, Sri Lanka, Suriname, Tajikistan, Uruguay, Uzbekistan, Venezuela (Bolivarian Republic of) and Viet Nam. 2/2",10/31/2019,2019_3834536,Madagascar,N/A,yes
2019,General Assembly,Third Committee,Seventy-fourth session,107,Countering the use of information and communications technologies for criminal purposes,"Algeria, Angola, Azerbaijan, Belarus, Bolivia (Plurinational State of), Burundi, Cambodia, China, Cuba, Democratic People’s Republic of Korea, Egypt, Eritrea, Iran (Islamic Republic of), Kazakhstan, Lao People’s Democratic Republic, Libya, Madagascar, Myanmar, Nicaragua, Russian Federation, Sudan, Suriname, Syrian Arab Republic, Tajikistan, Uzbekistan, Venezuela (Bolivarian Republic of) and Zimbabwe",N/A,Countering the use of information and communications technologies for criminal purposes,"The General Assembly, Noting that information and communications technologies, while having enormous potential for the development of States, create new opportunities for perpetrators and may contribute to a rise in the levels and complexity of crime, Noting also the potential risk of the misuse of emerging technologies, including artificial intelligence, while recognizing their potential in preventing and combating the use of information and communications technologies for criminal purposes, Concerned by the increase in the rate and diversity of crimes committed in the digital world and their impact on the stability of critical infrastructure of States and enterprises and on the well-being of individuals, Recognizing that diverse criminals, including traffickers in persons, are taking advantage of information and communications technologies to carry out criminal activities, Stressing the need to enhance coordination and cooperation among States in combating the use of information and communications technologies for criminal purposes, including by providing technical assistance to developing countries, upon their request, to improve national legislation and frameworks and build the capacity of national authorities to deal with such use in all its forms, including its prevention, detection, investigation and prosecution, and emphasizing in this context the role that the United Nations, in particular the Commission on Crime Prevention and Criminal Justice, plays, 19-19206 Hi 111119 CA TT A A Recalling Commission on Crime Prevention and Criminal Justice resolution 22/8 of 26 April 2013,! in which the Commission welcomed the efforts of the United Nations Office on Drugs and Crime in fulfilling its mandate to provide technical assistance and capacity-building on cybercrime, Noting the work carried out by the Commission on Crime Prevention and Criminal Justice under the auspices of an open-ended intergovernmental expert group which was established to conduct a comprehensive study of the problem of cybercrime and responses to it by Member States, the international community and the private sector, Recalling its resolution 65/230 of 21 December 2010, in which the General Assembly endorsed the Salvador Declaration on Comprehensive Strategies for Global Challenges: Crime Prevention and Criminal Justice Systems and Their Development in a Changing World, Recalling also the Doha Declaration on Integrating Crime Prevention and Criminal Justice into the Wider United Nations Agenda to Address Social and Economic Challenges and to Promote the Rule of Law at the National and International Levels, and Public Participation,” adopted at the Thirteenth United Nations Congress on Crime Prevention and Criminal Justice, held in Doha from 12 to 19 April 2015, Noting the discussions held during the first to fifth meetings of the open-ended intergovernmental expert group, held in Vienna from 17 to 21 January 2011, 25 to 28 February 2013, 10 to 13 April 2017, 3 to 5 April 2018 and 27 to 29 March 2019, reaffirming the importance of the study and the need to further enhance international discussion on and cooperation against cybercrime, Noting also the importance of the international and regional instruments in the fight against cybercrime and the ongoing efforts to examine options to strengthen existing and propose new national and international legal or other responses to the use of information and communications technologies for criminal purposes, Recalling its resolutions 53/70 of 4 December 1998, 54/49 of 1 December 1999, 55/28 of 20 November 2000, 56/19 of 29 November 2001, 57/53 of 22 November 2002, 58/32 of 8 December 2003, 59/61 of 3 December 2004, 60/45 of 8 December 2005, 61/54 of 6 December 2006, 62/17 of 5 December 2007, 63/37 of 2 December 2008, 64/25 of 2 December 2009, 65/41 of 8 December 2010, 66/24 of 2 December 2011, 66/181 of 19 December 2011, 67/27 of 3 December 2012, 68/193 of 18 December 2013, 68/243 of 27 December 2013, 69/28 of 2 December 2014, 70/237 of 23 December 2015, 71/28 of 5 December 2016, 72/196 of 19 December 2017, 73/27 of 5 December 2018 and 73/187 of 17 December 2018, Recalling also the reports of the Group of Governmental Experts on Developments in the Field of Information and Telecommunications in the Context of International Security,’ which is of the view that States should consider how best to cooperate to prosecute the criminal use of information and communication technologies, Taking note of Commission on Crime Prevention and Criminal Justice resolution 26/4 of 26 May 2017,* in which the Commission expressed appreciation for the work done by the Expert Group to Conduct a Comprehensive Study on Cybercrime and requested the Expert Group to continue its work, with a view to examining options to ' See Official Records of the Economic and Social Council, 2013, Supplement No. 10 (E/2013/30), chap. I, sect. D. ? Resolution 70/174, annex. chap. I, sect. D. 2/3 strengthen existing responses and propose new national and international legal or other responses to cybercrime, and in this regard reaffirming the role of the United Nations Office on Drugs and Crime, Taking note also of Economic and Social Council resolution 2019/19 of 23 July 2019 entitled “Promoting technical assistance and capacity-building to strengthen national measures and international cooperation to combat cybercrime, including information-sharing”, adopted on the recommendation of the Commission on Crime Prevention and Criminal Justice, Recognizing the role of the open-ended intergovernmental Expert Group to Conduct a Comprehensive Study on Cybercrime as an important platform for exchanging information on national legislation, best practices, technical assistance and international cooperation, with a view to examining options to strengthen existing responses and to proposing new national and international legal or other responses to cybercrime, Reaffirming the importance of respect for human rights and fundamental freedoms in the use of information and communications technologies, 1. Takes note of the report of the Secretary-General,> which was prepared pursuant to resolution 73/187; 2. Decides to establish an open-ended ad hoc intergovernmental committee of experts, representative of all regions, to elaborate a comprehensive international convention on countering the use of information and communications technologies for criminal purposes, taking into full consideration existing international instruments and efforts at the national, regional and international levels on combating the use of information and communications technologies for criminal purposes, in particular the work and outcomes of the open-ended intergovernmental Expert Group to Conduct a Comprehensive Study of Cybercrime; 3. Also decides that the ad hoc committee shall convene a three-day organizational session in August 2020, in New York, in order to agree on an outline and modalities for its further activities, to be submitted to the General Assembly at its seventy-fifth session for its consideration and approval; 4. Requests the Secretary General to allocate the necessary resources in order to organize and support the work of the ad hoc committee within the United Nations programme budget; 5. Invites donor countries to provide assistance to the United Nations in ensuring the active engagement of developing countries in the work of the ad hoc committee, including by covering travel costs and accommodation expenses; 6. Decides to examine the question at its seventy-fifth session under the item entitled “Countering the use of information and communications technologies for criminal purposes”. 5 A/74/130. 3/3",11/05/2019,2019_3835168,Madagascar,N/A,yes
2019,General Assembly,N/A,Seventy-fourth session,11,Sport for development and peace: building a peaceful and better world through sport and the Olympic ideal,"Antigua and Barbuda, Armenia, Australia, Austria, Bangladesh, Brazil, Chile, China, Dominican Republic, Ecuador, Equatorial Guinea, Finland, Israel, Jamaica, Japan, Kenya, Lao People’s Democratic Republic, Latvia, Lebanon, Lithuania, Malaysia, Monaco, New Zealand, Nicaragua, Norway, Palau, Panama, Paraguay, Romania, Russian Federation, Samoa, Spain, Sri Lanka, Tunisia, Turkey, United Arab Emirates, United Kingdom of Great Britain and Northern Ireland and Uruguay",N/A,Building a peaceful and better world through sport and the Olympic ideal,"Addendum Add the following countries to the list of sponsors of the resolution: Afghanistan, Albania, Algeria, Andorra, Angola, Argentina, Azerbaijan, Bahamas, Bahrain, Barbados, Belarus, Belgium, Belize, Benin, Bhutan, Bolivia (Plurinational State of), Bosnia and Herzegovina, Botswana, Brunei Darussalam, Bulgaria, Burkina Faso, Burundi, Cabo Verde, Cambodia, Cameroon, Canada, Central African Republic, Chad, Colombia, Comoros, Congo, Costa Rica, Céte d’Ivoire, Croatia, Cuba, Cyprus, Czechia, Denmark, Djibouti, Egypt, El Salvador, Eritrea, Estonia, Ethiopia, Fiji, France, Gabon, Gambia, Georgia, Germany, Ghana, Greece, Grenada, Guatemala, Guinea, Guinea-Bissau, Guyana, Haiti, Honduras, Hungary, Iceland, India, Indonesia, Iraq, Ireland, Italy, Jordan, Kazakhstan, Kiribati, Kuwait, Kyrgyzstan, Lesotho, Liberia, Libya, Liechtenstein, Luxembourg, Madagascar, Malawi, Maldives, Mali, Malta, Marshall Islands, Mauritania, Mauritius, Mexico, Micronesia (Federated States of), Mongolia, Montenegro, Morocco, Mozambique, Myanmar, Namibia, Nauru, Nepal, Netherlands, Niger, Nigeria, North Macedonia, Oman, Pakistan, Papua New Guinea, Peru, Philippines, Poland, Portugal, Qatar, Republic of Korea, Republic of Moldova, Rwanda, Saint Kitts and Nevis, Saint Lucia, Saint Vincent and the Grenadines, San Marino, Saudi Arabia, Senegal, Serbia, Seychelles, Sierra Leone, Singapore, Slovakia, Slovenia, Solomon Islands, Somalia, South Africa, South Sudan, Sudan, Suriname, Sweden, Switzerland, Syrian Arab Republic, Tajikistan, Thailand, Timor-Leste, Togo, Tonga, Trinidad and Tobago, Turkmenistan, Tuvalu, Uganda, Ukraine, United Republic of Tanzania, United States of America, Uzbekistan, Vanuatu, Viet Nam, Yemen, Zambia and Zimbabwe to Ly a"" wt rr Please recycle OQ 19-21182 Hi 121219 A TT A",12/09/2019,2019_3839766,Madagascar,N/A,yes
2019,General Assembly,N/A,Seventy-fourth session,71 (a),"Strengthening of the coordination of humanitarian and disaster relief assistance of the United Nations, including special economic assistance: strengthening of the coordination of emergency humanitarian assistance of the United Nations","Albania, Andorra, Antigua and Barbuda, Argentina, Armenia, Australia, Austria, Bangladesh, Belgium, Belize, Benin, Bosnia and Herzegovina, Bulgaria, Canada, Central African Republic, Colombia, Costa Rica, Céte d’Ivoire, Croatia, Cyprus, Czechia, Denmark, Dominican Republic, Ecuador, El Salvador, Equatorial Guinea, Eritrea, Estonia, Fiji, Finland, France, Gambia, Georgia, Germany, Greece, Guinea, Haiti, Honduras, Hungary, Iceland, Indonesia, Ireland, Italy, Jamaica, Japan, Kazakhstan, Kenya, Kiribati, Latvia, Lebanon, Lesotho, Liberia, Liechtenstein, Lithuania, Luxembourg, Malta, Marshall Islands, Mexico, Monaco, Mongolia, Montenegro, Morocco, Mozambique, Nauru, Netherlands, New Zealand, Nicaragua, Nigeria, North Macedonia, Norway, Poland, Portugal, Republic of Korea, Republic of Moldova, Romania, Rwanda, Saint Vincent and the Grenadines, Samoa, San Marino, Senegal, Serbia, Slovakia, Slovenia, Somalia, South Africa, Spain, Sweden, Switzerland, Timor-Leste, Tunisia, Turkey, Tuvalu, Ukraine, United Arab Emirates, United Kingdom of Great Britain and Northern Ireland and Uruguay",N/A,Strengthening of the coordination of emergency humanitarian assistance of the United Nations,"Addendum Add the following countries to the list of sponsors of the resolution: Bolivia (Plurinational State of), Burkina Faso, Cabo Verde, Chad, Chile, Djibouti, Ethiopia, Ghana, Guinea-Bissau, Madagascar, Malawi, Mali, Mauritius, Micronesia (Federated States of), Namibia, Niger, Palau, Panama, Papua New Guinea, Peru, Philippines, Sao Tome and Principe, Thailand, Togo, Zambia and Zimbabwe 19-21763 Hi 181219 A A TT A",12/16/2019,2019_3840105,Madagascar,N/A,yes
2019,General Assembly,N/A,Seventy-fourth session,15,Culture of peace,"Armenia, Bangladesh, Bhutan, China, Costa Rica, Dominican Republic, Equatorial Guinea, India, Malaysia, Mexico, Mongolia, Paraguay, Russian Federation, Saudi Arabia, Singapore and Sri Lanka",N/A,Follow-up to the Declaration and Programme of Action on a Culture of Peace,"Addendum Add the following countries to the list of sponsors of the resolution: Albania, Algeria, Antigua and Barbuda, Argentina, Austria, Azerbaijan, Bahrain, Belarus, Belize, Benin, Bolivia (Plurinational State of), Bosnia and Herzegovina, Brunei Darussalam, Bulgaria, Burkina Faso, Cabo Verde, Cameroon, Canada, Central African Republic, Chad, Chile, Colombia, Comoros, Congo, Cote d’Ivoire, Djibouti, Ecuador, Egypt, El Salvador, Eritrea, Ethiopia, Finland, Gabon, Gambia, Ghana, Greece, Guatemala, Guinea, Guinea-Bissau, Guyana, Haiti, Honduras, Hungary, Iraq, Ireland, Italy, Japan, Jordan, Kazakhstan, Kenya, Kiribati, Kuwait, Lao People’s Democratic Republic, Latvia, Lebanon, Libya, Lithuania, Luxembourg, Madagascar, Maldives, Malta, Mauritania, Mauritius, Montenegro, Morocco, Mozambique, Namibia, Nepal, Nicaragua, Nigeria, Norway, Pakistan, Palau, Panama, Papua New Guinea, Peru, Philippines, Poland, Portugal, Qatar, Republic of Korea, Saint Lucia, Saint Vincent and the Grenadines, Samoa, Sao Tome and Principe, Senegal, Serbia, Seychelles, Sierra Leone, Solomon Islands, Somalia, Spain, Sudan, Suriname, Syrian Arab Republic, Tajikistan, Thailand, Timor-Leste, Togo, Tunisia, Turkmenistan, Tuvalu, United Arab Emirates, Uruguay, Uzbekistan, Venezuela (Bolivarian Republic of), Viet Nam, Yemen, Zambia and Zimbabwe ree ¢ Please recycle 19-21488 Hi 161219 A A TT",12/12/2019,2019_3847891,Madagascar,N/A,yes
