year,Council,Committee,Session,Agenda item,Agenda detail,cosponsored countries,body title number,body title detail,body text,date,file,filecountry,footnote,scanned
1993,Convention On The Rights Of The Child,N/A,Forty-seventh session,19,ADMISSION OF NEW MEMBERS TO THE UNITED NATIONS,"Argentina, Austria, Belgium, Brazil, Cape Verde, Djibouti, Lithuania, Mauritius, Mexico, Morocco, Senegal, Spain, Tunisia and United Kingdom of Great Britain and Northern Ireland",N/A,Admission of Eritrea to membership in the United Nations,"Addendum Add the following countries to the list of sponsors of the resolution: Algeria, Australia, Bahamas, Bahrain, Bhutan, Canada, Chile, China, Colombia, Costa Rica, Cyprus, Czech Republic, Democratic People’s Republic of Korea, Denmark, Egypt, El Salvador, Estonia, Finland, France, Gabon, Germany, Greece, Guatemala, Guinea, India, Indonesia, Iran (Islamic Republic of), Ireland, Israel, Italy, Japan, Jordan, Kenya, Kuwait, Latvia, Lebanon, Lesotho, Libyan Arab Jamahiriya, Liechtenstein, Luxembourg, Madagascar, Malawi, Malaysia, Maldives, Mali, Malta, Myanmar, Namibia, Netherlands, New Zealand, Nicaragua, Nigeria, Norway, Oman, Panama, Philippines, Poland, Portugal, Qatar, Republic of Korea, Romania, Russian Federation, Saudi Arabia, Senegal, Singapore, Slovenia, Sudan, Suriname, Sweden, Syrian Arab Republic, Thailand, Turkey, Uganda, United Arab Emirates, United Republic of Tanzania, United States of America, Uruguay, Venezuela and Yemen",05/28/1993,1993_168662,Maldives,N/A,no
1993,General Assembly,First Committee,Forty-eighth session,61,CHEMICAL AND BACTERIOLOGICAL (BIOLOGICAL) WEAPONS,"Afghanistan, Algeria, Angola, Argentina, Armenia, Australia, Austria, Belarus, Belgium, Benin, Brazil, Brunei Darussalam, Bulgaria, Canada, Cape Verde, China, Colombia, Costa Rica, Céte d’ Ivoire, Croatia, Cuba, Cyprus, Czech Republic, Denmark, Ecuador, Estonia, Ethiopia, Fiji, Finland, France, Germany, Greece, Guatemala, Guinea, Guyana, Hungary, Iceland, India, Indonesia, Ireland, Israel, Italy, Jamaica, Japan, Kazakhstan, Kenya, Latvia, Liberia, Lithuania, Luxembourg, Madagascar, Malaysia, Maldives, Mali, Marshall Islands, Mexico, Micronesia (Federated States of), Mongolia, Myanmar, Namibia, Nepal, Netherlands, New Zealand, Nicaragua, Niger, Nigeria, Norway, Pakistan, Papua New Guinea, Peru, Poland, Portugal, Republic of Korea, Romania, Russian Federation, Rwanda, Senegal, Sierra Leone, Singapore, Slovakia, Spain, Sri Lanka, Suriname, Swaziland, Sweden, Thailand, The Former Yugoslav Republic of Macedonia, Togo, Turkey, Ukraine, United Kingdom of Great Britain and Northern Ireland, United States of America and Venezuela",N/A,N/A,"The General Assembly, Recalling its resolution 47/39 of 30 November 1992, adopted by consensus, in which the Convention on the Prohibition of the Development, Production, Stockpiling and Use of Chemical Weapons and on Their Destruction 1/ was commended, 1/ Official Records of the General Assembly, Forty-seventh Session, Supplement No. 27 (A/47/27), appendix I. Recalling also its resolution 46/35 B of 6 December 1991, in which the Assembly condemned vigorously all actions that violate the obligations assumed under the Protocol for the Prohibition of the Use in War of Asphyxiating, Poisonous or Other Gases, and of Bacteriological Methods of Warfare, signed at Geneva on 17 June 1925, 2/ Determined to make progress towards general and complete disarmament under strict and effective international control, including the prohibition of all types of weapons of mass destruction, Welcoming the completion of the Convention on the Prohibition of the Development, Production, Stockpiling and Use of Chemical Weapons and on Their Destruction, the result of many years of intensive negotiations by the Conference on Disarmament, which constitutes an historic achievement in the field of arms control and disarmament, Welcoming also the successful signing ceremony in Paris on 13 to 15 January 1993, where one hundred and thirty States signed the Convention, and the subsequent signature of seventeen States in New York, Welcoming further the progress achieved by the Preparatory Commission for the Organization for the Prohibition of Chemical Weapons in The Hague, Convinced that the Convention, particularly as adherence to it approaches universality, will contribute to the maintenance of international peace and improve the security of all States and that it therefore merits the strong support of the entire international community, Convinced also that the implementation of the Convention should promote expanded international trade, technological development and economic cooperation in the chemical sector, in order to enhance the economic and technological development of all States parties, Determined to ensure the efficient and cost-effective implementation of the Convention, 1. Calls upon all States which have not yet done so to sign the Convention in order to achieve universal adherence; 2. Also calls upon all signatory States, constitutional processes, to become parties to the Convention at the earliest possible date, thus contributing to its rapid entry into force and to the early achievement of universal adherence; according to their respective 3. Reaffirms the necessity that all States ensure the effective implementation of this unprecedented, global, comprehensive and verifiable multilateral disarmament agreement, thereby enhancing cooperative multilateralism as a basis for international peace and security; League of Nations, Treaty Series, vol. XCIV (1929)2318. 4. Requests all signatory States to play full and active roles in the work of the Preparatory Commission for the Organization for the Prohibition of Chemical Weapons; 5. Encourages the Preparatory Commission for the Organization for the Prohibition of Chemical Weapons to further pursue its efforts for the purpose of carrying out the necessary preparations for the effective implementation of the Convention; 6. Requests the Secretary-General, as depositary of the Convention, to report to the General Assembly at its forty-ninth session on the status of signatures and ratifications of the Convention.",10/29/1993,1993_176310,Maldives,N/A,no
1993,General Assembly,First Committee,Forty-eighth session,71,GENERAL AND COMPLETE DISARMAMENT,"Afghanistan, Argentina, Austria, Belgium, Belize, Bulgaria, Cambodia, Canada, Chad, Croatia, Denmark, El Salvador, Ethiopia, Finland, France, Guatemala, Hungary, Ireland, Japan, Kuwait, Lebanon, Liberia, Luxembourg, Madagascar, Malawi, Maldives, Mongolia, Mozambique, Netherlands, New Zealand, Nicaragua, Nigeria, Norway, Philippines, Poland, Portugal, Romania, Sierra Leone, Sweden, Togo and United States of America",N/A,Moratorium on the export of anti-personnel land mines,"The General Assembly, Noting that there are as many as 85 million un-cleared land mines throughout the world, particularly in rural areas, Expressing deep concern that such mines kill or maim hundreds of people each week, mostly unarmed civilians, obstruct economic development and have other severe consequences, which include inhibiting the repatriation of refugees and the return of internally displaced persons, Recalling with satisfaction the adoption of resolution 48/7 of 28 October 1993 by which it, inter alia, requested the Secretary-General to submit a comprehensive report on the problems caused by mines and other unexploded devices, Convinced that a moratorium by States exporting anti-personnel mines that pose grave dangers to civilian populations would reduce substantially the human and economic costs resulting from the use of such devices and would complement the aforementioned initiatives, Noting with satisfaction that several States have already declared moratoriums on the export, transfer or purchase of anti-personnel land mines and related devices, 1. Calls upon States to agree to a moratorium on the export of anti-personnel land mines that pose grave dangers to civilian populations; Urges States to implement such a moratorium; 3. Requests the Secretary-General to prepare a report concerning progress on this initiative, including possible recommendations regarding further appropriate measures to limit the export of anti-personnel land mines, and to submit it to the General Assembly at its forty-ninth session under the item entitled ""General and complete disarmament"".",11/04/1993,1993_176770,Maldives,N/A,no
1993,General Assembly,N/A,Forty-seventh session,19,ADMISSION OF NEW MEMBERS TO THE UNITED NATEONS,"Algeria, Argentina, Armenia, Australia, Austria, Azerbaijan, Bahamas, Belarus, Belgium, Benin, Bosnia and Herzegovina, Brazil, Bulgaria, Cape Verde, Chile, China, Colombia, Congo, Costa Rica, Cyprus, Democratic People's Republic of Korea, Denmark, Djibouti, Ecuador, Egypt, El Salvador, Estonia, Fiji, Finland, France, Germany, Greece, Guatemala, Hungary, Iceland ndia, Indonesia, Iran (Islamic Republic of Ireland, Israel, Italy, Japan, Jordan, Kazakhstan, Kuwait, Kyrgyzstan, Lebanon, Lithuania, Luxembourg, Madagascar, Maldives, Malta, Marshall Islands, Mexico, Micronesia Federated States of), Mongolia, Moroc Mozambique, Nepal Netherlands, New Zealand, Nicaragua, Norway, Pakistan, Panama, Paraquay, Philippines, Poland, Portugal, Republic of Korea, Republic of Moldova, Romania, Russian Federation, Singapore, Slovenia, Spain, Suriname, Sweden, Tunisia, Turkey, Ukraine, United Kingdom of Great Britain and Northern Ireland, United Republic of Tanzania, Vanuatu, Venezuela and Yemen",N/A,Admission of the Czech Republic to membership in the United Nations,"The General Assembly, Having received the recommendation of the Security Council of 8 January 1993 that the Czech Republic should be admitted to membership in the United Nations, 1/ i/ A/47/863. JA 4 & 1yg9 General Assembly Distr. LIMITED A/47/L.52 15 January 1993 ORIGINAL: ENGLISH mm ie LS NTT eaten Tian enETL eee ene yen eer tian eter] Forty-seventh session Agenda item 19 ADMISSION OF NEW MEMBERS TO THE UNITED NATEONS Algeria, Argentina, Armenia, Australia, Austria, Azerbaijan, Bahamas, Belarus, Belgium, Benin, Bosnia and Herzegovina, Brazil, Bulgaria, Cape Verde, Chile, China, Colombia, Congo, Costa Rica, Cyprus, Democratic People's Republic of Korea, Denmark, Djibouti, Ecuador, Egypt, El Salvador, Estonia, Fiji, Finland, France, Germany, Greece, Guatemala, Hungary, Iceland ndia, Indonesia, Iran (Islamic Republic of Ireland, Israel, Italy, Japan, Jordan, Kazakhstan, Kuwait, Kyrgyzstan, Lebanon, Lithuania, Luxembourg, Madagascar, Maldives, Malta, Marshall Islands, Mexico, Micronesia Federated States of), Mongolia, Moroc Mozambique, Nepal Netherlands, New Zealand, Nicaragua, Norway, Pakistan, Panama, Paraquay, Philippines, Poland, Portugal, Republic of Korea, Republic of Moldova, Romania, Russian Federation, Singapore, Slovenia, Spain, Suriname, Sweden, Tunisia, Turkey, Ukraine, United Kingdom of Great Britain and Northern Ireland, United Republic of Tanzania, Vanuatu, Venezuela and Yemen resolution Admission of the Czech Republic to membership in the United Nations The General Assembly, Having received the recommendation of the Security Council of , 8 January 1993 that the Czech Republic should be admitted to membership in the United Nations, 1/ A/47/863. line Having considered the application for membership of the Czech Republic, 2/ Decides to admit the Czech Republic to membership in the United Nations. A/47/851-S/25045.",01/15/1993,1993_185773,Maldives,N/A,no
1993,General Assembly,N/A,Forty-seventh session,19,ADMISSION OF NEW MEMBERS TO THE UNITED NATIONS,"Algeria, Argentina, Armenia, Australia, Austria, Azerbaijan, Bahamas, Belarus, Belgium, Benin, Bosnia and Herzegovina, Brazii, Bulgaria, Cape Verde, Chile, China, Colombia, Congo, Costa Rica, Cyprus, Democratic People's Republic of Korea, Denmark, Djibouti, Ecuador, Egypt, El Salvador, Estonia, Fiji, Finland, France, Germany, Greece, Guatemala, Hungary, Icelan Indi In i Iran (Islamic Republic of Ireland, Israel, Italy, Japan, Jordan, Kazakhstan, Kuwait, Kyrgyzstan, Lebanon, Lithuania, Luxembour Madagascar Maldives, Malta, Marshall Islands, Mexico, Micronesia Federated ates of Mongolia, Morocco, Mozambique, Nepal Netherlands, New Zealand, Nicaragua, Norway, Pakistan, Panama, Paragua Philippines, Poland, Portugal, Republic of Korea, Republic of Moldova, Romania, Russian Federation, Singapore, Slovenia, Spain, Suriname, Sweden, Tunisia, Turkey, Ukraine, United Kingdom of Great Britain and Northern Ireland, United Republic of Tanzania, Vanuatu, Venezuela and Yemen",N/A,Admission of the Slovak Republic to membership in the United Nations,"The General Assembly, Having received the recommendation of the Security Council of 8 January 1993 that the Slovak Republic should be admitted to membership in the United Nations, 1l/ l/s A/47/864. Distr. LIMITED General Assembly | A/47/L.53 15 January 1993 ORIGINAL: ENGLISH ADMISSION OF NEW MEMBERS TO THE UNITED NATIONS Algeria, Argentina, Armenia, Australia, Austria, Azerbaijan, Bahamas, Belarus, Belgium, Benin, Bosnia and Herzegovina, Brazii, Bulgaria, Cape Verde, Chile, China, Colombia, Congo, Costa Rica, Cyprus, Democratic People's Republic of Korea, Denmark, Djibouti, Ecuador, Egypt, El Salvador, Estonia, Fiji, Finland, France, Germany, Greece, Guatemala, Hungary, Icelan Indi In i Iran (Islamic Republic of Ireland, Israel, Italy, Japan, Jordan, Kazakhstan, Kuwait, Kyrgyzstan, Lebanon, Lithuania, Luxembour Madagascar Maldives, Malta, Marshall Islands, Mexico, Micronesia Federated ates of Mongolia, Morocco, Mozambique, Nepal Netherlands, New Zealand, Nicaragua, Norway, Pakistan, Panama, Paragua Philippines, Poland, Portugal, Republic of Korea, Republic of Moldova, Romania, Russian Federation, Singapore, Slovenia, Spain, Suriname, Sweden, Tunisia, Turkey, Ukraine, United Kingdom of Great Britain and Northern Ireland, United Republic of Tanzania, Vanuatu, Venezuela and Yemen resolution Admission of the Slovak Republic to membershi in the United Nations The General Assembly, Having received the recommendation of the Security Council of & January 1993 that the Slovak Republic should be admitted to membership in the United Nations, 1l/ A/47/864. foes Having considered the application for membership of the Slovak Republic, 2/ Decides to admit the Slovak Republic to membership in the United Nations. A/47/852-S/25046.",01/15/1993,1993_185774,Maldives,170193 a,no
1993,Convention On The Rights Of The Child,N/A,Forty-seventh session,19,ADMISSION OF NEW MEMBERS TO THE UNITED NATIONS,"Argentina, Austria, Belgium, Brazil, Djibouti, France, Hungary, Italy, Japan, Lithuania, Mexico, Morocco, Spain and United Kingdom of Great Britain and Northern Ireland",N/A,Admission of the Principality of Monaco to membership in the United Nations,"Addendum Add the following countries to the list of sponsors of the resolution: Australia, Bahamas, Bahrain, Bhutan, Bulgaria, Canada, China, Colombia, Costa Rica, Cyprus, Czech Republic, Denmark, El Salvador, Estonia, Finland, Gabon, Germany, Greece, Guatemala, India, Indonesia, Ireland, Israel, Jordan, Kuwait, Latvia, Lebanon, Liechtenstein, Luxembourg, Madagascar, Maldives, Mali, Malta, Myanmar, Namibia, Netherlands, New Zealand, Nicaragua, Norway, Oman, Panama, Philippines, Poland, Portugal, Qatar, Romania, Russian Federation, Senegal, Singapore, Slovenia, Suriname, Sweden, Thailand, Turkey, United Arab Emirates, United Republic of Tanzania, United States of America, Uruguay, Venezuela and Yemen.",05/28/1993,1993_185775,Maldives,N/A,no
