year,Council,Committee,Session,Agenda item,Agenda detail,cosponsored countries,body title number,body title detail,body text,date,file,filecountry,footnote,scanned
2006,General Assembly,Commission On Human Rights,First session,4,IMPLEMENTATION OF GENERAL ASSEMBLY RESOLUTION 60/251 OF 15 MARCH 2006 ENTITLED “HUMAN RIGHTS COUNCIL”,"Algeria, Angola*, Argentina, Belgium*, Bolivia*, Bosnia and Herzegovina*, Brazil, Bulgaria®, Burkina Faso*, Cameroon, Cape Verde*, Chile*, Colombia*, Costa Rica*, Croatia*, Cuba, Djibouti, Ecuador, Finland, France, Ghana, Guatemala, Guinea*, Italy*, Lesotho*, Mali, Mauritius, Mexico, Monaco*, Morocco, Mozambique*, Nigeria, Norway*, Panama*, Peru, Portugal*, Republic of Serbia*, Senegal, Slovenia*, South Africa, Spain*, Timor-Leste*, Tunisia, Ukraine, Uruguay®*, Venezuela (Bolivarian Republic of)*, Zambia",2006,"Open-ended Working Group on an optional protocol to the International Covenant on Economic, Social and Cultural Rights","The Human Rights Council, Guided by the principles relating to economic, social and cultural rights enshrined in the Universal Declaration of Human Rights and the International Covenant on Economic, Social and Cultural Rights, Recalling that in the Vienna Declaration and Programme of Action adopted in June 1993 by the World Conference on Human Rights (A/CONF.157/23), the World Conference encouraged the Commission on Human Rights to continue the examination of optional protocols to the International Covenant on Economic, Social and Cultural Rights, Bearing in mind the discussions held, and the progress made, during the three previous sessions of the Open-ended Working Group on an optional protocol to the International Covenant on Economic, Social and Cultural Rights, 1. Welcomes the report of the Open-ended Working Group to consider options regarding the elaboration of an optional protocol to the International Covenant on Economic, Social and Cultural Rights (E/CN.4/2006/47); 2. Decides to extend the mandate of the Working Group for a period of two years in order to elaborate an optional protocol to the International Covenant on Economic, Social and Cultural Rights and, in this regard, requests the Chairperson of the Working Group to prepare, taking into account all views expressed during the sessions of the Working Group on, inter alia, the scope and application of an optional protocol, a first optional protocol, which includes provisions corresponding to the various main approaches outlined in her analytical paper, to be used as a basis for the forthcoming negotiations; 3. Requests the Working Group to meet for ten working days each year and to report to the Human Rights Council; 4. Decides to invite a representative of the Committee on Economic, Social and Cultural Rights to attend these meetings as a resource person; Decides that the Human Rights Council shall remain seized of this matter.",06/28/2006,2006_577996,Mozambique,* Non-member States of the Human Rights Council.,yes
2006,General Assembly,Special Political And Decolonization Committee,Sixty-first session,39,Implementation of the Declaration on the Granting,"Algeria, Angola, Antigua and Barbuda, Botswana, Cuba, Dominica, Fiji, Grenada, Jamaica, Kenya, Lesotho, Liberia, Mozambique, Namibia, Nigeria, Rwanda, Saint Lucia, South Africa, Timor-Leste, Uganda, United Republic of Tanzania, Venezuela, Zambia and Zimbabwe",N/A,Question of Western Sahara,"The General Assembly, Having considered in depth the question of Western Sahara, Reaffirming the inalienable right of all peoples to self-determination and independence, in accordance with the principles set forth in the Charter of the United Nations and General Assembly resolution 1514 (XV) of 14 December 1960 containing the Declaration on the Granting of Independence to Colonial Countries and Peoples, Recalling its resolution 60/114 of 8 December 2005, Recalling also all resolutions of the General Assembly and the Security Council on the question of Western Sahara, Recalling further Security Council resolutions 658 (1990) of 27 June 1990 and 690 (1991) of 29 April 1991, by which the Council approved the settlement plan for Western Sahara, ! Recalling Security Council resolutions 1359 (2001) of 29 June 2001 and 1429 (2002) of 30 July 2002, as well as 1495 (2003) of 31 July 2003, in which the Council expressed its support of the peace plan for self-determination of the people of Western Sahara? as an optimum political solution on the basis of agreement between the two parties, and resolutions 1541 (2004) of 29 April 2004, 1570 (2004) 1 See S/21360 and S/22464 and Corr.1. 2 §/2003/565 and Corr.1, annex II. 06-55631 ﬁEi 061006 O O A of 28 October 2004, 1598 (2005) of 28 April 2005, 1634 (2005) of 28 October 2005 and 1675 (2006) of 28 April 2006, Taking note of the responses of the parties and neighbouring States to the Personal Envoy of the Secretary-General concerning the peace plan contained in the report of the Secretary-General of 23 May 2003,3 Reaffirming the responsibility of the United Nations towards the people of Western Sahara, Noting with satisfaction the entry into force of the ceasefire in accordance with the proposal made by the Secretary-General, and stressing the importance it attaches to the maintenance of the ceasefire as an integral part of the settlement plan, Underlining, in this regard, the validity of the settlement plan, while noting the fundamental differences between the parties in its implementation, Stressing that the lack of progress in the settlement of the dispute on Western Sahara continues to cause suffering to the people of Western Sahara, remains a source of potential instability in the region and obstructs the economic development of the Maghreb region and that, in view of this, the search for a political solution is critically needed, Welcoming the efforts of the Secretary-General and his Personal Envoy in search of a mutually acceptable political solution, which will provide for self- determination of the people of Western Sahara, Having examined the relevant chapter of the report of the Special Committee on the Situation with regard to the Implementation of the Declaration on the Granting of Independence to Colonial Countries and Peoples,# Having also examined the report of the Secretary-General,> 1. Takes note of the report of the Secretary-General;’ 2. Underlines Security Council resolution 1495 (2003), in which the Council expressed its support of the peace plan for self-determination of the people of Western Sahara as an optimum political solution on the basis of agreement between the two parties; 3. Underlines also that the parties reacted differently to this plan; 4. Continues to support strongly the efforts of the Secretary-General and his Personal Envoy to achieve a mutually acceptable political solution to the dispute over Western Sahara; 5. Commends the Secretary-General and his Personal Envoy for their outstanding efforts and the two parties for the spirit of cooperation they have shown in the support they provide for those efforts; 6. Calls upon all the parties and the States of the region to cooperate fully with the Secretary-General and his Personal Envoy; 4 See Official Records of the General Assembly, Sixtieth Session, Supplement No. 23 (A/60/23), chap. VIIIL. A/C.4/61/L.5 7. Reaffirms the responsibility of the United Nations towards the people of Western Sahara; 8. Calls upon the parties to cooperate with the International Committee of the Red Cross in its efforts to solve the problem of the fate of the people unaccounted for, and calls upon the parties to abide by their obligations under international humanitarian law to release without further delay all those held since the start of the conflict; 9. Requests the Special Committee on the Situation with regard to the Implementation of the Declaration on the Granting of Independence to Colonial Countries and Peoples to continue to consider the situation in Western Sahara and to report thereon to the General Assembly at its sixty-second session; 10. Invites the Secretary-General to submit to the General Assembly at its sixty-second session a report on the implementation of the present resolution. 06-55631",10/05/2006,2006_584276,Mozambique,N/A,yes
2006,General Assembly,N/A,Sixty-first session,108 (j),Cooperation between the United Nations and regional and other organizations: cooperation between the United Nations and the International Organization,"Afghanistan, Albania, Andorra, Angola, Armenia, Belgium, Benin, Bulgaria, Burundi, Cambodia, Cameroon, Canada, Cape Verde, Central African Republic, Chad, Comoros, Congo, Cote d’Ivoire, Croatia, Cyprus, Czech Republic, Democratic Republic of the Congo, Djibouti, Dominica, Egypt, Equatorial Guinea, France, Gabon, Ghana, Greece, Guinea, Haiti, Hungary, Lao People’s Democratic Republic, Lebanon, Liechtenstein, Lithuania, Luxembourg, Madagascar, Mali, Mauritania, Moldova, Monaco, Morocco, Mozambique, Niger, Paraguay, Philippines, Poland, Romania, Rwanda, Saint Lucia, Saint Vincent and the Grenadines, Sao Tome and Principe, Senegal, Serbia, Seychelles, Slovenia, Switzerland, Togo, Tunisia and Viet Nam",N/A,Cooperation between the United Nations and the International Organization of la Francophonie,"The General Assembly, Recalling its resolutions 33/18 of 10 November 1978, 50/3 of 16 October 1995, 52/2 of 17 October 1997, 54/25 of 15 November 1999, 56/45 of 7 December 2001, 57/43 of 21 November 2002 and 59/22 of 8 November 2004, as well as its decision 53/453 of 18 December 1998, Considering that the International Organization of la Francophonie brings together a considerable number of States Members of the United Nations, among which it promotes multilateral cooperation in areas of interest to the United Nations, Bearing in mind the Articles of the Charter of the United Nations which encourage the promotion of the purposes and principles of the United Nations through regional cooperation, Bearing in mind also that, according to the Charter of la Francophonie adopted on 23 November 2005 at the Ministerial Conference of la Francophonie, held in Antananarivo, the objectives of the International Organization of la Francophonie are to assist in the establishment and development of democracy, the prevention, 19100 06-57719 ﬁEi DRV |II| |III management and settlement of conflicts, and support for the rule of law and for human rights, the intensification of dialogue between cultures and civilizations, the establishment of closer ties among peoples through mutual knowledge and strengthening of their solidarity through multilateral cooperation activities with a view to promoting the growth of their economies, and the promotion of education and training, Welcoming the steps taken by the International Organization of Ila Francophonie to strengthen its ties with the organizations of the United Nations system and with international and regional organizations with a view to attaining its objectives, Noting with satisfaction the commitment to multilateral cooperation for sustainable development, in particular through education and information technologies, for the purpose of meeting the Millennium Development Goals, undertaken by the Heads of State and Government of countries using French as a common language, at their eleventh summit conference, held in Bucharest on 28 and 29 September 2006, and their determination to extend the scope of francophone collaboration and cooperation in order to narrow the digital divide, fight poverty and contribute to the emergence of a more equitable form of globalization that will bring progress, peace, democracy and human rights, in full respect for cultural and linguistic diversity, in the interests of the most vulnerable populations and the development of all countries, Having considered the report of the Secretary-General on the implementation of resolution 59/22,1 Noting with satisfaction the substantial progress achieved in cooperation between the United Nations, the specialized agencies and other United Nations bodies and programmes and the International Organization of la Francophonie, Convinced that strengthening cooperation between the United Nations and the International Organization of la Francophonie serves the purposes and principles of the United Nations, Noting the desire of the two organizations to consolidate, develop and strengthen the ties that exist between them in the political, economic, social and cultural fields, 1. Takes note with satisfaction of the report of the Secretary-General,' and welcomes the increasingly close and productive cooperation between the United Nations and the International Organization of la Francophonie; 2. Notes with satisfaction that the International Organization of la Francophonie participates actively in the work of the United Nations, to which it makes a valuable contribution; 3. Notes with great satisfaction the initiatives taken by the International Organization of la Francophonie in the areas of conflict prevention, the promotion of peace and support for democracy, the rule of law and human rights, in accordance with the commitments reaffirmed at the Ministerial Conference of la Francophonie on Conflict Prevention and Human Security, held on 14 May 2006 in Saint Boniface, Canada, and commends it on the genuine contribution it makes, in A/61/L.7 cooperation with the United Nations, in Haiti, the Comoros, Céte d’Ivoire, Burundi, the Democratic Republic of the Congo and the Central African Republic; 4. Welcomes the initiation of cooperation between the United Nations and the International Organization of la Francophonie, with the participation of other regional and subregional organizations, as well as non-governmental organizations, in the fields of early warning and conflict prevention, and encourages the pursuit of this initiative with a view to formulating practical recommendations to facilitate the establishment of relevant operational mechanisms, where necessary; 5. Expresses its gratitude to the International Organization of la Francophonie for the steps it has taken in recent years to promote cultural and linguistic diversity and dialogue between cultures and civilizations; 6. Expresses its appreciation to the Secretary-General of the United Nations and the Secretary-General of the International Organization of la Francophonie for their sustained efforts to strengthen cooperation and coordination between the two organizations, thereby serving their mutual interests in the political, economic, social and cultural fields; 7. Welcomes the initiation of cooperation between the International Organization of la Francophonie and the United Nations Department of Peacekeeping Operations with a view to increasing the number of French-speaking personnel in United Nations peacekeeping operations; 8. Also welcomes the fact that the eleventh summit conference of la Francophonie was devoted to the use of new technologies in the service of education, and calls upon the specialized agencies and the funds and programmes of the United Nations system to enhance their cooperation with the International Organization of la Francophonie in the area of sustainable development; 9. Also welcomes the involvement of the countries that use French as a common language, particularly through the International Organization of Ia Francophonie, in the preparation for, conduct of and follow-up to international conferences organized under United Nations auspices; 10. Commends the high-level meetings held periodically between the United Nations Secretariat and the secretariat of the International Organization of la Francophonie, and advocates the participation of those secretariats in major meetings of the two organizations; 11. Expresses its appreciation to the Secretary-General for including the International Organization of la Francophonie in the periodic meetings he holds with heads of regional organizations, and invites him to continue doing so, taking into account the role played by the International Organization of la Francophonie in conflict prevention and support for democracy and the rule of law; 12. Notes with satisfaction the continued collaboration between the United Nations and the International Organization of la Francophonie in the area of electoral monitoring and assistance, and advocates the strengthening of cooperation between the two organizations in that area; 13. Requests the Secretary-General of the United Nations, acting in cooperation with the Secretary-General of the International Organization of la Francophonie, to encourage the holding of periodic meetings between A/61/L.7 representatives of the United Nations Secretariat and representatives of the secretariat of the International Organization of la Francophonie in order to promote the exchange of information, coordination of activities and identification of new areas of cooperation; 14. Welcomes the participation of the International Organization of la Francophonie in the Peacebuilding Commission’s work on Burundi, and strongly encourages the International Organization of la Francophonie and the Peacebuilding Commission to continue to cooperate actively; 15. Invites the Secretary-General of the United Nations to take the necessary steps, in consultation with the Secretary-General of the International Organization of la Francophonie, to continue to promote cooperation between the two organizations; 16. Invites the specialized agencies and funds and programmes of the United Nations system, as well as the regional commissions, including the Economic Commission for Africa, to collaborate to this end with the Secretary-General of the International Organization of la Francophonie by identifying new synergies in favour of development, in particular in the areas of poverty elimination, energy, sustainable development, education, training and the development of new information technologies; 17. Requests the Secretary-General to submit to the General Assembly at its sixty-third session a report on the implementation of the present resolution; 18. Decides to include in the provisional agenda of its sixty-third session the sub-item entitled “Cooperation between the United Nations and the International Organization of la Francophonie™. 06-57719",10/18/2006,2006_584828,Mozambique,N/A,yes
2006,General Assembly,First Committee,Sixty-first session,90 (x),"General and complete disarmament: implementation of the Convention on the Prohibition of the Use, Stockpiling, Production and Transfer of Anti-personnel Mines and on Their Destruction","Afghanistan, Albania, Algeria, Angola, Argentina, Australia, Austria, Belarus, Belgium, Benin, Bolivia, Bosnia and Herzegovina, Brazil, Bulgaria, Burkina Faso, Chile, Colombia, Congo, Costa Rica, Cote d’Ivoire, Croatia, Cyprus, Czech Republic, Denmark, Dominican Republic, El Salvador, Eritrea, Estonia, Finland, France, Germany, Greece, Guatemala, Haiti, Honduras, Hungary, Iceland, Ireland, Italy, Japan, Jordan, Kenya, Latvia, Liechtenstein, Lithuania, Luxembourg, Malaysia, Malta, Mexico, Monaco, Montenegro, Mozambique, Netherlands, New Zealand, Panama, Peru, Poland, Portugal, Romania, Serbia, Sierra Leone, Slovakia, Slovenia, Spain, Sweden, Switzerland, Thailand, the former Yugoslav Republic of Macedonia, Trinidad and Tobago, Turkey, Uganda, United Kingdom of Great Britain and Northern Ireland and Zambia: revised",N/A,"Implementation of the Convention on the Prohibition of the Use, Stockpiling, Production and Transfer of Anti-personnel Mines and on Their Destruction","The General Assembly, Recalling its resolutions 54/54 B of 1 December 1999, 55/33 V of 20 November 2000, 56/24 M of 29 November 2001, 57/74 of 22 November 2002, 58/53 of 8 December 2003, 59/84 of 3 December 2004 and 60/80 of 8 December 2005, Reaffirming its determination to put an end to the suffering and casualties caused by anti-personnel mines, which kill or maim hundreds of people every week, mostly innocent and defenceless civilians including children, obstruct economic development and reconstruction, inhibit the repatriation of refugees and internally displaced persons and have other severe consequences for years after emplacement, 06-57951 ﬁEi 191006 N Believing it necessary to do the utmost to contribute in an efficient and coordinated manner to facing the challenge of removing anti-personnel mines placed throughout the world and to assure their destruction, Wishing to do the utmost in ensuring assistance for the care and rehabilitation, including the social and economic reintegration, of mine victims, Welcoming the entry into force, on 1 March 1999, of the Convention on the Prohibition of the Use, Stockpiling, Production and Transfer of Anti-personnel Mines and on Their Destruction,! and noting with satisfaction the work undertaken to implement the Convention and the substantial progress made towards addressing the global landmine problem, Recalling the first to sixth meetings of the States parties to the Convention held in Maputo (1999),2 Geneva (2000),3> Managua (2001),4 Geneva (2002), Bangkok (2003),6 Zagreb (2005)7 and the First Review Conference of the States Parties to the Convention, held in Nairobi (2004),8 Recalling also the seventh meeting of the States parties to the Convention, held in Geneva from 18 to 22 September 2006, at which time the international community monitored progress and supported continued application of the Nairobi Action Plan 2005-2009° and established priorities to achieve further progress towards ending, for all people and for all time, the suffering caused by anti- personnel mines, Noting with satisfaction that additional States have ratified or acceded to the Convention, bringing the total number of States that have formally accepted the obligations of the Convention to one hundred and fifty-one, Emphasizing the desirability of attracting the adherence of all States to the Convention, and determined to work strenuously towards the promotion of its universalization, Noting with regret that anti-personnel mines continue to be used in conflicts around the world, causing human suffering and impeding post-conflict development, 1. Invites all States that have not signed the Convention on the Prohibition of the Use, Stockpiling, Production and Transfer of Anti-personnel Mines and on Their Destruction' to accede to it without delay; 2. Urges all States that have signed but have not ratified the Convention to ratify it without delay; 3. Stresses the importance of the full and effective implementation of and compliance with the Convention, including through the continued implementation of the Nairobi Action Plan 2005—2009;9 I United Nations, Treaty Series, vol. 2056, No. 35597. 2 See APLC/MSP.1/1999/1. A/C.1/61/L.47/Rev.1 4. Urges all States parties to provide the Secretary-General with complete and timely information as required under article 7 of the Convention in order to promote transparency and compliance with the Convention; 5. Invites all States that have not ratified the Convention or acceded to it to provide, on a voluntary basis, information to make global mine action efforts more effective; 6. Renews its call upon all States and other relevant parties to work together to promote, support and advance the care, rehabilitation and social and economic reintegration of mine victims, mine risk education programmes and the removal and destruction of anti-personnel mines placed or stockpiled throughout the world; 7. Urges all States to remain seized of the issue at the highest political level and, where in a position to do so, to promote adherence to the Convention through bilateral, subregional, regional and multilateral contacts, outreach, seminars and other means; 8. Invites and encourages all interested States, the United Nations, other relevant international organizations or institutions, regional organizations, the International Committee of the Red Cross and relevant non-governmental organizations to participate in the eighth meeting of the States parties to the Convention, to be held in Jordan from 18 to 22 November 2007, and in the intersessional work programme established at the first meeting of the States parties, and further developed at subsequent meetings of the States parties; 9. Requests the Secretary-General, in accordance with article 11, paragraph 2, of the Convention, to undertake the preparations necessary to convene the next meeting of the States parties and on behalf of the States parties and in accordance with article 11, paragraph 4, of the Convention, to invite States not parties to the Convention, as well as the United Nations, other relevant international organizations or institutions, regional organizations, the International Committee of the Red Cross and relevant non-governmental organizations to attend the eighth meeting of the States parties as observers; 10. Decides to remain seized of the matter. 06-57951",10/19/2006,2006_584829,Mozambique,N/A,yes
