year,Council,Committee,Session,Agenda item,Agenda detail,cosponsored countries,body title number,body title detail,body text,date,file,filecountry,footnote,scanned
2006,General Assembly,N/A,Sixty-first session,108 (q),Cooperation between the United Nations and regional and other organizations: cooperation between the United Nations and the Organization of the Islamic Conference,"Afghanistan, Albania, Algeria, Azerbaijan, Bahrain, Bangladesh, Bosnia and Herzegovina, Cameroon, Chad, Comoros, Djibouti, Egypt, Guinea, Guyana, Indonesia, Iran (Islamic Republic of), Iraq, Jordan, Kazakhstan, Kuwait, Kyrgyzstan, Lebanon, Libyan Arab Jamahiriya, Malaysia, Mali, Mauritania, Morocco, Mozambique, Niger, Oman, Pakistan, Qatar, Russian Federation, Senegal, Sierra Leone, Somalia, Sudan, Suriname, Syrian Arab Republic, Tajikistan, Thailand, Togo, Tunisia, Turkey, Uganda, Uzbekistan and Yemen",N/A,Cooperation between the United Nations and the Organization of the Islamic Conference,"The General Assembly, Recalling its resolutions 37/4 of 22 October 1982, 38/4 of 28 October 1983, 39/7 of 8 November 1984, 40/4 of 25 October 1985, 41/3 of 16 October 1986, 42/4 of 15 October 1987, 43/2 of 17 October 1988, 44/8 of 18 October 1989, 45/9 of 25 October 1990, 46/13 of 28 October 1991, 47/18 of 23 November 1992, 48/24 of 24 November 1993, 49/15 of 15 November 1994, 50/17 of 20 November 1995, 51/18 of 14 November 1996, 52/4 of 22 October 1997, 53/16 of 29 October 1998, 54/7 of 25 October 1999, 55/9 of 30 October 2000, 56/47 of 7 December 2001, 57/42 of 21 November 2002 and 59/8 of 22 October 2004, Recalling also its resolution 3369 (XXX) of 10 October 1975, by which it decided to invite the Organization of the Islamic Conference to participate in the sessions and the work of the General Assembly and of its subsidiary organs in the capacity of observer, Welcoming the efforts of the Secretary General of the Organization of the Islamic Conference in strengthening the role of the organization in conflict prevention, confidence-building, peacekeeping, conflict resolution and post-conflict 06-63560 ﬁE) 301106 DA 0 0 rehabilitation in member States as well as in conflict situations involving Muslim communities, Noting the adoption by the third extraordinary session of the Islamic Summit Conference, held in Makkah, Saudi Arabia, on 7 and 8 December 2005, of the Ten-Year Programme of Action,! Having considered the report of the Secretary-General on cooperation between the United Nations and regional and other organizations,? Taking into account the desire of the two organizations to continue to cooperate closely in the political, economic, social, humanitarian, cultural and scientific fields and in their common search for solutions to global problems, such as questions relating to international peace and security, disarmament, self- determination, the promotion of a culture of peace through dialogue and cooperation, decolonization, fundamental human rights and economic and social development, Recalling the Articles of the Charter of the United Nations that encourage activities through regional cooperation for the promotion of the purposes and principles of the United Nations, Noting the strengthening of cooperation between the United Nations, its funds and programmes and the specialized agencies and the Organization of the Islamic Conference, its subsidiary organs and its specialized and affiliated institutions, Noting also the encouraging progress made in the ten priority areas of cooperation between the two organizations and their respective agencies and institutions, as well as in the identification of other areas of cooperation between them, Convinced that the strengthening of cooperation between the United Nations and other organizations of the United Nations system and the Organization of the Islamic Conference and its organs and institutions contributes to the promotion of the purposes and principles of the United Nations, Welcoming the results of the general meeting of the organizations and agencies of the United Nations system and the Organization of the Islamic Conference and its subsidiary organs and specialized and affiliated institutions, held in Rabat from 11 to 13 July 2006, and the fact that these meetings are now being held every two years, with the next one scheduled for 2008, and also welcoming the memorandum of understanding on technical cooperation in the field of human rights between the Office of the United Nations High Commissioner for Human Rights and the Organization of the Islamic Conference signed at the Rabat meeting, Also welcoming the issuance of a joint statement in Doha on 25 February 2006 by the Secretaries-General of the United Nations, the Organization of the Islamic Conference and the League of Arab States, together with the representatives of Qatar, Spain and Turkey, in the context of the Alliance of Civilizations, committing themselves to formulate a joint strategy to promote tolerance and mutual respect, 1 See A/60/633-S/2005/826, annex 111. 2 A/61/256 and Add.1. A/61/L.26 Further welcoming the close and multifaceted cooperation between the organizations and specialized institutions of the United Nations and the Organization of the Islamic Conference with a view to strengthening the capacities of the two organizations in addressing challenges to development and social progress, Noting with appreciation the determination of the two organizations to strengthen further the existing cooperation by developing specific proposals in the designated priority areas of cooperation, as well as in the political field, 1. Takes note with satisfaction of the report of the Secretary-General;’ 2. Urges the United Nations system to cooperate with the Organization of the Islamic Conference in areas of mutual interest, as appropriate; 3. Notes with satisfaction the active participation of the Organization of the Islamic Conference in the work of the United Nations towards the realization of the purposes and principles embodied in the Charter of the United Nations; 4. Requests the United Nations and the Organization of the Islamic Conference to continue to cooperate in their common search for solutions to global problems, such as questions relating to international peace and security, disarmament, self-determination, promotion of a culture of peace through dialogue and cooperation, decolonization, human rights and fundamental freedoms, terrorism, emergency relief and rehabilitation, social and economic development and technical cooperation; 5. Welcomes the efforts of the United Nations and the Organization of the Islamic Conference to continue to strengthen cooperation between the two organizations in areas of common concern and to review and explore innovative ways and means of enhancing the mechanisms of such cooperation; 6. Welcomes with appreciation the continuing cooperation between the United Nations and the Organization of the Islamic Conference in the fields of peacemaking, preventive diplomacy, peacekeeping and peacebuilding, and notes the close cooperation between the two organizations in reconstruction and development in Afghanistan, Bosnia and Herzegovina and Sierra Leone; 7. Welcomes the efforts of the secretariats of the two organizations to strengthen information exchange, coordination and cooperation between them in areas of mutual interest in the political field and to develop practical modalities of such cooperation; 8. Also welcomes the periodic high-level meetings between the Secretary- General of the United Nations and the Secretary General of the Organization of the Islamic Conference, as well as between senior secretariat officials of the two organizations, and encourages their participation in important meetings of the two organizations; 9. Encourages the specialized agencies and other organizations of the United Nations system to continue to expand their cooperation with the subsidiary organs and specialized and affiliated institutions of the Organization of the Islamic Conference, in particular by negotiating cooperation agreements, and through necessary contacts and meetings of the respective focal points for cooperation in A/61/L.26 priority areas of interest to the United Nations and the Organization of the Islamic Conference; 10. Urges the United Nations and other organizations of the United Nations system, especially the lead agencies, to provide increased technical and other forms of assistance to the Organization of the Islamic Conference and its subsidiary organs and specialized and affiliated institutions in order to enhance cooperation; 11. Expresses its appreciation to the Secretary-General for his continued efforts to strengthen cooperation and coordination between the United Nations and other organizations of the United Nations system and the Organization of the Islamic Conference and its subsidiary organs and specialized and affiliated institutions to serve the mutual interests of the two organizations in the political, economic, social, cultural, humanitarian and scientific fields; 12. Requests the Secretary-General to report to the General Assembly at its sixty-third session on the state of cooperation between the United Nations and the Organization of the Islamic Conference; 13. Decides to include in the provisional agenda of its sixty-third session the sub-item entitled “Cooperation between the United Nations and the Organization of the Islamic Conference”. 06-63560",11/30/2006,2006_587717,Mozambique,N/A,yes
2006,General Assembly,Second Committee,Sixty-first session,69 (b),"Strengthening of the coordination of humanitarian and disaster relief assistance of the United Nations, including special economic assistance: special economic assistance to individual countries or regions","Angola, Algeria, Argentina, Austria, Belarus, Belize, Benin, Botswana, Brazil, Cape Verde, China, Democratic Republic of the Congo, Egypt, Ethiopia, Germany, Grenada, Guinea, Jamaica, Japan, Lao People’s Democratic Republic, Madagascar, Malawi, Mauritius, Mexico, Mozambique, Namibia, South Africa, Sudan, Syrian Arab Republic, Timor-Leste, Togo, Tunisia, Turkey, Venezuela (Bolivarian Republic of), Viet Nam and Zimbabwe",N/A,International assistance for the economic rehabilitation of Angola,"The General Assembly, Recalling all previous resolutions in which it called upon the international community to continue to render material, technical and financial assistance for the economic rehabilitation of Angola, including 59/216, adopted by consensus on 22 December 2004, Recalling also that the Security Council, in resolution 922 (1994) of 31 May 1994 and in subsequent resolutions adopted as from 2001, the President of the Security Council, in statements on Angola, and the General Assembly, in all of its resolutions on international assistance for the economic rehabilitation of Angola, have, inter alia, called upon the international community to provide economic assistance to Angola, Bearing in mind that the main responsibility for improving the humanitarian situation and creating the conditions for long-term development and poverty reduction in Angola lies with the Government of Angola, together with, where appropriate, the participation of the international community, Noting the importance of international engagement for the consolidation of peace in Angola, 06-63450 ﬁE) 301106 N0 T 0 Noting with satisfaction the successful implementation of and effective compliance with the provisions of the Lusaka Protocol,! Noting that an economically revived and democratic Angola will contribute to regional stability, Noting with satisfaction the recent election of Angola as Chair of the Peacebuilding Commission, Recalling the first Round-Table Conference of Donors, held in Brussels from 25 to 27 September 1995, Welcoming the efforts made by donors and United Nations agencies, funds and programmes to provide humanitarian, economic and financial assistance to Angola, 1. Takes note of the report of the Secretary-General;? 2. Recognizes the primary responsibility of the Government of Angola for the welfare of its citizens, including returning refugees and internally displaced persons, together with the support of the international community; 3. Recognizes also the efforts undertaken by the Government of Angola towards ensuring the maintenance of the peace and national security so necessary for the reconstruction, rehabilitation and economic stabilization of the country, and in this context encourages the Government, with the support of the international community, to continue its efforts for poverty reduction and the achievement of sustained economic growth and sustainable development, including, inter alia, social reintegration, mine action, rural development and food security, gender mainstreaming, education and the rehabilitation of social and economic infrastructures; 4. Welcomes the continued commitment of the Government of Angola to improve governance, transparency and accountability in the management of public resources, including natural resources, encourages the Government of Angola to continue its efforts to that end, and calls on international organizations and others in a position to do so to assist the Government of Angola in this endeavour, including through the promotion of responsible business practices; 5. Recognizes the role that South-South cooperation is playing in the reconstruction and rehabilitation of the economy of Angola; 6. Welcomes the commitment of the Government of Angola to the development and strengthening of its democratic institutions, encourages the Government of Angola, with the necessary support of the international community, to continue its efforts with a view to holding legislative and presidential elections, as both would accelerate and consolidate the democratic development in the country, and in this regard welcomes the beginning of the voter registration process on 15 November 2006 as part of the road map for the holding of legislative and presidential elections; 7. Commends the Government of Angola for its leadership, coordination and successful implementation of the programme for disarmament, demobilization and reintegration and for ensuring the delivery of humanitarian assistance to those 1 S/1994/1441, annex. 2 A/61/209. A/C.2/61/L.10/Rev.2 in need, all of which contribute to placing the country on the path to sustained economic growth and sustainable development; 8. Expresses its appreciation to the international community, the United Nations system, funds and programmes, and the governmental and non-governmental organizations that are participating in humanitarian assistance programmes in Angola, including mine-action activities and appeals for their continued contribution to humanitarian mine-action activities in a manner complementary to that of the Government; 9. Expresses its gratitude to donors and United Nations agencies, funds and programmes for the assistance provided to Angola in support of initiatives and programmes for the alleviation of the humanitarian crisis and poverty eradication. 06-63450",11/29/2006,2006_587733,Mozambique,N/A,yes
2006,General Assembly,N/A,Sixty-first session,44,Culture of peace,Bangladesh,N/A,"International Decade for a Culture of Peace and Non-Violence for the Children of the World, 2001-2010","Addendum Add the following countries to the list of sponsors of the resolution: Afghanistan, Algeria, Angola, Antigua and Barbuda, Argentina, Azerbaijan, Barbados, Belarus, Belize, Benin, Bhutan, Bolivia, Botswana, Brazil, Brunei Darussalam, Burkina Faso, Burundi, Cambodia, Cameroon, Cape Verde, Central African Republic, Chad, Chile, Colombia, Comoros, Congo, Costa Rica, Cote d’Ivoire, Democratic Republic of the Congo, Djibouti, Dominica, Dominican Republic, Ecuador, Egypt, El Salvador, Eritrea, Ethiopia, Fiji, Grenada, Guatemala, Guinea, Guinea-Bissau, Guyana, Haiti, Honduras, India, Indonesia, Iran (Islamic Republic of), Iraq, Jamaica, Jordan, Kazakhstan, Kenya, Kuwait, Kyrgyzstan, Lebanon, Lesotho, Liberia, Libyan Arab Jamahiriya, Madagascar, Malawi, Malaysia, Maldives, Mali, Marshall Islands, Mauritania, Mauritius, Mexico, Micronesia (Federated States of), Mongolia, Morocco, Mozambique, Myanmar, Namibia, Nepal, Nicaragua, Niger, Nigeria, Oman, Pakistan, Panama, Paraguay, Peru, Philippines, Portugal, Qatar, Russian Federation, Saint Kitts and Nevis, Saint Lucia, Saint Vincent and the Grenadines, Samoa, Senegal, Seychelles, Sierra Leone, Somalia, South Africa, Sri Lanka, Sudan, Suriname, Syrian Arab Republic, Tajikistan, Thailand, Timor-Leste, Togo, Trinidad and Tobago, Tunisia, Turkmenistan, United Arab Emirates, Uzbekistan, Viet Nam, Yemen, Zambia and Zimbabwe 06-64086 ﬁEf 051206 O T",12/04/2006,2006_587927,Mozambique,N/A,yes
2006,General Assembly,Second Committee,Sixty-first session,53 (a),"Sustainable development: implementation of Agenda 21, the Programme for the Further Implementation of Agenda 21 and the outcomes of the World Summit on Sustainable Development","Angola, Austria, Bangladesh, Barbados, Belarus, Bolivia, Brazil, Brunei Darussalam, Burundi, Cambodia, China, Congo, Cote d’Ivoire, Croatia, Cuba Cyprus, Denmark, Dominica, Dominican Republic, Egypt, Eritrea, France, Gambia, Germany, Greece, Grenada, Honduras, Hungary, Ireland, Israel, Italy, Japan, Kenya, Kyrgyzstan, Lebanon, Lesotho, Malawi, Mexico, Monaco, Mongolia, Morocco, Mozambique, Peru, Philippines, Singapore, Saint Vincent and the Grenadines, South Africa, Tajikistan, Thailand, Tunisia, United Republic of Tanzania, Uruguay, Viet Nam, Zambia and Zimbabwe",N/A,International Year of Sanitation 2008,"The General Assembly, Recalling the Rio Declaration on Environment and Development,! Agenda 21,2 the Programme for the Further Implementation of Agenda 21,3 the Johannesburg Declaration on Sustainable Development* and the Plan of Implementation of the World Summit on Sustainable Development (“Johannesburg Plan of Implementation”),5 as well as the Monterrey Consensus of the International Conference on Financing for Development,© I Report of the United Nations Conference on Environment and Development, Rio de Janeiro 3-14 June 1992, vol. I, Resolutions Adopted by the Conference (United Nations publication, Sales No. E.93.1.8 and corrigendum), resolution 1, annex 1. 4 Report of the World Summit on Sustainable Development, Johannesburg, South Africa 26 August-4 September 2002 (United Nations publication, Sales No. E.03.1I.A.1 and corrigendum), chap. I, resolution 1, annex. 6 Report of the International Conference on Financing for Development, Monterrey, Mexico, 18-22 March 2002 (United Nations publication, Sales No. E.02.11.A.7), chap. I, resolution 1, annex. 06-64067 ﬁEf 051206 O 00 Reaffirming the commitment to implement Agenda 21, the Programme for the Further Implementation of Agenda 21, the Johannesburg Plan of Implementation, including the time-bound goals and targets, and the other internationally agreed development goals, including Millennium Development Goals, Recalling the 2005 World Summit Outcome, Reaffirming the need to assist developing countries’ efforts to prepare integrated water resources management and water efficiency plans as part of their national development strategies and to provide access to safe drinking water and basic sanitation in accordance with the Millennium Declaration and the Johannesburg Plan of Implementation, including halving by 2015 the proportion of people who are unable to reach or afford safe drinking water and who do not have access to basic sanitation, Reaffirming the necessity to take into account sanitation in complementarity with water, in conjunction with the International Decade for Action, “Water for Life”, 2005-2015, Appreciating the ongoing work in the United Nations system and the work of other intergovernmental organizations on sanitation, Taking note with appreciation of the contribution made by the United Nations Advisory Board on Water and Sanitation and its work on the Hashimoto Action Plan, a compendium of water-related actions which relevant actors should consider, as appropriate, Deeply concerned by the slow and insufficient progress in providing access to basic sanitation services, and conscious of the impact of the lack of sanitation on people’s health, poverty reduction and economic and social development, and on the environment, in particular water resources, Convinced that progress can be achieved through active commitment and action by all States, including at the national and local levels, as well as United Nations agencies, regional and international organizations, civil society organizations and other relevant stakeholders, 1. Decides to declare 2008 as the International Year of Sanitation; 2. Requests the Department of Economic and Social Affairs to serve as the focal point for the Year and to develop, in a timely manner, relevant proposals on possible activities at all levels, including possible sources of funding; 3. Calls upon States as well as subregional, regional and international organizations and other relevant stakeholders, including the private sector and civil society, to make voluntary contributions; 4. Encourages all States, as well as the United Nations system and all other relevant stakeholders to take advantage of the Year to increase awareness of the importance of sanitation and to promote action at all levels, taking into account, inter alia, the policy recommendations adopted by the 13th session of the United Nations Commission on Sustainable Development as well as, where appropriate, the relevant recommendations made in the Hashimoto Action Plan; 5. Requests the Secretary-General to submit to the General Assembly at its sixty-fourth session a report on the implementation of the present resolution. 06-64067",12/04/2006,2006_587941,Mozambique,N/A,yes
2006,General Assembly,N/A,Sixty-first session,108 (f),Cooperation between the United Nations and regional and other organizations: cooperation between the United Nations and the Community of Portuguese-speaking Countries,"Angola, Brazil, Cape Verde, Guinea-Bissau, Mozambique, Portugal, Sao Tome and Principe and Timor-Leste",N/A,Cooperation between the United Nations and the Community of Portuguese-speaking Countries,"The General Assembly, Recalling its resolution 54/10 of 26 October 1999, by which it granted observer status to the Community of Portuguese-speaking Countries and considered it mutually advantageous to provide for cooperation between the United Nations and the Community of Portuguese-speaking Countries, and its resolution 59/21 of 8 November 2004, by which it invited the Secretary-General of the United Nations to undertake consultations with the Executive Secretary of the Community of Portuguese-speaking Countries, and requested the specialized agencies and other bodies and programmes of the United Nations system to cooperate to that end with the Secretary-General and the Executive Secretary, Recalling also the Articles of the Charter of the United Nations that encourage activities through regional cooperation for the promotion of the purposes and principles of the United Nations, Considering that the activities of the Community of Portuguese-speaking Countries complement and support the work of the United Nations, Welcoming the participation of the Community of Portuguese-speaking Countries in the Sixth High-level Meeting between the United Nations and Regional and Other Intergovernmental Organizations, held in New York on 25 and 26 July 2005, Recalling the celebration on 5 May 2006, for the first time, of Lusophone Culture Day, 06-64849 ﬁEf 081206 O T 1. Notes with appreciation the progress achieved in cooperation between the Community of Portuguese-speaking Countries and the specialized agencies and other bodies and programmes of the United Nations system, in particular the United Nations Conference on Trade and Development, the International Labour Organization, the Food and Agriculture Organization of the United Nations and the United Nations Educational, Scientific and Cultural Organization; 2. Welcomes the signature on 9 November 2006 of the agreement between the Office of the United Nations Commissioner for Human Rights and the Community of Portuguese-speaking Countries regarding consultation, exchange of information and technical cooperation on their respective activities in the field of human rights; 3. Invites the Secretary-General to continue to undertake consultations with the Executive Secretary with a view to promoting cooperation between the secretariats of the two bodies, in particular by encouraging meetings that enable their representatives to consult one another on projects, measures and procedures that will facilitate and expand their mutual cooperation and coordination; 4. Invites the Secretary-General and the Executive Secretary to start consultations with a view to considering the establishment of a formal cooperation agreement, 5. Requests the Secretary-General to submit a report on the implementation of the present resolution to the General Assembly at its sixty-third session; 6. Decides to include in the provisional agenda of its sixty-third session the sub-item entitled “Cooperation between the United Nations and the Community of Portuguese-speaking Countries”. 06-64849",12/07/2006,2006_588342,Mozambique,N/A,yes
