year,Council,Committee,Session,Agenda item,Agenda detail,cosponsored countries,body title number,body title detail,body text,date,file,filecountry,footnote,scanned
2015,General Assembly,N/A,Sixty-ninth session,69 (c),"Strengthening of the coordination of humanitarian and disaster relief assistance of the United Nations, including special economic assistance: special economic assistance to individual countries or regions","Afghanistan, Albania, Angola, Argentina, Australia, Austria, Bangladesh, Belgium, Bhutan, Bolivia (Plurinational State of), Bosnia and Herzegovina, Bulgaria, Canada, China, Croatia, Cyprus, Czech Republic, Denmark, Estonia, Ethiopia, Finland, Germany, Greece, Hungary, India, Indonesia, Ireland, Israel, Italy, Japan, Kazakhstan, Latvia, Lithuania, Luxembourg, Maldives, Malta, Mexico, Micronesia (Federated States of), Monaco, Mongolia, Morocco, Nepal, Netherlands, New Zealand, Norway, Pakistan, Paraguay, Philippines, Portugal, Republic of Korea, Romania, Samoa, Serbia, Singapore, Slovakia, Slovenia, Spain, Sri Lanka, Sweden, Switzerland, Togo, Turkey, Tuvalu, United Kingdom of Great Britain and Northern Ireland, United States of America and Viet Nam",N/A,"Strengthening emergency relief, rehabilitation and reconstruction in response to the devastating effects of the earthquake in Nepal","Addendum Add the following countries to the list of sponsors of the resolution: Algeria, Andorra, Armenia, Azerbaijan, Bahamas, Belarus, Brazil, Brunei Darussalam, Burkina Faso, Cambodia, Chile, Colombia, Costa Rica, Cuba, Ecuador, Egypt, El Salvador, Eritrea, Fiji, France, Georgia, Ghana, Guatemala, Jordan, Kenya, Kyrgyzstan, Lebanon, Liberia, Libya, Liechtenstein, Malaysia, Mali, Mauritius, Montenegro, Mozambique, Myanmar, Namibia, Nauru, Nigeria, Poland, Republic of Moldova, Russian Federation, Saint Vincent and the Grenadines, San Marino, Saudi Arabia, Senegal, Seychelles, Solomon Islands, Sudan, Tajikistan, Thailand, the former Yugoslav Republic of Macedonia, Turkmenistan, Ukraine, United Arab Emirates, United Republic of Tanzania, Uruguay, Vanuatu, Venezuela (Bolivarian Republic of) and Yemen Hen ore ope ee Fy hoe a Spe gt al eat tt! Please recycle OO Leg a ope apo: 15-07765 (E) 200515 CNM AA A",05/15/2015,2015_793275,Myanmar,N/A,yes
2015,General Assembly,First Committee,Seventieth session,97 (t),General and complete disarmament: measures to prevent terrorists from acquiring weapons of mass destruction,"Australia, Austria, Bangladesh, Belgium, Belize, Benin, Bulgaria, Chile, Cyprus, Czech Republic, Denmark, Estonia, Finland, France, Germany, Guatemala, Guyana, Haiti, Hungary, India, Kyrgyzstan, Latvia, Luxembourg, Madagascar, Malta, Morocco, Myanmar, Nepal, New Zealand, Papua New Guinea, Philippines, Poland, Portugal, Republic of Moldova, San Marino, Senegal, Serbia, Singapore, Slovakia, Slovenia, Sweden, Thailand, the former Yugoslav Republic of Macedonia, Tunisia and Zambia",N/A,Measures to prevent terrorists from acquiring weapons of mass destruction,"The General Assembly, Recalling its resolution 69/39 of 2 December 2014, Recognizing the determination of the international community to combat terrorism, as evidenced in relevant General Assembly and Security Council resolutions, Deeply concerned by the growing risk of linkages between terrorism and weapons of mass destruction, and in particular by the fact that terrorists may seek to acquire weapons of mass destruction, Cognizant of the steps taken by States to implement Security Council resolution 1540 (2004) on the non-proliferation of weapons of mass destruction, adopted on 28 April 2004, Welcoming the entry into force on 7 July 2007 of the International Convention for the Suppression of Acts of Nuclear Terrorism, | Welcoming also the adoption, by consensus, of amendments to strengthen the Convention on the Physical Protection of Nuclear Material” by the International Atomic Energy Agency on 8 July 2005, ' United Nations, Treaty Series, vol. 2445, No. 44004. Please recycle 15-18188 Hi 211015 A AM TT Noting the support expressed in the Final Document of the Sixteenth Conference of Heads of State or Government of Non-Aligned Countries, which was held in Tehran from 26 to 31 August 2012,’ for measures to prevent terrorists from acquiring weapons of mass destruction, Noting also that the Group of Eight, the European Union, the Regional Forum of the Association of Southeast Asian Nations and others have taken into account in their deliberations the dangers posed by the likely acquisition by terrorists of weapons of mass destruction and the need for international cooperation in combating it, and that the Global Initiative to Combat Nuclear Terrorism has been launched jointly by the Russian Federation and the United States of America, Noting further the holding of the Nuclear Security Summit on 12 and 13 April 2010 in Washington, D.C., on 26 and 27 March 2012 in Seoul and on 24 and 25 March 2014 in The Hague, Noting the holding of the high-level meeting on countering nuclear terrorism, with a focus on strengthening the legal framework, in New York on 28 September 2012, Acknowledging the consideration of issues relating to terrorism and weapons of mass destruction by the Advisory Board on Disarmament Matters,* Taking note of the holding by the International Atomic Energy Agency of the “International Conference on Nuclear Security: Enhancing Global Efforts” in Vienna from | to 5 July 2013 and the relevant resolutions adopted by the General Conference of the Agency at its fifty-ninth regular session, Taking note also of the tenth anniversary of the Code of Conduct on the Safety and Security of Radioactive Sources, approved by the Board of Governors of the International Atomic Energy Agency on 8 September 2003, Taking note further of the 2005 World Summit Outcome adopted at the high- level plenary meeting of the General Assembly on 16 September 2005° and the adoption of the United Nations Global Counter-Terrorism Strategy® on 8 September 2006, Taking note of the report of the Secretary-General submitted pursuant to paragraph 5 of resolution 69/39,’ Mindful of the urgent need for addressing, within the United Nations framework and through international cooperation, this threat to humanity, Emphasizing that progress is urgently needed in the area of disarmament and non-proliferation in order to maintain international peace and security and to contribute to global efforts against terrorism, 1. Calls upon all Member States to support international efforts to prevent terrorists from acquiring weapons of mass destruction and their means of delivery; > Tbid., vol. 1456, No. 24631. 3 A/67/506-S/2012/752, annex I. * See A/59/361. > Resolution 60/1. © Resolution 60/288. 2/3 2. Appeals to all Member States to consider early accession to and ratification of the International Convention for the Suppression of Acts of Nuclear Terrorism;' 3. Urges all Member States to take and strengthen national measures, as appropriate, to prevent terrorists from acquiring weapons of mass destruction, their means of delivery and materials and technologies related to their manufacture; 4. Encourages cooperation among and between Member States and relevant regional and international organizations for strengthening national capacities in this regard; 5. Requests the Secretary-General to compile a report on measures already taken by international organizations on issues relating to the linkage between the fight against terrorism and the proliferation of weapons of mass destruction and to seek the views of Member States on additional relevant measures, including national measures, for tackling the global threat posed by the acquisition by terrorists of weapons of mass destruction and to report to the General Assembly at its seventy-first session; 6. Decides to include in the provisional agenda of its seventy-first session, under the item entitled “General and complete disarmament”, the sub-item entitled “Measures to prevent terrorists from acquiring weapons of mass destruction”. 15-18188 3/3",10/20/2015,2015_808125,Myanmar,N/A,yes
2015,General Assembly,First Committee,Seventieth session,97 (0),General and complete disarmament: reducing nuclear danger,"Bangladesh, Belize, Chile, Cuba, Ecuador, Egypt, El Salvador, Guyana, Haiti, India, Indonesia, Jordan, Libya, Malawi, Malaysia, Myanmar, Nepal, Nicaragua, Papua New Guinea, Sri Lanka, Venezuela (Bolivarian Republic of), Viet Nam and Zambia",N/A,Reducing nuclear danger,"The General Assembly, Bearing in mind that the use of nuclear weapons poses the most serious threat to mankind and to the survival of civilization, Reaffirming that any use or threat of use of nuclear weapons would constitute a violation of the Charter of the United Nations, Convinced that the proliferation of nuclear weapons in all its aspects would seriously enhance the danger of nuclear war, Convinced also that nuclear disarmament and the complete elimination of nuclear weapons are essential to remove the danger of nuclear war, Considering that, until nuclear weapons cease to exist, it is imperative on the part of the nuclear-weapon States to adopt measures that assure non-nuclear-weapon States against the use or threat of use of nuclear weapons, Considering also that the hair-trigger alert of nuclear weapons carries unacceptable risks of unintentional or accidental use of nuclear weapons, which would have catastrophic consequences for all mankind, Emphasizing the need to adopt measures to avoid accidental, unauthorized or unexplained incidents arising from computer anomalies or other technical malfunctions, Conscious that limited steps relating to de-alerting and de-targeting have been taken by the nuclear-weapon States and that further practical, realistic and mutually reinforcing steps are necessary to contribute to the improvement in the international climate for negotiations leading to the elimination of nuclear weapons, ons Please recycle 15-18195 Hi 211015 A AN Mindful that a diminishing role for nuclear weapons in the security policies of nuclear-weapon States would have a positive impact on international peace and security and improve the conditions for the further reduction and the elimination of nuclear weapons, Reiterating the highest priority accorded to nuclear disarmament in the Final Document of the Tenth Special Session of the General Assembly' and by the international community, Recalling the advisory opinion of the International Court of Justice on the legality of the threat or use of nuclear weapons’ that there exists an obligation for all States to pursue in good faith and bring to a conclusion negotiations leading to nuclear disarmament in all its aspects under strict and effective international control, Recalling also the call, in the United Nations Millennium Declaration,* to seek to eliminate the dangers posed by weapons of mass destruction and the resolve to strive for the elimination of weapons of mass destruction, particularly nuclear weapons, including the possibility of convening an international conference to identify ways of eliminating nuclear dangers, 1. Calls for a review of nuclear doctrines and, in this context, immediate and urgent steps to reduce the risks of unintentional and accidental use of nuclear weapons, including through de-alerting and de-targeting nuclear weapons; 2. Requests the five nuclear-weapon States to take measures towards the implementation of paragraph | above; 3. Calls upon Member States to take the measures necessary to prevent the proliferation of nuclear weapons in all its aspects and to promote nuclear disarmament, with the objective of eliminating nuclear weapons; 4. Takes note of the report of the Secretary-General submitted pursuant to paragraph 5 of its resolution 69/40 of 2 December 2014;* 5. Requests the Secretary-General to intensify efforts and support initiatives that would contribute towards the full implementation of the seven recommendations identified in the report of the Advisory Board on Disarmament Matters that would significantly reduce the risk of nuclear war,’ and also to continue to encourage Member States to consider the convening of an international conference, as proposed in the United Nations Millennium Declaration,’ to identify ways of eliminating nuclear dangers, and to report thereon to the General Assembly at its seventy-first session; 6. Decides to include in the provisional agenda of its seventy-first session, under the item entitled “General and complete disarmament”, the sub-item entitled “Reducing nuclear danger”. ' Resolution S-10/2. > A/51/218, annex; see also Legality of the Threat or Use of Nuclear Weapons, Advisory Opinion, I.CJ. Reports 1996, p. 226. > Resolution 55/2. > A/56/400, para. 3. 2/2",10/20/2015,2015_808126,Myanmar,* 4/70/1811.,yes
2015,General Assembly,First Committee,Seventieth session,98 (a),Review and implementation of the Concluding Document of the Twelfth Special Session of the General Assembly: Convention on the Prohibition of the Use of Nuclear Weapons,"Bangladesh, Belize, Chile, Cuba, Ecuador, Egypt, El Salvador, Guyana, Haiti, India, Indonesia, Iran (Islamic Republic of), Jordan, Lao People’s Democratic Republic, Libya, Madagascar, Malaysia, Myanmar, Nepal, Nicaragua, Papua New Guinea, Sri Lanka, Trinidad and Tobago, Venezuela (Bolivarian Republic of), Viet Nam and Zambia",N/A,Convention on the Prohibition of the Use of Nuclear Weapons,"The General Assembly, Convinced that the use of nuclear weapons poses the most serious threat to the survival of mankind, Bearing in mind the advisory opinion of the International Court of Justice of 8 July 1996 on the legality of the threat or use of nuclear weapons, ' Convinced that a multilateral, universal and binding agreement prohibiting the use or threat of use of nuclear weapons would contribute to the elimination of the nuclear threat and to the climate for negotiations leading to the ultimate elimination of nuclear weapons, thereby strengthening international peace and security, Conscious that some steps taken by the Russian Federation and the United States of America towards a reduction of their nuclear weapons and the improvement in the international climate can contribute towards the goal of the complete elimination of nuclear weapons, Recalling that in paragraph 58 of the Final Document of the Tenth Special Session of the General Assembly* it is stated that all States should actively participate in efforts to bring about conditions in international relations among States ' A/51/218, annex; see also Legality of the Threat or Use of Nuclear Weapons, Advisory Opinion, I.CJ. Reports 1996, p. 226. * Resolution S-10/2. 7 i 211015 oease ree Paces ema IVAN A , iF 15-181)7 Hi 211015 CAN in which a code of peaceful conduct of nations in international affairs could be agreed upon and which would preclude the use or threat of use of nuclear weapons, Reaffirming that any use of nuclear weapons would be a violation of the Charter of the United Nations and a crime against humanity, as declared in its resolutions 1653 (XVI) of 24 November 1961, 33/71 B of 14 December 1978, 34/83 G of 11 December 1979, 35/152 D of 12 December 1980 and 36/92 I of 9 December 1981, Determined to achieve an_ international convention prohibiting the development, production, stockpiling and use of nuclear weapons, leading to their ultimate destruction, Stressing that an international convention on the prohibition of the use of nuclear weapons would be an important step in a phased programme towards the complete elimination of nuclear weapons, with a specified framework of time, Noting with regret that the Conference on Disarmament, during its 2015 session, was unable to undertake negotiations on this subject as called for in General Assembly resolution 69/69 of 2 December 2014, 1. Reiterates its request to the Conference on Disarmament to commence negotiations in order to reach agreement on an international convention prohibiting the use or threat of use of nuclear weapons under any circumstances; 2. Requests the Conference on Disarmament to report to the General Assembly on the results of those negotiations. 15-18197 2/2",10/20/2015,2015_808127,Myanmar,"7 i 211015 oease ree Paces ema IVAN A , iF",yes
2015,General Assembly,First Committee,Seventieth session,95 (a),Prevention of an arms race in outer space,"Algeria, Bangladesh, Brazil, Central African Republic, China, Cuba, Democratic People’s Republic of Korea, Egypt, India, Indonesia, Iraq, Kuwait, Kyrgyzstan, Libya, Madagascar, Mongolia, Myanmar, Namibia, Nepal, Oman, Pakistan, Russian Federation, Senegal, Sri Lanka, Sudan, Syrian Arab Republic, Thailand, Trinidad and Tobago, Uganda, Uruguay, Zambia and Zimbabwe",N/A,Prevention of an arms race in outer space,"The General Assembly, Recognizing the common interest of all mankind in the exploration and use of outer space for peaceful purposes, Reaffirming the will of all States that the exploration and use of outer space, including the Moon and other celestial bodies, shall be for peaceful purposes and shall be carried out for the benefit and in the interest of all countries, irrespective of their degree of economic or scientific development, Reaffirming also the provisions of articles HI and IV of the Treaty on Principles Governing the Activities of States in the Exploration and Use of Outer Space, including the Moon and Other Celestial Bodies, | Recalling the obligation of all States to observe the provisions of the Charter of the United Nations regarding the use or threat of use of force in their international relations, including in their space activities, Reaffirming paragraph 80 of the Final Document of the Tenth Special Session of the General Assembly,” in which it is stated that, in order to prevent an arms race in outer space, further measures should be taken and appropriate international negotiations held in accordance with the spirit of the Treaty, Recalling its previous resolutions on this issue, and taking note of the proposals submitted to the General Assembly at its tenth special session and at its ' United Nations, Treaty Series, vol. 610, No. 8843. > Resolution S-10/2. 8 Please recycle 15-18258 1 231015 CA AN A A regular sessions and of the recommendations made to the competent organs of the United Nations and to the Conference on Disarmament, Recognizing that the prevention of an arms race in outer space would avert a grave danger for international peace and security, Emphasizing the paramount importance of strict compliance with existing arms limitation and disarmament agreements relevant to outer space, including bilateral agreements, and with the existing legal regime concerning the use of outer space, Considering that wide participation in the legal regime applicable to outer space could contribute to enhancing its effectiveness, Noting that the Ad Hoc Committee on the Prevention of an Arms Race in Outer Space, taking into account its previous efforts since its establishment in 1985 and seeking to enhance its functioning in qualitative terms, continued the examination and identification of various issues, existing agreements and existing proposals, as well as future initiatives relevant to the prevention of an arms race in outer space, and that this contributed to a better understanding of a number of problems and to a clearer perception of the various positions, Noting also that there were no objections in principle in the Conference on Disarmament to the re-establishment of the Ad Hoc Committee, subject to re-examination of the mandate contained in the decision of the Conference on Disarmament of 13 February 1992,” Emphasizing the mutually complementary nature of bilateral and multilateral efforts for the prevention of an arms race in outer space, and hoping that concrete results will emerge from those efforts as soon as possible, Convinced that further measures should be examined in the search for effective and verifiable bilateral and multilateral agreements in order to prevent an arms race in outer space, including the weaponization of outer space, Stressing that the growing use of outer space increases the need for greater transparency and better information on the part of the international community, Recalling, in this context, its previous resolutions, in particular resolutions 45/55 B of 4 December 1990, 47/51 of 9 December 1992 and 48/74 A of 16 December 1993, in which, inter alia, it reaffirmed the importance of confidence-building measures as a means conducive to ensuring the attainment of the objective of the prevention of an arms race in outer space, Conscious of the benefits of confidence- and security-building measures in the military field, Recognizing that negotiations for the conclusion of an international agreement or agreements to prevent an arms race in outer space remain a priority task of the Conference on Disarmament and that the concrete proposals on confidence-building measures could form an integral part of such agreements, Noting with satisfaction the constructive, structured and focused debate on the prevention of an arms race in outer space at the Conference on Disarmament in 2009, 2010, 2011, 2012, 2013, 2014 and 2015, > See Official Records of the General Assembly, Forty-seventh Session, Supplement No. 27 (A/47/27), para. 76. 2/3 Noting the introduction by China and the Russian Federation at the Conference on Disarmament of the treaty on the prevention of the placement of weapons in outer space and of the threat or use of force against outer space objects in 2008 and the submission of its updated version in 2014,* Taking note of the decision of the Conference on Disarmament to establish for its 2009 session a working group to discuss, substantially, without limitation, all issues related to the prevention of an arms race in outer space, 1. Reaffirms the importance and urgency of preventing an arms race in outer space and the readiness of all States to contribute to that common objective, in conformity with the provisions of the Treaty on Principles Governing the Activities of States in the Exploration and Use of Outer Space, including the Moon and Other Celestial Bodies;! 2. Reaffirms its recognition, as stated in the report of the Ad Hoc Committee on the Prevention of an Arms Race in Outer Space, that the legal regime applicable to outer space by itself does not guarantee the prevention of an arms race in outer space, that the regime plays a significant role in the prevention of an arms race in that environment, that there is a need to consolidate and reinforce that regime and enhance its effectiveness and that it is important to comply strictly with existing agreements, both bilateral and multilateral; 3. Emphasizes the necessity of further measures with appropriate and effective provisions for verification to prevent an arms race in outer space; 4. Calls upon all States, in particular those with major space capabilities, to contribute actively to the objective of the peaceful use of outer space and of the prevention of an arms race in outer space and to refrain from actions contrary to that objective and to the relevant existing treaties in the interest of maintaining international peace and security and promoting international cooperation; 5. Reiterates that the Conference on Disarmament, as the sole multilateral disarmament negotiating forum, has the primary role in the negotiation of a multilateral agreement or agreements, as appropriate, on the prevention of an arms race in outer space in all its aspects; 6. Invites the Conference on Disarmament to establish a working group under its agenda item entitled “Prevention of an arms race in outer space” as early as possible during its 2016 session; 7. Recognizes, in this respect, the growing convergence of views on the elaboration of measures designed to strengthen transparency, confidence and security in the peaceful uses of outer space; 8. Urges States conducting activities in outer space, as well as States interested in conducting such activities, to keep the Conference on Disarmament informed of the progress of bilateral and multilateral negotiations on the matter, if any, so as to facilitate its work; 9. Decides to include in the provisional agenda of its seventy-first session the item entitled “Prevention of an arms race in outer space”. 3/3",10/20/2015,2015_808299,Myanmar,* See CD/1839 and CD/1985.,yes
