year,Council,Committee,Session,Agenda item,Agenda detail,cosponsored countries,body title number,body title detail,body text,date,file,filecountry,footnote,scanned
2006,General Assembly,First Committee,Sixty-first session,89,Prevention of an arms race in outer space,"Algeria, Bangladesh, China, Democratic People’s Republic of Korea, Dominican Republic, Ecuador, Egypt, El Salvador, Ghana, Haiti, India, Indonesia, Iran (Islamic Republic of), Kuwait, Libyan Arab Jamahiriya, Mongolia, Myanmar, Nepal, Pakistan, Qatar, Russian Federation, Saudi Arabia, Sierra Leone, Sri Lanka, Syrian Arab Republic, Togo, Venezuela (Bolivarian Republic of), Zambia and Zimbabwe",N/A,Prevention of an arms race in outer space,"The General Assembly, Recognizing the common interest of all mankind in the exploration and use of outer space for peaceful purposes, Reaffirming the will of all States that the exploration and use of outer space, including the Moon and other celestial bodies, shall be for peaceful purposes and shall be carried out for the benefit and in the interest of all countries, irrespective of their degree of economic or scientific development, Reaffirming also the provisions of articles III and IV of the Treaty on Principles Governing the Activities of States in the Exploration and Use of Outer Space, including the Moon and Other Celestial Bodies, ! Recalling the obligation of all States to observe the provisions of the Charter of the United Nations regarding the use or threat of use of force in their international relations, including in their space activities, Reaffirming paragraph 80 of the Final Document of the Tenth Special Session of the General Assembly,? in which it is stated that in order to prevent an arms race in outer space, further measures should be taken and appropriate international negotiations held in accordance with the spirit of the Treaty, 1 Resolution 2222 (XXI), annex. 2 Resolution S-10/2. 06-55796 ﬁEi 091006 N O Recalling its previous resolutions on this issue, and taking note of the proposals submitted to the General Assembly at its tenth special session and at its regular sessions, and of the recommendations made to the competent organs of the United Nations and to the Conference on Disarmament, Recognizing that prevention of an arms race in outer space would avert a grave danger for international peace and security, Emphasizing the paramount importance of strict compliance with existing arms limitation and disarmament agreements relevant to outer space, including bilateral agreements, and with the existing legal regime concerning the use of outer space, Considering that wide participation in the legal regime applicable to outer space could contribute to enhancing its effectiveness, Noting that the Ad Hoc Committee on the Prevention of an Arms Race in Outer Space, taking into account its previous efforts since its establishment in 1985 and seeking to enhance its functioning in qualitative terms, continued the examination and identification of various issues, existing agreements and existing proposals, as well as future initiatives relevant to the prevention of an arms race in outer space,? and that this contributed to a better understanding of a number of problems and to a clearer perception of the various positions, Noting also that there were no objections in principle in the Conference on Disarmament to the re-establishment of the Ad Hoc Committee, subject to re-examination of the mandate contained in the decision of the Conference on Disarmament of 13 February 1992,4 Emphasizing the mutually complementary nature of bilateral and multilateral efforts in the field of preventing an arms race in outer space, and hoping that concrete results will emerge from those efforts as soon as possible, Convinced that further measures should be examined in the search for effective and verifiable bilateral and multilateral agreements in order to prevent an arms race in outer space, including the weaponization of outer space, Stressing that the growing use of outer space increases the need for greater transparency and better information on the part of the international community, Recalling, in this context, its previous resolutions, in particular resolutions 45/55 B of 4 December 1990, 47/51 of 9 December 1992 and 48/74 A of 16 December 1993, in which, inter alia, it reaffirmed the importance of confidence- building measures as a means conducive to ensuring the attainment of the objective of the prevention of an arms race in outer space, Conscious of the benefits of confidence- and security-building measures in the military field, Recognizing that negotiations for the conclusion of an international agreement or agreements to prevent an arms race in outer space remain a priority task of the Ad Hoc Committee and that the concrete proposals on confidence-building measures could form an integral part of such agreements, 3 Official Records of the General Assembly, Forty-ninth Session, Supplement No. 27 (A/49/27), sect. II1.D (para. 5 of the quoted text). 4 CD/1125. A/C.1/61/L.10 1. Reaffirms the importance and urgency of preventing an arms race in outer space and the readiness of all States to contribute to that common objective, in conformity with the provisions of the Treaty on Principles Governing the Activities of States in the Exploration and Use of Outer Space, including the Moon and Other Celestial Bodies;' 2. Reaffirms its recognition, as stated in the report of the Ad Hoc Committee on the Prevention of an Arms Race in Outer Space, that the legal regime applicable to outer space does not in and of itself guarantee the prevention of an arms race in outer space, that the regime plays a significant role in the prevention of an arms race in that environment, that there is a need to consolidate and reinforce that regime and enhance its effectiveness and that it is important to comply strictly with existing agreements, both bilateral and multilateral; 3. Emphasizes the necessity of further measures with appropriate and effective provisions for verification to prevent an arms race in outer space; 4. Calls upon all States, in particular those with major space capabilities, to contribute actively to the objective of the peaceful use of outer space and of the prevention of an arms race in outer space and to refrain from actions contrary to that objective and to the relevant existing treaties in the interest of maintaining international peace and security and promoting international cooperation; 5. Reiterates that the Conference on Disarmament, as the sole multilateral disarmament negotiating forum, has the primary role in the negotiation of a multilateral agreement or agreements, as appropriate, on the prevention of an arms race in outer space in all its aspects; 6. Invites the Conference on Disarmament to complete the examination and updating of the mandate contained in its decision of 13 February 1992* and to establish an ad hoc committee as early as possible during its 2007 session; 7. Recognizes, in this respect, the growing convergence of views on the elaboration of measures designed to strengthen transparency, confidence and security in the peaceful uses of outer space; 8. Urges States conducting activities in outer space, as well as States interested in conducting such activities, to keep the Conference on Disarmament informed of the progress of bilateral and multilateral negotiations on the matter, if any, so as to facilitate its work; 9. Decides to include in the provisional agenda of its sixty-second session the item entitled “Prevention of an arms race in outer space”. 06-55796",10/06/2006,2006_584386,Myanmar,N/A,yes
2006,General Assembly,Sixth Committee,Sixty-first session,153,Requests for observer status in the General Assembly,"Brunei Darussalam, Cambodia, China, Indonesia, Lao People’s Democratic Republic, Malaysia, Myanmar, Philippines, Singapore, Thailand and Viet Nam",N/A,Observer status for the Association of Southeast Asian Nations in the General Assembly,"The General Assembly, Wishing to promote cooperation between the United Nations and the Association of Southeast Asian Nations, 1. Decides to invite the Association of Southeast Asian Nations to participate in the sessions and the work of the General Assembly in the capacity of observer; 2. Requests the Secretary-General to take the necessary action to implement the present resolution. 06-56325 ﬁEi 111006 O",10/10/2006,2006_584466,Myanmar,N/A,yes
2006,General Assembly,First Committee,Sixty-first session,91 (e),Review and implementation of the Concluding Document,"Afghanistan, Australia, Bangladesh, Bhutan, Brunei Darussalam, Cambodia, China, Democratic People’s Republic of Korea, India, Indonesia, Kazakhstan, Kyrgyzstan, Lao People’s Democratic Republic, Malaysia, Maldives, Micronesia (Federated States of), Mongolia, Myanmar, Nauru, Nepal, New Zealand, Pakistan, Sri Lanka, Thailand, Viet Nam",N/A,United Nations Regional Centre for Peace and Disarmament in Asia and the Pacific,"The General Assembly, Recalling its resolutions 42/39 D of 30 November 1987 and 44/117 F of 15 December 1989, by which it established the United Nations Regional Centre for Peace and Disarmament in Asia and renamed it the United Nations Regional Centre for Peace and Disarmament in Asia and the Pacific, with headquarters in Kathmandu and with the mandate of providing, on request, substantive support for the initiatives and other activities mutually agreed upon by the Member States of the Asia-Pacific region for the implementation of measures for peace and disarmament, through appropriate utilization of available resources, Taking note of the report of the Secretary-General,! in which he expresses his belief that the mandate of the Regional Centre remains valid and that the Centre has been a useful instrument for fostering a climate of cooperation for peace and disarmament in the region, Noting that trends in the post-cold-war era have emphasized the function of the Regional Centre in assisting Member States as they deal with new security concerns and disarmament issues emerging in the region, Commending the useful activities carried out by the Regional Centre in encouraging regional and subregional dialogue for the enhancement of openness, transparency and confidence-building, as well as the promotion of disarmament and 06-56613 ﬁEi 131006 O 0 security through the organization of regional meetings, which has come to be widely known within the Asia-Pacific region as “the Kathmandu process”, Expressing its appreciation to the Regional Centre for its organization of meetings, conferences and workshops in the region, held in Kyoto, Japan, from 17 to 19 August 2005; Busan, Republic of Korea, from 1 to 3 December 2005; Bali, Indonesia, from 21-22 December 2005; Bangkok, Thailand, from 17 to 19 May 2006; and Beijing, People’s Republic of China, from 12-13 July 2006, Welcoming the Regional Centre’s activities in the promotion of disarmament and non-proliferation education in the Asia-Pacific region, as recommended by the United Nations study on disarmament and non-proliferation education,? Noting the important role of the Regional Centre in assisting region-specific initiatives of Member States, Appreciating highly the overall support that Nepal has extended as the host nation of the headquarters of the Regional Centre, 1. Reaffirms its strong support for the forthcoming operation and further strengthening of the United Nations Regional Centre for Peace and Disarmament in Asia and the Pacific; 2. Underlines the importance of the Kathmandu process as a powerful vehicle for the development of the practice of region-wide security and disarmament dialogue; 3. Expresses its appreciation for the continuing political support and voluntary financial contributions to the Regional Centre, which are essential for its continued operation; 4. Appeals to Member States, in particular those within the Asia-Pacific region, as well as to international governmental and non-governmental organizations and foundations, to make voluntary contributions, the only resources of the Regional Centre, to strengthen the programme of activities of the Centre and the implementation thereof; 5. Requests the Secretary-General, taking note of paragraph 6 of General Assembly resolution 49/76 D of 15 December 1994, to provide the Regional Centre with the necessary support, within existing resources, in carrying out its programme of activities; 6. Urges the Secretary-General to complete, without any further delay, the internal procedure for finalizing the host country agreement and the related memorandum of understanding and to ensure the physical operation of the Regional Centre from Kathmandu within six months of the date of signature of the host country agreement and to enable the Centre to function effectively; 7. Requests the Secretary-General to report to the General Assembly at its sixty-second session on the implementation of the present resolution; 8. Decides to include in the provisional agenda of its sixty-second session the item entitled “United Nations Regional Centre for Peace and Disarmament in Asia and the Pacific”. 2 A/57/124.",10/11/2006,2006_584564,Myanmar,N/A,yes
2006,General Assembly,First Committee,Sixty-first session,85,Developments in the field of information and telecommunications in the context of international security,"Armenia, Belarus, China, Kazakhstan, Kyrgyzstan, Myanmar, Russian Federation, Tajikistan and Uzbekistan",N/A,Developments in the field of information and telecommunications in the context of international security,"The General Assembly, Recalling its resolutions 53/70 of 4 December 1998, 54/49 of 1 December 1999, 55/28 of 20 November 2000, 56/19 of 29 November 2001, 57/53 of 22 November 2002, 58/32 of 8 December 2003, 59/61 of 3 December 2004 and 60/45 of 8 December 2005, Recalling also its resolutions on the role of science and technology in the context of international security, in which, inter alia, it recognized that scientific and technological developments could have both civilian and military applications and that progress in science and technology for civilian applications needed to be maintained and encouraged, Noting that considerable progress has been achieved in developing and applying the latest information technologies and means of telecommunication, Affirming that it sees in this process the broadest positive opportunities for the further development of civilization, the expansion of opportunities for cooperation for the common good of all States, the enhancement of the creative potential of humankind and additional improvements in the circulation of information in the global community, Recalling, in this connection, the approaches and principles outlined at the Information Society and Development Conference, held in Midrand, South Africa, from 13 to 15 May 1996, 06-56909 ﬁEi 131006 N0 A0 Bearing in mind the results of the Ministerial Conference on Terrorism, held in Paris on 30 July 1996, and the recommendations that it made, ! Bearing in mind also the results of the World Summit on the Information Society, held in Geneva from 10 to 12 December 2003 (first phase) and in Tunis from 16 to 18 November 2005 (second phase),? Noting that the dissemination and use of information technologies and means affect the interests of the entire international community and that optimum effectiveness is enhanced by broad international cooperation, Expressing its concern that these technologies and means can potentially be used for purposes that are inconsistent with the objectives of maintaining international stability and security and may adversely affect the integrity of the infrastructure of States to the detriment of their security in both civil and military fields, Considering that it is necessary to prevent the use of information resources or technologies for criminal or terrorist purposes, Noting the contribution of those Member States that have submitted their assessments on issues of information security to the Secretary-General pursuant to paragraphs 1 to 3 of resolutions 53/70, 54/49, 55/28, 56/19, 57/53, 58/32, 59/61 and 60/45, Taking note of the reports of the Secretary-General containing those assessments, 3 Welcoming the initiative taken by the Secretariat and the United Nations Institute for Disarmament Research in convening an international meeting of experts in Geneva in August 1999 on developments in the field of information and telecommunications in the context of international security, as well as its results, Considering that the assessments of the Member States contained in the reports of the Secretary-General and the international meeting of experts have contributed to a better understanding of the substance of issues of international information security and related notions, Bearing in mind that the Secretary-General, in fulfilment of resolution 58/32, established in 2004 a group of governmental experts, which, in accordance with its mandate, considered existing and potential threats in the sphere of information security and possible cooperative measures to address them and conducted a study on relevant international concepts aimed at strengthening the security of global information and telecommunications systems, Taking note of the report of the Secretary-General on the Group of Governmental Experts on Developments in the Field of Information and Telecommunications in the Context of International Security, prepared on the basis of the results of the Group’s work,* 2 See A/C.2/59/3 and A/60/687. 3 A/54/213, A/55/140 and Corr.1 and Add.1, A/56/164 and Add.1, A/57/166 and Add.1, A/58/373, A/59/116 and Add.1, A/60/95 and Add.1 and A/61/161. 4 A/60/202. A/C.1/61/L.35 1. Calls upon Member States to promote further at multilateral levels the consideration of existing and potential threats in the field of information security, as well as possible measures to limit the threats emerging in this field, consistent with the need to preserve the free flow of information; 2. Considers that the purpose of such measures could be served through the examination of relevant international concepts aimed at strengthening the security of global information and telecommunications systems; 3. Invites all Member States to continue to inform the Secretary-General of their views and assessments on the following questions: (a) General appreciation of the issues of information security; (b) Efforts taken at the national level to strengthen information security and promote international cooperation in this field; (c) The content of the concepts mentioned in paragraph 2 above; (d) Possible measures that could be taken by the international community to strengthen information security at the global level; 4. Requests the Secretary-General, with the assistance of a group of governmental experts, to be established in 2009 on the basis of equitable geographical distribution, to continue to study existing and potential threats in the sphere of information security and possible cooperative measures to address them, as well as the concepts referred to in paragraph 2 above, and to submit a report on the results of this study to the General Assembly at its sixty-fifth session; 5. Decides to include in the provisional agenda of its sixty-second session the item entitled “Developments in the field of information and telecommunications in the context of international security”. 06-56909",10/11/2006,2006_584645,Myanmar,N/A,yes
