year,Council,Committee,Session,Agenda item,Agenda detail,cosponsored countries,body title number,body title detail,body text,date,file,filecountry,footnote,scanned
2006,General Assembly,First Committee,Sixty-first session,88,Conclusion of effective international arrangements to assure non-nuclear-weapon States against the use or threat of use of nuclear weapons,"Bangladesh, Brunei Darussalam, Colombia, Congo, Cote d’Ivoire, Cuba, Egypt, El Salvador, Guinea, Haiti, Indonesia, Iran (Islamic Republic of), Iraq, Jordan, Kuwait, Lebanon, Libyan Arab Jamahiriya, Malawi, Malaysia, Myanmar, Pakistan, Philippines, Saudi Arabia, Sri Lanka, Sudan, Syrian Arab Republic, Viet Nam and Zambia",N/A,Conclusion of effective international arrangements to assure non-nuclear-weapon States against the use or threat of use of nuclear weapons,"The General Assembly, Bearing in mind the need to allay the legitimate concern of the States of the world with regard to ensuring lasting security for their peoples, Convinced that nuclear weapons pose the greatest threat to mankind and to the survival of civilization, Welcoming the progress achieved in recent years in both nuclear and conventional disarmament, Noting that, despite recent progress in the field of nuclear disarmament, further efforts are necessary towards the achievement of general and complete disarmament under effective international control, Convinced that nuclear disarmament and the complete elimination of nuclear weapons are essential to remove the danger of nuclear war, Determined to abide strictly by the relevant provisions of the Charter of the United Nations on the non-use of force or threat of force, Recognizing that the independence, territorial integrity and sovereignty of non- nuclear-weapon States need to be safeguarded against the use or threat of use of force, including the use or threat of use of nuclear weapons, 06-56742 ﬁEi 131006 OO0 O Considering that, until nuclear disarmament is achieved on a universal basis, it is imperative for the international community to develop effective measures and arrangements to ensure the security of non-nuclear-weapon States against the use or threat of use of nuclear weapons from any quarter, Recognizing that effective measures and arrangements to assure non-nuclear- weapon States against the use or threat of use of nuclear weapons can contribute positively to the prevention of the spread of nuclear weapons, Bearing in mind paragraph 59 of the Final Document of the Tenth Special Session of the General Assembly,! the first special session devoted to disarmament, in which it urged the nuclear-weapon States to pursue efforts to conclude, as appropriate, effective arrangements to assure non-nuclear-weapon States against the use or threat of use of nuclear weapons, and desirous of promoting the implementation of the relevant provisions of the Final Document, Recalling the relevant parts of the special report of the Committee on Disarmament? submitted to the General Assembly at its twelfth special session,3 the second special session devoted to disarmament, and of the special report of the Conference on Disarmament submitted to the Assembly at its fifteenth special session,# the third special session devoted to disarmament, as well as the report of the Conference on its 1992 session,? Recalling also paragraph 12 of the Declaration of the 1980s as the Second Disarmament Decade, contained in the annex to its resolution 35/46 of 3 December 1980, which states, inter alia, that all efforts should be exerted by the Committee on Disarmament urgently to negotiate with a view to reaching agreement on effective international arrangements to assure non-nuclear-weapon States against the use or threat of use of nuclear weapons, Noting the in-depth negotiations undertaken in the Conference on Disarmament and its Ad Hoc Committee on Effective International Arrangements to Assure Non-Nuclear-Weapon States against the Use or Threat of Use of Nuclear Weapons, ® with a view to reaching agreement on this question, Taking note of the proposals submitted under the item in the Conference on Disarmament, including the s of an international convention, Taking note also of the relevant decision of the Thirteenth Conference of Heads of State or Government of Non-Aligned Countries, held at Kuala Lumpur on 24 and 25 February 2003,7 which was reiterated at the Fourteenth Conference of Heads of State or Government of Non-Aligned Countries, held at Havana on 15 and 16 September 2006, as well as the relevant recommendations of the Organization of the Islamic Conference, 2 The Committee on Disarmament was redesignated the Conference on Disarmament as from 7 February 1984. 3 Official Records of the General Assembly, Twelfth Special Session, Supplement No. 2 (A/S-12/2), sect. II1.C. A/C.1/61/L.45 Taking note further of the unilateral declarations made by all the nuclear- weapon States on their policies of non-use or non-threat of use of nuclear weapons against the non-nuclear-weapon States, Noting the support expressed in the Conference on Disarmament and in the General Assembly for the elaboration of an international convention to assure non- nuclear-weapon States against the use or threat of use of nuclear weapons, as well as the difficulties pointed out in evolving a common approach acceptable to all, Taking note of Security Council resolution 984 (1995) of 11 April 1995 and the views expressed on it, Recalling its relevant resolutions adopted in previous years, in particular resolutions 45/54 of 4 December 1990, 46/32 of 6 December 1991, 47/50 of 9 December 1992, 48/73 of 16 December 1993, 49/73 of 15 December 1994, 50/68 of 12 December 1995, 51/43 of 10 December 1996, 52/36 of 9 December 1997, 53/75 of 4 December 1998, 54/52 of 1 December 1999, 55/31 of 20 November 2000, 56/22 of 29 November 2001, 57/56 of 22 November 2002, 58/35 of 8 December 2003, 59/64 of 3 December 2004 and 60/53 of 8 December 2005, 1. Reaffirms the urgent need to reach an early agreement on effective international arrangements to assure non-nuclear-weapon States against the use or threat of use of nuclear weapons; 2. Notes with satisfaction that in the Conference on Disarmament there is no objection, in principle, to the idea of an international convention to assure non- nuclear-weapon States against the use or threat of use of nuclear weapons, although the difficulties with regard to evolving a common approach acceptable to all have also been pointed out; 3. Appeals to all States, especially the nuclear-weapon States, to work actively towards an early agreement on a common approach and, in particular, on a common formula that could be included in an international instrument of a legally binding character; 4. Recommends that further intensive efforts be devoted to the search for such a common approach or common formula and that the various alternative approaches, including, in particular, those considered in the Conference on Disarmament, be further explored in order to overcome the difficulties; 5. Recommends also that the Conference on Disarmament actively continue intensive negotiations with a view to reaching early agreement and concluding effective international agreements to assure the non-nuclear-weapon States against the use or threat of use of nuclear weapons, taking into account the widespread support for the conclusion of an international convention and giving consideration to any other proposals designed to secure the same objective; 6. Decides to include in the provisional agenda of its sixty-second session the item entitled “Conclusion of effective international arrangements to assure non- nuclear-weapon States against the use or threat of use of nuclear weapons”. 06-56742",10/11/2006,2006_584654,Myanmar,N/A,yes
2006,General Assembly,First Committee,Sixty-first session,91 (h),Review and implementation of the Concluding Document,"Bhutan, Botswana, Brunei Darussalam, Burkina Faso, Cambodia, Colombia, Congo, Cuba, Egypt, Haiti, India, Indonesia, Iran (Islamic Republic of), Jordan, Kenya, Libyan Arab Jamahiriya, Madagascar, Malaysia, Mauritius, Myanmar, Namibia, Nepal, Sudan, Viet Nam, Zambia and Zimbabwe",N/A,Convention on the Prohibition of the Use of Nuclear Weapons,"The General Assembly, Convinced that the use of nuclear weapons poses the most serious threat to the survival of mankind, Bearing in mind the advisory opinion of the International Court of Justice of 8 July 1996 on the Legality of the Threat or Use of Nuclear Weapons,! Convinced that a multilateral, universal and binding agreement prohibiting the use or threat of use of nuclear weapons would contribute to the elimination of the nuclear threat and to the climate for negotiations leading to the ultimate elimination of nuclear weapons, thereby strengthening international peace and security, Conscious that some steps taken by the Russian Federation and the United States of America towards a reduction of their nuclear weapons and the improvement in the international climate can contribute towards the goal of the complete elimination of nuclear weapons, Recalling that paragraph 58 of the Final Document of the Tenth Special Session of the General Assembly? states that all States should actively participate in efforts to bring about conditions in international relations among States in which a code of peaceful conduct of nations in international affairs could be agreed upon and that would preclude the use or threat of use of nuclear weapons, 1 A/51/218, annex; see also Legality of the Threat or Use of Nuclear Weapons, Advisory Opinion, 1.C.J. Reports 1996, p. 226. 2 See resolution S-10/2. 06-56862 ﬁEi 131006 N Reaffirming that any use of nuclear weapons would be a violation of the Charter of the United Nations and a crime against humanity, as declared in its resolutions 1653 (XVI) of 24 November 1961, 33/71 B of 14 December 1978, 34/83 G of 11 December 1979, 35/152 D of 12 December 1980 and 36/92 I of 9 December 1981, Determined to achieve an international convention prohibiting the development, production, stockpiling and use of nuclear weapons, leading to their ultimate destruction, Stressing that an international convention on the prohibition of the use of nuclear weapons would be an important step in a phased programme towards the complete elimination of nuclear weapons, with a specified framework of time, Noting with regret that the Conference on Disarmament, during its 2006 session, was unable to undertake negotiations on this subject as called for in General Assembly resolution 60/88 of 8§ December 2005, 1. Reiterates its request to the Conference on Disarmament to commence negotiations in order to reach agreement on an international convention prohibiting the use or threat of use of nuclear weapons under any circumstances; 2. Requests the Conference on Disarmament to report to the General Assembly on the results of those negotiations. 06-56862",10/11/2006,2006_584736,Myanmar,N/A,yes
2006,General Assembly,First Committee,Sixty-first session,90 (v),General and complete disarmament: measures to prevent terrorists from acquiring weapons of mass destruction,"Afghanistan, Armenia, Bhutan, Colombia, Czech Republic, Denmark, El Salvador, Finland, France, Germany, India, Kenya, Kuwait, Kyrgyzstan, Mauritius, Monaco, Myanmar, Nepal, Norway, Poland, Portugal, Spain, Sri Lanka and Zambia",N/A,Measures to prevent terrorists from acquiring weapons of mass destruction,"The General Assembly, Recalling its resolution 60/78 of 8 December 2005, Recognizing the determination of the international community to combat terrorism, as evidenced in relevant General Assembly and Security Council resolutions, Deeply concerned by the growing risk of linkages between terrorism and weapons of mass destruction, and in particular by the fact that terrorists may seek to acquire weapons of mass destruction, Cognizant of the steps taken by States to implement Security Council resolution 1540 (2004) on the non-proliferation of weapons of mass destruction, adopted on 28 April 2004, Welcoming the adoption, by consensus, of the International Convention for the Suppression of Acts of Nuclear Terrorism on 13 April 2005,! Welcoming also the adoption, by consensus, of amendments to strengthen the Convention on the Physical Protection of Nuclear Material?> by the International Atomic Energy Agency on 8 July 2005, 06-56874* iEﬁ 201006 OO T Noting the support expressed in the Final Document of the Fourteenth Summit Conference of Heads of State or Government of the Non-Aligned Movement, which was held in Havana from 11 to 16 September 2006,3 for measures to prevent terrorists from acquiring weapons of mass destruction, Noting also that the Group of Eight, the European Union, the Regional Forum of the Association of Southeast Asian Nations and others have taken into account in their deliberations the dangers posed by the acquisition by terrorists of weapons of mass destruction, and the need for international cooperation in combating it, Acknowledging the consideration of issues relating to terrorism and weapons of mass destruction by the Advisory Board on Disarmament Matters,* Taking note of the relevant resolutions> adopted by the General Conference of the International Atomic Energy Agency at its fiftieth regular session, Taking note also of the 2005 World Summit Outcome® adopted at the High- level Plenary Meeting of the sixtieth session of the General Assembly in September 2005 and the adoption of the United Nations Global Counter-Terrorism Strategy on 8 September 2006,° Taking note further of the report of the Secretary-General, submitted pursuant to paragraphs 2 and 4 of resolution 60/78,7 Mindful of the urgent need for addressing, within the United Nations framework and through international cooperation, this threat to humanity, Emphasizing that progress is urgently needed in the area of disarmament and non-proliferation in order to help to maintain international peace and security and to contribute to global efforts against terrorism, 1. Calls upon all Member States to support international efforts to prevent terrorists from acquiring weapons of mass destruction and their means of delivery; 2. Appeals to all Member States to consider signing and ratifying the International Convention for the Suppression of Acts of Nuclear Terrorism' in order to bring about its early entry into force; 3. Urges all Member States to take and strengthen national measures, as appropriate, to prevent terrorists from acquiring weapons of mass destruction, their means of delivery and materials and technologies related to their manufacture, and invites them to inform the Secretary-General, on a voluntary basis, of the measures taken in this regard; 4. Encourages cooperation among and between Member States and relevant regional and international organizations for strengthening national capacities in this regard; 5. Requests the Secretary-General to compile a report on measures already taken by international organizations on issues relating to the linkage between the 5 See International Atomic Energy Agency, Resolutions and Other Decisions of the General Conference, Fiftieth Regular Session, 18-22 September 2006 (GC(50)/RES/DEC(2006)). A/C.1/61/L.52 fight against terrorism and the proliferation of weapons of mass destruction, to seek the views of Member States on additional relevant measures for tackling the global threat posed by the acquisition by terrorists of weapons of mass destruction and to report to the General Assembly at its sixty-second session; 6. Decides to include in the provisional agenda of its sixty-second session the item entitled “Measures to prevent terrorists from acquiring weapons of mass destruction”. 06-56874",10/20/2006,2006_584737,Myanmar,"* Reissued for technical reasons. 1 Resolution 59/290, annex. 2 United Nations, Treaty Series, vol. 1456, No. 24631.",yes
2006,General Assembly,First Committee,Sixty-first session,89,Prevention of an arms race in outer space,"Algeria, Armenia, Bangladesh, Belarus, China, Cuba, Democratic People’s Republic of Korea, Dominican Republic, Ecuador, Egypt, El Salvador, Ghana, Haiti, Honduras, India, Indonesia, Iran (Islamic Republic of), Jamaica, Kuwait, Libyan Arab Jamahiriya, Mongolia, Myanmar, Nepal, Pakistan, Qatar, Russian Federation, Saudi Arabia, Sierra Leone, Sri Lanka, Syrian Arab Republic, Togo, Venezuela (Bolivarian Republic of), Zambia and Zimbabwe",N/A,Prevention of an arms race in outer space,"The General Assembly, Recognizing the common interest of all mankind in the exploration and use of outer space for peaceful purposes, Reaffirming the will of all States that the exploration and use of outer space, including the Moon and other celestial bodies, shall be for peaceful purposes and shall be carried out for the benefit and in the interest of all countries, irrespective of their degree of economic or scientific development, Reaffirming also the provisions of articles III and IV of the Treaty on Principles Governing the Activities of States in the Exploration and Use of Outer Space, including the Moon and Other Celestial Bodies, ! Recalling the obligation of all States to observe the provisions of the Charter of the United Nations regarding the use or threat of use of force in their international relations, including in their space activities, Reaffirming paragraph 80 of the Final Document of the Tenth Special Session of the General Assembly,? in which it is stated that in order to prevent an arms race in outer space, further measures should be taken and appropriate international negotiations held in accordance with the spirit of the Treaty, 1 Resolution 2222 (XXI), annex. 2 Resolution S-10/2. 06-57777 ﬁEi 191006 N O Recalling its previous resolutions on this issue, and taking note of the proposals submitted to the General Assembly at its tenth special session and at its regular sessions, and of the recommendations made to the competent organs of the United Nations and to the Conference on Disarmament, Recognizing that prevention of an arms race in outer space would avert a grave danger for international peace and security, Emphasizing the paramount importance of strict compliance with existing arms limitation and disarmament agreements relevant to outer space, including bilateral agreements, and with the existing legal regime concerning the use of outer space, Considering that wide participation in the legal regime applicable to outer space could contribute to enhancing its effectiveness, Noting that the Ad Hoc Committee on the Prevention of an Arms Race in Outer Space, taking into account its previous efforts since its establishment in 1985 and seeking to enhance its functioning in qualitative terms, continued the examination and identification of various issues, existing agreements and existing proposals, as well as future initiatives relevant to the prevention of an arms race in outer space,3 and that this contributed to a better understanding of a number of problems and to a clearer perception of the various positions, Noting also that there were no objections in principle in the Conference on Disarmament to the re-establishment of the Ad Hoc Committee, subject to re-examination of the mandate contained in the decision of the Conference on Disarmament of 13 February 1992,4 Emphasizing the mutually complementary nature of bilateral and multilateral efforts in the field of preventing an arms race in outer space, and hoping that concrete results will emerge from those efforts as soon as possible, Convinced that further measures should be examined in the search for effective and verifiable bilateral and multilateral agreements in order to prevent an arms race in outer space, including the weaponization of outer space, Stressing that the growing use of outer space increases the need for greater transparency and better information on the part of the international community, Recalling, in this context, its previous resolutions, in particular resolutions 45/55 B of 4 December 1990, 47/51 of 9 December 1992 and 48/74 A of 16 December 1993, in which, inter alia, it reaffirmed the importance of confidence- building measures as a means conducive to ensuring the attainment of the objective of the prevention of an arms race in outer space, Conscious of the benefits of confidence- and security-building measures in the military field, Recognizing that negotiations for the conclusion of an international agreement or agreements to prevent an arms race in outer space remain a priority task of the Ad Hoc Committee and that the concrete proposals on confidence-building measures could form an integral part of such agreements, 3 Official Records of the General Assembly, Forty-ninth Session, Supplement No. 27 (A/49/27), sect. II1.D (para. 5 of the quoted text). 4 CD/1125. A/C.1/61/L.10/Rev.1 Noting with satisfaction the constructive, structured and focused debate on the prevention of an arms race in outer space at the Conference on Disarmament in 2000, 1. Reaffirms the importance and urgency of preventing an arms race in outer space and the readiness of all States to contribute to that common objective, in conformity with the provisions of the Treaty on Principles Governing the Activities of States in the Exploration and Use of Outer Space, including the Moon and Other Celestial Bodies;' 2. Reaffirms its recognition, as stated in the report of the Ad Hoc Committee on the Prevention of an Arms Race in Outer Space, that the legal regime applicable to outer space does not in and of itself guarantee the prevention of an arms race in outer space, that the regime plays a significant role in the prevention of an arms race in that environment, that there is a need to consolidate and reinforce that regime and enhance its effectiveness and that it is important to comply strictly with existing agreements, both bilateral and multilateral; 3. Emphasizes the necessity of further measures with appropriate and effective provisions for verification to prevent an arms race in outer space; 4. Calls upon all States, in particular those with major space capabilities, to contribute actively to the objective of the peaceful use of outer space and of the prevention of an arms race in outer space and to refrain from actions contrary to that objective and to the relevant existing treaties in the interest of maintaining international peace and security and promoting international cooperation; 5. Reiterates that the Conference on Disarmament, as the sole multilateral disarmament negotiating forum, has the primary role in the negotiation of a multilateral agreement or agreements, as appropriate, on the prevention of an arms race in outer space in all its aspects; 6. Invites the Conference on Disarmament to complete the examination and updating of the mandate contained in its decision of 13 February 1992* and to establish an ad hoc committee as early as possible during its 2007 session; 7. Recognizes, in this respect, the growing convergence of views on the elaboration of measures designed to strengthen transparency, confidence and security in the peaceful uses of outer space; 8. Urges States conducting activities in outer space, as well as States interested in conducting such activities, to keep the Conference on Disarmament informed of the progress of bilateral and multilateral negotiations on the matter, if any, so as to facilitate its work; 9. Decides to include in the provisional agenda of its sixty-second session the item entitled “Prevention of an arms race in outer space”. 06-57777",10/18/2006,2006_584823,Myanmar,N/A,yes
