year,Council,Committee,Session,Agenda item,Agenda detail,cosponsored countries,body title number,body title detail,body text,date,file,filecountry,footnote,scanned
2000,General Assembly,N/A,Fifty-fifth session,N/A,United Nations Asssna,"Letter dated 3 August 2000 from the representatives of Burkina Faso, the Gambia, Grenada, Honduras, Malawi, the Marshall Islands, Nauru, Nicaragua, Saint Vincent and the Grenadines, Senegal, Solomon Islands and Swaziland to the United Nations addressed to the Secretary-General Upon the instruction of our respective Governments, we have the honour to request, pursuant to rule 14 of the rules of procedure of the General Assembly, the inclusion in the agenda of the fifty-fifth session of the Assembly of a supplementary item entitled “Need to examine the exceptional international situation pertaining to the Republic of China on Taiwan, to ensure that the fundamental right of its twenty- three million people to participate in the work and activities of the United Nations is fully respected”. Pursuant to rule 20 of the rules of procedure of the General Assembly, we attach an explanatory memorandum (see annex I)",N/A,Signed) Michel Kafando Permanent Representative of Burkina Faso to the United Nations,"(Signed) Baboucarr-Blaise Ismaila Jagne Permanent Representative of the Gambia to the United Nations (Signed) Lamuel A. Stanislaus Permanent Representative of Grenada to the United Nations A/55/227 (Signed) Angel Edmundo Orellana Permanent Representative of Honduras to the United Nations (Signed) Yusuf Mcdadlly Juwayeyi Permanent Representative of the Republic of Malawi to the United Nations (Signed) Jackeo A. Relang Permanent Representative of the Republic of the Marshall Islands to the United Nations (Signed) Vinci Neil Clodumar Permanent Representative of the Republic of Nauru to the United Nations (Signed) Mario H. Castellon Duarte Alternate Permanent Representative Chargé d’affaires a.i. Permanent Mission of Nicaragua to the United Nations (Signed) Dennie M. J. Wilson Permanent Representative of Saint Vincent and the Grenadines to the United Nations (Signed) Ibra Deguéne Ka Permanent Representative of the Republic of Senegal to the United Nations (Signed) Jeremiah Manele Counsellor Chargé d’affaires a.i. Permanent Mission of Solomon Islands to the United Nations (Signed) Joel M. Nhleko Counsellor Chargé d’affaires a.i. Permanent Mission of the Kingdom of Swaziland to the United Nations A/55/227 Annex I to the letter dated 3 August 2000 from the representatives of Burkina Faso, the Gambia, Grenada, Honduras, Malawi, the Marshall Islands, Nauru, Nicaragua, Saint Vincent and the Grenadines, Senegal, Solomon Islands and Swaziland to the United Nations addressed to the Secretary-General Explanatory memorandum As Tuvalu of the South Pacific is to be admitted to the United Nations later this year, the Republic of China on Taiwan will then be the only country in the world that remains excluded from the United Nations. Therefore, there is an urgent need to examine this situation from a whole new perspective and redress this mistaken omission. There are many reasons why the Republic of China should have the right to play a role in the United Nations: The Republic of China is a democratic country and its democratically elected Government is the sole legitimate one that can actually represent the interests and wishes of the people of Taiwan in the United Nations. The Republic of China and the People’s Republic of China have coexisted on their respective sides of the Taiwan Strait, with neither subject to the other’s rule. Over that past half-century, each side has developed its own political system, social values and foreign relations. Therefore, each of these two sides can speak for and represent only the people actually under its jurisdiction on its respective side of the Taiwan Strait. The exclusion of the Republic of China from the United Nations and its related agencies has created a major and serious obstacle for both the Government and the people of the Republic of China in their pursuit of normal participation in international organizations and activities. From 1950 to 1971, the United Nations considered the question of China’s representation. In October 1971, at its twenty-sixth session, the General Assembly adopted resolution 2758 (XXVI), in which it decided that the China seat would be taken by the People’s Republic of China. That resolution, however, failed to address the issue of legitimate representation for the people of Taiwan in the United Nations. Worse still, while the representatives of the Government of the Republic of China are excluded from all United Nations activities, the Republic of China’s lack of membership in the United Nations and General Assembly resolution 2758 (XXVI) have too often been used as pretexts to deter or discourage the participation of individuals and non-governmental groups of the Republic in United Nations activities and all activities related to all functions of the Economic and Social Council. This unjust exclusion of civil associations and individuals of the Republic of China runs counter to the predominant trend of involving all possible participants in international affairs and the United Nations call for global and comprehensive partnership. A/55/227 The Republic of China, a country with significant achievements, is a constructive and responsible member of the international community. The Republic of China has played a positive role in promoting world trade, eradicating poverty and advancing human rights, a fact that merits recognition by Members of the United Nations. The Republic of China has a population of 23 million and a democratic system. Above all, it is a peace-loving country, which is able and willing to carry out the obligations contained in the Charter of the United Nations. Today the people of the Republic of China on Taiwan enjoy a high degree of freedom and democracy. The Republic held its first direct presidential election in March 1996, the first time in history that the Republic elected its highest leader by popular vote. In March 2000, Mr. Chen Shui-bian of the Democratic Progressive Party was elected in the second direct presidential election, marking the first-ever change of political parties for the presidency of the Republic of China. Since Mr. Chen’s inauguration on 20 May 2000, the people of the Republic have witnessed a peaceful transition of power as a result of a democratic election. The Republic of China is one of the most successful examples of economic development in the twentieth century and is now the world’s nineteenth largest economy in terms of GNP, and the fourteenth most important trading country. It is also a major investor in East Asia and possesses the third largest amount of foreign reserves in the world. The Republic of China is also a humanitarian-minded country. Over the years it has sent over 10,000 experts to train technicians in countries all over the world, especially the countries of Asia, the South Pacific, Latin America and Africa, to help develop their agricultural, fishery and livestock industries. It also has provided billions of United States dollars in disaster relief throughout the world, including the People’s Republic of China, over the past several years, and has responded to United Nations appeals for emergency relief and rehabilitation assistance to countries suffering from natural disasters and wars. Currently, the Republic of China contributes capital to regional development programmes through international financial institutions such as the Asian Development Bank, the Central American Bank for Economic Integration, the Inter- American Development Bank and the European Bank for Reconstruction and Development. The Republic of China is fully committed to observing the principles of the Universal Declaration of Human Rights and to its integration into the international human rights system spearheaded by the United Nations. The United Nations should take note of the recent conciliatory gestures of the Republic of China towards the People’s Republic of China and play a facilitating role by providing a forum for their reconciliation and rapprochement. On 20 June 2000, President Chen called upon the leader of the People’s Republic of China, President Jiang Zemin, to work together to bring about a historic summit like that just held between North and South Korea. He indicated that he would be willing to sit down with Mr. Jiang to pursue cross-strait reconciliation, without specifying any preconditions, format or location. He also urged the leaders A/55/227 of the two sides to use their wisdom and creativity, based on the principles of democracy and parity, to jointly create a favourable environment for the betterment of cross-strait relations. He further voiced the hope that the leaders of the Republic of China and the People’s Republic of China would respect the free choice of the people on both sides and work together to resolve the question of a future “one- China”. As an organization dedicated to the preservation and maintenance of world peace, the United Nations should facilitate a reconciliation and peace process between the two sides of the Taiwan Strait. The United Nations can serve as a forum to foster mutual understanding and goodwill between the Republic of China and the People’s Republic of China so that confidence-building measures can be developed in time, thus reducing cross-strait tension. The participation of the Republic of China on Taiwan in the United Nations poses no barrier to the future peaceful resolution of the differences between the two sides of the Taiwan Strait; indeed, it can be conducive to regional peace and security. The examples of the former East Germany and West Germany, and now of the Republic of Korea and the Democratic People’s Republic of Korea, serve as precedents for parallel representation of divided nations in the United Nations. The exchanges between East Germany and West Germany via the United Nations and other international organizations contributed not only to regional peace and security, but also to their peaceful unification in 1990. The simultaneous admission of two Koreas into the United Nations in 1991 also helped to build mutual trust and confidence between the two, which culminated in the June 2000 summit. The strategic position of Taiwan makes it a focal point of the entire Asia and Pacific region. Accordingly, the stability of the Taiwan Strait and its periphery is vital to the maintenance of peace and security for the region in particular and for the world in general. In the absence of an institutionalized crisis-management mechanism that covers the relations across the Taiwan Strait, a role for the Republic of China on Taiwan in the United Nations would bring the area under the peace and security mechanism contained in the United Nations, thus enhancing the maintenance of peace and security in the region. The United Nations should therefore encourage both sides of the Taiwan Strait to work and cooperate in the Organization and its related organizations. The General Assembly should act to ensure that the voice of the 23 million people on Taiwan is heard in the United Nations and its related organizations. Tremendous changes have taken place globally in the past two decades. The world is faced with increasingly demanding tasks in eradicating disease and poverty, protecting the environment and endangered species, regulating human migration and population growth, and promoting human rights and dignity. Many of those issues call for global and comprehensive efforts that transcend traditional national boundaries. To be more effective and efficient, these joint efforts require not only broad support and cooperation from national Governments, but also greater involvement and participation from local governments, civil associations and even individuals. As the world organization with the most comprehensive functions, the United Nations system should invite every possible participant of the international A/55/227 community to join the partnership to further the objectives and purposes of the United Nations. At the dawning of the new millennium, people around the world welcome the Israeli-Arab peace talks, the summit between the North and South Koreas and the imminent accession of both the Republic of China and the People’s Republic of China to the World Trade Organization. All these events signify that reconciliation has replaced confrontation as the dominant spirit of the new century and the mainstream value of the international community. It is high time that the United Nations seriously reconsider the appropriateness of continued exclusion of the Republic of China from this most important global forum. With the participation of the Republic of China, the United Nations can live up to its principle of universality, achieve its goal of preventive diplomacy, and facilitate the cross-strait reconciliation and peace process. A/55/227 Annex II to the letter dated 3 August 2000 from the representatives of Burkina Faso, the Gambia, Grenada, Honduras, Malawi, the Marshall Islands, Nauru, Nicaragua, Saint Vincent and the Grenadines, Senegal, Solomon Islands and Swaziland to the United Nations addressed to the Secretary-General Draft resolution The General Assembly, Considering the fact that the twenty-three million people of the Republic of China on Taiwan are the only remaining people in the world that still do not have actual and legitimate representation in the United Nations, Recognizing that since 1949 the Government of the Republic of China has exercised effective control and jurisdiction over the Taiwan area while the Government of the People’s Republic of China has exercized effective control and jurisdiction over the Chinese mainland during the same time period, Acknowledging that the Republic of China on Taiwan is a constructive and responsible member of the international community, with a democratic system and a strong, dynamic economy, Observing that the strategic location of Taiwan is vital to the peace and security of the East Asian and Pacific regions and the world, Understanding that the determination of future relations between the Republic of China on Taiwan and the People’s Republic of China should fully respect the free will of the people on both sides and be implemented in a peaceful way, Mindful of the fact that the Republic of China has committed itself to peaceful resolution of differences with the People’s Republic of China and has repeatedly offered friendly and conciliatory gestures towards the leadership of the People’s Republic of China, Noting the declaration of the Government of the Republic of China on Taiwan that it accepts without condition the obligations contained in the Charter of the United Nations, that it is able and willing to carry out those obligations, and that it is fully committed to observing the principles and spirit of the Universal Declaration of Human Rights, Affirming the significance that recognition of and respect for the fundamental rights of the twenty-three million people of the Republic of China on Taiwan would have for upholding the principles and spirit of the Charter of the United Nations, Decides: (a) To respect fully the choice of the people on both sides of the Taiwan Strait with regard to their future relations and to reject any unilateral arrangement or forced resolution of their differences by other than peaceful means; (b) To express its concern about cross-strait tension and its possible impact upon regional peace, stability and prosperity, and to encourage the Republic of China on Taiwan and the People’s Republic of China to resume their dialogue and communications on a peaceful basis and equal footing; A/55/227 (c) To establish a working group of the General Assembly with the mandate of examining thoroughly the exceptional international situation pertaining to the Republic of China on Taiwan so as to ensure that its twenty-three million people participate, with a direct and representative voice, in the United Nations and its related agencies.",08/04/2000,2000_420451,Nauru,N/A,yes
2000,General Assembly,N/A,Fifty-fourth session,176,Review of the problem of human immunodeficiency virus/ acquired immunodeficiency syndrome in all its aspects,"Azerbaijan, Barbados, Brazil, Burundi, Cambodia, Costa Rica, Czech Republic, Democratic Republic of the Congo, Fiji, Gabon, Jamaica, Kazakhstan, Kyrgyzstan, Lesotho, Libyan Arab Jamahiriya, Marshall Islands, Monaco, Namibia, Nauru, Nicaragua, Nigeria, Romania, Saint Kitts and Nevis, San Marino, Saudi Arabia, Senegal, Slovenia, Swaziland, Tajikistan, Thailand, Togo, Trinidad and Tobago, Turkmenistan, Uganda, Ukraine, United Republic of Tanzania and Zimbabwe",N/A,N/A,"The General Assembly, Recalling its resolution 44/233 of 22 December 1989, Economic and Social Council resolution 1999/36 of 28 July 1999 and other relevant resolutions, Noting with deep concern the accelerating spread of human immunodeficiency virus (HIV), which has already infected millions of people worldwide, and the resulting increase in cases of acquired immunodeficiency syndrome (AIDS), Recognizing that no country in the world has been spared by the AIDS epidemic, and that 90 per cent of the people living with HIV/AIDS live in the developing world, which has been very severely affected, Mindful that the AIDS epidemic has become a development crisis in many countries, with devastating consequences for human, social and economic progress, and that the development gains of the past fifty years, including the increase in child survival and in life expectancy, are being reversed by the HIV/AIDS epidemic, Alarmed that, despite all efforts, the HIV/AIDS epidemic is having a more severe impact than was originally projected, and recognizing that resources devoted to combating the epidemic at both national and international levels are not commensurate with the magnitude of the problem, Recognizing that the needs in countries to address AIDS far outweigh both the human and the financial resources being made available and that high-level political commitment is critical to strengthen the response to the epidemic, 1. Decides to convene a special session of the General Assembly for a duration of three days in May 2001, to review the problem of human immunodeficiency virus/acquired immunodeficiency syndrome (HIV/AIDS) in all its aspects; 2. Decides also that the special session will be open to the participation of all States Members of the United Nations and observers, as well as States members of the specialized agencies that are not Members of the United Nations, in the capacity of observers; 3. Urges Member States and observers to ensure their representation at the special session at a high political level; 4. Decides that non-governmental organizations in consultative status with the Economic and Social Council may participate in the special session without creating a precedent for future special sessions of the General Assembly; 5. Encourages all relevant entities of the United Nations system, including the programmes, funds and specialized agencies, to participate at the highest level in the special session; 6. Requests the Secretary-General to make the necessary administrative arrangements towards the convening of the special session; 7. Also requests the Secretary-General to make available all necessary documentation for the special session in a timely manner; 8. Decides that the modalities for the preparatory process of the special session should be finalized, at the earliest opportunity, at the fifty-fifth session of the General Assembly; 9. Also decides to include in the agenda of its fifty-fifth session the item entitled “Review of the problem of human immunodeficiency virus/acquired immunodeficiency syndrome in all its aspects”.",08/23/2000,2000_421117,Nauru,N/A,yes
2000,General Assembly,N/A,Fifty-fifth session,19,* Admission of new Members to the United Nations,"Argentina, Australia, Belgium, Fiji, France, Guatemala, Ireland, Italy, Malaysia, Maldives, Marshall Islands, Mexico, Micronesia (Federated States of), Nauru, Nepal, New Zealand, Norway, Papua New Guinea, Peru, Samoa, Seychelles, Singapore, Solomon Islands, Sri Lanka, Thailand and Tonga",N/A,Admission of Tuvalu to membership in the United Nations,"The General Assembly, Having received the recommendation of the Security Council of 17 February 2000 that Tuvalu should be admitted to membership in the United Nations,' Having considered the application for membership of Tuvalu,’ Decides to admit Tuvalu to membership in the United Nations.",08/28/2000,2000_421353,Nauru,* A/55/150. ' A/54/758. 2 A/54/699-S/2000/5.,yes
2000,General Assembly,N/A,Fifty-fourth session,176,Review of the problem of human immunodeficiency virus/ acquired immunodeficiency syndrome in all its aspects,"Algeria, Austria, Azerbaijan, Bahamas, Barbados, Belgium, Belize, Benin, Brazil, Bulgaria, Burkina Faso, Burundi, Cambodia, Costa Rica, Croatia, Cuba, Czech Republic, Democratic Republic of the Congo, Denmark, Egypt, Eritrea, Fiji, Finland, France, Gabon, Germany, Greece, Guyana, Hungary, Ireland, Italy, Jamaica, Japan, Kazakhstan, Kyrgyzstan, Lesotho, Liberia, Libyan Arab Jamahiriya, Luxembourg, Malaysia, Mali, Marshall Islands, Monaco, Namibia, Nauru, Netherlands, Nicaragua, Nigeria, Norway, Portugal, Republic of Moldova, Romania, Saint Kitts and Nevis, San Marino, Saudi Arabia, Senegal, Slovenia, South Africa, Spain, Sudan, Swaziland, Sweden, Tajikistan, Thailand, the former Yugoslav Republic of Macedonia, Togo, Trinidad and Tobago, Turkmenistan, Uganda, Ukraine, United Kingdom of Great Britain and Northern Ireland, United Republic of Tanzania and Zimbabwe",N/A,N/A,"The General Assembly, Recalling its resolution 44/233 of 22 December 1989, Economic and Social Council resolution 1999/36 of 28 July 1999 and other relevant resolutions, Noting with deep concern the accelerating spread of human immunodeficiency virus (HIV), which has already infected millions of people worldwide, and the resulting increase in cases of acquired immunodeficiency syndrome (AIDS), Recognizing that no country in the world has been spared by the AIDS epidemic, and that 90 per cent of the people living with HIV/AIDS live in the developing world, which has been very severely affected, particularly in Africa, Mindful that the AIDS epidemic has become a development crisis in many countries, with devastating consequences for human, social and economic progress, and that the development gains of the past fifty years, including the increase in child survival and in life expectancy, are being reversed by the HIV/AIDS epidemic, Alarmed that, despite all efforts, the HIV/AIDS epidemic is having a more severe impact than was originally projected, and recognizing that resources devoted to combating the epidemic at both national and international levels are not commensurate with the magnitude of the problem, Commending the efforts by the Joint United Nations Programme on HIV/AIDS to coordinate and intensify efforts to address HIV/AIDS in all appropriate forums, Recognizing also that the needs in countries to address AIDS far outweigh both the human and the financial resources being made available and that high-level political commitment is critical to strengthen the response to the epidemic, 1. Decides to convene a special session of the General Assembly for a duration of three days, to review and address the problem of HIV/AIDS in all its aspects and to coordinate and intensify international efforts to combat it, as soon as possible, preferably in May 2001 but not later than the end of its fifty-sixth regular session; 2. Urges Member States and observers to ensure their representation at the special session at a high political level; 3. Also decides that the exact date of the special session, as well as the modalities, participation in and organization of the preparatory process and the special session, should be finalized, at the earliest opportunity, at its fifty-fifth session; 4. Further decides to include in the agenda of its fifty-fifth session the item entitled “Review of the problem of human immunodeficiency virus/acquired immunodeficiency syndrome in all its aspects”.",08/31/2000,2000_421593,Nauru,N/A,yes
