year,Council,Committee,Session,Agenda item,Agenda detail,cosponsored countries,body title number,body title detail,body text,date,file,filecountry,footnote,scanned
2019,General Assembly,N/A,Seventy-third session,29,Advancement of women,"Albania, Andorra, Angola, Armenia, Australia, Austria, Azerbaijan, Bangladesh, Belgium, Benin, Bosnia and Herzegovina, Bulgaria, Cabo Verde, Canada, Central African Republic, Chile, China, Colombia, Comoros, Céte d’Ivoire, Croatia, Czechia, Djibouti, Egypt, Equatorial Guinea, Eritrea, Estonia, Finland, France, Georgia, Hungary, Ireland, Israel, Japan, Kenya, Latvia, Lebanon, Liberia, Lithuania, Luxembourg, Malaysia, Mali, Malta, Mexico, Micronesia (Federated States of), Monaco, Mongolia, Morocco, Nigeria, Norway, Paraguay, Peru, Philippines, Portugal, Qatar, Republic of Moldova, Romania, Samoa, Seychelles, Sierra Leone, Spain, Sri Lanka, Switzerland, Thailand, Turkey, Uruguay, Vanuatu, Venezuela (Bolivarian Republic of), Viet Nam and Zambia",N/A,Twenty-fifth anniversary of the Fourth World Conference on Women,"Addendum Add the following countries to the list of sponsors of the resolution: Algeria, Antigua and Barbuda, Argentina, Barbados, Bolivia (Plurinational State of), Botswana, Burkina Faso, Burundi, Cameroon, Congo, Costa Rica, Cuba, Cyprus, Democratic Republic of the Congo, Denmark, El Salvador, Eswatini, Gambia, Germany, Ghana, Greece, Guatemala, Guinea, Guinea- Bissau, Guyana, Haiti, Iceland, Indonesia, Italy, Jamaica, Kazakhstan, Lao People’s Democratic Republic, Lesotho, Libya, Liechtenstein, Maldives, Mauritius, Montenegro, Mozambique, Myanmar, Namibia, Nepal, Netherlands, New Zealand, North Macedonia, Palau, Panama, Papua New Guinea, Poland, Republic of Korea, Rwanda, Saint Lucia, Saint Vincent and the Grenadines, San Marino, Sao Tome and Principe, Senegal, Serbia, Slovakia, Slovenia, Somalia, South Africa, South Sudan, Sudan, Sweden, Tajikistan, Togo, Tunisia, Tuvalu, Uganda, Ukraine, United Kingdom of Great Britain and Northern Ireland, United Republic of Tanzania and Zimbabwe Ob] 0 472 Please recycle OQ ol 19-08414 ii 240519 A A A",05/22/2019,2019_3805911,Nepal,N/A,yes
2019,General Assembly,N/A,Seventy-fourth session,N/A,United Nations Av74/293,"Letter dated 16 August 2019 from the representatives of China, Cambodia, the Islamic Republic of Iran, Kyrgyzstan, the Lao People’s Democratic Republic, Mongolia, Myanmar, Nepal, Pakistan, Singapore, Uzbekistan and Viet Nam to the United Nations addressed to the Secretary-General Pursuant to rule 14 of the rules of procedure of the General Assembly, we have the honour to jointly request the inclusion in the agenda of the seventy-fourth session of the General Assembly of a supplementary item entitled “Observer status for the Boao Forum for Asia in the General Assembly”. The Boao Forum for Asia is a non-profit international organization dedicated to providing a high-level venue for dialogue among Governments, businesses and academic leaders in Asia and other regions on major Asian and global issues. The Forum strives to promote economic exchanges, interaction and cooperation within the region, as well as between the region and other parts of the world in the pursuit of common development. It holds its annual conference in Hainan Province, China, organizes regional and international conferences to discuss the economic and social development of Asia and beyond, as well as key issues concerning technology and innovation, education, health, culture and the media, and to propose initiatives to strengthen cooperation between Governments and businesses. Twenty-nine countries, namely, the Commonwealth of Australia, the People’s Republic of Bangladesh, Brunei Darussalam, the Kingdom of Cambodia, the People’s Republic of China, the Republic of India, the Republic of Indonesia, the Islamic Republic of Iran, the State of Israel, Japan, the Republic of Kazakhstan, the Kyrgyz Republic, the Lao People’s Democratic Republic, the Republic of Maldives, Malaysia, Mongolia, the Republic of the Union of Myanmar, the Federal Democratic Republic of Nepal, New Zealand, the Islamic Republic of Pakistan, the Republic of the Philippines, the Republic of Korea, the Republic of Singapore, the Democratic Socialist Republic of Sri Lanka, the Republic of Tajikistan, the Kingdom of Thailand, OF ao :ay2 Please recycle OQ ol 19-14083 HA 230819 A A A A/74/293 Turkmenistan, the Republic of Uzbekistan and the Socialist Republic of Viet Nam are initial countries of the Forum. Membership is open to all members of the United Nations. The Forum signed a cooperation agreement with the Department of Economic and Social Affairs of the United Nations Secretariat in 2019 to advance their shared goals. In accordance with rule 20 of the rules of procedure of the General Assembly, an explanatory memorandum (annex J)",N/A,We have the honour to request that the present letter and its annexes be circulated as a document of the General Assembly.,"(Signed) Zhang Jun Permanent Representative of the People’s Republic of China to the United Nations (Signed) Sovann Ke Permanent Representative of the Kingdom of Cambodia to the United Nations (Signed) Majid Takht Ravanchi Permanent Representative of the Islamic Republic of Iran to the United Nations (Signed) Mirgul Moldoisaeva Permanent Representative of the Kyrgyz Republic to the United Nations (Signed) Khiane Phansourivong Permanent Representative of the Lao People’s Democratic Republic to the United Nations (Signed) Baasankhuu Purev Chargé d’affaires a.i. of the Permanent Mission of Mongolia to the United Nations (Signed) Hau Do Suan Permanent Representative of the Republic of the Union of Myanmar to the United Nations (Signed) Amrit Bahadur Rai Permanent Representative of the Federal Democratic Republic of Nepal to the United Nations (Signed) Maleeha Lodhi Permanent Representative of the Islamic Republic of Pakistan to the United Nations (Signed) Burhan Gafoor Permanent Representative of the Republic of Singapore to the United Nations (Signed) Bakhtiyor Ibragimov Permanent Representative of the Republic of Uzbekistan to the United Nations (Signed) Dang Dinh Quy Permanent Representative of the Socialist Republic of Viet Nam to the United Nations 2/6 A/74/293 Annex I Explanatory memorandum The Boao Forum for Asia is an international organization jointly initiated by 29 Asia-Pacific countries (see the attached list). The objectives of the Forum include (1) to promote and deepen economic exchange, interaction and cooperation within Asia as well as between Asia and other parts of the world; and (2) to provide a high- level venue for dialogue among Governments, businesses, experts and scholars to discuss economic, social, environmental and other issues important for Asia and the world. On the proposal of Fidel V. Ramos, former President of the Philippines, Bob Hawke, former Prime Minister of Australia, and Morihiro Hosokawa, former Prime Minister of Japan, representatives of 25 countries met in Hainan Province, China, on 19 November 2000, and agreed that the Boao Forum for Asia would be established and its headquarters permanently located at Boao. On 27 February 2001, the Charter of the Boao Forum for Asia was unanimously adopted by the representatives of all the participating countries, and 26 countries including China became initial countries of the Forum. In 2006 and 2016, upon the requests of their Governments, the Forum accepted Israel, New Zealand and the Maldives as initial countries in addition to the original list. The Boao Forum for Asia consists of the General Meeting of Members, the Board of Directors, the Secretariat, the Research and Training Institute and the Council of Advisers. The General Meeting of Members is the ultimate authority of the Forum, and includes 234 political and business leaders, government agencies, companies and think tanks from 36 countries and regions around the world (as at 31 July 2019). The Board of Directors functions as the supreme executive body of the General Meeting. The 19 board members include former political leaders, business leaders and former heads of international organizations, who are nominated by Governments of relevant countries and approved by the General Meeting. The incumbent Chair of the Board of Directors is Mr. Ban Ki-moon, former Secretary- General of the United Nations. In accordance with the Charter of the Boao Forum for Asia and the laws of China, the host country, the Forum possesses full juridical personality and has full capacity to contract, to acquire and to dispose of immovable and movable property, and to institute legal proceedings. In 2005, a memorandum of understanding was signed by the Chinese Government and the Forum, which ensures for the Forum treatment as an intergovernmental international organization with regard to premises, tax concessions, entry and exit and the like. To help Asian countries to achieve common development and deepen economic cooperation with other regions, the Boao Forum for Asia holds its annual conference in Boao in the spring. State leaders, business elites and opinion leaders from various countries are invited to discuss key issues on the economic and social development of Asia and the world, such as finance, trade, investment and the environment. During the annual conference, consensus is reached, and regional and international initiatives are launched through exchanges on an equal footing. At the invitation of Governments, businesses and think tanks, the Boao Forum for Asia organizes conferences in various countries in Asia and beyond to forge partnerships between the public and private sectors and promote trade and investment facilitation. The Boao Forum for Asia works closely with the United Nations specialized agencies and major international economic organizations in co-hosting conferences 3/6 A/74/293 in specialized areas, conducting joint studies and releasing reports on regional and global economic trends. In 2019, the Forum signed a cooperation agreement with the Department of Economic and Social Affairs of the United Nations Secretariat and held the Global Health Forum with the World Health Organization to advance their shared goals. We believe that the Boao Forum for Asia, which is based in Asia and with a global outlook, provides intellectual support for the sustainable development of the Asian economy and actively promotes economic globalization. It commits to safeguarding the international system with the United Nations at the core and to upholding a multilateral trading system that is open, transparent, inclusive, just and equitable. As an international public good and a platform for exchange of ideas, the Forum is jointly initiated and operated by Asian countries and receives support from around the world. Its activities are consistent with the purposes and principles of the United Nations in the socioeconomic fields. We are convinced that granting the Boao Forum for Asia observer status in the General Assembly will help to facilitate deeper and long-term cooperation between the Forum and the United Nations. This will not only support the collaboration between the Asian countries in the pursuit of the 2030 Sustainable Development Goals, but also promote the robust, inclusive and sustainable growth of the world economy. 4/6 A/74/293 List of initial countries of the Boao Forum for Asia — er nN anw FF YN NO NY NY NY WN KN NY NY NO RO RR ee ee NAAR HN = SSH NDA BR wWN FS The Commonwealth of Australia The People’s Republic of Bangladesh Brunei Darussalam The Kingdom of Cambodia The People’s Republic of China The Republic of India The Republic of Indonesia The Islamic Republic of Iran The State of Israel Japan The Republic of Kazakhstan The Kyrgyz Republic The Lao People’s Democratic Republic The Republic of Maldives Malaysia Mongolia The Republic of the Union of Myanmar The Federal Democratic Republic of Nepal New Zealand The Islamic Republic of Pakistan The Republic of the Philippines The Republic of Korea The Republic of Singapore The Democratic Socialist Republic of Sri Lanka The Republic of Tajikistan The Kingdom of Thailand Turkmenistan The Republic of Uzbekistan The Socialist Republic of Viet Nam 5/6 A/74/293 Annex IT Draft resolution Observer status for the Boao Forum for Asia in the General Assembly The General Assembly, Noting the aspiration of the Boao Forum for Asia to develop its cooperation with the United Nations, 1. Decides to invite the Boao Forum for Asia to participate in the sessions and the work of the General Assembly in the capacity of observer; 2. Requests the Secretary-General to take the action necessary to implement the present resolution. 19-14083 6/6",08/19/2019,2019_3825179,Nepal,N/A,yes
2019,General Assembly,N/A,Seventy-third session,15,Culture of peace,"Afghanistan, Armenia, Benin, Equatorial Guinea, Hungary, Kuwait, Lebanon, Morocco, Poland, Suriname and Venezuela (Bolivarian Republic of)",N/A,Academy for Human Encounters and Dialogue,"Addendum Add the following countries to the list of sponsors of the resolution: Albania, Algeria, Andorra, Angola, Antigua and Barbuda, Argentina, Austria, Azerbaijan, Bahamas, Bahrain, Bangladesh, Barbados, Belarus, Belgium, Belize, Bhutan, Bolivia (Plurinational State of), Bosnia and Herzegovina, Botswana, Brazil, Brunei Darussalam, Bulgaria, Burkina Faso, Burundi, Cabo Verde, Cambodia, Cameroon, Canada, Central African Republic, Chad, Chile, China, Colombia, Comoros, Congo, Costa Rica, Croatia, Cuba, Cyprus, Czechia, Cote d’Ivoire, Democratic People’s Republic of Korea, Democratic Republic of the Congo, Denmark, Djibouti, Dominica, Dominican Republic, Ecuador, Egypt, El Salvador, Eritrea, Estonia, Eswatini, Ethiopia, Fiji, Finland, France, Gabon, Gambia, Germany, Ghana, Greece, Grenada, Guatemala, Guinea, Guinea- Bissau, Guyana, Haiti, Honduras, Iceland, India, Indonesia, Iran (Islamic Republic of), Iraq, Ireland, Italy, Jamaica, Japan, Jordan, Kazakhstan, Kenya, Kiribati, Kyrgyzstan, Lao People’s Democratic Republic, Latvia, Lesotho, Liberia, Libya, Liechtenstein, Lithuania, Luxembourg, Madagascar, Malawi, Malaysia, Maldives, Mali, Malta, Mauritania, Mauritius, Mexico, Monaco, Mongolia, Montenegro, Mozambique, Myanmar, Namibia, Nepal, Netherlands, New Zealand, Nicaragua, Niger, Nigeria, North Macedonia, Norway, Oman, Pakistan, Palau, Panama, Papua New Guinea, Paraguay, Peru, Philippines, Portugal, Qatar, Republic of Korea, Republic of Moldova, Romania, Rwanda, Saint Kitts and Nevis, Saint Lucia, Saint Vincent and the Grenadines, San Marino, Sao Tome and Principe, Saudi Arabia, Senegal, Serbia, Seychelles, Sierra Leone, Singapore, Slovakia, Slovenia, Somalia, South Africa, South Sudan, Spain, Sri Lanka, Sudan, Sweden, Switzerland, Syrian Arab Republic, Thailand, Timor-Leste, Togo, Trinidad and Tobago, Tunisia, Turkey, Turkmenistan, Uganda, United Arab Emirates, United Republic of Tanzania, Uruguay, Uzbekistan, Vanuatu, Viet Nam, Yemen, Zambia, Zimbabwe and State of Palestine Please recycle eS 19-15852 1 041019 A A",09/16/2019,2019_3829881,Nepal,N/A,yes
2019,General Assembly,Sixth Committee,Seventy-fourth session,174,Observer status for the Boao Forum for Asia in the General Assembly,"Cambodia, China, Indonesia, Iran (Islamic Republic of), Kazakhstan, Kyrgyzstan, Lao People’s Democratic Republic, Mongolia, Myanmar, Nepal, Pakistan, Philippines, Republic of Korea, Saudi Arabia, Singapore, Sri Lanka, Thailand, Uzbekistan and Viet Nam",N/A,Observer status for the Boao Forum for Asia in the General Assembly,"The General Assembly, Wishing to promote cooperation between the United Nations and the Boao Forum for Asia, 1. Decides to invite the Boao Forum for Asia to participate in the sessions and the work of the General Assembly in the capacity of observer; 2. Requests the Secretary-General to take the action necessary to implement the present resolution. ORO ar Please recycle OQ ol 19-17706 i 161019 A AA A",10/14/2019,2019_3832240,Nepal,N/A,yes
2019,General Assembly,First Committee,Seventy-fourth session,98 (t),General and complete disarmament: measures to prevent terrorists from acquiring weapons of mass destruction,"Angola, Argentina, Australia, Austria, Bangladesh, Belgium, Bosnia and Herzegovina, Bulgaria, Canada, Croatia, Cyprus, Czechia, Denmark, Eritrea, Estonia, Finland, France, Georgia, Germany, Greece, Guatemala, Hungary, Iceland, India, Iraq, Ireland, Italy, Latvia, Lithuania, Luxembourg, Malawi, Malta, Montenegro, Myanmar, Nepal, Netherlands, New Zealand, North Macedonia, Norway, Philippines, Poland, Portugal, Republic of Moldova, Romania, San Marino, Serbia, Singapore, Slovakia, Spain, Sweden, Thailand, United Kingdom of Great Britain and Northern Ireland and United States of America",N/A,Measures to prevent terrorists from acquiring weapons of mass destruction,"The General Assembly, Recalling its resolution 73/55 of 5 December 2018, Recognizing the determination of the international community to combat terrorism, as evidenced in relevant General Assembly and Security Council resolutions, Deeply concerned by the growing risk of linkages between terrorism and weapons of mass destruction, and in particular by the fact that terrorists may seek to acquire weapons of mass destruction, Cognizant of the steps taken by States to implement Security Council resolution 1540 (2004) of 28 April 2004 on the non-proliferation of weapons of mass destruction, Taking note of Security Council resolution 2325 (2016) of 15 December 2016 on the non-proliferation of weapons of mass destruction, Welcoming the entry into force on 7 July 2007 of the International Convention for the Suppression of Acts of Nuclear Terrorism, ! ' United Nations, Treaty Series, vol. 2445, No. 44004. Please recycle OQ + 19-17725 i 221019 A AA Welcoming also the adoption, by consensus, of amendments to strengthen the Convention on the Physical Protection of Nuclear Material”? by the International Atomic Energy Agency on 8 July 2005, and their entry into force on 8 May 2016, Noting the support expressed in the Final Document of the Seventeenth Conference of Heads of State or Government of Non-Aligned Countries, held on Margarita Island, Bolivarian Republic of Venezuela, from 13 to 18 September 2016, for measures to prevent terrorists from acquiring weapons of mass destruction, Noting also that the Group of Eight, the European Union, the Regional Forum of the Association of Southeast Asian Nations and others have taken into account in their deliberations the dangers posed by the likely acquisition by terrorists of weapons of mass destruction and the need for international cooperation in combating it, and that the Global Initiative to Combat Nuclear Terrorism has been launched jointly by the Russian Federation and the United States of America, Noting further the holding of the Nuclear Security Summit on 12 and 13 April 2010 in Washington, D.C., on 26 and 27 March 2012 in Seoul, on 24 and 25 March 2014 in The Hague and on 31 March and 1 April 2016 in Washington, D.C., Noting the holding of the high-level meeting on countering nuclear terrorism, with a focus on strengthening the legal framework, in New York on 28 September 2012, Acknowledging the consideration of issues relating to terrorism and weapons of mass destruction by the Advisory Board on Disarmament Matters, ° Taking note of the holding by the International Atomic Energy Agency of the International Conference on Nuclear Security: Commitments and Actions, in Vienna in December 2016, and the first International Conference on Nuclear Security: Enhancing Global Efforts, in Vienna in July 2013, and the relevant resolutions adopted by the General Conference of the Agency at its sixty-second regular session, Taking note also of the Code of Conduct on the Safety and Security of Radioactive Sources, approved by the Board of Governors of the International Atomic Energy Agency on 8 September 2003, and the supplementary Guidance on the Management of Disused Radioactive Sources, approved by the Board of Governors of the Agency on 11 September 2017, Taking note further of the 2005 World Summit Outcome adopted at the high- level plenary meeting of the General Assembly on 16 September 2005‘ and the adoption of the United Nations Global Counter-Terrorism Strategy on 8 September 2006,° Taking note of the report of the Secretary-General submitted pursuant to paragraph 5 of resolution 73/55,° Mindful of the urgent need for addressing, within the United Nations framework and through international cooperation, this threat to humanity, Emphasizing that progress is urgently needed in the area of disarmament and non-proliferation in order to maintain international peace and security and to contribute to global efforts against terrorism, 2 Ibid., vol. 1456, No. 24631. 3 See A/59/361. > Resolution 60/288. 2/3 1. Calls upon all Member States to support international efforts to prevent terrorists from acquiring weapons of mass destruction and their means of delivery; 2. Appeals to all Member States to consider early accession to and ratification of the International Convention for the Suppression of Acts of Nuclear Terrorism, ! and encourages States parties to the Convention to review its implementation; 3. Urges all Member States to take and strengthen national measures, as appropriate, to prevent terrorists from acquiring weapons of mass destruction, their means of delivery and materials and technologies related to their manufacture; 4. Encourages cooperation among and between Member States and relevant regional and international organizations for strengthening national capacities in this regard; 5. Requests the Secretary-General to compile a report on measures already taken by international organizations on issues relating to the linkage between the fight against terrorism and the proliferation of weapons of mass destruction and to seek the views of Member States on additional relevant measures, including national measures, for tackling the global threat posed by the acquisition by terrorists of weapons of mass destruction and to report to the General Assembly at its seventy- fifth session; 6. Decides to include in the provisional agenda of its seventy-fifth session, under the item entitled “General and complete disarmament”, the sub-item entitled “Measures to prevent terrorists from acquiring weapons of mass destruction”. 19-17725 3/3",10/21/2019,2019_3832707,Nepal,N/A,yes
