year,Council,Committee,Session,Agenda item,Agenda detail,cosponsored countries,body title number,body title detail,body text,date,file,filecountry,footnote,scanned
2019,General Assembly,First Committee,Seventy-fourth session,98 (aa),General and complete disarmament: united action with renewed determination towards the total elimination of nuclear weapons,"Angola, Australia, Belgium, Bulgaria, Canada, Comoros, Croatia, Czechia, Dominican Republic, Estonia, Finland, Georgia, Greece, Haiti, Japan, Luxembourg, Nepal, Netherlands, Paraguay, Portugal, Seychelles, Slovakia, Slovenia, Spain, Tuvalu, United Arab Emirates and Vanuatu",N/A,Joint courses of action and future-oriented dialogue towards a world without nuclear weapons,"The General Assembly, Reaffirming that achieving a world without nuclear weapons is a common goal for the international community, Reaffirming also that the Treaty on the Non-Proliferation of Nuclear Weapons! is the essential foundation to realize the common goal, stressing that nuclear disarmament, nuclear non-proliferation and the peaceful uses of nuclear energy are mutually reinforcing and are essential for maintaining and strengthening the regime of the Treaty, and reaffirming its determination to further enhance the universality of the Treaty, Emphasizing the importance of a successful outcome of the Review Conference of the Parties to the Treaty on the Non-Proliferation of Nuclear Weapons to be held in 2020, on the occasion of the fiftieth anniversary of the entry into force of the Treaty, and seventy-five years since the use of nuclear weapons in Hiroshima and Nagasaki, stressing that since that time no nuclear weapons have been used, and emphasizing the necessity for all States to comply with their obligations regarding nuclear disarmament and non-proliferation under the Treaty, Reaffirming the importance of implementing agreed steps contained in the Final Documents of the 19957 Review and Extension Conference of the Parties to the Treaty ' United Nations, Treaty Series, vol. 729, No. 10485. 2 1995 Review and Extension Conference of the Parties to the Treaty on the Non-Proliferation of Nuclear Weapons, Final Document, Part I (NPT/CONF.1995/32 (Part I) and NPT/CONF.1995/32 (Part I1)/Corr.2). Please recycle eS 19-18077 1 221019 A A A on the Non-Proliferation of Nuclear Weapons and of the 2000? and 20104 Review Conferences of the Parties to the Treaty on the Non-Proliferation of Nuclear Weapons, Bearing in mind that various approaches exist towards the realization of a world without nuclear weapons and that confidence-building among all States is essential to this end, Emphasizing the importance for all States of taking further practical steps and effective measures towards the total elimination of nuclear weapons, in a way that promotes international stability, peace and security, and based on the principle of undiminished and increased security for all, Encouraging the establishment of further nuclear-weapon-free zones, where appropriate, on the basis of arrangements freely arrived at among States of the region concerned, and in accordance with the 1999 guidelines of the Disarmament Commission,» Stressing the importance of the immediate commencement of negotiations on a treaty banning the production of fissile material for use in nuclear weapons or other nuclear explosive devices in the Conference on Disarmament and its early conclusion, Stressing also the importance of the signing and ratification of the Comprehensive Nuclear-Test-Ban Treaty® without delay by all States, in particular the eight remaining States in annex 2 thereof, Recognizing the importance of reducing the risk of nuclear weapons being used due to miscalculation or misunderstanding, Recalling the indispensable role of effective and credible nuclear disarmament verification in the course of achieving and then maintaining the elimination of nuclear weapons with compliance, and welcoming the substantive work of the Group of Governmental Experts to consider the role of verification in advancing nuclear disarmament, as contained in its report,’ Recognizing the value of cooperative work across the existing multilateral disarmament machinery to support work towards disarmament objectives, Noting the importance of considering the possible impacts of developments in science and technology on nuclear disarmament, non-proliferation and international security, Stressing that effective nuclear disarmament and the enhancement of international security are mutually reinforcing, Reaffirming that further strengthening of the international regime for nuclear non-proliferation is essential to international peace and security, Welcoming recent diplomatic efforts to achieve the complete, verifiable and irreversible dismantlement of all of the Democratic People’s Republic of Korea’s nuclear weapons and ballistic missiles of all ranges, including through the meetings 3 2000 Review Conference of the Parties to the Treaty on the Non-Proliferation of Nuclear Weapons, Final Document, vols. I-UI (NPT/CONF.2000/28 (Parts I and I1), NPT/CONF.2000/28 (Part Ill) and NPT/CONF.2000/28 (Part IV)). 4 2010 Review Conference of the Parties to the Treaty on the Non-Proliferation of Nuclear Weapons, Final Document, vols. I-III (NPT/CONF.2010/50 (Vol. I, NPT/CONF.2010/50 (Vol. I) and NPT/CONF.2010/50 (Vol. IID). > Official Records of the General Assembly, Fifty-fourth Session, Supplement No. 42 (A/54/42), annex I, sect. C. ® See resolution 50/245 and A/50/1027. 2/4 between the President of the United States of America and the Chairman of the Workers’ Party of the Democratic People’s Republic of Korea, Noting that disarmament and non-proliferation education encompassing different generations, areas and genders underscores efforts and creates momentum towards achieving a world without nuclear weapons, Recognizing the catastrophic humanitarian consequences that would result from the use of nuclear weapons, Welcoming the visits of leaders, youth and others to Hiroshima and Nagasaki, Reaffirming that the international community needs to take immediate actions together and to conduct future-oriented dialogues in order to further facilitate the implementation of concrete nuclear disarmament measures through confidence- building, 1. Reaffirms that all States parties to the Treaty on the Non-Proliferation of Nuclear Weapons! are committed to the ultimate goal to eliminate nuclear weapons, including through easing international tension, as well as strengthening trust between States and the international regime for nuclear non-proliferation, and to full and steady implementation of the Treaty in all its aspects, including article VI of the Treaty, towards the realization of a world without nuclear weapons; 2. Calls upon all States parties to the Treaty on the Non-Proliferation of Nuclear Weapons to identify concrete measures to put the commitments into practice towards the 2020 Review Conference; 3. Encourages the following, as joint courses of action: (a) All States, in particular the nuclear-weapon States, to immediately take concrete measures to enhance transparency and mutual confidence, including, inter alia, by providing frequent and detailed reporting on the implementation of the Treaty on the Non-Proliferation of Nuclear Weapons and opportunities for discussion of these reports; (b) All States possessing nuclear weapons to take actions to reduce the risks of nuclear detonation occurring either by miscalculation or by misunderstanding; (c) All States to immediately make every effort, including declaring and maintaining moratoriums on the production of fissile material for use in nuclear weapons or other nuclear explosive devices, as well as deepening substantive discussions in the Conference on Disarmament, to start negotiations on a treaty banning the production of fissile material for use in nuclear weapons or other nuclear explosive devices; (d) All States, including the eight remaining States in annex 2 to the Comprehensive Nuclear-Test-Ban Treaty,° to immediately make every effort, including maintaining all existing moratoriums on nuclear-weapon test explosions or any other nuclear explosions and declaring their political will to do so, as well as through continued support for the Comprehensive Nuclear-Test-Ban Treaty Organization, to sign and ratify the Comprehensive Nuclear-Test-Ban Treaty; (ec) All States to continue to make practical contributions to nuclear disarmament verification, including through concrete exercises, at the United Nations and the Conference on Disarmament, and in the framework of the International Partnership for Nuclear Disarmament Verification; (f) All States to facilitate efforts on disarmament and non-proliferation education, inter alia, efforts in which the young generation can actively engage, as well as to raise awareness of the realities of the use of nuclear weapons, including 3/4 through, among others, visits by leaders, youth and others to and interactions with communities and people, including the hibakusha (those who have suffered the use of nuclear weapons) who pass on their experiences to the future generations; 4. Also encourages, for the purpose of facilitating future-oriented dialogues in order to advance nuclear disarmament, the following: (a) Nuclear-weapon States to clearly set out their nuclear policies and doctrines at international forums, including the Review Conference and Preparatory Committees of the Treaty on the Non-Proliferation of Nuclear Weapons, the Conference on Disarmament and the First Committee of the General Assembly, and all States to conduct interactive discussions, based on such nuclear policies and doctrines; (b) All States to conduct dialogue regarding the possible impacts of developments in science and technology on arms control, disarmament and non-proliferation; (c) All States to conduct candid dialogue on the relationship between nuclear disarmament and security; 5. Reaffirms the commitment to strengthening the international regime for nuclear non-proliferation and to achieving the complete, verifiable and irreversible dismantlement of all of the Democratic People’s Republic of Korea’s nuclear weapons, ballistic missiles of all ranges and related nuclear and ballistic missile programmes, in accordance with relevant Security Council resolutions, and the responsibility of all States for the full implementation of all relevant Security Council resolutions, and calls upon the Democratic People’s Republic of Korea to return at an early date to full compliance with the Treaty on the Non-Proliferation of Nuclear Weapons, including that of the International Atomic Energy Agency safeguards; 6. Decides to include in the provisional agenda of its seventy-fifth session, under the item entitled “General and complete disarmament”, a sub-item entitled “Joint courses of action and future-oriented dialogue towards a world without nuclear weapons”. 19-18077 4/4",10/21/2019,2019_3832793,Nepal,N/A,yes
2019,General Assembly,First Committee,Seventy-fourth session,93,Developments in the field of information and telecommunications in the context of international security,"Algeria, Angola, Bolivia (Plurinational State of), Cambodia, China, Cuba, Democratic People’s Republic of Korea, Democratic Republic of the Congo, Lao People’s Democratic Republic, Malawi, Nepal, Russian Federation, Suriname, Syrian Arab Republic and Venezuela (Bolivarian Republic of)",N/A,Developments in the field of information and telecommunications in the context of international security,"The General Assembly, Recalling its resolutions 36/103 of 9 December 1981, 43/78 H of 7 December 1988, 53/70 of 4 December 1998, 54/49 of 1 December 1999, 55/28 of 20 November 2000, 56/19 of 29 November 2001, 57/53 of 22 November 2002, 58/32 of 8 December 2003, 59/61 of 3 December 2004, 60/45 of 8 December2005, 61/54 of 6 December 2006, 62/17 of 5 December 2007, 63/37 of 2 December 2008, 64/25 of 2 December 2009, 65/41 of 8 December 2010, 66/24 of 2 December 2011, 67/27 of 3 December 2012, 68/243 of 27 December 2013, 69/28 of 2 December 2014, 70/237 of 23 December 2015, 71/28 of 5 December 2016 and 73/27 of 5 December 2018, Underscoring the aspirations of the international community to the peaceful use of information and communications technologies (ICTs) for the common good of humankind and to further the sustainable development of all countries, irrespective of their scientific and technological development, Stressing that it is in the interest of States to promote the use of ICTs for peaceful purposes and in preventing conflict arising from the use of ICTs, Expressing concern that a number of States are developing ICT capabilities for military purposes and the use of ICTs in future conflicts between States is becoming more likely, Considering that it is necessary to prevent the use of information resources or technologies for criminal or terrorist purposes, Underlining the importance of respect for human rights and fundamental freedoms in the use of information and communications technologies, B Please recycle 19-18104 ii 221019 CA Noting that capacity-building is essential for cooperation of States and confidence-building in the field of ICT security, Recognizing that some States may require assistance in their efforts to bridge the divide in the security of ICTs and their use, Affirming that capacity-building measures should seek to promote the use of ICTs for peaceful purposes, Noting the leading role of the United Nations in promoting dialogue among Member States to develop common understandings on the security of and in the use of ICTs, as well as in developing common understandings on the international legal regulation of the activities of States in the ICT field and norms, rules and principles for responsible State behaviour in this sphere, and that the United Nations should encourage regional efforts, promote confidence-building and transparency measures and support capacity-building and the dissemination of best practices, Recognizing the importance of the efforts made in this direction by the Group of Governmental Experts on Developments in the Field of Information and Telecommunications in the Context of International Security (GGE) in previous years, Stressing the need to ensure the integrity and continuity of the negotiation process on the security in the use of ICTs under the auspices of the United Nations, 1. | Welcomes the launch of the negotiation process in the format of United Nations Open-ended Working Group on Developments in the Field of Information and Telecommunications in the Context of International Security (QEWG) and the GGE; 2. Underlines that the OEWG and the GGE are important independent negotiation mechanisms under the auspices of the United Nations, which should conduct their work in a constructive and pragmatic manner, adding to each other’s efforts, and their results should contribute to the implementation of the tasks of maintaining international peace and security in the use of ICTs; 3. Decides to include in the provisional agenda of its seventy-fifth session the item entitled “Developments in the field of information and telecommunications in the context of international security”. 19-18104 2/2",10/21/2019,2019_3832795,Nepal,N/A,yes
2019,General Assembly,First Committee,Seventy-fourth session,98 (ii),General and complete disarmament: Treaty on the Prohibition of Nuclear Weapons,"Algeria, Angola, Antigua and Barbuda, Austria, Bangladesh, Bolivia (Plurinational State of), Botswana, Brazil, Cabo Verde, Chile, Costa Rica, Céte d’Ivoire, Cuba, Democratic Republic of the Congo, Dominican Republic, Ecuador, Gambia, Ghana, Guatemala, Guinea-Bissau, Guyana, Indonesia, Ireland, Jamaica, Kazakhstan, Lao People’s Democratic Republic, Lesotho, Libya, Liechtenstein, Malawi, Mexico, Namibia, Nepal, New Zealand, Nigeria, Paraguay, Peru, Philippines, Saint Kitts and Nevis, Saint Lucia, Saint Vincent and the Grenadines, Samoa, San Marino, South Africa, Thailand, Trinidad and Tobago, Uganda, Uruguay and Viet Nam",N/A,Treaty on the Prohibition of Nuclear Weapons,"The General Assembly, Recalling its resolutions 72/31 of 4 December 2017 and 73/48 of 5 December 2018, 1. Welcomes the adoption of the Treaty on the Prohibition of Nuclear Weapons! on 7 July 2017; 2. Notes that the Treaty has been open for signature at United Nations Headquarters in New York since 20 September 2017; 3. Welcomes that already 79 States had signed the Treaty and 32 States had ratified or acceded to it as at 7 October 2019; 4. Calls upon all States that have not yet done so to sign, ratify, accept, approve or accede to the Treaty at the earliest possible date; 5. Calls upon those States in a position to do so to promote adherence to the Treaty through bilateral, subregional, regional and multilateral contacts, outreach and other means; ' A/CONF.229/2017/8. ns : = Please recycle eS 19-17524 vit 231019 A AA 6. Requests the Secretary-General, as depositary of the Treaty, to report to the General Assembly at its seventy-fifth session on the status of signature and ratification, acceptance, approval or accession of the Treaty; 7. Decides to include in the provisional agenda of its seventy-fifth session, under the item entitled “General and complete disarmament”, the sub-item entitled “Treaty on the Prohibition of Nuclear Weapons”. 19-17524 2/2",10/21/2019,2019_3833254,Nepal,N/A,yes
2019,General Assembly,First Committee,Seventy-fourth session,98 (ee),General and complete disarmament: humanitarian consequences of nuclear weapons,"Algeria, Andorra, Angola, Antigua and Barbuda, Austria, Bahamas, Bolivia (Plurinational State of), Brazil, Cabo Verde, Chile, Colombia, Costa Rica, Céte d’Ivoire, Democratic Republic of the Congo, Dominican Republic, Egypt, Eritrea, Eswatini, Gambia, Ghana, Guatemala, Guinea-Bissau, Guyana, Indonesia, Iraq, Ireland, Jamaica, Libya, Liechtenstein, Madagascar, Malawi, Malta, Mexico, Myanmar, Namibia, Nepal, New Zealand, Nigeria, North Macedonia, Paraguay, Peru, Philippines, Republic of Moldova, Saint Vincent and the Grenadines, Samoa, San Marino, Singapore, South Africa, Suriname, Sweden, Switzerland, Thailand, Uganda, Uruguay, Vanuatu and Viet Nam",N/A,Humanitarian consequences of nuclear weapons,"The General Assembly, Recalling its resolutions 70/47 of 7 December 2015, 71/46 of 5 December 2016, 72/30 of 4 December 2017 and 73/47 of 5 December 2018, Reiterating the deep concern about the catastrophic consequences of nuclear weapons, Stressing that the immense and uncontrollable destructive capability and indiscriminate nature of nuclear weapons cause unacceptable humanitarian consequences, as has been demonstrated through their past use and testing, Recalling that concern about the humanitarian consequences of nuclear weapons has been reflected in numerous United Nations resolutions, including the first resolution adopted by the General Assembly, on 24 January 1946, Recalling also that at the first special session of the General Assembly devoted to disarmament, in 1978, the Assembly stressed that nuclear weapons posed the greatest danger to mankind and to the survival of civilization, ! Welcoming the renewed interest and resolve of the international community, together with the International Committee of the Red Cross and international ' See resolution S-10/2. 8 Please recycle 19-17529 vit 231019 A AA humanitarian organizations, to address the catastrophic consequences of nuclear weapons, Recalling that the 2010 Review Conference of the Parties to the Treaty on the Non-Proliferation of Nuclear Weapons expressed deep concern at the catastrophic humanitarian consequences of any use of nuclear weapons,” Noting the resolution of 26 November 2011 of the Council of Delegates of the International Red Cross and Red Crescent Movement entitled “Working towards the elimination of nuclear weapons”, Recalling the joint statements on the humanitarian consequences of nuclear weapons delivered to the General Assembly and during the 2010-2015 cycle of the review of the Treaty on the Non-Proliferation of Nuclear Weapons, Welcoming the facts-based discussions on the effects of a nuclear weapon detonation that were held at the conferences on the humanitarian impact of nuclear weapons, convened by Norway, on 4 and 5 March 2013, Mexico, on 13 and 14 February 2014, and Austria, on 8 and 9 December 2014, Cognizant that a key message from experts and international organizations at those conferences was that no State or international body could address the immediate humanitarian emergency caused by a nuclear weapon detonation or provide adequate assistance to victims, Firmly believing that it is in the interest of all States to engage in discussions on the humanitarian consequences of nuclear weapons with the aim of further broadening and deepening the understanding of this matter, and welcoming civil society’s ongoing engagement, Reaffirming the role of civil society, in partnership with Governments, in raising awareness about the unacceptable humanitarian consequences of nuclear weapons, Emphasizing that the catastrophic consequences of nuclear weapons affect not only Governments but each and every citizen of our interconnected world and have deep implications for human survival, for the environment, for socioeconomic development, for our economies and for the health of future generations, 1. Stresses that it is in the interest of the very survival of humanity that nuclear weapons never be used again, under any circumstances; 2. Emphasizes that the only way to guarantee that nuclear weapons will never be used again is their total elimination; 3. Stresses that the catastrophic effects of a nuclear weapon detonation, whether by accident, miscalculation or design, cannot be adequately addressed; 4. Expresses its firm belief that awareness of the catastrophic consequences of nuclear weapons must underpin all approaches and efforts towards nuclear disarmament; 5. Calls upon all States, in their shared responsibility, to prevent the use of nuclear weapons, to prevent their vertical and horizontal proliferation and to achieve nuclear disarmament; 6. Urges States to exert all efforts to totally eliminate the threat of these weapons of mass destruction; 2 See 2010 Review Conference of the Parties to the Treaty on the Non-Proliferation of Nuclear Weapons, Final Document, vol. | (NPT/CONF.2010/50 (Vol. I)), part I, Conclusions and recommendations for follow-on actions. 2/3 7. Decides to include in the provisional agenda of its seventy-fifth session, under the item entitled “General and complete disarmament”, the sub-item entitled “Humanitarian consequences of nuclear weapons”. 19-17529 3/3",10/21/2019,2019_3833255,Nepal,N/A,yes
