year,Council,Committee,Session,Agenda item,Agenda detail,cosponsored countries,body title number,body title detail,body text,date,file,filecountry,footnote,scanned
2005,General Assembly,First Committee,Sixtieth session,98 (d),Review and implementation of the Concluding Document of the Twelfth Special Session of the General Assembly: United Nations Regional Centre for Peace and Disarmament in Asia and the Pacific,"Afghanistan, Australia, Bangladesh, Bhutan, Brunei Darussalam, China, Democratic People’s Republic of Korea, India, Indonesia, Japan, Kazakhstan, Lao People’s Democratic Republic, Malaysia, Maldives, Mongolia, Myanmar, Nepal, New Zealand, Pakistan, Sri Lanka, Thailand and Viet Nam:",N/A,United Nations Regional Centre for Peace and Disarmament in Asia and the Pacific,"The General Assembly, Recalling its resolutions 42/39 D of 30 November 1987 and 44/117 F of 15 December 1989, by which it established the United Nations Regional Centre for Peace and Disarmament in Asia and renamed it the United Nations Regional Centre for Peace and Disarmament in Asia and the Pacific, with headquarters in Kathmandu and with the mandate of providing, on request, substantive support for the initiatives and other activities mutually agreed upon by the Member States of the Asia-Pacific region for the implementation of measures for peace and disarmament, through appropriate utilization of available resources, Taking note of the report of the Secretary-General,! in which he expresses his belief that the mandate of the Regional Centre remains valid and that the Centre has been a useful instrument for fostering a climate of cooperation for peace and disarmament in the region, Noting that trends in the post-cold-war era have emphasized the function of the Regional Centre in assisting Member States as they deal with new security concerns and disarmament issues emerging in the region, Commending the useful activities carried out by the Regional Centre in encouraging regional and subregional dialogue for the enhancement of openness, 05-55871 (E) 181005 *0555871* transparency and confidence-building, as well as the promotion of disarmament and security through the organization of regional meetings, which has come to be widely known within the Asia-Pacific region as “the Kathmandu process”, Expressing its appreciation to the Regional Centre for its organization of meetings and conferences in the region, held in Sapporo, Japan, from 26 to 29 July 2004, Nadi, Fiji, from 18 to 20 August 2004, Jeju Island, the Republic of Korea, from 6 to 8 December 2004, Beijing, from 19 to 21 April 2005 and Kanazawa, Japan, from 13 to 14 June 2005, Welcoming the idea of the possible creation of an educational and training programme for peace and disarmament in Asia and the Pacific for young people with different backgrounds, to be financed from voluntary contributions, Noting the important role of the Regional Centre in assisting region-specific initiatives of Member States, including its continued assistance in finalizing a treaty related to the establishment of a nuclear-weapon-free zone in Central Asia, as well as to Mongolia’s international security and nuclear-weapon-free status, Appreciating highly the overall support that Nepal has extended as the host nation of the headquarters of the Regional Centre, 1. Reaffirms its strong support for the forthcoming operation and further strengthening of the United Nations Regional Centre for Peace and Disarmament in Asia and the Pacific; 2. Underlines the importance of the Kathmandu process as a powerful vehicle for the development of the practice of region-wide security and disarmament dialogue; 3. Expresses its appreciation for the continuing political support and voluntary financial contributions to the Regional Centre, which are essential for its continued operation; 4. Appeals to Member States, in particular those within the Asia-Pacific region, as well as to international governmental and non-governmental organizations and foundations, to make voluntary contributions, the only resources of the Regional Centre, to strengthen the programme of activities of the Centre and the implementation thereof; 5. Requests the Secretary-General, taking note of paragraph 6 of General Assembly resolution 49/76 D of 15 December 1994, to provide the Regional Centre with the necessary support, within existing resources, in carrying out its programme of activities; 6. Urges the Secretary-General to ensure the physical operation of the Regional Centre from Kathmandu within six months of the date of signature of the host country agreement and to enable the Centre to function effectively; 7. Requests the Secretary-General to report to the General Assembly at its sixty-first session on the implementation of the present resolution; 8. Decides to include in the provisional agenda of its sixty-first session the item entitled “United Nations Regional Centre for Peace and Disarmament in Asia and the Pacific”.",10/18/2005,2005_558723,Nepal,N/A,yes
2005,General Assembly,First Committee,Sixtieth session,97 (p),General and complete disarmament: measures to prevent terrorists from acquiring weapons of mass destruction,"Afghanistan, Argentina, Armenia, Bhutan, Colombia, Czech Republic, Ecuador, Fiji, France, Georgia, Greece, India, Kenya, Mauritius, Myanmar, Nepal, Netherlands, Poland, Portugal, Singapore, Slovakia, Spain, Sri Lanka and Turkey",N/A,Measures to prevent terrorists from acquiring weapons of mass destruction,"The General Assembly, Recalling its resolution 59/80 of 3 December 2004, Recognizing the determination of the international community to combat terrorism, as evident in relevant General Assembly and Security Council resolutions, Deeply concerned by the growing risk of linkages between terrorism and weapons of mass destruction, and in particular by the fact that terrorists may seek to acquire weapons of mass destruction, Cognizant of the steps taken by States to implement Security Council resolution 1540 (2004) on the non-proliferation of weapons of mass destruction, adopted on 28 April 2004, Welcoming the adoption, by consensus, of the International Convention for the Suppression of Acts of Nuclear Terrorism on 13 April 2005,! Also welcoming the adoption, by consensus, of amendments to strengthen the Convention on the Physical Protection of Nuclear Material by the International Atomic Energy Agency on 8 July 2005, 05-54959 (E) 131005 *0554959~"" Noting the support expressed in the Final Document of the Thirteenth Conference of Heads of State or Government of Non-Aligned Countries, which was held in Kuala Lumpur from 20 to 25 February 2003,2 and in the Final Document of the Fourteenth Ministerial Conference of the Movement of Non-Aligned Countries, which was held in Durban, South Africa, from 17 to 19 August 2004, for measures to prevent terrorists from acquiring weapons of mass destruction, Noting also that the Group of Eight, the European Union, the Regional Forum of the Association of Southeast Asian Nations and others have taken into account in their deliberations the dangers posed by the acquisition by terrorists of weapons of mass destruction, and the need for international cooperation in combating it, Acknowledging the consideration of issues relating to terrorism and weapons of mass destruction by the Advisory Board on Disarmament Matters,3 Taking note of resolution GC(49)/RES/10 on 30 September 2005 by the General Conference of the International Atomic Energy Agency at its forty-ninth regular session,* Taking note also of the report of the Policy Working Group on the United Nations and Terrorism,> Taking note further of the report of the Secretary-General, submitted pursuant to paragraphs 2 and 4 of resolution 59/80,¢ Mindful of the urgent need for addressing, within the United Nations framework and through international cooperation, this threat to humanity, Emphasizing that progress is urgently needed in the area of disarmament and non-proliferation in order to help to maintain international peace and security and to contribute to global efforts against terrorism, 1. Calls upon all Member States to support international efforts to prevent terrorists from acquiring weapons of mass destruction and their means of delivery; 2. Invites all Member States to consider signing and ratifying the International Convention for the Suppression of Acts of Nuclear Terrorism' in order to bring about its early entry into force; 3. Urges all Member States to take and strengthen national measures, as appropriate, to prevent terrorists from acquiring weapons of mass destruction, their means of delivery and materials and technologies related to their manufacture, and invites them to inform the Secretary-General, on a voluntary basis, of the measures taken in this regard; 4. Encourages cooperation among and between Member States and relevant regional and international organizations for strengthening national capacities in this regard; 4 See International Atomic Energy Agency, Resolutions and Other Decisions of the General Conference, Forty-ninth Regular Session, 26-30 September 2005 (GC(49)/RES/DEC(2005)). A/C.1/60/L.51 5. Requests the Secretary-General to compile a report on measures already taken by international organizations on issues relating to the linkage between the fight against terrorism and the proliferation of weapons of mass destruction, to seek the views of Member States on additional relevant measures for tackling the global threat posed by the acquisition by terrorists of weapons of mass destruction and to report to the General Assembly at its sixty-first session; 6. Decides to include in the provisional agenda of its sixty-first session the item entitled “Measures to prevent terrorists from acquiring weapons of mass destruction”.",10/12/2005,2005_558868,Nepal,N/A,yes
2005,General Assembly,Second Committee,Sixtieth session,73 (b),"Strengthening of the coordination of humanitarian and disaster relief assistance of the United Nations, including special economic assistance: special economic assistance to individual countries or regions","Afghanistan, Angola, Argentina, Austria, Azerbaijan, Bangladesh, Barbados, Belize, Botswana, Brazil, Chile, Costa Rica, Croatia, Cuba, Djibouti, Dominica, Dominican Republic, Ecuador, Egypt, El Salvador, Eritrea, Ethiopia, Fiji, Finland, France, Ghana, Grenada, Guatemala, Guinea, Guinea-Bissau, Honduras, Indonesia, Iran (Islamic Republic of), Israel, Jamaica, Kazakhstan, Lesotho, Mexico, Morocco, Namibia, Nepal, Nicaragua, Pakistan, Panama, Paraguay, Peru, Saint Vincent and the Grenadines, Senegal, Singapore, South Africa, Spain, Syrian Arab Republic, Trinidad and Tobago, Tunisia, United Republic of Tanzania, Uruguay, Venezuela (Bolivarian Republic of) and Yemen",N/A,Humanitarian assistance and reconstruction for El Salvador and Guatemala,"The General Assembly, Recalling its resolutions 53/1 B of 5 October 1998, 53/1 C of 2 November 1998, 54/96 E of 15 December 1999, 58/117 of 17 December 2003, 59/212 of 20 December 2004, and 59/231 and 59/233 of 22 December of 2004, Reiterating its concern over the unpredictable manner in which natural hazards occur and the need for the United Nations system to respond to requests for assistance by Member States with impartiality and equality, Deeply regretting the loss of human lives and the scores of victims in the wake of tropical storm Stan, aggravated by other natural events, in El Salvador and Guatemala, from 3 to 12 October 2005, Conscious of the huge material losses sustained to crops, homes, basic infrastructure and tourist and other areas, 05-56512 ﬁEi 241005 O Acknowledging the efforts of the Governments of El Salvador and Guatemala to protect the lives of their nationals and rapidly to assist the affected population, in particular the indigenous communities, Conscious that the Central American countries are vulnerable and, as a result of their geographical features, prone to natural hazards, which impose additional challenges on the possibility of their achieving the Millennium Development Goals, Noting the enormous effort that will be required to rebuild the affected areas and to alleviate the grave situation wreaked by these natural hazards, Aware that the work of reconstruction requires the fullest coordinated support as well as the unwavering solidarity of the international community, 1. Expresses its solidarity and support to the Government and the peoples of El Salvador and Guatemala; 2. Expresses its appreciation to the members of the international community that have offered their support to the rescue efforts and emergency assistance for the affected population; 3. Appeals to all Member States and all organs and bodies of the United Nations system, as well as international financial institutions and development agencies, to provide speedy support to the relief, rehabilitation and assistance effort for the affected countries; 4. Calls upon the international community to provide assistance in response to the flash appeal for Guatemala and to the joint United Nations agency appeal in El Salvador; 5. Requests the Secretary-General and all organs and bodies of the United Nations system, as well as international financial institutions and development agencies, to assist El Salvador and Guatemala, whenever possible, through increased technical and financial assistance that contributes to overcoming the emergency and achieving the rehabilitation and recovery of the economy and the affected population in the short, medium and long term, in conformity with the priorities identified at the national level; 6. Requests the relevant organs and organizations of the United Nations system and other multilateral organizations to increase their support and assistance for strengthening the disaster-preparedness capacity of the countries concerned; 7. Requests the Secretary-General to report to the General Assembly, through the Economic and Social Council, at the humanitarian affairs segment of its substantive session of 2006, on the collaborative effort referred to in paragraph 5 above and on the progress made in the relief, rehabilitation and reconstruction efforts of the affected countries.",10/21/2005,2005_559146,Nepal,N/A,yes
2005,General Assembly,First Committee,Sixtieth session,97 (d),General and complete disarmament: transparency in armaments,"Albania, Andorra, Antigua and Barbuda, Argentina, Armenia, Australia, Austria, Bahamas, Bangladesh, Belgium, Belize, Bhutan, Bolivia, Bosnia and Herzegovina, Brazil, Bulgaria, Burkina Faso, Burundi, Canada, Chile, Colombia, Congo, Costa Rica, Céte d’Ivoire, Croatia, Cyprus, Czech Republic, Denmark, Dominican Republic, Ecuador, El Salvador, Equatorial Guinea, Estonia, Fiji, Finland, France, Georgia, Germany, Ghana, Greece, Guatemala, Guyana, Japan, Haiti, Hungary, Iceland, Ireland, Italy, Jamaica, Kazakhstan, Latvia, Liberia, Liechtenstein, Lithuania, Luxembourg, Madagascar, Malawi, Malaysia, Malta, Micronesia (Federated States of), Monaco, Mongolia, Nauru, Nepal, Netherlands, New Zealand, Nicaragua, Niger, Norway, Panama, Papua New Guinea, Paraguay, Peru, Philippines, Poland, Portugal, Republic of Korea, Republic of Moldova, Romania, Saint Lucia, Saint Vincent and the Grenadines, Samoa, San Marino, Senegal, Serbia and Montenegro, Sierra Leone, Singapore, Slovakia, Slovenia, Solomon Islands, South Africa, Spain, Suriname, Swaziland, Sweden, Switzerland, Thailand, the former Yugoslav Republic of Macedonia, Timor-Leste, Trinidad and Tobago, Turkey, Ukraine, United Kingdom of Great Britain and Northern Ireland, United Republic of Tanzania, Uruguay, Venezuela (Bolivarian Republic of) and Zambia",N/A,Transparency in armaments,"The General Assembly, Recalling its resolutions 46/36 L of 9 December 1991, 47/52 L of 15 December 1992, 48/75 E of 16 December 1993, 49/75 C of 15 December 1994, 50/70 D of 12 December 1995, 51/45 H of 10 December 1996, 52/38 R of 9 December 1997, 53/77 V of 4 December 1998, 54/54 O of 1 December 1999, 55/33 U of 20 November 2000, 56/24 Q of 29 November 2001, 57/75 of 22 November 2002 and 58/54 of 8 December 2003 entitled “Transparency in armaments”, 05-56898 (E) 261005 *0556898* Continuing to take the view that an enhanced level of transparency in armaments contributes greatly to confidence-building and security among States and that the establishment of the United Nations Register of Conventional Arms! constitutes an important step forward in the promotion of transparency in military matters, Welcoming the consolidated report of the Secretary-General on the Register,? which includes the returns of Member States for 2004, Welcoming also the response of Member States to the request contained in paragraphs 9 and 10 of resolution 46/36 L to provide data on their imports and exports of arms, as well as available background information regarding their military holdings, procurement through national production and relevant policies, Welcoming further the inclusion by some Member States of their transfers of small arms and light weapons in their annual report to the Register as part of their additional background information, Stressing that the continuing operation of the Register and its further development should be reviewed in order to secure a Register that is capable of attracting the widest possible participation, 1. Reaffirms its determination to ensure the effective operation of the United Nations Register of Conventional Arms,' as provided for in paragraphs 7 to 10 of resolution 46/36 L; 2. Calls upon Member States, with a view to achieving universal participation, to provide the Secretary-General, by 31 May, annually with the requested data and information for the Register, including nil reports if appropriate, on the basis of resolutions 46/36 L and 47/52 L, the recommendations contained in paragraph 64 of the 1997 report of the Secretary-General on the continuing operation of the Register and its further development,3 the recommendations contained in paragraph 94 of the 2000 report of the Secretary-General and the appendices and annexes thereto4 and the recommendations contained in paragraphs 112 to 114 of the 2003 report of the Secretary-General;> 3. Invites Member States in a position to do so, pending further development of the Register, to provide additional information on procurement from national production and military holdings and to make use of the “Remarks” column in the standardized reporting form to provide additional information such as types or models and to include transfers of small arms and light weapons, using definitions and reporting measures they deem appropriate, as part of their additional background information; 4. Reaffirms its decision, with a view to further development of the Register, to keep the scope of and participation in the Register under review and, to that end: 1 See resolution 46/36 L. 2 A/60/160 and Corr.1. A/C.1/60/L.50/Rev.1 (a) Recalls its request to Member States to provide the Secretary-General with their views on the continuing operation of the Register and its further development and on transparency measures related to weapons of mass destruction; (b) Requests the Secretary-General, with assistance of a group of governmental experts to be convened in 2006, within available resources, on the basis of equitable geographical representation, to prepare a report on the continuing operation of the Register and its further development, taking into account the work of the Conference on Disarmament, the views expressed by Member States and the reports of the Secretary-General on the continuing operation of the Register and its further development, with a view to taking a decision at its sixty-first session; 5. Requests the Secretary-General to implement the recommendations contained in his 2000 and 2003 reports on the continuing operation of the Register and its further development and to ensure that sufficient resources are made available for the Secretariat to operate and maintain the Register; 6. Invites the Conference on Disarmament to consider continuing its work undertaken in the field of transparency in armaments; 7. Reiterates its call upon all Member States to cooperate at the regional and subregional levels, taking fully into account the specific conditions prevailing in the region or subregion, with a view to enhancing and coordinating international efforts aimed at increased openness and transparency in armaments; 8. Requests the Secretary-General to report to the General Assembly at its sixty-first session on progress made in implementing the present resolution; 9. Decides to include in the provisional agenda of its sixty-first session the item entitled “Transparency in armaments”.",10/24/2005,2005_559223,Nepal,N/A,yes
2005,General Assembly,N/A,Sixtieth session,60,Global road safety crisis,"Algeria, Argentina, Azerbaijan, Bahrain, Comoros, Fiji, Gambia, Iran (Islamic Republic of), Kazakhstan, Kuwait, Malaysia, Monaco, Morocco, Oman, Pakistan, Qatar, Saudi Arabia, Singapore, South Africa, Switzerland, Syrian Arab Republic, Thailand, United Arab Emirates, United Kingdom of Great Britain and Northern Ireland, Viet Nam and Yemen",N/A,Improving global road safety,"Addendum Add the following countries to the list of sponsors to the resolution: Afghanistan, Albania, Armenia, Australia, Austria, Bangladesh, Belgium, Brunei Darussalam, Cambodia, Canada, Chile, China, Croatia, Cuba, Cyprus, Djibouti, Dominican Republic, Egypt, France, Germany, Greece, Guatemala, Guinea- Bissau, Guyana, Iceland, India, Indonesia, Iraq, Ireland, Israel, Italy, Jamaica, Jordan, Lebanon, Libyan Arab Jamahiriya, Luxembourg, Madagascar, Malta, Nepal, New Zealand, Nigeria, Panama, Peru, Philippines, Poland, Portugal, Republic of Moldova, Romania, Russian Federation, Senegal, Slovenia, Spain, Sudan, Switzerland, Timor-Leste, Tunisia, Turkey, Turkmenistan, Zambia 05-57264 (E) 271005 *0557264*",10/26/2005,2005_559327,Nepal,N/A,yes
