year,Council,Committee,Session,Agenda item,Agenda detail,cosponsored countries,body title number,body title detail,body text,date,file,filecountry,footnote,scanned
2018,General Assembly,First Committee,Seventy-third session,101 (e),General and complete disarmament: regional disarmament,"Ecuador, Egypt, Nepal, Nigeria, Pakistan, Peru and Saudi Arabia",N/A,Regional disarmament,"The General Assembly, Recalling its resolutions 45/58 P of 4 December 1990, 46/36 I of 6 December 1991, 47/52 J of 9 December 1992, 48/75 I of 16 December 1993, 49/75 N of 15 December 1994, 50/70 K of 12 December 1995, 51/45 K of 10 December 1996, 52/38 P of 9 December 1997, 53/77 O of 4 December 1998, 54/54 N of 1 December 1999, 55/33 O of 20 November 2000, 56/24 H of 29 November 2001, 57/76 of 22 November 2002, 58/38 of 8 December 2003, 59/89 of 3 December 2004, 60/63 of 8 December 2005, 61/80 of 6 December 2006, 62/38 of 5 December 2007, 63/43 of 2 December 2008, 64/41 of 2 December 2009, 65/45 of 8 December 2010, 66/36 of 2 December 2011, 67/57 of 3 December 2012, 68/54 of 5 December 2013, 69/45 of 2 December 2014, 70/43 of 7 December 2015, 71/40 of 5 December 2016 and 72/34 of 4 December 2017 on regional disarmament, Believing that the efforts of the international community to move towards the ideal of general and complete disarmament are guided by the inherent human desire for genuine peace and security, the elimination of the danger of war and the release of economic, intellectual and other resources for peaceful pursuits, Affirming the abiding commitment of all States to the purposes and principles enshrined in the Charter of the United Nations in the conduct of their international relations, Noting that essential guidelines for progress towards general and complete disarmament were adopted at the tenth special session of the General Assembly,! Taking note of the guidelines and recommendations for regional approaches to disarmament within the context of global security adopted by the Disarmament Commission at its 1993 substantive session, ' Resolution S-10/2. 2 Official Records of the General Assembly, Forty-eighth Session, Supplement No. 42 (A/48/42), annex II. {AY Ld 18-16450 Hi 221018 A A Welcoming the prospects of genuine progress in the field of disarmament engendered in recent years as a result of negotiations between the two super-Powers, Taking note of the recent proposals for disarmament at the regional and subregional levels, Recognizing the importance of confidence-building measures for regional and international peace and security, Convinced that endeavours by countries to promote regional disarmament, taking into account the specific characteristics of each region and in accordance with the principle of undiminished security at the lowest level of armaments, would enhance the security of all States and would thus contribute to international peace and security by reducing the risk of regional conflicts, 1. Stresses that sustained efforts are needed, within the framework of the Conference on Disarmament and under the umbrella of the United Nations, to make progress on the entire range of disarmament issues; 2. Affirms that global and regional approaches to disarmament complement each other and should therefore be pursued simultaneously to promote regional and international peace and security; 3. Calls upon States to conclude agreements, wherever possible, for nuclear non-proliferation, disarmament and confidence-building measures at the regional and subregional levels; 4. Welcomes the initiatives towards disarmament, nuclear non-proliferation and security undertaken by some countries at the regional and subregional levels; 5. Supports and encourages efforts aimed at promoting confidence-building measures at the regional and subregional levels to ease regional tensions and to further disarmament and nuclear non-proliferation measures at the regional and subregional levels; 6. Decides to include in the provisional agenda of its seventy-fourth session, under the item entitled “General and complete disarmament”, the sub-item entitled “Regional disarmament”. 18-16450 2/2",10/19/2018,2018_1649485,Nepal,N/A,yes
2018,General Assembly,First Committee,Seventy-third session,101 (p),General and complete disarmament: reducing nuclear danger,"Angola, Bhutan, Cuba, Ecuador, India, Malawi, Myanmar, Namibia, Nepal, Nicaragua, Samoa and Viet Nam",N/A,Reducing nuclear danger,"The General Assembly, Bearing in mind that the use of nuclear weapons poses the most serious threat to humankind and to the survival of civilization, Reaffirming that any use or threat of use of nuclear weapons would constitute a violation of the Charter of the United Nations, Convinced that the proliferation of nuclear weapons in all its aspects would seriously enhance the danger of nuclear war, Convinced also that nuclear disarmament and the complete elimination of nuclear weapons are essential to remove the danger of nuclear war, Considering that, until nuclear weapons cease to exist, it is imperative on the part of the nuclear-weapon States to adopt measures that assure non-nuclear-weapon States against the use or threat of use of nuclear weapons, Considering also that the hair-trigger alert of nuclear weapons carries unacceptable risks of unintentional or accidental use of nuclear weapons, which would have catastrophic consequences for all humankind, Emphasizing the need to adopt measures to avoid accidental, unauthorized or unexplained incidents arising from computer anomalies or other technical malfunctions, Conscious that limited steps relating to de-alerting and de-targeting have been taken by the nuclear-weapon States and that further practical, realistic and mutually reinforcing steps are necessary to contribute to the improvement in the international climate for negotiations leading to the elimination of nuclear weapons, Mindful that a diminishing role for nuclear weapons in the security policies of nuclear-weapon States would have a positive impact on international peace and 4 en Please recycle eS 18-17235 i 221018 A AT security and improve the conditions for the further reduction and the elimination of nuclear weapons, Reiterating the highest priority accorded to nuclear disarmament in the Final Document of the Tenth Special Session of the General Assembly ! and by the international community, Recalling the advisory opinion of the International Court of Justice on the legality of the threat or use of nuclear weapons? that there exists an obligation for all States to pursue in good faith and bring to a conclusion negotiations leading to nuclear disarmament in all its aspects under strict and effective international control, Recalling also the call, in the United Nations Millennium Declaration,’ to seek to eliminate the dangers posed by weapons of mass destruction and the resolve to strive for the elimination of weapons of mass destruction, particularly nuclear weapons, including the possibility of convening an international conference to identify ways of eliminating nuclear dangers, 1. Calls for a review of nuclear doctrines and, in this context, immediate and urgent steps to reduce the risks of unintentional and accidental use of nuclear weapons, including through de-alerting and de-targeting nuclear weapons; 2. Requests the five nuclear-weapon States to take measures towards the implementation of paragraph | above; 3. Calls upon Member States to take the measures necessary to prevent the proliferation of nuclear weapons in all its aspects and to promote nuclear disarmament, with the objective of eliminating nuclear weapons; 4. Takes note of the report of the Secretary-General submitted pursuant to paragraph 5 of its resolution 72/41 of 4 December 2017;4 5. Requests the Secretary-General to intensify efforts and support initiatives that would contribute to the full implementation of the seven recommendations identified in the report of the Advisory Board on Disarmament Matters that would significantly reduce the risk of nuclear war,> and also to continue to encourage Member States to consider the convening of an international conference, as proposed in the United Nations Millennium Declaration,’ to identify ways of eliminating nuclear dangers, and to report thereon to the General Assembly at its seventy-fourth session; 6. Decides to include in the provisional agenda of its seventy-fourth session, under the item entitled “General and complete disarmament”, the sub-item entitled “Reducing nuclear danger”. ' Resolution S-10/2. 2 A/51/218, annex. > Resolution 55/2. > A/56/400, para. 3. 2/2",10/19/2018,2018_1649490,Nepal,4 en Please recycle eS,yes
2018,General Assembly,First Committee,Seventy-third session,101 (gg),"General and complete disarmament: women, disarmament, non-proliferation and arms control","Albania, Antigua and Barbuda, Argentina, Australia, Austria, Bahamas, Belgium, Belize, Bosnia and Herzegovina, Bulgaria, Canada, Central African Republic, Chile, Costa Rica, Croatia, Cyprus, Czechia, Denmark, Dominican Republic, El Salvador, Estonia, Finland, France, Greece, Grenada, Guatemala, Guyana, Haiti, Hungary, Iceland, Ireland, Italy, Jamaica, Japan, Latvia, Liechtenstein, Lithuania, Luxembourg, Madagascar, Malawi, Malta, Mongolia, Montenegro, Namibia, Nepal, Netherlands, New Zealand, Nigeria, Norway, Panama, Peru, Philippines, Poland, Portugal, Republic of Moldova, Romania, Saint Lucia, Saint Vincent and the Grenadines, Samoa, San Marino, Senegal, Serbia, Slovakia, Slovenia, South Africa, Spain, Suriname, Sweden, Switzerland, Thailand, Togo, Trinidad and Tobago, United Kingdom of Great Britain and Northern Ireland and Uruguay",N/A,"Women, disarmament, non-proliferation and arms control","The General Assembly, Recalling that the Charter of the United Nations reaffirms the equal rights of women and men, Recalling also its resolutions 65/69 of 8 December 2010, 67/48 of 3 December 2012, 68/33 of S December 2013, 69/61 of 2 December 2014 and 71/56 of 5 December 2016, Recalling further General Assembly and Security Council resolutions on the issue of women and peace and security, Recalling the 2015 review of the women and peace and security agenda, Reaffirming the Sustainable Development Goals relevant to the promotion of women, disarmament, non-proliferation and arms control, and acknowledging that the success of efforts to achieve sustainable development and disarmament depends on the full and effective inclusion of women in all aspects of these efforts, Welcoming the call for the full and meaningful participation of women in efforts to prevent, combat and eradicate the illicit transfer of small arms, pursuant to Security {AY Lad Please recycle v7 18-16890 Hi 221018 A A AA Council resolutions 2106 (2013) of 24 June 2013, 2117 (2013) of 26 September 2013, 2122 (2013) of 18 October 2013 and 2220 (2015) of 22 May 2015, Reaffirming that the equal, full and effective participation of both women and men is one of the essential factors for the promotion and attainment of sustainable peace and security, Recognizing the valuable contribution of women to practical disarmament measures carried out at the local, national, subregional and regional levels in the prevention and reduction of armed violence and armed conflict, and in promoting disarmament, non-proliferation and arms control, Recognizing also that the role of women in disarmament, non-proliferation and arms control should be further developed and in particular the need to facilitate the participation and representation of women in policymaking, planning and implementation processes related to disarmament, non-proliferation and arms control, Recalling the entry into force of the Arms Trade Treaty,! and therefore encouraging States parties to fully implement all the provisions of the Treaty, including the provisions on serious acts of gender-based violence and on violence against children, Noting with appreciation the efforts of Member States to increase the participation of women in their national and regional coordination mechanisms on disarmament-related matters, including in efforts to prevent, combat and eradicate the illicit trade in small arms and light weapons in all its aspects, Recognizing the important role played by civil society organizations in promoting the role of women in disarmament, non-proliferation and arms control, 1. Urges Member States, relevant subregional and regional organizations, the United Nations and the specialized agencies to promote equal opportunities for the representation of women in all decision-making processes with regard to matters related to disarmament, non-proliferation and arms control, in particular as it relates to the prevention and reduction of armed violence and armed conflict; 2. Welcomes the report of the Secretary-General on the measures taken by Member States to implement General Assembly resolution 71/56;7 3. Also welcomes the continuing efforts of the United Nations organs, agencies, funds and programmes to accord high priority to the issue of women and peace and security, and in this regard notes the role of the United Nations Entity for Gender Equality and the Empowerment of Women (UN-Women) in promoting the implementation of all resolutions related to women in the context of peace and security; 4. Encourages Member States to better understand the impact of armed violence, in particular the impact of the illicit trafficking in small arms and light weapons on women and girls, through, inter alia, the development of national action plans on women and peace and security and strengthening the collection of data disaggregated by sex and age; 5. | Urges Member States to support and strengthen the effective participation of women in organizations in the field of disarmament at the local, national, subregional and regional levels; ' See resolution 67/234 B. 2 A/73/115. 2/3 6. Calls upon all States to empower women, including through capacity- building efforts, as appropriate, to participate in the design and implementation of disarmament, non-proliferation and arms control efforts; 7. Encourages States to seriously consider increasing funding for policies and programmes that take account of the differing impacts of illicit small arms and light weapons on women, men, girls and boys; 8. Calls upon all States to develop appropriate and effective national risk assessment criteria to facilitate the prevention of the use of arms to commit violence against women and children; 9. Requests the relevant United Nations organs, agencies, funds and programmes to assist States, upon request, in promoting the role of women in disarmament, non-proliferation and arms control, including in preventing, combating and eradicating the illicit trade in small arms and light weapons; 10. Requests the Secretary-General to seek the views of Member States on ways and means of promoting the role of women in disarmament, non-proliferation and arms control and to report to the General Assembly at its seventy-fifth session on the implementation of the present resolution; 11. Decides to include in the provisional agenda of its seventy-fifth session, under the item entitled “General and complete disarmament”, the sub-item entitled “Women, disarmament, non-proliferation and arms control”. 18-16890 3/3",10/22/2018,2018_1649702,Nepal,N/A,yes
2018,General Assembly,First Committee,Seventy-third session,101 (jj),General and complete disarmament: humanitarian consequences of nuclear weapons,"Algeria, Angola, Antigua and Barbuda, Austria, Bahamas, Belize, Benin, Bolivia (Plurinational State of), Brazil, Cabo Verde, Central African Republic, Chile, Costa Rica, Democratic Republic of the Congo, Dominican Republic, Egypt, El Salvador, Eritrea, Eswatini, Ghana, Guatemala, Guyana, Honduras, Indonesia, Ireland, Jamaica, Kazakhstan, Libya, Liechtenstein, Madagascar, Malawi, Malaysia, Malta, Mexico, Mongolia, Myanmar, Namibia, Nepal, New Zealand, Nicaragua, Nigeria, Panama, Papua New Guinea, Paraguay, Peru, Philippines, Saint Vincent and the Grenadines, Samoa, San Marino, Sierra Leone, South Africa, Sudan, Suriname, Sweden, Switzerland, Thailand, Togo, Trinidad and Tobago, Uruguay, Viet Nam and Zimbabwe",N/A,Humanitarian consequences of nuclear weapons,"The General Assembly, Recalling its resolutions 70/47 of 7 December 2015, 71/46 of 5 December 2016 and 72/30 of 4 December 2017, Reiterating the deep concern about the catastrophic consequences of nuclear weapons, Stressing that the immense and uncontrollable destructive capability and indiscriminate nature of nuclear weapons cause unacceptable humanitarian consequences, as has been demonstrated through their past use and testing, Recalling that concern about the humanitarian consequences of nuclear weapons has been reflected in numerous United Nations resolutions, including the first resolution adopted by the General Assembly, on 24 January 1946, Recalling also that at the first special session of the General Assembly devoted to disarmament, in 1978, the Assembly stressed that nuclear weapons posed the greatest danger to mankind and to the survival of civilization,! Welcoming the renewed interest and resolve of the international community, together with the International Committee of the Red Cross and international ' See resolution S-10/2. Please recycle 18-17067 i 231018 A A A A humanitarian organizations, to address the catastrophic consequences of nuclear weapons, Recalling that the 2010 Review Conference of the Parties to the Treaty on the Non-Proliferation of Nuclear Weapons expressed deep concern at the catastrophic humanitarian consequences of any use of nuclear weapons,” Noting the resolution of 26 November 2011 of the Council of Delegates of the International Red Cross and Red Crescent Movement entitled “Working towards the elimination of nuclear weapons”, Recalling the joint statements on the humanitarian consequences of nuclear weapons delivered to the General Assembly and during the 2010-2015 cycle of the review of the Treaty on the Non-Proliferation of Nuclear Weapons, Welcoming the facts-based discussions on the effects of a nuclear weapon detonation that were held at the conferences on the humanitarian impact of nuclear weapons, convened by Norway, on 4 and 5 March 2013, Mexico, on 13 and 14 February 2014, and Austria, on 8 and 9 December 2014, Cognizant that a key message from experts and international organizations at those conferences was that no State or international body could address the immediate humanitarian emergency caused by a nuclear weapon detonation or provide adequate assistance to victims, Firmly believing that it is in the interest of all States to engage in discussions on the humanitarian consequences of nuclear weapons with the aim of further broadening and deepening the understanding of this matter, and welcoming civil society’s ongoing engagement, Reaffirming the role of civil society, in partnership with Governments, in raising awareness about the unacceptable humanitarian consequences of nuclear weapons, Emphasizing that the catastrophic consequences of nuclear weapons affect not only Governments but each and every citizen of our interconnected world and have deep implications for human survival, for the environment, for socioeconomic development, for our economies and for the health of future generations, 1. Stresses that it is in the interest of the very survival of humanity that nuclear weapons never be used again, under any circumstances; 2. Emphasizes that the only way to guarantee that nuclear weapons will never be used again is their total elimination; 3. Stresses that the catastrophic effects of a nuclear weapon detonation, whether by accident, miscalculation or design, cannot be adequately addressed; 4. Expresses its firm belief that awareness of the catastrophic consequences of nuclear weapons must underpin all approaches and efforts towards nuclear disarmament; 5. Calls upon all States, in their shared responsibility, to prevent the use of nuclear weapons, to prevent their vertical and horizontal proliferation and to achieve nuclear disarmament; 6. Urges States to exert all efforts to totally eliminate the threat of these weapons of mass destruction; 2 See 2010 Review Conference of the Parties to the Treaty on the Non-Proliferation of Nuclear Weapons, Final Document, vol. | (NPT/CONF.2010/50 (Vol. I)), part I, Conclusions and recommendations for follow-on actions. 2/3 7. Decides to include in the provisional agenda of its seventy-fourth session, under the item entitled “General and complete disarmament”, the sub-item entitled “Humanitarian consequences of nuclear weapons”. 18-17067 3/3",10/19/2018,2018_1649703,Nepal,N/A,yes
2018,General Assembly,First Committee,Seventy-third session,102 (b),Review and implementation of the Concluding Document of the Twelfth Special Session of the General Assembly: Convention on the Prohibition of the Use of Nuclear Weapons,"Angola, Bhutan, Cuba, Honduras, India, Lao People’s Democratic Republic, Myanmar, Nepal, Samoa and Viet Nam",N/A,Convention on the Prohibition of the Use of Nuclear Weapons,"The General Assembly, Convinced that the use of nuclear weapons poses the most serious threat to the survival of humankind, Bearing in mind the advisory opinion of the International Court of Justice of 8 July 1996 on the legality of the threat or use of nuclear weapons, ! Convinced that a multilateral, universal and binding agreement prohibiting the use or threat of use of nuclear weapons would contribute to the elimination of the nuclear threat and to the climate for negotiations leading to the ultimate elimination of nuclear weapons, thereby strengthening international peace and security, Conscious that some steps have been taken by the Russian Federation and the United States of America towards a reduction of their nuclear weapons and that further steps — in all relevant formats — on nuclear arms control and disarmament can contribute to the improvement of the international climate and the goal of the complete elimination of nuclear weapons, Recalling that in paragraph 58 of the Final Document of the Tenth Special Session of the General Assembly? it is stated that all States should actively participate in efforts to bring about conditions in international relations among States in which a code of peaceful conduct of nations in international affairs could be agreed upon and which would preclude the use or threat of use of nuclear weapons, Reaffirming that any use of nuclear weapons would be a violation of the Charter of the United Nations and a crime against humanity, as declared in its resolutions ' A/51/218, annex. ? Resolution S-10/2. i Please recycle eS 18-17236 i 221018 A A AT A 1653 (XVI) of 24 November 1961, 33/71 B of 14 December 1978, 34/83 G of 11 December 1979, 35/152 D of 12 December 1980 and 36/92 I of 9 December 1981, Recognizing that a legally binding prohibition of the use of nuclear weapons is not contrary to but in fact contributes to international efforts for the achievement and maintenance of a world free of nuclear weapons, Stressing that an international convention on the prohibition of the use of nuclear weapons would be an important step in a phased programme towards the complete elimination of nuclear weapons, with a specified framework of time, Noting with regret that the Conference on Disarmament, during its 2017 session, was unable to undertake negotiations on this subject as called for in General Assembly resolution 72/59 of 4 December 2017, 1. Reiterates its request to the Conference on Disarmament to commence negotiations in order to reach agreement on an international convention prohibiting the use or threat of use of nuclear weapons under any circumstances; 2. Requests the Conference on Disarmament to report to the General Assembly on the results of those negotiations. 18-17236 2/2",10/19/2018,2018_1649706,Nepal,"1653 (XVI) of 24 November 1961, 33/71 B of 14 December 1978, 34/83 G of 11 December 1979, 35/152 D of 12 December 1980 and 36/92 I of 9 December 1981,",yes
