year,Council,Committee,Session,Agenda item,Agenda detail,cosponsored countries,body title number,body title detail,body text,date,file,filecountry,footnote,scanned
2018,General Assembly,N/A,Seventy-second session,123,Strengthening of the United Nations system,"Australia, Belarus, Central African Republic, Democratic Republic of the Congo, Honduras, Hungary, Nepal, Qatar, Russian Federation, Saudi Arabia, Sri Lanka, Tunisia, Turkmenistan and Viet Nam",N/A,International Association of Permanent Representatives to the United Nations,"The General Assembly, Guided by the Charter of the United Nations, Mindful of the importance of the atmosphere of trusting and respectful dialogue and interaction among the permanent representatives of States Members of the United Nations for the successful promotion of the noble principles and purposes of the Charter of the United Nations, Willing to facilitate the exchange and proliferation of good diplomatic practices, experience and insight, as well as the preservation of the institutional memory of the United Nations diplomatic community, Recalling that the International Association of Permanent Representatives to the United Nations was established on 2 February 1988 in New York upon the initiative of the Permanent Representative of Saudi Arabia to the United Nations, Samir Shihabi, as an informal forum and a framework for regular communication and consultation among former and current permanent representatives to the United Nations, Bearing in mind the close personal ties of amity and friendship that are forged between permanent representatives to the United Nations in their common pursuit of the shared objectives of the United Nations, Wishing to promote informal interpersonal communication among former and current permanent representatives to the United Nations and to ensure the continuity thereof, 1. Acknowledges with appreciation the role played by the former Permanent Representative of Saudi Arabia to the United Nations, Samir Shihabi and all subsequent presidents of the International Association of Permanent Representatives a i 4 =a 1-0: 40 '- 2: Please recycle OQ ae 4 18-05109 ii 040418 A A ATA A/72/L..45 to the United Nations in leading and developing the Association and guiding it towards the achievement of its goals and objectives; 2. Recognizes the important role played by the Association and its positive contribution to the activity of the Organization through the promotion of better interpersonal connectedness and a climate of trust and openness, as well as the exchange of good practices and experience; 3. Invites the States Members of the United Nations to support the work of the Association and encourage the participation of former and current permanent representatives to the United Nations in the events and forums of the Association; 4. Authorizes the Secretary-General to continue to provide the Association, from within existing resources, with facilities on a non-remuneration basis and to replace its current office with a more suitable space to enable the Association to convene its meetings; 5. Calls upon the Secretary-General to provide the Association with a separate web page, to be hosted on the delegates section of the United Nations web site, with content provided by the Association and updated from time to time with information on its recent activities; 6. Authorizes the use by the Association of the United Nations emblem alongside the emblem of the Association, provided that guidelines for the use thereof are followed. 18-05109 2/2",04/02/2018,2018_1480581,Nepal,N/A,yes
2018,General Assembly,Commission On Human Rights,Thirty-seventh session,3,"Promotion and protection of all human rights, civil, political, economic, social and cultural rights, including the right to development","Afghanistan, Azerbaijan,* Chile, Ecuador, Georgia, Kenya, Maldives,* Nepal, Philippines, Portugal,* Republic of Moldova,* Saudi Arabia, Spain, Thailand,* Togo,‘ Turkey,* Uruguay:*",N/A,"37/.... Promoting human rights and the Sustainable Development Goals through transparent, accountable and efficient public services delivery","The Human Rights Council, Guided by the purposes and principles of the Charter of the United Nations, Recalling the Universal Declaration of Human Rights, the International Covenants on Human Rights and other relevant international human rights instruments, Reaffirming the importance of the United Nations Convention against Corruption, Recalling all relevant United Nations resolutions, including Human Rights Council resolutions on good governance and corruption, Recalling also resolution 6/8 entitled “Prevention of corruption by promoting transparent, accountable, and efficient public service delivery through the application of best practices and technological innovations” adopted by the Conference of States Parties to the United Nations Convention against Corruption at its sixth session, Recalling further General Assembly resolution 70/1 of 25 September 2015, entitled “Transforming our world: the 2030 Agenda for Sustainable Development”, including Sustainable Development Goal 16, which encourages Member States to promote peaceful and inclusive societies for sustainable development, provide access to justice for all and build effective, accountable and inclusive institutions at all levels, Recalling General Assembly resolution 69/313 of 27 July 2015 on the Addis Ababa Action Agenda of the Third International Conference on Financing for Development, which is an integral part of the 2030 Agenda for Sustainable Development, GE. 18-04144(E) 804144* Please recycle eS A/HRC/37/L.16 Noting the importance of multilateral platforms and public-private partnership mechanisms that foster good governance policies and the implementation of the Sustainable Development Goals, such as the Open Government Partnership, which aims to promote transparency, empower citizens, fight corruption and harness new technologies to strengthen governance, Recalling the report of the United Nations High Commissioner for Human Rights on the role of public service as an essential component of good governance in the promotion and protection of human rights, ! Recognizing that a professional, accountable and transparent public service upholding the highest standards of efficiency, competence, integrity, accessibility and non- discrimination is one of the essential components of good governance, Recalling article 21 of the Universal Declaration of Human Rights and article 25 of the International Covenant on Civil and Political Rights, according to which every citizen has a right to have access, on general terms of equality, to public service in his/her country, without unreasonable restrictions or distinctions of any kind mentioned in article 2 of the Covenant, Acknowledging that the promotion and protection of human rights and the 2030 Agenda for Sustainable Development are complementary and mutually reinforcing, Concerned about the negative impact of widespread corruption on the enjoyment of human rights, and recognizing that corruption constitutes one of the obstacles to the effective promotion and protection of human rights and fundamental freedoms, Acknowledging that non-discriminatory, efficient, accessible, accountable and transparent public services delivery consistent with citizens’ needs and feedback is one of the key components in building an anti-corruption environment in the public sector and contributes to the promotion and protection of human rights and the implementation of 2030 Agenda, Underlining that the increased application of technological innovations and electronic services in public services delivery can play an important role in reducing corruption by promoting transparency and accountability and can improve the environment and tools necessary to foster public access to information on preventing and combating corruption, Stressing in that regard the important role of Governments in the effective use of information and communications technology in the design of public policies and in the provision of public services responsive to national needs and priorities, including on the basis of a multi-stakeholder approach, to support national development efforts as stipulated by the General Assembly in its resolution 69/204 of 19 December 2014 entitled “Information and communications technologies for development”, Acknowledging the important role that civil society and other stakeholders can play in the design, delivery and promotion of transparent, accountable and efficient delivery of public services, Stressing the need to incorporate transparent, accountable and efficient public services delivery models into local, national and regional development plans, Highlighting the significance of access to relevant information as one of the key components of efficiency in the delivery of public services, and emphasizing the importance of respecting, promoting and protecting the freedom of expression, as stipulated in article 19 of the International Covenant on Civil and Political Rights, including the freedom to seek, receive and impart information, Noting that everyone, including those residing in remote areas of a country, should have access to simple and consumer-oriented public services delivery, as appropriate, including through the availability of online and mobility services, as well as e-applications, ' A/ARC/25/27. A/HRC/37/L.16 Recognizing the importance of quality control of the delivery of public services on an ongoing basis with a view to ensuring accountability, Acknowledging the need for the voluntary exchange of relevant information, experience, knowhow and technology on a mutually agreed terms and at all levels on successful national practices in the efficient, transparent and accountable delivery of public services, Noting the importance that multi-sectoral regional and national centres of public excellence can have to deliberate on public service innovation trends and applications, enhance evidence-based institutions and peer-to-peer learning, 1. Recognizes the important role of the Government, as service provider, as well as all other stakeholders, including the private sector and civil society, in the promotion and protection of all human rights and, as appropriate, in the implementation of the Sustainable Development Goals and the Addis Ababa Action Agenda; 2. Notes with appreciation the application of innovative approaches, in particular the use of science and technological innovation by States, in the delivery of public services, ensuring the fullest access by all to public services and seeking to minimize risks of corruption; 3. Stresses the importance of efficiency, accountability and non-discrimination in the delivery of public services, and in this regard encourages efforts, with the participation of all relevant stakeholders, to strengthen the capacity of national statistical offices and data systems; 4. Encourages States with effective models for the delivery of public services to share their best practices with other States, especially with developing States, through bilateral, regional and multilateral cooperation frameworks, and calls upon all States to establish, taking into account best practices from other States, as appropriate, a transparent, accountable and efficient public service system; 5. Welcomes the initiatives of States to promote the delivery of public services as an aspect of the topic of human rights and good governance by organizing regional and international events; 6. Encourages international cooperation and national efforts, including by strengthening capacity-building and the training of public servants, to cover such areas as human rights, the rule of law and good governance within the public service, and the provision of technical assistance, such as the voluntary exchange of knowhow and technology on mutually agreed terms; 7. Underlines the important role of the United Nations Public Service Awards, as the most prominent international recognition of excellence in public service within the United Nations system, in identifying and promoting innovations and new concepts in public administration that minimize the risks for corruption, and encourages United Nations entities and other international organizations to continue to promote and reward such initiatives and their replication; 8. Notes with appreciation United Nations Public Service Day, held on 23 June to celebrate the value and virtue of public service to the community, highlights the contribution of public service in the development process, recognizes the work of public servants, encourages young people to pursue careers in the public sector, and encourages States to organize special events on that occasion; 9. Invites the United Nations High Commissioner for Human Rights to mark United Nations Public Service Day at every June session of the Human Rights Council with a view to raise awareness about the human rights dimension of public services delivery.",03/19/2018,2018_1485550,Nepal,* State not a member of the Human Rights Council. ¥ On behalf of the States Members of the United Nations that are member of the Group of African States.,yes
2018,General Assembly,N/A,Seventy-second session,14,"Integrated and coordinated implementation of and follow-up to the outcomes of the major United Nations conferences and summits in the economic, social and related fields","Algeria, Bangladesh, Colombia, Dominican Republic, Ecuador, El Salvador, Ghana, Guatemala, Guinea, Honduras, Madagascar, Morocco, Philippines and Tunisia",N/A,International Day of Family Remittances,"Addendum Add the following countries to the list of sponsors of the resolution: Australia, Bolivia (Plurinational State of), Brazil, Canada, Costa Rica, Egypt, Guyana, India, Indonesia, Ireland, Jamaica, Malawi, Mexico, Myanmar, Nepal, Nicaragua, Nigeria, Paraguay, Republic of Moldova, Russian Federation, Samoa, Singapore, Sudan, Thailand, Timor-Leste, Uruguay and Viet Nam ia oat hes Pat tain Please recycle a au) 18-09667 Hi 200618 A A A A",06/12/2018,2018_1630298,Nepal,N/A,yes
2018,General Assembly,Sixth Committee,Seventy-third session,178,Observer status for the International Think Tank for Landlocked Developing Countries in the General Assembly,"Afghanistan, Armenia, Bhutan, Burkina Faso, Ethiopia, Kazakhstan, Kyrgyzstan, Lao People’s Democratic Republic, Mongolia, Myanmar, Nepal, Niger, Paraguay, Portugal, Tajikistan and Zambia",N/A,Observer status for the International Think Tank for Landlocked Developing Countries in the General Assembly,"The General Assembly, Wishing to promote cooperation between the United Nations and the International Think Tank for Landlocked Developing Countries, 1. Decides to invite the International Think Tank for Landlocked Developing Countries to participate in the sessions and the work of the General Assembly in the capacity of observer; 2. Requests the Secretary-General to take the action necessary to implement the present resolution. Please recycle OQ Sate ea ol Jeto: 18-16700 Hi 111018 CA 0 AA A",10/09/2018,2018_1647530,Nepal,N/A,yes
2018,General Assembly,First Committee,Seventy-third session,99 (a),Prevention of an arms race in outer space: prevention of an arms race in outer space,"Algeria, Bolivia (Plurinational State of), China, Cuba, Egypt, Honduras, Kazakhstan, Lesotho, Libya, Malawi, Mongolia, Myanmar, Namibia, Nepal, Nicaragua, Nigeria, Pakistan, Russian Federation, Senegal, Sri Lanka, Suriname, Swaziland, Syrian Arab Republic, Thailand and Venezuela (Bolivarian Republic of)",N/A,Prevention of an arms race in outer space,"The General Assembly, Recognizing the common interest of all mankind in the exploration and use of outer space for peaceful purposes, Reaffirming the will of all States that the exploration and use of outer space, including the Moon and other celestial bodies, shall be for peaceful purposes and shall be carried out for the benefit and in the interest of all countries, irrespective of their degree of economic or scientific development, Reaffirming also the provisions of articles III and IV of the Treaty on Principles Governing the Activities of States in the Exploration and Use of Outer Space, including the Moon and Other Celestial Bodies, Recalling the obligation of all States to observe the provisions of the Charter of the United Nations regarding the use or threat of use of force in their international relations, including in their space activities, Reaffirming paragraph 80 of the Final Document of the Tenth Special Session of the General Assembly,” in which it is stated that, in order to prevent an arms race in outer space, further measures should be taken and appropriate international negotiations held in accordance with the spirit of the Treaty, Recalling its previous resolutions on this issue, the most recent of which is resolution 72/26 of 4 December 2017, and taking note of the proposals submitted to the General Assembly at its tenth special session and at its regular sessions and of the ' United Nations, Treaty Series, vol. 610, No. 8843. ? Resolution S-10/2. Please recycle 18-16447 Hi 191018 CA AA recommendations made to the competent organs of the United Nations and to the Conference on Disarmament, Recognizing that the prevention of an arms race in outer space would avert a grave danger for international peace and security, Emphasizing the paramount importance of strict compliance with existing arms limitation and disarmament agreements relevant to outer space, including bilateral agreements, and with the existing legal regime concerning the use of outer space, Considering that wide participation in the legal regime applicable to outer space could contribute to enhancing its effectiveness, Noting that the Ad Hoc Committee on the Prevention of an Arms Race in Outer Space, taking into account its previous efforts since its establishment in 1985 and seeking to enhance its functioning in qualitative terms, continued the examination and identification of various issues, existing agreements and existing proposals, as well as future initiatives relevant to the prevention of an arms race in outer space, and that this contributed to a better understanding of a number of problems and to a clearer perception of the various positions, Noting also that there were no objections in principle in the Conference on Disarmament to the re-establishment of the Ad Hoc Committee, subject to re-examination of the mandate contained in the decision of the Conference on Disarmament of 13 February 1992,° Emphasizing the mutually complementary nature of bilateral and multilateral efforts for the prevention of an arms race in outer space, and hoping that concrete results will emerge from those efforts as soon as possible, Convinced that further measures should be examined in the search for effective and verifiable bilateral and multilateral agreements in order to prevent an arms race in outer space, including the weaponization of outer space, Stressing that the growing use of outer space increases the need for greater transparency and better information on the part of the international community, Recalling, in this context, its previous resolutions, in particular resolutions 45/55 B of 4 December 1990, 47/51 of 9 December 1992 and 48/74 A of 16 December 1993, in which, inter alia, it reaffirmed the importance of confidence-building measures as a means conducive to ensuring the attainment of the objective of the prevention of an arms race in outer space, Conscious of the benefits of confidence- and security-building measures in the military field, Recognizing that negotiations for the conclusion of an international agreement or agreements to prevent an arms race in outer space remain a priority task of the Conference on Disarmament and that the concrete proposals on confidence -building measures could form an integral part of such agreements, Noting with satisfaction the constructive, structured and focused debate on the prevention of an arms race in outer space at the Conference on Disarmament each year from 2009 to 2018, Noting the introduction by China and the Russian Federation at the Conference on Disarmament of the treaty on the prevention of the placement of weapons in 3 See Official Records of the General Assembly, Forty-seventh Session, Supplement No. 27 (A/47/27), para. 76. 2/3 outer space and of the threat or use of force against outer space objects in 2008 and the submission of its updated version in 2014,‘ Taking note of the decision of the Conference on Disarmament to establish for its 2009 session a working group to discuss, substantially, without limitation, all issues related to the prevention of an arms race in outer space, and to establish a subsidiary body on the prevention of an arms race in outer space for its 2018 session, 1. Reaffirms the importance and urgency of preventing an arms race in outer space and the readiness of all States to contribute to that common objective, in conformity with the provisions of the Treaty on Principles Governing the Activities of States in the Exploration and Use of Outer Space, including the Moon and Other Celestial Bodies; ! 2. Reaffirms its recognition, as stated in the report of the Ad Hoc Committee on the Prevention of an Arms Race in Outer Space, that the legal regime applicable to outer space by itself does not guarantee the prevention of an arms race in outer space, that the regime plays a significant role in the prevention of an arms race in that environment, that there is a need to consolidate and reinforce that regime and enhance its effectiveness and that it is important to comply strictly with existing agreements, both bilateral and multilateral; 3. Emphasizes the necessity of further measures with appropriate and effective provisions for verification to prevent an arms race in outer space; 4. Calls upon all States, in particular those with major space capabilities, to contribute actively to the objective of the peaceful use of outer space and of the prevention of an arms race in outer space and to refrain from actions contrary to that objective and to the relevant existing treaties in the interest of maintaining international peace and security and promoting international cooperation; 5. Reiterates that the Conference on Disarmament, as the sole multilateral disarmament negotiating forum, has the primary role in the negotiation of a multilateral agreement or agreements, as appropriate, on the prevention of an arms race in outer space in all its aspects; 6. Invites the Conference on Disarmament to establish a working group under its agenda item entitled “Prevention of an arms race in outer space” as early as possible; 7. Recognizes, in this respect, the growing convergence of views on the elaboration of measures designed to strengthen transparency, confidence and security in the peaceful uses of outer space; 8. Urges States conducting activities in outer space, as well as States interested in conducting such activities, to keep the Conference on Disarmament informed of the progress of bilateral and multilateral negotiations on the matter, if any, so as to facilitate its work; 9. Decides to include in the provisional agenda of its seventy-fourth session the item entitled “Prevention of an arms race in outer space”. 4 See CD/1839 and CD/1985. 3/3",10/03/2018,2018_1648981,Nepal,N/A,yes
