year,Council,Committee,Session,Agenda item,Agenda detail,cosponsored countries,body title number,body title detail,body text,date,file,filecountry,footnote,scanned
2005,Economic And Social Council,Commission On Human Rights,Sixty-first session,18 (b),EFFECTIVE FUNCTIONING OF HUMAN RIGHTS MECHANISMS: NATIONAL INSTITUTIONS AND REGIONAL ARRANGEMENTS,"Afghanistan®, Albania*, Algeria*, Argentina, Armenia, Australia, Bosnia and Herzegovina*, Bulgaria*, Cameroon*, Canada, Chile*, Congo, Croatia*, Cyprus*, Denmark*, Dominican Republic, Ecuador, Estonia*, Finland, France, Germany, Greece*, Guatemala, Honduras, Hungary, Indonesia, Iraq*, Ireland, Israel*, Italy, Japan, Kenya, Latvia*, Lithuania*, Luxembourg*, Mexico, Morocco*, Nepal, New Zealand*, Nigeria, Norway*, Paraguay, Peru, Poland*, Republic of Korea, Romania, Serbia and Montenegro*, Slovakia*, Slovenia*, South Africa, Spain*, Sri Lanka, Sweden*, Switzerland*, Thailand*, Turkey*, Ukraine, United Kingdom of Great Britain and Northern Ireland, United States of America and Venezuela",2005,National institutions for the promotion and protection of human rights,"The Commission on Human Rights, Recalling the relevant resolutions of the General Assembly, notably resolution 48/134 of 20 December 1993, and its own resolutions concerning national institutions for the promotion and protection of human rights, Welcoming international recognition of the importance of establishing and strengthening independent, pluralistic national institutions for the promotion and protection of human rights consistent with the Principles relating to the status of national institutions for the promotion and protection of human rights annexed to General Assembly resolution 48/134 (the Paris Principles), Convinced of the important role such national institutions play in promoting and protecting human rights and fundamental freedoms and in developing and enhancing public awareness of those rights and freedoms, Recognizing that it is the prerogative of each State to choose, for the establishment of a national institution, the legal framework that is best suited to its particular needs and circumstances to ensure that human rights are promoted and protected at the national level in accordance with international human rights standards, Recalling the Vienna Declaration and Programme of Action adopted in June 1993 by the World Conference on Human Rights (A/CONF.157/23), which reaffirmed the important and constructive role played by national human rights institutions and their role in remedying human rights violations and in the dissemination of human rights information and education concerning human rights, Also recalling the Programme of Action (A/CONF.157/N1/6) adopted by national institutions meeting in Vienna during the World Conference on Human Rights, which recommended that United Nations activities and programmes should be reinforced to meet the requests for assistance from States wishing to establish or strengthen their national institutions for the promotion and protection of human rights, Welcoming the strengthening of international cooperation among national human rights institutions, including through the International Coordinating Committee of National Institutions, Noting the outcomes of the seventh International Conference for National Institutions held in Seoul from 14 to 17 September 2004, the positive contribution of non-governmental organizations and the Seoul Declaration on upholding human rights during conflict and while countering terrorism, Welcoming the strengthening in all regions of regional cooperation among national human rights institutions and between national human rights institutions and other regional human rights forums, Noting efforts to strengthen regional human rights networks, including the fifth European meeting of national institutions for the promotion and protection of human rights and the third Round Table of National Human Rights Institutions held in Berlin from 25 to 26 November 2004, organized jointly by the German Institute for Human Rights and the Commissioner for Human Rights of the Council of Europe, the First African Union Conference of National Human Rights Institutions held in Addis Ababa from 18 to 21 October 2004, the continuing work of the Network of National Human Rights Institutions of the Americas, the Network’s Third General Assembly held in Buenos Aires from 9 to 11 June 2004 and its seminar on irregular migration and trafficking of people: human rights and national institutions, held in Campeche, Mexico, from 10 to 11 March 2005, and the work of the Asia Pacific Forum of National Human Rights Institutions, including the holding of their ninth annual meeting in Seoul in September 2004, Noting the conclusions and programme of action adopted at the twelfth Workshop on Regional Cooperation for the Promotion and Protection of Human Rights in the Asian and Pacific Region held in Doha from 2 to 4 March 2004 with regard to the role of national institutions (see E/CN.4/2004/89), Noting the creation of a francophone group of national institutions for human rights in cooperation with the International Organization of la francophonie, Noting also the work of the Ibero-American Federation of Ombudsman as a forum for cooperation and exchanging of experience, Welcoming the call of the twelfth Workshop for the Office for the United Nations High Commissioner for Human Rights to support the subregional workshop for the Arab Region on national human rights protection systems, including national human rights institutions, held in Cairo, from 6 to 8 March 2005 with the support of the Egyptian National Council for Human Rights, Noting the valuable role played and contributions made by national institutions in United Nations meetings dealing with human rights and the importance of their continued appropriate participation, 1. Reaffirms the importance of the development of effective, independent, pluralistic national institutions for the promotion and protection of human rights consistent with the Paris Principles; 2. Reiterates the continued importance of the Paris Principles as a set of important recommended guidelines of practice for national institutions, recognizes the value of further strengthening their application and encourages States, national institutions and other interested parties to consider ways to achieve this; 3. Welcomes the decisions of a growing number of States to establish, or to consider establishing, national institutions consistent with the Paris Principles; 4. Encourages States to establish or, where they already exist, to strengthen such institutions, as outlined in the Vienna Declaration and Programme of Action; 5. Recognizes that national institutions have a crucial role to play in promoting and ensuring the indivisibility and interdependence of all human rights and calls upon all States to ensure that all human rights are appropriately reflected in the mandate of their national human rights institutions when established; 6. Takes note with satisfaction of the efforts of those States that have provided their national institutions with more autonomy and independence, including through giving them an investigative role or enhancing such a role, and encourages other Governments to consider taking similar steps; 7. Recognizes the important and constructive role that individuals, groups and organs of society can play for the better promotion and protection of human rights and encourages efforts by national institutions to establish partnerships and increase cooperation with civil society; 8. Welcomes greater efforts by the Office of the High Commissioner to engage national institutions as partners and provide them with opportunities to exchange experiences and best practices amongst themselves, and in this context welcomes: (a) The International Workshop of National Institutions for the Promotion and Protection of Human Rights: causes, effects and consequences of the migratory phenomenon and human rights protection held in Zacatecas, Mexico, from 14 to 15 October 2004 organized by the Mexican National Human Rights Commission of Mexico and the Human Rights Commission of Zacatecas; (b) The Round Table of National Human Rights Institutions and National Machineries for the Advancement of Women held in Ouarzazate, Morocco, from 15 to cooperation with the United Nations Division for the Advancement of Women, Department of Economic and Social Affairs; and The International Round Table on National Institutions and Good Governance (c) The International Round Table on National Institutions and Good Gove held in Suva from 13 to 15 December 2004 with the Fiji Human Rights Commission; 9. Also welcomes the engagement of the Office of the High Commissioner with concerned national institutions on a regional level in relation to conflict prevention as well as the prevention of torture; 10. Further welcomes the practice of national institutions and coordinating committees of such institutions that conform with the Paris Principles of participating in an appropriate manner in their own right in meetings of the Commission and its subsidiary bodies; 10. 11. Welcomes the report of the Secretary-General (E/CN.4/2005/107) on enhancing the participation of national human rights institutions in the work of the Commission and its subsidiary bodies and, in accordance with its recommendations, decides to request the Chairperson of the sixty-first session, in consultation with all relevant stakeholders, to finalize, by the sixty-second session, the modalities for: 11. (a) Permitting national institutions that are accredited by the Accreditation Subcommittee of the International Coordinating Committee of National Institutions under the auspices of the Office of the High Commissioner, and coordinating committees of such institutions, to speak, as outlined in the report, within their mandates, under all items of the Commission’s agenda, while stressing the need to maintain present good practices of management of the agenda and speaking times in the Commission, to allocate dedicated seating to national institutions for this purpose, and supporting their engagement with all the subsidiary bodies of the Commission; (b) Continuing the practice of issuing documents from national institutions under their own symbol numbers; (b) 12. Welcomes the continuation of the practice of national institutions convening regional meetings and encourages national institutions, in cooperation with the Office of the High Commissioner, to continue to organize similar events with Governments and non-governmental organizations in their own regions; 12. 13. Affirms the important role of national human rights institutions, in cooperation with other mechanisms for the promotion and protection of human rights, in combating racial and related forms of discrimination and in the protection and promotion of the human rights of women and the rights of particularly vulnerable groups, including children and people with 13. disabilities; 14. Recognizes the important and constructive role that national institutions can play in human rights education, including by the publication and dissemination of human rights material and other public information activities during the World Programme for Human Rights Education, and calls upon all existing national institutions to assist in the implementation of human rights education training programmes across all relevant sectors of society, including during the first phase of the Programme (2005-2007), which will focus on primary and secondary education; 14. 15. Commends the High Commissioner for the priority accorded to the establishment and strengthening of national human rights institutions, including through technical cooperation, and calls upon the Office of the High Commissioner: 15. (a) To continue to strengthen its coordinating role in this field and to allocate the resources necessary for this work from both core and extrabudgetary sources; (a) (b) To continue to support technical cooperation projects focused on specific practical challenges faced by national institutions, including in the area of complaint handling; 16. Welcomes efforts, through the Secretary-General’s action 2 programme (see A/57/387), to ensure effective engagement by all parts of the United Nations with national institutions and notes in this regard the importance of strengthening the National Institutions Unit within the Office of the High Commissioner, including with appropriate specialist expertise; 16. 17. Expresses its appreciation to those Governments that have contributed additional resources for the purpose of the establishment and strengthening of national human rights institutions and their regional organizations; 17. 18. Welcomes the important role of the International Coordinating Committee, in close cooperation with the Office of the High Commissioner, in assessing conformity with the Paris Principles and in assisting Governments and national institutions, when requested, to follow up on relevant resolutions and recommendations concerning the strengthening of national institutions; 18. 19. Requests the Secretary-General to continue to provide, from within existing resources, the necessary assistance for holding meetings of the International Coordinating Committee during the sessions of the Commission, under the auspices of, and in cooperation with, the Office of the High Commissioner; 19. 20. Also requests the Secretary-General to continue to provide, from within existing resources and from the United Nations Voluntary Fund for Technical Cooperation in the Field of Human Rights, the necessary assistance for international and regional meetings of national institutions; 20. 21. Further requests the Secretary-General to report to the Commission at its sixty-second session on the implementation of the present resolution and on ways and means of enhancing participation of national human rights institutions in the work of the Commission; 21. 22. Requests the Secretary-General to report to the Commission at its sixty-second session on the process currently utilized by the International Coordinating Committee to accredit national institutions in compliance with the Paris Principles and to ensure that the process is strengthened with appropriate periodic review; 22. Decides to continue its consideration of this question at its sixty-second session. 23.",04/19/2005,2005_546628,Nepal,"* In accordance with rule 69, paragraph 3, of the rules of procedure of the functional commissions of the Economic and Social Council. 19 November 2004 with the Conseil consultatif des droits de I’homme of Morocco in",yes
2005,General Assembly,First Committee,Sixtieth session,97 (w),General and complete disarmament: regional disarmament,"Bangladesh, Egypt, Indonesia, Jordan Nepal, Pakistan, Peru, Saudi Arabia, Sri Lanka, Sudan, and Turkey",N/A,Regional disarmament,"The General Assembly, Recalling its resolutions 45/58 P of 4 December 1990, 46/36 1 of 6 December 1991, 47/52 J of 9 December 1992, 48/75 1 of 16 December 1993, 49/75 N of 15 December 1994, 50/70 K of 12 December 1995, 51/45 K of 10 December 1996, 52/38 P of 9 December 1997, 53/77 O of 4 December 1998, 54/54 N of 1 December 1999, 55/33 O of 20 November 2000, 56/24 H of 29 November 2001, 57/76 of 22 November 2002, 58/38 of 8 December 2003 and 59/89 of 3 December 2004 on regional disarmament, Believing that the efforts of the international community to move towards the ideal of general and complete disarmament are guided by the inherent human desire for genuine peace and security, the elimination of the danger of war and the release of economic, intellectual and other resources for peaceful pursuits, Affirming the abiding commitment of all States to the purposes and principles enshrined in the Charter of the United Nations in the conduct of their international relations, Noting that essential guidelines for progress towards general and complete disarmament were adopted at the tenth special session of the General Assembly,! Taking note of the guidelines and recommendations for regional approaches to disarmament within the context of global security adopted by the Disarmament Commission at its 1993 substantive session,?2 Welcoming the prospects of genuine progress in the field of disarmament engendered in recent years as a result of negotiations between the two superpowers, 1 Resolution S-10/2. 2 Official Records of the General Assembly, Forty-eighth Session, Supplement No. 42 (A/48/42), annex II. 05-54620 (E) 131005 *0554620°* Taking note of the recent proposals for disarmament at the regional and subregional levels, Recognizing the importance of confidence-building measures for regional and international peace and security, Convinced that endeavours by countries to promote regional disarmament, taking into account the specific characteristics of each region and in accordance with the principle of undiminished security at the lowest level of armaments, would enhance the security of all States and would thus contribute to international peace and security by reducing the risk of regional conflicts, 1. Stresses that sustained efforts are needed, within the framework of the Conference on Disarmament and under the umbrella of the United Nations, to make progress on the entire range of disarmament issues; 2. Affirms that global and regional approaches to disarmament complement each other and should therefore be pursued simultaneously to promote regional and international peace and security; 3. Calls upon States to conclude agreements, wherever possible, for nuclear non-proliferation, disarmament and confidence-building measures at the regional and subregional levels; 4. Welcomes the initiatives towards disarmament, nuclear non-proliferation and security undertaken by some countries at the regional and subregional levels; 5. Supports and encourages efforts aimed at promoting confidence-building measures at the regional and subregional levels to ease regional tensions and to further disarmament and nuclear non-proliferation measures at the regional and subregional levels; 6. Decides to include in the provisional agenda of its sixty-first session the item entitled “Regional disarmament”.",10/12/2005,2005_558286,Nepal,N/A,yes
2005,General Assembly,First Committee,Sixtieth session,97 (v),Conventional arms control at the regional and subregional levels,"Bangladesh, Belarus, Germany, Italy, Liberia, Nepal, Pakistan, Peru, Spain and Ukraine",N/A,Conventional arms control at the regional and subregional levels,"The General Assembly, Recalling its resolutions 48/75 J of 16 December 1993, 49/75 O of 15 December 1994, 50/70 L of 12 December 1995, 51/45 Q of 10 December 1996, 52/38 Q of 9 December 1997, 53/77 P of 4 December 1998, 54/54 M of 1 December 1999, 55/33 P of 20 November 2000, 56/24 1 of 29 November 2001, 57/77 of 22 November 2002, 58/39 of 8 December 2003 and 59/88 of 3 December 2004, Recognizing the crucial role of conventional arms control in promoting regional and international peace and security, Convinced that conventional arms control needs to be pursued primarily in the regional and subregional contexts, since most threats to peace and security in the post-cold-war era arise mainly among States located in the same region or subregion, Aware that the preservation of a balance in the defence capabilities of States at the lowest level of armaments would contribute to peace and stability and should be a prime objective of conventional arms control, Desirous of promoting agreements to strengthen regional peace and security at the lowest possible level of armaments and military forces, Noting with particular interest the initiatives taken in this regard in different regions of the world, in particular the commencement of consultations among a number of Latin American countries and the proposals for conventional arms control made in the context of South Asia, and recognizing, in the context of this 05-54857 (E) 141005 *0554857* subject, the relevance and value of the Treaty on Conventional Armed Forces in Europe,! which is a cornerstone of European security, Believing that militarily significant States and States with larger military capabilities have a special responsibility in promoting such agreements for regional security, Believing also that an important objective of conventional arms control in regions of tension should be to prevent the possibility of military attack launched by surprise and to avoid aggression, 1. Decides to give urgent consideration to the issues involved in conventional arms control at the regional and subregional levels; 2. Requests the Conference on Disarmament to consider the formulation of principles that can serve as a framework for regional agreements on conventional arms control, and looks forward to a report of the Conference on this subject; 3. Requests the Secretary-General, in the meantime, to seek the views of Member States on the subject and to submit a report to the General Assembly at its sixty-first session; 4. Decides to include in the provisional agenda of its sixty-first session the item entitled “Conventional arms control at the regional and subregional levels”. 1 CD/1064.",10/12/2005,2005_558451,Nepal,N/A,yes
