year,Council,Committee,Session,Agenda item,Agenda detail,cosponsored countries,body title number,body title detail,body text,date,file,filecountry,footnote,scanned
2005,General Assembly,N/A,Fifty-ninth session,156,Multilingualism,"Afghanistan, Albania, Andorra, Angola, Argentina, Armenia, Austria, Azerbaijan, Bangladesh, Belarus, Belgium, Benin, Bolivia, Bulgaria, Burkina Faso, Burundi, Cameroon, Canada, Cape Verde, Central African Republic, Chad, Chile, China, Colombia, Comoros, Congo, Costa Rica, Céte d’Ivoire, Cyprus, Democratic Republic of the Congo, Djibouti, Dominican Republic, Egypt, El Salvador, France, Gabon, Georgia, Germany, Greece, Guatemala, Guinea, Guinea-Bissau, Guyana, Haiti, Honduras, Hungary, Ireland, Lao People’s Democratic Republic, Latvia, Lebanon, Liechtenstein, Lithuania, Luxembourg, Madagascar, Malawi, Mali, Mauritania, Mauritius, Mexico, Monaco, Morocco, Nicaragua, Niger, Nigeria, Oman, Panama, Peru, Poland, Portugal, Republic of Moldova, Romania, Russian Federation, Rwanda, San Marino, Sao Tome and Principe, Saudi Arabia, Senegal, Serbia and Montenegro, Seychelles, Slovakia, Slovenia, Somalia, South Africa, Spain, Sri Lanka, Sudan, Switzerland, Syrian Arab Republic, the former Yugoslav Republic of Macedonia, Timor-Leste, Togo, Tunisia, United Arab Emirates, Uruguay, Uzbekistan, Venezuela (Bolivarian Republic of) and Viet Nam",N/A,Multilingualism,"The General Assembly, Recognizing that the United Nations pursues multilingualism as a means of promoting, protecting and preserving diversity of languages and cultures globally, Also recognizing that genuine multilingualism promotes unity in diversity and international understanding, Recalling its resolution 47/135 of 18 December 1992, by which it adopted the Declaration on the Rights of Persons Belonging to National or Ethnic, Religious and Linguistic Minorities, and the International Covenant on Civil and Political Rights,! in particular its article 27 concerning the rights of persons belonging to ethnic, religious or linguistic minorities, 05-37739 (E) 100605 *0537739* Also recalling its resolutions 2 (I) of 1 February 1946, 2480 B (XXIII) of 21 December 1968, 42/207 C of 11 December 1987, 50/11 of 2 November 1995, 52/23 of 25 November 1997, 54/64 of 6 December 1999, 56/262 of 15 February 2002, 59/126 B of 10 December 2004 and 59/265 and 59/266 of 23 December 2004, 1. Takes note of the report of the Secretary-General? and the report of the Joint Inspection Unit;3 2. Also takes note of the appointment of a new coordinator for multilingualism; 3. Underlines the need for full implementation of the resolutions establishing arrangements for the official languages of the United Nations and the working languages of the Secretariat; 4. Emphasizes the paramount importance of the equality of the six official languages of the United Nations; 5. Requests the Secretary-General to continue to ensure, through the provision of documentation services and meeting and publishing services under conference management, including high-quality translation and interpretation, effective multilingual communication among representatives of Member States in intergovernmental organs and members of expert bodies of the United Nations equally in all the official languages of the United Nations; 6. Notes with satisfaction the willingness of the Secretariat to encourage staff members, in formal meetings with interpretation services, to use any of the six official languages of which they have a command; 7. Recalls its resolution 59/266, by which it reaffirmed the need to respect the equality of each of the two working languages of the Secretariat, reaffirms also the use of additional working languages in specific duty stations as mandated, and in this regard requests the Secretary-General to ensure that vacancy announcements specify the need for either of the working languages of the Secretariat, unless the functions of the post require a specific working language; 8. Also recalls that in its resolution 59/266 it requested the Secretary- General to continue to take the steps necessary to ensure that the Galaxy e-staffing system is available in both of the working languages of the Organization; 9. Encourages United Nations staff members to continue to use actively existing training facilities to acquire and enhance their proficiency in one or more of the official languages of the United Nations; 10. Recalls its resolution 59/265, in which it reaffirmed the provisions of its resolutions on multilingualism relating to conference services; 11. Also recalls its resolution 59/126 B, and emphasizes the importance of multilingualism in United Nations public relations and information activities; 12. Reaffirms the need to achieve full parity among the six official languages on the United Nations website; 2 A/58/363. 3 See A/58/93. A/59/L.62 13. Takes note with appreciation of the work done by the United Nations information centres, including the regional United Nations information centre, in favour of the publication of United Nations information materials and the translation of important documents into languages other than United Nations official languages, with a view to reaching the widest possible spectrum of audiences and extending the United Nations message to all the corners of the world in order to strengthen international support for the activities of the Organization; 14. Welcomes the decision by the General Conference of the United Nations Educational, Scientific and Cultural Organization on 17 November 1999 that 21 February should be proclaimed “International Mother Language Day”, and calls upon Member States and the Secretariat to promote the preservation and protection of all languages used by peoples of the world; 15. Requests the Secretary-General to report to it at its sixty-first session on the measures that can be taken by international organizations within the United Nations system in order to strengthen the protection, promotion and preservation of all languages, in particular languages spoken by persons belonging to linguistic minorities and languages facing extinction; 16. Also requests the Secretary-General to submit to it at its sixty-first session a comprehensive report on the implementation of its resolutions on multilingualism, including the implications of the present resolution; 17. Decides to include in the provisional agenda of its sixty-first session the item entitled “Multilingualism”.",06/08/2005,2005_550894,Niger,N/A,yes
2005,General Assembly,N/A,Fifty-ninth session,113,Scale of assessments for the apportionment of the expenses of the United Nations,"Central African Republic, Comoros, Georgia, Guinea-Bissau, Niger, Sao Tome and Principe, Somalia and Tajikistan",N/A,Requests for exemption under Article 19 of the Charter of the United Nations,"The General Assembly, Having considered the letter dated 24 June 2005 from the Chairman of the Committee on Contributions addressed to the President of the General Assembly! regarding the recommendations of the Committee on Contributions on requests for exemption under Article 19 of the Charter of the United Nations, Reaffirming the obligation of Member States under Article 17 of the Charter to bear the expenses of the Organization as apportioned by the General Assembly, 1. Reaffirms its role in accordance with the provisions of Article 19 of the Charter of the United Nations and the advisory role of the Committee on Contributions in accordance with rule 160 of the rules of procedure of the General Assembly; 2. Also reaffirms its resolution 54/237 C of 23 December 1999; 3. Agrees that the failure of the Central African Republic, the Comoros, Georgia, Guinea-Bissau, Somalia and Tajikistan to pay the full minimum amount necessary to avoid the application of Article 19 of the Charter was due to conditions beyond their control; 4. Decides that the Central African Republic, the Comoros, Georgia, Guinea-Bissau, Somalia and Tajikistan should be permitted to vote in the General Assembly until the Assembly takes a final decision during the main part of the sixtieth session; In order for the General Assembly to take action on the present resolution, it will be necessary for the Assembly to decide to consider agenda item 113 directly in a plenary meeting. 1 A/59/864. 05-41599 (E) 120705 *0541599* 5. Takes note of the information provided by the Niger and Sao Tome and Principe;2 6. Agrees that the failure of the Niger and Sao Tome and Principe to pay the full minimum amount necessary to avoid the application of Article 19 of the Charter was due to conditions beyond their control, and invites the Niger and Sao Tome and Principe to submit appropriate information to the Committee on Contributions if similar circumstances prevail in the future; 7. Decides that the Niger and Sao Tome and Principe should be permitted to vote in the General Assembly until the Assembly takes a final decision during the main part of the sixtieth session. 2 A/59/868 and A/59/869.",07/11/2005,2005_552956,Niger,*,yes
2005,General Assembly,N/A,Fifty-ninth session,53,Question of equitable representation on and increase in the membership of the Security Council and related matters,"Algeria, Angola, Botswana, Burkina Faso, Cameroon, Cape Verde, Chad, Congo, Cote d’Ivoire, Djibouti, Egypt, Equatorial Guinea, Ethiopia, Gabon, Gambia, Ghana, Guinea, Guinea-Bissau, Kenya, Liberia, Libyan Arab Jamahiriya, Madagascar, Malawi, Mali, Mauritania, Mauritius, Mozambique, Namibia, Niger, Nigeria, Rwanda, Sao Tome and Principe, Senegal, Seychelles, Sierra Leone, Somalia, South Africa, Sudan, Tunisia, Uganda, United Republic of Tanzania, Zambia and Zimbabwe",N/A,Reform of the Security Council,"The General Assembly, Reaffirming the aims and objectives of the Charter of the United Nations, Recognizing that the international community has welcomed proposals for the reform of the United Nations as contained in the report of the High-level Panel on Threats, Challenges and Change entitled “A more secure world: our shared responsibility”! and the report of the Secretary-General entitled “In larger freedom: towards development, security and human rights for all”,? Aware of the positive reactions of various regions, groups and individual countries to the proposals contained in the two reports, as reflected in the outcome document for the High-level Plenary Meeting of the General Assembly to be held in September 2005, released by the President of the Assembly in June 2005,3 Noting the common African position on the proposed reform of the United Nations as contained in the Ezulwini Consensus, _outcome.htm. 05-42167* (E) 180705 *0542167F* Convinced that the three categories of freedom, namely, freedom from want, freedom from fear and freedom to live in dignity, are essential for both developed and developing societies and indispensable for the peace and stability of the world, Conscious that these freedoms can be upheld and protected by the world community only through an effective management of the current United Nations system, Taking into account the need to strengthen United Nations institutions in order to enhance the efficiency of the organization, especially its principal organs and, in particular, the General Assembly and the Security Council, Emphasizing the need to strengthen the General Assembly which should be made to function effectively as the main deliberative and representative organ of the United Nations, Cognizant of the primary responsibility of the Security Council for the maintenance of international peace and security under the Charter of the United Nations, Stressing the need to consider the views of all Member States on this all- important issue of the reform of the Security Council with a view to bringing to fruition ideas that have been the subject of several debates over the years, Acknowledging the need for the Security Council to reflect present world realities and be more responsive to the aspirations of all States Members of the United Nations, bearing in mind the undeniable fact that in the year 1945, when the United Nations was being formed, most of Africa was not represented and that, as a result, Africa remains to this day the only continent without a permanent seat in the Council, which is the primary organ of the United Nations addressing matters of international peace and security, Mindful of the need to ensure Africa, like all the other regions of the world, effective representation in the Security Council, Realizing the need to engage fully all regions of the world in the work of the United Nations and to enlist their support for the progress of humanity, Resolves to: (a) Enlarge the Security Council in both the permanent and non-permanent categories and improve on its working methods; (b) Accord the new permanent members the same prerogatives and privileges as those of the current permanent members, including the right of veto; (c) Grant Africa two permanent and five non-permanent seats in the Security Council and increase its membership from fifteen to twenty-six with the eleven additional seats to be distributed as follows: (i) Two permanent seats and two non-permanent seats for African States; (ii) Two permanent seats and one non-permanent seat for Asian States; (iii) One non-permanent seat for Eastern European States; A/59/L.67 (iv) One permanent seat and one non-permanent seat for Latin American and Caribbean States; (v) One permanent seat for Western European and other States; (d) Amend the Charter of the United Nations accordingly.",07/18/2005,2005_553252,Niger,* Reissued for technical reasons. 1 See A/59/565. 2 A/59/2005 and Add.1 and 2.,yes
2005,Economic And Social Council,Commission On Human Rights,Substantive session,14 (a),Social and human rights questions: advancement of women,"Canada, Jordan,* Mexico, Niger* and Slovenia:*",N/A,United Nations Development Fund for Women,"The Economic and Social Council, Recognizing that mainstreaming a gender perspective into all aspects of the work of the United Nations is an ongoing process and that further concrete steps are required, as a matter of urgency, to ensure full implementation of its agreed conclusions 1997/2 and its resolution 2004/4 of 7 July 2004, Recalling General Assembly resolution 59/250 of 22 December 2004, in which the Assembly called upon the United Nations development system to avail itself of the technical experience of the United Nations Development Fund for Women on gender issues, 1. Welcomes the report of the Consultative Committee of the United Nations Development Fund for Women on the current status and future role and structure of the Fund in the United Nations system;! 2. Recommends that the General Assembly examine and take action on the recommendations of the Consultative Committee contained in its report. 05-42809 (E) 190705 *0542809*",07/18/2005,2005_553436,Niger,* In accordance with rule 72 of the rules of procedure of the Economic and Social Council. 1 A/60/62-E/2005/10.,yes
2005,General Assembly,Third Committee,Sixtieth session,64,Advancement of women,"Andorra, Antigua and Barbuda, Austria, Azerbaijan, Barbados, Belgium, Brazil, Canada, Congo, Costa Rica, Cote d’Ivoire, Croatia, Cyprus, Czech Republic, Democratic Republic of the Congo, Denmark, Estonia, Finland, France, Germany, Greece, Guatemala, Haiti, Hungary, Iceland, Ireland, Italy, Japan, Jordan, Latvia, Liechtenstein, Lithuania, Luxembourg, Madagascar, Mali, Malta, Mexico, Monaco, Morocco, Netherlands, New Zealand, Niger, Norway, Panama, Peru, Poland, Portugal, Republic of Korea, Romania, Rwanda, Senegal, Slovakia, Slovenia, Spain, Sweden, Switzerland, Thailand, the former Yugoslav Republic of Macedonia, Timor-Leste, Togo, Turkey and United Kingdom of Great Britain and Northern Ireland",N/A,In-depth study on all forms of violence against women,"The General Assembly, Recalling its resolution 58/185 of 22 December 2003, entitled “In-depth study on all forms of violence against women”, 1. Takes note of the report of the Secretary-General on the status of preparations for the study;! 2. Welcomes: (a) The work undertaken so far in conducting the study, in particular at the expert group meeting on data and statistics on violence against women, held in Geneva from 11 to 14 April 2005, and the expert group meeting on good practices in combating violence against women, held in Vienna from 17 to 20 May 2005; (b) The initiatives taken at the national, regional and international levels to highlight the study and contribute to its preparation, including the workshop on violence against women, held in Paris on 28 and 29 April 2005, and the consultation at United Nations Headquarters, on 6 and 7 September 2005; 05-55298 (E) 141005 *0555298* 3. Stresses once again the importance, when conducting the study, of close cooperation with: (a) All relevant United Nations bodies, funds and programmes, including the United Nations Development Fund for Women, the United Nations Children’s Fund, the United Nations Development Programme, the United Nations Population Fund, the World Health Organization and the United Nations International Research and Training Institute for the Advancement of Women; (b) All relevant parts of the Secretariat, in particular the Office of the United Nations High Commissioner for Human Rights and the regional commissions; (c) United Nations treaty bodies, in particular the Committee on the Elimination of Discrimination against Women; (d) Special procedures of the Commission on Human Rights, in particular the Special Rapporteur on violence against women, its causes and consequences; 4. Requests the Secretary-General: (a) To seize all opportunities to raise awareness on the conduct of the study and solicit contributions, and in this regard notes with appreciation the launch of a website dedicated to the study and the online discussion that took place from 26 September to 15 October 2005; (b) To ensure that the conduct of the study on all forms of violence against women will be carried out in close cooperation with the in-depth study on the question of violence against children requested in its resolution 56/138 of 19 December 2001 so as to enable the exchange of appropriate information; (¢) To continue to provide opportunities for consultations with Member States and other stakeholders and to solicit information, including on strategies, policies, programmes and best practices, including from regional organizations; (d) To continue and, where appropriate, to strengthen cooperation with relevant non-governmental organizations in the preparation of the study; 5. Urges all relevant United Nations bodies, funds and programmes to fully cooperate with the Secretary-General in the conduct of the study; 6. Encourages Member States to contribute to the funding of the in-depth study on all forms of violence against women in order to meet the budgetary requirements for the study; 7. Decides: (a) To extend to the sixty-first session of the General Assembly the deadline for submission of the report mentioned in subparagraph (d) of its resolution 58/185, in time for its in-depth consideration at that session, at the latest by early September 2006; (b) To consider the report at its sixty-first session under the item entitled “Advancement of women”.",10/13/2005,2005_558461,Niger,N/A,yes
