year,Council,Committee,Session,Agenda item,Agenda detail,cosponsored countries,body title number,body title detail,body text,date,file,filecountry,footnote,scanned
2005,General Assembly,Third Committee,Sixtieth session,71 (b),"Human rights questions: human rights questions, including alternative approaches for improving the effective enjoyment of human rights and fundamental freedoms","Algeria, Azerbaijan, Bahrain, Bangladesh, Benin, Burkina Faso, China, Congo, Cuba, Djibouti, Egypt, Eritrea, Ethiopia, Indonesia, Iran (Islamic Republic of), Iraq, Kazakhstan, Kuwait, Lebanon, Libyan Arab Jamahiriya, Malaysia, Mauritania, Morocco, Myanmar, Niger, Nigeria, Oman, Pakistan, Saudi Arabia, Senegal, Sri Lanka, Sudan, Syrian Arab Republic, Thailand, Turkmenistan, United Republic of Tanzania and Viet Nam",N/A,Human rights and cultural diversity,"The General Assembly, Recalling the Universal Declaration of Human Rights,! the International Covenant on Economic, Social and Cultural Rights2 and the International Covenant on Civil and Political Rights,3 as well as other pertinent human rights instruments, Recalling also its resolutions 54/160 of 17 December 1999, 55/91 of 4 December 2000 and 57/204 of 18 December 2002, and recalling further its resolutions 54/113 of 10 December 1999, 55/23 of 13 November 2000 and 60/4 of 20 October 2005 on the United Nations Year of Dialogue among Civilizations, Noting that numerous instruments within the United Nations system promote cultural diversity, as well as the conservation and development of culture, in particular the Declaration of the Principles of International Culture Cooperation proclaimed on 4 November 1966 by the General Conference of the United Nations Educational, Scientific and Cultural Organization at its fourteenth session,’ Taking note of the report of the Secretary-General, 4 Welcoming the adoption of the Global Agenda for Dialogue among Civilizations by its resolution 56/6 of 9 November 2001, 1 Resolution 217 A (III). 2 See resolution 2200 A (XXI), annex. 3 See United Nations Educational, Scientific and Cultural Organization, Records of the General Conference, Fourteenth Session, Paris, 1966, Resolutions. 4 A/60/340. 05-58789 (E) 091105 *0558789* Welcoming also the contribution of the World Conference against Racism, Racial Discrimination, Xenophobia and Related Intolerance, held at Durban, South Africa, from 31 August to 8 September 2001, to the promotion of respect for cultural diversity, Welcoming further the Universal Declaration on Cultural Diversity of the United Nations Educational, Scientific and Cultural Organization,> together with its Action Plan,® adopted on 2 November 2001 by the General Conference of the United Nations Educational, Scientific and Cultural Organization at its thirty-first session, in which member States invited the United Nations system and other intergovernmental and non-governmental organizations concerned to cooperate with the United Nations Educational, Scientific and Cultural Organization in the promotion of the principles set forth in the Declaration and its Action Plan with a view to enhancing the synergy of actions in favour of cultural diversity, Reaffirming that all human rights are universal, indivisible, interdependent and interrelated and that the international community must treat human rights globally in a fair and equal manner, on the same footing and with the same emphasis, and that, while the significance of national and regional particularities and various historical, cultural and religious backgrounds must be borne in mind, it is the duty of States, regardless of their political, economic and cultural systems, to promote and protect all human rights and fundamental freedoms, Recognizing that cultural diversity and the pursuit of cultural development by all peoples and nations are a source of mutual enrichment for the cultural life of humankind, Taking into account that a culture of peace actively fosters non-violence and respect for human rights and strengthens solidarity among peoples and nations and dialogue between cultures, Recognizing that all cultures and civilizations share a common set of universal values, Recognizing also that the promotion of the rights of indigenous people and their cultures and traditions will contribute to the respect for and observance of cultural diversity among all peoples and nations, Considering that tolerance of cultural, ethnic, religious and linguistic diversities, as well as dialogue among and within civilizations, is essential for peace, understanding and friendship among individuals and people of different cultures and nations of the world, while manifestations of cultural prejudice, intolerance and xenophobia towards different cultures and religions generate hatred and violence among peoples and nations throughout the world, Recognizing in each culture a dignity and value that deserve recognition, respect and preservation, and convinced that, in their rich variety and diversity, and in the reciprocal influences that they exert on one another, all cultures form part of the common heritage belonging to all humankind, 5 United Nations Educational, Scientific and Cultural Organization, Records of the General Conference, Thirty-first Session, Paris, 15 October-3 November 2001, vol. 1: Resolutions, chap. V, resolution 25, annex I. A/C.3/60/L.55 Convinced that the promotion of cultural pluralism and tolerance towards and dialogue among various cultures and civilizations would contribute to the efforts of all peoples and nations to enrich their cultures and traditions by engaging in a mutually beneficial exchange of knowledge and intellectual, moral and material achievements, Acknowledging the diversity of the world, recognizing that all cultures and civilizations contribute to the enrichment of mankind, acknowledging the importance of respect and the understanding for religious and cultural diversity throughout the world, and, in order to promote international peace and security, committing ourselves to advancing human welfare, freedom and progress everywhere, as well as to encouraging tolerance, respect, dialogue and cooperation among different cultures, civilizations and peoples, 1. Affirms the importance for all peoples and nations to hold, develop and preserve their cultural heritage and traditions in a national and international atmosphere of peace, tolerance and mutual respect; 2. Welcomes the adoption of the United Nations Millennium Declaration of 8 September 2000,7 in which Member States consider, inter alia, that tolerance is one of the fundamental values essential to international relations in the twenty-first century and that it should include the active promotion of a culture of peace and dialogue among civilizations, with human beings respecting one another in all their diversity of belief, culture and language, neither fearing nor repressing differences within and between societies but cherishing them as a precious asset of humanity; 3. Recognizes the right of everyone to take part in cultural life and to enjoy the benefits of scientific progress and its applications; 4. Affirms that the international community should strive to respond to the challenges and opportunities posed by globalization in a manner that ensures respect for the cultural diversity of all; 5. Expresses its determination to prevent and mitigate cultural homogenization in the context of globalization, through increased intercultural exchange guided by the promotion and protection of cultural diversity; 6. Affirms that intercultural dialogue essentially enriches the common understanding of human rights and that the benefits to be derived from the encouragement and development of international contacts and cooperation in the cultural fields are important; 7. Welcomes the recognition at the World Conference against Racism, Racial Discrimination, Xenophobia and Related Intolerance of the necessity of respecting and maximizing the benefits of diversity within and among all nations in working together to build a harmonious and productive future by putting into practice and promoting values and principles such as justice, equality and non-discrimination, democracy, fairness and friendship, tolerance and respect within and among communities and nations, in particular through public information and educational programmes to raise awareness and understanding of the benefits of cultural diversity, including programmes in which the public authorities work in A/C.3/60/L.55 partnership with international and non-governmental organizations and other sectors of civil society; 8. Recognizes that respect for cultural diversity and the cultural rights of all enhances cultural pluralism, contributing to a wider exchange of knowledge and understanding of cultural background, advancing the application and enjoyment of universally accepted human rights throughout the world and fostering stable, friendly relations among peoples and nations worldwide; 9. Emphasizes that the promotion of cultural pluralism and tolerance at the national, regional and international levels is important for enhancing respect for cultural rights and cultural diversity; 10. Also emphasizes that tolerance and respect for diversity facilitate the universal promotion and protection of human rights, including gender equality and the enjoyment of all human rights by all, and underlines the fact that tolerance and respect for cultural diversity and the universal promotion and protection of human rights are mutually supportive; 11. Urges all actors on the international scene to build an international order based on inclusion, justice, equality and equity, human dignity, mutual understanding and promotion of and respect for cultural diversity and universal human rights, and to reject all doctrines of exclusion based on racism, racial discrimination, xenophobia and related intolerance; 12. Urges States to ensure that their political and legal systems reflect the multicultural diversity within their societies and, where necessary, to improve democratic institutions so that they are more fully participatory and avoid marginalization and exclusion of, and discrimination against, specific sectors of society; 13. Calls upon States, international organizations and United Nations agencies, and invites civil society, including non-governmental organizations, to recognize and promote respect for cultural diversity for the purpose of advancing the objectives of peace, development and universally accepted human rights; 14. Requests the Secretary-General, in the light of the present resolution, to prepare a report on human rights and cultural diversity, taking into account the views of Member States, relevant United Nations agencies and non-governmental organizations, as well as the considerations in the present resolution regarding the recognition and importance of cultural diversity among all peoples and nations in the world, and to submit the report to the General Assembly at its sixty-second session; 15. Requests the Office of the United Nations High Commissioner for Human Rights to give full and equal attention to the issues raised in the present resolution in the course of its activities for the promotion and protection of human rights; 16. Decides to continue consideration of this question at its sixty-second session under the sub-item entitled “Human rights questions, including alternative approaches for improving the effective enjoyment of human rights and fundamental freedoms”.",11/03/2005,2005_560438,Niger,N/A,yes
2005,General Assembly,Third Committee,Sixtieth session,70,Right of peoples to self-determination,"Algeria, Azerbaijan, Bahrain, Bangladesh, Brunei Darussalam, Burkina Faso, Egypt, Eritrea, Iran (Islamic Republic of), Kuwait, Libyan Arab Jamabhiriya, Malaysia, Niger, Oman, Pakistan, Qatar, Saudi Arabia, Somalia and United Arab Emirates",N/A,Universal realization of the right of peoples to self-determination,"The General Assembly, Reaffirming the importance, for the effective guarantee and observance of human rights, of the universal realization of the right of peoples to self- determination enshrined in the Charter of the United Nations and embodied in the International Covenants on Human Rights,! as well as in the Declaration on the Granting of Independence to Colonial Countries and Peoples contained in General Assembly resolution 1514 (XV) of 14 December 1960, Welcoming the progressive exercise of the right to self-determination by peoples under colonial, foreign or alien occupation and their emergence into sovereign statehood and independence, Deeply concerned at the continuation of acts or threats of foreign military intervention and occupation that are threatening to suppress, or have already suppressed, the right to self-determination of peoples and nations, Expressing grave concern that, as a consequence of the persistence of such actions, millions of people have been and are being uprooted from their homes as refugees and displaced persons, and emphasizing the urgent need for concerted international action to alleviate their condition, Recalling the relevant resolutions regarding the violation of the right of peoples to self-determination and other human rights as a result of foreign military 05-59310 (E) 101105 *0559310~ intervention, aggression and occupation, adopted by the Commission on Human Rights at its sixty-first2 and previous sessions, Reaffirming its previous resolutions on the universal realization of the right of peoples to self-determination, including resolution 59/180 of 20 December 2004, Reaffirming also its resolutions 55/2 of 8 September 2000, containing the United Nations Millennium Declaration, and 60/1 of 16 September 2005, containing the 2005 World Summit Outcome, which, inter alia, uphold the right to self- determination of peoples under colonial domination and foreign occupation, Taking note of the report of the Secretary-General on the right of peoples to self-determination,3 1. Reaffirms that the universal realization of the right of all peoples, including those under colonial, foreign and alien domination, to self-determination is a fundamental condition for the effective guarantee and observance of human rights and for the preservation and promotion of such rights; 2. Declares its firm opposition to acts of foreign military intervention, aggression and occupation, since these have resulted in the suppression of the right of peoples to self-determination and other human rights in certain parts of the world; 3. Calls upon those States responsible to cease immediately their military intervention in and occupation of foreign countries and territories and all acts of repression, discrimination, exploitation and maltreatment, in particular the brutal and inhuman methods reportedly employed for the execution of those acts against the peoples concerned; 4. Deplores the plight of millions of refugees and displaced persons who have been uprooted as a result of the aforementioned acts, and reaffirms their right to return to their homes voluntarily in safety and honour; 5. Requests the Commission on Human Rights to continue to give special attention to the violation of human rights, especially the right to self-determination, resulting from foreign military intervention, aggression or occupation; 6. Requests the Secretary-General to report on the question to the General Assembly at its sixty-first session under the item entitled “Right of peoples to self- determination”. 2 See Official Records of the Economic and Social Council, 2005, Supplement No. 3 (E/2005/23), chap. I, sect. A. 3 A/60/268.",11/08/2005,2005_560441,Niger,N/A,yes
2005,General Assembly,Second Committee,Sixtieth session,73 (b),"Strengthening of the coordination of humanitarian and disaster relief assistance of the United Nations, including special economic assistance: special economic assistance to individual countries or regions","Algeria, Angola, Azerbaijan, Bahrain, Benin, Botswana, Brazil, Burkina Faso, Central African Republic, Chile, China, Comoros, Congo, Cuba, Djibouti, Egypt, Eritrea, Ethiopia, Gabon, Ghana, Guatemala, Guinea, Guinea-Bissau, Haiti, Italy, Jamaica, Kazakhstan, Kenya, Kuwait, Lebanon, Lesotho, Liberia, Libyan Arab Jamabhiriya, Madagascar, Malawi, Mali, Mauritania, Morocco, Mozambique, Namibia, Niger, Nigeria, Pakistan, Qatar, Saint Vincent and the Grenadines, Saudi Arabia, Senegal, Somalia, South Africa, Sudan, Sweden, Syrian Arab Republic, Thailand, Togo, Tunisia, United Republic of Tanzania, Turkey, Yemen, Zambia and Zimbabwe:",N/A,Assistance for humanitarian relief and the economic and social rehabilitation of Somalia,"The General Assembly, Recalling its resolutions 47/160 of 18 December 1992 and subsequent relevant resolutions, in particular resolutions 56/106 of 14 December 2001, 57/154 of 16 December 2002, 58/115 of 17 December 2003 and 59/218 of 22 December 2004, Noting with serious concern the effects of the civil war in Somalia and in particular the destruction of the physical, economic and social infrastructure of Somalia, Underlining the urgent need for the rehabilitation and reconstruction of the infrastructure, Also underlining the wurgency in rebuilding State institutions and in strengthening the capacity of those institutions, 05-59586* (E) 161105 *0559586* Welcoming the continued efforts of the African Union and the Intergovernmental Authority on Development towards the successful conclusion of the peace process for Somalia, Deeply concerned that the collateral effects of the ongoing drought continue to worsen, as evidenced by the high levels of malnutrition ranging from 19 to 22 per cent, Noting with grave concern the effects of the 2004 tsunami, which threaten the livelihoods and environment of the coastal population and have had a negative impact on the Somali economy, Underlining the urgent need for humanitarian assistance and continued relief, reconstruction and livelihood assistance, as well as equitable resource allocation to vulnerable communities, such as destitute pastoralists and internally displaced persons, Concerned that shipments of illegal nuclear and toxic waste dumped along the coastline of Somalia and stirred up by the tsunami, as reported by the United Nations Environment Programme Asian Tsunami Disaster Task Force, have caused health and environmental problems and can cause serious long-term effects on human health, that they pose a very serious environmental hazard, not only in Somalia but in the eastern Africa subregion, and that they are contrary to international law, infringing on the sovereignty and territorial integrity of Somalia, Recognizing the negative effects of the proliferation of small arms and light weapons on the humanitarian situation and on development in Somalia, and in this regard condemning the significant increase in the flow of weapons and ammunition supplies to and through Somalia, Noting the intrinsic link between the search for peace and reconciliation and the alleviation of the humanitarian crisis in Somalia, and in this regard underlining that a stable and secure environment in Somalia is essential to the future success of the national reconciliation process and that the improvement of the humanitarian situation is an essential component of support for the peace and reconciliation process, Welcoming the continued focus of the United Nations, in partnership with the newly established Transitional Federal Government of Somalia, Recalling the statements by the President of the Security Council of 31 October 2001! and 28 March 2002,2 by which the Council condemned attacks on humanitarian personnel and called upon all parties in Somalia to respect fully the security and safety of personnel of the United Nations, the International Committee of the Red Cross and non-governmental organizations, and to guarantee their complete freedom of movement and access throughout Somalia, Re-emphasizing the crucial importance of the further implementation of its resolutions 47/160, 56/106, 57/154, 58/115 and 59/218 to rehabilitate basic social and economic services throughout the country, 1 S/PRST/2001/30; see Resolutions and Decisions of the Security Council, 1 January 2001- 31 July 2002. 2 S/PRST/2002/8; see Resolutions and Decisions of the Security Council, 1 January 2001-31 July 2002. A/C.2/60/L.8/Rev.2 Taking note of the reports of the Secretary-General,3 1. Expresses its appreciation to the Secretary-General for his continued and tireless efforts to mobilize assistance for the Somali people, and welcomes the steps being taken to strengthen the capacity of the United Nations Political Office for Somalia and the appointment of the Special Representative of the Secretary- General; 2. Welcomes with great satisfaction the formation of the transitional federal institutions and their relocation to Somalia, urges further progress, and calls upon the Somali leaders to continue to work towards establishing effective national governance through inclusive dialogue and consensus-building within the framework of those institutions, in accordance with the transitional federal charter of the Somali Republic adopted in February 2004; 3. Urges, in that regard, the Somali leaders to make every effort to create conditions to help to increase the effectiveness of humanitarian assistance by, inter alia, improving the security situation on the ground; 4. Urges, in that regard, the fundamental importance of donor countries, regional and subregional organizations continuing to contribute to the reconstruction and rehabilitation of Somalia, in particular through the mechanism of the rapid assistance programme and efforts coordinated by the United Nations; 5. Urges the United Nations to continue the implementation of the relief, rehabilitation and reconstruction programmes for Somalia in line with the priorities established by the Transitional Federal Government of Somalia; 6. Commends the Office for the Coordination of Humanitarian Affairs, the funds and programmes of the United Nations as well as other humanitarian organizations for their response, especially during the wake of the 2004 tsunami, and underlines the urgent need for putting into place practical measures aimed at the alleviation of the consequences of the drought in the most affected areas in Somalia; 7. Urges all States and intergovernmental and non-governmental organizations concerned to continue to implement further its resolutions 47/160, 56/106, 57/154, 58/115 and 59/218 in order to assist the transitional federal institutions in embarking on the rehabilitation of basic social and economic services, as well as institution-building aimed at the restoration of structures of civil governance at all levels in all parts of the country; 8. Calls upon the international community to assist in conducting critical assessments of the environmental impacts of the tsunami-affected areas, drought and flood-affected areas and of toxic and other wastes, and in putting into place aggressive programmes focusing on short, medium and long-term measures in the areas of institutional development, development of policy and legislation, land use and soil management, marine and coastal ecosystem management and disaster management (prevention, preparedness, assessment, response and mitigation); 9. Calls upon the Secretary-General to continue to mobilize rapid international financial assistance as well as humanitarian, rehabilitation and 3 A/58/133, S/2003/231, S/2003/636, S/2003/987, S/2004/115 and Corr.1, S/2004/469, S/2004/804, S/2005/89 and S/2005/392. A/C.2/60/L.8/Rev.2 reconstruction relief for the Somali people and to help build capacity within the transitional federal institutions in support of a consensus agreement; 10. Urges the Somali parties to respect the security and safety of the personnel of the United Nations, the specialized agencies, the International Red Cross and Red Crescent Movement and non-governmental organizations, as well as all other humanitarian personnel, and to guarantee their complete freedom of movement and safe access throughout Somalia; 11. Urges the international community to support the need for peacebuilding measures and the speedy implementation of programmes for the disarmament, demobilization and reintegration of militias throughout Somalia in order to stabilize the entire country and thereby ensure the effectiveness of the Transitional Federal Government of Somalia; 12. Calls upon the international community to provide, as a matter of urgency, humanitarian assistance and relief to the transitional federal institutions and the Somali people to alleviate in particular the consequences of the civil war and the prevailing drought; 13. Also calls upon the international community to provide continuing and increased assistance in response to the United Nations 2004 Consolidated Inter- Agency Appeal for relief, rehabilitation and reconstruction assistance for Somalia; 14. Commends the Secretary-General for the establishment of the Trust Fund for Peacebuilding in Somalia, welcomes the contributions made thus far to the Fund, and appeals to Member States to contribute to it; 15. Requests the Secretary-General, in view of the critical situation in Somalia, to take all necessary and practicable measures for the implementation of the present resolution and to report thereon to the General Assembly at its sixty-first session.",11/11/2005,2005_560537,Niger,* Reissued for technical reasons.,yes
