year,Council,Committee,Session,Agenda item,Agenda detail,cosponsored countries,body title number,body title detail,body text,date,file,filecountry,footnote,scanned
2001,General Assembly,Third Committee,Fifty-sixth session,115,Promotion and protection of the rights of children,"Andorra, Argentina, Belgium, Benin, Bolivia, Botswana, Canada, Chile, Democratic Republic of the Congo, Denmark, Ethiopia, Ecuador, Finland, Germany, Hungary, Ireland, Italy, Japan, Kenya, Latvia, Lesotho, Luxembourg, Malawi, Mauritius, Monaco, Mozambique, Namibia, Nepal, Netherlands, New Zealand, Niger, Nigeria, Norway, Poland, Portugal, Republic of Moldova, Romania, San Marino, Senegal, Singapore, Slovenia, South Africa, Swaziland, Sweden, Thailand, the former Yugoslav Republic of Macedonia, Uganda, United Kingdom of Great Britain and Northern Ireland, United Republic of Tanzania, Uruguay, Venezuela, Zambia and Zimbabwe",N/A,The girl child,"The General Assembly, Recalling its resolution 55/78 of 4 December 2000 and all previous relevant resolutions, including the agreed conclusions of the Commission on the Status of Women, in particular those relevant to the girl child, Recalling also all relevant United Nations conferences and the Declaration and Agenda for Action adopted by the World Congress against Commergjal Sexual Exploitation of Children, held at Stockholm from 27 to 31 August 1996,+as well as the outcome documents of the recent five-year reviews of the implementation of the Programme Action of the International Conference on Population and Development®and the Programme of Action of the World Summit for Social Development,l;I Deeply concerned about discrimination against the girl child and the violation of the rights of the girl child, which often result in less access for girls to education, nutrition, physical and mental health care and in girls enjoying fewer of the rights, opportunities and benefits of childhood and adolescence than boys and often being subjected to various forms of cultural, social, sexual and economic exploitation and 1 A/51/385, annex. 2 Resolution S-21/2, annex. 3 Resolution S-24/2, annex. to violence and harmful practices, such as female infanticide, incest, early marriage, prenatal sex selection and female genital mutilation, Recognizing the need to achieve gender equality so as to ensure a just and equitable world for girls, Deeply concerned that, in situations of poverty, war and armed conflict, girl children are among the victims most affected and that thus their potential for full development is limited, Concerned that the girl child has furthermore become a victim of sexually transmitted diseases and the human immunodeficiency virus, which affects the quality of her life and leaves her open to further discrimination, Reaffirming the equal rights of women and men as enshrined, inter alia, in the Preamble to the Charter of the United Nations, the Convention on the Elimination of All Formtr)f Discrimination against Wome:'i] and the Convention on the Rights of the Child, Reaffirming also the political declaratiml;I and furtheractions and initiatives to implement the Beijing Declaration and Platform for Action,” adopted by the General Assembly at its twenty-third special session, entitled “Women 2000: gender equality, development and peace for the twenty-first century”, Reaffirming further the Dakar Framework for Action adopted at the World Education Forum, Reaffirming the Declaration of Commitment on HIV/AIDS,I‘Q‘—‘I adopted by the General Assembly at its twenty-sixth special session, 1. Stresses the need for full and urgent implementation of the rights of the girl child as guaranteed to her under a]l human rights instruments, including the Convention on the Rights of the Child™ and the Convention on the Elimination of All Forms of Discrimination against Women,™ as well as the need for universal ratification of those instruments; 2. Urges States to consider signing, ratifying or acceding to the Optional Protocol to theﬁonvention on the Elimination of All Forms of Discrimination against Women; 3. Welcomes the adoption of the Optional Protocols to the ConvE:jion on the Rights of the Child on the involvement of children in apmed conflict**and on the sale of children, child prostitution and child pornography,*® and invites States to consider signing and ratifying the Optional Protocols as a matter of priority with a view to their entry into force as soon as possible; 8 See Final Report of the World Education Forum, Dakar, Senegal, 26-28 April 2000, United Nations Educational, Scientific and Cultural Organization, Paris, 2000. A/C.3/56/L.29 4. Also welcomes the United Nations Girls’ Education Initiative launched by the Secretary-General at the World Education Forum; 5. Urges all Governments and the United Nations system to strengthen efforts bilaterally and with international organizations and private sector donors in order to achieve the goals of the World Education Forum, in particular that of eliminating gender disparities in primary and secondary education by 2005, and for the implementation of the United Nations Girls’ Education Initiative as a means of reaching this goal, and Ejffirms the commitment contained in the United Nations Millennium Declaration; 6. Calls upon all States to take measures to address the obstacles that continueto affect the achievement of the goals set forth in the Beijing Platform for Action,** as contained in paragraph 33 of the further actio&s and initiatives to implement the Beijing Declaration and Platform for Action, where appropriate, including the strengthening of national mechanisms to implement policies and programmes for the girl child and, in some cases, to enhance coordination among responsible institutions for the realization of the human rights of girls, as indicated in the further actions and initiatives; 7. Urges all States to take all necessary measures and to institute legal reforms to ensure the full and equal enjoyment by the girl child of all human rights and fundamental freedoms, to take effective action against violations of those rights and freedoms and to base programmes and policies for the girl child on the rights of the child; 8. Urges States to enact and enforce strictly laws to ensure that marriage is entered into only with the free and full consent of the intending spouses, to enact and enforce strictly laws concerning the minimum legal age of consent and the minimum age for marriage and to raise the minimum age for marriage where necessary; 9. Urges all States to fulfil their obligations under the Convention on the Rights of the Child and the Convention on the Elimination of All Forms of Discrimination against Women as well as the commitment to implement the Beijing Platform for Action; 10. Also urges all States to enact and enforce legislation to protect girls from all forms of violence, including female infanticide and prenatal sex selection, female genital mutilation, rape, domestic violence, incest, sexual abuse, sexual exploitation, child prostitution and child pornography, and to develop age-appropriate safe and confidential programmes and medical, social and psychological support services to assist girls who are subjected to violence; 11. Calls upon all States and international and non-governmental organizations, individually and collectively, to implement further the Beijing Platform for Action, in particular the strategic objectives relating to the girl child and including the further actions and initiatives to implement the Beijing Declaration and Platform for Action; 13 See resolution 55/2. 14 Report of the Fourth World Conference on Women, Beijing, 4-15 September 1995 (United Nations publication, Sales No. E.96.1V.13), chap. I, resolution 1, annex II. A/C.3/56/L.29 12. Urges States to take special measures for the protection of war-affected girls and in particular to protect them from sexually transmitted diseases, such as human immunodeficiency virus/acquired immunodeficiency syndrome, and gender- based violence, including rape and sexual abuse, torture, sexual exploitation, abduction and forced labour, paying special attention to refugee and displaced girls, and to take into account the special needs of the war-affected girl child in the delivery of humanitarian assistance and disarmament, demobilization and reintegration processes; 13. Urges all States and the international community to respect, protect and promote the rights of the child, taking into account the particular vulnerabilities of the girl child in pre-conflict, conflict and post-conflict situations, and calls for special initiatives designed to address all of the rights and needs of war-affected girls; 14. Welcomes the holding of the International Conference on War-Affected Children at Winnipeg, Canada, from 10 to 17 September 2000, takes note with appreciation of the Winnipeg Agenda for War-Affected Children; 15. Urges States to formulate comprehensive, multidisciplinary and coordinated national plans, programmes or strategies to eliminate all forms of violence against women and girls, which should be widely disseminated and should provide targets and timetables for implementation, as well as effective domestic enforcement procedures through the establishment of monitoring mechanisms involving all parties concerned, including consultations with women’s organizations, giving attention to the recommendations relating to the girl child of the Special Rapporteur of the Commission on Human Rights on violence against women, its causes and consequences; 16. Calls upon Governments, civil society, including the media, and non-governmental organizations to promote human rights education and the full respect for and enjoyment of the human rights of the girl child, inter alia, through the translation, production and dissemination of age-appropriate information material on those rights to all sectors of society, in particular to children; 17. Requests the Secretary-General, as Chairman of the Administrative Committee on Coordination, to ensure that all organizations and bodies of the United Nations system, individually and collectively, in particular the United Nations Children’s Fund, the United Nations Educational, Scientific and Cultural Organization, the World Food Programme, the United Nations Population Fund, the United Nations Development Fund for Women, the World Health Organization, the United Nations Development Programme and the Office of the United Nations High Commissioner for Refugees, take into account the rights and the particular needs of the girl child in the country programme of cooperation in accordance with the national priﬁjties, including through the United Nations Development Assistance Framework, 15 A/55/467-S/2000/973, annex. 16 See A/53/226, paras. 72-77, and A/53/226/Add.1, paras. 88-98. A/C.3/56/L.29 18. Requests all human rights treaty bodies, special procedures and other human rights mechanisms of the Commission on Human Rights and its Subcommission on the Promotion and Protection of Human Rights to adopt regularly and systematically a gender perspective in the implementation of their mandates and to include in their reports information on the qualitative analysis of violations of the human rights of women and girls, and encourages the strengthening of cooperation and coordination in that regard; 19. Calls upon States and international and non-governmental organizations to mobilize all necessary resources, support and efforts to realize the goals, strategic objectives and actions set out in the Beijing Platform for Action and the further actions and initiatives to implement the Beijing Declaration and Platform for Action; 20. Stresses the importance of a substantive assessment of the implementation of the Beijing Platform for Action with a life-cycle perspective so as to identify gaps and obstacles in the implementation process and to develop further actions for the achievement of the goals of the Platform; 21. Welcomes the convening of the Second World Congress against Commercial Sexual Exploitation of Children at Yokohama, Japan, from 17 to 20 December 2001, and the regional consultative meetings for its preparation, which aim to review the progress made in implementing the Declaration and Agenda for Action adopted by the first World Congress, held at Stockholm from 27 to 31 August 1996 and to strengthen actions to eradicate sexual commercial exploitation of children, and invites Member States and observers to ensure their representation at the Second World Congress at a high political level; 22. Encourages the regional commissions and other regional organizations to carry out activities in support of the preparations for the Second World Congress; 23. Stresses the importance of integrating a gender perspective and the needs and rights of the girl child into the work of the special session of the General Assembly on children.",10/31/2001,2001_451536,Nigeria,N/A,yes
2001,General Assembly,N/A,Fifty-sixth session,28,Culture of peace,"Bangladesh, Benin, Chile, El Salvador and Togo",N/A,"International Decade for a Culture of Peace and Non-Violence for the Children of the World, 2001-2010","Addendum Add the following countries to the list of sponsors of the resolution: Argentina, Azerbaijan, Belarus, Burundi, Cambodia, Cameroon, Costa Rica, Cuba, Cyprus, Egypt, Eritrea, Gabon, Guyana, India, Jamaica, Madagascar, Malawi, Morocco, Myanmar, Namibia, Nigeria, Philippines, Republic of Moldova, Russian Federation, Senegal, Suriname, Tajikistan, Thailand and the former Yugoslav Republic of Macedonia 01-62015 (E) 051101",11/05/2001,2001_451718,Nigeria,N/A,yes
2001,General Assembly,Third Committee,Fifty-sixth session,118,Right of peoples to self-determination,"Angola, Bolivia, Cambodia, Cameroon, China, Comoros, Congo, Costa Rica, Cuba, Democratic People’s Republic of Korea, Democratic Republic of the Congo, Dominican Republic, Ecuador, Egypt, Eritrea, Ethiopia, Guatemala, Iran (Islamic Republic of), Iraq, Kenya, Lao People’s Democratic Republic, Libyan Arab Jamahiriya, Mali, Niger, Nigeria, Pakistan, Peru, Rwanda, Sudan, Syrian Arab Republic, Togo, Viet Nam and Yemen",N/A,Use of mercenaries as a means of violating human rights and impeding the exercise of the right of peoples to self-determination,"The General Assembly, Recalling its resolution 55/86 of 4 December 2000, apd taking note of Commission on Human Rights resolution 2001/3 of 6 April 2001, Recalling also all of its relevant resolutions, in which, inter alia, it condemned any State that permitted or tolerated the recruitment, financing, training, assembly, transit and use of mercenaries with the objective of overthrowing the Governments of States Members of the United Nations, especially those of developing countries, or of fighting against national liberation movements, and recalling further the relevant resolutions of and international instruments adopted by the Security Council, the Economic and Social Council and the Organization of African Unity, inter alia the Convention of the Organization of African Unity on the Elimination of Mercenarism in Africa, Reaffirming the purposes and principles enshrined in the Charter of the United Nations concerning the strict observance of the principles of sovereign equality, political independence, the territorial integrity of States, the self-determination of peoples, the non-use of force or threat of use of force in international relations and non-interference in affairs within the domestic jurisdiction of States, 1 See Official Records of the Economic and Social Council, 2001, Supplement No. 3 (E/2001/23), chap. II, sect. A. Reaffirming also that, by virtue of the principle of self-determination, all peoples have the right freely to determine their political status and to pursue their economic, social and cultural development, and that every State has the duty to respect this right in accordance with the provisions of the Charter, Reaffirming further the Declaration on Principles of International Law concerning Friendly Relationsljnd Cooperation among States in accordance with the Charter of the United Nations, Alarmed and concerned about the danger that the activities of mercenaries constitute to peace and security in developing countries, in particular in Africa and in small States, Deeply concerned about the loss of life, the substantial damage to property and the negative effects on the policy and economies of affected countries resulting from mercenary criminal activities, Convinced that, notwithstanding the way in which mercenaries or mercenary- related activities are used or the form they take to acquire some semblance of legitimacy, they are a threat to peace, security and the self-determination of peoples and an obstacle to the enjoyment of human rights by peoples, 1. Welcomes the report of the Special Rapporteur of the Commission on Human Rights on the use of mercenaries as a means of violating human rights and impeding the exercise of the right of peoples to self-determination; 2. Reaffirms that the use of mercenaries and their recruitment, financing and training are causes for grave concern to all States and violate the purposes and principles enshrined in the Charter of the United Nations; 3. Recognizes that armed conflict, terrorism, arms-trafficking and covert operations by third Powers, inter alia, encourage the demand for mercenaries on the global market; 4. Urges all States to take the necessary steps and to exercise the utmost vigilance against the menace posed by the activities of mercenaries and to take legislative measures to ensure that their territories and other territories under their control, as well as their nationals, are not used for the recruitment, assembly, financing, training and transit of mercenaries for the planning of activities designed to impede the right of peoples to self-determination, to destabilize or overthrow the Government of any State or to dismember or impair, totally or in part, the territorial integrity or political unity of sovereign and independent States conducting themselves in compliance with the right of peoples to self-determination; 5. Welcomes the recent entry into force of the International nvention against the Recruitment, Use, Financing and Training of Mercenaries* and calls upon all States that have not yet done so to consider taking the necessary action to sign or ratify it, as a matter of priority; 6. Also welcomes the cooperation extended by those countries that have received visits from the Special Rapporteur; 2 Resolution 2625 (XXV), annex. 3 See A/56/224. 4 Resolution 44/34, annex. A/C.3/56/L.31 7. Further welcomes the adoption by some States of national legislation that restricts the recruitment, assembly, financing, training and transit of mercenaries; 8. Calls upon States to investigate the possibility of mercenary involvement whenever and wherever criminal acts of a terrorist nature occur and to bring to trial those found responsible or to consider their extradition, if so requested, in accordance with domestic law and applicable bilateral or international treaties; 9. Welcomes the convening by the Office of the United Nations High Commissioner for Human Rights of an expert meeting to discuss traditional and new forms of mercenary activities as a means of violating human rights and impeding the exercise of the right of peoples to self-determination, and takes note of its report,*as a valuable contribution to the process of elaborating a clearer legal definition of mercenaries that would make more efficient the prevention and punishment of mercenary activities; 10. Requests the United Nations High Commissioner for Human Rights to convene, before the fifty-ninth session of the Commission on Human Rights, a second expert meeting, pursuant to General Assembly resolution 54/151 of 17 December 1999, to continue studying and updating the international legislation and to make recommendations for a clearer legal definition of mercenaries that would make more efficient the prevention and punishment of mercenary activities; 11. Requests the Special Rapporteur to propose a clearer definition of mercenaries, including a clear nationality criteria, based on his findings, the proposals of States and the outcomes of the expert meetings, and to make suggestions on the procedure to be followed for international adoption of a new definition; 12. Requests the Office of the United Nations High Commissioner for Human Rights, as a matter of priority, to publicize the adverse effects of the activities of mercenaries on the right of peoples to self-determination and, when requested and where necessary, to render advisory services to States that are affected by the activities of mercenaries; 13. Requests the Special Rapporteur to continue taking into account in the discharge of his mandate that mercenary activities are continuing to occur in many parts of the world and are taking on new forms, manifestations and modalities; 14. Urges all States to cooperate fully with the Special Rapporteur in the fulfilment of his mandate; 15. Requests the Secretary-General and the United Nations High Commissioner for Human Rights to provide the Special Rapporteur with all the necessary assistance and support for the fulfilment of his mandate, both professional and financial, including through the promotion of cooperation between the Special Rapporteur and other components of the United Nations system that deal with countering mercenary-related activities; 16. Requests the Special Rapporteur to consult States, intergovernmental and non-governmental organizations in the implementation of the present resolution and to report, with specific recommendations, to the General Assembly at its fifty- A/C.3/56/L.31 seventh session, his findings on the use of mercenaries to undermine the right of peoples to self-determination; 17. Decides to consider at its fifty-seventh session the question of the use of mercenaries as a means of violating human rights and impeding the exercise of the right of peoples to self-determination under the item entitled “Right of peoples to self-determination”.",11/06/2001,2001_451904,Nigeria,N/A,yes
