year,Council,Committee,Session,Agenda item,Agenda detail,cosponsored countries,body title number,body title detail,body text,date,file,filecountry,footnote,scanned
2001,General Assembly,N/A,Fifty-fifth session,14,Report of the International Atomic Energy Agency,Nigeria,N/A,Report of the International Atomic Energy Agency,"The General Assembly, Having received the report of the International Atomic Energy Agency to the General Assembly for the year 1999, Noting the statement of the Director General of the Agency,’ Recognizing the importance of the work of the Agency and reaffirming its confidence in the role of the Agency, Recognizing also the cooperation between the United Nations and the Agency and the agreement covering the relationship between the United Nations and the Agency as approved by the General Conference of the Agency on 23 October 1957 and by the General Assembly in the annex to its resolution 1145 (XII) of 14 November 1957, Taking note also of the resolutions and decisions adopted by the General Conference of the Agency at its forty-fourth session, 1. Takes note of the report of the Agency;' 2. Requests the Secretary-General to transmit to the Director General of the Agency the records of the fifty-fifth session of the General Assembly relating to the activities of the Agency. ! See A/55/284 and Corr.1. % See Official Records of the General Assembly, Fifty-fifth Session, Plenary Meetings, 52nd and 53rd meetings (A/55/PV.52 and A/55/PV.53).",02/16/2001,2001_433362,Nigeria,N/A,yes
2001,Economic And Social Council,Commission On Human Rights,Fifty-seventh session,5,THE RIGHT OF PEOPLES TO SELF-DETERMINATION AND ITS APPLICATION TO PEOPLES UNDER COLONIAL OR ALIEN DOMINATION OR FOREIGN OCCUPATION,"Algeria, Angola*, Cameroon, Congo*, Cuba, Democratic Republic of the Congo, Democratic People’s Repubic of Korea*, Egypt*, Eritrea*, Ethiopia*, Gabon*, Ghana, Iraq*, Lao People’s Democratic Republic*, Libyan Arab Jamabhiriya, Madagascar, Nigeria, Sudan, Swaziland, Syrian Arab Republic, Togo*, Tunisia*, United Republic of Tanzania*,Viet Nam, Yemen*",2001,The use of mercenaries as a means of violating human rights and impeding the exercise of the right of peoples to self-determination,"The Commission on Human Rights, Recalling General Assembly resolution 55/86 of 4 December 2000 and recalling its own resolution 2000/3 of 7 April 2000, Recalling also all of its relevant resolutions, in which, inter alia, it condemned any State that permitted or tolerated the recruitment, financing, training, assembly, transit and use of mercenaries with the objective of overthrowing the Governments of States Members of the United Nations, especially those of developing countries or of fighting against national liberation movements, and recalling further the relevant resolutions and international instruments adopted by the General Assembly, the Security Council, the Economic and Social Council and the Organization of African Unity, inter alia the Convention of the Organization of African Unity on the Elimination of Mercenarism in Africa, Reaffirming the purposes and principles enshrined in the Charter of the United Nations concerning the strict observance of the principles of sovereign equality, political independence, territorial integrity of States, self-determination of peoples, the non-use of force or threat of use of force in international relations and non-interference in affairs within the domestic jurisdiction of States, Reaffirming also that by virtue of the principle of self-determination, all peoples have the right to freely determine their political status and freely pursue their economic, social and cultural development, Reaffirming further the Declaration on Principles of International Law concerning Friendly Relations among States in accordance with the Charter of the United Nations, Alarmed and concerned about the danger which the activities of mercenaries constitute to peace and security in developing countries, particularly in Africa and in small States, Deeply concerned about the loss of life, the substantial damage to property and the negative effects on the policy and economies of affected countries resulting from mercenary international criminal activities, Convinced that, notwithstanding the way in which mercenaries or mercenary-related activities are used or the form they take to acquire some semblance of legitimacy, they are a threat to peace, security and the self-determination of peoples and an obstacle to the enjoyment of human rights by peoples, 1. Welcomes the report of the Special Rapporteur on the use of mercenaries as a means of violating human rights and impeding the exercise of the right of peoples to self-determination (E/CN.4/2001/19); 2. Reaffirms that the use of mercenaries and their recruitment, financing and training are causes for grave concern to all States and violate the purposes and principles enshrined in the Charter of the United Nations; 3. Recognizes that armed conflicts, terrorism, arms trafficking and covert operations by third Powers, inter alia, encourage the demand for mercenaries on the global market; 4. Urges all States to take the necessary steps and to exercise the utmost vigilance against the menace posed by the activities of mercenaries and to take legislative measures to ensure that their territories and other territories under their control, as well as their nationals, are not used for the recruitment, assembly, financing, training and transit of mercenaries for the planning of activities designed to impede the right to self-determination, to overthrow the Government of any State, or dismember or impair, totally or in part, the territorial integrity or political unity of sovereign and independent States conducting themselves in compliance with the right to self-determination of peoples; 5. Calls upon all States that have not yet done so to consider taking the necessary action to sign or ratify the International Convention against the Recruitment, Use, Financing and Training of Mercenaries; 6. Welcomes the cooperation extended by those countries that received a visit by the Special Rapporteur on the use of mercenaries as a means of violating human rights and impeding the exercise of the right of peoples to self-determination; 7. Also welcomes the adoption by some States of national legislation that restricts the recruitment, assembly, financing, training and transit of mercenaries; 8. Invites States to investigate the possibility of mercenary involvement whenever and wherever criminal acts of a terrorist nature occur; 9. Welcomes the convening by the Office of the United Nations High Commissioner for Human Rights of an expert meeting to discuss the traditional and new forms of mercenary activities as a means of violating human rights and impeding the exercise of the right of peoples to self-determination; 10. Takes note of the report on the outcome of the above-mentioned expert meeting (E/CN.4/2001/18), as a valuable contribution to the process of elaborating a clearer legal definition of mercenaries that would make for more efficient prevention and punishment of 10. mercenary activities; 1. Reques 11. Reques}‘s the Office of the United Nations High Commissioner for Human Rights, as a matter of priority, to publicize the adverse effects of mercenary activities on the right of peoples to self-determination and, when requested and where necessary, to render advisory services to States that are affected by the activities of mercenaries; 12. Decides, in accordance with General Assembly resolution 55/86 of 4 December 2000, to renew the mandate of the Special Rapporteur on the use of mercenaries as a means of violating human rights and impeding the exercise of the right of peoples to self-determination for a period of three years; 13. Requests the Special Rapporteur to continue taking into account in the discharge of his mandate that mercenary activities are continuing to occur in many parts of the world and are taking on new forms, manifestations and modalities; 14. Urges all States to cooperate fully with the Special Rapporteur in the fulfilment of 12. 13. his mandate; 15. Requests the United Nations High Commissioner for Human Rights to provide the Special Rapporteur with all the necessary assistance and support for the fulfilment of his mandate, including through the promotion of cooperation between the Special Rapporteur and other components of the United Nations system that deal with countering mercenary-related activities; 16. Requests the Special Rapporteur to consult States, intergovernmental and 16. Requests the Special Rapporteur to consult States, intergovernmental and non-governmental organizations in the implementation of the present resolution and to report, with specific recommendations, his findings on the use of mercenaries to undermine the right to self-determination to the Commission at its fifty-eighth session; 17. Decides to consider at its fifty-eighth session the question of the use of mercenaries as a means of violating human rights and impeding the exercise of the right of peoples to self-determination under the same agenda item; 18. Recommends the following decision to the Economic and Social Council for 17. 18. adoption: — “The Economic and Social Council, taking note of the Commission on Human Rights resolution 2001/... of ... April 2001, endorses the Commission’s decision, in accordance with General Assembly resolution 55/86 of 4 December 2000, to renew for a period of three years the mandate of the Special Rapporteur on the use of mercenaries as a means of violating human rights and impeding the exercise of the right of peoples to self-determination.”",04/02/2001,2001_436746,Nigeria,"* In accordance with rule 69, paragraph 3, of the rules of procedure of the functional commissions of the Economic and Social Council.",yes
2001,Economic And Social Council,Commission On Human Rights,Fifty-seventh session,10,"ECONOMIC, SOCIAL AND CULTURAL RIGHTS","Algeria, Angola*, Bangladesh*, Belarus*, Belgium, Bhutan*, Botswana*, Burundi, Cameroon, China, Congo*, Costa Rica, Cote d’Ivoire*, Cuba, Democratic People’s Republic of Korea*, Democratic Republic of the Congo, Dominican Republic*, Ecuador, Egypt*, El Salvador¥, Equatorial Guinea*, Eritrea*®, Ethiopia*, Gabon*, Ghana*, Guatemala, Guinea*, Haiti*, Honduras*, India, Indonesia, Iran (Islamic Republic of)*, Iraq*, Kenya, Lao People’s Democratic Republic*, Libyan Arab Jamahiriya, Madagascar, Mauritania*, Mauritius, Mexico, Mongolia*, Nepal*, Niger, Nigeria, Pakistan, Peru, Philippines*, Portugal, Russian Federation, Rwanda*, Senegal, South Africa, Sri Lanka*, Sudan¥*, Swaziland, Syrian Arab Republic, Togo*, Tunisia®, Turkey*, United Republic of Tanzania*, Viet Nam, Yemen*, Zambia",2001,"The right to food The Commission on Human Rights, Recalling the Universal Declaration of Human Rights, which provides that everyone has","the right to a standard of living adequate for her/his health and well-being, including food, Recalling also the provisions of the International Covenant on Economic, Social and Cultural Rights in which the fundamental right of every person to be free from hunger is recognized, Recalling further the Universal Declaration on the Eradication of Hunger and Malnutrition, Bearing in mind the Rome Declaration on World Food Security and the Plan of Action of the World Food Summit, held in Rome from 13 to 17 November 1996, Recalling all its previous resolutions in this regard, in particular resolution 2000/10 of 17 April 2000, Reaffirming that all human rights are universal, indivisible and interdependent and interrelated, Recognizing that the problem of hunger and food insecurity has global dimensions and that they are likely to persist and even to increase dramatically in some regions, unless urgent, determined and concerted action is taken, given the anticipated increase in the world's population and the stress on natural resources, Reaffirming that a peaceful, stable and enabling political, social and economic environment, both at a national and an international level, is the essential foundation which will enable States to give adequate priority to food security and poverty eradication, Reiterating, as did the Rome Declaration, that food should not be used as an instrument of political or economic pressure, and reaffirming in this regard the importance of international cooperation and solidarity, as well as the necessity of refraining from unilateral measures not in accordance with international law and the Charter of the United Nations which endanger food security, Convinced that each State must adopt a strategy consistent with its resources and capacities to achieve its individual goals in implementing the recommendations contained in the Rome Declaration and Plan of Action of the World Food Summit and, at the same time, cooperate regionally and internationally in order to organize collective solutions to global issues of food security in a world of increasingly interlinked institutions, societies and economies, where coordinated efforts and shared responsibilities are essential, Stressing the importance of reversing the continuing decline of official development assistance devoted to agriculture, both in real terms and as a share of total official development assistance, 1. Reaffirms that hunger constitutes an outrage and a violation of human dignity and, therefore, requires the adoption of urgent measures at the national, regional and international levels for its elimination,; 2. Also reaffirms the right of everyone to have access to safe and nutritious food, consistent with the right to adequate food and the fundamental right of everyone to be free from hunger so as to be able fully to develop and maintain their physical and mental capacities; 3. Considers it intolerable that 826 million people, most of them women and children, throughout the world and particularly in developing countries, do not have enough food to meet their basic nutritional needs, which infringes their fundamental human rights and at the same time can generate additional pressures upon the environment in ecologically fragile areas; 4. Stresses the need to make efforts to mobilize and optimize the allocation and utilization of technical and financial resources from all sources, including external debt relief for developing countries, to reinforce national actions to implement sustainable food security policies; 5. Encourages all States to take steps with a view to achieving progressively the full 5. Encourages all States to take steps with a view to achieving progressively the full realization of the right to food, including steps to promote the conditions for everyone to be free from hunger and as soon as possible enjoy fully the right to food, as well as to elaborate and adopt national plans to combat hunger; 6. Takes note of the State of the World’s Children 2001 report of the United Nations Children’s Fund on early childhood and, in this context, recalls that the nurturing of young children merits the highest priority; 7. Takes note with appreciation of the report of the Special Rapporteur on the right to food, submitted in accordance with Commission resolution 2000/10 (E/CN.4/2001/53), and commends the Special Rapporteur for his valuable work in the promotion of the right to food; 8. Requests the Special Rapporteur on the right to food, in the fulfilment of his mandate, to continue to carry out the following main activities: (a) To seek, receive and respond to information on all aspects of the realization of the right to food, including the urgent necessity of eradicating hunger; (b) To establish cooperation with Governments, intergovernmental organizations, in particular the Food and Agriculture Organization of the United Nations, and non-governmental organizations on the promotion and effective implementation of the right to food and to make appropriate recommendations on the realization thereof, taking into consideration the work already done in this field throughout the United Nations system; (c) To identify emerging issues related to the right to food worldwide; 9. Also requests the Special Rapporteur, in discharging his mandate, to pay attention to the issue of drinking water, taking into account the interdependence of this issue and the right to food; 10. 10. | Further requests the Special Rapporteur to contribute effectively to the medium-term review of the implementation of the Rome Declaration on World Food Security and the Plan of Action of the World Food Summit by submitting to the United Nations High Commissioner for Human Rights his recommendations on all aspects of the right to food; 11. Encourages the Special Rapporteur to mainstream a gender perspective in the activities relating to his mandate; 12. Requests the High Commissioner to provide all the necessary human and financial resources for the effective fulfilment of the mandate of the Special Rapporteur; 13. Welcomes the work already done by the Committee on Economic, Social and Cultural Rights in promoting the right to adequate food, in particular its General Comment No. 12 (1999) on the right to adequate food (article 11 of the International Covenant on Economic, Social and Cultural Rights), in which the Committee affirmed, inter alia, that the right to adequate food is indivisibly linked to the inherent dignity of the human person and is indispensable for the fulfilment of other human rights enshrined in the International Bill of Human Rights and is also inseparable from social justice, requiring the adoption of appropriate economic, environmental and social policies, at both the national and international levels, oriented to the eradication of poverty and the fulfilment of all human rights for all; 14. Also welcomes the convening by the High Commissioner in Bonn, from 12 to 14 March 2001, of the Third Expert Consultation on the Right to Food, with a focus on implementation mechanisms at country level, hosted by the Government of Germany, and takes note with interest of the report of this meeting (E/CN.4/2001/148); 15. Recommends that the High Commissioner organize a fourth expert consultation on the right to food, with a focus on the realization of this right as part of strategies and policies for the eradication of poverty, inviting experts from all regions; 11. 12. 13. 15. 16. Requests the Special Rapporteur to submit a preliminary report to the General Assembly at its fifty-sixth session and a final report on the implementation of the present resolution to the Commission at its fifty-eighth session; 17. Invites Governments, relevant United Nations agencies, funds and programmes, treaty bodies and non-governmental organizations, to cooperate fully with the Special Rapporteur in the fulfilment of his mandate, inter alia through the submission of comments and suggestions on ways and means of realizing the right to food. 16. 17.",04/11/2001,2001_437684,Nigeria,"* In accordance with rule 69, paragraph 3, of the rules of procedure of the functional commissions of the Economic and Social Council.",yes
