year,Council,Committee,Session,Agenda item,Agenda detail,cosponsored countries,body title number,body title detail,body text,date,file,filecountry,footnote,scanned
2011,Security Council,N/A,N/A,N/A,United Nations S 2011/24,"Afghanistan, Algeria, Argentina, Austria, Azerbaijan, Bahrain, Bangladesh, Belarus, Belgium, Bolivia (Plurinational State of), Botswana, Brazil, Brunei Darussalam, Chile, Comoros, Costa Rica, Cuba, Cyprus, Democratic People’s Republic of Korea, Djibouti, Ecuador, Egypt, Finland, Gabon, Greece, Grenada, Guatemala, Guinea, Guyana, Iceland, India, Indonesia, Iraq, Ireland, Jordan, Kuwait, Lao People’s Democratic Republic, Lebanon, Lesotho, Liechtenstein, Luxembourg, Malaysia, Mali, Malta, Mauritania, Mauritius, Mexico, Morocco, Namibia, Nicaragua, Nigeria, Norway, Oman, Pakistan, Papua New Guinea, Peru, Philippines, Portugal, Qatar, Saint Vincent and the Grenadines, Saudi Arabia, Senegal, Serbia, Slovenia, Somalia, South Africa, Sudan, Sweden, Switzerland, Tajikistan, Tunisia, Turkey, Turkmenistan, United Arab Emirates, Uruguay, Venezuela (Bolivarian Republic of), Viet Nam, Yemen, and Zimbabwe",N/A,N/A,"The Security Council, Recalling its relevant resolutions, including resolutions 242 (1967), 338 (1973), 446 (1979), 452 (1979), 465 (1980), 476 (1980), 478 (1980), 1397 (2002), 1515 (2003), and 1850 (2008), Reaffirming the applicability of the Geneva Convention relative to the Protection of Civilian Persons in Time of War, of 12 August 1949, to the Palestinian Territory, including East Jerusalem, and the other Arab territories occupied since 1967, Reaffirming that all Israeli settlement activities in the Occupied Palestinian Territory, including East Jerusalem, are illegal and constitute a major obstacle to the achievement of peace on the basis of the two-State solution, Condemning the continuation of settlement activities by Israel, the occupying Power, in the Occupied Palestinian Territory, including East Jerusalem, and of all other measures aimed at altering the demographic composition, character and status of the Territory, in violation of international humanitarian law and relevant resolutions, Bearing in mind also the obligation under the Quartet Roadmap, endorsed by its resolution 1515 (2003), for a freeze by Israel of all settlement activity, including “natural growth”, and the dismantlement of all settlement outposts erected since March 2001, Reiterating its vision of a region where two democratic States, Israel and Palestine, live side by side in peace within secure and recognized borders, 11-23987 Hi 180211 CA AM AA $/2011/24 Taking note of the strong support expressed by the Quartet for the resumption of Israeli-Palestinian negotiations for the resolution of all final status issues within one year, Stressing the urgency of achieving a just, comprehensive and lasting peace on the basis of the relevant resolutions, the Madrid terms of reference, including the principle of land for peace, the Arab Peace Initiative and the Quartet Roadmap, 1. Reaffirms that the Israeli settlements established in the Palestinian Territory occupied since 1967, including East Jerusalem, are illegal and constitute a major obstacle to the achievement of a just, lasting and comprehensive peace; 2. Reiterates its demand that Israel, the occupying Power, immediately and completely ceases all settlement activities in the Occupied Palestinian Territory, including East Jerusalem, and that it fully respect all of its legal obligations in this regard; 3. Calls upon both parties to act on the basis of international law and their previous agreements and obligations, including under the Roadmap, aimed, inter alia, at improving the situation on the ground, building confidence and creating the conditions necessary for promoting the peace process; 4. Calls upon all parties to continue, in the interest of the promotion of peace and security, with their negotiations on the final status issues in the Middle East peace process according to its agreed terms of reference and within the time frame specified by the Quartet in its statement of 21 September 2010; 5. Urges in this regard the intensification of international and regional diplomatic efforts to support and invigorate the peace process towards the achievement of a comprehensive, just and lasting peace in the Middle East; 6. Decides to remain seized of the matter. 11-23987",02/18/2011,2011_698332,Oman,N/A,yes
2011,General Assembly,Commission On Human Rights,Eighteenth session,1,Organizational and procedural matters,"Algeria’, Bahrain’, Botswana, Chad , Djibouti, Egypt, France , Ghana , Italy, Jordan, Kuwait, Lebanon , Libya’, Maldives, Morocco , Nigeria, Norway, Oman’, Palestine , Portugal , Qatar, Saudi Arabia, Senegal, Spain, Sudan’, Thailand, Tunisia , Turkey , United Arab Emirates , United Kingdom of Great Britain and Northern Ireland",N/A,18/... Resumption of rights of membership of Libya in the Human Rights Council,"The Human Rights Council, Recalling paragraph 14 of its resolution S-15/1 of 25 February 2011, Recalling also General Assembly resolution 65/265 of 1 March 2011, in which the Assembly decided to suspend the rights of membership in the Human Rights Council of Libya, 1. Welcomes the commitments made by Libya to uphold its obligations under intemational human rights law, to promote and protect human rights, democracy and the tule of law, and to cooperate with relevant international human rights mechanisms, including the Office of the United Nations High Commissioner for Human Rights and the international commission of inquiry established by the Human Rights Council in its resolution S-15/1; 2. Recommends that the General Assembly lift the suspension of the rights of membership of Libya in the Human Rights Council at its current session. “ Non-Member State of the Human Rights Council. ™ See General Assembly resolution 65/265. GE.11-16481",09/28/2011,2011_712283,Oman,N/A,yes
2011,General Assembly,N/A,Sixty-sixth session,11 (a),Sport for peace and development: building a peaceful and better world through sport and the Olympic ideal,"Afghanistan, Albania, Algeria, Andorra, Angola, Antigua and Barbuda, Armenia, Australia, Austria, Azerbaijan, Bangladesh, Belgium, Belize, Benin, Bosnia and Herzegovina, Brazil, Bulgaria, Burkina Faso, Burundi, Cambodia, Cameroon, Canada, Cape Verde, Chile, China, Colombia, Comoros, Congo, Costa Rica, Cote d’Ivoire, Croatia, Cuba, Cyprus, Czech Republic, Democratic Republic of the Congo, Denmark, Djibouti, Dominican Republic, Ecuador, Egypt, El Salvador, Eritrea, Estonia, Ethiopia, Fiji, Finland, France, Gabon, Gambia, Georgia, Germany, Greece, Guatemala, Guyana, Haiti, Honduras, Hungary, Iceland, India, Indonesia, Ireland, Israel, Italy, Jamaica, Japan, Jordan, Kazakhstan, Kenya, Kuwait, Kyrgyzstan, Lao People’s Democratic Republic, Latvia, Lebanon, Lesotho, Liberia, Libya, Liechtenstein, Lithuania, Luxembourg, Madagascar, Malawi, Malaysia, Maldives, Mali, Malta, Mauritius, Mexico, Micronesia (Federated States of), Monaco, Mongolia, Montenegro, Morocco, Myanmar, Namibia, Nauru, Nepal, Netherlands, New Zealand, Nicaragua, Nigeria, Norway, Oman, Pakistan, Palau, Panama, Papua New Guinea, Paraguay, Peru, Poland, Portugal, Qatar, Republic of Korea, Republic of Moldova, Romania, Russian Federation, Rwanda, Saint Kitts and Nevis, Saint Lucia, Saint Vincent and the Grenadines, San Marino, Senegal, Serbia, Sierra Leone, Singapore, Slovakia, Slovenia, Solomon Islands, Somalia, South Africa, Spain, Sri Lanka, Sudan, Swaziland, Sweden, Switzerland, Tajikistan, Thailand, the Former Yugoslav Republic of Macedonia, Timor-Leste, Togo, Tonga, Trinidad and Tobago, Tunisia, Turkey, Uganda, Ukraine, United Arab Emirates, United Kingdom of Great Britain and Northern Ireland, United Republic of Tanzania, United States of America, Uruguay, Vanuatu, Viet Nam and Zambia",N/A,Building a peaceful and better world through sport and the Olympic ideal,"The General Assembly, Recalling its resolution 64/4 of 19 October 2009, in which it decided to include in the provisional agenda of its sixty-sixth session the sub-item entitled “Building a peaceful and better world through sport and the Olympic ideal”, and 11-53956 HH 121011 CA AM A A recalling also its prior decision to consider the sub-item every two years in advance of each Summer and Winter Olympic Games, Recalling also its resolution 48/11 of 25 October 1993, which, inter alia, revived the ancient Greek tradition of ekecheiria (“Olympic Truce”) calling for a truce during the Olympic Games that would encourage a peaceful environment and ensure the safe passage and participation of athletes and relevant persons at the Games, thereby mobilizing the youth of the world to the cause of peace, Recalling further that the core concept of ekecheiria, historically, was the cessation of hostilities from seven days before until seven days after the Olympic Games, which, according to the legendary oracle of Delphi, was to replace the cycle of conflict with a friendly athletic competition every four years, Reaffirming the value of sport in promoting education, health, development and peace, Recalling the inclusion in the United Nations Millennium Declaration! of an appeal for the observance of the Olympic Truce now and in the future and for support for the International Olympic Committee in its efforts to promote peace and human understanding through sport and the Olympic ideal, Acknowledging the valuable contribution that the appeal launched by the International Olympic Committee for an Olympic Truce could make towards advancing the purposes and principles of the Charter of the United Nations, Noting that the Games of the XXX Olympiad will take place from 27 July to 12 August 2012, and that the XIV Paralympic Games will take place from 29 August to 9 September 2012, in London, Welcoming the granting of observer status to the International Olympic Committee following the adoption of resolution 64/3 of 19 October 2009 and its participation in the sessions and work of the General Assembly, Acknowledging the joint endeavours of the International Olympic Committee, the International Paralympic Committee, the Office of the Special Adviser to the Secretary-General on Sport for Development and Peace, and the United Nations system in such fields as human development, poverty alleviation, humanitarian assistance, health promotion, HIV and AIDS prevention, child and youth education, gender equality, peacebuilding and sustainable development, Noting the successful conclusion of the first Youth Olympic Games, held in Singapore in 2010, and welcoming the first Youth Winter Olympic Games, to be held in Innsbruck, Austria, from 13 to 22 January 2012, and the second Youth Olympic Games, to be held in China from 16 to 28 August 2014, Recalling the articles on leisure, recreation, sport and play in relevant international conventions, including article 30 of the Convention on the Rights of Persons with Disabilities,? recognizing the right of persons with disabilities to take part on an equal basis with others in cultural life, recreation, leisure and sport, noting that the 1948 Olympic Games, held in London, inspired the staging of the first organized sporting event for patients with spinal cord injuries at Stoke 1 See resolution 55/2. 2 Resolution 61/106, annex I. A/66/L.3 Mandeville near London, and heralding the birth of a new global sporting movement for athletes with disabilities, the establishment of the Paralympic Games and plans to stage integrated and inclusive Games for Everyone in 2012, Recalling also that the main themes of the Olympic and Paralympic Games in London are to host genuinely sustainable Games that deliver long-term social, economic, environmental and sporting benefits, helping to promote more stable, inclusive and peaceful communities and urban regeneration, addressing climate change, enhancing international relations and cooperation, and changing attitudes towards disability; and to inspire young people around the world to enrich their lives through sport, for example through the introduction of the London 2012 international legacy programme — International Inspiration, Welcoming the commitment made by various States Members of the United Nations to developing national and international programmes which promote peace and conflict resolution and the Olympic and Paralympic values through sport and through culture, education, sustainable development and wider public engagement, Recognizing the humanitarian opportunities presented by the Truce and by other initiatives to achieve the cessation of conflict supported by the United Nations, such as the International Day of Peace established by resolution 36/67 of 30 November 1981, Noting with satisfaction the flying of the United Nations flag at the Olympic Park, 1. | Urges Member States to observe, within the framework of the Charter of the United Nations, the Olympic Truce, individually and collectively, throughout the period beginning with the start of the Games of the XXX Olympiad and ending with the closing of the XIV Paralympic Games; 2. | Welcomes the work of the International Olympic Committee and the International Paralympic Committee to mobilize international sports organizations and the National Olympic Committees and National Paralympic Committees of Member States to undertake concrete actions at the local, national, regional and international levels to promote and strengthen a culture of peace based on the spirit of the Olympic Truce, and invites those organizations and national committees to share information and best practices, as appropriate; 3. Also welcomes the leadership of Olympic and Paralympic athletes in promoting peace and human understanding through sport and the Olympic ideal; 4. Calls upon all Member States to cooperate with the International Olympic Committee and the International Paralympic Committee in their efforts to use sport as a tool to promote peace, dialogue and reconciliation in areas of conflict during and beyond the Olympic and Paralympic Games period; 5. | Welcomes the cooperation among Member States, the United Nations and the specialized agencies, funds and programmes, and the International Olympic Committee and, where appropriate, the International Paralympic Committee, to work towards a meaningful and sustainable contribution through sport to raising awareness of and to the achievement of the Millennium Development Goals, and encourages the Olympic and Paralympic movements to work closely with national and international sports organizations on the use of sport to contribute to the Millennium Development Goals; A/66/L.3 6. Requests the Secretary-General and the President of the General Assembly to promote the observance of the Olympic Truce among Member States and support for human development initiatives through sport and to cooperate with the International Olympic Committee, the International Paralympic Committee and the sporting community in general in the realization of those objectives; 7. Decides to include in the provisional agenda of its sixty-eighth session the sub-item entitled “Building a peaceful and better world through sport and the Olympic ideal” and to consider the sub-item before the XXII Olympic Winter Games and the XI Paralympic Winter Games to be held in Sochi, Russian Federation, in 2014. 11-53956",10/11/2011,2011_712839,Oman,N/A,yes
2011,General Assembly,N/A,Sixty-sixth session,118,The United Nations Global Counter-Terrorism Strategy,"Algeria, Bahrain, Bangladesh, Burkina Faso, Djibouti, Egypt, Honduras, Jordan, Kuwait, Lebanon, Libya, Mauritania, Morocco, Oman, Qatar, Saudi Arabia, Senegal, Somalia, Sudan, Syrian Arab Republic, Togo, Tunisia, United Arab Emirates, Vanuatu and Yemen",N/A,United Nations Counter-Terrorism Centre,"The General Assembly, Recalling all its resolutions on measures to eliminate international terrorism and Security Council resolutions on threats to international peace and security caused by terrorist acts, Reaffirming its resolutions 60/288 of 8 September 2006, 62/272 of 5 September 2008, and 64/235 of 24 December 2009 concerning the United Nations Global Counter-Terrorism Strategy, Reaffirming the importance of the establishment of a United Nations counter- terrorism centre as an essential part of the United Nations Global Counter-Terrorism Strategy, Noting with appreciation the agreement signed between the United Nations and Saudi Arabia on the establishment of a United Nations counter-terrorism centre, 1. Welcomes the establishment of the United Nations Counter-Terrorism Centre at United Nations Headquarters, in New York; 2. Welcomes the offer of Saudi Arabia to fund the Centre and its activities for the first three years of its operation; 3. Determines that the United Nations Counter-Terrorism Centre will coordinate all aspects of the United Nations Global Counter-Terrorism Strategy; 4. Calls on all Member States to collaborate with the United Nations Counter-Terrorism Centre in the implementation of its activities; 5. Decides to review the implementation of the present resolution at its sixty-ninth session. 11-55980 HI 241011 CA AM A AA",10/21/2011,2011_713880,Oman,N/A,yes
2011,General Assembly,Third Committee,Sixty-sixth session,68,Right of peoples to self-determination,"Albania, Algeria, Armenia, Azerbaijan, Bahrain, Bangladesh, Belarus, Benin, Bolivia (Plurinational State of), Brunei Darussalam, Burkina Faso, Cameroon, Central African Republic, China, Comoros, Congo, Cote d’Ivoire, Ecuador, Egypt, Eritrea, Gabon, Iran (Islamic Republic of), Jordan, Kenya, Kuwait, Lebanon, Liberia, Libya, Malawi, Malaysia, Mali, Namibia, Nicaragua, Niger, Nigeria, Oman, Pakistan, Qatar, Saudi Arabia, Senegal, Sierra Leone, Singapore, Somalia, Sudan, Thailand, Timor-Leste, Togo, United Arab Emirates, Venezuela (Bolivarian Republic of) and Zimbabwe",N/A,Universal realization of the right of peoples to self-determination,"The General Assembly, Reaffirming the importance, for the effective guarantee and observance of human rights, of the universal realization of the right of peoples to self- determination enshrined in the Charter of the United Nations and embodied in the International Covenants on Human Rights,! as well as in the Declaration on the Granting of Independence to Colonial Countries and Peoples contained in General Assembly resolution 1514 (XV) of 14 December 1960, Welcoming the progressive exercise of the right to self-determination by peoples under colonial, foreign or alien occupation and their emergence into sovereign statehood and independence, Deeply concerned at the continuation of acts or threats of foreign military intervention and occupation that are threatening to suppress, or have already suppressed, the right to self-determination of peoples and nations, Expressing grave concern that, as a consequence of the persistence of such actions, millions of people have been and are being uprooted from their homes as refugees and displaced persons, and emphasizing the urgent need for concerted international action to alleviate their condition, 11-56753 nil 281011 CA AM A A A Recalling the relevant resolutions regarding the violation of the right of peoples to self-determination and other human rights as a result of foreign military intervention, aggression and occupation, adopted by the Commission on Human Rights at its sixty-first? and previous sessions, Reaffirming its previous resolutions on the universal realization of the right of peoples to self-determination, including resolution 65/201 of 21 December 2010, Reaffirming also its resolution 55/2 of 8 September 2000, containing the United Nations Millennium Declaration, and recalling its resolution 60/1 of 16 September 2005, containing the 2005 World Summit Outcome, which, inter alia, upheld the right to self-determination of peoples under colonial domination and foreign occupation, Taking note of the report of the Secretary-General on the right of peoples to self-determination, 3 1. Reaffirms that the universal realization of the right of all peoples, including those under colonial, foreign and alien domination, to self-determination is a fundamental condition for the effective guarantee and observance of human rights and for the preservation and promotion of such rights; 2. Declares its firm opposition to acts of foreign military intervention, aggression and occupation, since these have resulted in the suppression of the right of peoples to self-determination and other human rights in certain parts of the world; 3. Calls upon those States responsible to cease immediately their military intervention in and occupation of foreign countries and territories and all acts of repression, discrimination, exploitation and maltreatment, in particular the brutal and inhuman methods reportedly employed for the execution of those acts against the peoples concerned; 4. Deplores the plight of millions of refugees and displaced persons who have been uprooted as a result of the aforementioned acts, and reaffirms their right to return to their homes voluntarily in safety and with honour; 5. | Requests the Human Rights Council to continue to give special attention to violations of human rights, especially the right to self-determination, resulting from foreign military intervention, aggression or occupation; 6. | Requests the Secretary-General to report on the question to the General Assembly at its sixty-seventh session under the item entitled “Right of peoples to self-determination”. 2 See Official Records of the Economic and Social Council, 2005, Supplement No. 3 and corrigenda (E/2005/23 and Corr.1 and 2), chap. II, sect. A. 3 A/66/172.",10/27/2011,2011_714413,Oman,N/A,yes
