year,Council,Committee,Session,Agenda item,Agenda detail,cosponsored countries,body title number,body title detail,body text,date,file,filecountry,footnote,scanned
2009,General Assembly,N/A,Sixty-third session,65 (b),Strengthening of the coordination of humanitarian,"Afghanistan, Algeria, Armenia, Azerbaijan, Bangladesh, Belarus, Belgium, Bolivia (Plurinational State of), Bosnia and Herzegovina, Brazil, Bulgaria, Canada, Cape Verde, Chile, Cuba, Czech Republic, Denmark, Ecuador, Egypt, Estonia, Finland, Georgia, Germany, Greece, Guinea-Bissau, Iraq, Italy, Japan, Jordan, Kazakhstan, Kenya, Kyrgyzstan, Lao People’s Democratic Republic, Lithuania, Luxembourg, Malaysia, Maldives, Mexico, Mongolia, Morocco, Nicaragua, Norway, Oman, Pakistan, Papua New Guinea, Paraguay, Philippines, Poland, Portugal, Republic of Moldova, Romania, Russian Federation, Saint Kitts and Nevis, Singapore, Slovenia, Sudan, Switzerland, Tajikistan, the former Yugoslav Republic of Macedonia, Timor-Leste, Turkey, Turkmenistan, Ukraine, United Arab Emirates, United States of America, Uzbekistan, Viet Nam and Zambia",N/A,International cooperation and coordination for the human and ecological rehabilitation and economic development of the Semipalatinsk region of Kazakhstan,"The General Assembly, Recalling its resolutions 52/169 M of 16 December 1997, 53/1 H of 16 November 1998, 55/44 of 27 November 2000, 57/101 of 25 November 2002 and 60/216 of 22 December 2005, Taking note of the report of the Secretary-General,! and the information contained therein on measures undertaken to address health, environmental, economic and humanitarian development problems and satisfaction of needs of the Semipalatinsk region, 09-29414* tr 230409 CAT RCY Recognizing that the Semipalatinsk nuclear testing ground, inherited by Kazakhstan and closed in 1991, remains a matter of serious concern for the people and Government of Kazakhstan with regard to the long-term nature of its consequences for the lives and health of the people, especially children and other vulnerable groups, as well as for the environment of the region, Taking into consideration the results of the international conference on the problems of the Semipalatinsk region, held in Tokyo in 1999, which have promoted the effectiveness of the assistance provided to the population of the region, Recognizing the important role of national development policies and strategies in the rehabilitation of the Semipalatinsk region, and taking note with satisfaction of the successful accomplishment of the Kazakhstan national programme entitled “Complex solution of the former Semipalatinsk nuclear test site problems for 2005- 2007” and the elaboration of the new cycle of the programme for 2009-2011, Recognizing also the challenges Kazakhstan faces in the rehabilitation of the Semipalatinsk region, in particular in the context of the efforts by the Government of Kazakhstan to ensure an effective and timely achievement of the internationally agreed development goals, including the Millennium Development Goals, in particular on health care and environmental sustainability, Recognizing further that the Government of Kazakhstan may call upon the United Nations Resident Coordinator in Kazakhstan to render assistance in conducting consultations regarding establishing a multi-stakeholders’ mechanism, with the participation of various government bodies, local governments, civil society, the donor community and international organizations, to improve governance and enable the more efficient use of resources allocated to the rehabilitation of the Semipalatinsk region, in particular regarding the areas of radiation safety, socio-economic development, health, environmental protection, and the provision of information and risk communication to the population, Expressing profound concern regarding the negative effects of nuclear testing on the sustainability of the ecosystem in the region and the accumulation of radioactive substances in the soil, resulting in a wide scope and a complexity of nuclear testing consequences that create humanitarian, environmental, social, economic and health problems, Taking note of the need for utilization of modern technologies in minimizing and mitigating radiological, health, socio-economic, psychological and environmental challenges in the Semipalatinsk region, Taking into account the fact that a number of international programmes in the Semipalatinsk region have been completed since the closure of the nuclear testing grounds, whereas serious social, economic and ecological problems continue to exist, Expressing deep concern that the current efforts are not sufficient to alleviate consequences of nuclear testing, and regarding the fact that only 5 of the 38 projects identified by the international conference in Tokyo held in 1999 were implemented, Emphasizing the importance of support by donor States and international development organizations for the efforts by Kazakhstan to improve the social, economic and environmental situation in the Semipalatinsk region, and, in this A/63/L.67 regard, stressing the need for the international community to continue to pay due attention to the rehabilitation of the Semipalatinsk region, Emphasizing also the importance of the new development-oriented approach in tackling problems in the Semipalatinsk region in the medium and long term, Stressing the importance of the commemoration, in 2011, of the upcoming twentieth anniversary of the closure of the Semipalatinsk nuclear test site, Expressing appreciation to donor countries especially to the Government of Japan, United Nations agencies, in particular the United Nations Development Programme, the United Nations Children’s Fund, the United Nations Population Fund and the International Atomic Energy Agency, and the Organization for Security and Cooperation in Europe, the World Bank, and the Global Environment Facility for their contribution to the rehabilitation of the Semipalatinsk region, 1. Welcomes and recognizes the important role of the Government of Kazakhstan in providing domestic resources to help meet the needs of the Semipalatinsk region, including for the implementation of the Kazakhstan national multi-year programme entitled “Complex solution of the former Semipalatinsk nuclear test site problems for 2005-2007”; 2. Calls upon the international community, including all Member States, in particular donor States, and United Nations institutions to continue to support Kazakhstan in addressing the challenges of the rehabilitation of the Semipalatinsk region and its population, taking additional actions, including by facilitating the implementation of the Kazakhstan national programme on addressing the problems of the former Semipalatinsk nuclear testing ground in a comprehensive manner, and stresses the importance of the regional cooperation in this regard; 3. | Urges the international community to provide assistance to Kazakhstan in the formulation and implementation of special programmes and projects of treatment and care for the affected population as well as in the efforts to ensure economic growth and sustainable development in the Semipalatinsk region; 4. Calls upon Member States, relevant multilateral financial organizations and other entities of the international community, including academia and non-governmental organizations, to share their knowledge and experience in order to contribute to the human and ecological rehabilitation and economic development of the Semipalatinsk region; 5. Welcomes initiatives commemorating the closure of the former Semipalatinsk test site and the twentieth anniversary of the international anti-nuclear movement “Nevada-Semei”, and the international conference of the International Atomic Energy Agency on remediation of land contaminated by radioactive material residues, to be held in 2009 in Kazakhstan, and invites the international community to participate in these events; 6. Invites Member States to observe, in 2011, the twentieth anniversary of the closure of the Semipalatinsk nuclear test site through conducting relevant events and functions to deliver to the international community information on the deteriorating consequences of nuclear testing on human health and environment; 7. Requests the Secretary-General to continue his efforts in implementing relevant resolutions of the General Assembly and to encourage the donor A/63/L.67 community and international and regional organizations to fulfil their commitments declared at the Tokyo international conference; 8. Also requests the Secretary-General to pursue a consultative process, with the participation of interested States and relevant United Nations agencies, on modalities for mobilizing and coordinating the necessary support to seek appropriate solutions to the problems and needs of the Semipalatinsk region, including those prioritized in the report of the Secretary-General; 9. Calls upon the Secretary-General to continue his efforts to enhance world public awareness of the problems and needs of the Semipalatinsk region; 10. Requests the Secretary-General to report to the General Assembly at its sixty-sixth session, under the agenda item entitled “Sustainable development”, on progress made in the implementation of the present resolution. 09-29414",04/23/2009,2009_651498,Oman,"* Reissued for technical reasons. ** Tn order for the General Assembly to take action on the present proposal, it will be necessary to reopen consideration of agenda item 65 (b). 1 A/63/659.",yes
2009,General Assembly,First Committee,Sixty-fourth session,99,The risk of nuclear proliferation in the Middle East,"Algeria, Bahrain, Comoros, Djibouti, Egypt, Iraq, Jordan, Kuwait, Lebanon, Libyan Arab Jamahiriya, Mauritania, Morocco, Oman, Qatar, Saudi Arabia, Sudan, Syrian Arab Republic, Tunisia, United Arab Emirates, Yemen and Palestine",N/A,The risk of nuclear proliferation in the Middle East,"The General Assembly, Bearing in mind its relevant resolutions, Taking note of the relevant resolutions adopted by the General Conference of the International Atomic Energy Agency, the latest of which are resolutions GC(53)/RES/16, adopted on 17 September 2009 and GC(53)/RES/17, adopted on 18 September 2009, 1 Cognizant that the proliferation of nuclear weapons in the region of the Middle East would pose a serious threat to international peace and security, Mindful of the immediate need for placing all nuclear facilities in the region of the Middle East under full-scope safeguards of the Agency, Recalling the decision on _ principles and _ objectives for nuclear non-proliferation and disarmament adopted by the 1995 Review and Extension Conference of the Parties to the Treaty on the Non-Proliferation of Nuclear Weapons on 11 May 1995,? in which the Conference urged universal adherence to the Treaty? as an urgent priority and called upon all States not yet parties to the Treaty to accede to it at the earliest date, particularly those States that operate unsafeguarded nuclear facilities, 1 See International Atomic Energy Agency, Resolutions and Other Decisions of the General Conference, Fifty-third Regular Session, 14-18 September 2009 (GC(53)/RES/DEC(2009)). 2 See 1995 Review and Extension Conference of the Parties to the Treaty on the Non-Proliferation of Nuclear Weapons, Final Document, Part I (NPT/CONF.1995/32 (Part I) and Corr.2), annex. 081009 09-54694 ui NECA A A Recognizing with satisfaction that, in the Final Document of the 2000 Review Conference of the Parties to the Treaty on the Non-Proliferation of Nuclear Weapons, the Conference undertook to make determined efforts towards the achievement of the goal of universality of the Treaty, called upon those remaining States not parties to the Treaty to accede to it, thereby accepting an international legally binding commitment not to acquire nuclear weapons or nuclear explosive devices and to accept Agency safeguards on all their nuclear activities, and underlined the necessity of universal adherence to the Treaty and of strict compliance by all parties with their obligations under the Treaty, 4 Recalling the resolution on the Middle East adopted by the 1995 Review and Extension Conference on 11 May 1995,° in which the Conference noted with concern the continued existence in the Middle East of unsafeguarded nuclear facilities, reaffirmed the importance of the early realization of universal adherence to the Treaty and called upon all States in the Middle East that had not yet done so, without exception, to accede to the Treaty as soon as possible and to place all their nuclear facilities under full-scope Agency safeguards, Noting that Israel remains the only State in the Middle East that has not yet become party to the Treaty, Concerned about the threats posed by the proliferation of nuclear weapons to the security and stability of the Middle East region, Stressing the importance of taking confidence-building measures, in particular the establishment of a nuclear-weapon-free zone in the Middle East, in order to enhance peace and security in the region and to consolidate the global non-proliferation regime, Emphasizing the need for all parties directly concerned to seriously consider taking the practical and urgent steps required for the implementation of the proposal to establish a nuclear-weapon-free zone in the region of the Middle East in accordance with the relevant resolutions of the General Assembly and, as a means of promoting this objective, inviting the countries concerned to adhere to the Treaty and, pending the establishment of the zone, to agree to place all their nuclear activities under Agency safeguards, Noting that one hundred and eighty-one States have signed the Comprehensive Nuclear-Test-Ban Treaty,° including a number of States in the region, 1. | Welcomes the conclusions on the Middle East of the 2000 Review Conference of the Parties to the Treaty on the Non-Proliferation of Nuclear Weapons; ® 2. Reaffirms the importance of Israel’s accession to the Treaty on the Non-Proliferation of Nuclear Weapons” and placement of all its nuclear facilities 4 See 2000 Review Conference of the Parties to the Treaty on the Non-Proliferation of Nuclear Weapons, Final Document, vol. I (NPT/CONF.2000/28 (Parts I and ID)), part I, section entitled “Article IX”. 6 See 2000 Review Conference of the Parties to the Treaty on the Non-Proliferation of Nuclear Weapons, Final Document, vol. I (NPT/CONF.2000/28 (Parts I and ID)), part I, section entitled “Article VII and the security of non-nuclear-weapon States”, para. 16. A/C.1/64/L.4 under comprehensive International Atomic Energy Agency safeguards, in realizing the goal of universal adherence to the Treaty in the Middle East; 3. Calls upon that State to accede to the Treaty without further delay and not to develop, produce, test or otherwise acquire nuclear weapons, and to renounce possession of nuclear weapons, and to place all its unsafeguarded nuclear facilities under full-scope Agency safeguards as an important confidence-building measure among all States of the region and as a step towards enhancing peace and security; 4. Requests the Secretary-General to report to the General Assembly at its sixty-fifth session on the implementation of the present resolution; 5. Decides to include in the provisional agenda of its sixty-fifth session the item entitled “The risk of nuclear proliferation in the Middle East”. 09-54694",10/07/2009,2009_667274,Oman,N/A,yes
2009,General Assembly,N/A,Sixty-fourth session,45,Sport for peace and development: building a peaceful and better world through sport and the Olympic ideal,"Afghanistan, Andorra, Argentina, Armenia, Australia, Austria, Azerbaijan, Bahrain, Bangladesh, Belarus, Belgium, Benin, Bhutan, Bolivia (Plurinational State of), Bosnia and Herzegovina, Brazil, Brunei Darussalam, Bulgaria, Canada, Chile, China, Croatia, Cyprus, Czech Republic, Ecuador, Egypt, El Salvador, Estonia, Ethiopia, Fiji, France, Georgia, Germany, Greece, Guatemala, Guyana, Haiti, Hungary, Iceland, India, Ireland, Israel, Italy, Jamaica, Japan, Jordan, Kuwait, Lesotho, Lao People’s Democratic Republic, Liechtenstein, Lithuania, Luxembourg, Maldives, Malta, Monaco, Mongolia, Mozambique, Netherlands, New Zealand, Oman, Pakistan, Panama, Paraguay, Peru, Poland, Portugal, Republic of Korea, Romania, Russian Federation, Saint Lucia, Saint Vincent and the Grenadines, Samoa, San Marino, Serbia, Singapore, Slovakia, Slovenia, Solomon Islands, South Africa, Spain, Sri Lanka, Sweden, Switzerland, Thailand, the former Yugoslav Republic of Macedonia, Togo, Tonga, Trinidad and Tobago, Turkey, Turkmenistan, Ukraine, United Kingdom of Great Britain and Northern Ireland and United States of America",N/A,Building a peaceful and better world through sport and the Olympic ideal,"The General Assembly, Recalling its resolution 62/4 of 31 October 2007, in which it decided to include in the provisional agenda of its sixty-fourth session the sub-item entitled “Building a peaceful and better world through sport and the Olympic ideal”, and recalling also its prior decision to consider the item every two years in advance of each Summer and Winter Olympic Games, Recalling also its resolution 48/11 of 25 October 1993, which, inter alia, revived the ancient Greek tradition of ekecheiria (“Olympic Truce”) calling for a truce during the Olympic Games that would encourage a peaceful environment and ensure the safe passage and participation of athletes and relevant persons at the Games, thereby mobilizing the youth of the world to the cause of peace, 09-55686 HI 141009 ARCA TA A Taking into account the inclusion in the United Nations Millennium Declaration! of an appeal for the observances of the Olympic Truce now and in the future and support for the International Olympic Committee in its efforts to promote peace and human understanding through sport and the Olympic ideal, Recognizing the valuable contribution that the appeal launched by the International Olympic Committee for an Olympic Truce could make towards advancing the purposes and principles of the Charter of the United Nations, Recognizing also the increasingly important role of sport in achieving internationally agreed development goals, including those contained in the Millennium Declaration, and reaffirming the commitments undertaken in this regard by the Heads of State and Government gathered at the World Summit of the General Assembly, held in New York in 2005, Recalling its resolution 63/135 of 11 December 2008, in which it recognized the value of sport as a means to promote education, health, development and peace and welcomed the establishment of a United Nations Office of Sport for Development and Peace, Recognizing that the goal of the Olympic movement is to build a peaceful and better world by educating the youth of the world through sport, practiced without discrimination of any kind and in the Olympic spirit, which is based on mutual understanding, friendship, solidarity and fair play, Welcoming the joint endeavours of the International Olympic Committee, the International Paralympic Committee and the United Nations system in such fields as human development, poverty alleviation, humanitarian assistance, health promotion, HIV and AIDS prevention, youth education, gender equality, peacebuilding and sustainable development, Recalling the relevant articles on leisure, recreation, sport and play of international conventions, including article 30 of the Convention on the Rights of Persons with Disabilities recognizing the right of persons with disabilities to take part on an equal basis with others in cultural life, recreation, leisure and sport, Noting that the XXI Winter Olympic Games will take place from 12 to 28 February 2010, and that the X Paralympic Winter Games will take place from 12 to 21 March 2010 in Vancouver, Canada, with the aim of upholding sport as an inspirational means to promote peace, inclusivity, indigenous participation, social and environmental responsibility and meaningful legacies for future generations, Also noting that the inaugural Youth Olympic Games will take place from 14 to 26 August 2010, in Singapore, with the aim of inspiring the youth of the world through an integrated, sport, culture and education experience to embrace, embody and express the Olympic values, Noting with satisfaction the flying of the United Nations flag at the competition sites of the Olympic Games and the Paralympic Games, 1. | Urges Member States to observe, within the framework of the Charter of the United Nations, the Olympic Truce, individually and collectively, during the XXI Winter Olympic Games and the X Paralympic Winter Games; A/64/L.2 2. Welcomes the decisions of the International Olympic Committee and the International Paralympic Committee to mobilize international sports organizations and the National Olympic Committees and National Paralympic Committees of Member States to undertake concrete actions at the local, national, regional and world levels to promote and strengthen a culture of peace based on the spirit of the Olympic truce, and invites those organizations and national committees to share information and best practices, as appropriate; 3. Calls upon all Member States to cooperate with the International Olympic Committee and the International Paralympic Committee in their efforts to use sport as a tool to promote peace, dialogue and reconciliation in areas of conflict during and beyond the Olympic Games period; 4. Requests the Secretary-General to promote the observance of the Olympic Truce among Member States and support for human development initiatives through sport and to cooperate with the International Olympic Committee, the International Paralympic Committee and the sporting community in general in the realization of those objectives; 5. Decides to include in the provisional agenda of its sixty-sixth session the sub-item entitled “Building a peaceful and better world through sport and the Olympic ideal” and to consider the sub-item before the Games of the XXX Olympiad and the XIV Paralympic Games to be held in London in 2012. 09-55686",10/15/2009,2009_667703,Oman,N/A,yes
