year,Council,Committee,Session,Agenda item,Agenda detail,cosponsored countries,body title number,body title detail,body text,date,file,filecountry,footnote,scanned
1999,Economic And Social Council,Commission On Human Rights,Fifty-fifth session,19,ADVISORY SERVICES AND TIECHNICAL COOPIERATION IN THEFIELD OF HUMAN RIGHTS,"Argentina, Canada, Chile, Colombia, Costa Rica*, Cuba, Denmark*, Ecuador, E1 Salvador, France, Germany, Guatemala, Haiti*, Honduras*, Japan, Mexico, Paraquay*, Peru, Uruguay",1999,Situation of human rights in Haiti,"The Commission on Human Rights, Guided by the principles embodied in the Charter of the United Nations, the Universal Declaration of Human Rights and the International Covenants on Human Rights and other international human rights instruments, including the Convention on the Elimination of All Forms of Discrimination against Women, Reaffirming that all Member States have the obligation to promote human rights and to fulfil the obligations they have undertaken under the various international instruments in this field, Recalling its resolution 1998/58 of 17 April 1998 and General Assembly resolution 53/159 of 9 December 1998, Having in mind the note by the Secretary-General on the situation of democracy and human rights in Haiti of 18 November 1998 (A/53/564), and the report of the Secretary-General on the technical cooperation programme in Haiti of 21 October 1998 (A/53/530), E.99-12884 (1 Recognizing the important contributions of the International Civilian Mission to Haiti whose ma Uni Jus ndate has been extended until 31 December 1999, the ted Nations Support Mission in Haiti, the National Commission for Truth and tice, the United Natio whose mandate has been ex res toring and strengtheni ns Transition Mission in Haiti, terminated on United Nations Civilian Police Mission in Haiti, tended until 30 November 1999, to the task of ng democracy in Haiti and of establishing a climate of freedom and tolerance conducive to respect for human rights in that country, Recognizing also the 1 between democracy, developme nterdependence and the mutual reinforcement nt and respect for human rights and fundamental freedoms and the commitment of the international community to supporting, strengthening and promoting this principle, Expressing its concern by the absence of an agreeme and over the lack of fully i over the lack of a functioning legislature caused nt regarding the status of most parliamentarians, ndependent local governments after Taking note with interest of the establishment, following consultations among the political leadership in Haiti of a new Government, having as its princi pal expressed goal the holding of early, free and fair elections, Welcoming the Government's stated determination that it and its servants will remain politically neut Welcoming also the nam Welcoming further the situation in Haiti since the the de of tha societ of tha clarations by the Hait t country remains comm Indicating its concern ral throughout the electoral process, ing of a new provisional electoral council, improvements effected in the human rights restoration of its democratic regime and noting ian authorities to the effect that the Government itted to upholding human rights, at the security problems faced by Haitian y, some of which are due to the difficult social and economic conditions t society, and which both account for and result from the limitations of the judicial and police systems, as indicated in the reports of the indep ndent expert, Reiterating its satisfaction at the invitation to visit the country addressed by the Government of Haiti to the Special Rapporteur on violence agains t women, 1. Thanks the Secretary-General, his Special Representative for Haiti and the independent expert of the Commission on Human Rights on the situation of human rights in Haiti for their unremitting efforts on behalf of the consolidation of democratic institutions in Haiti and respect for human rights in that country; 2. Notes with gratitude the report on the situation of human rights in Haiti submitted to the General Assembly by the independent expert of the Commission on Human Rights, Mr. Adama Dieng (A/53/355), and the recommendations contained therein and welcomes in particular, his analysis of and attention to the issues affecting the enjoyment by women in Haiti of their human rights, in particular violence against women; 3. Invites the Government of Haiti to ratify the International Covenant on Economic, Social and Cultural Rights, the Convention against Torture and Other Cruel, Inhuman or Degrading Treatment or Punishment, and the Optional Protocols to the International Covenant on Civil and Political Rights; 4. Reaffirms the importance, for the realization of a genuine and ffective process of transition and national reconciliation, of the investigations undertaken by the National Commission for Truth and Justice, and once again urges the Government of Haiti to institute legal proceedings against the perpetrators of human rights violations identified by the Commission for Truth and Justice and to creat ffective facilities for support to the victims, particularly women, children and members of their families; 5. Strongly supports the intention that the people of Haiti be able 5. Strongly supports the intention that the people of Haiti be able to express their political will through free and fair elections, in conditions of security, as soon as possible, and in this connection invites the Government of Haiti to pursue its consultations with political parties and civil society, in a spirit of political pluralism, with a view to democratically filling the institutional void which has existed since 11 January 1999; 6. Expresses its concern at the lack of substantive progress on reform of the judicial system and urges the new Government to proceed with the programme of action worked out at the Law and Justice Reform Seminar of rights and encouraging broad participation in the elections; 7. prisons, inter alia medical care; 8. the Government of Haiti, Calls upon international community and women's groups, address violence against women, includi programmes for judicial and legal personnel, human rights of women in all levels of 9. Calls upon the Government of Haiti in the police and justice sectors, to investiga properly and prosecute perpe Urges the Government of Haiti to improve the overall in collaboration wi ng the development of traini conditions th the to put in place measures to ng and the incorporation of the the education system; to continue structural reforms te politically motivated crimes trators of such crimes in accordance with Haitian ny continuing human rights National Police for its professional and law, and to take vigorous action to eliminate a violations, including illegal arrests and detentions; 10. Commends the Haitian apolitical behaviour during the political crisis, a of such behaviour during the electoral process; 11. Draws attention to the need for the Hai continue receiving technical training to enable it efficiently, within a framework of respect for huma 12. Commends the United Nations Civilian Po nd encourages continuation tian National Police to to perform its functions n rights; ice Mission in Haiti for its successful mentoring of the Haitian National Po importance of developing a suitabl lice and underscores the n the mandate of the replacement wh Mission expires 30 November 1999; 13. Welcomes th report of the Secretary-Ge implementation of the programme of technical cooperation in Haiti, Office of the United Nations High Commissioner for for the purpose of strengthening institutional especially in the areas of legislative reform, trai administration personnel and human rights education Secretary-General to submit a further report on the programme to 14. Commends the efforts of the United Na Unity International Civilian Mission in Hai neral (A/53/530) on the which the Human Rights is conducting capacity in that field and ning of justice , and requests the implementation of the the Commission at its fifty-sixth session; tions/Organization of African ti in monitoring human rights and promoting democratic reform and assisting the Hai of institution-building, as well as the United Na for technical assistance to the Haitian National tian authorities in the field tions Development Programme Police; 15. Invites the United Nations High Commissioner for Human Rights to contribute to the strengthening of the Office of Protection of the Citizen, through a programme of technical cooperation; 16. Invites the international community, including the Bretton Woods institutions, to continue their involvement in the reconstruction and development of Haiti, having regard to the continuing fragility of the country's political, economic and social situation; 17. Reiterates once again its invitation to the Special Rapporteur on violence against women to consider favourably the invitation by the Government of Haiti to visit the country; 18. Invites the independent expert to report to the General Assembly at its fifty-fourth session and to the Commission on Human Rights at its fifty-sixth session on developments in the human rights situation in Haiti; 19. Decides to continue its consideration of this question at its fifty-sixth session under the agenda item entitled “Advisory services in the field of human rights”.",04/22/1999,1999_1487910,Peru,"* In accordance with rule 69, paragraph 3, of the rules of procedure of the functional commissions of the Economic and Social Council. 30 November 1997, and the 11 January 1999, 6 July 1998, as a means of strengthening the promotion and protection of human",yes
1999,Convention On The Rights Of The Child,N/A,N/A,N/A,UNITED NATIONS CRC,"Afghanistan, Albania, Andorra, Antigua and Barbuda, Argentina, Azerbaijan, Bahamas, Bangladesh, Barbados, Belarus, Belize, Benin, Bhutan, Bosnia and Herzegovina, Bulgaria, Burundi, Cambodia, Cameroon, Cape Verde, China, Colombia, Costa Rica, Croatia, Democratic Republic of the Congo, Dijibouti, Dominica, Ecuador, El Salvador, Estonia, Fiji, Gabon, Gambia, Georgia, Ghana, Greece, Grenada, Guatemala, Haiti, Honduras, Iceland, India, Indonesia, Iran (Islamic Republic of), Italy, Japan, Jordan, Kazakhstan, Kenvya, Kyrgyzstan, Latvia, Lebanon, Lesotho, Liberia, Lithuania, Madagascar, Malaysia, Mali, Malta, Marshall Islands, Mauritania, Micronesia (Federated States of), Monaco, Mongolia, Mozambique, Myanmar, Nicaragua, Nigeria, Pakistan, Palau, Papua New Guinea, Paraquay, Peru, Philippines, Portugal, Qatar, Romania, Saint Kitts and Nevis, Saint Lucia, Saint Vincent and the Grenadines, San Marino, Sao Tome and Principe, Singapore, Solomon Islands, Spain, Sri Lanka, Sudan, Suriname, Switzerland, Tajikistan, the former Yugoslav Republic of Macedonia, Togo, Turkey, Turkmenistan, Ukraine, United Republic of Tanzania, Uzbekistan, Vanuatu, Viet Nam and Zimbabwe",N/A,NOTIFICATION OF CANDIDATURI RIGHTS OF THE CHILD (A,"THI — R i} ES TO TH RTICLE OF THE R CONV ﬂNTIOV) (J\) [eal PH 4 The Seventh Meeting of the States Parties to the Convention on the Rights of the Child, Recalling that, with regard to the election of members of the Committee on the Rights of the Child, article 43, paragraph 4 of the Convention states that ""... At least four months before the date of each election, the Secretary- General of the United Nations shall address a letter to States Parties inviting them to submit their nominations within two months. The Secretary-General shall subsequently prepare a list in alphabetical order of all persons thus nominated, (1 1 indicating States Parties which have nominated them, and shall submit it to the States Parties to the present Convention"", Recognizing the importance of ensuring that the said procedure be scrupulously followed, 1. Expresses appreciation to the Secretary-General for punctually addressing to the Missions of States Parties accredited in New York, where the election is held, the letter inviting States Parties to submit their nominations; 2. Recommends that, on the occasion of future elections of members of the Committee, nominations of candidates submitted by States Parties to the Convention be accepted by the Secretary-General of the United Nations only within the deadlin xpressly established by the Convention; 3. Further recommends that the list of all candidates resulting from nominations duly accepted by the Secretary-General, and subsequent withdrawals, be addressed by the Secretary-General, in the same way as the invitation to present candidatures, to the Missions of States Parties accredited in New York, promptly after the established deadline or the withdrawal.",02/11/1998,1999_1488406,Peru,N/A,yes
1999,Economic And Social Council,Commission On Human Rights,Fifty-fifth session,10,"ECONOMIC, SOCIAL AND CULTURAL RIGHTS","Algeria*, Angola, Bangladesh, Belarus*, Bhutan, Burundi*, Cape Verde, China, Congo, Cuba, Democratic Republic of the Congo, Democratic People's Republic of Korea*, Ecuador, Egypt*, El1 Salvador, Ethiopia*, Guatemala, Haiti*, India, Irag*, Kenya*, Madagascar, Mauritania*, Mozambique, Nigeria*, Pakistan, Peru, Philippines, Rwanda, Senegal, South Africa, Sri Lanka, Sudan, Syrian Arab Republic*, Venezuela, Viet Nam* and Yemen*",1999,The right to food,"The Commission on Human Rights, Recalling the Universal Declaration of Human Rights, which provides that everyone has the right to a standard of living adequate for his health and well-being, including food, Recalling also the provisions of the International Covenant on Economic, Social and Cultural Rights in which the fundamental right of every person to be free from hunger is recognized, E.99-12220 (1 Recalling further the Universal Declaration on the Eradication of Hunger and Malnutrition, Bearing in mind the Rome Declaration on World Food Security and the Plan of Action of the World Food Summit, held in Rome from 13 to 17 November 1996, Recalling all its previous resolutions in this regard, in particular resolution 1998/23 of 17 April 1998, Recognizing that the problem of hunger and food insecurity have global dimensions and that they are likely to persist and even to increase dramatically in some regions, unless urgent, determined and concerted action is taken, given the anticipated increase in the world's population and the stress on natural resources, Reaffirming that a peaceful, stable and enabling political, social and economic environment, both at a national and an international level, is the essential foundation which will enable States to give adequate priority to food security and poverty eradication, Reiterating, as did the Rome Declaration, that food should not be used as an instrument of political or economic pressure, and reaffirming in this regard the importance of international cooperation and solidarity, as well as the necessity of refraining from unilateral measures not in accordance with international law and the Charter of the United Nations, which endanger food security, Convinced that each State must adopt a strategy consistent with its resources and capacities to achieve its individual goals in implementing the recommendations contained in the Rome Declaration and Plan of Action and, at the same time, cooperate regionally and internationally in order to organize collective solutions to global issues of food security in a world of increasingly interlinked institutions, societies and economies, where coordinated efforts and shared responsibilities are essential, Noting the view expressed by the Committee on Economic, Social and Cultural Rights in its Statement on Globalization and Economic, Social and Cultural Rights adopted on 11 May 1998, in which the Committee argued that while much energy and many resources had been expended by Governments in promoting the trends and policies that were associated with globalization, insufficient efforts were being made to devise new or complementary approaches which could enhance the compatibility of those trends and policies with full respect for economic, social and cultural rights, 1. Reaffirms that hunger constitutes an outrage and a violation of human dignity and, therefore, requires the adoption of urgent measures at the national, regional and international level for its elimination; 2. Also reaffirms the right of everyone to have access to safe and nutritious food, consistent with the right to adequate food and the fundamental right of everyone to be fr from hunger so as to be able fully to develop and maintain their physical and mental capacities; 3. Considers intolerable that more than 800 million people, especially women and children, throughout the world, and particularly in developing countries, do not have enough food to meet their basic nutritional needs, which infringes their fundamental human rights and at the same time can generate additional pressures upon the environment in ecologically weak areas; 4. Stresses the need to make efforts to mobilize and optimize the allocation and utilization of technical and financial resources from all sources, including external debt relief for developing countries, to reinforce national actions to implement sustainable food security policies; 5. Welcomes the convening of a follow-up consultation on the right to adequate food by the Office of the High Commissioner for Human Rights at the headquarters of the Food and Agriculture Organization of the United Nations on 18 and 19 November 1998 as requested by the Commission in resolution 1998/23, as a concrete and practical response to objective 7.4 of the Rome Declaration and Plan of Action, in order better to define the rights relating to food in article 11 of the International Covenant on Economic, Social and Cultural Rights and to propose ways to implement and realize those rights as a means of achieving the commitments of the World Food Summit; 6. Takes note with interest of the reference in the report of the High Commissioner for Human Rights (E/CN.4/1999/45) to proposals, based on the International Covenant on Economic, Social and Cultural Rights and other relevant international human rights standards, for the definition of the content and means of implementation of the right to food; 7. Invites once again the Committee on Economic, Social and Cultural Rights to and adopt a general comment on the right to food as a contribution to the clarification of the content of the rights related to food in article 11 of the International Covenant on Economic, Social and Cultural Rights; 8. Reguests the High Commissioner for Human Rights to transmit the present resolution to Governments, relevant specialized agencies and programmes, treaty bodies, as well as non-governmental organizations, and invites them to present comments and suggestions for the elaboration of the content and means of implementation of the right to food, taking into account the outcome of the follow-up consultation on the right to adequate food; 9. Regquests the High Commissioner for Human Rights to report on the implementation of the present resolution to the Commission at its fifty-sixth session.",04/16/1999,1999_1488864,Peru,"* In accordance with rule 69, paragraph 3, of the rules of procedure of the functional commissions of the Economic and Social Council.",yes
