year,Council,Committee,Session,Agenda item,Agenda detail,cosponsored countries,body title number,body title detail,body text,date,file,filecountry,footnote,scanned
2005,General Assembly,First Committee,Sixtieth session,97 (y),General and complete disarmament: the Hague Code of Conduct against Ballistic Missile Proliferation,"Albania, Argentina, Armenia, Australia, Austria, Azerbaijan, Belarus, Belgium, Benin, Bulgaria, Burundi, Cameroon, Canada, Cape Verde, Chile, Colombia, Costa Rica, Croatia, Cyprus, Czech Republic, Denmark, Djibouti, Ecuador, El Salvador, Eritrea, Estonia, Fiji, Finland, France, Georgia, Germany, Ghana, Greece, Guatemala, Guinea, Guyana, Haiti, Hungary, Iceland, Iraq, Ireland, Italy, Japan, Jordan, Kazakhstan, Kenya, Kuwait, Latvia, Liberia, Libyan Arab Jamahiriya, Liechtenstein, Lithuania, Luxembourg, Madagascar, Malawi, Malta, Micronesia (Federated States of), Monaco, Mongolia, Morocco, Netherlands, New Zealand, Nicaragua, Nigeria, Norway, Palau, Panama, Paraguay, Peru, Philippines, Poland, Portugal, Republic of Korea, Republic of Moldova, Romania, Russian Federation, Saint Vincent and the Grenadines, Senegal, Serbia and Montenegro, Seychelles, Sierra Leone, Slovakia, Slovenia, South Africa, Spain, Sudan, Suriname, Sweden, Switzerland, the former Yugoslav Republic of Macedonia, Timor-Leste, Trinidad and Tobago, Tunisia, Turkey, Uganda, Ukraine, United Kingdom of Great Britain and Northern Ireland, United Republic of Tanzania, United States of America, Uruguay, Uzbekistan, Vanuatu, Venezuela (Bolivarian Republic of), Zambia and Zimbabwe",N/A,The Hague Code of Conduct against Ballistic Missile Proliferation,"The General Assembly, Concerned about the increasing regional and global security challenges caused, inter alia, by the ongoing proliferation of ballistic missiles capable of delivering weapons of mass destruction, Bearing in mind the purposes and principles of the United Nations and its role and responsibility in the field of international peace and security in accordance with the Charter of the United Nations, Emphasizing the significance of regional and international efforts to prevent and curb comprehensively the proliferation of ballistic missile systems capable of delivering weapons of mass destruction, as a contribution to international peace and security, 05-54608 (E) 131005 *0554608* Welcoming the adoption of the Hague Code of Conduct against Ballistic Missile Proliferation! on 25 November 2002 at The Hague, and convinced that the Code will contribute to enhancing transparency and confidence among States, Recalling its resolution 59/91 of 3 December 2004, entitled “The Hague Code of Conduct against Ballistic Missile Proliferation”, Confirming its commitment to the Declaration on International Cooperation in the Exploration and Use of Outer Space for the Benefit and in the Interest of All States, Taking into Particular Account the Needs of Developing Countries, as contained in the annex to its resolution 51/122 of 13 December 1996, Recognizing that States should not be excluded from utilizing the benefits of space for peaceful purposes, but that in reaping such benefits and in conducting related cooperation they must not contribute to the proliferation of ballistic missiles capable of carrying weapons of mass destruction, Mindful of the need to combat the proliferation of weapons of mass destruction and their means of delivery, 1. Notes with satisfaction that one hundred and twenty-two States have already subscribed to the Hague Code of Conduct against Ballistic Missile Proliferation as a practical step against the proliferation of weapons of mass destruction and their means of delivery; 2. Invites all States that have not yet subscribed to the Code of Conduct to do so; 3. Encourages the exploration of further ways and means to deal effectively with the problem of the proliferation of ballistic missiles capable of delivering weapons of mass destruction; 4. Decides to include in the provisional agenda of its sixty-first session an item entitled “The Hague Code of Conduct against Ballistic Missile Proliferation”. 1 A/57/724, enclosure.",10/11/2005,2005_558344,Russian Federation,N/A,yes
2005,General Assembly,Second Committee,Sixtieth session,73 (b),Strengthening of the coordination of humanitarian,"Argentina, Armenia, Austria, Azerbaijan, Belarus, Belgium, Costa Rica, Georgia, Japan, Jordan, Kazakhstan, Kyrgyzstan, Lao People’s Democratic Republic, Lithuania, Mexico, Monaco, Mongolia, Pakistan, Paraguay, Philippines, Poland, Romania, Russian Federation, Slovakia, Slovenia, Tajikistan, Thailand, Turkey, Turkmenistan, Ukraine and Uzbekistan",N/A,International cooperation and coordination for the human and ecological rehabilitation and economic development of the Semipalatinsk region of Kazakhstan,"The General Assembly, Recalling its resolutions 52/169 M of 16 December 1997, 53/1 H of 16 November 1998, 55/44 of 27 November 2000 and 57/101 of 25 November 2002, Welcoming the report of the Secretary-General,! Recognizing that the Semipalatinsk nuclear testing ground, inherited by Kazakhstan and closed in 1991, remains a matter of serious concern for the people and Government of Kazakhstan with regard to the long-term nature of its consequences for the lives and health of the people, especially children and other vulnerable groups, as well as for the environment of the region, Taking into consideration the results of the international conference on the problems of the Semipalatinsk region, held in Tokyo in 1999, which have promoted the effectiveness of the assistance provided to the population of the region, Recognizing the important role of national development policies and strategies in the rehabilitation of the Semipalatinsk region, and taking note with satisfaction of the elaboration of the Kazakhstan national programme entitled “Complex solution of the former Semipalatinsk nuclear test site problems for 2005-2007”, 05-55007 (E) 131005 *0555007* Recognizing also the contribution of different organizations of the United Nations system, donor States, intergovernmental and non-governmental organizations to humanitarian assistance and to the implementation of the projects aimed at the rehabilitation of the region and the role of the Government of Kazakhstan in this regard, Recognizing further the challenges Kazakhstan faces in the rehabilitation of the Semipalatinsk region, in particular in the context of the efforts by the Government of Kazakhstan to ensure an effective and timely achievement of the Millennium Development Goals, Taking note of the need for know-how in minimizing and mitigating radiological, health, socio-economic, psychological and environmental problems in the Semipalatinsk region, Taking into account that many international programmes in the Semipalatinsk region have been completed whereas serious social, economic and ecological problems continue to exist, Conscious that the international community should continue to pay due attention to the issue of the human, ecological and socio-economic dimensions of the situation in the Semipalatinsk region, Emphasizing the importance of support by donor States and international development organizations for the efforts by Kazakhstan to improve the social, economic and environmental situation in the Semipalatinsk region, 1. Takes note of the report of the Secretary-General' and the information about the measures taken to solve the health, ecological, economic and humanitarian problems and to meet the needs of the Semipalatinsk region; 2. Welcomes and recognizes the important role of the Government of Kazakhstan in providing domestic resources to help to meet the needs of the Semipalatinsk region, including for the implementation of the Kazakhstan national programme entitled “Complex solution of the former Semipalatinsk nuclear test site problems for 2005-2007""; 3. Calls upon the international community, including all Member States, in particular donor States, and United Nations institutions to continue to support Kazakhstan in addressing the challenges of the rehabilitation of the Semipalatinsk region and its population, taking additional actions, including by facilitating the implementation of the Kazakhstan national programme on addressing the problems of the former Semipalatinsk nuclear testing ground in a comprehensive manner, and stresses the importance of the regional cooperation in this regard; 4. Urges the international community to provide assistance to Kazakhstan in the formulation and implementation of special programmes and projects of treatment and care for the affected population as well as in the efforts to ensure economic growth and sustainable development in the Semipalatinsk region; 5. Calls upon all States, relevant multilateral financial organizations and other entities of the international community, including non-governmental organizations, to share their knowledge and experience in order to contribute to the human and ecological rehabilitation and economic development of the Semipalatinsk region; A/C.2/60/L.4 6. Invites the Secretary-General to pursue a consultative process, with the participation of interested States and relevant United Nations agencies, on modalities for mobilizing the necessary support to seek appropriate solutions to the problems and needs of the Semipalatinsk region, including those prioritized in the report of the Secretary-General; 7. Calls upon the Secretary-General to continue his efforts to enhance world public awareness of the problems and needs of the Semipalatinsk region; 8. Requests the Secretary-General to report to the General Assembly at its sixty-third session, under a separate sub-item, on progress made in the implementation of the present resolution.",10/12/2005,2005_558348,Russian Federation,N/A,yes
2005,General Assembly,First Committee,Sixtieth session,96,Prevention of an arms race in outer space,"Algeria, Armenia, Bangladesh, Belarus, Bhutan, Brunei Darussalam, China, Congo, Cote d’Ivoire, Cuba, Dominican Republic, Ecuador, Egypt, Haiti, India, Indonesia, Iran (Islamic Republic of), Jordan, Kenya, Libyan Arab Jamabhiriya, Malaysia, Mongolia, Myanmar, Nepal, Pakistan, Qatar, Russian Federation, Saudi Arabia, Sierra Leone, Sri Lanka, Sudan, Syrian Arab Republic, Trinidad and Tobago, Uruguay, Yemen and Zambia",N/A,Prevention of an arms race in outer space,"The General Assembly, Recognizing the common interest of all mankind in the exploration and use of outer space for peaceful purposes, Reaffirming the will of all States that the exploration and use of outer space, including the Moon and other celestial bodies, shall be for peaceful purposes and shall be carried out for the benefit and in the interest of all countries, irrespective of their degree of economic or scientific development, Reaffirming also the provisions of articles III and IV of the Treaty on Principles Governing the Activities of States in the Exploration and Use of Outer Space, including the Moon and Other Celestial Bodies,! Recalling the obligation of all States to observe the provisions of the Charter of the United Nations regarding the use or threat of use of force in their international relations, including in their space activities, Reaffirming paragraph 80 of the Final Document of the Tenth Special Session of the General Assembly,? in which it is stated that in order to prevent an arms race in outer space, further measures should be taken and appropriate international negotiations held in accordance with the spirit of the Treaty, 1 Resolution 2222 (XXI), annex. 2 Resolution S-10/2. 05-54692 (E) 141005 *0554692* Recalling its previous resolutions on this issue, and taking note of the proposals submitted to the General Assembly at its tenth special session and at its regular sessions, and of the recommendations made to the competent organs of the United Nations and to the Conference on Disarmament, Recognizing that prevention of an arms race in outer space would avert a grave danger for international peace and security, Emphasizing the paramount importance of strict compliance with existing arms limitation and disarmament agreements relevant to outer space, including bilateral agreements, and with the existing legal regime concerning the use of outer space, Considering that wide participation in the legal regime applicable to outer space could contribute to enhancing its effectiveness, Noting that the Ad Hoc Committee on the Prevention of an Arms Race in Outer Space, taking into account its previous efforts since its establishment in 1985 and seeking to enhance its functioning in qualitative terms, continued the examination and identification of various issues, existing agreements and existing proposals, as well as future initiatives relevant to the prevention of an arms race in outer space,? and that this contributed to a better understanding of a number of problems and to a clearer perception of the various positions, Noting also that there were no objections in principle in the Conference on Disarmament to the re-establishment of the Ad Hoc Committee, subject to re- examination of the mandate contained in the decision of the Conference on Disarmament of 13 February 1992,4 Emphasizing the mutually complementary nature of bilateral and multilateral efforts in the field of preventing an arms race in outer space, and hoping that concrete results will emerge from those efforts as soon as possible, Convinced that further measures should be examined in the search for effective and verifiable bilateral and multilateral agreements in order to prevent an arms race in outer space, including the weaponization of outer space, Stressing that the growing use of outer space increases the need for greater transparency and better information on the part of the international community, Recalling, in this context, its previous resolutions, in particular resolutions 45/55 B of 4 December 1990, 47/51 of 9 December 1992 and 48/74 A of 16 December 1993, in which, inter alia, it reaffirmed the importance of confidence- building measures as a means conducive to ensuring the attainment of the objective of the prevention of an arms race in outer space, Conscious of the benefits of confidence- and security-building measures in the military field, Recognizing that negotiations for the conclusion of an international agreement or agreements to prevent an arms race in outer space remain a priority task of the Ad Hoc Committee and that the concrete proposals on confidence-building measures could form an integral part of such agreements, 3 Official Records of the General Assembly, Forty-ninth Session, Supplement No. 27 (A/49/27), sect. III.D (para. 5 of the quoted text). 4 CD/1125. A/C.1/60/L.27 1. Reaffirms the importance and urgency of preventing an arms race in outer space and the readiness of all States to contribute to that common objective, in conformity with the provisions of the Treaty on Principles Governing the Activities of States in the Exploration and Use of Outer Space, including the Moon and Other Celestial Bodies;! 2. Reaffirms its recognition, as stated in the report of the Ad Hoc Committee on the Prevention of an Arms Race in Outer Space, that the legal regime applicable to outer space does not in and of itself guarantee the prevention of an arms race in outer space, that the regime plays a significant role in the prevention of an arms race in that environment, that there is a need to consolidate and reinforce that regime and enhance its effectiveness and that it is important to comply strictly with existing agreements, both bilateral and multilateral; 3. Emphasizes the necessity of further measures with appropriate and effective provisions for verification to prevent an arms race in outer space; 4. Calls upon all States, in particular those with major space capabilities, to contribute actively to the objective of the peaceful use of outer space and of the prevention of an arms race in outer space and to refrain from actions contrary to that objective and to the relevant existing treaties in the interest of maintaining international peace and security and promoting international cooperation; 5. Reiterates that the Conference on Disarmament, as the single multilateral disarmament negotiating forum, has the primary role in the negotiation of a multilateral agreement or agreements, as appropriate, on the prevention of an arms race in outer space in all its aspects; 6. Invites the Conference on Disarmament to complete the examination and updating of the mandate contained in its decision of 13 February 1992* and to establish an ad hoc committee as early as possible during its 2006 session; 7. Recognizes, in this respect, the growing convergence of views on the elaboration of measures designed to strengthen transparency, confidence and security in the peaceful uses of outer space; 8. Urges States conducting activities in outer space, as well as States interested in conducting such activities, to keep the Conference on Disarmament informed of the progress of bilateral and multilateral negotiations on the matter, if any, so as to facilitate its work; 9. Decides to include in the provisional agenda of its sixty-first session the item entitled “Prevention of an arms race in outer space”.",10/12/2005,2005_558457,Russian Federation,N/A,yes
2005,General Assembly,First Committee,Sixtieth session,97 (z),General and complete disarmament: information on confidence-building measures in the field of conventional arms,"Albania, Andorra, Angola, Antigua and Barbuda, Argentina, Armenia, Australia, Bangladesh, Barbados, Belarus, Belize, Bolivia, Brazil, Burkina Faso, Cameroon, Canada, Chad, Chile, Colombia, Congo, Costa Rica, Céte d’Ivoire, Dominican Republic, Ecuador, El Salvador, Fiji, Georgia, Germany, Guatemala, Guinea, Haiti, Indonesia, Israel, Jamaica, Kenya, Liberia, Madagascar, Malawi, Malaysia, Mexico, Nicaragua, Norway, Panama, Paraguay, Peru, Philippines, Romania, Russian Federation, Saint Vincent and the Grenadines, Senegal, Seychelles, Sierra Leone, Spain, Suriname, Thailand, Timor-Leste, Trinidad and Tobago, Turkey, Ukraine, United Republic of Tanzania, Uruguay, Venezuela, Zambia and Zimbabwe",N/A,Information on confidence-building measures in the field of conventional arms,"The General Assembly, Guided by the purposes and principles enshrined in the Charter of the United Nations, Bearing in mind the contribution of confidence-building measures in the field of conventional arms, adopted on the initiative and with the agreement of the States concerned, to the improvement of the overall international peace and security situation, Convinced that the relationship between the development of confidence- building measures in the field of conventional arms and the international security environment can also be mutually reinforcing, Considering the important role that confidence-building measures in the field of conventional arms can also play in creating favourable conditions for progress in the field of disarmament, Recognizing that the exchange of information on confidence-building measures in the field of conventional arms contributes to mutual understanding and confidence among Member States, 05-54929 ﬁEf 141005 R 1. Welcomes all confidence-building measures in the field of conventional arms already undertaken by Member States as well as the information on such measures voluntarily provided; 2. Encourages Member States to continue to adopt confidence-building measures in the field of conventional arms and to provide information in that regard; 3. Also encourages Member States to continue the dialogue on confidence- building measures in the field of conventional arms; 4. Requests the Secretary-General to establish, with the financial support of States in a position to do so, an electronic database containing information provided by Member States and to assist them, at their request, in the organization of seminars, courses and workshops aimed at enhancing the knowledge of new developments in this field; 5. Decides to include in the provisional agenda of its sixty-first session the item entitled “Information on confidence-building measures in the field of conventional arms”.",10/12/2005,2005_558459,Russian Federation,N/A,yes
2005,General Assembly,First Committee,Sixtieth session,97,General and complete disarmament,Russian Federation,N/A,Measures to promote transparency and confidence-building in outer space,"The General Assembly, Reaffirming that the prevention of an arms race in outer space would avert a grave danger to international peace and security, Conscious that further measures should be examined in the search for agreements to prevent an arms race in outer space, including the weaponization of outer space, Recalling, in this context, its previous resolutions, which, inter alia, emphasize the need for increased transparency and confirm the importance of confidence- building measures as a conducive means of ensuring the objective of the prevention of an arms race in outer space, Recalling the report of the Secretary-General to its forty-eighth session, the annex to which contains the study by governmental experts on the application of confidence-building measures in outer space,! 1. Invites all Member States to inform the Secretary-General before its sixty-first session of their views on the advisability of further developing international measures for assuring transparency and confidence-building measures in outer space activities in the interest of maintaining international peace and security and promoting international cooperation and the prevention of an arms race in outer space; 2. Decides to include in the provisional agenda of its sixty-first session an item entitled “Measures to promote transparency and confidence-building in outer space”. 05-54899* (E) 241005 *0554899~*",10/24/2005,2005_558463,Russian Federation,* Reissued for technical reasons. 1 A/48/305 and Corr.1.,yes
