year,Council,Committee,Session,Agenda item,Agenda detail,cosponsored countries,body title number,body title detail,body text,date,file,filecountry,footnote,scanned
2005,General Assembly,N/A,Fifty-ninth session,39,"Strengthening of the coordination of humanitarian and disaster relief assistance of the United Nations, including special economic assistance","Andorra, Australia, Austria, Azerbaijan, Belarus, Belgium, Brunei Darussalam, Cambodia, Canada, China, Cyprus, Czech Republic, Denmark, Estonia, France, Greece, Indonesia, Iran (Islamic Republic of), Ireland, Italy, Jamaica, Japan, Kazakhstan, Leo People’s Democratic Republic, Lithuania, Luxembourg, Malaysia, Maldives, Mauritius, Monaco, Mongolia, Morocco, Myanmar, Netherlands, New Zealand, Pakistan, Philippines, Republic of Korea, Russian Federation, Senegal, Serbia and Montenegro, Singapore, Slovenia, Somalia, Spain, Sri Lanka, Sweden, Tajikistan, Thailand, Timor-Leste, United Kingdom of Great Britain and Northern Ireland, Uzbekistan, Viet Nam",N/A,"Strengthening emergency relief, rehabilitation, reconstruction and prevention in the aftermath of the Indian Ocean tsunami disaster","The General Assembly, Recalling its resolutions 46/182 of 19 December 1991, 57/152 of 16 December 2002, 57/256 of 20 December 2002, 58/214 and 58/215 of 23 December 2003, 58/25 of 5 December 2003, 59/212 of 20 December 2004, and 59/231 and 59/233 of 22 December 2004, Expressing sincere condolences and deep sympathy to the victims, their families, the Governments and the peoples of those States that suffered huge losses of life and socio-economic and environmental damage from the unprecedented tsunami disaster that struck the Indian Ocean and Southeast Asian regions on 26 December 2004, Commending the prompt response, support, generous contributions to and assistance of the international community, by Governments, civil society, the private sector and individuals, in the relief, rehabilitation and reconstruction efforts, which reflect the spirit of international solidarity and cooperation to address the disaster, In order for the General Assembly to be able to consider the present resolution, it will be necessary to reopen consideration of agenda item 39. 05-20857 (E) 140105 *0520857~* Commending also the leading role of the affected States and the role of the United Nations in addressing the disaster, and recognizing the importance of cooperation for effective mobilization, coordination and delivery of international assistance in the emergency relief phase, Welcoming the Declaration on Action to Strengthen Emergency Relief, Rehabilitation, Reconstruction and Prevention in the Aftermath of the Earthquake and Tsunami Disaster of 26 December 2004! adopted at the special meeting of Association of South-East Asian Nations leaders in the aftermath of the earthquake and tsunami, held in Jakarta on 6 January 2005, and the pledges made by donor countries and international financial institutions for the affected countries, Welcoming also the launching of the Indian Ocean earthquake-tsunami 2005 flash appeal? by the Secretary-General to respond to the urgent and immediate needs of communities severely affected by the earthquake and tsunami and the outcome of the Ministerial-Level Meeting on Humanitarian Assistance to Tsunami-affected Communities held in Geneva on 11 January 2005, Welcoming the recent announcement by the Paris Club creditors that they will not expect debt payments from affected countries that request such forebearance until the World Bank and the International Monetary Fund have made a full assessment of their reconstruction and financing needs as well as specific initiatives of countries in this issue, Welcoming also the appointment by the Secretary-General of a Special Coordinator to coordinate international emergency relief operations in support of national emergency programmes of countries affected by the tsunami disaster and covered by the flash appeal, Expressing concern over the medium- and long-term social, economic and environmental impacts of the disaster on the affected States, Stressing the need to develop and implement risk-reduction strategies and to integrate them, where appropriate, into national development plans, in particular through the implementation of the International Strategy for Disaster Reduction, so as to enhance the resilience of populations in disasters and reduce risks to them, their livelihoods, the social and economic infrastructure and environmental resources, Recognizing that the development of stronger institutions, mechanisms and capacities, including at the community level, that can systematically build resilience to hazards and disasters is essential to reducing the risks and the vulnerability of populations to disasters, including disaster preparedness, mitigation and early warning system at all levels, Recalling the need for continued commitment to assist the affected countries and their peoples, particularly the most vulnerable groups, to fully recover from the catastrophic and traumatic effects of the disaster, including in their medium- and long-term rehabilitation and reconstruction efforts, and welcoming Government and international assistance measures in this regard, 1 A/59/669, annex. 2 Indonesia, Maldives, Myanmar, Seychelles, Somalia, Sri Lanka. A/59/L.58 Emphasizing that disaster reduction, including reducing vulnerability to natural disasters, is an important element that contributes to the achievement of sustainable development, Welcoming the convening of the World Conference on Disaster Reduction in Kobe, Hyogo, Japan from 18 to 22 January 2005, with a view to updating the guiding framework on disaster reduction for the twenty-first century, Noting also the outcome of the International Meeting to Review the Implementation of the Programme of Action for the Sustainable Development of Small Island Developing States held in Mauritius, 10-14 January 2005, Stressing the importance of advancing the implementation of the Johannesburg Plan of Implementation3 and its relevant provisions on vulnerability, risk assessment and disaster management, Emphasizing the importance of establishing a partnership, upon the request and with the leadership of the country concerned, involving donor countries and regional and international financial institutions as well as the private sector and civil society, to support the respective national rehabilitation and reconstruction programmes of the affected countries, Emphasizing also the importance of international cooperation in support of the efforts of the affected States in dealing with natural disasters in all phases, including prevention, preparedness, mitigation, recovery and reconstruction, as well as in strengthening the response capacity of affected countries, 1. Expresses its deep concern at the number and scale of natural disasters and their increasing impact within recent years, which have resulted in a massive loss of life and long-term negative social, economic and environmental consequences for vulnerable societies throughout the world, in particular in developing countries; 2. Emphasizes the need for the international community to maintain its focus beyond the present emergency relief, in order to sustain the political will to support the medium- and long-term rehabilitation, reconstruction and risk reduction efforts led by the Governments of the affected countries at all levels; 3. Welcomes the effective cooperation between the affected States, relevant bodies in the United Nations system, donor countries, regional and international financial institutions and civil society in the coordination and delivery of emergency relief, and stresses the need to continue such cooperation and delivery throughout the ongoing relief operations and rehabilitation and reconstruction efforts, in a manner that reduces vulnerability to future natural hazards; 4. Encourages the international community, particularly donor countries, international financial institutions and relevant international organizations, as well as the private sector and civil society, to deliver swiftly on their pledges and to continue to provide the necessary funds and assistance to support the rehabilitation and reconstruction efforts; 3 Report of the World Summit on Sustainable Development, Johannesburg, South Africa, 26 August-4 September 2002 (United Nations publication, Sales No. E.03.1I.A.1 and corrigendum), chap. I, resolution 2, annex. A/59/L.58 5. Welcomes the increasing efforts to further enhance transparency and accountability with respect to the channelling and utilization of resources; 6. Requests the Secretary-General to appoint a special representative in order to, inter alia, sustain the political will of the international community to support medium- and long-term rehabilitation, reconstruction and risk reduction efforts led by the Governments of affected countries at all levels; 7. Also requests the Secretary-General to explore ways to further strengthen the rapid response capacities for immediate humanitarian relief efforts of the international community, building on the existing arrangements and ongoing initiatives, including the consideration of “standby arrangements” under the auspices of the United Nations; 8. Invites the World Bank and the Asian Development Bank, in collaboration with other international and regional financial institutions and the United Nations, to convene members of the international community, including affected countries, to address the medium- and long-term rehabilitation and reconstruction needs of the affected countries; 9. Recognizes the importance of the decision by the Association of South- East Asian Nations to establish regional mechanisms on disaster prevention, preparedness and mitigation, encourages regional cooperation in this regard and urges donor countries and regional and international organizations as well as other relevant institutions to provide, where appropriate, financial and technical assistance; 10. Recognizes also the importance of the promotion of public education, awareness and community participation in disaster prevention and preparedness, particularly at the local level, as well as the pressing need to develop and promote national and regional capacity and access to technology and knowledge in building and managing a regional early warning system and in disaster management, through national and regional efforts as well as through international cooperation and partnership; 11. Emphasizes the urgent need for the establishment of a regional early warning system, particularly for tsunami, in the Indian Ocean and South-East Asian regions, and notes the interest expressed by some Governments, bodies and organizations, including the Asian Disaster Preparedness Centre (ADPC), to support the establishment of this system; 12. Welcomes the proposed convening of a regional ministerial meeting on regional cooperation with regard to a tsunami early warning system, to be held in Thailand on 28 January 2005; 13. Welcomes the proposal of Germany to host a third international early warning conference, covering the complete range of natural hazards, with a focus on the urgent implementation of early warning systems for hydro-meteorological and geological hazards on a global scale; 14. Welcomes also the fact that the World Conference on Disaster Reduction will discuss the issue of a global tsunami early warning system as part of its agenda; 15. Requests the Secretary-General to report to the General Assembly at its sixtieth session on the implementation of the present resolution under the item A/59/L.58 entitled “Strengthening of the coordination of humanitarian and disaster relief assistance of the United Nations including special economic assistance” and to report to the Economic and Social Council at its substantive session in 2005.",01/14/2005,2005_539188,Russian Federation,*,yes
2005,Economic And Social Council,Commission On Human Rights,Sixty-first session,7,THE RIGHT TO DEVELOPMENT,Malaysia (on behalf of the States members of the Non-Aligned Movement and China) and the Russian Federation,2005,The right to development,"The Commission on Human Rights, Recalling the Declaration on the Right to Development adopted by the General Assembly in its resolution 41/128 of 4 December 1986, which confirmed the right to development as an inalienable human right and that equality of opportunity for development is a prerogative both of nations and of individuals who make up nations, and the individual as the central subject and beneficiary of development, Stressing that in General Assembly resolution 48/141 of 20 December 1993, the Assembly decided that the responsibility of the High Commissioner for Human Rights, among others, shall be to promote and protect the realization of the right to development and to enhance support from relevant bodies of the United Nations system for this purpose, Recalling all its previous resolutions on the right to development, in particular resolution 1998/72 of 22 April 1998 in which it referred to the urgent need to make further progress towards the realization of the right to development as set out in the Declaration, Recognizing that the open-ended working group established to monitor and review progress made in the promotion and implementation of the right to development is the only global forum mandated to monitor and review progress made in the promotion and implementation of this right at the national and international levels, providing recommendations thereon and further analysing obstacles to its full enjoyment, Recognizing also the valuable contribution made by the independent expert on the right to development through his series of reports to the Working Group on the Right to Development which provide valuable input for the implementation of the right to development, Reaffirming the agreed conclusions of the third session of the Working Group (E/CN.4/2002/28/Rev.1) and the need for their follow-up and effective implementation, Reaffirming also the agreed conclusions and recommendations adopted by consensus by the Working Group at its fifth session (E/CN.4/2004/23, paras. 41-51), Welcoming the establishment of the high-level task force on the implementation of the right to development established within the framework of the Working Group with the objective of assisting the Working Group in fulfilling its mandate as contained in paragraph 10 (a) of Commission resolution 1998/72 comprising five experts with practical experience related to the implementation of the right to development, and high-level representatives of United Nations agencies, funds and programmes, multilateral financial and development institutions and the World Trade Organization, Recognizing the broad participation by States, international organizations and non-governmental organizations at the sixth session of the Working Group on the Right to Development and welcoming their active participation in enhancing the realization of the Declaration on the Right to Development as well as the adoption by consensus of the Working Group’s conclusions and recommendations (E/CN.4/2005/25, paras. 35-58), Taking note of the report of the United Nations High Commissioner for Human Rights (E/CN.4/2005/24), 1. Recognizes the importance of maintaining political will and commitment on the part of all members of the Working Group on the Right to Development and welcomes their ongoing cooperation towards the realization of its mandate; 2. Welcomes the convening of the first meeting of the high-level task force on the implementation of the right to development from 13 to 17 December 2004 and expresses its appreciation to the task force for the work it has undertaken; 3. Also welcomes the active participation of all members of the task force, including the five regional experts and the representatives of the United Nations Development Programme, the United Nations Children’s Fund, the United Nations Conference on Trade and Development, the International Monetary Fund, the World Bank and the World Trade Organization; 4. Endorses the conclusions and recommendations adopted by the Working Group on the Right to Development at its sixth session as reflected in its report and calls for their immediate, full and effective implementation; 5. Notes with appreciation that the high-level task force, at its next meeting, will examine Millennium Development Goal 8 on a global partnership for development and suggest criteria for its periodic evaluation with the aim of improving the effectiveness of global partnership with regard to the realization of the right to development; 6. Requests the Office of the United Nations High Commissioner for Human Rights to provide all necessary administrative support and financial and human resources to the high-level task force on the implementation of the right to development; Notes with concern that the Sub-Commission on the Promotion and Protection of Human Rights has not submitted the concept document requested by the Commission in its resolution 2003/83 of 25 April 2003 establishing options and their feasibility for the implementation of the right to development, inter alia an international legal standard of a binding nature, guidelines on the implementation of the right to development and principles for development partnership, based on the Declaration on the Right to Development, including issues which any such instrument might address, for consideration and determination of the feasibility of these options, and requests the Sub-Commission, without further delay, to submit the concept document at the sixty-second session of the Commission; 8. Takes note of decision 2004/104 of 9 August 2004 of the Sub-Commission on the Promotion and Protection of Human Rights relating to the right to development; 9. Requests the Office of the High Commissioner to continue to provide all necessary administrative support and financial and human resources to the Sub-Commission in its work on the concept document; 10. Requests the High Commissioner, in mainstreaming the right to development, to undertake effectively activities aimed at strengthening the global partnership for development between Member States, development agencies and the international development, financial and trade institutions, and to reflect these activities in detail in her report to the Commission at its sixty-second session; 10. 11. Decides to renew the mandate of the Working Group on the Right to Development for one year and to convene its seventh session before the sixty-second session of the Commission for a period of 10 working days, five of which shall be allocated to the second meeting of the high-level task force to be held well in advance of the session of the Working 11. Group; 12. Also decides to review the progress of the implementation of the present resolution as a matter of priority at its sixty-second session; 12. Recommends the following decision to the Economic and Social Council for 13. adoption: “The Economic and Social Council, taking note of Commission on Human Rights resolution 2005/... of .. April 2005, approves the decision of the Commission to renew for one year the mandate of the Working Group on the Right to Development and to convene its seventh session before the sixty-second session of the Commission for a period of 10 working days, five of which shall be allocated to the second meeting of the high-level task force to be held well in advance of the session of the Working Group.”",04/05/2005,2005_545212,Russian Federation,N/A,yes
2005,Economic And Social Council,Commission On Human Rights,Sixty-first session,6,"RACISM, RACIAL DISCRIMINATION, XENOPHOBIA AND ALL FORMS OF DISCRIMINATION","Belarus,* Cuba and the Russian Federation",2005,"Inadmissibility of certain practices that contribute to fuelling contemporary forms of racism, racial discrimination, xenophobia and related intolerance","The Commission on Human Rights, Guided by the Charter of the United Nations, the Universal Declaration of Human Rights, the International Covenant on Civil and Political Rights, the International Convention on the Elimination of All Forms of Racial Discrimination and other relevant human rights instruments, Recalling the provisions of its resolution 2004/16 of 16 April 2004, Recalling also the Charter of the Niirnberg Tribunal and the Judgement of the Tribunal, which recognized the Waffen SS organization and all its integral parts as criminal and declared it responsible for many war crimes and crimes against humanity, Recalling further the relevant provisions of the Durban Declaration and Programme of Action adopted by the World Conference against Racism, Racial Discrimination, Xenophobia and Related Intolerance on 8 September 2001 (A/CONF.189/12 and Corr.1), in particular its paragraph 2 of the Declaration and paragraph 86 of the Programme of Action, Recalling the study undertaken by the Special Rapporteur on contemporary forms of racism, racial discrimination, xenophobia and related intolerance (E/CN.4/2004/61) and taking note of his report (E/CN.4/2005/18 and Add.1-6), Alarmed, in this regard, at the spread in many parts of the world of various extremist political parties, movements and groups, including neo-Nazis and skinhead groups, 1. Reaffirms the provision of the Durban Declaration, in which States condemned the persistence and resurgence of neo-Nazism, neo-Fascism and violent nationalist prejudice and stated that these phenomena could never be justified in any instance or in any circumstances; 2. Expresses deep concern over the fact of the glorification of the Nazi movement and former members of the Waffen SS organization, including through erecting monuments and memorials as well as holding public demonstrations; 3. Stresses that the practices described above do injustice to the memory of the countless victims of crimes against humanity committed in the Second World War, in particular those committed by the SS organization, and poison the minds of young people, in particular in the year of the sixtieth anniversary of victory in the Second World War and the liberation of Auschwitz and other concentration camps, and that these practices are incompatible with the obligations of States Members of the United Nations under its Charter and are incompatible with the goals and principles of the Organization; 4. Also stresses that such practices fuel contemporary forms of racism, racial discrimination, xenophobia and related intolerance and contribute to the spread and multiplication of various extremist political parties, movements and groups, including neo-Nazis and skinhead groups; Notes with concern the increase in the number of racist incidents in several countries and the rise of skinhead groups, which have been responsible for many of these incidents, as noted by the Special Rapporteur; 6. Emphasizes the need to take the necessary measures to put an end to the practices described above and calls upon States to take more effective measures to combat these phenomena and the extremist movements, which pose a real threat to democratic values; 7. Requests the Special Rapporteur to continue to reflect on this issue and to make relevant recommendations in his report to the Commission at its sixty-second session, to seek and to take into account in this regard the views of Governments as well as non-governmental organizations; 8. Invites Governments as well as non-governmental organizations to cooperate fully with the Special Rapporteur in the exercise of the aforementioned task; Decides to consider this issue at its sixty-second session under the same e agenda item.",04/06/2005,2005_545260,Russian Federation,"* In accordance with rule 69, paragraph 3, of the rules of procedure of the functional commissions of the Economic and Social Council.",yes
