year,Council,Committee,Session,Agenda item,Agenda detail,cosponsored countries,body title number,body title detail,body text,date,file,filecountry,footnote,scanned
2003,General Assembly,Second Committee,Fifty-eighth session,95,"Implementation of Agenda 21, the Programme for the Further Implementation of Agenda 21 and outcomes of the World Summit on Sustainable Development","Afghanistan, Algeria, Argentina, Armenia, Barbados, Belarus, Belize, Benin, Bolivia, Botswana, Brunei Darussalam, Burkina Faso, Cambodia, Cameroon, Cape Verde, Costa Rica, Cote d’Ivoire, Cuba, Djibouti, Dominican Republic, Egypt, Ethiopia, Gabon, Georgia, Grenada, Guinea, Haiti, Honduras, Indonesia, Iran (Islamic Republic of), Japan, Jordan, Kazakhstan, Kenya, Kyrgyzstan, Lao People’s Democratic Republic, Lesotho, Madagascar, Mali, Mauritius, Mexico, Micronesia (Federated States of), Mongolia, Nauru, Nepal, Niger, Oman, Pakistan, Panama, Philippines, Republic of Moldova, Romania, Russian Federation, Saint Kitts and Nevis, Samoa, Saudi Arabia, Singapore, Somalia, South Africa, Sri Lanka, Syrian Arab Republic, Tajikistan, Thailand, Timor- Leste, Trinidad and Tobago, Turkmenistan, Tuvalu, Uganda, Ukraine, Uzbekistan, Venezuela, Viet Nam, Yemen, Zambia and Zimbabwe",N/A,"International Decade for Action, “Water for Life”, 2005-2015","The General Assembly, Recalling its resolution 55/196 of 20 December 2000, in which it proclaimed the year 2003 as the International Year of Freshwater, Emphasizing that water is a driving force for sustainable development, environmental integrity and the eradication of poverty and hunger, indispensable for human health and well-being, Determined to achieve internationally agreed development goals-on water and sanitation, including those contained in the Millennium Declaration,* which set a goal to halve, by the year 2015, the proportion of people who are unable to reach or to afford safe drinking water and the proportion of people without access to basic sanitation, Bearing in mind the comprehensive review of today’s water problems and recommendations of the World Water Development Report 2003, a joint project of twenty-three United Nations specialized agencies and other entities, and other water-related collaborative mechanisms and initiatives, Taking note of the Ministljial Declaration entitled “Message from the Lake Biwa and Yodo River Basin”,® adopted on 23 March 2003, at the Ministerial Conference on the occasion of the Third World Water Forum, held in Kyoto, Japan, and the Dushanbe Water Appeal,® adopted on 1 September 2003 at the International Freshwater Forum, held in Dushanbe, 1. Proclaims the period from 2005 to 2015 as the International Decade for Action, “Water for Life”, commencing on World Water Day, 22 March 2005; 2. Decides that the goal of the Decade should be a greater focus on water- related issues, with emphasis on women as managers of water, and the furtherance of international cooperation among all stakeholders in order to help to achieve internationally agreed water-related goals contained in the Millennium Declaration, the Johannesltl]\rg Plan of Implementation of the World Summit for Sustainable Developmeﬁ, Agenda 21%and the Programme for the Further Implementation of Agenda 21; 3. Invites the Commission on Sustainable Development to identify possible activities and programmes in connection with the Decade within the framework of consideration of water and sanitation issues at its twelfth and thirteenth sessions, as provided for by its Multi-Year Programme of Work; 4. Requests the Secretary-General to entrust the Under-Secretary-General for Economic and Social Affairs with the coordination of activities for the Decade; 5. Calls upon the competent United Nations bodies, specialized agencies, regional commissions and other organizations of the United Nations system to deliver a coordinated response to make it a “decade for action”. 2 A/57/785, annex. 4 Report of the World Summit on Sustainable Development, Johannesburg, South Africa, 26 August-4 September 2002 (United Nations publication, Sales No. E.03.1I.A.1 and corrigendum), chap. I, resolution 2, annex. 5 Report of the United Nations Conference on Environment and Development, Rio de Janeiro, 3-14 June 1992 (United Nations publication, Sales No. E.93.1.8 and corrigenda), vol. I: Resolutions adopted by the Conference, resolution 1, annex II.",10/24/2003,2003_504852,Samoa,N/A,yes
2003,General Assembly,N/A,Fifty-eighth session,23 (a),Sport for peace and development: building a peaceful and better world through sport and the Olympic ideal,"Afghanistan, Albania, Algeria, Andorra, Angola, Antigua and Barbuda, Argentina, Armenia, Australia, Austria, Azerbaijan, Bahamas, Bahrain, Bangladesh, Barbados, Belarus, Belgium, Belize, Benin, Bhutan, Bolivia, Bosnia and Herzegovina, Botswana, Brazil, Brunei Darussalam, Bulgaria, Burkina Faso, Burundi, Cambodia, Cameroon, Canada, Cape Verde, Central African Republic, Chad, Chile, China, Colombia, Comoros, Congo, Costa Rica, Cote d’Ivoire, Croatia, Cuba, Cyprus, Czech Republic, Democratic People’s Republic of Korea, Democratic Republic of the Congo, Denmark, Djibouti, Dominica, Dominican Republic, Ecuador, Egypt, El Salvador, Equatorial Guinea, Eritrea, Estonia, Ethiopia, Fiji, Finland, France, Gabon, Gambia, Georgia, Germany, Ghana, Greece, Grenada, Guatemala, Guinea, Guinea-Bissau, Guyana, Haiti, Honduras, Hungary, Iceland, India, Indonesia, Iran (Islamic Republic of), Ireland, Israel, Italy, Jamaica, Japan, Jordan, Kazakhstan, Kenya, Kuwait, Kyrgyzstan, Lao People’s Democratic Republic, Latvia, Lebanon, Lesotho, Liberia, Libyan Arab Jamahiriya, Liechtenstein, Lithuania, Luxembourg, Madagascar, Malawi, Malaysia, Maldives, Mali, Malta, Marshall Islands, Mauritania, Mauritius, Mexico, Micronesia (Federated States of), Monaco, Mongolia, Morocco, Mozambique, Myanmar, Namibia, Nauru, Nepal, Netherlands, New Zealand, Nicaragua, Niger, Nigeria, Norway, Oman, Pakistan, Palau, Panama, Papua New Guinea, Paraguay, Peru, Philippines, Poland, Portugal, Qatar, Republic of Korea, Republic of Moldova, Romania, Russian Federation, Rwanda, Saint Kitts and Nevis, Saint Lucia, Saint Vincent and the Grenadines, Samoa, San Marino, Sao Tome and Principe, Saudi Arabia, Senegal, Serbia and Montenegro, Seychelles, Sierra Leone, Singapore, Slovakia, Slovenia, Solomon Islands, Somalia, South Africa, Spain, Sri Lanka, Sudan, Suriname, Swaziland, Sweden, Switzerland, Syrian Arab Republic, Tajikistan, Thailand, the former Yugoslav Republic of Macedonia, Timor-Leste, Togo, Tonga, Trinidad and Tobago, Tunisia, Turkey, Turkmenistan, Tuvalu, Uganda, Ukraine, United Arab Emirates, United Kingdom of Great Britain and Northern Ireland, United Republic of Tanzania, United States of America, Uruguay, Uzbekistan, Vanuatu, Venezuela, Viet Nam, Yemen, Zambia and Zimbabwe",N/A,Reissued for technical reasons.,"03-58359* (E) 311003 *0358359* Building a peaceful and better world through sport and the Olympic ideal The General Assembly, Recalling its resolution 56/75 of 11 December 2001, in which it decided to include in the provisional agenda of its fifty-eighth session the item entitled “Building a peaceful and better world through sport and the Olympic Ideal” and its decision to consider this item every two years in advance of each Summer and Winter Olympic Games, Recalling also its resolution 48/11 of 25 October 1993, which, inter alia, revived the ancient Greek tradition of ekecheiria (“Olympic Truce”), calling for a truce during the Games that would encourage a peaceful environment and ensuring the safe passage and participation of athletes and others at the Games and, thereby, mobilizing the youth of the world to the cause of peace, Taking into account the inclusion in the United Nations Millennium Declaration! of an appeal for the observance of the Olympic Truce now and in the future, and to support the International Olympic Committee in its efforts to promote peace and human understanding through sport and the Olympic ideal, Noting that the Games of the XXVIII Olympiad will take place at Athens, in Greece, where the Olympic Games were born in ancient times and revived in 1896, and where the tradition of the Olympic Truce was first established, Welcoming the initiative of the Secretary-General to establish the Task Force on Sport for Development and Peace, Recognizing the important role of sport in the implementation of the internationally agreed development goals, including those contained in the United Nations Millennium Declaration, Recognizing also the valuable contribution that the appeal launched by the International Olympic Committee for an Olympic Truce, with which the National Olympic Committees of the Member States are associated, could make towards advancing the purposes and principles of the Charter of the United Nations, Noting with satisfaction the flying of the United Nations flag at all competition sites of the Olympic Games, and the joint endeavours of the International Olympic Committee and the United Nations system in fields such as poverty alleviation, human and economic development, humanitarian assistance, education, health promotion, gender equality, environment protection and human immunodeficiency virus/acquired immunodeficiency syndrome (HIV/AIDS) prevention, Welcoming the establishment by the International Olympic Committee, of an International Olympic Truce Foundation and an International Olympic Truce Centre to promote further the ideals of peace and understanding through sport, on whose Board the President in office of the General Assembly sits and the Secretary- General and the Director-General of the United Nations Educational, Scientific and Cultural Organization are represented, A/58/L.9 Welcoming the individual support of world personalities for the promotion of the Olympic Truce, 1. Urges Member States to observe, within the framework of the Charter of the United Nations, the Olympic Truce, individually and collectively, during the Games of the XXVIII Olympiad, to be held at Athens from 13 to 29 August 2004; 2. Welcomes the decision of the International Olympic Committee to mobilize all international sports organizations and the National Olympic Committees of the Member States to undertake concrete actions at the local, national, regional and world levels to promote and strengthen a culture of peace based on the spirit of the Olympic Truce; 3. Calls upon all Member States to cooperate with the International Olympic Committee in its efforts to use the Olympic Truce as an instrument to promote peace, dialogue and reconciliation in areas of conflict during and beyond the Olympic Games period; 4. Welcomes the increased implementation of projects for development through sport and encourages Member States and all concerned agencies and programmes of the United Nations system to strengthen their work in this field, in cooperation with the International Olympic Committee; 5. Requests the Secretary-General to promote the observance of the Olympic Truce among Member States and support to human development initiatives through sport, and to cooperate with the International Olympic Committee in the realization of these objectives; 6. Decides to include in the provisional agenda of its sixtieth session the item entitled “Building a peaceful and better world through sport and the Olympic Ideal” and to consider this item before the XX Olympic Winter Games.",10/31/2003,2003_505074,Samoa,N/A,yes
