year,Council,Committee,Session,Agenda item,Agenda detail,cosponsored countries,body title number,body title detail,body text,date,file,filecountry,footnote,scanned
2020,General Assembly,First Committee,Seventy-fifth session,106,The risk of nuclear proliferation in the Middle East,"Algeria, Bahrain, Comoros, Djibouti, Egypt,* Iraq, Jordan, Kuwait, Lebanon, Libya, Mauritania, Morocco, Oman, Qatar, Saudi Arabia, Somalia, Sudan, Tunisia, United Arab Emirates, Yemen and State of Palestine",N/A,The risk of nuclear proliferation in the Middle East,"The General Assembly, Bearing in mind its relevant resolutions, the latest of which is resolution 74/75 of 12 December 2019, Taking note of the relevant resolutions adopted by the General Conference of the International Atomic Energy Agency, the latest of which is resolution GC(64)/RES/15, adopted on 24 September 2020, Cognizant that the proliferation of nuclear weapons in the region of the Middle East would pose a serious threat to international peace and security, Mindful of the immediate need for placing all nuclear facilities in the region of the Middle East under full-scope safeguards of the Agency, Recalling the decision on principles and objectives for nuclear non-proliferation and disarmament adopted by the 1995 Review and Extension Conference of the Parties to the Treaty on the Non-Proliferation of Nuclear Weapons on 11 May 1995,! in which the Conference urged universal adherence to the Treaty on the Non-Proliferation of Nuclear Weapons’ as an urgent priority and called upon all States not yet parties to the Treaty to accede to it at the earliest date, particularly those States that operate unsafeguarded nuclear facilities, ' See 1995 Review and Extension Conference of the Parties to the Treaty on the Non-Proliferation of Nuclear Weapons, Final Document, Part I (NPT/CONF.1995/32 (Part I) and NPT/CONF.1995/32 (Part I)/Corr.2), annex. ? United Nations, Treaty Series, vol. 729, No. 10485. Please recycle eS 20-13174 Hi 131020 AY A TA Recognizing with satisfaction that, in the Final Document of the 2000 Review Conference of the Parties to the Treaty on the Non-Proliferation of Nuclear Weapons,* the Conference undertook to make determined efforts towards the achievement of the goal of universality of the Treaty, called upon those remaining States not parties to the Treaty to accede to it, thereby accepting an international legally binding commitment not to acquire nuclear weapons or nuclear explosive devices and to accept Agency safeguards on all their nuclear activities, and underlined the necessity of universal adherence to the Treaty and of strict compliance by all parties with their obligations under the Treaty, Recalling the resolution on the Middle East adopted by the 1995 Review and Extension Conference of the Parties to the Treaty on 11 May 1995, in which the Conference noted with concern the continued existence in the Middle East of unsafeguarded nuclear facilities, reaffirmed the importance of the early realization of universal adherence to the Treaty, and called upon all States in the Middle East that had not yet done so, without exception, to accede to the Treaty as soon as possible and to place all their nuclear facilities under full-scope Agency safeguards, Acknowledging that, in the Final Document of the 2010 Review Conference of the Parties to the Treaty on the Non-Proliferation of Nuclear Weapons,* the Conference emphasized the importance of a process leading to full implementation of the 1995 resolution on the Middle East and decided, inter alia, that the Secretary- General of the United Nations and the co-sponsors of the 1995 resolution, in consultation with the States of the region, would convene a conference in 2012, to be attended by all States of the Middle East, on the establishment of a Middle East zone free of nuclear weapons and all other weapons of mass destruction, on the basis of arrangements freely arrived at by the States of the region, and with the full support and engagement of the nuclear-weapon States, Expressing regret and concern that the conference was not convened in 2012 as mandated and that little progress has been achieved towards the implementation of the resolution on the Middle East adopted by the 1995 Review and Extension Conference of the Parties to the Treaty, Noting, in this context, the relevant resolutions of the League of Arab States aiming at the establishment of a Middle East zone free of nuclear weapons and all other weapons of mass destruction, Taking note with appreciation of the report of the Secretary-General.,° Recalling that Israel remains the only State in the Middle East that has not yet become a party to the Treaty, Concerned about the threats posed by the proliferation of nuclear weapons to the security and stability of the Middle East region, Stressing the importance of taking confidence-building measures, in particular the establishment of a nuclear-weapon-free zone in the Middle East, in order to enhance peace and security in the region and to consolidate the global non-proliferation regime, 3 2000 Review Conference of the Parties to the Treaty on the Non-Proliferation of Nuclear Weapons, Final Document, vols. I-HI (NPT/CONF.2000/28 (Parts I and II), NPT/CONF.2000/28 (Part IIT) and NPT/CONF.2000/28 (Part IV)). 4 2010 Review Conference of the Parties to the Treaty on the Non-Proliferation of Nuclear Weapons, Final Document, vols. I-HI (NPT/CONF.2010/50 (Vol. I), NPT/CONF.2010/50 (Vol. Il) and NPT/CONF.2010/50 (Vol. ILD). 2/3 Emphasizing the need for all parties directly concerned to seriously consider taking the practical and urgent steps required for the implementation of the proposal to establish a nuclear-weapon-free zone in the region of the Middle East in accordance with the relevant resolutions of the General Assembly and, as a means of promoting this objective, inviting the countries concerned to adhere to the Treaty and, pending the establishment of the zone, to agree to place all their nuclear activities under Agency safeguards, Noting that 184 States have signed the Comprehensive Nuclear-Test-Ban Treaty,° including a number of States in the region, 1. Recalls the conclusions on the Middle East of the 2010 Review Conference of the Parties to the Treaty on the Non-Proliferation of Nuclear Weapons,’ and calls for the speedy and full implementation of the commitments contained therein; 2. Stresses that the resolution on the Middle East adopted by the 1995 Review and Extension Conference of the Parties to the Treaty® is an essential element of the outcome of the 1995 Conference and of the basis on which the Treaty was indefinitely extended without a vote in 1995; 3. Reiterates that the resolution on the Middle East adopted by the 1995 Review and Extension Conference of the Parties to the Treaty remains valid until its goals and objectives are achieved; 4. Calls for immediate steps towards the full implementation of that resolution; 5. Reaffirms the importance of Israel’s accession to the Treaty on the Non-Proliferation of Nuclear Weapons and placement of all its nuclear facilities under comprehensive International Atomic Energy Agency safeguards, in realizing the goal of universal adherence to the Treaty in the Middle East; 6. Calls upon that State to accede to the Treaty without further delay, not to develop, produce, test or otherwise acquire nuclear weapons, to renounce possession of nuclear weapons and to place all its unsafeguarded nuclear facilities under full- scope Agency safeguards as an important confidence-building measure among all States of the region and as a step towards enhancing peace and security; 7. Requests the Secretary-General to report to the General Assembly at its seventy-sixth session on the implementation of the present resolution; 8. Decides to include in the provisional agenda of its seventy-sixth session the item entitled “The risk of nuclear proliferation in the Middle East”. ® See resolution 50/245 and A/50/1027. 7 2010 Review Conference of the Parties to the Treaty on the Non-Proliferation of Nuclear Weapons, Final Document, vol. | (NPT/CONF.2010/50 (Vol. I)), part I, Conclusions and recommendations for follow-on actions, sect. IV. 8 See 1995 Review and Extension Conference of the Parties to the Treaty on the Non-Proliferation of Nuclear Weapons, Final Document, Part I (NPT/CONF.1995/32 (Part I) and NPT/CONF.1995/32 (Part I)/Corr.2), annex. 3/3",10/08/2020,2020_3886475,Saudi Arabia,* On behalf of the States Members of the United Nations that are members of the League of Arab States.,yes
2020,General Assembly,First Committee,Seventy-fifth session,100,Conclusion of effective international arrangements to assure non-nuclear-weapon States against the use or threat of use of nuclear weapons,"Algeria, Bangladesh, Colombia, Cuba, Egypt, Iran (Islamic Republic of), Kazakhstan, Kuwait, Nicaragua, Pakistan, Peru, Saudi Arabia, Sri Lanka, Syrian Arab Republic and Venezuela (Bolivarian Republic of)",N/A,Conclusion of effective international arrangements to assure non-nuclear-weapon States against the use or threat of use of nuclear weapons,"The General Assembly, Bearing in mind the need to allay the legitimate concern of the States of the world with regard to ensuring lasting security for their peoples, Convinced that nuclear weapons pose the greatest threat to humankind and to the survival of civilization, Noting that the renewed interest in nuclear disarmament should be translated into concrete actions for the achievement of general and complete disarmament under effective international control, Convinced that nuclear disarmament and the complete elimination of nuclear weapons are essential to remove the danger of nuclear war, Determined to abide strictly by the relevant provisions of the Charter of the United Nations on the non-use of force or threat of force, Recognizing that the independence, territorial integrity and sovereignty of non-nuclear-weapon States need to be safeguarded against the use or threat of use of force, including the use or threat of use of nuclear weapons, Considering that, until nuclear disarmament is achieved on a universal basis, it is imperative for the international community to develop effective measures and arrangements to ensure the security of non-nuclear-weapon States against the use or threat of use of nuclear weapons from any quarter, Please recycle eS 20-13154 Hi 191020 AY A TO AA Recognizing that effective measures and arrangements to assure non-nuclear- weapon States against the use or threat of use of nuclear weapons can contribute positively to the prevention of the spread of nuclear weapons, Bearing in mind paragraph 59 of the Final Document of the Tenth Special Session of the General Assembly, the first special session devoted to disarmament, ! in which it urged the nuclear-weapon States to pursue efforts to conclude, as appropriate, effective arrangements to assure non-nuclear-weapon States against the use or threat of use of nuclear weapons, and desirous of promoting the implementation of the relevant provisions of the Final Document, Recalling the relevant parts of the special report of the Committee on Disarmament” submitted to the General Assembly at its twelfth special session, the second special session devoted to disarmament,’ and of the special report of the Conference on Disarmament submitted to the Assembly at its fifteenth special session, the third special session devoted to disarmament,‘ as well as the report of the Conference on its 1992 session,” Recalling also paragraph 12 of the Declaration of the 1980s as the Second Disarmament Decade, contained in the annex to its resolution 35/46 of 3 December 1980, in which it is stated, inter alia, that all efforts should be exerted by the Committee on Disarmament urgently to negotiate with a view to reaching agreement on effective international arrangements to assure non-nuclear-weapon States against the use or threat of use of nuclear weapons, Noting the in-depth negotiations undertaken in the Conference on Disarmament and its Ad Hoc Committee on Effective International Arrangements to Assure Non-Nuclear-Weapon States against the Use or Threat of Use of Nuclear Weapons, ° with a view to reaching agreement on this question, Taking note of the proposals submitted under the item in the Conference on Disarmament, including the s of an international convention, Taking note also of the relevant decision of the Thirteenth Conference of Heads of State or Government of Non-Aligned Countries, held in Kuala Lumpur on 24 and 25 February 2003,’ which was reiterated at the Seventeenth Conference of Heads of State or Government of Non-Aligned Countries, held on Margarita Island, Bolivarian Republic of Venezuela, from 13 to 18 September 2016, as well as the relevant recommendations of the Organization of Islamic Cooperation, Taking note further of the unilateral declarations made by all the nuclear- weapon States on their policies of non-use or non-threat of use of nuclear weapons against the non-nuclear-weapon States, Noting the support expressed in the Conference on Disarmament and in the General Assembly for the elaboration of an international convention to assure non-nuclear-weapon States against the use or threat of use of nuclear weapons, as well as the difficulties pointed out in evolving a common approach acceptable to all, ' Resolution S-10/2. > The Committee on Disarmament was redesignated the Conference on Disarmament as from 7 February 1984. 3 Official Records of the General Assembly, Twelfth Special Session, Supplement No. 2 (A/S-12/2), sect. III.C. > Ibid., Forty-seventh Session, Supplement No. 27 (A/47/27), sect. ULF. ® Ibid., Forty-eighth Session, Supplement No. 27 (A/48/27), sect. IIL.E. T See A/57/759-S/2003/332, annex I. 2/3 Taking note of Security Council resolution 984 (1995) of 11 April 1995 and the views expressed on it, Recalling its relevant resolutions adopted in previous years, in particular resolutions 45/54 of 4 December 1990, 46/32 of 6 December 1991, 47/50 of 9 December 1992, 48/73 of 16 December 1993, 49/73 of 15 December 1994, 50/68 of 12 December 1995, 51/43 of 10 December 1996, 52/36 of 9 December 1997, 53/75 of 4 December 1998, 54/52 of 1 December 1999, 55/31 of 20 November 2000, 56/22 of 29 November 2001, 57/56 of 22 November 2002, 58/35 of 8 December 2003, 59/64 of 3 December 2004, 60/53 of 8 December 2005, 61/57 of 6 December 2006, 62/19 of 5 December 2007, 63/39 of 2 December 2008, 64/27 of 2 December 2009, 65/43 of 8 December 2010, 66/26 of 2 December 2011, 67/29 of 3 December 2012, 68/28 of 5 December 2013, 69/30 of 2 December 2014, 70/25 of 7 December 2015, 71/30 of 5 December 2016, 72/25 of 4 December 2017, 73/29 of 5 December 2018 and 74/31 of 12 December 2019, 1. Reaffirms the urgent need to reach an early agreement on effective international arrangements to assure non-nuclear-weapon States against the use or threat of use of nuclear weapons; 2. Notes with satisfaction that in the Conference on Disarmament there is no objection, in principle, to the idea of an international convention to assure non-nuclear-weapon States against the use or threat of use of nuclear weapons, although the difficulties with regard to evolving a common approach acceptable to all have also been pointed out; 3. Appeals to all States, especially the nuclear-weapon States, to work actively towards an early agreement on a common approach and, in particular, on a common formula that could be included in an international instrument of a legally binding character; 4. Recommends that further intensive efforts be devoted to the search for such a common approach or common formula and that the various alternative approaches, including, in particular, those considered in the Conference on Disarmament, be further explored in order to overcome the difficulties; 5. Also recommends that the Conference on Disarmament actively continue intensive negotiations with a view to reaching early agreement and concluding effective international agreements to assure the non-nuclear-weapon States against the use or threat of use of nuclear weapons, taking into account the widespread support for the conclusion of an international convention and giving consideration to any other proposals designed to secure the same objective; 6. Decides to include in the provisional agenda of its seventy-sixth session the item entitled “Conclusion of effective international arrangements to assure non-nuclear-weapon States against the use or threat of use of nuclear weapons”. 20-13154 3/3",10/07/2020,2020_3887360,Saudi Arabia,N/A,yes
2020,General Assembly,First Committee,Seventy-fifth session,103 (jj),General and complete disarmament: humanitarian consequences of nuclear weapons,"Algeria, Austria, Bahamas, Bangladesh, Brazil, Cabo Verde, Chile, Colombia, Costa Rica, Céte d’Ivoire, Democratic Republic of the Congo, Dominican Republic, Ecuador, Egypt, El Salvador, Fiji, Ghana, Guatemala, Indonesia, Ireland, Jamaica, Kazakhstan, Kiribati, Lao People’s Democratic Republic, Lebanon, Lesotho, Libya, Liechtenstein, Malawi, Malaysia, Malta, Mexico, Mongolia, Myanmar, Namibia, Nepal, New Zealand, Nicaragua, Nigeria, Peru, Philippines, Republic of Moldova, Saint Lucia, Samoa, San Marino, Saudi Arabia, Sierra Leone, Singapore, South Africa, Sudan, Sweden, Switzerland, Thailand, Tuvalu, Venezuela (Bolivarian Republic of), Viet Nam and Zimbabwe",N/A,Humanitarian consequences of nuclear weapons,"The General Assembly, Recalling its resolutions 70/47 of 7 December 2015, 71/46 of 5 December 2016, 72/30 of 4 December 2017, 73/47 of 5 December 2018 and 74/42 of 12 December 2019, Reiterating the deep concern about the catastrophic consequences of nuclear weapons, Stressing that the immense and uncontrollable destructive capability and indiscriminate nature of nuclear weapons cause unacceptable humanitarian consequences, as has been demonstrated through their past use and testing, Recalling that concern about the humanitarian consequences of nuclear weapons has been reflected in numerous United Nations resolutions, including the first resolution adopted by the General Assembly, on 24 January 1946, Recalling also that at the first special session of the General Assembly devoted to disarmament, in 1978, the Assembly stressed that nuclear weapons posed the greatest danger to mankind and to the survival of civilization, ! ' See resolution S-10/2. B Please recycle 20-13030 ali 191020 NN A Welcoming the renewed interest and resolve of the international community, together with the International Committee of the Red Cross and international humanitarian organizations, to address the catastrophic consequences of nuclear weapons, Recalling that the 2010 Review Conference of the Parties to the Treaty on the Non-Proliferation of Nuclear Weapons expressed deep concern at the catastrophic humanitarian consequences of any use of nuclear weapons,” Noting the resolution of 26 November 2011 of the Council of Delegates of the International Red Cross and Red Crescent Movement entitled “Working towards the elimination of nuclear weapons”, Recalling the joint statements on the humanitarian consequences of nuclear weapons delivered to the General Assembly and during the 2010-2015 cycle of the review of the Treaty on the Non-Proliferation of Nuclear Weapons, Welcoming the facts-based discussions on the effects of a nuclear weapon detonation that were held at the conferences on the humanitarian impact of nuclear weapons, convened by Norway, on 4 and 5 March 2013, Mexico, on 13 and 14 February 2014, and Austria, on 8 and 9 December 2014, Cognizant that a key message from experts and international organizations at those conferences was that no State or international body could address the immediate humanitarian emergency caused by a nuclear weapon detonation or provide adequate assistance to victims, Firmly believing that it is in the interest of all States to engage in discussions on the humanitarian consequences of nuclear weapons with the aim of further broadening and deepening the understanding of this matter, and welcoming civil society’s ongoing engagement, Reaffirming the role of civil society, in partnership with Governments, in raising awareness about the unacceptable humanitarian consequences of nuclear weapons, Emphasizing that the catastrophic consequences of nuclear weapons affect not only Governments but each and every citizen of our interconnected world and have deep implications for human survival, for the environment, for socioeconomic development, for our economies and for the health of future generations, 1. Stresses that it is in the interest of the very survival of humanity that nuclear weapons never be used again, under any circumstances; 2. Emphasizes that the only way to guarantee that nuclear weapons will never be used again is their total elimination; 3. Stresses that the catastrophic effects of a nuclear weapon detonation, whether by accident, miscalculation or design, cannot be adequately addressed; 4. Expresses its firm belief that awareness of the catastrophic consequences of nuclear weapons must underpin all approaches and efforts towards nuclear disarmament; 5. Calls upon all States, in their shared responsibility, to prevent the use of nuclear weapons, to prevent their vertical and horizontal proliferation and to achieve nuclear disarmament; 2 See 2010 Review Conference of the Parties to the Treaty on the Non-Proliferation of Nuclear Weapons, Final Document, vol. | (NPT/CONF.2010/50 (Vol. 1)), part I, Conclusions and recommendations for follow-on actions. 2/3 6. Urges States to exert all efforts to totally eliminate the threat of these weapons of mass destruction; 7. Decides to include in the provisional agenda of its seventy-sixth session, under the item entitled “General and complete disarmament”, the sub-item entitled “Humanitarian consequences of nuclear weapons”. 20-13030 3/3",10/06/2020,2020_3887602,Saudi Arabia,N/A,yes
