year,Council,Committee,Session,Agenda item,Agenda detail,cosponsored countries,body title number,body title detail,body text,date,file,filecountry,footnote,scanned
2020,General Assembly,N/A,Seventy-fourth session,123,Strengthening of the United Nations system,"Angola, Bahrain, Bangladesh, Brunei Darussalam, Canada, Comoros, Djibouti, Ecuador, Egypt, Equatorial Guinea, Eritrea, Gambia, Ghana, Indonesia, Iraq, Jordan, Kenya, Kuwait, Lebanon, Libya, Malaysia, Morocco, Nigeria, Oman, Palau, Saudi Arabia, Seychelles, Singapore, Sri Lanka, Sudan, Thailand, Tunisia, Uganda, United Arab Emirates, Uzbekistan and Yemen",N/A,United response against global health threats: combating COVID-19,"The General Assembly, Expressing grave concern and deep sadness at the global crisis triggered by the novel disease COVID-19 pandemic and its unprecedented negative health, economic and social impacts on the international community, Acknowledging that the unprecedented COVID-19 pandemic is a powerful reminder of our interconnectedness and vulnerabilities, as the virus respects no borders, and that combating this pandemic calls for an open, transparent, robust, coordinated, large-scale, science-based and inclusive global response in the spirit of solidarity, Noting the importance of utilizing all available policy tools to safeguard the global economy, financial markets, trade and global supply chains in order to minimize the economic damage from the pandemic, restore global growth and maintain market stability, Recognizing the essential role of the United Nations as the body that can effectively bring together a global response to control and contain the spread of COVID-19 and address the critical interlinkages between health, trade, finance and economic and social development, and acknowledging that the disease will negatively impact endeavours aimed at achieving the Sustainable Development Goals by 2030, Recognizing also the great effort undertaken by people around the world to follow the measures recommended by the World Health Organization and national authorities in order to control and fight the spread of the pandemic, Expressing deep concern about the serious risks posed to all countries, in particular developing and least developed countries, and notably African countries and small island developing States, where health systems and economies may be less Oe ar Please recycle OO ol 20-05609 il 160420 AY A AA A A A/7A/L.57 able to cope with the challenge, as well as the particular risk faced by refugees and displaced persons, Commending the United Nations for its recommitment to the timely implementation of the 2030 Agenda for Sustainable Development ! and its determination to lead a recovery that is inclusive and sustainable, Emphasizing the urgent need for initiatives, on a voluntary basis, that focus on preventing threats from emerging pandemics and on building an effective global defence against outbreaks of deadly infectious diseases should such threats emerge, Welcoming the initiative taken by the Secretary-General, noting the initiatives by the International Monetary Fund and the World Bank Group, and acknowledging the role of the World Health Organization, Recalling the high-level meeting on universal health coverage, held in New York on 23 September 2019, and reaffirming its political declaration, entitled “Universal health coverage: moving together to build a healthier world”? as a means of strengthening health systems, and recalling also its resolution 74/270 of 2 April 2020, entitled “Global solidarity to fight the coronavirus disease 2019 (COVID-19)”, Expressing profound gratitude to all front-line health-care workers as the fight against the pandemic continues, and emphasizing the importance of providing them with the necessary protection and support, Welcoming the outcomes of the virtual Extraordinary Summit of the Group of 20, chaired by the Kingdom of Saudi Arabia, President of the Group for 2020, on 26 March 2020, and the call therein for effective and coordinated action to fight this global health crisis, 1. Calls for intensified international cooperation and multilateral efforts in handling disease outbreaks, including by sharing timely, accurate and transparent information, exchanging epidemiological and clinical data, sharing materials necessary for research and development, and implementing the International Health Regulations (IHR 2005)? and relevant guidance; 2. Emphasizes the need for the United Nations system, as well as relevant regional and international organizations and financial institutions, to collaborate in order to ensure that the adverse social, economic, humanitarian and financial impacts of COVID-19 are addressed in a timely and non-discriminatory manner; 3. Also emphasizes the need for full respect for human rights, and stresses further that there is no place for any form of discrimination, racism and xenophobia in the response to the pandemic; 4. Stresses the necessity of urgent short-term actions to step up the global efforts to fight global health crises and pandemics and maintain economic stability, including by taking the following steps: (a) Swift delivery of medical supplies, especially diagnostic tools, treatments, medicines and vaccines; (b) Increasing research and development funding for vaccines and medicines, leveraging digital technologies and strengthening scientific international cooperation; ' Resolution 70/1. ? Resolution 74/2. 3 World Health Organization, document WHA58/2005/REC/1, resolution 58.3, annex. 2/3 (c) Expanding manufacturing capacity to meet the increasing needs for medical supplies and ensuring that these are made widely available, at an affordable price, on an equitable basis, where they are most needed and as quickly as possible; (d) Engaging with the front-line international organizations, notably the United Nations, the World Health Organization, the International Monetary Fund, the World Bank Group and multilateral and regional development banks, to deploy robust, coherent, coordinated and rapid financial packages to strengthen global financial safety nets; 5. Reaffirms the necessity to support economies, protect workers, businesses, especially micro-, small and medium-sized enterprises, and the sectors most affected, and shield the vulnerable through adequate social protection, and in this context welcomes the statement by the leaders of the Group of 20 on injecting 5 trillion United States dollars into the global economy, as part of targeted fiscal policy, economic measures and guarantee schemes to counteract the social, economic and financial impacts of the pandemic; 6. Calls upon the international community, regional and international organizations and relevant stakeholders to give high priority to people, particularly the elderly, women and girls, displaced persons and refugees and persons with disabilities, and areas that are most vulnerable, particularly developing and least developed countries, in order to mitigate any drawback towards achieving the Sustainable Development Goals, and highlights the need to address risks of debt vulnerabilities in developing countries, including least developed countries, landlocked developing countries, small island developing States and African countries, as well as middle-income countries, due to the pandemic; 7. Calls upon Member States to enhance coordination on public health and financial measures as well as cooperation at the national, regional and international levels to confront and combat this pandemic; 8. Stresses the need to give appropriate consideration to the issue of halting and reversing the global threats posed by epidemics through the implementation of the 2030 Agenda for Sustainable Development;! 9. Urges Member States, in conjunction with the United Nations, the World Health Organization, the International Monetary Fund, the World Bank Group and other regional and international organizations, working within their existing mandates, to embark on sustainable pandemic preparedness, response and recovery planning, taking into account strengthening the capacity of health sector institutions in developing countries; 10. Requests the Secretary-General to mobilize the United Nations system in support of global action towards sustainable recovery, including through the work of the United Nations resident coordinators and United Nations country teams, especially in the most vulnerable countries; 11. Decides to remain seized of the matter, and requests the Secretary-General to coordinate and follow up on the various relevant initiatives and to report to the General Assembly on the implementation of the present resolution in a timely manner. 20-05609 3/3",04/14/2020,2020_3856786,Saudi Arabia,N/A,yes
2020,General Assembly,N/A,Seventy-fourth session,123,Strengthening of the United Nations system,"Andorra, Angola, Antigua and Barbuda, Argentina, Armenia, Azerbaijan, Barbados, Belize, Bosnia and Herzegovina, Canada, Central African Republic, Costa Rica, Cote d’Ivoire, Djibouti, Dominican Republic, Ecuador, El Salvador, Equatorial Guinea, Fiji, Gambia, Georgia, Ghana, Grenada, Guatemala, Guyana, Honduras, Iraq, Jamaica, Jordan, Kazakhstan, Kenya, Lebanon, Lesotho, Libya, Liechtenstein, Madagascar, Malawi, Maldives, Mauritius, Mexico, Micronesia (Federated States of), Morocco, Namibia, Nepal, Niger, Nigeria, Norway, Palau, Panama, Papua New Guinea, Paraguay, Peru, Republic of Korea, Rwanda, Saint Lucia, Saint Vincent and the Grenadines, Samoa, Senegal, Seychelles, Singapore, Sri Lanka, Sudan, Suriname, Tajikistan, Thailand, Timor-Leste, Trinidad and Tobago, Turkey, Turkmenistan, Ukraine, United Republic of Tanzania, Uruguay, Vanuatu, Viet Nam and Zimbabwe",N/A,"International cooperation to ensure global access to medicines, vaccines and medical equipment to face COVID-19","Addendum Add the following countries to the list of sponsors of the resolution: Afghanistan, Albania, Algeria, Austria, Bahamas, Bahrain, Bangladesh, Belarus, Belgium, Benin, Bhutan, Bolivia (Plurinational State of), Botswana, Brunei Darussalam, Bulgaria, Burkina Faso, Burundi, Cabo Verde, Cambodia, Cameroon, Chad, Chile, China, Colombia, Comoros, Congo, Croatia, Cuba, Cyprus, Czechia, Denmark, Dominica, Egypt, Eritrea, Estonia, Eswatini, Ethiopia, Finland, France, Germany, Greece, Guinea, Guinea-Bissau, Haiti, Iceland, India, Indonesia, Ireland, Israel, Italy, Japan, Kiribati, Kuwait, Kyrgyzstan, Lao People’s Democratic Republic, Latvia, Liberia, Lithuania, Luxembourg, Malaysia, Mali, Malta, Marshall Islands, Mauritania, Monaco, Mongolia, Montenegro, Mozambique, Myanmar, Nauru, Netherlands, New Zealand, Nicaragua, North Macedonia, Oman, Philippines, Poland, Portugal, Qatar, Republic of Moldova, Saint Kitts and Nevis, San Marino, Sao Tome and Principe, Saudi Arabia, Serbia, Sierra Leone, Slovakia, Solomon Islands, South Africa, South Sudan, Spain, Sweden, Switzerland, Syrian Arab Republic, Togo, Tonga, Tunisia, Tuvalu, Uganda, United Arab Emirates, United Kingdom of Great Britain and Northern Ireland, Uzbekistan, Yemen and Zambia Please recycle 20-05879 ii 230420 AY A A AA A",04/20/2020,2020_3858644,Saudi Arabia,N/A,yes
2020,General Assembly,Commission On Human Rights,Forty-fourth session,3,"Promotion and protection of all human rights, civil, political, economic, social and cultural rights, including the right to development",Pakistan and Saudi Arabia*,N/A,44/...Elimination of all forms of discrimination against women and girls,"Paragraph 9 should read 9. Calls upon States to take a human rights-based, gender-responsive and intersectional approach in their responses to the COVID-19 pandemic, and to pay special attention to women and girls, in particular those in vulnerable situations, and their specific needs, including protection from xenophobia, social stigma, sexual and gender-based violence, and domestic violence; equal access to livelihood and socioeconomic opportunities, health-care services, including testing, treatment and vaccines, timely, adequate and accurate information about the pandemic; the ability to maintain social distancing; and access to testing and treatment, and to other necessities, including food, education, adequate housing, safe drinking water and sanitation, and essential health-care services; GE.20-09529(E) Please recycle eS",07/15/2020,2020_3872960,Saudi Arabia,* State not a member of the Human Rights Council. *2009529%,yes
2020,General Assembly,Commission On Human Rights,Forty-fifth session,10,Technical assistance and capacity-building,"Bahrain, Egypt,* Kuwait,* Mauritania, Saudi Arabia,* Somalia, Sudan, Tunisia,* United Arab Emirates,* Yemen* and State of Palestine*",N/A,45/.... Technical assistance and capacity-building for Yemen in the field of human rights,"The Human Rights Council, Guided by the purposes and principles of the Charter of the United Nations and the provisions of the Universal Declaration of Human Rights, and recalling relevant international human rights treaties, Recognizing the primary responsibility of States to promote and protect human rights, Reaffirming its strong commitment to the sovereignty, independence, unity and territorial integrity of Yemen, Recalling Security Council resolutions 2014 (2011) of 21 October 2011, 2051 (2012) of 12 June 2012 and 2140 (2014) of 26 February 2014, and Human Rights Council resolutions 18/19 of 29 September 2011, 19/29 of 23 March 2012, 21/22 of 27 September 2012, 24/32 of 27 September 2013, 27/19 of 25 September 2014, 30/18 of 2 October 2015, 33/16 of 29 September 2016, 36/31 of 29 September 2017, 39/23 of 28 September 2018 and 42/31 of 27 September 2019, Emphasizing Security Council resolutions 2216 (2015) of 14 April 2015 and 2451 (2018) of 21 December 2018, Welcoming the Stockholm Agreement, accepted by the Government of Yemen and the Houthis, for a ceasefire in Hudaydah city, and the mutual redeployment of the forces from the ports of Hudaydah, Salif and Ra’s Isa, thereby establishing a mechanism for activating the exchange of prisoners, lifting the siege of the city of Ta’izz and facilitating the delivery of humanitarian aid, Reiterating its strong support for the efforts of the Secretary-General and the Special Envoy of the Secretary-General for Yemen, and recalling the need for all parties to the conflict to react in a flexible and constructive manner and without preconditions to these efforts, and to fully and immediately implement all provisions of relevant Security Council resolutions, while welcoming in this regard the positive engagement of the Government of Yemen, GE.20-12608(E) Please recycle eS A/HRC/45/L.51 Recognizing that the promotion, protection and fulfilment of human rights are essential factors in ensuring a fair and equal justice system and, ultimately, reconciliation and stability for Yemen, Welcoming the acceptance by Yemeni political parties to complete the political transition process on the basis of the Gulf Cooperation Council initiative and _ its implementation mechanism, and emphasizing the need for the fulfilment of the recommendations made in the outcome document of the National Dialogue Conference, including the completion of the ing of a new constitution, Taking note with appreciation of Presidential Decree No. 30 of 22 August 2019, in which the mandate of the National Commission of Inquiry was extended for a period of two years with a view to investigating all human rights violations since 2011, Welcoming the Riyadh Agreement signed by the Government of Yemen and the Southern Transitional Council, and encouraging the speedy and full implementation of the Agreement as an important step towards a political solution in Yemen, Aware of reports by the Office for the Coordination of Humanitarian Affairs indicating that the existing humanitarian emergency affects the enjoyment of fundamental human rights, including social and economic rights, and that the parties to the conflict must facilitate the rapid, safe and unhindered delivery of humanitarian aid, 1. Takes note of the report of the United Nations High Commissioner for Human Rights on technical assistance and capacity-building in Yemen;! 2. Notes the comments made by the Government of Yemen on the report of the High Commissioner during the present session; 3. Welcomes the cooperation between the Government of Yemen and the Office of the High Commissioner and other relevant United Nations bodies and mechanisms; 4. Takes note of the eighth report of the National Commission of Inquiry; 5. Notes the work carried out by the Joint Incident Assessment Team; 6. Calls upon all parties to immediately implement the Stockholm Agreement in order to begin negotiations for a comprehensive political solution to the current crisis in Yemen; 7. Expresses deep concern at the serious human rights abuses and violations of international human rights law and international humanitarian law in Yemen committed by all parties to the conflict, including those involving sexual and gender-based violence, the continued recruitment of children, contrary to international treaties, the abduction of political activists, the violations against journalists, the killing of civilians, the prevention of access for relief and humanitarian aid, persecution on the basis of religion or belief, the cutting of electricity and water supplies and attacks against hospitals and ambulances; 8. Calls upon all parties to the conflict in Yemen to respect their obligations under international human rights law and international humanitarian law, to stop immediately attacks on civilians, including those delivering medical supplies and aid workers, and to facilitate rapid, safe and unhindered humanitarian access to the affected population nationwide; 9. Expresses deep concern at all attacks against civilian objects, in violation of international humanitarian law, and recalls the obligations by all parties to the conflict to take all precautions necessary to avoid and in any event to minimize harm to civilians and civilian objects, such as schools, markets and medical facilities, and the prohibition on attacking or destroying infrastructure and provisions that are indispensable to the survival of the civilian population, including water installations, supplies and foodstuffs; 10. Urges the Government of Yemen to take measures to protect civilians and to take appropriate measures with a view to ending impunity for all cases involving violations ' A/ARC/45/57. A/HRC/45/L.51 and abuses of human rights and international humanitarian law, and violence against journalists and the detention of journalists and political activists; 11. Requests all parties to the conflict in Yemen to implement fully Security Council resolution 2216 (2015), which will contribute to an improvement in the situation of human rights, and encourages all parties to the conflict to reach a comprehensive agreement to end the conflict while ensuring that women are part of the political and peacemaking process; 12. Demands that all parties to the conflict end the recruitment and use of children and release those who have already been recruited, and calls upon all parties to the conflict to cooperate with the United Nations for their reintegration into their communities; 13. Reiterates the commitments and obligations of the Government of Yemen to ensure respect for the promotion and protection of the human rights of all individuals within its territory and subject to its jurisdiction, and in that connection recalls that Yemen is a party to the International Convention on the Elimination of All Forms of Racial Discrimination, the Convention on the Elimination of All Forms of Discrimination against Women, the International Covenant on Civil and Political Rights, the International Covenant on Economic, Social and Cultural Rights, the Convention against Torture and Other Cruel, Inhuman or Degrading Treatment or Punishment, the Convention on the Rights of the Child and the Optional Protocols thereto on the involvement of children in armed conflict and on the sale of children, child prostitution and child pornography, the Convention on the Rights of Persons with Disabilities and the Convention relating to the Status of Refugees and the Protocol thereto, and looks forward to the Government continuing its efforts to promote and protect human rights; 14. Expresses deep concern at the deteriorating humanitarian situation in Yemen, which is further exacerbated by the spread of the coronavirus disease (COVID-19), and expresses its appreciation to donor States and organizations working on improving that situation and for their commitment to provide financial support for the United Nations Yemen humanitarian response plan for 2020 and to fulfil their pledges to the relevant United Nations humanitarian appeal; 15. Reaffirms the responsibilities of all parties to the conflict to facilitate the immediate, safe and unhindered delivery of humanitarian assistance to all those who are in need, in accordance with the principles of international human rights law and international humanitarian law; 16. ‘Invites all bodies of the United Nations system, including the Office of the United Nations High Commissioner for Human Rights, and Member States to assist the transitional process in Yemen, including by supporting the mobilization of resources to tackle the consequences of the violence and the economic and social challenges faced by Yemen, in coordination with the international donor community and according to the priorities set by the Yemeni authorities; 17. | Requests the High Commissioner to continue to provide substantive capacity- building and technical assistance to the Government of Yemen and technical support to the National Commission of Inquiry to ensure that the National Commission continues to investigate allegations of violations and abuses committed by all parties to the conflict in Yemen, and in line with international standards, and submits its comprehensive report on alleged human rights violations and abuses in all parts of Yemen, in accordance with Presidential Decree No. 30 of 22 August 2019, as soon as it is available, and encourages all parties to the conflict in Yemen to extend full and transparent access and cooperation to the National Commission; 18. Also requests the High Commissioner to present a written report on the implementation of technical assistance, as stipulated in the present resolution, to the Human Rights Council at its forty-eighth session.",10/01/2020,2020_3885725,Saudi Arabia,* State not a member of the Human Rights Council. *2012608*,yes
