year,Council,Committee,Session,Agenda item,Agenda detail,cosponsored countries,body title number,body title detail,body text,date,file,filecountry,footnote,scanned
2016,General Assembly,N/A,Seventieth session,13,Improving global road safety,"Albania, Argentina, Belarus, Cabo Verde, Croatia, Israel, Italy, Kyrgyzstan, Mexico, Mozambique, Myanmar, Oman, Russian Federation, Singapore, Slovakia, Syrian Arab Republic and Viet Nam",N/A,Improving global road safety,"Addendum Add the following countries to the list of sponsors of the resolution: Andorra, Belgium, Bosnia and Herzegovina, Brazil, Bulgaria, Cameroon, Canada, Cyprus, Czech Republic, Denmark, Finland, France, Germany, Greece, Guyana, Hungary, Iceland, India, Japan, Lebanon, Luxembourg, Monaco, Montenegro, Morocco, Netherlands, Nicaragua, Poland, Portugal, Qatar, San Marino, Serbia, Slovenia, Spain, Sweden, the former Yugoslav Republic of Macedonia, Turkmenistan, United Arab Emirates, United States of America and Uruguay - Fs a Pre ma : f rue! oT: a Pap pat aE Please reeyele OS) zee a 16-06310 Hl 190416 CAA A A",04/18/2016,2016_826765,Serbia,N/A,yes
2016,General Assembly,N/A,Seventieth session,78,Report of the International Criminal Court,"Albania, Andorra, Argentina, Australia, Austria, Belgium, Bosnia and Herzegovina, Brazil, Bulgaria, Canada, Central African Republic, Chile, Colombia, Costa Rica, Croatia, Cyprus, Czech Republic, Democratic Republic of the Congo, Denmark, Ecuador, El Salvador, Estonia, Finland, France, Georgia, Germany, Guatemala, Hungary, Iceland, Ireland, Italy, Japan, Jordan, Latvia, Liechtenstein, Lithuania, Luxembourg, Mexico, Netherlands, New Zealand, Nigeria, Norway, Paraguay, Peru, Poland, Portugal, Republic of Korea, Romania, Samoa, San Marino, Senegal, Serbia, Slovakia, Slovenia, Spain, Sweden, Switzerland, the former Yugoslav Republic of Macedonia, Trinidad and Tobago, United Kingdom of Great Britain and Northern Ireland, Uruguay and Venezuela (Bolivarian Republic of)",N/A,Report of the International Criminal Court,"The General Assembly, Recalling its resolution 69/279 of 8 May 2015 and all its previous relevant resolutions, Recalling also that the Rome Statute of the International Criminal Court! reaffirms the purposes and principles of the Charter of the United Nations, Recognizing the International Criminal Court as an independent permanent judicial institution and, in this regard, that the United Nations and the Court respect each other’s status and mandate, Reiterating the historic significance of the adoption of the Rome Statute, Emphasizing that justice, especially transitional justice in conflict and post- conflict societies, is a fundamental building block of sustainable peace, Convinced that ending impunity is essential for coming to terms with any past crimes committed and preventing such crimes in the future, Acknowledging the fact that the International Criminal Court has achieved considerable progress in its investigations and judicial proceedings in various ' United Nations, Treaty Series, vol. 2187, No. 38544. fo eke a “a iy a. Please reeyele OS) fel =a 16-07583 TT 110516 CA AA situations and cases which were referred to it by States parties to the Rome Statute and by the Security Council, and which the Prosecutor of the Court has initiated proprio motu, in accordance with the Rome Statute, Recalling that effective and comprehensive cooperation and assistance in all aspects of its mandate by States, the United Nations and other international and regional organizations remain essential for the International Criminal Court to carry out its activities, Expressing its appreciation to the Secretary-General for providing effective and efficient assistance to the International Criminal Court in accordance with the Relationship Agreement between the United Nations and the International Criminal Court,” Acknowledging the Relationship Agreement as approved by the General Assembly in its resolution 58/318 of 13 September 2004, including paragraph 3 of the resolution, with respect to the payment in full of expenses accruing to the United Nations as a result of the implementation of the Relationship Agreement,* which provides a framework for continued cooperation between the International Criminal Court and the United Nations, which enables, inter alia, facilitation by the United Nations of the Court’s field activities, and encouraging the conclusion of supplementary arrangements and agreements, as necessary, Noting the need for funding of expenses related to investigations or prosecutions of the International Criminal Court, including in connection with situations referred to the Court by the Security Council, Welcoming the continuous support given by civil society to the International Criminal Court, Stressing the importance that the Rome Statute accords to the rights and needs of victims, in particular their right to participate in judicial proceedings and to claim reparations, and emphasizing the importance of informing and involving victims and affected communities in order to give effect to the mandate of the International Criminal Court towards victims, 1. Welcomes the report of the International Criminal Court for 2014/15;* 2. Also welcomes the States that have become parties to the Rome Statute of the International Criminal Court,' and calls upon all States in all regions of the world that are not yet parties to the Rome Statute to consider ratifying, accepting, approving or acceding to it without delay; 3. Further welcomes the States parties as well as States not parties to the Rome Statute that are parties to the Agreement on the Privileges and Immunities of the International Criminal Court,’ and calls upon all States that have not yet done so to consider becoming parties to that Agreement; 4. Notes the recent ratifications and acceptances of the amendments adopted at the Review Conference of the Rome Statute, held in Kampala from 31 May to 11 June 2010; > A/58/874 and Add.1. ? Articles 10 and 13 of the Relationship Agreement. > United Nations, Treaty Series, vol. 2271, No. 40446. 2/5 5. | Underlines, bearing in mind that in accordance with the Rome Statute the International Criminal Court is complementary to national criminal jurisdictions, that States need to adopt appropriate measures within their national legal systems for those crimes for which they are required under international law to exercise their responsibility to investigate and prosecute; 6. Encourages further efforts by the United Nations, other international and regional organizations and States, as well as civil society, to appropriately assist States, upon their request, in strengthening their domestic capacity to investigate and prosecute crimes, and in this regard underlines the importance of national ownership; 7. Emphasizes the importance of international cooperation and judicial assistance in conducting effective investigations and prosecutions; 8. Acknowledges the role of the International Criminal Court in a multilateral system that aims to end impunity, promote the rule of law, promote and encourage respect for human rights, achieve sustainable peace and further the development of nations, in accordance with international law and the purposes and principles of the Charter of the United Nations; 9. Calls upon States parties to the Rome Statute that have not yet done so to adopt national legislation to implement obligations emanating from the Rome Statute and to cooperate with the International Criminal Court in the exercise of its functions, and recalls the provision of technical assistance by States parties in this respect; 10. Welcomes the cooperation and assistance provided thus far to the International Criminal Court by States parties as well as States not parties, the United Nations and other international and regional organizations, and calls upon those States that are under an obligation to cooperate to provide such cooperation and assistance in the future, in particular with regard to arrest and surrender, the provision of evidence, the protection and relocation of victims and witnesses and the enforcement of sentences; 11. Notes the efforts of the Secretary-General in promoting cooperation between the United Nations and the International Criminal Court in accordance with the Relationship Agreement between the United Nations and the International Criminal Court,’ and also notes in this regard that the Office of Legal Affairs of the Secretariat has a specific role within the United Nations; 12. Recalls article 3 of the Relationship Agreement according to which, with a view to facilitating the effective discharge of their respective responsibilities, the United Nations and the International Criminal Court shall cooperate closely, whenever appropriate, with each other and consult each other on matters of mutual interest pursuant to the provisions of the Relationship Agreement and in conformity with the respective provisions of the Charter and the Rome Statute, and shall respect each other’s status and mandate,° and requests the Secretary-General to continue to include information relevant to the implementation of article 3 of the Relationship Agreement in a report to be submitted to the General Assembly at its seventy-first session; ° Article 2, paragraph 3, of the Relationship Agreement. 3/5 13. Recalls the guidance issued by the Secretary-General on contacts with persons who are the subject of arrest warrants or summonses issued by the International Criminal Court,’ and in this regard takes note of the information included in the report of the Secretary-General on the implementation of article 3 of the Relationship Agreement;* 14. Recalls the Relationship Agreement, and notes that expenses related to investigations or prosecutions incurred by the International Criminal Court in connection with situations referred by the Security Council or otherwise continue to be borne exclusively by States parties to the Rome Statute; 15. Emphasizes the importance of cooperation with States that are not parties to the Rome Statute; 16. Invites regional organizations to consider concluding cooperation agreements with the International Criminal Court; 17. Recalls that, by virtue of article 12, paragraph 3, of the Rome Statute, if the acceptance of a State which is not a party to the Rome Statute is required under article 12, paragraph 2, of the Rome Statute, that State may, by declaration lodged with the Registrar of the International Criminal Court, accept the exercise of jurisdiction by the Court with respect to the crime in question; 18. Urges all States parties to take the interests, needs for assistance and mandate of the International Criminal Court into account when relevant matters are being discussed in the United Nations, and invites all other States to consider doing the same, as appropriate; 19. Emphasizes the importance of the full implementation of all aspects of the Relationship Agreement, which forms a framework for close cooperation between the two organizations and for consultation on matters of mutual interest pursuant to the provisions of that Agreement and in conformity with the respective provisions of the Charter and the Rome Statute, as well as the need for the Secretary-General to continue to inform the General Assembly at its seventy-first session of the expenses incurred and reimbursements received by the United Nations in connection with assistance provided to the International Criminal Court; 20. Encourages further dialogue between the United Nations and the International Criminal Court, and welcomes in this regard the increased interaction of the Security Council with the Court under various formats, including the holding of open debates on peace and justice and working methods, with a special focus on the role of the Court; 21. Continues to welcome the statement by the President of the Security Council of 12 February 2013° in which the Council reiterated its previous call regarding the importance of State cooperation with the International Criminal Court in accordance with the respective obligations of States, and expressed its commitment to effective follow-up of Council decisions in this regard; ° S/PRST/2013/2; see Resolutions and Decisions of the Security Council, 1 August 2012-31 July 2013. 4/5 22. Expresses its appreciation for the work undertaken by the International Criminal Court liaison office to United Nations Headquarters, and encourages the Secretary-General to continue to work closely with that office; 23. Encourages States to contribute to the Trust Fund established for the benefit of victims of crimes within the jurisdiction of the International Criminal Court and the families of such victims, and acknowledges with appreciation contributions made to that Trust Fund thus far; 24. Recalls that, at the Review Conference of the Rome Statute of the International Criminal Court, which was convened and opened by the Secretary- General, States parties reaffirmed their commitment to the Rome Statute and its full implementation, as well as its universality and integrity, and that the Review Conference undertook a stocktaking exercise of international criminal justice, considering the impact of the Rome Statute on victims and affected communities, peace and justice, complementarity and cooperation, called for the strengthening of the enforcement of sentences, adopted amendments to the Rome Statute to expand the jurisdiction of the Court to cover three additional war crimes when committed in armed conflicts not of an international character, and adopted amendments to the Rome Statute to define the crime of aggression and to establish conditions under which the Court could exercise jurisdiction with respect to that crime; 25. Acknowledges the report of the Secretary-General on the work of the Organization; '° 26. Takes note of the decision of the Assembly of States Parties to the Rome Statute of the International Criminal Court at its fourteenth session, while recalling that, according to article 112, paragraph 6, of the Rome Statute, the Assembly of States Parties shall meet at the seat of the Court or at United Nations Headquarters, to hold its fifteenth session at The Hague, looks forward to the fifteenth session, which is to be held from 16 to 24 November 2016, and requests the Secretary- General to provide the necessary services and facilities in accordance with the Relationship Agreement and resolution 58/318; 27. Encourages the widest possible participation of States in the Assembly of States Parties, invites States to contribute to the Trust Fund for the participation of least developed countries, and acknowledges with appreciation contributions made to that Trust Fund thus far; 28. Invites the International Criminal Court to submit, if it deems it appropriate, in accordance with article 6 of the Relationship Agreement, a report on its activities for 2015/16, for consideration by the General Assembly at its seventy- first session. ' Official Records of the General Assembly, Seventieth Session, Supplement No. 1 (A/70/1). 5/5",05/10/2016,2016_828871,Serbia,* 4/70/350. * 4/70/3117.,yes
2016,General Assembly,N/A,Seventieth session,20,Sustainable development,"Afghanistan, Angola, Antigua and Barbuda, Australia, Azerbaijan, Bahamas, Bangladesh, Cabo Verde, Canada, Chile, Costa Rica, Cuba, Denmark, Dominican Republic, Ecuador, Fiji, Georgia, India, Ireland, Israel, Italy, Japan, Kazakhstan, Kiribati, Marshall Islands, Mauritius, Mexico, Monaco, Morocco, Myanmar, Nauru, Netherlands, New Zealand, Nicaragua, Palau, Papua New Guinea, Peru, Samoa, Singapore, Slovenia, Solomon Islands, Spain, Sri Lanka, Suriname, Sweden, Thailand, Tonga, Turkey, Tuvalu, Uganda, United Arab Emirates, Vanuatu and Zimbabwe",N/A,International Day of the Tropics,"Addendum Add the following countries to the list of sponsors of the resolution: Argentina, Belize, Benin, Bosnia and Herzegovina, Brazil, Brunei Darussalam, Cameroon, Cyprus, Greece, Guyana, Haiti, Maldives, Micronesia (Federated States of), Montenegro, Panama, San Marino, Senegal, Serbia, Timor-Leste, Trinidad and Tobago and United Kingdom of Great Britain and Northern Ireland Please recycle 16-09893 Hin 160616 CN A A",06/14/2016,2016_832145,Serbia,N/A,yes
2016,General Assembly,Commission On Human Rights,Thirty-first session,3,"Promotion and protection of all human rights, civil, political, economic, social and cultural rights, including the right to development","Albania, Angola,* Argentina, Australia,* Austria,* Azerbaijan,* Belgium, Bosnia and Herzegovina,* Botswana, Bulgaria,* Canada,* Chile,* Colombia,* Congo, Croatia,* Cyprus,* Czech Republic,* Denmark,* Djibouti,* Estonia,* Ethiopia, Fiji,* Finland,* France, Georgia, Germany, Greece,* Honduras,* Hungary,* Iceland,* Ireland,* Israel,* Italy,* Latvia, Lebanon,* Libya,* Liechtenstein,* Lithuania,* Luxembourg,* Malta,* Mexico, Montenegro,* Namibia, Netherlands, New Zealand,* Norway,* Panama, Paraguay, Peru,* Philippines, Poland,* Portugal, Republic of Korea, Republic of Moldova,* Romania,* Senegal,* Serbia,* Slovakia,* Slovenia, South Africa, Spain,* Sudan,* Sweden,* Thailand,* the former Yugoslav Republic of Macedonia, Togo, Tunisia,* Turkey,* Ukraine,* United Kingdom of Great Britain and Northern Ireland, United States of America,* Uruguay,* Yemen:*",N/A,31/... The role of good governance in the promotion and protection of human rights,"The Human Rights Council, Guided by the Universal Declaration of Human Rights as a common standard of achievement of all peoples and all nations, and also the Vienna Declaration and Programme of Action, which affirmed that all human rights are universal, indivisible, interdependent and interrelated, Recalling Human Rights Council resolutions 7/11 of 27 March 2008, 19/20 of 23 March 2012, and 25/8 of 27 March 2014, and all other resolutions relevant to the role of good governance in the promotion of human rights, as well as the United Nations Millennium Declaration, Welcoming the resolve of States parties to the United Nations Convention against Corruption, and the commitment made by all States in the 2005 World Summit Outcome to make the fight against corruption a priority at all levels, and noting with interest the “ Non-member State of the Human Rights Council. a ate ah net Please recycle cE a 1 | Ol = i GE.16-04390(E) CAA AA A/HRC/31/L.19 provisions of the Convention that have led to the development of a mechanism among States parties to review their progress in combating corruption, Noting the ongoing work by several important initiatives towards the deepening of good governance practices at the national, regional and international levels, Recognizing the importance of a conducive environment, at both the national and international levels, for the full enjoyment of human rights and fundamental freedoms and of the mutually reinforcing relationship between good governance and human rights, Recognizing also that transparent, responsible, accountable, open and participatory government, responsive to the needs and aspirations of the people, is the foundation on which good governance rests, and that such a foundation is one of the indispensable conditions for the full realization of human rights, including the right to development, Stressing that good governance at the national and international levels is essential for sustained economic growth, sustainable development and the eradication of poverty and hunger, and in this context reaffirming the Millennium Declaration, the 2005 World Summit Outcome, the outcome of the 2010 High-level Summit on the Millennium Development Goals and the 2030 Agenda for Sustainable Development, ' Recognizing the increasing awareness in the international community of the detrimental impact of widespread corruption on human rights through both the weakening of institutions and the erosion of public trust in government, as well as through the impairment of the ability of Governments to fulfil all their human rights obligations, Acknowledging that good governance has a central role in the promotion and protection of human rights, and in preventing and combating corruption at all levels, Realizing that the fight against corruption at all levels plays an important role in the promotion and protection of human rights and in the process of creating an environment conducive to their full enjoyment, Recognizing that effective anti-corruption measures and the protection of human rights, including by strengthening transparency and accountability in government, are mutually reinforcing, Noting with interest the outcomes of the third, fourth, fifth and sixth sessions of the Conference of the States Parties to the United Nations Convention against Corruption, held in Doha in 2009, in Marrakech, Morocco, in 2011, in Panama City, in 2013, and in Saint Petersburg, Russian Federation, in 2015, Stressing the importance of policy coherence and coordination in intergovernmental processes in the area of the promotion and protection of human rights, on the one hand, and of anti-corruption initiatives, on the other, Stressing also the importance of developing and implementing national legislation on the promotion of access to information and of strengthening the administration of justice, transparency, accountability and good governance at all levels, Reaffirming the right of every citizen to have access, in general terms of equality, to public service in his or her country as enshrined in article 21 of the Universal Declaration of Human Rights and article 25 (c) of the International Covenant on Civil and Political Rights, ' General Assembly resolution 70/1. A/HRC/31/L.19 Recognizing that a professional, accountable and transparent public service upholding the highest standards of efficiency, competence and integrity is one of the essential components of good governance, Recognizing also that the knowledge, training and awareness of public servants, as well as the promotion of a human rights culture within the public service, play a vital role in promoting respect for and the realization of human rights in society, Welcoming the contribution of the United Nations Public Service Awards programme, which recognizes excellence in public service to the promotion of the role, professionalism and visibility of public service, and noting its review to align it with the 2030 Agenda for Sustainable Development, Welcoming also the 2030 Agenda for Sustainable Development, including its recognition of the need to build peaceful, just and inclusive societies that provide equal access to justice and that are based on respect for human rights, including the right to development, on effective rule of law and good governance at all levels, and on transparent, effective and accountable institutions, Taking into account the ongoing work of the United Nations system and other relevant international and regional organizations relating to the role of good governance in the promotion and protection of human rights, 1. Welcomes the holding by the Human Rights Council, at its thirtieth session, of a panel discussion on a human rights-based approach to good governance in the public service;7 2. Also welcomes the publication by the United Nations High Commissioner for Human Rights of the summary report on the panel discussion on a human rights-based approach to good governance in the public service;* 3. Further welcomes the growing trend towards the universal ratification of the United Nations Convention against Corruption, and encourages States that have not yet ratified this important international instrument to consider doing so; 4. Welcomes the commitments made by all States in the 2030 Agenda for Sustainable Development with regard to good governance in the promotion and protection of human rights, including in Sustainable Development Goal 16; 5. Underlines that the primary responsibility lies with States at the national level, including through their constitutional provisions and other enabling legislation, consistent with their international obligations, to ensure that professional public services uphold the highest standards of efficiency, competence and integrity, and are predicated on good governance principles, including impartiality, rule of law, transparency, accountability and combating corruption, and stresses the importance of human rights training and education in this regard; 6. Invites the Secretary-General to ensure the upholding of the integrity of the United Nations system in its service of humanity, and improved coordination between United Nations agencies, programmes and funds, with a view to ensuring that the United Nations system continues to improve the quality of its work at all levels, including in support of objectives and priorities at the national level; > See A/HRC/31/28. A/HRC/31/L.19 7. Encourages the relevant mechanisms of the Human Rights Council to continue to consider, within their respective mandates, the issue of the role of good governance in the promotion and protection of human rights; 8. Requests the High Commissioner to prepare a compilation of the activities and programmes of the United Nations system that contribute to the role of good governance in the promotion and protection of human rights, including its efforts to support States in the implementation of the 2030 Agenda for Sustainable Development in this context, and to submit it to the Human Rights Council at its thirty-fourth session; 9. Decides to remain seized of the matter.",03/18/2016,2016_836779,Serbia,N/A,yes
