year,Council,Committee,Session,Agenda item,Agenda detail,cosponsored countries,body title number,body title detail,body text,date,file,filecountry,footnote,scanned
2016,General Assembly,First Committee,Seventy-first session,98 (m),General and complete disarmament: consolidation of peace through practical disarmament measures,"Albania, Angola, Australia, Austria, Belgium, Bosnia and Herzegovina, Bulgaria, Canada, Chile, Costa Rica, Croatia, Cyprus, Czechia, Denmark, Estonia, Finland, France, Germany, Greece, Hungary, Iceland, Ireland, Italy, Japan, Latvia, Liechtenstein, Lithuania, Luxembourg, Malta, Micronesia (Federated States of), Monaco, Mongolia, Montenegro, Netherlands, Norway, Papua New Guinea, Poland, Portugal, Republic of Korea, Republic of Moldova, Romania, San Marino, Serbia, Slovakia, Slovenia, Spain, Sweden, Switzerland, the former Yugoslav Republic of Macedonia, Turkey, Ukraine, United Kingdom of Great Britain and Northern Ireland and United States of America: revised",N/A,Consolidation of peace through practical disarmament measures,"The General Assembly, Recalling its resolutions 51/45 N of 10 December 1996, 52/38 G of 9 December 1997, 53/77 M of 4 December 1998, 54/54 H of 1 December 1999, 55/33 G of 20 November 2000, 56/24 P of 29 November 2001 and 57/81 of 22 November 2002, its decision 58/519 of 8 December 2003, as well as its resolutions 59/82 of 3 December 2004, 61/76 of 6 December 2006, 63/62 of 2 December 2008, 65/67 of 8 December 2010, 67/50 of 3 December 2012 and 69/60 of 2 December 2014, entitled “Consolidation of peace through practical disarmament measures”, Convinced that a comprehensive and integrated approach towards certain practical disarmament measures often is a prerequisite to maintaining and consolidating peace and security and thus provides a basis for effective post-conflict peacebuilding; such measures include collection and responsible disposal, preferably through destruction, of weapons obtained through illicit trafficking or illicit manufacture as well as of stockpiled weapons and ammunition declared by competent national authorities to be surplus to requirements, particularly with regard to small arms and light weapons, unless another form of disposition or use EJF fala aT Please reeyele OS) of 4 16-18780 1 271016 CA A has been officially authorized and provided that such weapons have been duly marked and registered; confidence-building measures; disarmament, demobilization and reintegration of former combatants; demining; and conversion, Noting with satisfaction that the international community is more than ever aware of the importance of such practical disarmament measures, especially with regard to the growing problems arising from the excessive accumulation and uncontrolled spread of small arms and light weapons, including their ammunition, which pose a threat to peace and security and reduce the prospects for economic and social development in many regions, particularly in post-conflict situations, Stressing that further efforts are needed in order to develop and effectively implement programmes of practical disarmament in affected areas as part of disarmament, demobilization and reintegration measures so as to complement, on a case-by-case basis, peacekeeping and peacebuilding efforts, Taking note of Security Council resolution 2171 (2014) of 21 August 2014, in which the Council affirmed that a comprehensive conflict prevention strategy should include practical disarmament and other measures to contribute to combating the proliferation and illicit trade of arms, Welcoming the work of the United Nations Coordinating Action on Small Arms mechanism, which was established by the Secretary-General to bring about a holistic and multidisciplinary approach to the complex and multifaceted global problems related to small arms, Welcoming also the report of the Sixth Biennial Meeting of States to Consider the Implementation of the Programme of Action to Prevent, Combat and Eradicate the Ilicit Trade in Small Arms and Light Weapons in All Its Aspects,' which, inter alia, underlined the importance of the full and effective implementation of the Programme of Action’ and the International Instrument to Enable States to Identify and Trace, in a Timely and Reliable Manner, Illicit Small Arms and Light Weapons’ for attaining Goal 16 and target 16.4 of the 2030 Agenda for Sustainable Development,’ and which noted the importance of arrangements that assist in matching needs and resources for the implementation of the Programme of Action and the International Tracing Instrument, Welcoming further the sustainable operation of the flexible, voluntary United Nations Trust Facility Supporting Cooperation on Arms Regulation, pursuant to the Programme of Action and the outcome of the Second United Nations Conference to Review Progress Made in the Implementation of the Programme of Action,” 1. Takes note of the report of the Secretary-General on the consolidation of peace through practical disarmament measures, submitted pursuant to resolution 69/60;° ' A/CONF.192/BMS/2016/2. ? Report of the United Nations Conference on the Illicit Trade in Small Arms and Light Weapons in All Its Aspects, New York, 9-20 July 2001 (A/CONF.192/15), chap. IV, para. 24. > A/CONEF.192/2012/RC/4, annexes I and II. ° A/TI/ISI. 2/4 2. Also takes note of the report of the Secretary-General on the illicit trade in small arms and light weapons in all its aspects,’ which highlighted recent developments in small arms and light weapons manufacturing, technology and design and implications for the implementation of the International Instrument to Enable States to Identify and Trace, in a Timely and Reliable Manner, Illicit Small Arms and Light Weapons;° 3. Emphasizes the importance of including in United Nations-mandated peacekeeping missions, as appropriate and with the consent of the host State, practical disarmament measures aimed at addressing the illicit trafficking of small arms and light weapons, including, inter alia, through weapons collection, disarmament, demobilization, and reintegration programmes and enhancing physical security and stockpile management practices, as well as relevant training programmes, with a view to promoting and implementing an_ integrated comprehensive and effective weapons management strategy that would contribute to a sustainable peacebuilding process; 4. Welcomes the activities undertaken by the Group of Interested States for Practical Disarmament Measures, and invites the Group to continue to promote, on the basis of lessons learned from previous disarmament and peacebuilding projects, new practical disarmament measures to consolidate peace, especially as undertaken or designed by affected States themselves and regional and _ subregional organizations, as well as United Nations agencies; 5. Encourages the Group of Interested States to continue to function as an informal, open and transparent forum supporting the implementation of the Programme of Action to Prevent, Combat and Eradicate the Illicit Trade in Small Arms and Light Weapons in All Its Aspects,” in particular to facilitate the exchange of views on issues related to the United Nations small arms and light weapons process, as well as to continue efforts to facilitate the effective matching of assistance needs with available resources, in line with requests from affected States as indicated in their national reports, pursuant to the outcome of the Second United Nations Conference to Review Progress Made in the Implementation of the Programme of Action’ and the outcome of the Sixth Biennial Meeting of States to Consider the Implementation of the Programme of Action,® thus effectively facilitating the provision of international assistance in the implementation of the Programme of Action; 6. Also encourages the Group of Interested States to contribute to the development of voluntary indicators at the national level, based on the work of the Statistical Commission, the Programme of Action and the International Tracing Instrument, which could be used to measure progress made in the implementation of target 16.4,° and to support efforts towards the implementation of the target, including data collection for relevant indicators; '° T A/71/438-A/CONF.192/BMS/2016/1. 8 A/CONF.192/BMS/2016/2, annex. ° Tbid., sect. I, para. 27. '° Tpid., sect. I, para. 76. 3/4 7. Further encourages Member States in a position to do so to financially contribute to the United Nations Trust Facility Supporting Cooperation on Arms Regulation; 8. Encourages States parties to the Arms Trade Treaty in a position to do so to financially contribute to the Arms Trade Treaty Voluntary Trust Fund; 9. Welcomes the synergies within the multi-stakeholder process, including Governments, the United Nations system, regional and subregional organizations and institutions as well as non-governmental organizations in support of practical disarmament measures and the Programme of Action; 10. Requests the Secretary-General to submit to the General Assembly at its seventy-third session a report on the implementation of practical disarmament measures, taking into consideration the activities of the Group of Interested States; 11. Decides to include in the provisional agenda of its seventy-third session, under the item entitled “General and complete disarmament”, the sub-item entitled “Consolidation of peace through practical disarmament measures”. 16-18780 4/4",10/27/2016,2016_845940,Serbia,* Resolution 70/1.,yes
2016,General Assembly,Third Committee,Seventy-first session,68 (b),"Promotion and protection of human rights: human rights questions, including alternative approaches for improving the effective enjoyment of human rights and fundamental freedoms","Albania, Andorra, Angola, Argentina, Armenia, Australia, Austria, Belgium, Benin, Bosnia and Herzegovina, Brazil, Bulgaria, Cabo Verde, Canada, Chile, Colombia, Congo, Costa Rica, Cote d’Ivoire, Croatia, Cyprus, Czechia, Denmark, Dominican Republic, Ecuador, El Salvador, Estonia, Finland, France, Georgia, Germany, Greece, Guinea-Bissau, Honduras, Hungary, Iceland, Ireland, Israel, Italy, Latvia, Liechtenstein, Lithuania, Luxembourg, Malta, Mexico, Micronesia (Federated States of), Monaco, Mongolia, Montenegro, Netherlands, New Zealand, Norway, Palau, Panama, Paraguay, Poland, Portugal, Republic of Moldova, Romania, San Marino, Serbia, Slovakia, Slovenia, Spain, Sweden, Switzerland, the former Yugoslav Republic of Macedonia, Timor-Leste, Ukraine, United Kingdom of Great Britain and Northern Ireland, Uruguay and Venezuela (Bolivarian Republic of)",N/A,Moratorium on the use of the death penalty,"The General Assembly, Guided by the purposes and principles contained in the Charter of the United Nations, Reaffirming the Universal Declaration of Human Rights, the International Covenant on Civil and Political Rights” and the Convention on the Rights of the Child,* Recalling the Second Optional Protocol to the International Covenant on Civil and Political Rights, aiming at the abolition of the death penalty,’ and in this regard ' Resolution 217 A (IID). > See resolution 2200 A (XXI), annex. > United Nations, Treaty Series, vol. 1577, No. 27531. * United Nations, Treaty Series, vol. 1642, No. 14668. Please recycle eS 16-18972 1 021116 CN A welcoming the increasing number of accessions to and ratifications of the Second Optional Protocol, Reaffirming its resolutions 62/149 of 18 December 2007, 63/168 of 18 December 2008, 65/206 of 21 December 2010, 67/176 of 20 December 2012 and 69/186 of 18 December 2014 on the question of a moratorium on the use of the death penalty, in which the General Assembly called upon States that still maintain the death penalty to establish a moratorium on executions with a view to abolishing it, Welcoming all relevant decisions and resolutions of the Human Rights Council, Mindful that any miscarriage or failure of justice in the implementation of the death penalty is irreversible and irreparable, Convinced that a moratorium on the use of the death penalty contributes to respect for human dignity and to the enhancement and progressive development of human rights, and considering that there is no conclusive evidence of the deterrent value of the death penalty, Noting ongoing local and national debates and regional initiatives on the death penalty, as well as the readiness of an increasing number of Member States to make available to the public information on the use of the death penalty, and also, in this regard, the decision by the Human Rights Council in its resolution 26/2 of 26 June 2014° to convene biennial high-level panel discussions in order to further exchange views on the question of the death penalty, Recognizing the role of national human rights institutions in contributing to ongoing local and national debates and regional initiatives on the death penalty, Welcoming the considerable movement towards the abolition of the death penalty globally and the fact that many States are applying a moratorium, including long-standing moratoriums, either in law or in practice, on the use of the death penalty, Emphasizing the need to ensure that persons facing the death penalty are treated with humanity and with respect for their inherent dignity and in compliance with their rights under international human rights law, Noting the technical cooperation among Member States, as well as the role of relevant United Nations entities and human rights mechanisms, in supporting State efforts to establish moratoriums on the death penalty, Bearing in mind the work of special procedures mandate holders who have addressed human rights issues related to the death penalty within the framework of their respective mandates, 1. Expresses its deep concern about the continued application of the death penalty; > See Official Records of the General Assembly, Sixty-ninth Session, Supplement No. 53 (A/69/53), chap. V, sect. A. 2/4 2. Welcomes the report of the Secretary-General on the implementation of resolution 69/186° and the recommendations contained therein; 3. Also welcomes the steps taken by some States to reduce the number of offences for which the death penalty may be imposed, as well as steps taken to limit its application; 4. Further welcomes initiatives and political leadership encouraging national discussions and debates on the possibility of moving away from capital punishment; 5. Welcomes the decisions made by an increasing number of States from all regions, at all levels of government, to apply a moratorium on executions, followed in many cases by the abolition of the death penalty; 6. Calls upon all States: (a) To respect international standards that provide safeguards guaranteeing protection of the rights of those facing the death penalty, in particular the minimum standards, as set out in the annex to Economic and Social Council resolution 1984/50 of 25 May 1984, as well as to provide the Secretary-General with information in this regard; (b) To comply with their obligations under article 36 of the 1963 Vienna Convention on Consular Relations,’ particularly the right to receive information on consular assistance; (c) To make available relevant information, disaggregated by sex, age, and race, as applicable, and other applicable criteria, with regard to their use of the death penalty, inter alia, the number of persons sentenced to death, the number of persons on death row and the number of executions carried out, the number of death sentences reversed or commuted on appeal and information on any scheduled execution, which can contribute to possible informed and transparent national and international debates, including on the obligations of States pertaining to the use of the death penalty; (d) To progressively restrict the use of the death penalty and not to impose capital punishment for offences committed by persons below 18 years of age, on pregnant women or on persons with mental or intellectual disabilities; (e) To reduce the number of offences for which the death penalty may be imposed; (f) To ensure that those facing the death penalty can exercise their right to apply for pardon or commutation of their death sentence by ensuring that clemency procedures are fair and transparent and that prompt information is provided at all stages of the process; (g) To establish a moratorium on executions with a view to abolishing the death penalty; ° A/71/332. 7 United Nations, Treaty Series, vol. 596, No. 8638. 3/4 7. Calls upon States which have abolished the death penalty not to reintroduce it, and encourages them to share their experience in this regard; 8. Encourages States which have a moratorium to maintain it and to share their experience in this regard; 9. Calls upon States which have abolished the death penalty to include in their bilateral and regional extradition agreements provisions stating that, in case of receipt of an extradition request for an offence punishable by death under the law of the requesting State, the extradition is to be refused, unless the requesting State gives a credible assurance that the death penalty will not be carried out; 10. Calls upon States that have not yet done so to consider acceding to or ratifying the Second Optional Protocol to the International Covenant on Civil and Political Rights, aiming at the abolition of the death penalty;* 11. Requests the Secretary-General to report to the General Assembly at its seventy-third session on the implementation of the present resolution; 12. Decides to continue consideration of the matter at its seventy-third session under the item entitled “Promotion and protection of human rights”. 16-18972 4/4",10/31/2016,2016_846972,Serbia,N/A,yes
2016,General Assembly,Special Political And Decolonization Committee,Seventy-first session,49,United Nations Relief and Works Agency for Palestine Refugees in the Near East,"Algeria, Bahrain, Belgium, Bolivia (Plurinational State of), Brunei Darussalam, Bulgaria, Comoros, Cuba, Cyprus, Djibouti, Ecuador, Egypt, Indonesia, Iraq, Jordan, Kuwait, Lebanon, Malaysia, Mali, Mauritania, Monaco, Morocco, Netherlands, Nicaragua, Oman, Qatar, Saudi Arabia, Senegal, Serbia, South Africa, Sudan, Tunisia, United Arab Emirates, Yemen, Venezuela (Bolivarian Republic of) and State of Palestine",N/A,Assistance to Palestine refugees,"The General Assembly, Recalling its resolution 194 (III) of 11 December 1948 and all its subsequent resolutions on the question, including resolution 70/83 of 9 December 2015, Recalling also its resolution 302 (IV) of 8 December 1949, by which, inter alia, it established the United Nations Relief and Works Agency for Palestine Refugees in the Near East, Recalling further the relevant resolutions of the Security Council, Aware of the fact that, for more than six decades, the Palestine refugees have suffered from the loss of their homes, lands and means of livelihood, Affirming the imperative of resolving the problem of the Palestine refugees for the achievement of justice and for the achievement of lasting peace in the region, Acknowledging the essential role that the Agency has played for over 65 years since its establishment in ameliorating the plight of the Palestine refugees through the provision of education, health, relief and social services and ongoing work in the areas of camp infrastructure, microfinance, protection and emergency assistance, Please recycle 16-18944 1 031116 CA A A Taking note of the report of the Commissioner-General of the Agency covering the period from 1 January to 31 December 2015,! Taking note also of the update to the special report of 3 August 2015 of the Commissioner-General submitted pursuant to paragraph 21 of General Assembly resolution 302 (IV),” which was conveyed by the Secretary-General on 15 September 2016 to the President of the General Assembly, and expressing concern regarding the severe financial crisis of the Agency and the negative implications for the continued delivery of core programmes to the Palestine refugees in all fields of operation, Aware of the growing needs of the Palestine refugees throughout all the fields of operation, namely, Jordan, Lebanon, the Syrian Arab Republic and the Occupied Palestinian Territory, Expressing grave concern at the especially difficult situation of the Palestine refugees under occupation, including with regard to their safety, well-being and socioeconomic living conditions, Expressing grave concern in particular at the grave humanitarian situation and socioeconomic conditions of the Palestine refugees in the Gaza Strip, and underlining the importance of emergency and humanitarian assistance and urgent reconstruction efforts, Noting the signing of the Declaration of Principles on Interim Self- Government Arrangements on 13 September 1993 by the Government of Israel and the Palestine Liberation Organization’ and the subsequent implementation agreements, 1. Notes with regret that repatriation or compensation of the refugees, as provided for in paragraph 11 of General Assembly resolution 194 (III), has not yet been effected, and that, therefore, the situation of the Palestine refugees continues to be a matter of grave concern and the Palestine refugees continue to require assistance to meet basic health, education and living needs; 2. Also notes with regret that the United Nations Conciliation Commission for Palestine has been unable to find a means of achieving progress in the implementation of paragraph 11 of General Assembly resolution 194 (III), and reiterates its request to the Conciliation Commission to continue exerting efforts towards the implementation of that paragraph and to report to the Assembly on the efforts being exerted in this regard as appropriate, but no later than 1 September 2017; 3. Affirms the necessity for the continuation of the work of the United Nations Relief and Works Agency for Palestine Refugees in the Near East and the importance of its unimpeded operation and its provision of services, including emergency assistance, for the well-being, protection and human development of the Palestine refugees and for the stability of the region, pending the just resolution of the question of the Palestine refugees; ' Official Records of the General Assembly, Seventy-first Session, Supplement No. 13 (A/71/13). > A/70/272, annex. > A/48/486-S/26560, annex. 2/3 4. Calls upon all donors to continue to strengthen their efforts to meet the anticipated needs of the Agency, including with regard to increased expenditures and needs arising from conflicts and instability in the region and the serious socioeconomic and humanitarian situation, particularly in the Occupied Palestinian Territory, and those needs mentioned in recent emergency, recovery and reconstruction appeals and plans for the Gaza Strip and in the regional crisis response plans to address the situation of Palestine refugees in the Syrian Arab Republic and those Palestine refugees who have fled to countries in the region; 5. Commends the Agency for its provision of vital assistance to the Palestine refugees and its role as a stabilizing factor in the region and the tireless efforts of the staff of the Agency in carrying out its mandate; 6. Decides to extend the mandate of the Agency until 30 June 2020, without prejudice to the provisions of paragraph 11 of General Assembly resolution 194 (i). 16-18944 3/3",11/01/2016,2016_846994,Serbia,N/A,yes
