year,Council,Committee,Session,Agenda item,Agenda detail,cosponsored countries,body title number,body title detail,body text,date,file,filecountry,footnote,scanned
2008,General Assembly,N/A,Sixty-second session,116,Follow-up to the outcome of the Millennium Summit,"Australia, Austria, Canada, Fiji, Maldives, Marshall Islands, Micronesia (Federated States of), Nauru, New Zealand, Palau, Papua New Guinea, Samoa, Seychelles, Solomon Islands, Tonga, Turkey, Tuvalu and Vanuatu",N/A,Security and climate change,"The General Assembly, Recalling Article 1, paragraph 1, of the Charter of the United Nations, which recognizes that a primary purpose of the United Nations is to maintain international peace and security, Recognizing that under Article 24 of the Charter, the Security Council is charged with primary responsibility for the maintenance of international peace and security, Also recognizing that under Article 39 of the Charter, the Security Council shall determine the existence of any threat to the peace and shall make recommendations, or decide what measures shall be taken, to maintain or restore international peace and security, Bearing in mind that the General Assembly, under Article 11, paragraph 3, of the Charter, may call the attention of the Security Council to situations which are likely to endanger international peace and security, Also bearing in mind that the Security Council remains seized of the matter of climate change in terms of its implications on international peace and security since its thematic debate, “Energy, security and climate change”, held in April 2007, Recognizing the responsibilities of the General Assembly, the Economic and Social Council and relevant subsidiary bodies with regard to sustainable development issues, including energy and climate change, 08-50284 i 110908 AR A A Noting the goals and objectives of the United Nations Framework Convention on Climate Change, ! Deeply concerned that the adverse impacts of climate change, including sea-level rise, trigger population relocation and threaten the territorial integrity and sovereignty of some States, thus endangering international peace and security, 1. Invites the Security Council to continue to consider and address, as appropriate, the threat posed by climate change to international peace and security; 2. Requests the Secretary-General to report to the General Assembly at its sixty-third session on the international peace and security implications of climate change; 3. Invites the Security Council to update the General Assembly on its work, and any actions taken, in this regard. 1 United Nations, Treaty Series, vol. 1771, No. 30822.",09/10/2008,2008_636769,Seychelles,N/A,yes
2008,General Assembly,Third Committee,Sixty-third session,56 (a),Advancement of women,"Angola, Antigua and Barbuda, Belgium, Botswana, Brazil, Burkina Faso, Burundi, Cameroon, Cape Verde, Chile, Céte d’Ivoire, Democratic Republic of the Congo, Equatorial Guinea, Ethiopia, Gabon, Gambia, Ghana, Guatemala, Guinea, Guinea-Bissau, Iceland, Indonesia, Israel, Jamaica, Kenya, Luxembourg, Malawi, Mali, Mauritania, Morocco, Mozambique, Niger, Nigeria, Paraguay, Saudi Arabia, Senegal, Seychelles, South Africa, Sudan, Swaziland, Switzerland, Tunisia, Uganda and United Republic of Tanzania",N/A,Supporting efforts to end obstetric fistula,"The General Assembly, Recalling its resolution 62/138 of 18 December 2007 on supporting efforts to end obstetric fistula, Reaffirming the Beijing Declaration and Platform for Action,! the outcome of the twenty-third special session of the General Assembly entitled “Women 2000: gender equality, development and peace for the twenty-first century”,? and the declaration adopted at the forty-ninth session of the Commission on the Status of Women, * Reaffirming also the international commitments in the field of social development and to gender equality and the advancement of women made at the World Conference on Human Rights, the International Conference on Population and Development, the World Summit for Social Development and the World Conference against Racism, Racial Discrimination, Xenophobia and Related 1 Report of the Fourth World Conference on Women, Beijing, 4-15 September 1995 (United Nations publication, Sales No. E.96.IV.13), chap. I, resolution 1, annexes I and II. 3 See Official Records of the Economic and Social Council, 2005, Supplement No. 7 and corrigendum (E/2005/27 and Corr.1), chap. I, sect. A; see also Economic and Social Council decision 2005/232. 08-55216 HI 161008 AR A Intolerance, as well as those made in the United Nations Millennium Declaration+ and at the 2005 World Summit,> Reaffirming further the Convention on the Elimination of All Forms of Discrimination against Women® and the Convention on the Rights of the Child,” and urging States that have not done so to consider, as a matter of priority, signing, ratifying or acceding to these Conventions and the Optional Protocols thereto,® Stressing the interlinkages between poverty, malnutrition, lack of or inadequate or inaccessible health services, early childbearing, early marriage of the girl child, violence against young women and girls and gender discrimination as root causes of obstetric fistula, and that poverty remains the main social risk factor, Recognizing that the difficult socio-economic conditions that exist in many developing countries, in particular the least developed countries, have resulted in the acceleration of the feminization of poverty, Recognizing also that early pregnancy and early childbearing entail complications during pregnancy and delivery and a much higher risk of maternal mortality and morbidity, and deeply concerned that early childbearing and limited access to the highest attainable standard of health, including sexual and reproductive health, including in the area of emergency obstetric care, cause high levels of obstetric fistula and other maternal morbidities as well as maternal mortality, Recognizing further the serious immediate and long-term implications for health, including sexual and reproductive health, as well as increased vulnerability to HIV/AIDS, and the negative impact on psychological, social and economic development, that violence against the girl child and adolescent girls represents for individuals, families, communities and States, Deeply concerned about discrimination against the girl child and the violation of the rights of the girl child, which often result in less access by girls to education, nutrition and physical and mental health and in enjoyment by girls of fewer of the rights, opportunities and benefits of childhood and adolescence compared with boys and their often being subjected to various forms of cultural, social, sexual and economic exploitation and to violence and harmful practices, Welcoming the contribution by Member States, the international community and civil society to the global Campaign to End Fistula, bearing in mind that a people-centred approach to social and economic development is fundamental for protecting and empowering individuals and communities, 1. Recognizes the interlinkages between poverty, malnutrition, lack of or inadequate or inaccessible health services, early childbearing, early marriage of the girl child and gender discrimination as root causes of obstetric fistula, that poverty remains the main social risk factor, that the eradication of poverty is critical to meeting the needs and protecting and promoting the rights of women and girls and that continued urgent national and international action is required to eliminate it; A/C.3/63/L.15 2. Stresses the need to address the social issues that contribute to the problem of obstetric fistula, such as early marriage of the girl child, early pregnancy, lack of access to sexual and reproductive health, lack of or inadequate education of women and girls, poverty and low status of women and girls; 3. Also stresses that States have the obligation to promote and protect all human rights and fundamental freedoms of women and girls, that they must exercise due diligence in order to prevent, investigate and punish the perpetrators of violence against women and girls and to provide protection to the victims, and that failure to do so violates and impairs or nullifies the enjoyment of their human rights and fundamental freedoms; 4. Calls upon States to take all necessary measures to ensure the right of women and girls to the enjoyment of the highest attainable standard of health, including sexual and reproductive health, and develop sustainable health systems and social services, with a view to ensuring access to such systems and services without discrimination, while paying special attention to adequate food and nutrition, water and sanitation, family planning information, increasing knowledge and awareness and securing appropriate prenatal and post-natal care for the prevention of obstetric fistula; 5. Also calls upon States to ensure that women and girls have equal access to free and compulsory primary education of good quality and that they complete their education at that level, and to renew their efforts to improve and expand girls’ and women’s education at all levels, including at the secondary and higher levels, as well as vocational education and technical training, in order to, inter alia, achieve gender equality, the empowerment of women and poverty eradication; 6. Urges States to enact and strictly enforce laws to ensure that marriage is entered into only with the free and full consent of the intending spouses and, in addition, to enact and strictly enforce laws concerning the minimum legal age of consent and the minimum age for marriage, and to raise the minimum age for marriage where necessary; 7. Calls upon the international community to support the activities of the United Nations Population Fund and other partners in the global Campaign to End Fistula, including the World Health Organization, in establishing and financing regional fistula treatment and training centres by identifying and supporting health facilities that have the potential to serve as centres for treatment, training and convalescent care; 8. Calls upon States and/or the relevant funds and programmes, organs and specialized agencies of the United Nations system, within their respective mandates, and invites the international financial institutions and all relevant actors of civil society, including non-governmental organizations, and the private sector: (a) To redouble their efforts to meet the internationally agreed goal of improving maternal health by increasing access to skilled attendance at birth and emergency obstetric care, and appropriate prenatal and post-natal care; (b) To develop, implement and support national and international prevention, care and treatment and reintegration and support strategies, as appropriate, to address effectively the condition of obstetric fistula and to develop further a multisectoral, multidisciplinary, comprehensive and integrated approach in order to A/C.3/63/L.15 bring about lasting solutions and put an end to obstetric fistula, maternal mortality and related morbidities, including through ensuring access to affordable, comprehensive, quality maternal health-care services, including skilled birth attendance and emergency obstetric care; (c) To strengthen the capacity of health systems to provide the essential services needed to prevent obstetric fistula and to treat those cases that do occur by providing the continuum of services, including family planning, prenatal care, skilled birth attendance, emergency obstetric care and post-partum care, to young women and girls, including those living in poverty and in underserved rural areas where obstetric fistula is most common; (d) To strengthen research, monitoring and evaluation systems, including community-based notification of obstetric fistula cases and maternal and newborn deaths, to guide the implementation of maternal health programmes; (e) To provide essential health services, equipment and supplies and skills training and income-generating projects to women and girls so that they can break out of a cycle of poverty; (f) To mobilize funding to provide free or subsidized fistula repairs, including through encouraging more networking among providers and the sharing of new treatment techniques and protocols; (g) To provide health education, rehabilitation and reintegration counselling, including medical counselling, as key components of post-operative care; (h) To bring obstetric fistula to the attention of policymakers and communities, thereby reducing the stigma and discrimination associated with it and helping women and girls suffering from obstetric fistula so that they can overcome abandonment and social exclusion together with the psychosocial implications thereof, inter alia, through the support of social reintegration projects; (i) To educate individual women and men, girls and boys, communities, policymakers and health professionals about how obstetric fistula can be prevented and treated and increase awareness of the needs of pregnant women and girls, including their right to the highest attainable standard of health, through working with community and religious leaders, traditional birth attendants, media, radio stations, influential public figures and policymakers, support the training of doctors, midwives, nurses and other health workers in lifesaving obstetric care, and include training on fistula repair, treatment and care as a standard element of health professionals’ training curricula; (j) To develop means of transportation and financing that enable women and girls to access obstetric care and treatment, and provide incentives and other means to secure the presence in rural areas of qualified health professionals who are able to perform interventions to prevent obstetric fistula; 9. Encourages communication and networking among existing fistula centres to facilitate training, research, advocacy and fund-raising and the development and application of relevant standards, including Obstetric Fistula: Guiding Principles for Clinical Management and Programme Development, published by the World Health Organization, which provides background information along with principles for developing fistula prevention and treatment strategies and programmes; A/C.3/63/L.15 10. Urges the international community to address the shortages of doctors, midwives, nurses and other health workers trained in lifesaving obstetric care, and of space and supplies, which limit the capacity of most of the fistula centres; 11. Urges multilateral donors, and invites international financial institutions, within their respective mandates, and regional development banks to review and implement policies to support national efforts to ensure that a higher proportion of resources reaches young women and girls, in particular in rural and remote areas; 12. Invites Member States to contribute to efforts to end obstetric fistula, including, in particular, the United Nations Population Fund global Campaign to End Fistula, with the goal of eliminating obstetric fistula by 2015, in line with the targets of the millennium development goal of improving maternal health; 13. Requests the Secretary-General to report to the General Assembly at its sixty-fifth session on the implementation of the present resolution under the item entitled “Advancement of women”. 08-55216",10/15/2008,2008_639450,Seychelles,N/A,yes
2008,General Assembly,First Committee,Sixty-third session,85,Developments in the field of information and telecommunications in the context of international security,"Armenia, Azerbaijan, Belarus, Chile, China, Cuba, Democratic People’s Republic of Korea, Ethiopia, Haiti, India, Kazakhstan, Kyrgyzstan, Madagascar, Mali, Myanmar, Nicaragua, Russian Federation, Serbia, Seychelles, Sudan, Tajikistan, Turkmenistan, Uzbekistan and Zimbabwe",N/A,Developments in the field of information and telecommunications in the context of international security,"The General Assembly, Recalling its resolutions 53/70 of 4 December 1998, 54/49 of 1 December 1999, 55/28 of 20 November 2000, 56/19 of 29 November 2001, 57/53 of 22 November 2002, 58/32 of 8 December 2003, 59/61 of 3 December 2004, 60/45 of 8 December 2005, 61/54 of 6 December 2006 and 62/17 of 5 December 2007, Recalling also its resolutions on the role of science and technology in the context of international security, in which, inter alia, it recognized that scientific and technological developments could have both civilian and military applications and that progress in science and technology for civilian applications needed to be maintained and encouraged, Noting that considerable progress has been achieved in developing and applying the latest information technologies and means of telecommunication, Affirming that it sees in this process the broadest positive opportunities for the further development of civilization, the expansion of opportunities for cooperation for the common good of all States, the enhancement of the creative potential of humankind and additional improvements in the circulation of information in the global community, Recalling, in this connection, the approaches and principles outlined at the Information Society and Development Conference, held in Midrand, South Africa, from 13 to 15 May 1996, 08-55840 HI 211008 AR AA Bearing in mind the results of the Ministerial Conference on Terrorism, held in Paris on 30 July 1996, and the recommendations that it made, ! Bearing in mind also the results of the World Summit on the Information Society, held in Geneva from 10 to 12 December 2003 (first phase) and in Tunis from 16 to 18 November 2005 (second phase), 2 Noting that the dissemination and use of information technologies and means affect the interests of the entire international community and that optimum effectiveness is enhanced by broad international cooperation, Expressing its concern that these technologies and means can potentially be used for purposes that are inconsistent with the objectives of maintaining international stability and security and may adversely affect the integrity of the infrastructure of States to the detriment of their security in both civil and military fields, Considering that it is necessary to prevent the use of information resources or technologies for criminal or terrorist purposes, Noting the contribution of those Member States that have submitted their assessments on issues of information security to the Secretary-General pursuant to paragraphs 1 to 3 of resolutions 53/70, 54/49, 55/28, 56/19, 57/53, 58/32, 59/61, 60/45, 61/54 and 62/17, Taking note of the reports of the Secretary-General containing those assessments, 3 Welcoming the initiative taken by the Secretariat and the United Nations Institute for Disarmament Research in convening international meetings of experts in Geneva in August 1999 and April 2008 on developments in the field of information and telecommunications in the context of international security, as well as its results, Considering that the assessments of the Member States contained in the reports of the Secretary-General and the international meetings of experts have contributed to a better understanding of the substance of issues of international information security and related notions, Bearing in mind that the Secretary-General, in fulfilment of resolution 58/32, established in 2004 a group of governmental experts, which, in accordance with its mandate, considered existing and potential threats in the sphere of information security and possible cooperative measures to address them and conducted a study on relevant international concepts aimed at strengthening the security of global information and telecommunications systems, Taking note of the report of the Secretary-General on the Group of Governmental Experts on Developments in the Field of Information and 3 A/54/213, A/55/140 and Corr.1 and Add.1, A/56/164 and Add.1, A/57/166 and Add.1, A/58/373, A/59/116 and Add.1, A/60/95 and Add.1, A/61/161 and Add.1 and A/62/98 and Add.1. A/C.1/63/L.45 Telecommunications in the Context of International Security, prepared on the basis of the results of the Group’s work,+ 1. Calls upon Member States to promote further at multilateral levels the consideration of existing and potential threats in the field of information security, as well as possible measures to limit the threats emerging in this field, consistent with the need to preserve the free flow of information; 2. Considers that the purpose of such measures could be served through the examination of relevant international concepts aimed at strengthening the security of global information and telecommunications systems; 3. Invites all Member States to continue to inform the Secretary-General of their views and assessments on the following questions: (a) General appreciation of the issues of information security; (b) Efforts taken at the national level to strengthen information security and promote international cooperation in this field; (c) The content of the concepts mentioned in paragraph 2 above; (d) Possible measures that could be taken by the international community to strengthen information security at the global level; 4. Requests the Secretary-General, with the assistance of a group of governmental experts, to be established in 2009 on the basis of equitable geographical distribution, to continue to study existing and potential threats in the sphere of information security and possible cooperative measures to address them, as well as the concepts referred to in paragraph 2 above, and to submit a report on the results of this study to the General Assembly at its sixty-fifth session; 5. Decides to include in the provisional agenda of its sixty-fourth session the item entitled “Developments in the field of information and telecommunications in the context of international security”. 4 A/60/202.",10/17/2008,2008_639773,Seychelles,N/A,yes
2008,General Assembly,N/A,Sixty-third session,107,Follow-up to the outcome of the Millennium Summit,"Armenia, Australia, Austria, Belgium, Bulgaria, Canada, Chile, Cyprus, Czech Republic, Denmark, Estonia, Fiji, Finland, France, Germany, Greece, Hungary, Iceland, Ireland, Israel, Italy, Kiribati, Latvia, Lithuania, Luxembourg, Maldives, Malta, Marshall Islands, Micronesia (Federated States of), Monaco, Nauru, Netherlands, New Zealand, Palau, Papua New Guinea, Philippines, Poland, Portugal, Romania, Samoa, Seychelles, Slovakia, Slovenia, Solomon Islands, Spain, Sweden, Tonga, Turkey, Tuvalu, United Kingdom of Great Britain and Northern Ireland and Vanuatu",N/A,Security and climate change,"The General Assembly, Recalling Article 1, paragraph 1, of the Charter of the United Nations, which recognizes that a primary purpose of the United Nations is to maintain international peace and security, Recognizing that under Article 24 of the Charter, the Security Council is charged with primary responsibility for the maintenance of international peace and security, Also recognizing that under Article 39 of the Charter, the Security Council shall determine the existence of any threat to the peace and shall make recommendations, or decide what measures shall be taken to maintain or restore international peace and security, Bearing in mind that the General Assembly, under Article 11, paragraph 3, of the Charter, may call the attention of the Security Council to situations which are likely to endanger international peace and security, Also bearing in mind that the Security Council remains seized of the matter of climate change in terms of its implications for international peace and security since its thematic debate, “Energy, security and climate change”, held in April 2007, 08-57182* if 291008 ATE AA Recognizing the responsibilities of the General Assembly, the Economic and Social Council and relevant subsidiary bodies for sustainable development issues, including energy and climate change, Noting the goals and objectives of the United Nations Framework Convention on Climate Change, ! Deeply concerned that the adverse impacts of climate change, including sea- level rise, trigger population relocation and threaten the territorial integrity and sovereignty of some States, thus endangering international peace and security, 1. Invites the Security Council to continue to consider and address, as appropriate, the threat posed by climate change to international peace and security; 2. Requests the Secretary-General to report to the General Assembly at its sixty-third session on the international peace and security implications of climate change; 3. Invites the Security Council to update the General Assembly on its work, and any actions taken, in this regard. 1 United Nations, Treaty Series, vol. 1771, No. 30822.",10/27/2008,2008_640196,Seychelles,* Reissued for technical reasons.,yes
