year,Council,Committee,Session,Agenda item,Agenda detail,cosponsored countries,body title number,body title detail,body text,date,file,filecountry,footnote,scanned
2013,General Assembly,N/A,Sixty-seventh session,94,General and complete disarmament,"Albania, Antigua and Barbuda, Argentina, Australia, Austria, Bahamas, Belgium, Bulgaria, Chile, Colombia, Costa Rica, Cote d’Ivoire, Croatia, Cyprus, Czech Republic, Denmark, Dominican Republic, Estonia, Finland, France, Germany, Ghana, Greece, Grenada, Guatemala, Guyana, Haiti, Hungary, Iceland, Italy, Jamaica, Japan, Kenya, Latvia, Liberia, Liechtenstein, Lithuania, Luxembourg, Mali, Mexico, Montenegro, Morocco, Namibia, Netherlands, New Zealand, Nigeria, Norway, Peru, Poland, Portugal, Republic of Korea, Romania, Rwanda, Saint Lucia, Saint Vincent and the Grenadines, Slovakia, Slovenia, Spain, Sweden, Switzerland, Trinidad and Tobago, Turkey, United Kingdom of Great Britain and Northern Ireland and United States of America",N/A,The Arms Trade Treaty,"Addendum Add the following countries to the list of sponsors of the resolution: Andorra, Barbados, Belize, Benin, Bosnia and Herzegovina, Burkina Faso, Burundi, Central African Republic, Dominica, E] Salvador, Gabon, Guinea- Bissau, Honduras, Ireland, Lesotho, Madagascar, Maldives, Malta, Micronesia (Federated States of), Monaco, Mongolia, Mozambique, Nauru, Niger, Palau, Panama, Papua New Guinea, Paraguay, Republic of Moldova, Saint Kitts and Nevis, Samoa, San Marino, Senegal, Seychelles, South Africa, South Sudan, Suriname, the former Yugoslav Republic of Macedonia, Timor-Leste, Tonga, Ukraine, United Republic of Tanzania, Uruguay and Vanuatu 13-27817 iil 030413 A NY AA",04/02/2013,2013_746816,Seychelles,N/A,yes
2013,General Assembly,N/A,Sixty-seventh session,20,Sustainable development,"Afghanistan, Armenia, Australia, Austria, Azerbaijan, Belarus, Belgium, Bulgaria, Burkina Faso, China, Croatia, Cuba, Cyprus, Czech Republic, Denmark, Estonia, Finland, France, Georgia, Germany, Greece, Hungary, Iran (Islamic Republic of), Ireland, Israel, Italy, Kazakhstan, Kyrgyzstan, Lao People’s Democratic Republic, Latvia, Lithuania, Luxembourg, Malaysia, Malta, Netherlands, New Zealand, Niger, Norway, Pakistan, Portugal, Republic of Moldova, Romania, Russian Federation, Serbia, Slovakia, Slovenia, Spain, Sri Lanka, Sweden, Tajikistan, the former Yugoslav Republic of Macedonia, Turkey, Turkmenistan, Ukraine and Uzbekistan",N/A,Reliable and stable transit of energy and its role in ensuring sustainable development and international cooperation,"Addendum Add the following countries to the list of sponsors of the resolution: Bosnia and Herzegovina, Chile, Colombia, Egypt, India, Japan, Jordan, Monaco, Mongolia, Montenegro, Nicaragua, Panama, Paraguay, Poland, Seychelles and United Kingdom of Great Britain and Northern Ireland 13-33954 nn 210513 CN RYN A",05/17/2013,2013_749302,Seychelles,N/A,yes
2013,General Assembly,N/A,Sixty-seventh session,14,"Integrated and coordinated implementation of and follow-up to the outcomes of the major United Nations conferences and summits in the economic, social and related fields","Afghanistan, Albania, Angola, Armenia, Australia, Azerbaijan, Bangladesh, Belarus, Belize, Benin, Bolivia (Plurinational State of), Bosnia and Herzegovina, Brunei Darussalam, Burkina Faso, Burundi, Cambodia, Chile, China, Costa Rica, Croatia, Cuba, Cyprus, Djibouti, Ecuador, El Salvador, Ethiopia, Fiji, Finland, Georgia, Germany, Ghana, Grenada, Guatemala, Haiti, Honduras, Hungary, Indonesia, Iraq, Ireland, Israel, Jamaica, Japan, Jordan, Kenya, Lao People’s Democratic Republic, Lebanon, Lesotho, Liberia, Liechtenstein, Lithuania, Madagascar, Malaysia, Maldives, Monaco, Mongolia, Montenegro, Myanmar, Namibia, Nauru, Netherlands, New Zealand, Oman, Palau, Panama, Papua New Guinea, Paraguay, Peru, Philippines, Portugal, Qatar, Republic of Korea, Russian Federation, Saint Vincent and the Grenadines, Samoa, Serbia, Seychelles, Singapore, Slovakia, Slovenia, Solomon Islands, Somalia, South Africa, Spain, Sri Lanka, Suriname, Sweden, Tajikistan, Thailand, the former Yugoslav Republic of Macedonia, Timor-Leste, Togo, Turkey, Turkmenistan, Tuvalu, Ukraine, United Republic of Tanzania, Uruguay, Vanuatu and Viet Nam",N/A,Sanitation for All,"The General Assembly, Recalling its resolutions 61/192 of 20 December 2006 on the International Year of Sanitation, 2008 and 65/153 of 20 December 2010 on the follow-up to the International Year of Sanitation, 2008, Recalling also General Assembly resolutions and resolutions of the Human Rights Council on the human right to safe drinking water and sanitation, Recalling further its resolution 65/1 of 22 September 2010, “Keeping the promise: united to achieve the Millennium Development Goals”, 13-39821* iil 230713 A RY YA Reaffirming Economic and Social Council resolution 1980/67 of 25 July 1980 on international years and anniversaries and General Assembly resolutions 53/199 of 15 December 1998 and 61/185 of 20 December 2006 on the proclamation of international years, Reaffirming also the commitment to implement Agenda 21,! the Programme for the Further Implementation of Agenda 21,2 the Plan of Implementation of the World Summit on Sustainable Development (“Johannesburg Plan of Implementation”), including the time-bound goals and targets, and the other internationally agreed development goals, including the Millennium Development Goals, Reaffirming further the outcome document of the United Nations Conference on Sustainable Development, held in Rio de Janeiro, Brazil, from 20 to 22 June 2012 entitled “The future we want”,+ Deeply concerned by the slow and insufficient progress in providing access to basic sanitation services, as shown in the 2012 update report of the United Nations Children’s Fund and the World Health Organization,® in which it was noted that 2.5 billion people continue to lack basic sanitation, and conscious of the impact of the lack of sanitation on people’s health, poverty reduction efforts, economic and social development and the environment, in particular water resources, Appreciating the ongoing work of the organizations of the United Nations system and the work of other intergovernmental organizations on sanitation, Noting that sanitation-related activities, events and initiatives are observed each year in many countries, Noting also the efforts of countries that are participating in all relevant voluntary initiatives related to water and sanitation, including the Sanitation and Water for All Partnership, to share their experience with interested Member States, Recognizing that events organized on 19 November in many Member States in the context of World Toilet Day have contributed to a better awareness and concerted actions on different aspects of the critical issue of sanitation for all, and acknowledging in this regard the critical role of civil society organizations, 1. Decides, in the context of Sanitation for All, to designate 19 November as World Toilet Day; 2. Urges all Member States, the organizations of the United Nations system and all other relevant stakeholders to encourage behavioural change, together with policies for increasing access to sanitation among the poor, complemented by a call to end open defecation as an practice extremely harmful to public health; 1 Report of the United Nations Conference on Environment and Development, Rio de Janeiro, 3-14 June 1992, vol. I, Resolutions Adopted by the Conference (United Nations publication, Sales No. E.93.1.8 and corrigendum), resolution 1, annex II. 26 August-4 September 2002 (United Nations publication, Sales No. E.03.11.A.1 and corrigendum), chap. I, resolution 2, annex. 5 Progess on Drinking Water and Sanitation: 2012 Update, United Nations Children’s Fund and World Health Organization, 2012. A/67/L.75 3. Encourages all Member States, as well as the organizations of the United Nations system and international organizations and other stakeholders, to approach the sanitation issue in a much broader context and to encompass all its aspects, including hygiene promotion, the provision of basic sanitation services, sewerage and wastewater treatment and reuse in the context of integrated water management; 4. Invites all Member States, organizations of the United Nations system and other international and regional organizations, as well as civil society, including non-governmental organizations and individuals, to observe World Toilet Day in the context of Sanitation for All in an appropriate manner, including through education and activities to raise public awareness on the importance of access to sanitation for all; 5. | Urges all Member States, as well as the organizations of the United Nations system, international organizations and other relevant stakeholders, to accelerate progress in order to achieve Millennium Development Goal 7 and other Millennium Development Goals related to sanitation, including through redoubling efforts to close the sanitation gap through scaled-up ground-level action, and noting in this regard the global effort to realize “Sustainable sanitation: the five-year drive to 2015”; 6. Stresses that the costs of all activities that may arise from the implementation of the present resolution should be met from _ voluntary contributions, subject to the availability and provision of voluntary contributions for this specific purpose; 7. Requests UN-Water, in consultation with relevant entities of the United Nations system, mindful of the provisions of the annex to Economic and Social Council resolution 1980/67, to facilitate the implementation of World Toilet Day in the context of Sanitation for All, in collaboration with Governments and relevant stakeholders; 8. Requests the Secretary-General to bring the present resolution to the attention of all Member States and organizations of the United Nations system. 13-39821",07/17/2013,2013_753412,Seychelles,"* Reissued for technical reasons on 23 July 2013. 3 Report of the World Summit on Sustainable Development, Johannesburg, South Africa,",yes
2013,General Assembly,N/A,Sixty-seventh session,120,Multilingualism,"Afghanistan, Albania, Angola, Andorra, Argentina, Armenia, Australia, Austria, Belgium, Benin, Brazil, Bulgaria, Burkina Faso, Canada, Cape Verde, Chile, Colombia, Congo, Costa Rica, Cote d’Ivoire, Cyprus, Djibouti, Estonia, Finland, France, Gabon, Georgia, Guatemala, Haiti, Iraq, Lao People’s Democratic Republic, Lebanon, Liechtenstein, Lithuania, Luxembourg, Mali, Malta, Mauritius, Mexico, Monaco, Morocco, Mozambique, Netherlands, Niger, Panama, Peru, Poland, Portugal, Romania, Russian Federation, Senegal, Switzerland, Togo, Tunisia and Turkmenistan",N/A,Multilingualism,"Addendum Add the following countries to the list of sponsors of the resolution: Bosnia and Herzegovina, Burundi, Cameroon, Central African Republic, Chad, Croatia, Greece, Guinea, Guyana, Honduras, Hungary, India, Kazakhstan, Libya, Madagascar, Mauritania, Montenegro, Republic of Moldova, Rwanda, Serbia, Seychelles, Slovakia, Slovenia, Spain, the former Yugoslav Republic of Macedonia, Timor-Leste, Uruguay, Vanuatu and Viet Nam 13-40681 Hi 260713 UN MYA A A",07/24/2013,2013_753675,Seychelles,N/A,yes
2013,General Assembly,N/A,Sixty-seventh session,121 (s),Cooperation between the United Nations and regional and other organizations: cooperation between the United Nations and the Pacific Islands Forum,"Australia, Austria, Ireland, Italy, Jordan, Lithuania, Luxembourg, Marshall Islands, Micronesia (Federated States of), Monaco, Netherlands, New Zealand, Norway, Palau, Papua New Guinea, Samoa, Slovenia, Solomon Islands, Spain, Tonga, Tuvalu and Vanuatu",N/A,Cooperation between the United Nations and the Pacific Islands Forum,"Addendum Add the following countries to the list of sponsors of the resolution: Belgium, Bosnia and Herzegovina, Chile, Cyprus, Czech Republic, Estonia, Finland, Georgia, Guyana, Hungary, India, Israel, Kiribati, Montenegro, Nauru, Philippines, Poland, Portugal, Romania, Seychelles, Singapore, Slovakia, Thailand, the former Yugoslav Republic of Macedonia, Turkey and United States of America 13-47853 iil 190913 AMY AAA",09/16/2013,2013_757101,Seychelles,N/A,yes
2013,General Assembly,N/A,Sixty-eighth session,120,Follow-up to the commemoration of the two-hundredth anniversary of the abolition of the transatlantic slave trade,"Antigua and Barbuda, Austria, Bahamas, Barbados, Belize, Brazil, Chile, Costa Rica, Croatia, Cuba, Dominica, El Salvador, Ethiopia,* France, Grenada, Guatemala, Guyana, Haiti, Honduras, India, Israel, Italy, Jamaica, Lithuania, Montenegro, Nauru, Netherlands, New Zealand, Nicaragua, Panama, Peru, Saint Kitts and Nevis, Saint Lucia, Saint Vincent and the Grenadines, Singapore, Suriname, Sweden, Trinidad and Tobago, Turkey, United Kingdom of Great Britain and Northern Ireland and United States of America",N/A,Permanent memorial to and remembrance of the victims of slavery and the transatlantic slave trade,"Addendum Add the following countries to the list of sponsors of the resolution: Andorra, Argentina, Armenia, Azerbaijan, Belarus, Belgium, Bosnia and Herzegovina, Bulgaria, Cambodia, Cameroon, Canada, Cape Verde, China, Cyprus, Czech Republic, Denmark, Equatorial Guinea, Estonia, Finland, Georgia, Germany, Greece, Hungary, Iceland, Indonesia, Iran (Islamic Republic of), Ireland, Japan, Latvia, Lebanon, Luxembourg, Malaysia, Maldives, Mexico, Monaco, Mongolia, Norway, Paraguay, Philippines, Poland, Portugal, Republic of Moldova, Romania, Russian Federation, Samoa, San Marino, Serbia, Seychelles, Slovakia, Slovenia, Spain, Thailand, the former Yugoslav Republic of Macedonia and Ukraine 23 WNT rate recycle 231013 ine",10/21/2013,2013_759562,Seychelles,* On behalf of the States Members of the United Nations that are members of the Group of African States.,yes
2013,General Assembly,Third Committee,Sixty-eighth session,68,Right of peoples to self-determination,"Albania, Algeria, Angola, Antigua and Barbuda, Armenia, Azerbaijan, Bangladesh, Belarus, Benin, Brazil, Burkina Faso, Burundi, Cameroon, China, Comoros, Congo, Cote d’Ivoire, Egypt, El Salvador, Eritrea, Grenada, Guinea, Honduras, Iran (Islamic Republic of), Jordan, Kuwait, Lebanon, Libya, Malawi, Malaysia, Maldives, Mozambique, Namibia, Niger, Nigeria, Oman, Pakistan, Qatar, Russian Federation, Saudi Arabia, Senegal, Seychelles, Sierra Leone, Singapore, Somalia, South Africa, Sudan, Swaziland, Thailand, Togo, Tunisia, Uganda, United Arab Emirates, United Republic of Tanzania, Viet Nam, Zambia and Zimbabwe",N/A,Universal realization of the right of peoples to self-determination,"The General Assembly, Reaffirming the importance, for the effective guarantee and observance of human rights, of the universal realization of the right of peoples to self- determination enshrined in the Charter of the United Nations and embodied in the International Covenants on Human Rights,! as well as in the Declaration on the Granting of Independence to Colonial Countries and Peoples contained in General Assembly resolution 1514 (XV) of 14 December 1960, Welcoming the progressive exercise of the right to self-determination by peoples under colonial, foreign or alien occupation and their emergence into sovereign statehood and independence, Deeply concerned at the continuation of acts or threats of foreign military intervention and occupation that are threatening to suppress, or have already suppressed, the right to self-determination of peoples and nations, Expressing grave concern that, as a consequence of the persistence of such actions, millions of people have been and are being uprooted from their homes as refugees and displaced persons, and emphasizing the urgent need for concerted international action to alleviate their condition, 1 Resolution 2200 A (XXI), annex. 13-54918 ui 071113 A NY A A Recalling the relevant resolutions regarding the violation of the right of peoples to self-determination and other human rights as a result of foreign military intervention, aggression and occupation, adopted by the Commission on Human Rights at its sixty-first? and previous sessions, Reaffirming its previous resolutions on the universal realization of the right of peoples to self-determination, including resolution 67/157 of 20 December 2012, Reaffirming also its resolution 55/2 of 8 September 2000, containing the United Nations Millennium Declaration, and recalling its resolution 60/1 of 16 September 2005, containing the 2005 World Summit Outcome, which, inter alia, upheld the right to self-determination of peoples under colonial domination and foreign occupation, Taking note of the report of the Secretary-General on the right of peoples to self-determination, 3 1. Reaffirms that the universal realization of the right of all peoples, including those under colonial, foreign and alien domination, to self-determination is a fundamental condition for the effective guarantee and observance of human rights and for the preservation and promotion of such rights; 2. Declares its firm opposition to acts of foreign military intervention, aggression and occupation, since these have resulted in the suppression of the right of peoples to self-determination and other human rights in certain parts of the world; 3. Calls upon those States responsible to cease immediately their military intervention in and occupation of foreign countries and territories and all acts of repression, discrimination, exploitation and maltreatment, in particular the brutal and inhuman methods reportedly employed for the execution of those acts against the peoples concerned; 4. Deplores the plight of millions of refugees and displaced persons who have been uprooted as a result of the aforementioned acts, and reaffirms their right to return to their homes voluntarily in safety and with honour; 5. | Requests the Human Rights Council to continue to give special attention to violations of human rights, especially the right to self-determination, resulting from foreign military intervention, aggression or occupation; 6. | Requests the Secretary-General to report on the question to the General Assembly at its sixty-ninth session under the item entitled “Right of peoples to self-determination”. 2 See Official Records of the Economic and Social Council, 2005, Supplement No. 3 and corrigenda (E/2005/23 and Corr.1 and 2), chap. II, sect. A. 3 A/68/318. 2/2",11/05/2013,2013_760327,Seychelles,N/A,yes
