year,Council,Committee,Session,Agenda item,Agenda detail,cosponsored countries,body title number,body title detail,body text,date,file,filecountry,footnote,scanned
2019,General Assembly,N/A,Seventy-third session,14,"Integrated and coordinated implementation of and follow-up to the outcomes of the major United Nations conferences and summits in the economic, social and related fields","Benin, Costa Rica, Democratic People’s Republic of Korea, Ecuador, El Salvador, Guatemala, Palau, Philippines and Venezuela (Bolivarian Republic of)",N/A,United Nations Decade on Ecosystem Restoration (2021-2030),"Addendum Add the following countries to the list of sponsors of the resolution: Albania, Andorra, Angola, Argentina, Armenia, Austria, Bangladesh, Belgium, Bolivia (Plurinational State of), Cameroon, Canada, Central African Republic, Chile, Colombia, Croatia, Cuba, Cyprus, Czechia, Dominican Republic, Estonia, Fiji, Finland, France, Georgia, Greece, Hungary, Iceland, India, Indonesia, Ireland, Italy, Kazakhstan, Latvia, Liechtenstein, Lithuania, Malta, Mexico, Monaco, Netherlands, Nicaragua, Nigeria, North Macedonia, Norway, Panama, Paraguay, Peru, Poland, Romania, Russian Federation, Saint Lucia, Serbia, Slovakia, Slovenia, Spain, Sri Lanka, Sweden, Tajikistan, Timor-Leste, Turkey, United Kingdom of Great Britain and Northern Ireland, Uruguay and Viet Nam Bree 472 Please recycle OQ ol 19-03515 Hi 050319 A A AA",03/01/2019,2019_3793718,Sri Lanka,N/A,yes
2019,General Assembly,Commission On Human Rights,Fortieth session,3,"Promotion and protection of all human rights, civil, political, economic, social and cultural rights, including the right to development","Albania,* Afghanistan, Argentina, Australia, Austria, Bahamas, Belgium,* Bulgaria, Bolivia (Plurinational State of),** Cabo Verde,* Canada,* Chile, Colombia,* Costa Rica,* Croatia, Cyprus,* Czechia, Denmark, Dominican Republic,* Ecuador,* Egypt, El Salvador,* Estonia,* Fiji, Finland,* France,* Georgia,* Germany,* Greece,* Guatemala,* Haiti,* Honduras,* Hungary, Iceland, Ireland,* Israel,* Italy, Latvia,* Liechtenstein,* Lithuania,* Luxembourg,* Malta,* Mexico, Monaco,* Mongolia,* Montenegro,* Netherlands,* Nicaragua,* Norway,* Pakistan, Panama,* Paraguay,* Peru, Philippines, Poland,* Portugal,* Republic of Moldova,* Romania,* Russian Federation,* Slovakia, Slovenia,* Spain, Sri Lanka,* Sweden,* Switzerland,* Thailand,* Tunisia, Turkey,* Ukraine, United Kingdom of Great Britain and Northern Ireland, Uruguay, Venezuela (Bolivarian Republic of):*",N/A,40/... Thirtieth anniversary of the Convention on the Rights of the Child,"The Human Rights Council, Guided by the Charter of the United Nations, the Universal Declaration of Human Rights, the International Covenants on Human Rights and other relevant human rights instruments, Noting that 2019 marks the thirtieth anniversary of the Convention on the Rights of the Child, adopted by the General Assembly in its resolution 44/25 of 20 November 1989, which constitutes the standard in the promotion and protection of the rights of the child, as well as the sixtieth anniversary of the Declaration of the Rights of the Child, proclaimed by the Assembly in 1959, Recognizing that the Convention on the Rights of the Child is the most widely ratified international human rights instrument, Noting the Optional Protocols to the Convention on the Rights of the Child on the involvement of children in armed conflict, on the sale of children, child prostitution and child pornography and on a communications procedure, Welcoming the work of the Committee on the Rights of the Child, GE. 19-04390(E) Please recycle eS A/HRC/40/L.21 Emphasizing that the anniversaries offer a valuable opportunity to raise awareness and to reflect on achievements, best practices and challenges with regard to the full realization and continued advancement of the rights of the child, Stressing the necessity for continued national efforts aimed at the full realization of all human rights and fundamental freedoms, including the rights of the child, and acknowledging the benefits of enhanced international cooperation to that end, 1. Calls for renewed efforts towards the full implementation of the Convention on the Rights of the Child by all parties and ratification by non-party States; 2. Also calls for wider ratification of the Optional Protocols to the Convention on the Rights of the Child; 3. Invites the President of the Human Rights Council to consider the theme “Thirty years of implementation of the Convention on the Rights of the Child: challenges and opportunities” for the annual high-level panel discussion on human rights mainstreaming to be held at the forty-third session of the Council; 4. Requests the Office of the United Nations High Commissioner for Human Rights to liaise with States, relevant United Nations bodies and agencies, treaty bodies, in particular the Committee on the Rights of the Child, special procedures and regional human rights mechanisms, as well as with civil society, including non-governmental organizations, and national human rights institutions, with a view to ensuring their participation in the panel discussion, and to make the panel discussion fully accessible for persons with disabilities; 5. Requests the United Nations High Commissioner for Human Rights to make provisions and provide resources for the above-mentioned panel discussion and to circulate the relevant information among States and other stakeholders; 6. Invites the High Commissioner to make provisions for events and arrangements aimed at the celebration of the anniversary of the Convention on the Rights of the Child and to circulate the relevant information among States and other stakeholders, within existing resources and, where appropriate, in partnership with other international and regional organizations; 7. Encourages States to use the anniversary of the Convention on the Rights of the Child as a tool to raise awareness of the Convention and to maintain momentum and increase action with respect to the rights of the child.",03/18/2019,2019_3798044,Sri Lanka,* State not a member of the Human Rights Council. *1904390%,yes
