year,Council,Committee,Session,Agenda item,Agenda detail,cosponsored countries,body title number,body title detail,body text,date,file,filecountry,footnote,scanned
2001,General Assembly,N/A,Fifty-fifth session,20 (b),"Strengthening of the coordination of humanitarian and disaster relief assistance of the United Nations, including special economic assistance: special economic assistance to individual countries or regions","Argentina, Barbados, Belize, Bolivia, Brazil, Chile, Colombia, Costa Rica, Cuba, Dominican Republic, Ecuador, El Salvador, Grenada, Guatemala, Haiti, Honduras, Jamaica, Mexico, Nicaragua, Panama, Paraguay, Peru, Saint Vincent and the Grenadines, Trinidad and Tobago, Uruguay and Venezuela",N/A,Assistance to El Salvador as a result of the earthquake of 13 January 2001,"Addendum Add the following countries to the list of sponsors of the resolution: Andorra, Antigua and Barbuda, Armenia, Australia, Austria, Azerbaijan, Bahamas, Bangladesh, Belarus, Belgium, Bhutan, Bulgaria, Cambodia, Canada, Cape Verde, Croatia, Cyprus, Czech Republic, Denmark, Egypt, Estonia, Fiji, Finland, France, Gabon, Germany, Guyana, Iceland, India, Ireland, Israel, Italy, Japan, Jordan, Kuwait, Kyrgyzstan, Latvia, Lesotho, Liberia, Libyan Arab Jamabhiriya, Liechtenstein, Lithuania, Luxembourg, Malta, Mauritius, Monaco, Mongolia, Morocco, Myanmar, Nauru, Nepal, Netherlands, New Zealand, Norway, Papua New Guinea, Philippines, Poland, Portugal, Qatar, Republic of Korea, Romania, Saint Kitts and Nevis, Saint Lucia, San Marino, Senegal, Singapore, Slovakia, Slovenia, Solomon Islands, South Africa, Spain, Suriname, Swaziland, Sweden, Syrian Arab Republic, Thailand, the former Yugoslav Republic of Macedonia, Togo, Turkey, United Kingdom of Great Britain and Northern Ireland, United States of America, Yemen, Yugoslavia 01-22898 (E) 260101",01/26/2001,2001_431830,Suriname,N/A,yes
2001,General Assembly,N/A,Fifty-fifth session,20 (b),Strengthening of the coordination of humanitarian,"Antigua and Barbuda, Argentina, Bahamas, Barbados, Belize, Bolivia, Brazil, Chile, Colombia, Costa Rica, Cuba, Dominican Republic, Ecuador, El Salvador, Grenada, Guatemala, Guyana, Haiti, Honduras, Jamaica, Mexico, Nicaragua, Panama, Paraguay, Peru, Saint Kitts and Nevis, Saint Lucia, Suriname, Trinidad and Tobago, Uruguay and Venezuela",N/A,Assistance to Bolivia as a result of the flooding experienced in recent months,"The General Assembly, Distressed by the floods, torrents, cave-ins, landslides and inundation caused mainly by the torrential rains that fell in recent months, resulting in severe economic damage and loss of human lives in the territory of Bolivia, Recognizing the large-scale relief and humanitarian assistance efforts being made by the Government and people of Bolivia to alleviate the suffering of the disaster victims and meet their immediate needs, Noting the enormous efforts that have been made by the people and Government of Bolivia to build peace and democracy and achieve a favourable environment for promoting economic growth and furthering human development, Aware of the grave consequences of natural disasters, which may present serious obstacles to economic and social development in the developing countries, and which require considerable amounts of human and financial resources to overcome their negative effects, and considering it essential that the international community offer all its technical and financial support and assistance in order to supplement national efforts and undertake, as soon as possible, the process of rehabilitation, reconstruction and development in the areas afflicted by these natural disasters, 1. Expresses its solidarity and support to the Government and people of Bolivia in these difficult times; 2. Welcomes the valuable support of the international community in the work of rescuing and providing emergency relief to the stricken population; 3. Urges all Member States, specialized agencies and other organizations and organs of the United Nations system, together with international financial institutions and non-governmental organizations, to continue responding generously to Bolivia in its emergency, rehabilitation and reconstruction tasks and programmes, in order to maintain the present political stability and prevent the effects of this natural disaster from becoming an impediment to the economic and social development of Bolivia; 4. Requests the Secretary-General to make every effort to continue mobilizing and coordinating the humanitarian assistance being provided by the specialized agencies and other organizations and organs of the United Nations system in support of the efforts of the Government of Bolivia.",02/09/2001,2001_432612,Suriname,N/A,yes
2001,General Assembly,N/A,Fifty-fifth session,46,The situation in Afghanistan and its implications for international peace and security,"Afghanistan, Andorra, Armenia, Australia, Austria, Azerbaijan, Belgium, Benin, Bhutan, Bosnia and Herzegovina, Brazil, Bulgaria, Cambodia, Canada, Chile, Colombia, Costa Rica, Croatia, Cyprus, Czech Republic, Denmark, Dominican Republic, Ecuador, Egypt, El Salvador, Estonia, Fiji, Finland, France, Georgia, Germany, Greece, Guatemala, Haiti, Hungary, Iceland, India, Iran (Islamic Republic of), Ireland, Israel, Italy, Japan, Kazakhstan, Liberia, Liechtenstein, Lithuania, Luxembourg, Malta, Mauritius, Mexico, Micronesia (Federated States of), Mongolia, Myanmar, Nepal, Netherlands, New Zealand, Nicaragua, Norway, Panama, Paraguay, Poland, Portugal, Republic of Korea, Romania, Russian Federation, Samoa, San Marino, Slovakia, Spain, Sri Lanka, Sweden, Tajikistan, the former Yugoslav Republic of Macedonia, Togo, Turkey, Ukraine, United Kingdom of Great Britain and Northern Ireland, United States of America, Uruguay and Yugoslavia",N/A,The destruction of relics and monuments in Afghanistan,"Addendum Add the following countries to the list of sponsors of the resolution: Argentina, Bolivia, Madagascar, Monaco, Peru, Republic of Moldova, Sierra Leone, Slovenia, Solomon Islands, South Africa, Suriname, Thailand and Uzbekistan. 01-28134 (E) 090301",03/09/2001,2001_434704,Suriname,N/A,yes
2001,Economic And Social Council,Commission On Human Rights,Forty-fifth session,3,"Follow-up to the Fourth World Conference on Women and to the special session of the General Assembly entitled “Women 2000: gender equality, development and peace for the twenty-first century”","Argentina, Azerbaijan, Bosnia and Herzegovina,* Georgia,* Iran (Islamic Republic of), Kazakhstan,* Pakistan, Suriname,* Tajikistan and Turkey",N/A,"Release of women and children taken hostage, including those subsequently imprisoned, in armed conflicts","The Commission on the Status of Women, Recalling its resolutions 39/2 of 31 March 1995, 40/1 of 22 March 1996, 41/1 of 21 March 1997, 42/2 of 13 March 1998, 43/1 of 12 March 1999 and 44/1 of 2 March 2000, Recalling also the relevant provisions contained in the instruments of international humanitarian law relative to the protection of women and children in areas of armed conflict, Welcoming the adoption of the Beijing Declaration' and Platform for Action® adopted by the Fourth World Conference on Women, including the provisions regarding violence against women and children, Expressing grave concern at the continuation of armed conflicts in many regions throughout the world and the human suffering and humanitarian emergencies they have caused, Emphasizing that all forms of violence committed against the civilian population, including women and children in areas of armed conflict, including Report of the Fourth World Conference on Women, Beijing, 4-15 September 1995 (United Nations publication, Sales No. E.96.1V.13), chap. I, resolution 1, annex I. capturing them as hostages, seriously contravene international humanitarian law, in particular the Geneva Conventions of 12 August 1949 for the protection of victims of war,’ Expressing its strong belief that the rapid and unconditional release of women and children taken hostage in areas of armed conflict will promote the implementation of the noble goals enshrined in the Beijing Declaration and the Platform for Action, 1. Condemns violent acts in contravention of international humanitarian law against civilian women and children in areas of armed conflict, and calls for an effective response to such acts, including the immediate release of such women and children taken hostage, including those subsequently imprisoned, in armed conflicts; 2. Strongly urges all parties to armed conflicts to respect fully the norms of international humanitarian law in armed conflict and to take all necessary measures for the protection of these women and children and for their immediate release; 3. Urges all parties to armed conflicts to provide safe unimpeded access to humanitarian assistance for these women and children; 4. Requests the Secretary-General and all relevant international organizations to use their capabilities and efforts to facilitate the release of these women and children; 5. Also requests the Secretary-General to prepare, taking into account the information provided by States and relevant international organizations, a report on the implementation of the present resolution for submission to the Commission on the Status of Women at its forty-sixth session. ? United Nations Treaty Series, vol. 75, Nos. 970-973.",03/08/2001,2001_434729,Suriname,* In accordance with rule 69 of the rules of procedure of the functional commissions of the Economic and Social Council.,yes
2001,General Assembly,N/A,Fifty-fifth session,32,United Nations Year of Dialogue among Civilizations,"Afghanistan, Algeria, Andorra, Argentina, Armenia, Australia, Austria, Azerbaijan, Bangladesh, Belgium, Bhutan, Bosnia and Herzegovina, Brazil, Bulgaria, Burkina Faso, Cambodia, Canada, Colombia, Costa Rica, Croatia, Cyprus, Czech Republic, Democratic Republic of the Congo, Denmark, Dominican Republic, Ecuador, Egypt, El Salvador, Estonia, Fiji, Finland, France, Gabon, Georgia, Germany, Greece, Guatemala, Haiti, Hungary, Iceland, Indonesia, Iran (Islamic Republic of), Ireland, Israel, Italy, Japan, Jordan, Kazakhstan, Lao People’s Democratic Republic, Latvia, Lebanon, Liechtenstein, Lithuania, Luxembourg, Madagascar, Mali, Malta, Mauritius, Mexico, Monaco, Mongolia, Morocco, Netherlands, New Zealand, Nicaragua, Norway, Pakistan, Panama, Poland, Portugal, Republic of Korea, Republic of Moldova, Romania, Russian Federation, Saint Kitts and Nevis, San Marino, Slovakia, Slovenia, Spain, Sri Lanka, Sweden, Thailand, the former Yugoslav Republic of Macedonia, Tunisia, Turkey, Ukraine, United Kingdom of Great Britain and Northern Ireland, United States of America, Uruguay, Yemen, Yugoslavia and Zambia",N/A,Protection of religious sites,"Addendum Add the following countries to the list of sponsors of the resolution: Albania, Bahamas, Barbados, Belarus, Benin, Bolivia, Grenada, Guinea, Guyana, Kyrgyzstan, Liberia, Malaysia, Myanmar, Oman, Paraguay, Senegal, South Africa, Sudan, Suriname, Tajikistan, Trinidad and Tobago, Uzbekistan and Venezuela 01-39285 (E) 310501",05/31/2001,2001_441481,Suriname,N/A,yes
2001,General Assembly,N/A,Fifty-fifth session,186,2001-2010: Decade to Roll Back Malaria in Africa,"Algeria, Angola, Austria, Azerbaijan, Belgium, Benin, Botswana, Bulgaria, Burkina Faso, Burundi, Cambodia, Cameroon, Cape Verde, Central African Republic, Chad, Congo, Cote d’Ivoire, Democratic People’s Republic of Korea, Denmark, Djibouti, Dominican Republic, El Salvador, France, Gambia, Germany, Ghana, Grenada, Guatemala, Guinea, Guinea-Bissau, India, Italy, Jordan, Kenya, Lesotho, Libyan Arab Jamahiriya, Luxembourg, Madagascar, Malawi, Mali, Malta, Mauritania, Mauritius, Mozambique, Namibia, Netherlands, Nicaragua, Niger, Nigeria, Norway, Pakistan, Portugal, Rwanda, Senegal, Sierra Leone, Singapore, Slovenia, South Africa, Sudan, Suriname, Swaziland, Sweden, the former Yugoslav Republic of Macedonia, Togo, Tunisia, Uganda, United Kingdom of Great Britain and Northern Ireland, United Republic of Tanzania, Zambia and Zimbabwe",2001,"2010: Decade to Roll Back Malaria in Developing Countries, Particularly in Africa","The General Assembly, Recalling its resolutions 49/135 of 19 December 1994 and 50/128 of 20 December 1995 concerning the struggle against malaria in the developing countries, particularly in Africa, Bearing in mind the relevant resolutions of the Economic and Social Council relating to the struggle against malaria and diarrhoeal diseases, in particular its resolution 1998/36 of 30 July 1998, Acknowledging that it is important and necessary for countries where malaria is endemic to adopt appropriate strategies to combat malaria, one of the most deadly of all tropical diseases, which annually causes approximately a million deaths in Africa, where nine out of every 10 cases of malaria occur, Taking note of the declarations and decisions on health issues adopted by the Organization of African Unity, in particular the Declaration and Plan of Action on the “Roll Back Malaria” initiative adopted at the Extraordinary Summit of Heads of State and Government of the Organization of African Unity, held in Abuja on 24 and 25 July 2000, as well as decision AHG/Dec.155 (XXXVI) concerning the implementation of that Declaration and Plan of Action, adopted by the Assembly of Heads of State and Government of the Organization of Afriﬁn Unity at its thirty- sixth ordinary session, held in Lomé from 10 to 12 July 2000, Further acknowledging the efforts of the World Health Organization and other partners to fight malaria over the years, including the launching of the Roll Back Malaria Partnership in 1998, Recognizing that malaria-related ill-health and deaths throughout the world could be eliminated with political commitment and commensurate resources if the public was educated and sensitized about malaria and appropriate health services were made available in countries where the disease is endemic, Emphasizing that the international community has an essential role to play in strengthening the support and assistance provided to developing countries, particularly African countries, in their efforts to reduce the incidence of malaria and mitigate its negative effects, Emphasizing also—the importance of implementing the United Nations Millennium DeclarationgI and welcoming, in this connection, the commitments of Member States to respond to the specific needs of Africa, 1. Proclaims the period 2001-2010 the Decade to Roll Back Malaria in Developing Countries, Particularly in Africa; 2. Takes note with satisfaction of the continuing efforts of developing countries, particularly those in African countries, to combat malaria through the formulation of plans and strategies at the national, regional and continental levels, despite their limited financial, technical and human resources; 3. Stresses that the proclamation of the Decade will stimulate the efforts of African countries and the international community to not only roll back malaria worldwide, in particular in Africa, where the burden is heaviest, but also to prevent its spread to previously malaria-free areas; 4. Appeals to the international community, United Nations bodies, international and regional organizations and non-governmental organizations to allocate substantial new and additional resources, including through the new global fund to fight HIV/AIDS, malaria and tuberculosis, launched by the Group of Eight Major Industrialized Countries at its Genoa Summit in 2001 and by the Secretary- General, for developing countries, particularly in Africa, with a view to enabling them to fully implement the Plan of Action adopted in Abuja for the “Roll Back Malaria” initiative; 5. Commends the World Health Organization and its partners and urges them to provide the necessary support for its ongoing measures to combat malaria in developing countries, particularly in Africa, and to provide the necessary assistance to African States in order to meet their objectives; 6. Calls for joint comprehensive efforts between Africa and the international community to ensure that by the year 2005, the following targets are achieved: 1 See A/55/286, annex II. 2 Resolution 55/2. A/55/L.84/Rev.1 (a) At least 60 per cent of those at risk of malaria, particularly pregnant women and children under five years of age, benefit from the most suitable combination of personal and community protective measures, such as insecticide- treated bednets and other interventions that are accessible and affordable, to prevent infection and suffering; (b) At least 60 per cent of all pregnant women who are at risk of malaria, especially those in their first pregnancies, have access to chemoprophylaxis of presumptive intermittent treatment; (c) At least 60 per cent of those suffering from malaria have prompt access to and are able to use correct, affordable and appropriate treatment within 24 hours of the onset of symptoms. 7. Reiterates the need to ensure that measures to reduce malaria transmission risks, including environmental management, are included in development planning and activities; 8. Requests the Secretary-General, acting in close collaboration with the Director-General of the World Health Organization, developing countries and regional organizations, including the Organization of African Unity, to conduct in 2005 an evaluation of the measures taken and progress made towards the achievement of the mid-term targets, the means of implementation provided by the international community in this regard and the overall goals of the Decade, and to report thereon to the General Assembly at its sixtieth session; 9. Also requests the Secretary-General to report to it at its fifty-seventh session on the implementation of the present resolution.",09/04/2001,2001_447853,Suriname,N/A,yes
