year,Council,Committee,Session,Agenda item,Agenda detail,cosponsored countries,body title number,body title detail,body text,date,file,filecountry,footnote,scanned
2001,General Assembly,Third Committee,Fifty-sixth session,27,Implementation of the outcome of the World Summit for Social Development and of the twenty-fourth special session of the General Assembly,"Andorra, Antigua and Barbuda, Argentina, Austria, Bangladesh, Belarus, Belgium, Benin, Bhutan, Bolivia, Bosnia and Herzegovina, Botswana, Brazil, Cameroon, Cape Verde, Chile, China, Colombia, Congo, Costa Rica, Croatia, Cuba, Cyprus, Czech Republic, Denmark, Djibouti, Dominican Republic, Ecuador, El Salvador, Finland, France, Georgia, Germany, Ghana, Greece, Guatemala, Guinea-Bissau, Haiti, Hungary, Iceland, India, Iran (Islamic Republic of ), Ireland, Italy, Japan, Kenya, Liechtenstein, Lithuania, Luxembourg, Madagascar, Malaysia, Mali, Mauritania, Mexico, Monaco, Mongolia, Namibia, Netherlands, Nigeria, Norway, Pakistan, Panama, Paraguay, Peru, Philippines, Poland, Portugal, Republic of Korea, Romania, Russian Federation, San Marino, Seychelles, Singapore, South Africa, Spain, Sri Lanka, Sudan, Suriname, Swaziland, Sweden, Turkey, Uganda, Ukraine, United Arab Emirates, United Kingdom of Great Britain and Northern Ireland, United Republic of Tanzania, United States of America, Uruguay, Venezuela, Zambia and Zimbabwe",N/A,Implementation of the outcome of the World Summit for Social Development and of the twenty-fourth special session of the General Assembly,"Recalling the World Summit for Social Development, held at Copenhagen from 6 to 12 March 1995, and the twenty-fourth special session of the General Assembly, entitled “World Summit for Social Development and beyond: achieving social development for all in a globalizing world”, held at Geneva from 26 June to 1 July 2000, Reaffirming that the Copenhagen Declarationﬂand the Programme of Actionzﬂ and the further initiatives for social developmentﬂadopted by the General Assembly at its twenty-fourth special session constitute the basic framework for the promotion of social development for all at the national and international levels, Recalling the United Nations Millennium Declaration,lzI Also recalling and reaffirming the commitments made at major United Nations conferences, special sessions, summit conferences and their follow-up processes, and the principles expressed in relevant United Nations declarations, Further recalling its resolution 55/46 of 29 November 2000, on the implementation of the outcome of the World Summit for Social Development and the twenty-fourth special session of the Assembly, 1. Reaffirms the commitments made by heads of State and Government at the World Summit for Social Development, contained in the Copenhagen Declaration on Social Development' and the Programme of Action,” which established a new consensus to place people at the centre of the concerns for sustainable development and pledged to eradicate poverty, promote full and productive employment and foster social integration so as to achieve stable, safe and just societies for all; 2. Also reaffirms the decisions on further action and initiatives to accelerate social development for all, adopted by the General Assembly at its twenty-fourth special session and contained in the further initiatives for social development;’ 3. Stresses the vital importance of placing the goals of social development, as contained in the Copenhagen Declaration and the Programme of Action and in the further initiatives for social development at the centre of economic policy-making, including in policies that influence domestic and global market forces and the global economy; 4. Encourages coordinated and mutually reinforcing follow-up to the Copenhagen Declaration on Social Development and the Programme of Action, the further initiatives for social development and the United Nations Millennium Declaration, emphasizing the strong interrelatedness in relation to social development issues; 5. Invites the Secretary-General, the Economic and Social Council, the Commission for Social Development, the regional commissions, the relevant agencies, funds and programmes of the United Nations system and other relevant intergovernmental forums, within their respective mandates, to take on a priority basis and in a coordinated manner all steps necessary to ensure the effective implementation of all commitments and undertakings contained in the Copenhagen Declaration and the Programme of Action and in the further initiatives for social development, and to continue to be actively involved in their follow-up; 1 Report of the World Summit for Social Development, Copenhagen, 6-12 March 1995 (United Nations publication, Sales No. E.3.96.1V.8), chap. I, resolution 1, annex I. A/C.3/56/L.11 6. Recognizes that the implementation of the outcome of the World Summit for Social Development and of the twenty-fourth special session calls for the strengthening of cooperation at the regional level through, inter alia, the promotion of dialogue among regional and subregional groups and organizations, encouragement of the implementation of regional social development agendas where they exist, and encouragement of recipient countries, donor Governments and agencies and multilateral financial institutions to take greater account of the regional social development agenda of the regional commissions and of regional and subregional organizations, inter alia, in their funding policies and programmes; 7. Reaffirms that a strong political commitment by the international community is needed to implement strengthened and effective international cooperation and assistance for development, including social development, that the mobilization of domestic and international resources for development from all sources is an essential component of the implementation of the Copenhagen Declaration on Social Development and the Programme of Action and of the further initiatives for social development; 8. Welcomes the convening of the International Conference on Financing for Development, to be held at Monterrey, Mexico from 18 to 22 March 2002, which will consider the mobilization of national and international resources for social development, and the World Summit on Sustainable Development, to be held at Johannesburg, South Africa, from 2 to 11 September 2002, and encourages their preparatory committees and other relevant intergovernmental bodies involved in the preparations for and follow-up to those conferences to give consideration to the outcomes of the World Summit for Social Development and of the twenty-fourth special session; 9. Reaffirms that the follow-up to the World Summit for Social Development and the relevant special session will be undertaken on the basis of an integrated approach to social development and within the framework of a coordinated follow-up to major international conferences and summits in the economic, social and related fields and, in this regard, takes note of Economic and Social Council resolution 2001/21 of 26 July 2001, on integrated and coordinated implementation of and follow-up to major United Nations conferences and summits; 10. Also reaffirms the need for effective partnership and cooperation between Governments and the relevant actors of civil society, including non-governmental organizations and the private sector, in the implementation of and follow-up to the Copenhagen Declaration and the Programme of Action and the further initiatives for social development, and the need for ensuring their involvement in the planning, elaboration, implementation and evaluation of social policies at the national level; 11. Further reaffirms that the Commission for Social Development, as a functional commission of the Economic and Social Council, will continue to have the primary responsibility for the follow-up to and review of the further implementation of the commitments made at Copenhagen and the outcome of the special session; 12. Invites Governments to support the work of the Commission for Social Development, inter alia, through the participation of high-level representatives on social development issues and policies, and to continue to assess on a regular basis the progress made at the national level towards the implementation of the outcome A/C.3/56/L.11 of the World Summit for Social Development and the twenty-fourth special session, and to submit such information on a voluntary basis to the Commission; 13. Takes into account that the Commission for Social Development at its fortieth session, in 2002, will consider the priority theme, “Integration of social and economic policy”, and emphasizes the importance of the active participation in and contribution to the work of the Commission by the relevant funds and programmes as well as the specialized agencies of the United Nations system; 14. Takes note of the Report on the World Social Situation, 2001,EI and requests the Secretary-General to submit future reports on a biennial basis; 15. Takes note of the report of the Secretary-General on the implementation of the outcome of the World Summit for Soc'@l Development and of the twenty- fourth special session of the General Assembly; 16. Decides to include in the provisional agenda of its fifty-seventh session an item entitled “Implementation of the outcome of the World Summit for Social Development and of the twenty-fourth special session of the General Assembly”, and requests the Secretary-General to submit to the General Assembly at its fifty- seventh session a report on this question. 5 United Nations publication, Sales No. E.01.IV.5. 6 A/56/140.",10/12/2001,2001_450116,Suriname,N/A,yes
2001,General Assembly,First Committee,Fifty-sixth session,74 (s),General and complete disarmament: transparency in armaments,"Andorra, Argentina, Armenia, Australia, Austria, Belgium, Bhutan, Bolivia, Bosnia and Herzegovina, Brazil, Bulgaria, Burkina Faso, Cambodia, Cameroon, Canada, Chile, Congo, Costa Rica, Cote d’Ivoire, Croatia, Czech Republic, Denmark, Estonia, Fiji, Finland, France, Germany, Ghana, Greece, Guatemala, Guinea, Guinea-Bissau, Guyana, Haiti, Hungary, Iceland, Ireland, Israel, Italy, Japan, Kazakhstan, Lesotho, Liberia, Liechtenstein, Lithuania, Luxembourg, Madagascar, Malaysia, Malta, Nepal, Netherlands, New Zealand, Nicaragua, Nigeria, Norway, Panama, Philippines, Poland, Portugal, Republic of Moldova, Romania, Russian Federation, San Marino, Sierra Leone, Singapore, Slovakia, Slovenia, Solomon Islands, South Africa, Spain, Suriname, Sweden, Thailand, the former Yugoslav Republic of Macedonia, Turkey, Tuvalu, Ukraine, United Kingdom of Great Britain and Northern Ireland, United Republic of Tanzania, United States of America, Yugoslavia",N/A,Transparency in armaments,"The General Assembly, Recalling its resolution 46/36 L of 9 December 1991, 47/52 L of 15 December 1992, 48/75 E of 16 December 1993, 49/75 C of 15 December 1994, 50/70 D of 12 December 1995, 51/45 H of 10 December 1996, 52/38 R of 9 December 1997, 53/77 V of 4 December 1998, 54/54 O of 1 December 1999 and 55/33 U of 20 November 2000 entitled “Transparency in armaments”, Continuing to take the view that an enhanced level of transparency in armaments contributes greatly to confidence-building and security among States and that the establishment of the United Nations Register of Conventional Arms' constitutes an important step forward in the promotion of transparency in military matters, Welcoming the consolidated report of the Secretary-General on the Register, which includes the returns of Member States for 2000, ' See resolution 46/36 L. 2 A/56/257. Welcoming also the response of Member States to the request contained in paragraphs 9 and 10 of resolution 46/36 L to provide data on their imports and exports of arms, as well as available background information regarding their military holdings, procurement through national production and relevant policies, Stressing that the continuing operation of the Register and its further development should be reviewed in order to secure a Register that is capable of attracting the widest possible participation, 1. Reaffirms its determination to ensure the effective operation of the United Nations Register of Conventional Arms,' as provided for in paragraphs 7 to 10 of resolution 46/36 L; 2. Calls upon Member States, with a view to achieving universal participation, to provide the Secretary-General by 31 May annually with the requested data and information for the Register, including nil reports if appropriate, on the basis of resolutions 46/36 L and 47/52 L, the recommendations contained in paragraph 64 of the 1997 report of the Secretary-General on the continuing operation of the Register and its further development® and the recommendations contained in paragraph 94 of the 2000 report of the Secretary-General and the appendices and annexes thereto;* 3. Invites Member States in a position to do so, pending further development of the Register, to provide additional information on procurement from national production and military holdings and to make use of the “Remarks” column in the standardized reporting form to provide additional information such as types or models; 4. Reaffirms its decision, with a view to further development of the Register, to keep the scope of and participation in the Register under review and, to that end: (a) Recalls its request to Member States to provide the Secretary-General with their views on the continuing operation of the Register and its further development and on transparency measures related to weapons of mass destruction; (b) Requests the Secretary-General, with the assistance of a group of governmental experts to be convened in 2003, on the basis of equitable geographical representation, to prepare a report on the continuing operation of the Register and its further development, taking into account the work of the Conference on Disarmament, the views expressed by Member States and the reports of the Secretary-General on the continuing operation of the Register and its further development, with a view to a decision at its fifty-eighth session; 5. Requests the Secretary-General to implement the recommendations in his 2000 report on the continuing operation of the Register and its further development and to ensure that sufficient resources are made available for the Secretariat to operate and maintain the Register; A/C.1/56/L.40 6. Invites the Conference on Disarmament to consider continuing its work undertaken in the field of transparency in armaments; 7. Reiterates its call upon all Member States to cooperate at the regional and subregional levels, taking fully into account the specific conditions prevailing in the region or subregion, with a view to enhancing and coordinating international efforts aimed at increased openness and transparency in armaments; 8. Requests the Secretary-General to report to the General Assembly at its fifty-seventh session on progress made in implementing the present resolution; 9. Decides to include in the provisional agenda of its fifty-seventh session the item entitled “Transparency in armaments”.",10/18/2001,2001_450582,Suriname,* A/52/316 and Corr.2. * See A/55/281.,yes
2001,General Assembly,First Committee,Fifty-sixth session,80,Consolidation of the regime established by the Treaty for the Prohibition of Nuclear Weapons in Latin America and the Caribbean (Treaty of Tlatelolco),"Antigua and Barbuda, Argentina, Bahamas, Barbados, Belize, Bolivia, Brazil, Chile, Colombia, Costa Rica, Cuba, Dominican Republic, Ecuador, El Salvador, Grenada, Guatemala, Guyana, Haiti, Honduras, Jamaica, Mexico, Nicaragua, Panama, Paraguay, Peru, Saint Lucia, Saint Vincent and the Grenadines, Suriname, Trinidad and Tobago, Uruguay and Venezuela",N/A,Consolidation of the regime established by the Treaty for the Prohibition of Nuclear Weapons in Latin America and the Caribbean (Treaty of Tlatelolco),"The General Assembly, Recalling that, in its resolution 1911 (XVIII) of 27 November 1963, it expressed the hope that the States of Latin America would take appropriate measures to conclude a treaty that would prohibit nuclear weapons in Latin America, Recalling also that, in the same resolution, it voiced its confidence that, once such a treaty was concluded, all States, and in particular the nuclear-weapon States, would lend it their full cooperation for the effective realization of its peaceful aims, Considering that, in its resolution 2028 (XX) of 19 November 1965, it established the principle of an acceptable balance of mutual responsibilities and obligations between nuclear-weapon States and those that do not possess such weapons, Recalling that the Treaty for the Prohibitionlj)f Nuclear Weapons in Latin America and the Caribbean (Treaty of Tlatelolco)* was opened for signature at Mexico City on 14 February 1967, Noting with satisfaction the holding on 14 February 1997 of the eleventh special session of the General Conference of the Agency for the Prohibition of Nuclear Weapons in Latin America and the Caribbean in commemoration of the thirtieth anniversary of the opening for signature of the Treaty of Tlatelolco, Recalling that, in its preamble, the Treaty of Tlatelolco states that military denuclearized zones are not an end in themselves but rather a means for achieving general and complete disarmament at a later stage, Recalling also that, in its resolution 2286 (XXII) of 5 December 1967, it welcomes with special satisfaction the Treaty of Tlatelolco as an event of historic significance in the efforts to prevent the proliferation of nuclear weapons and to promote international peace and security, Recalling further that in 1990, 1991 and 1992 the General Conference of the Agency for the Prohibition of Nuclear Weapons in Latin America and the Caribbean approved and opened for signature a set of amendments® to the Treaty of Tlatelolco,' with the aim of enabling the full entry into force of that instrument, Recalling resolution C/E/RES.27 of the Council of the Aﬁncy for the Prohibition of Nuclear Weapons in Latin America and the Caribbean,>in which the Council called for the promotion of cooperation and consultations with other nuclear-weapon-free zones, Noting with satisfaction that the Treaty of Tlatelolco is now in force for thirty- two sovereign States of the region, Also noting with satisfaction that the amended Treaty of Tlatelolco is fully in force for Argentina, Barbados, Brazil, Chile, Colombia, Costa Rica, Ecuador, Guyana, Jamaica, Mexico, Panama, Paraguay, Peru, Suriname, Uruguay and Venezuela, 1. Welcomes the concrete steps taken by some countries of the region during recent years for the consolidation of the regime of military denuclearization established by the Treaty for the Prohibition of Nuclear Weapons in Latin America and the Caribbean (Treaty of Tlatelolco);' 2. Urges the countries of the region that have not yet done so to deposit their instruments of ratification of the amendments to the Treaty of Tlatelolco approved by the General Conference of the Agency for the Prohibition of Nuclear Weapons in Latin America and the Caribbean in its resolutions 267 (E-V), 268 (XII) and 290 (E-VII); 3. Decides to include in the provisional agenda of its fifty-eighth session the item entitled “Consolidation of the regime established by the Treaty for the Prohibition of Nuclear Weapons in Latin America and the Caribbean (Treaty of Tlatelolco)”. 2 A/47/467, annex. 3 See CD/1392.",10/18/2001,2001_450627,Suriname,N/A,yes
2001,General Assembly,First Committee,Fifty-sixth session,74 (j),General and complete disarmament: nuclear-weapon-free southern hemisphere and adjacent areas,"Angola, Argentina, Bahamas, Barbados, Belize, Bolivia, Botswana, Brazil, Brunei Darussalam, Burkina Faso, Cape Verde, Chile, Colombia, Comoros, Congo, Costa Rica, Céte d’Ivoire, Djibouti, Dominican Republic, Ecuador, Egypt, El Salvador, Ethiopia, Fiji, Gabon, Ghana, Grenada, Guatemala, Guinea-Bissau, Guyana, Haiti, Honduras, Indonesia, Iran (Islamic Republic of), Jordan, Kenya, Liberia, Madagascar, Mexico, Mongolia, Mozambique, New Zealand, Nicaragua, Panama, Paraguay, Peru, Sierra Leone, Singapore, South Africa, Sudan, Suriname, Swaziland, Thailand, Trinidad and Tobago, Uganda, United Republic of Tanzania, Uruguay, Venezuela, Viet Nam and Zimbabwe",N/A,Nuclear-weapon-free southern hemisphere and adjacent areas,"The General Assembly, Recalling its resolutions 51/45 B of 10 December 1996, 52/38 of 9 December 1997, 53/77 Q of 4 December 1998, 54/54 L of 1 December 1999 and 55/33 1 of 20 November 2000, Welcoming the adoption by the Disarmament Commission at its 1999 substantive session of a text entitled “Establishment of nuclear-weapon-free zones on the basjlﬁ of arrangements freely arrived at among the States of the region concerned”, Determined to pursue the total elimination of nuclear weapons, Determined also to continue to contribute to the prevention of the proliferation of nuclear weapons in all its aspects and to the process of general and complete disarmament under strict and effective international control, in particular in the field of nuclear weapons and other weapons of mass destruction, with a view to 1 Official Records of the General Assembly, Fifty-fourth Session, Supplement No. 42 (A/54/42), annex I. strengthening international peace and security, in accordance with the purposes and principles of the Charter of the United Nations, Recalling the provisions on nuclear-weapon-free zopes of the Final Document of the Tenth Special Session of the General Assembly,® the first special session devoted to disarmament, Stressing the importance of the treaties of Tlatelolco,gRarotonga,I""—'lBangkokEI and Pelindaba,® establishing nuclear-weapon-free zones, as well as the Antarctic Treaty,”to, inter alia, achieve a world entirely free of nuclear weapons, Underlining also the value of enhancing cooperation among the nuclear- weapon-free zone treaty members by means of mechanisms such as joint meetings of States parties, signatories and observers to those treaties, Recalling the applicable principles and rules of international law relating to the freedom of the high seas and the rights of passage through marﬁime space, including those of the United Nations Convention on the Law of the Sea, 1. Welcomes the continued contribution that the Antarctic Treaty,” and the treaties of Tlatelolco,” Rarotonga,* Bangkok’ and Pelindaba® are making towards freeing the southern hemisphere and adjacent areas covered by those treaties from nuclear weapons; 2. Calls for the ratification of the treaties of Tlatelolco, Rarotonga, Bangkok and Pelindaba by all States of the region, and calls upon all concerned States to continue to work together in order to facilitate adherence to the protocols to nuclear- weapon-free zone treaties by all relevant States that have not yet done so; 3. Welcomes the steps taken to conclude further nuclear-weapon-free zone treaties on the basis of arrangements freely arrived at among the States of the region concerned, and calls upon all States to consider all relevant proposals, including those reflected in its resolutions on the establishment of nuclear-weapon-free zones in the Middle East and South Asia; 4. Convinced of the important role of nuclear-weapon-free zones in strengthening the nuclear non-proliferation regime and in extending the areas of the world that are nuclear-weapon-free, and with particular reference to the responsibilities of the nuclear-weapon States, calls upon all States to support the process of nuclear disarmament and to work for the total elimination of all nuclear weapons; 4 See The United Nations Disarmament Yearbook, vol. 10: 1985 (United Nations publication, Sales No. E.86.1X.7), appendix VII. 8 See The Law of the Sea: Official Texts of the United Nations Convention on the Law of the Sea of 10 December 1982 and of the Agreement relating to the Implementation of Part XI of the United Nations Convention on the Law of the Sea of 10 December 1982 with Index and Excerpts from the Final Act of the Third United Nations Conference on the Law of the Sea (United Nations publication, Sales No. E.97.V.10). A/C.1/56/L.24 5. Calls upon the States parties and signatories to the treaties of Tlatelolco, Rarotonga, Bangkok and Pelindaba, in order to pursue the common goals envisaged in those treaties and to promote the nuclear-weapon-free status of the southern hemisphere and adjacent areas, to explore and implement further ways and means of cooperation among themselves and their treaty agencies; 6. Welcomes the vigorous efforts being made among States parties and signatories to those treaties to promote their common objectives, and considers that an international conference of States parties and signatories to nuclear-weapon-free zones might be held to support the common goals envisaged in those treaties; 7. Encourages the competent authorities of the nuclear-weapon-free-zone treaties to provide assistance to the States parties and signatories to such treaties so as to facilitate the accomplishment of these goals; 8. Decides to include in the provisional agenda of its fifty-seventh session the item entitled “Nuclear-weapon-free southern hemisphere and adjacent areas”.",10/18/2001,2001_450638,Suriname,N/A,yes
