year,Council,Committee,Session,Agenda item,Agenda detail,cosponsored countries,body title number,body title detail,body text,date,file,filecountry,footnote,scanned
2009,N/A,Commission On Human Rights,Tenth session,5,HUMAN RIGHTS BODIES AND MECHANISMS,"Belarus*, Bolivia, Cuba, Democratic People’s Republic of Korea*, Ecuador*, Ethiopia*, Indonesia, Iran (Islamic Republic of)*, Nicaragua, Panama*, Sri Lanka*, Togo*, Uruguay, Venezuela (Bolivarian Republic of)*, Viet Nam*",N/A,10/... The Social Forum,"The Human Rights Council, Recalling all previous resolutions and decisions adopted on this issue by the former Commission on Human Rights and its Subcommission on the Promotion and Protection of Human Rights, as well as by the Economic and Social Council, Recalling also its resolutions 5/1 of 18 June 2007, and 6/13 of 28 September 2007, Bearing in mind that the reduction of poverty and the elimination of extreme poverty remain an ethical and moral imperative of humankind, based on respect for human dignity, and noting the report of the Chairperson-Rapporteur of the 2008 Social Forum, held from 1 to 3 September 2008, which focused on questions relating to the eradication of poverty in the context of human rights, best practices in the fight against poverty, and the social dimension of the globalization process, Reaffirming the unique nature within the United Nations of the Social Forum, which makes possible a dialogue and an exchange between the representatives of Member States, civil society, including grass-roots organizations, and intergovernmental organizations, and stressing that the current reform of the United Nations should take into account the contribution of the Social Forum as a vital space for open and fruitful dialogue on issues linked with the national and international environment needed for the promotion of the enjoyment of all human rights by all, 1. Takes note with satisfaction of the report of the 2008 Social Forum held in Geneva from | to 3 September 2008 submitted by the Chairman-Rapporteur (A/HRC/10/65); Takes note also with interest of the conclusions and recommendations of the 2008 Social Forum and of the innovative nature of many of them, and calls upon States, international organizations, in particular those with a mandate for poverty eradication, non-governmental organizations, civil society organizations, trade unions and other relevant actors to take them into account when designing and implementing poverty-eradication programmes and strategies; 3. Reaffirms the Social Forum as a unique space for interactive dialogue between the United Nations human rights machinery and various stakeholders, including grass-roots organizations, and stresses the need to ensure a larger participation of grass-roots organizations and of those living in poverty, particularly women, especially from developing countries, in the Social Forum sessions, and to this end considers, inter alia, the possibility of the establishment of a voluntary United Nations Fund to contribute to providing resources to these organizations so that they can participate in and contribute to the deliberations of future sessions; 4. Underlines the importance of coordinated efforts at national, regional and international levels for the promotion of social cohesion based on the principles of social justice, equity and solidarity and of addressing the social dimension and challenges of the ongoing globalization process and the negative impacts of the current economic and financial crises; 5. Requests that the next meeting of the Social Forum be held during 2009, in Geneva, on dates suitable for the participation of representatives of United Nations Member States and of the broadest possible range of other stakeholders, especially from developing countries, and decides that at its next meeting the Social Forum should focus on: (a) Negative impacts of economic and financial crises on efforts to combat poverty; (b) National anti-poverty programmes: best practices of States in implementing social security programmes from a human rights perspective; (c) International assistance and cooperation in combating poverty; Decides that the Social Forum will meet for three working days, in order that it may devote: (a) Two days of thematic discussions on the topics of the Forum; (b) One day to an interactive debate with relevant thematic procedures mandate-holders of the Human Rights Council on issues related to the topics of the Social Forum, and to formulating conclusions and recommendations to be presented to relevant bodies through the Human Rights Council; 7. Requests the President of the Council to appoint, as early as possible, from candidates nominated by regional groups, the Chairperson-Rapporteur for the 2009 Social Forum bearing in mind the principle of regional rotation; 8. Invites the appointed Chairperson-Rapporteur to announce, in a timely manner, the most appropiate dates for convening the 2009 Social Forum, after holding consultations with United Nations Member States and other stakeholders; 9. Requests the United Nations High Commissioner for Human Rights to consult all actors identified in the present resolution on the issues referred to in paragraph 4 above and to present a report as a background contribution for the dialogues and debates that will be held at the 2009 Social Forum; 10. Requests also the United Nations High Commissioner for Human Rights to facilitate the participation in the 2009 Social Forum, in order to assist the Chairperson-Rapporteur as resource persons, of up to four relevant Human Rights Council thematic procedures mandate-holders, in particular the independent expert on the question of human rights and extreme poverty and the independent expert on human rights and international solidarity; 11. Decides that the Social Forum will remain open to the participation of representatives of United Nations Member States and all other interested stakeholders such as intergovernmental organizations, different components of the United Nations system, especially mandate-holders of thematic procedures and mechanisms of the human rights machinery, regional economic commissions, specialized agencies and organizations - in particular the United Nations Development Programme, the World Bank, the International Monetary Fund, the World Trade Organization, and the United Nations Conference on Trade and Development, as well as representatives designated by human rights national institutions and non-governmental organizations in consultative status with the Economic and Social Council, and shall also be open to other non-governmental organizations, whose aims and purposes are in conformity with the spirit, purposes and principles of the Charter of the United Nations, in particular newly emerging actors such as small groups and rural and urban associations from the North and the South, anti-poverty groups, peasants’ and farmers’ organizations and their national and international associations, voluntary organizations, youth associations, community organizations, trade unions and associations of workers, as well as representatives of the private sector, regional banks, and other financial institutions and international development agencies, based on arrangements, including Economic and Social Council resolution 1996/31 of 25 July 1996, and practices observed by the Commission on Human Rights, through an open and transparent accreditation procedure, in accordance with the Rules of Procedure of the Human Rights Council, while ensuring the most effective contribution of these entities; 12. Requests the Office of the United Nations High Commissioner for Human Rights to seek effective means of ensuring consultation and the broadest possible participation of representatives from every region, especially those from developing countries, in the Social Forum, including by establishing partnerships with non-governmental organizations, the private sector and international organizations; 13. Requests also the Secretary-General to adopt the appropriate measures to disseminate information about the Social Forum, invite the relevant individuals and organizations to the Social Forum and take all practical measures required for the success of this initiative; 14. Invites the 2009 Social Forum to submit a report to the Human Rights Council; 15. Requests the Secretary-General to provide the Social Forum with all the services and facilities necessary to fulfil its activities, and requests also the United Nations High Commissioner for Human Rights to provide all the necessary support to facilitate the convening and proceedings of the Social Forum; 16. Decides to continue consideration of this issue under the relevant agenda item when the report of the 2009 Social Forum is submitted to the Human Rights Council.",03/20/2009,2009_650494,Togo,* Non-member State of the Human Rights Council.,yes
2009,Convention On The Rights Of The Child,Commission On Human Rights,Tenth session,2,ANNUAL REPORT OF THE UNITED NATIONS HIGH COMMISSIONER FOR HUMAN RIGHTS AND REPORTS OF THE OFFICE OF THE HIGH COMMISSIONER AND THE SECRETARY-GENERAL,"Belarus*, Bolivia, China, Cuba, Democratic People’s Republic of Korea*, Ecuador*, Iran (Islamic Republic of)*, Nicaragua, Sri Lanka*, Syrian Arab Republic*, Togo*, Uruguay, Venezuela (Bolivarian Republic of)*, Zimbabwe*",N/A,10/... Composition of the staff of the Office of the United Nations High Commissioner for Human Rights,"The Human Rights Council, Recalling paragraph 5 (g) of General Assembly resolution 60/251 of 15 March 2006, in which the Assembly decided that the Council should assume the role and responsibilities of the Commission on Human Rights relating to the work of the Office of the United Nations High Commissioner for Human Rights, as decided by the Assembly in its resolution 48/141 of 20 December 1993, Taking note of all relevant resolutions on this issue adopted by the General Assembly, the Commission on Human Rights and the Council, Taking note also of the report of the United Nations High Commissioner for Human Rights on the composition of the staff of the Office of the United Nations High Commissioner for Human Rights (A/HRC/10/45), Taking note further of the reports of the Joint Inspection Unit on the follow-up to the management review of the Office of the United Nations High Commissioner for Human Rights (A/59/65-E/2004/48 and Add.1) and on the funding and staffing of the Office of the United Nations High Commissioner for Human Rights (JIU/REP/2007/8), Bearing in mind that an imbalance in the composition of the staff could diminish the effectiveness of the work of the Office of the High Commissioner if it is perceived to be culturally biased and unrepresentative of the United Nations as a whole, Reaffirming the importance of continuing the ongoing efforts to address the imbalance regarding the regional representation of the staff of the Office of the High Commissioner, Underlining that the paramount consideration for employing staff at every level is the need for the highest standards of efficiency, competence and integrity, and taking into account Article 101, paragraph 3, of the Charter of the United Nations, expressing its conviction that this objective is compatible with the principle of equitable geographical distribution, Reaffirming that the Fifth Committee is the appropriate Main Committee of the General Assembly entrusted with responsibilities for administrative and budgetary matters, 1. | Welcomes the statement made by the High Commissioner in her report that achieving geographical balance in the staff of the Office of the United Nations High Commissioner for Human Rights will remain one of her priorities, and requests the High Commissioner to continue taking all measures needed to redress the current imbalance in geographical distribution of the staff of the Office of the High Commissioner; 2. Notes the increase in the percentage of staff from regions identified as requiring better representation and the various measures proposed and already taken to address the imbalance in geographical distribution of the staff, while stressing that the imbalance in geographical distribution is still prominent; 3. Underlines that a genuine geographic representation requires that the percentage of staff from each region be directly proportional to the percentage of United Nations Member States of the given region; 4. Requests the High Commissioner to impose a Zero-Growth cap on the representation of regions already over-represented in the Office of the United Nations High Commissioner for Human Rights; 5. Takes note of the progress achieved towards improved geographic diversity in the staff of the Office, and takes note also of the commitment of the High Commissioner to remain attentive to the need to maintain the emphasis on the broadest possible geographic diversity of her Office, as stated in the conclusion of her report; 6. | Welcomes the efforts towards the achievement of a gender balance in the composition of the staff and the decision to continue paying special attention to this issue; 7. Requests future High Commissioners to continue enhancing the ongoing efforts in the fulfilment of the goal of a geographical balance in the composition of the staff of the Office; 8. Underlines the importance of continuing promoting geographical diversity in the recruitment of, and promotion to high-level and Professional posts, including senior managers, as a principle of the staffing policies of the Office of the High Commissioner; 9. Affirms the vital importance of geographical balance in the composition of the staff of the Office of the United Nations High Commissioner for Human Rights, taking into account the significance of national and regional specificities and various historic, cultural and religious backgrounds, as well as of different political, economic and legal systems, to the promotion and protection of the universality of human rights; 10. Recalls the provisions contained in section X, paragraph 3, of General Assembly resolution 55/258 of 14 June 2001 on human resources management, in which the Assembly reiterated its request to the Secretary-General to increase further his efforts to improve the composition of the Secretariat by ensuring a wide and equitable geographical distribution of staff in all departments; 11. Encourages the General Assembly to consider further measures for promoting desirable ranges of geographical balance in the staff of the Office of the High Commissioner representing national and regional specificities, various historic, cultural and religious backgrounds, as well as the diversity of political, economic and legal systems; 12. Welcomes the significant increase in the human and financial resources allocated to the activities of the Office of the High Commissioner, and the impact it should have on the geographic composition of the Office; 13. Recognizes the importance of the follow-up to and implementation of General Assembly resolution 61/159 of 19 December 2006, and underlines the priority importance that the Assembly continue providing support and guidance to the High Commissioner in the ongoing process of improvement of the geographical balance in the composition of the staff of the Office of the High Commissioner; 14. Requests the High Commissioner to submit a comprehensive and updated report to the Council in 2010, in accordance with its annual programme of work, following the structure and scope of her report and with a special focus on further measures taken to correct the imbalance in geographical composition of the staff of the Office.",03/20/2009,2009_650500,Togo,* Non-member State of the Human Rights Council.,yes
2009,General Assembly,Commission On Human Rights,Tenth session,2,ANNUAL REPORT OF THE UNITED NATIONS HIGH COMMISSIONER FOR HUMAN RIGHTS AND REPORTS OF THE OFFICE OF THE HIGH COMMISSIONER AND THE SECRETARY-GENERAL,"Algeria*, Belarus*, Bhutan*, Bolivia, China, Cuba, Democratic People’s Republic of Korea*, Ecuador*, Egypt (on behalf of the African Group), Iran (Islamic Republic of)*, Nicaragua, Russian Federation, Sri Lanka*, Syrian Arab Republic*, Togo*, Uruguay, Venezuela (Bolivarian Republic of)*, Viet Nam*, Zimbabwe*",N/A,10/... Composition of the staff of the Office of the United Nations High Commissioner for Human Rights,"The Human Rights Council, Recalling paragraph 5 (g) of General Assembly resolution 60/251 of 15 March 2006, in which the Assembly decided that the Council should assume the role and responsibilities of the Commission on Human Rights relating to the work of the Office of the United Nations High Commissioner for Human Rights, as decided by the Assembly in its resolution 48/141 of 20 December 1993, Taking note of all relevant resolutions on this issue adopted by the General Assembly, the Commission on Human Rights and the Council, Taking note also of the report of the United Nations High Commissioner for Human Rights on the composition of the staff of the Office of the United Nations High Commissioner for Human Rights (A/HRC/10/45), GE.09-12536 Taking note further of the reports of the Joint Inspection Unit on the follow-up to the management review of the Office of the United Nations High Commissioner for Human Rights (A/59/65-E/2004/48 and Add.1) and on the funding and staffing of the Office of the United Nations High Commissioner for Human Rights (JIU/REP/2007/8), Bearing in mind that an imbalance in the composition of the staff could diminish the effectiveness of the work of the Office of the High Commissioner if it is perceived to be culturally biased and unrepresentative of the United Nations as a whole, Expressing its concern that, despite the repeated requests to correct the unbalanced geographical distribution of the staff, the situation remains that one region accounts for more than half of the posts of the Office of the High Commissioner and for more posts than the four remaining regional groups combined, Reaffirming the importance of continuing the ongoing efforts to address the imbalance regarding the regional representation of the staff of the Office of the High Commissioner, Underlining that the paramount consideration for employing staff at every level is the need for the highest standards of efficiency, competence and integrity, and taking into account Article 101, paragraph 3, of the Charter of the United Nations, expressing its conviction that this objective is compatible with the principle of equitable geographical distribution, Reaffirming that the Fifth Committee is the appropriate Main Committee of the General Assembly entrusted with responsibilities for administrative and budgetary matters, 1. | Welcomes the statement made by the High Commissioner in her report that achieving geographical balance in the staff of the Office of the United Nations High Commissioner for Human Rights will remain one of her priorities, and requests the High Commissioner to continue taking all measures needed to redress the current imbalance in geographical distribution of the staff of the Office of the High Commissioner; 2. Notes the increase in the percentage of staff from regions identified as requiring better representation and the various measures proposed and already taken to address the imbalance in geographical distribution of the staff, while stressing that the imbalance in geographical distribution is still prominent; 3. Takes note of the progress achieved towards improved geographic diversity in the staff of the Office, and takes note also of the commitment of the High Commissioner to remain attentive to the need to maintain the emphasis on the broadest possible geographic diversity of her Office, as stated in the conclusion of her report; 4. Requests the High Commissioner to work on the broadest geographic diversity of her staff by enhancing the implementation of measures to achieve a better representation of countries and regions that are unrepresented or underrepresented, particularly from the developing world, while considering applying a zero-growth cap on the representation of countries and regions already overrepresented in the Office of the High Commissioner; 5. | Welcomes the efforts towards the achievement of a gender balance in the composition of the staff and the decision to continue paying special attention to this issue; 6. | Requests future High Commissioners to continue enhancing the ongoing efforts in the fulfilment of the goal of a geographical balance in the composition of the staff of the Office; 7. Underlines the importance of continuing promoting geographical diversity in the recruitment of and promotion to high-level and Professional posts, including senior managers, as a principle of the staffing policies of the Office of the High Commissioner; 8. Affirms the vital importance of geographical balance in the composition of the staff of the Office of the High Commissioner, taking into account the significance of national and regional specificities and various historic, cultural and religious backgrounds, as well as of different political, economic and legal systems, to the promotion and protection of the universality of human rights; 9. Recalls the provisions contained in section X, paragraph 3, of General Assembly resolution 55/258 of 14 June 2001, on human resources management, in which the Assembly reiterated its request to the Secretary-General to increase further his efforts to improve the composition of the Secretariat by ensuring a wide and equitable geographical distribution of staff in all departments, and also recalls the request that he submit to the General Assembly proposals for a comprehensive review of the system of desirable ranges, with a view to establishing a more effective tool to ensure equitable geographic distribution in relation to the total number of staff of the Secretariat; 10. Encourages the General Assembly to consider further measures for promoting desirable ranges of geographical balance in the staff of the Office of the High Commissioner representing national and regional specificities and various historic, cultural and religious backgrounds, as well as the diversity of political, economic and legal systems; 11. Welcomes the significant increase in the human and financial resources allocated to the activities of the Office of the High Commissioner, and the impact it should have on the geographic composition of the Office; 12. Recognizes the importance of the follow-up to and implementation of General Assembly resolution 61/159 of 19 December 2006, and underlines the priority importance that the Assembly continue providing support and guidance to the High Commissioner in the ongoing process of improvement of the geographical balance in the composition of the staff of the Office of the High Commissioner; 13. Requests the High Commissioner to submit a comprehensive and updated report to the Council at its 13 session in 2010, in accordance with its annual programme of work, following the structure and scope of her report and with a special focus on further measures taken to correct the imbalance in geographical composition of the staff of the Office.",03/25/2009,2009_650507,Togo,* Non-member State of the Human Rights Council.,yes
