year,Council,Committee,Session,Agenda item,Agenda detail,cosponsored countries,body title number,body title detail,body text,date,file,filecountry,footnote,scanned
2012,Security Council,N/A,N/A,N/A,United Nations S 2012/77,"Bahrain, Colombia, Egypt, France, Germany, Jordan, Kuwait, Libya, Morocco, Oman, Portugal, Qatar, Saudi Arabia, Togo, Tunisia, Turkey, United Arab Emirates, United Kingdom of Great Britain and Northern Ireland and United States of America",N/A,N/A,"The Security Council, Recalling its presidential statement of 3 August 2011, Recalling General Assembly resolution A/RES/66/176 of 19 December 2011, as well as Human Rights Council resolutions S/16-1, S/17-1 and S/18-1, Noting the League of Arab States’ request in its decision of 22 January 2012, Expressing grave concern at the deterioration of the situation in Syria, and profound concern at the death of thousands of people and calling for an immediate end to all violence, Welcoming the League of Arab States’ Action Plan of 2 November 2011 and its subsequent decisions, including its decision of 22 January 2012, which aims to achieve a peaceful resolution of the crisis, Noting the deployment of the League of Arab States’ observer mission, commending its efforts, regretting that, due to the escalation in violence, the observer mission was not in a position to monitor the full implementation of the League of Arab States’ Action Plan of 2 November 2011, and noting the subsequent decision of the League of Arab states to suspend the mission, Underscoring the importance of ensuring the voluntary return of refugees and internally displaced persons to their homes in safety and with dignity, Mindful that stability in Syria is key to peace and stability in the region, Noting the announced commitments by the Syrian authorities to reform, and regretting the lack of progress in implementation, Reaffirming its strong commitment to the sovereignty, independence, unity and territorial integrity of Syria, emphasizing its intention to resolve the current political crisis in Syria peacefully, and noting that nothing in this resolution authorizes measures under Article 42 of the Charter, 12-22375 nl 060212 CAT TA S/2012/77 Welcoming the engagement of the Secretary-General and all diplomatic efforts aimed at addressing the situation, and noting in this regard the offer of the Russian Federation to host a meeting in Moscow, in consultation with the League of Arab States, 1. | Condemns the continued widespread and gross violations of human rights and fundamental freedoms by the Syrian authorities, such as the use of force against civilians, arbitrary executions, killing and persecution of protestors and members of the media, arbitrary detention, enforced disappearances, interference with access to medical treatment, torture, sexual violence, and ill-treatment, including against children; 2. Demands that the Syrian government immediately put an end to all human rights violations and attacks against those exercising their rights to freedom of expression, peaceful assembly and association, protect its population, fully comply with its obligations under applicable international law and fully implement Human Rights Council resolutions S-16/1, S-17/1, S-18/1 and General Assembly resolution A/RES/66/176; 3. Condemns all violence, irrespective of where it comes from, and in this regard demands that all parties in Syria, including armed groups, immediately stop all violence or reprisals, including attacks against State institutions, in accordance with the League of Arab States’ initiative; 4. Recalls that all those responsible for human rights violations, including acts of violence, must be held accountable; 5. Demands that the Syrian government, in accordance with the Plan of Action of the League of Arab States of 2 November 2011 and its decision of 22 January 2012, without delay: (a) cease all violence and protect its population; (b) release all persons detained arbitrarily due to the recent incidents; (c) withdraw all Syrian military and armed forces from cities and towns, and return them to their original home barracks; (d) guarantee the freedom of peaceful demonstrations; (e) allow full and unhindered access and movement for all relevant League of Arab States’ institutions and Arab and international media in all parts of Syria to determine the truth about the situation on the ground and monitor the incidents taking place; and (f) allow full and unhindered access to the League of Arab States’ observer mission; 6. Calls for an inclusive Syrian-led political process conducted in an environment free from violence, fear, intimidation and extremism, and aimed at effectively addressing the legitimate aspirations and concerns of Syria’s people, without prejudging the outcome; 7. Fully supports in this regard the League of Arab States’ 22 January 2012 decision to facilitate a Syrian-led political transition to a democratic, plural political system, in which citizens are equal regardless of their affiliations or ethnicities or beliefs, including through commencing a serious political dialogue between the S/2012/77 Syrian government and the whole spectrum of the Syrian opposition under the League of Arab States’ auspices, in accordance with the timetable set out by the League of Arab States; 8. Encourages the League of Arab States to continue its efforts in cooperation with all Syrian stakeholders; 9. Calls upon the Syrian authorities, in the event of a resumption of the observer mission, to cooperate fully with the League of Arab States’ observer mission, in accordance with the League of Arabs States’ Protocol of 19 December 2011, including through granting full and unhindered access and freedom of movement to the observers, facilitating the entry of technical equipment necessary for the mission, guaranteeing the mission’s right to interview, freely or in private, any individual and guaranteeing also not to punish, harass, or retaliate against, any person who has cooperated with the mission; 10. Stresses the need for all to provide all necessary assistance to the mission in accordance with the League of Arab States’ Protocol of 19 December 2011 and its decision of 22 January 2012; 11. Demands that the Syrian authorities cooperate fully with the Office of the High Commissioner for Human Rights and with the Commission of Inquiry dispatched by the Human Rights Council, including by granting it full and unimpeded access to the country; 12. Calls upon the Syrian authorities to allow safe and unhindered access for humanitarian assistance in order to ensure the delivery of humanitarian aid to persons in need of assistance; 13. Welcomes the Secretary-General’s efforts to provide support to the League of Arab States, including its observer mission, in promoting a peaceful solution to the Syrian crisis; 14. Requests the Secretary-General to report on the implementation of this resolution, in consultation with the League of Arab States, within 21 days after its adoption and to report every 30 days thereafter; 15. Decides to review implementation of this resolution within 21 days and, in the event of non-compliance, to consider further measures; 16. Decides to remain actively seized of the matter. 12-22375",02/04/2012,2012_720648,Tunisia,N/A,yes
2012,Economic And Social Council,Commission On Human Rights,Fifty-sixth session,3,"Follow-up to the Fourth World Conference on Women and to the twenty-third special session of the General Assembly, entitled “Women 2000: gender equality, development and peace for the twenty-first century”",Tunisia:*,N/A,The Commission on the Status of Women recommends to the Economic and,"Social Council the approval of the following decision for adoption by the General Assembly: “Ending female genital mutilation “The General Assembly, recalling its resolutions 56/128 of 19 December 2001, 58/156 of 22 December 2003 and 60/141 of 16 December 2005, Commission on the Status of Women resolutions 51/2 of 9 March 2007, 52/2 of 7 March 2008 and 54/7 of 12 March 2010, as well as agreed conclusions of the Commission, and all other relevant resolutions, and taking note of the report of the Secretary-General! on ending female genital mutilation and the recommendations contained therein, decides to consider the issue of ending female genital mutilation at its sixty-seventh session under the agenda item >” entitled ‘Advancement of women’. 12-24461 Hil 290212 CAT A",02/27/2012,2012_721709,Tunisia,* On behalf of the States Members of the United Nations that are members of the Group of African States; submitted in accordance with rule 69 of the rules of procedure of the functional commissions of the Economic and Social Council.,yes
2012,General Assembly,Commission On Human Rights,Nineteenth session,1,Organizational and procedural matters,"Albania, Andorra, Australia, Austria, Bahrain’, Belgium, Botswana, Bulgaria , Canada’, Céte d’Ivoire, Croatia , Cyprus , Czech Republic, Denmark , Djibouti, Egypt , Estonia , Finland’, France , Germany , Greece , Hungary, Iceland , Ireland , Italy, Japan’, Jordan, Kuwait, Latvia’, Libya, Lithuania, Luxembourg , Maldives, Malta’, Monaco, Morocco, Netherlands, New Zealand , Nigeria, Norway, Oman’, Poland, Portugal , Qatar, Republic of Korea , Republic of Moldova, Romania , Saudi Arabia, Slovakia , Slovenia , Spain, Sweden’, Switzerland, Tunisia , Turkey , United Arab Emirates, United Kingdom of Great Britain and Northern Ireland’, United States of America",N/A,19/... The escalating grave human rights violations and deteriorating humanitarian situation in the Syrian Arab Republic,"The Human Rights Council, Having held an urgent debate to discuss the escalating grave human rights violations and the deteriorating humanitarian situation in the Syrian Arab Republic, Expressing grave concern at the deterioration of the situation in the Syrian Arab Republic, in particular the ongoing human rights violations and use of violence by the Syrian authorities against its population, resulting in a humanitarian crisis, Reaffirming its strong commitment to the sovereignty, independence, unity and territorial integrity of the Syrian Arab Republic and to the principles of the Charter of the United Nations, Recalling General Assembly resolutions 66/176 of 19 December 2011 and 66/253 of 23 February 2012, Human Rights Council resolutions S-16/1 of 29 April 2011, S-17/1 of 23 August 2011 and S-18/1 of 2 December 2011, the decisions, initiatives, efforts and measures of the League of Arab States to address all aspects of the situation in the Syrian Arab Republic, including its resolutions 7444 of 22 January 2012 and 7446 of 12 February 2012, and the final communiqué of the Executive Committee of the Organization of Islamic Cooperation after its meeting on the situation in the Syrian Arab Republic, held on 30 November 2011, ” Non-Member State of the Human Rights Council. Please recycle eS GE.12-10917 A/HRC/19/L.1/Rev.1 Welcoming the conclusions of the Chairman of the International Conference of the Group of Friends of the Syrian People of 24 February 2012, 1. Strongly condemns the continued widespread and systematic violations of human rights and fundamental freedoms by the Syrian authorities, such as the use of force against civilians, arbitrary executions, the killing and persecution of protestors, human rights defenders and journalists, including recent deaths of Syrian and foreign journalists, arbitrary detention, enforced disappearances, interference with access to medical treatment, torture, sexual violence and ill-treatment, including against children; 2. Deplores the brutal actions of the Syrian regime over the past 11 months, such as its use of heavy artillery and tanks to attack residential areas of cities and towns, which have led to the death of thousands of innocents civilians, caused widespread destruction, forced tens of thousands of Syrians to flee their homes and created widespread suffering among the Syrian people, resulting in a humanitarian crisis; 3. Expresses strong concern at the humanitarian situation in the Syrian Arab Republic, including the lack of access to basic food, medicine and fuel, as well as threats to and acts of violence against medical staff, patients and facilities; 4. Reiterates the need to urgently address humanitarian needs, to facilitate the effective delivery of assistance and to ensure safe access to medical treatment; 5. Calls upon the Government of the Syrian Arab Republic to immediately put an end to all human rights violations and attacks against civilians, to cease all violence, to allow free and unimpeded access by the United Nations and humanitarian agencies to carry out a full assessment of needs in Homs and other areas, and to permit humanitarian agencies to deliver vital relief goods and services to all civilians affected by the violence, especially in Homs, Dar’a, Zabadani and other areas under siege by the Syrian security forces; 6. Stresses the importance of ensuring accountability and the need to end impunity and hold to account those responsible for human rights violations, including those violations that may amount to crimes against humanity; 7. Acknowledges the serious and growing burden carried by the neighbours of the Syrian Arab Republic in hosting refugees from the Syrian Arab Republic and committed to provide appropriate support and assistance in this regard; 8. Decides to remain seized of the matter and to take further action on the situation of human rights in the Syrian Arab Republic, including after the forthcoming interactive dialogue with the commission of inquiry.",02/29/2012,2012_721922,Tunisia,N/A,yes
2012,General Assembly,N/A,Sixty-sixth session,123 (a),Strengthening of the United Nations system,"Australia, Austria, Bosnia and Herzegovina, Brazil, Bulgaria, Canada, Chile, Croatia, Denmark, Egypt, Estonia, Finland, France, Germany, Ghana, Hungary, Iceland, Indonesia, Ireland, Israel, Italy, Japan, Liberia, Liechtenstein, Lithuania, Luxembourg, Mexico, Montenegro, Morocco, Nepal, Netherlands, New Zealand, Nigeria, Norway, Philippines, Poland, Republic of Korea, Romania, Sierra Leone, Slovenia, South Africa, Spain, Sweden, Switzerland, Timor-Leste, Tunisia, Turkey, United Kingdom of Great Britain and Northern Ireland, United States of America and Uruguay",N/A,Civilian capacity in the aftermath of conflict,"The General Assembly, Taking note of the report of the Secretary-General on peacebuilding in the immediate aftermath of conflict,! the subsequent progress report,? the report of the Secretary-General on civilian capacity in the aftermath of conflict? and the report of the Senior Advisory Group, + Welcoming the intention of the Secretary-General to develop proposals, in partnership with Member States and other relevant peacebuilding stakeholders, as outlined in the report of the Secretary-General on civilian capacity in the aftermath of conflict, Affirming the fundamental principle of national ownership, and stressing the importance of supporting national civilian capacity development and institution- building, including through peacekeeping operations in accordance with their mandates, as well as enhanced regional, South-South and triangular cooperation, Encouraging national Governments, the United Nations and regional and subregional organizations to broaden and deepen the pool of civilian expertise for peacebuilding in the immediate aftermath of conflict, including from countries with relevant experience in post-conflict peacebuilding or democratic transition, giving 1 A/63/881-S/2009/304. 2 A/64/866-S/2010/386. 3 A/66/311-S/2011/527. 4 A/65/747-S/2011/85. 12-26144 Hil 130312 CAA A particular attention to mobilizing capacities from developing countries and from women as vital for successful United Nations peacebuilding endeavours, 1. Requests the Secretary-General to continue holding regular consultations on the review of civilian capacity in the aftermath of conflict in order to maintain close collaboration with Member States, including through the Peacebuilding Commission within its mandate; 2. Also requests the Secretary-General to submit a report in 2012 on the measures outlined in his report on civilian capacity in the aftermath of conflict,® as well as on the development of further initiatives for consideration by Member States in the General Assembly and its subsidiary bodies, including, in particular, the Special Committee on Peacekeeping Operations and the Fifth Committee; 3. Further requests the Secretary-General to continue to draw on all relevant expertise, in particular that of field practitioners, in the development of initiatives to support national capacities; 4. Decides to consider developments on the review of civilian capacity in the aftermath of conflict during its sixty-seventh session, under the agenda item entitled “Strengthening of the United Nations system” and other agenda items as appropriate. 12-26144",03/12/2012,2012_722654,Tunisia,N/A,yes
2012,General Assembly,N/A,Sixty-sixth session,123 (b),Strengthening of the United Nations system: central role of the United Nations system in global governance,"Argentina, Australia, Austria, Bahamas, Barbados, Belgium, Brazil, Bulgaria, Chile, Costa Rica, Croatia, Denmark, Dominican Republic, El Salvador, Finland, Germany, Greece, Guatemala, Honduras, Ireland, Italy, Kenya, Latvia, Liechtenstein, Lithuania, Luxembourg, Malaysia, Malta, Mexico, Montenegro, Morocco, New Zealand, Norway, Panama, Paraguay, Peru, Portugal, Romania, Singapore, Slovakia, Slovenia, Spain, Sweden, Switzerland and Uruguay",N/A,The United Nations in global governance,"Addendum Add the following countries to the list of sponsors of the resolution: Albania, Andorra, Benin, Brunei Darussalam, Colombia, Cyprus, Estonia, Guyana, Haiti, Hungary, Iceland, Iraq, Jamaica, Jordan, Monaco, Mongolia, Nepal, Philippines, Republic of Moldova, Rwanda, Samoa, San Marino, Serbia, Thailand, the former Yugoslav Republic of Macedonia, Timor-Leste, Tunisia, Ukraine and Viet Nam 12-26760 Hil 190312 CAAT A a",03/16/2012,2012_723057,Tunisia,N/A,yes
