year,Council,Committee,Session,Agenda item,Agenda detail,cosponsored countries,body title number,body title detail,body text,date,file,filecountry,footnote,scanned
1993,General Assembly,N/A,Forty-eighth session,150,OBSERVER STATUS FOR THE ECONOMIC COOPERATION ORGANIZATION IN THE GENERAL ASSEMBLY,"Afghanistan, Azerbaijan, Iran (Islamic Republic of), Kazakhstan, Kyrgyzstan, Pakistan, Tajikistan, Turkey, Turkmenistan and Uzbekistan",N/A,N/A,"The General Assembly, Noting the desire of the Economic Cooperation Organization for cooperation between the United Nations and the Economic Cooperation Organization, 1. Decides to invite the Economic Cooperation Organization to participate in the sessions and the work of the General Assembly in the capacity of observer; 2. Requests the Secretary-General to take the necessary action to implement the present resolution. 280993",09/28/1993,1993_173707,Turkmenistan,N/A,no
1993,General Assembly,Second Committee,Forty-eighth session,91 (34),DEVELOPMENT AND INTERNATIONAL ECONOMIC COOPERATION: INTEGRATION OF THE ECONOMIES IN TRANSITION INTO THE WORLD ECONOMY,"Armenia, Belarus, Bulgaria, Croatia, Czech Republic, Estonia, Georgia, Kazakhstan, Kyrgyzstan, Latvia, Lithuania, Poland, Republic of Moldova, Romania, Russian Federation, Tajikistan, The Former Yugoslav Republic of Macedonia, Turkmenistan and Ukraine",N/A,Integration of the countries with economies in transition from,"centrally planned to market economies into the world economy The General Assembly, Reaffirming its resolution 47/187 of 22 December 1992, and noting the relevant decisions of the Governing Council of the United Nations Development Programme as well as resolution B(48) of 26 April 1993, adopted by the Economic Commission for Europe, and resolution 49/1 of 29 April 1993, adopted by the Economic and Social Commission of Asia and the Pacific, Taking note of the report by the Secretary-General on the role of the United Nations system in addressing problems facing countries with economies in transition, including the difficulties that those countries are encountering as they integrate their economies into the world economy, 1/ 1. Reaffirms that the full integration of the countries with economies in transition into the world economy, in particular through improved market access for export goods and services from the countries with economies in transition, will support their systemic transformation and will, simultaneously, have a positive impact on world trade and global economic growth and development; A/48/317. 2. Requests the Secretary-General to strengthen, inter alia, through better coordination by an appropriate unit within the United Nations Secretariat, the ability of the United Nations system to conduct analytical activities and provide policy advice and technical assistance to the countries with economies in transition, and to submit a relevant report to the General Assembly at its forty-ninth session, and biennially thereafter.",10/22/1993,1993_175356,Turkmenistan,N/A,no
1993,General Assembly,Third Committee,Forty-eighth session,114 (b),"HUMAN RIGHTS QUESTIONS: HUMAN RIGHTS QUESTIONS,INCLUDING ALTERNATIVE APPROACHES FOR IMPROVINGTHE EFFECTIVE ENJOYMENT OF HUMAN RIGHTS AND FUNDAMENTAL FREEDOMS","Afghanistan, Algeria, Azerbaijan, Bosnia and Herzegovina, Croatia, Cuba, Egypt, India, Kyrgyzstan, Morocco, Sierra Leone, Sri Lanka, Macedonia, Tunisia, Peru, the former Yugoslav Republic of Turkey and Turkmenistan",N/A,Human rights and terrorism,"The General Assembly, Guided by the principles embodied in the Charter of the United Nations, the Universal Declaration of Human Rights 1/ and the International Covenants on Human Rights, 2/ Bearing in mind that the most essential and basic human right is the right to life, Recalling the Vienna Declaration and Programme of Action adopted at the World Conference on Human Rights, 3/ Reiterating that all Member States have an obligation to promote and protect human rights and fundamental freedoms, and also that every individual should strive to secure their universal and effective recognition and observance, Resolution 217 A (III). See resolution 2200 A (XXI), annex. A/CONF.157/23. Seriously concerned at the gross violations of human rights perpetrated by terrorist groups, Profoundly deploring the increasing number of innocent persons, including women, children and elderly, killed, massacred and maimed by terrorists by indiscriminate and random acts of violence and terror, which cannot be justified under any circumstances, Noting with great concern the growing connection between the terrorist groups and the illegal traffic of arms and drugs, Mindful of the need to protect human rights of and guarantees for the individual in accordance with the relevant international human rights principles and instruments, particularly the right to life, 1. Unequivocally condemns all acts, methods and practices of terrorism in all its forms and manifestations, wherever and by whomever committed, as activities aimed at the destruction of human rights, fundamental freedoms and democracy, threatening territorial integrity and security of States, destabilizing legitimately constituted Governments, undermining pluralistic civil society and having adverse consequences on the economic and social development of States; 2. Calls upon States, in accordance with international standards of human rights, to take all necessary and effective measures to prevent, combat and eliminate terrorism; 3. Urges the international community to enhance cooperation in the fight against the threat of terrorism at national, regional and international levels; 4. Requests the Secretary-General to transmit the text of the present resolution to all Member States and to relevant specialized agencies and intergovernmental organizations; 5. Decides to consider this question at its forty-ninth session under the item entitled ""Human rights questions"".",11/24/1993,1993_177379,Turkmenistan,N/A,no
1993,General Assembly,Second Committee,Forty-eighth session,99,IMPLEMENTATION OF DECISIONS AND RECOMMENDATIONS OF THE UNITED NATIONS CONFERENCE ON ENVIRONMENT AND DEVELOPMENT,"Armenia, Belarus, Canada, Czech Republic, Georgia, Hungary, Kazakhstan, Kyrgyzstan, Republic of Moldova, Romania, Russian Federation, Tajikistan, Turkmenistan and Ukraine",N/A,Strengthening international cooperation in the,"monitoring of global environmental problems The General Assembly, Reaffirming its resolutions 44/244 of 22 December 1989 and 46/217 of 20 December 1991 on international cooperation in the monitoring, assessment and anticipation of environmental threats and in assistance in cases of environmental emergency, Recalling the relevant provisions of Agenda 21 1/ and the Rio Declaration on Environment and Development, 2/ adopted by the United Nations Conference on Environment and Development, Taking note of decision 16/37 of 31 May 1991 of the Governing Council of the United Nations Environment Programme on early warning and forecasting of 1/ Report of the United Nations Conference on Environment and Development, Rio de Janeiro, 3-14 June 1992, vol. I, Resolutions Adopted by the Conference (United Nations publication, Sales No. E.93.1.8 and corrigendum), resolution 1, annex II. Ibid., resolution 1, annex I. 291193 environmental emergencies, 3/ and decision 17/26 of 21 May 1993 on the United Nations Centre for Urgent Environmental Assistance, 4/ Also taking note of the relevant parts of the reports of the Committee on the Peaceful Uses of Outer Space on its thirty-fifth 5/ and thirty-sixth sessions 6/ in particular, in which the Committee noted the importance of remote sensing by satellites for monitoring the Earth’s environment and, in particular, for studying and monitoring global change, Taking into account the ongoing activities of the Committee on Earth Observation Satellites in support of global environment monitoring and related applications, Bearing in mind the importance of the participation of relevant organs, specialized agencies and other organizations of the United Nations system, within their respective mandates, in Earthwatch, in particular in its environmental monitoring programmes, and the need for early warning capabilities in those programmes, Recognizing the need to make Earthwatch a more efficient instrument for environmental sensing and assessment of all elements influencing the global environment in order to ensure a balanced approach in serving, in particular, the needs of developing countries, Recognizing also the potential and importance of current available methods, technologies and techniques of monitoring, assessment and anticipation of global environmental problems, including remote sensing and monitoring from outer space, 1. Invites Governments, and relevant organizations of the United Nations system, within their respective mandates, and other relevant entities to review, as appropriate, their contribution to international cooperation in environmental monitoring, including remote sensing and evaluation from outer space, and provide appropriate support for such activities within existing resources; 2. Requests the Executive Director of the United Nations Environment Programme to prepare in collaboration with all relevant entities within and outside the United Nations system for submission to the Governing Council of the United Nations Environment Programme at its eighteenth session, a report on the Programme’s activities in environmental monitoring, containing proposals and recommendations within the context of Agenda 21 and a review of Earthwatch, 3/ Official Records of the General Assembly, Forty-sixth Session, Supplement No. 25 (A/46/25), annex. Ibid., Forty-eighth session, Supplement No. 25 (A/48/25), annex. Ibid., Forty-seventh session, Supplement No. 20 (A/47/20). Ibid., Forty-eighth session, Supplement No. 20 (A/48/20). taking into account the decisions adopted by the Governing Council of the United Nations Environment Programme at its seventeenth session; 3. Invites the Governing Council of the United Nations Environment Programme to consider the above-mentioned report at its eighteenth session and submit its conclusions and recommendations to the General Assembly at its fiftieth session, through the Economic and Social Council.",11/29/1993,1993_177547,Turkmenistan,N/A,no
1993,General Assembly,N/A,Forty-eighth session,34,THE SITUATION IN THE MIDDLE EAST,"Norway, Russian Federation and United States of America",N/A,Middle East peace process,"Addendum Add the following countries to the list of sponsors of the resolution: Albania, Angola, Argentina, Armenia, Australia, Austria, Azerbaijan, Barbados, Belarus, Belgium, Benin, Bhutan, Bolivia, Bosnia and Herzegovina, Botswana, Brazil, Bulgaria, Burundi, Cambodia, Canada, Cape Verde, Central African Republic, Chile, Comoros, Congo, Costa Rica, Céte d’Ivoire, Croatia, Czech Republic, Denmark, Ecuador, Egypt, El Salvador, Estonia, Ethiopia, Fiji, Finland, Georgia, Germany, Ghana, Greece, Guatemala, Guinea, Guinea-Bissau, Haiti, Honduras, Hungary, Iceland, Ireland, Israel, Italy, Jamaica, Japan, Jordan, Kazakhstan, Kenya, Kyrgyzstan, Latvia, Lesotho, Liechtenstein, Lithuania, Luxembourg, Madagascar, Malawi, Malta, Marshall Islands, Mauritius, Micronesia (Federated States of), Mongolia, Morocco, Myanmar, Nepal, Netherlands, New Zealand, Nicaragua, Papua New Guinea, Paraguay, Peru, Philippines, Poland, Portugal, Republic of Korea, Republic of Moldova, Romania, Rwanda, Saint Vincent and the Grenadines, Samoa, San Marino, Singapore, Slovak Republic, Slovenia, Solomon Islands, Spain, Suriname, Sweden, Tajikistan, Thailand, the former Yugoslav Republic of Macedonia, Togo, Tunisia, Turkey, Turkmenistan, Ukraine, United Kingdom of Great Britain and Northern Ireland, Uruguay, Venezuela and Zambia",12/14/1993,1993_178756,Turkmenistan,N/A,no
1993,General Assembly,Second Committee,Forty-eighth session,91 (34),DEVELOPMENT AND INTERNATIONAL ECONOMIC COOPERATION: INTEGRATION OF THE ECONOMIES IN TRANSITION INTO THE WORLD ECONOMY,"Armenia, Azerbaijan, Belarus, Bulgaria, Croatia, Czech Republic, Estonia, Georgia, Kazakhstan, Krygyzstan, Latvia, Lithuania, Nicaragua, Poland, Republic of Moldova, Romania, Slovakia, Tajikistan, Russian Federation, the former Yugoslav Republic of Macedonia, Turkmenistan, Ukraine and United States of America",N/A,Integration of the economies in transition into the,"world economy The General Assembly, Reaffirming its resolutions 47/175 and 47/187 of 22 December 1992 and all its other relevant resolutions, Noting the relevant decisions of the Governing Council of the United Nations Development Programme, 1/ decision B (48) of 26 April 1993, adopted by the Economic Commission for Europe, 2/ and resolution 49/1 of 29 April 1993, adopted by the Economic and Social Commission of Asia and the Pacific, 3/ Taking note of the report of the Secretary-General concerning the role of the United Nations system in addressing problems facing countries with economies 1/ Official Records of the Economic and Social Council, 1993, Supplement No. 15 (E/1993/35), annex I. Ibid., Supplement No. 17 (E/1993/37), chap. IV. Ibid., Supplement No. 16 (E/1993/36), chap. IV. 171193 in transition, including the difficulties that those countries are encountering as they integrate their economies into the world economy, 4/ 1. Reaffirms the need for the full integration of the countries with economies in transition, as well as all other countries, into the world economy, in particular through improved market access for their exports of goods and services; such integration will support the systemic transformation of countries with economies in transition towards market-oriented policies and will, simultaneously, have a positive impact on world trade and global economic growth and development; 2. Requests the Secretary-General to strengthen - within existing resources and through appropriate arrangements within the United Nations Secretariat - the ability of the United Nations system to conduct analytical activities and provide policy advice and technical assistance to the countries with economies in transition and to promote and enhance mutual cooperation with the International Monetary Fund and the World Bank, within their respective mandates; 3. Also requests the Secretary-General to study - within the scope of the implementation of the present resolution and while continuing the existing cooperation with relevant international institutions and entities - possible areas of economic and technical cooperation among countries with economies in transition, as well as with the developing countries, identifying the role the United Nations system could play in this field, with a view to encouraging greater participation by those countries in the world economy; 4. Further requests the Secretary-General to submit to the General Assembly at its forty-ninth session, and biennially thereafter, a report on the implementation of the present resolution. A/48/317.",11/17/1993,1993_241988,Turkmenistan,N/A,no
