year,Council,Committee,Session,Agenda item,Agenda detail,cosponsored countries,body title number,body title detail,body text,date,file,filecountry,footnote,scanned
2010,General Assembly,N/A,Sixty-fourth session,49,Culture of peace,"Afghanistan, Bangladesh, Barbados, Belarus, Belize, Benin, Bosnia and Herzegovina, Democratic People’s Republic of Korea, Ecuador, Egypt, Guinea, Haiti, India, Indonesia, Jordan, Kazakhstan, Lao People’s Democratic Republic, Liberia, Madagascar, Malaysia, Maldives, Mauritius, Mongolia, Morocco, Nepal, Nicaragua, Pakistan, Panama, Peru, Philippines, Russian Federation, Senegal, Sierra Leone, Somalia, Sri Lanka, Syrian Arab Republic, Thailand, Uzbekistan, Vanuatu, Yemen, Zambia and Zimbabwe",N/A,"International Decade for a Culture of Peace and Non-Violence for the Children of the World, 2001-2010","Addendum Add the following countries to the list of sponsors of the resolution: Angola, Antigua and Barbuda, Azerbaijan, Bahamas, Bhutan, Bolivia, Botswana, Brazil, Brunei Darussalam, Burkina Faso, Burundi, Cambodia, Cameroon, Cape Verde, Chad, Chile, China, Colombia, Comoros, Congo, Costa Rica, Céte d’Ivoire, Democratic Republic of the Congo, Djibouti, Dominica, Dominican Republic, El Salvador, Eritrea, Ethiopia, Fiji, Gabon, Gambia, Ghana, Grenada, Guatemala, Guyana, Honduras, Jamaica, Kenya, Kuwait, Lebanon, Lesotho, Malawi, Mali, Mauritania, Mexico, Montenegro, Mozambique, Myanmar, Nigeria, Oman, Papua New Guinea, Paraguay, Qatar, Rwanda, Saint Lucia, Saint Vincent and the Grenadines, Samoa, Saudi Arabia, Seychelles, Singapore, Solomon Islands, Sudan, Suriname, Swaziland, Tajikistan, Togo, Trinidad and Tobago, Tunisia, Turkey, Turkmenistan, Uganda, United Arab Emirates, United Republic of Tanzania, Uruguay and Viet Nam 09-66441* ill 060110 CARCI",01/04/2010,2010_673882,Turkey,* Reissued for technical reasons.,yes
2010,Security Council,N/A,N/A,N/A,United Nations S 2010/29,"Argentina, Austria, Bosnia and Herzegovina, Brazil, Canada, Chile, China, France, Gabon, Guatemala, Japan, Lebanon, Mexico, Nigeria, Peru, Russian Federation, Turkey, Uganda, United Kingdom of Great Britain and Northern Ireland, United States of America and Uruguay",N/A,N/A,"The Security Council, Reaffirming its previous resolutions on Haiti, in particular its resolutions 1892 (2009), 1840 (2008), 1780 (2007), 1743 (2007), 1702 (2006), 1658 (2006), 1608 (2005), 1576 (2004) and 1542 (2004), Expressing its deepest sympathy and solidarity to all those affected by the devastating earthquake of 12 January in Haiti and to their families, Further expressing its deepest gratitude for the work of United Nations Stabilization Mission in Haiti (MINUSTAH) staff and troops, as well as for the work of the staffs of other United Nations and international organizations in Haiti, Recognizing the dire circumstances and urgent need for a response, Welcoming the efforts of Member States to support the Government and people of Haiti and MINUSTAH, 1. Endorses the recommendation made by the Secretary-General to increase the overall force levels of MINUSTAH to support the immediate recovery, reconstruction and stability efforts; 2. Decides, therefore, that MINUSTAH will consist of a military component of up to 8,940 troops of all ranks and of a police component of up to 3,711 police and that it will keep the new levels of troops and police in MINUSTAH under review as necessary; 3. Decides to remain seized of the matter. 10-21240 Hi 190110 CAT AT A",01/19/2010,2010_675257,Turkey,N/A,yes
2010,General Assembly,N/A,Sixty-fourth session,70 (a),"Strengthening of the coordination of humanitarian and disaster relief assistance of the United Nations, including special economic assistance: strengthening of the coordination of emergency humanitarian assistance","Australia, Brazil, Cameroon, Chile, Colombia, Dominican Republic, Japan, Kazakhstan, Norway, Peru, Philippines, Saint Vincent and the Grenadines, Spain and Uruguay",N/A,"Humanitarian assistance, emergency relief and rehabilitation for Haiti in response to the devastating effects of the earthquake in that country","Addendum Add the following countries to the list of sponsors of the resolution: Albania, Algeria, Andorra, Antigua and Barbuda, Argentina, Armenia, Austria, Azerbaijan, Bahamas, Bangladesh, Barbados, Belarus, Belgium, Belize, Benin, Bosnia and Herzegovina, Bulgaria, Burkina Faso, Burundi, Cambodia, Canada, Central African Republic, Comoros, Congo, Costa Rica, Croatia, Cuba, Cyprus, Czech Republic, Denmark, Ecuador, Egypt, El] Salvador, Eritrea, Estonia, Finland, France, Gambia, Georgia, Germany, Ghana, Greece, Grenada, Guatemala, Guyana, Haiti, Honduras, Hungary, Iceland, India, Indonesia, Iran (Islamic Republic of), Ireland, Israel, Italy, Jamaica, Jordan, Lao People’s Democratic Republic, Latvia, Lebanon, Liechtenstein, Lithuania, Luxembourg, Madagascar, Malta, Mauritius, Mexico, Monaco, Mongolia, Montenegro, Morocco, Nepal, Netherlands, New Zealand, Nigeria, Pakistan, Panama, Papua New Guinea, Poland, Portugal, Republic of Korea, Republic of Moldova, Romania, Russian Federation, Rwanda, Saint Lucia, San Marino, Senegal, Serbia, Seychelles, Singapore, Slovakia, Slovenia, South Africa, Sudan, Suriname, Sweden, Switzerland, Thailand, the former Yugoslav Republic of Macedonia, Tonga, Trinidad and Tobago, Tunisia, Turkey, Turkmenistan, Ukraine, United Kingdom of Great Britain and Northern Ireland, United Republic of Tanzania, United States of America, Viet Nam, Yemen and Zambia 10-21729 Hi 260110 CNY A A",01/22/2010,2010_675700,Turkey,N/A,yes
2010,Security Council,N/A,N/A,N/A,United Nations S 2010/49,"France, Turkey, Uganda, United Kingdom of Great Britain and Northern Ireland and United States of America",N/A,N/A,"The Security Council, Recalling all its previous resolutions and statements of its President concerning the situation in Somalia, Recalling its resolutions 1674 (2006), 1738 (2006) and 1894 (2009) on the protection of civilians in armed conflict, 1325 (2000), 1820 (2008), 1888 (2009) and 1889 (2009) on women and peace and security, and 1612 (2005) and 1882 (2009) on children and armed conflict, Reaffirming its respect for the sovereignty, territorial integrity, political independence and unity of Somalia, Reiterating its commitment to a comprehensive and lasting settlement of the situation in Somalia, Reiterating its full support for the Djibouti Peace Process, which provides the framework for reaching a lasting political solution in Somalia, expressing its support for the Transitional Federal Charter, recognizing the need to promote reconciliation and dialogue among the Somali population and stressing the importance of broad- based and representative institutions reached through a political process ultimately inclusive of all, Commending the contribution of the African Union Mission to Somalia (AMISOM) to lasting peace and stability in Somalia, expressing its appreciation for the continued commitment of troops and equipment to AMISOM by the Governments of Uganda and Burundi, and condemning any hostilities towards AMISOM and the Transitional Federal Government, Commending the Special Representative of the Secretary-General, Mr. Ahmedou Ould-Abdallah, and reaffirming its strong support for his efforts, Welcoming the communiqué of the 214th meeting of the African Union Peace and Security Council of 8 January 2010, which renewed the mandate of AMISOM for an additional period of twelve months, Reaffirming the importance of the re-establishment, training, equipping and retention of Somali security forces, which is vital for the long-term stability of Somalia, and emphasizing the importance of coordinated, timely and sustained support from the international community, 10-22271 nl 280110 CAT A TA S/2010/49 Strongly encouraging the prompt disbursement of funds pledged in support of the Somali security institutions and AMISOM at the International Conference on Somalia held in Brussels on 23 April 2009, and recognizing the importance of timely and predictable funding for the Transitional Federal Government and AMISOM, Reiterating its serious concern at the continued fighting in Somalia, and reaffirming its support for the Transitional Federal Government, Condemning the terrorist attacks on the Transitional Federal Government, AMISOM and the civilian population by armed groups and foreign fighters who undermine peace and stability in Somalia, particularly Al Shabaab, and stressing the terrorist threat that Somali armed groups, in particular Al Shabaab, constitute for Somalia and for the international community, Emphasizing the importance of effective public information and communications operations to support the Transitional Federal Government and AMISOM and consolidate the political process, and expressing its serious concern at the continued attacks against journalists, Reiterating its serious concern at the worsening humanitarian situation in Somalia, strongly condemning the targeting and obstruction of the delivery of humanitarian aid by armed groups in Somalia, which has prevented the delivery of such aid in some areas, deploring the repeated attacks on humanitarian personnel, expressing its condemnation in the strongest terms of all acts of violence or abuses committed against civilians and humanitarian personnel, in violation of international humanitarian law and human rights law, and reaffirming the importance of the fight against impunity, Expressing its concern at the significant decline in humanitarian funding for Somalia and calling on all Member States to contribute to current and future consolidated humanitarian appeals, Condemning all and any violations of human rights and international humanitarian and human rights law, stressing the responsibility of all parties in Somalia to respect fully their obligations in this regard and to take appropriate measures to protect civilians, including women and children, and recalling the conclusions of the Security Council working group on Children and Armed Conflict pertaining to parties in the armed conflict of Somalia (S/AC.51/2008/14), Recalling its resolution 1897 (2009), recognizing that the ongoing instability in Somalia contributes to the problem of piracy and armed robbery at sea off the coast of Somalia, stressing the need for a comprehensive response to tackle piracy and its underlying causes, by the international community, including through the training of the Somali coastguard, and welcoming the efforts of the Contact Group for Piracy off the Coast of Somalia, States and international and regional organizations, Welcoming the Secretary-General’s report dated 31 December 2009 (S/2009/684), and its recommendations for continued action on the political, security and recovery tracks by the Transitional Federal Government with the support of the international community, Determining that the situation in Somalia constitutes a threat to international peace and security in the region, S/2010/49 Acting under Chapter VII of the Charter of the United Nations, 1. Decides to authorize the Member States of the African Union to maintain AMISOM until 31 January 2011, which shall be authorized to take all necessary measures to carry out its existing mandate as set out in paragraph 9 of resolution 1772 (2007); 2. Requests the African Union to maintain AMISOM’s deployment in Somalia and to increase its force strength with a view to achieving AMISOM’s originally mandated strength of 8,000 troops, thereby enhancing its ability to carry out its mandate in full; 3. Requests AMISOM to continue to assist the Transitional Federal Government in the development of the Somali Police Force and the National Security Force, and to assist the integration of Somali units trained by other member States or organizations inside and outside Somalia; 4. Requests the Secretary-General to continue to provide a logistical support package for AMISOM called for by resolution 1863 (2009), comprising equipment and services, including public information support, but not including the transfer of funds, as described in the Secretary-General’s letter (S/2009/60) to the Security Council until 31 January 2011, ensuring the accountability and transparency of expenditure of United Nations funds; 5. | Encourages Member States to support AMISOM and the Somali Security Sector Institutions through the provision of appropriate and necessary equipment; 6. Requests AMISOM to ensure that all equipment and services provided under the support package are used in a transparent and effective manner for their designated purposes, and further requests the African Union to report to the Secretary-General on the usage of such equipment and services in accordance with the Memorandum of Understanding established between the United Nations and the African Union; 7. Requests the Secretary-General to continue to provide technical and expert advice to the African Union in the planning and deployment of AMISOM through the existing United Nations planning team in Addis Ababa; 8. Urges Member States and regional and international organizations to contribute generously and promptly to the United Nations Trust Fund for AMISOM, or to make direct bilateral donations in support of AMISOM, and encourages donors to work closely with the United Nations and African Union in order to ensure that the appropriate funds and equipment are promptly provided, particularly in relation to the salaries of AMISOM soldiers and the costs of contingent-owned equipment; 9. Recalls its statement of intent regarding the establishment of a United Nations peacekeeping operation as expressed in resolution 1863 (2009), and notes that any decision to deploy such an operation would take into account inter alia the conditions set out in the Secretary-General’s report dated 16 April 2009 (S/2009/210), and requests the Secretary-General to take the steps identified in paragraphs 82-86 of his report (S/2009/210), subject to the conditions in this report; 10. Emphasizes that Somalia’s long-term security rests with the effective development by the Transitional Federal Government of the National Security Force S/2010/49 and the Somali Police Force, in the framework of the Djibouti Agreement and in line with a national security strategy; 11. Urges Member States, regional and international organizations to contribute generously and promptly to the United Nations Trust Fund for the Somali security institutions, and to offer assistance to the Somali security forces, including through training and equipment in coordination with AMISOM, consistent with paragraphs 11 (b) and 12 of resolution 1772 (2007); 12. Requests the Secretary-General to continue to assist the Transitional Federal Government in developing the transitional security institutions, including the Somali Police Force, and the National Security Force, and to continue to support the Transitional Federal Government in developing a national security strategy, which reflects respect for the rule of law and the protection of human rights, including plans for disarmament, demobilization and reintegration (DDR), justice and corrections capacities, as well as the legal and policy framework for the operation of its security forces including governance, vetting and oversight mechanisms; 13. Reaffirms that the measures imposed by paragraph 5 of resolution 733 (1992) and further elaborated upon by paragraphs 1 and 2 of resolution 1425 (2002) shall not apply to supplies and technical assistance provided in accordance with paragraph 11 (b) and 12 of resolution 1772 (2007) to the Transitional Federal Government for the purposes of the development of its security sector institutions, consistent with the Djibouti peace process and subject to the notification procedure set out in paragraph 12 of resolution 1772 (2007); 14. Reiterates its call on all Somali parties to support the Djibouti Agreement, and calls for the end of all hostilities, acts of armed confrontation and efforts to undermine the Transitional Federal Government; 15. Welcomes the efforts of the Transitional Federal Government on reconciliation, urges the Transitional Federal Government to continue and strengthen these efforts in the framework of the Djibouti Agreement with all groups willing to cooperate and ready to renounce violence, and requests the Secretary- General, through his Special Representative for Somalia, to continue to work with the international community to facilitate reconciliation; 16. Calls for the immediate cessation of all acts of violence or abuses committed against civilians and humanitarian personnel in violation of international humanitarian law and human rights law; 17. Calls on all parties and armed groups to take appropriate steps to ensure the safety and security of humanitarian personnel and supplies, and demands that all parties ensure full, safe and unhindered access for the timely delivery of humanitarian aid to persons in need of assistance across the country; 18. Requests the Secretary-General, through his Special Representative for Somalia and the United Nations Political Office for Somalia (UNPOS), to redouble their efforts to coordinate effectively and develop an integrated approach to all activities of the United Nations system in Somalia, to provide good offices and political support for the efforts to establish lasting peace and stability in Somalia, and to mobilize resources and support from the international community for both the S/2010/49 immediate recovery and long-term economic development of Somalia taking into account the recommendations contained in his report (S/2009/684); 19. Calls on the Transitional Federal Government to take every appropriate measure to improve security conditions in Somalia and requests the Secretary- General to expedite the proposed deployment of elements of UNPOS and other United Nations offices and agencies, including the United Nations Support Office for AMISOM (UNSOA), to Mogadishu consistent with the security conditions, as outlined in his report (S/2009/210); 20. Requests the Secretary-General to report on all aspects of this resolution every four months commencing 1 January and expresses its intention to review the situation, as part of his reporting obligations, as specified in the statement of the President of the Security Council of 31 October 2001 (S/PRST/2001/30) and Security Council resolution 1872 (2009); 21. Decides to remain actively seized of the matter. 10-22271",01/28/2010,2010_675888,Turkey,N/A,yes
2010,General Assembly,Commission On Human Rights,special session,N/A,United Nations Avurcys-13/L.1,"Algeria’, Angola, Argentina, Armenia’, Austria’, Bahrain, Belarus’, Belgium, Bangladesh, Bolivia (Plurinational State of), Bosnia and Herzegovina, Botswana’, Brazil, Bulgaria*, Burkina Faso, Chile, China, Colombia’, Costa Rica’, Croatia’, Cuba, Cyprus’, Djibouti, Denmark’, Dominican Republic’, Ecuador’, Estonia’, Finland’, France, Gabon, Germany’, Ghana, Greece’, Guatemala’, Haiti’, Hungary, Iceland’, India, Ireland’, Italy, Japan, Kenya’, Kuwait’, Latvia’, Lebanon’, Lithuania’, Luxembourg’, Malta’, Mexico, Morocco’, Nicaragua, Nigeria, Norway, Panama’, Paraguay , Peru’, Philippines, Poland’, Portugal’, Qatar, Republic of Korea, Romania’, Russian Federation, Saudi Arabia, Senegal, Slovakia, Slovenia, Somalia’, Spain’, Syrian Arab Republic’, Trinidad and Tobago’, Tunisia’, Turkey’, Ukraine, United Kingdom of Great Britain and Northern Ireland, Uruguay, Venezuela (Bolivarian Republic of)"", Viet Nam* and Zambia",N/A,"S-13/... The support of the Human Rights Council to the Recovery Process in Haiti after the Earthquake of January 12, 2010: a Human Rights Approach","The Human Rights Council, Expressing its sincere condolences and deepest sympathy and solidarity for all victims and their families, including all UN personnel, as well as for the government and the people of Haiti affected by the devastating earthquake of 12 January 2010, Reaffirming its previous outcomes on the situation of Human Rights in Haiti, in particular Presidential Statements PRST/9/1 and PRST/6/1, Concerned by the dire human and material losses and suffering sustained as a result of the earthquake, as well as of its impact on the full enjoyment of all human rights in the affected country, Concerned also that the effects of the earthquake further exacerbated existing challenges to the full enjoyment of all human rights in Haiti and expressing concern over the medium and long-term consequences of the disaster, including its social, economic and development aspects, “ Non-member State of the Human Rights Council. GE.10- 10505 A/HRC/S-13/L.1 Reiterating that the promotion and protection of all human rights — economic, civil, social, political and cultural rights, including the right to development — are indispensable elements for peace, stability and development, Acknowledging the extraordinary situation in Haiti, particularly in Port au Prince, Léogane and Jacmel, which requires an equally extraordinary response led by the government of Haiti, in collaboration with the international community, Expressing its appreciation for the prompt response, solidarity and assistance provided by the U.N. system, through U.N. agencies, programs and funds, and the United Nations Stabilization Mission in Haiti (MINUSTAH), as well as by the U.N. Member States, the international community, civil society, the private sector and individuals, Reiterating the need for the United Nations system to respond swiftly to requests for assistance by the affected country and to ensure that the assistance provided is timely, adequate, effective and coherent and coordinated among all development actors, in particular the government of Haiti. Underscoring the need for long-term and sustainable support of the international community for the government of Haiti to promote the respect for human rights, the rule of law and good governance, Recalling the primary responsibility and competence of the Haitian government to promoting and protecting all human rights in the country, Bearing in mind that the tragedy has obliterated the ongoing efforts of the Haitian government to prepare the national report to be presented in May, 2010, at the eighth session of the Working Group of the Universal Periodic Review (UPR), Mindful of UN General Assembly Resolution A/64/250, 1. Calls upon the international community to continue to ensure adequate and coordinated support to the government and the people of Haiti in their efforts to overcome the challenges arising from the earthquake, keeping in mind the importance of integrating a human-rights approach; 2. Reaffirms the sovereignty of Haiti and its territorial integrity and stresses the central role of the Haitian government in establishing national priorities for the recovery process; 3. Underscores the importance of renewed and sustainable commitment to address the existing and the additional challenges to promote and protect all human rights in Haiti, and further encourages the government of Haiti to continue its efforts to promote and protect all human rights in the country; 4. Expresses its concern about the present human rights situation in Haiti, in particular the vulnerable situation of children, women, internally displaced persons, the elderly, persons with disabilities and wounded; 5. Underlines the need to address the additional obstacles arising from the devastation in such areas as access to food, adequate housing, health care, water and sanitation, education, work and the civil registry; 6. Emphasizes, in this context, the importance of reconstructing national institutions and of providing cooperation, capacity-building and technical assistance to the government and the people of Haiti, in accordance with the needs and the requests made by the concerned country; A/HRC/S-13/L.1 7. Welcomes and further encourages the responses provided by the U.N. system and by the international community at large to assist the government of Haiti to promote and protect all human rights in Haiti in the aftermath of the earthquake, such as, inter alia, those resources aiming at providing cash and food for work, as well as those aiming at securing the full protection of the rights of all those in vulnerable situations, especially children and women; 8. Underlines the importance of protecting children from any violence, injury or abuse, mal-treatment or exploitation, and of ensuring that separated or unaccompanied children do re-unite with their families and those left orphaned receive immediate attention and necessary protection, and, in this context, underscores the need of cooperation and assistance to the government of Haiti from all U.N. members and relevant organs and bodies of the U.N. systems, in particular UNICEF; 9. Emphasizes the need to apply a gender based approach in the recovery process; 10. Decides to act favourably, in view of the exceptional circumstances that confront it, upon the request of Haiti, to postpone relevant deadlines related to its Universal Periodic Review within the Human Rights Council to a date no later than December 2011; 11. Welcomes the initiative to establish a joint protection team with the participation of the High Commissioner for Human Rights; 12. Invites the United Nations High Commissioner for Human Rights to identify, in collaboration with the Haitian government, areas for cooperation and technical assistance with Haiti, on the basis of the expertise and the presence of the U.N. system on the ground, in particular the Office of the High Commissioner for Human Rights, in collaboration with special procedures, a view to present suggestions in this regard to the Human Rights Council in its 14"""" Regular Session.",01/27/2010,2010_676238,Turkey,N/A,yes
