year,Council,Committee,Session,Agenda item,Agenda detail,cosponsored countries,body title number,body title detail,body text,date,file,filecountry,footnote,scanned
2010,General Assembly,N/A,Sixty-fourth session,70 (a),"Strengthening of the coordination of humanitarian and disaster relief assistance of the United Nations, including special economic assistance: strengthening of the coordination of emergency humanitarian assistance","Australia, Brazil, Cameroon, Chile, Colombia, Dominican Republic, Japan, Kazakhstan, Norway, Peru, Philippines, Saint Vincent and the Grenadines, Spain and Uruguay",N/A,"Humanitarian assistance, emergency relief and rehabilitation for Haiti in response to the devastating effects of the earthquake in that country","Addendum Add the following countries to the list of sponsors of the resolution: Albania, Algeria, Andorra, Antigua and Barbuda, Argentina, Armenia, Austria, Azerbaijan, Bahamas, Bangladesh, Barbados, Belarus, Belgium, Belize, Benin, Bosnia and Herzegovina, Bulgaria, Burkina Faso, Burundi, Cambodia, Canada, Central African Republic, Comoros, Congo, Costa Rica, Croatia, Cuba, Cyprus, Czech Republic, Denmark, Ecuador, Egypt, El] Salvador, Eritrea, Estonia, Finland, France, Gambia, Georgia, Germany, Ghana, Greece, Grenada, Guatemala, Guyana, Haiti, Honduras, Hungary, Iceland, India, Indonesia, Iran (Islamic Republic of), Ireland, Israel, Italy, Jamaica, Jordan, Lao People’s Democratic Republic, Latvia, Lebanon, Liechtenstein, Lithuania, Luxembourg, Madagascar, Malta, Mauritius, Mexico, Monaco, Mongolia, Montenegro, Morocco, Nepal, Netherlands, New Zealand, Nigeria, Pakistan, Panama, Papua New Guinea, Poland, Portugal, Republic of Korea, Republic of Moldova, Romania, Russian Federation, Rwanda, Saint Lucia, San Marino, Senegal, Serbia, Seychelles, Singapore, Slovakia, Slovenia, South Africa, Sudan, Suriname, Sweden, Switzerland, Thailand, the former Yugoslav Republic of Macedonia, Tonga, Trinidad and Tobago, Tunisia, Turkey, Turkmenistan, Ukraine, United Kingdom of Great Britain and Northern Ireland, United Republic of Tanzania, United States of America, Viet Nam, Yemen and Zambia 10-21729 Hi 260110 CNY A A",01/22/2010,2010_675700,Ukraine,N/A,yes
2010,General Assembly,Commission On Human Rights,special session,N/A,United Nations Avurcys-13/L.1,"Algeria’, Angola, Argentina, Armenia’, Austria’, Bahrain, Belarus’, Belgium, Bangladesh, Bolivia (Plurinational State of), Bosnia and Herzegovina, Botswana’, Brazil, Bulgaria*, Burkina Faso, Chile, China, Colombia’, Costa Rica’, Croatia’, Cuba, Cyprus’, Djibouti, Denmark’, Dominican Republic’, Ecuador’, Estonia’, Finland’, France, Gabon, Germany’, Ghana, Greece’, Guatemala’, Haiti’, Hungary, Iceland’, India, Ireland’, Italy, Japan, Kenya’, Kuwait’, Latvia’, Lebanon’, Lithuania’, Luxembourg’, Malta’, Mexico, Morocco’, Nicaragua, Nigeria, Norway, Panama’, Paraguay , Peru’, Philippines, Poland’, Portugal’, Qatar, Republic of Korea, Romania’, Russian Federation, Saudi Arabia, Senegal, Slovakia, Slovenia, Somalia’, Spain’, Syrian Arab Republic’, Trinidad and Tobago’, Tunisia’, Turkey’, Ukraine, United Kingdom of Great Britain and Northern Ireland, Uruguay, Venezuela (Bolivarian Republic of)"", Viet Nam* and Zambia",N/A,"S-13/... The support of the Human Rights Council to the Recovery Process in Haiti after the Earthquake of January 12, 2010: a Human Rights Approach","The Human Rights Council, Expressing its sincere condolences and deepest sympathy and solidarity for all victims and their families, including all UN personnel, as well as for the government and the people of Haiti affected by the devastating earthquake of 12 January 2010, Reaffirming its previous outcomes on the situation of Human Rights in Haiti, in particular Presidential Statements PRST/9/1 and PRST/6/1, Concerned by the dire human and material losses and suffering sustained as a result of the earthquake, as well as of its impact on the full enjoyment of all human rights in the affected country, Concerned also that the effects of the earthquake further exacerbated existing challenges to the full enjoyment of all human rights in Haiti and expressing concern over the medium and long-term consequences of the disaster, including its social, economic and development aspects, “ Non-member State of the Human Rights Council. GE.10- 10505 A/HRC/S-13/L.1 Reiterating that the promotion and protection of all human rights — economic, civil, social, political and cultural rights, including the right to development — are indispensable elements for peace, stability and development, Acknowledging the extraordinary situation in Haiti, particularly in Port au Prince, Léogane and Jacmel, which requires an equally extraordinary response led by the government of Haiti, in collaboration with the international community, Expressing its appreciation for the prompt response, solidarity and assistance provided by the U.N. system, through U.N. agencies, programs and funds, and the United Nations Stabilization Mission in Haiti (MINUSTAH), as well as by the U.N. Member States, the international community, civil society, the private sector and individuals, Reiterating the need for the United Nations system to respond swiftly to requests for assistance by the affected country and to ensure that the assistance provided is timely, adequate, effective and coherent and coordinated among all development actors, in particular the government of Haiti. Underscoring the need for long-term and sustainable support of the international community for the government of Haiti to promote the respect for human rights, the rule of law and good governance, Recalling the primary responsibility and competence of the Haitian government to promoting and protecting all human rights in the country, Bearing in mind that the tragedy has obliterated the ongoing efforts of the Haitian government to prepare the national report to be presented in May, 2010, at the eighth session of the Working Group of the Universal Periodic Review (UPR), Mindful of UN General Assembly Resolution A/64/250, 1. Calls upon the international community to continue to ensure adequate and coordinated support to the government and the people of Haiti in their efforts to overcome the challenges arising from the earthquake, keeping in mind the importance of integrating a human-rights approach; 2. Reaffirms the sovereignty of Haiti and its territorial integrity and stresses the central role of the Haitian government in establishing national priorities for the recovery process; 3. Underscores the importance of renewed and sustainable commitment to address the existing and the additional challenges to promote and protect all human rights in Haiti, and further encourages the government of Haiti to continue its efforts to promote and protect all human rights in the country; 4. Expresses its concern about the present human rights situation in Haiti, in particular the vulnerable situation of children, women, internally displaced persons, the elderly, persons with disabilities and wounded; 5. Underlines the need to address the additional obstacles arising from the devastation in such areas as access to food, adequate housing, health care, water and sanitation, education, work and the civil registry; 6. Emphasizes, in this context, the importance of reconstructing national institutions and of providing cooperation, capacity-building and technical assistance to the government and the people of Haiti, in accordance with the needs and the requests made by the concerned country; A/HRC/S-13/L.1 7. Welcomes and further encourages the responses provided by the U.N. system and by the international community at large to assist the government of Haiti to promote and protect all human rights in Haiti in the aftermath of the earthquake, such as, inter alia, those resources aiming at providing cash and food for work, as well as those aiming at securing the full protection of the rights of all those in vulnerable situations, especially children and women; 8. Underlines the importance of protecting children from any violence, injury or abuse, mal-treatment or exploitation, and of ensuring that separated or unaccompanied children do re-unite with their families and those left orphaned receive immediate attention and necessary protection, and, in this context, underscores the need of cooperation and assistance to the government of Haiti from all U.N. members and relevant organs and bodies of the U.N. systems, in particular UNICEF; 9. Emphasizes the need to apply a gender based approach in the recovery process; 10. Decides to act favourably, in view of the exceptional circumstances that confront it, upon the request of Haiti, to postpone relevant deadlines related to its Universal Periodic Review within the Human Rights Council to a date no later than December 2011; 11. Welcomes the initiative to establish a joint protection team with the participation of the High Commissioner for Human Rights; 12. Invites the United Nations High Commissioner for Human Rights to identify, in collaboration with the Haitian government, areas for cooperation and technical assistance with Haiti, on the basis of the expertise and the presence of the U.N. system on the ground, in particular the Office of the High Commissioner for Human Rights, in collaboration with special procedures, a view to present suggestions in this regard to the Human Rights Council in its 14"""" Regular Session.",01/27/2010,2010_676238,Ukraine,N/A,yes
2010,General Assembly,N/A,Sixty-fourth session,126,Sixty-fifth anniversary of the end of the Second World War,"Armenia, Azerbaijan, Belarus, Canada, Croatia, Cuba, Cyprus, Ecuador, Kazakhstan, Kyrgyzstan, Luxembourg, Mongolia, Nicaragua, Peru, Portugal, Republic of Moldova, Romania, Russian Federation, Serbia, Slovenia, South Africa, Tajikistan, Trinidad and Tobago, Turkmenistan, Ukraine, United States of America, Uzbekistan and Viet Nam",N/A,Sixty-fifth anniversary of the end of the Second World War,"The General Assembly, Recalling its resolution 59/26 of 22 November 2004, in which it, inter alia, declared 8 and 9 May as a time of remembrance and reconciliation, Recalling that 2010 will mark the sixty-fifth anniversary of the end of the Second World War, a war which brought untold sorrow to mankind, Stressing that this historic event established the conditions for the creation of the United Nations, designed to save succeeding generations from the scourge of war, Calling upon the States Members of the United Nations to unite their efforts in dealing with new challenges and threats, with the United Nations playing a central role, and to make every effort to settle all disputes by peaceful means in conformity with the Charter of the United Nations and in such a manner that international peace and security are not endangered, Underlining the progress made since the end of the Second World War in overcoming its legacy and towards establishing reconciliation, international and regional cooperation and the promotion of democratic values, human rights and fundamental freedoms, in particular through the United Nations, and the establishment of regional organizations and other appropriate frameworks, 1. Invites all Member States, organizations of the United Nations system, non-governmental organizations and individuals to observe these days in an appropriate manner to pay tribute to all victims of the Second World War; 10-24416 Hil 180210 CAT A A A 2. Requests the President of the General Assembly to hold a special solemn meeting of the General Assembly in the second week of May 2010 in commemoration of all victims of the war; 3. Requests the Secretary-General to bring the present resolution to the attention of all Member States and organizations of the United Nations system and to take measures necessary for its implementation. 10-24416",02/17/2010,2010_676867,Ukraine,N/A,yes
2010,General Assembly,N/A,Sixty-fourth session,46,Global road safety crisis,"Argentina, Armenia, Azerbaijan, Bangladesh, Belarus, Belgium, Benin, Chile, Costa Rica, Cuba, Cyprus, Dominican Republic, Finland, France, Germany, Greece, Hungary, Iceland, India, Israel, Italy, Jamaica, Jordan, Kazakhstan, Lao People’s Democratic Republic, Lebanon, Luxembourg, Malaysia, Mexico, Mongolia, Morocco, Netherlands, Norway, Oman, Peru, Poland, Portugal, Republic of Moldova, Romania, Russian Federation, Saudi Arabia, Serbia, Seychelles, Singapore, Slovenia, Sri Lanka, Sweden, Tajikistan, Thailand, the former Yugoslav Republic of Macedonia, Turkey, Turkmenistan, United Kingdom of Great Britain and Northern Ireland, Uruguay, Uzbekistan, Venezuela (Bolivarian Republic of), Viet Nam and Yemen",N/A,Improving global road safety,"Addendum Add the following countries to the list of sponsors of the resolution: Albania, Algeria, Australia, Bahrain, Canada, Cape Verde, Colombia, Croatia, Czech Republic, Democratic People’s Republic of Korea, Denmark, Ecuador, Egypt, El Salvador, Estonia, Grenada, Haiti, Iraq, Ireland, Japan, Kuwait, Kyrgyzstan, Lithuania, Malta, Mauritius, Monaco, Montenegro, Myanmar, Nepal, New Zealand, Pakistan, Qatar, Saint Lucia, Slovakia, Spain, Sudan, Switzerland, Trinidad and Tobago, Tunisia, Ukraine, United Arab Emirates and United States of America 10-25985 Hil 080310 CAT A A A",03/02/2010,2010_677897,Ukraine,N/A,yes
2010,General Assembly,Commission On Human Rights,Thirteenth session,3,"Promotion and protection of all human rights, civil, political, economic, social and cultural rights, including the right to development","Austria*, Belarus*, Bolivia (Plurinational State of), Bosnia and Herzegovina, Brazil, Chile, Colombia*, Costa Rica*, Croatia*, Cyprus*, Dominican Republic*, Egypt, Finland*, France, Germany*, Honduras, Hungary, Italy, Kenya*, Liechtenstein“, Lithuania*, Maldives*, Malta*, Morocco*, Netherlands, Niger*, Paraguay*, Peru*, Portugal*, Romania*, Slovakia, Slovenia, Spain*, Thailand*, Uganda*, Ukraine, United Republic of Tanzania*, Uruguay, Zimbabwe*",N/A,13/... Open-ended Working Group on an optional protocol to the Convention on the Rights of the Child to provide a communications procedure,"The Human Rights Council, Recalling Human Rights Council resolution 11/1 of 17 June 2009 on the Open- ended Working Group on an optional protocol to the Convention on the Rights of the Child to provide a communications procedure, Recalling also General Assembly resolution 64/146 of 18 December 2009 on the rights of the child, Bearing in mind paragraph 33 (p) of General Assembly resolution 64/146, in which the Assembly called upon States to ensure that child-sensitive procedures were made available to children and their representatives so that children had access to means of facilitating effective remedies for any breaches of any of their rights arising from the Convention on the Rights of the Child through independent advice, advocacy and complaint procedures, including justice mechanisms, and that their views were heard when they were involved or their interests were concerned in judicial or administrative procedures in a manner consistent with the procedural rules of national law, Noting with interest general comment No. 5 (2003) of the Committee on the Rights of the Child, in which the Committee emphasized that children’s special and dependent status creates real difficulties for them in pursuing remedies for breaches of their rights, and general comment No. 12 (2009), in which the Committee stated that the right of all children Please recycle ee A/HRC/13/L.5 to be heard and taken seriously constitutes one of the fundamental values of the Convention on the Rights of the Child, Recalling the view of the Committee on the Rights of the Child, expressed by its Chairperson in her oral report to the General Assembly at its sixty-third session, that the development of a communications procedure for the Convention on the Rights of the Child would significantly contribute to the overall protection of children’s rights, 1. Takes note of the report on its first session, held in Geneva from 16 to 18 December 2009, of the Open-ended Working Group established under Human Rights Council resolution 11/1 to explore the possibility of elaborating an optional protocol to the Convention on the Rights of the Child to provide a communications procedure complementary to the reporting procedure under the Convention (A/HRC/13/43); 2. Decides to extend the mandate of the Open-ended Working Group until the seventeenth session of the Council, and also decides that the Open-ended Working Group shall meet for up to 10 working days and report to the Council not later than at its seventeenth session; 3. Also decides to mandate the Open-ended Working Group to elaborate an optional protocol to the Convention on the Rights of the Child to provide a communications procedure and, in this regard, requests the Chairperson of the Open-ended Working Group to prepare a proposal for a optional protocol, taking into account the views expressed and inputs provided during the first session of the Working Group in December 2009 and giving due regard to the views of the Committee on the Rights of the Child and, where appropriate, to the views of relevant United Nations special procedures and other experts, to be circulated by September 2010 in all the official languages of the United Nations, so that the may be used as a basis for the forthcoming negotiations; 4. Further decides to invite a representative of the Committee on the Rights of the Child to attend the meetings of the Open-ended Working Group as a resource person and, where appropriate, relevant United Nations special procedures and other relevant independent experts; 5. Requests the Office of the United Nations High Commissioner for Human Rights to update and publish the report of the Secretary-General on the comparative summary of existing communications and inquiry procedures and practices under international human rights instruments and under the United Nations system, published on 22 November 2004 (E/CN.4/2005/WG.23/2), and to present that report to the Council at its fifteenth session; 6. Requests the Secretary-General and the Office of the High Commissioner to continue to provide the Open-ended Working Group with the assistance necessary for the fulfilment of its mandate, in accordance with General Assembly resolution 64/245 of 24 December 2009 on special subjects relating to the proposed programme budget for the biennium 2010-2011. GE. 10-12214",03/18/2010,2010_679236,Ukraine,* Non-Member State of the Human Rights Council.,yes
