year,Council,Committee,Session,Agenda item,Agenda detail,cosponsored countries,body title number,body title detail,body text,date,file,filecountry,footnote,scanned
2004,General Assembly,Third Committee,Fifty-ninth session,98,Advancement of women,"Australia, Austria, Azerbaijan, Belgium, Brazil, Canada, Colombia, Croatia, Cyprus, Czech Republic, Denmark, El Salvador, Estonia, Finland, Germany, Greece, Hungary, Ireland, Israel, Italy, Japan, Latvia, Luxembourg, Netherlands, Nigeria, Norway, Poland, Portugal, Romania, Slovakia, Slovenia, Spain, Sweden, Switzerland, the former Yugoslav Republic of Macedonia, Turkey, Uganda, United Kingdom of Great Britain and Northern Ireland, United Republic of Tanzania, Uruguay and Vanuatu",N/A,Working towards the elimination of crimes against women and girls committed in the name of honour,"The General Assembly, Reaffirming the obligation of all States to promote and protect human rights and fundamental freedoms, including the right to life, liberty and security of person, as stated in the Universal Declaration of Human Rights,! and reaffirming also the obligations of States parties under human rights instruments, in particular the International Covenant on Economic, Social and Cultural Rights, 2 the International Covenant on Civil and Political Rights,” the Convention on the Elimination of All Forms of Discrimination against Women? and the Convention on the Rights of the Child,* Reaffirming also the Vienna Declaration and Programme of Action> and the Declaration on the Elimination of Violence against Women,® as well as the goals and commitments contained in the Beijing Declaration and Platform for Action adopted at the Fourth World Conference on Women,” and the outcome document of 2 See resolution 2200 A (XXI), annex. 3 Resolution 34/180, annex. ¢ See resolution 48/104. 7 Report of the Fourth World Conference on Women, Beijing, 4-15 September 1995 (United Nations publication, Sales No. E.96.1V.13), chap. I, resolution 1, annexes I and II. 04-55912 (E) 191004 *0455912~* the special session of the General Assembly entitled “Women 2000: gender equality, development and peace for the twenty-first century”,8 Recalling its resolutions 57/179 of 18 December 2002 and 58/147 of 22 December 2003 as well as Commission on Human Rights resolution 2004/46 of 20 April 2004,° Recalling also its resolution 58/185 of 22 December 2003, in which it called for an in-depth study on violence against women, including crimes committed in the name of honour, as well as its resolution 57/190 of 18 December 2002, in which it called for an in-depth study on violence against children, Bearing in mind that States have an obligation to exercise due diligence to prevent, investigate and punish the perpetrators of crimes committed against women and girls in the name of honour and to provide protection to the victims, and that not doing so violates and impairs or nullifies the enjoyment of their human rights and fundamental freedoms, Stressing the need to treat all forms of violence against women and girls, including crimes committed in the name of honour, as a criminal offence, punishable by law, Stressing also the need to identify and effectively address the root causes of violence against women, in particular crimes committed in the name of honour, which take many different forms, Aware that inadequate data on violence against women, including crimes committed in the name of honour, hinder informed policy analysis, at both the domestic and the international levels, and efforts to eliminate such violence, Deeply concerned that women and girls continue to be victims of these crimes, as described in the relevant sections of the reports of the Human Rights Committee, the Committee on the Elimination of Discrimination against Women, the Committee on the Rights of the Child and the Committee on Economic, Social and Cultural Rights, and notes in this regard successive reports of the Special Rapporteur of the Commission on Human Rights on violence against women, its causes and consequences, 19 Emphasizing that such crimes are incompatible with all religious and cultural values, Emphasizing also that the elimination of crimes against women and girls committed in the name of honour requires greater efforts and commitment on the part of Governments and the international community, inter alia, through international cooperation efforts, and civil society, including non-governmental organizations, and that fundamental changes in societal attitude are required, Underlining the importance of the empowerment of women and their effective participation in decision-making and policy-making processes as one of the critical tools to prevent and eliminate crimes against women and girls committed in the name of honour, 9 See Official Records of the Economic and Social Council, 2004, Supplement No. 3 (E/2004/23), chap. I, sect. A. A/C.3/59/L.25 1. Welcomes: (a) The report of the Secretary-General on the elimination of violence against women;!! (b) The activities and initiatives of States aimed at the elimination of crimes against women committed in the name of honour, including the adoption of amendments to relevant national laws relating to such crimes, the effective implementation of such laws and educational, social and other measures, including national information and awareness-raising campaigns, as well as activities and initiatives of States aimed at the elimination of all other forms of violence against women; (¢) The efforts, such as projects, undertaken by United Nations bodies, funds and programmes, including the United Nations Population Fund, the United Nations Children’s Fund and the United Nations Development Fund for Women, to address the issue of crimes against women committed in the name of honour, and encourages them to coordinate their efforts; (d) The work carried out by civil society, including non-governmental organizations, such as women’s organizations, grass-roots movements and individuals, in raising awareness of such crimes and their harmful effects; 2. Expresses its concern that women continue to be victims of crimes committed in the name of honour, and at the continuing occurrence in all regions of the world of such violence, which takes many different forms, and at failures to prosecute and punish perpetrators; 3. Calls upon all States: (@) To fulfil their obligations under the relevant international human rights instruments and to implement the Beijing Declaration and Platform for Action’ and the outcome document of the special session of the General Assembly;® (b) To continue to intensify efforts to prevent and eliminate crimes against women and girls committed in the name of honour, which take many different forms, by using legislative, administrative and programmatic measures; (¢) To investigate promptly and thoroughly, prosecute effectively and document cases of crimes against women and girls committed in the name of honour and punish the perpetrators; (d) To intensify efforts to raise awareness of the need to prevent and eliminate crimes against women and girls committed and condoned in the name of honour, with the aim of changing the attitudes and behaviour that allow such crimes to be committed by involving, inter alia, community leaders; (e) To intensify efforts to raise awareness about the responsibility of men to promote gender equality and bring about change in attitudes to eliminate gender stereotypes, including, specifically, their role in preventing crimes against women and girls committed in the name of honour; (/) To encourage the efforts of the media to engage in awareness-raising campaigns; A/C.3/59/L.25 (g) To encourage, support and implement measures and programmes aimed at increasing the knowledge and understanding of the causes and consequences of crimes against women and girls committed in the name of honour, including the provision of training for those responsible for enforcing the law, such as police personnel and judicial and legal personnel, and to strengthen their capacity to respond to complaints of such crimes in an impartial and effective manner and take necessary measures to ensure the protection of actual and potential victims; (h) To continue to support the work of civil society, including non- governmental organizations, in addressing this issue and to strengthen cooperation with intergovernmental and non-governmental organizations; (i) To establish, strengthen or facilitate, where possible, support services to respond to the needs of actual and potential victims by, inter alia, providing for them the appropriate protection, safe shelter, counselling, legal aid, health-care services, including in the areas of sexual and reproductive health, psychological health and other relevant areas, rehabilitation and reintegration into society; (/) To address effectively complaints of crimes against women and girls committed in the name of honour, inter alia, by creating, strengthening or facilitating institutional mechanisms so that victims and others can report such crimes in a safe and confidential environment; (k) To gather and disseminate statistical information on the occurrence of such crimes, including information disaggregated by sex and age, and to make any such information available to the Secretariat for use in the in-depth report on violence against women, in accordance with resolution 58/185, and the in-depth report on violence against children, in accordance with resolution 57/190; (/) To include, where appropriate, in their reports to the human rights treaty bodies information on legal and policy measures adopted and implemented in their efforts to prevent and eliminate crimes against women and girls committed in the name of honour; 4. Invites: (a) The international community, including relevant United Nations bodies, funds and programmes, inter alia, through technical assistance and advisory services programmes, to support the efforts of all countries, at their request, aimed at strengthening institutional capacity for preventing crimes against women and girls committed in the name of honour and at addressing the root causes of such crimes; (b) The relevant human rights treaty bodies, where appropriate, and the Special Rapporteur on violence against women its causes and consequences to continue to address this issue; 5. Requests the Secretary-General to report on the implementation of the present resolution in his report on the question of violence against women to the General Assembly at its sixtieth session.",10/15/2004,2004_533605,Uruguay,N/A,yes
2004,General Assembly,N/A,Fifty-ninth session,56 (j),Cooperation between the United Nations and regional and other organizations: cooperation between the United Nations and the Inter-Parliamentary Union,"Albania, Algeria, Andorra, Argentina, Austria, Azerbaijan, Bangladesh, Belarus, Belgium, Benin, Bolivia, Bosnia and Herzegovina, Brazil, Bulgaria, Burkina Faso, Cambodia, Canada, Chile, China, Costa Rica, Croatia, Denmark, Ecuador, El Salvador, Finland, France, Gabon, Germany, Ghana, Greece, Guatemala, Guinea, Hungary, Iceland, Ireland, Italy, Japan, Jordan, Kazakhstan, Kenya, Kuwait, Kyrgyzstan, Latvia, Liechtenstein, Lithuania, Luxembourg, Madagascar, Mali, Malta, Mexico, Mongolia, Morocco, Namibia, New Zealand, Nigeria, Norway, Pakistan, Panama, Peru, Philippines, Poland, Portugal, Republic of Korea, Republic of Moldova, Romania, Russian Federation, San Marino, Serbia and Montenegro, Slovakia, Slovenia, Spain, Sri Lanka, Sweden, Switzerland, Thailand, Timor-Leste, Turkey, Uganda, Ukraine, United Kingdom of Great Britain and Northern Ireland, Uruguay, Viet Nam and Zambia: revised",N/A,Cooperation between the United Nations and the Inter-Parliamentary Union,"The General Assembly, Having considered the report of the Secretary-General of 1 September 2004, which takes stock of the broad cooperation between the United Nations and the Inter-Parliamentary Union over the past two years,! Taking note of the resolutions adopted by the Inter-Parliamentary Union and circulated in the General Assembly and the activities undertaken by the organization over the past two years in support of the United Nations, Welcoming the annual parliamentary hearings at the United Nations as a regular feature of the programme of events held at United Nations Headquarters on the occasion of the sessions of the General Assembly, 04-56532 (E) 211004 *0456532* Taking into consideration the cooperation agreement between the United Nations and the Inter-Parliamentary Union of 1996,2 which laid the foundation for cooperation between the two organizations, Recalling the United Nations Millennium Declaration,? in which heads of State and Government resolved to strengthen further cooperation between the United Nations and national parliaments through their world organization, the Inter- Parliamentary Union, in various fields, including peace and security, economic and social development, international law and human rights, and democracy and gender issues, Also recalling its resolution 57/32 of 19 November 2002, in which the Inter- Parliamentary Union was invited to participate in the work of the General Assembly in the capacity of observer, as well as resolution 57/47 of 21 November 2002, Taking note of the recommendations contained in the report of the panel of Eminent Persons on United Nations-Civil Society Relations# in regard to engaging parliamentarians more systematically in the work of the United Nations, 1. Welcomes the efforts made by the Inter-Parliamentary Union to provide for a greater parliamentary contribution and enhanced support to the United Nations; 2. Welcomes with satisfaction the decision to convene the second World Conference of Speakers of Parliaments at United Nations Headquarters in September 2005, as a joint meeting of the United Nations and the Inter- Parliamentary Union, in follow-up to the first such conference, held in New York in 2000 in conjunction with the Millennium Assembly of the United Nations; 3. Takes note of the efforts of the Inter-Parliamentary Union to consult parliaments on the recommendations made in the report of the Panel of Eminent Persons® relating to engaging parliamentarians more systematically in the work of the United Nations, and looks forward to learning of the outcome of this process as a contribution to the deliberations of the Assembly prior to taking a final decision on the recommendations of the Panel in regard to parliamentarians; 4. Encourages the United Nations and the Inter-Parliamentary Union to continue to cooperate closely in various fields, in particular peace and security, economic and social development, international law, human rights, and democracy and gender issues, bearing in mind the significant benefits of cooperation between the two organizations, to which the report of the Secretary-General' attests; 5. Decides to include in the provisional agenda of its sixty-first session the sub-item entitled “Cooperation between the United Nations and the Inter- Parliamentary Union”. 2 A/51/402, annex. 3 See resolution 55/20. 4 See A/58/817 and Corr.1.",10/21/2004,2004_533653,Uruguay,N/A,yes
2004,General Assembly,Sixth Committee,Fifty-ninth session,141,"Consideration of effective measures to enhance the protection, security and safety of diplomatic and consular missions and representatives","Argentina, Australia, Austria, Azerbaijan, Belgium, Bulgaria, Burkina Faso, Cambodia, Canada, Chile, Cote d’Ivoire, Croatia, Cuba, Cyprus, Czech Republic, Denmark, Dominican Republic, Ecuador, Estonia, Fiji, Finland, France, Germany, Greece, Hungary, Iceland, Ireland, Italy, Jordan, Latvia, Liechtenstein, Luxembourg, Madagascar, Mali, Malta, Marshall Islands, Netherlands, New Zealand, Nigeria, Norway, Peru, Poland, Portugal, Republic of Moldova, Romania, Russian Federation, Serbia and Montenegro, Sierra Leone, Slovakia, Slovenia, Spain, Sweden, Switzerland, Thailand, the former Yugoslav Republic of Macedonia, Trinidad and Tobago, Turkey, Ukraine, United Kingdom of Great Britain and Northern Ireland and Uruguay",N/A,"Consideration of effective measures to enhance the protection, security and safety of diplomatic and consular missions and representatives","The General Assembly, Having considered the report of the Secretary-General,! Conscious of the need to develop and strengthen friendly relations and cooperation among States, Convinced that respect for the principles and rules of international law governing diplomatic and consular relations is a basic prerequisite for the normal conduct of relations among States and for the fulfilment of the purposes and principles of the Charter of the United Nations, Alarmed by the recent acts of violence against diplomatic and consular representatives, as well as against representatives of international intergovernmental organizations and officials of such organizations, which have endangered or taken 04-56526 (E) 211004 *0456526* innocent lives and seriously impeded the normal work of such representatives and officials, Expressing sympathy for the victims of such illegal acts, Concerned at the failure to respect the inviolability of diplomatic and consular missions and representatives, Recalling that, without prejudice to their privileges and immunities, it is the duty of all persons enjoying such privileges and immunities to respect the laws and regulations of the receiving State, Recalling also that diplomatic and consular premises must not be used in any manner incompatible with the functions of diplomatic and consular missions, Emphasizing the duty of States to take all appropriate measures as required by international law, including measures of a preventive nature, and to bring offenders to justice, Welcoming measures already taken by States to this end in conformity with their international obligations, Convinced that the role of the United Nations, which includes the reporting procedures established under General Assembly resolution 35/168 of 15 December 1980 and further elaborated in subsequent Assembly resolutions, is important in promoting efforts to enhance the protection, security and safety of diplomatic and consular missions and representatives, 1. Takes note of the report of the Secretary-General;' 2. Strongly condemns acts of violence against diplomatic and consular missions and representatives, as well as against missions and representatives of international intergovernmental organizations and officials of such organizations, and emphasizes that such acts can never be justified; 3. Urges States to strictly observe, implement and enforce the principles and rules of international law governing diplomatic and consular relations and, in particular, to ensure, in conformity with their international obligations, the protection, security and safety of the missions, representatives and officials mentioned in paragraph 2 above officially present in territories under their jurisdiction, including practical measures to prohibit in their territories illegal activities of persons, groups and organizations that encourage, instigate, organize or engage in the perpetration of acts against the security and safety of such missions, representatives and officials; 4. Also urges States to take all necessary measures at the national and international levels to prevent any acts of violence against the missions, representatives and officials mentioned in paragraph 2 above, and to ensure, with the participation of the United Nations where appropriate, that such acts are fully investigated with a view to bringing offenders to justice; 5. Recommends that States cooperate closely through, inter alia, contacts between the diplomatic and consular missions and the receiving State with regard to practical measures designed to enhance the protection, security and safety of diplomatic and consular missions and representatives and with regard to the exchange of information on the circumstances of all serious violations thereof; A/C.6/59/L.14 6. Urges States to take all appropriate measures, in accordance with international law, at the national and international levels, to prevent any abuse of diplomatic or consular privileges and immunities, in particular serious abuses, including those involving acts of violence; 7. Recommends that States cooperate closely with the State in whose territory abuses of diplomatic and consular privileges and immunities may have occurred, including by exchanging information and providing assistance to its juridical authorities in order to bring offenders to justice; 8. Calls upon States that have not yet done so to consider becoming parties to the instruments relevant to the protection, security and safety of diplomatic and consular missions and representatives; 9. Calls upon States, in cases where a dispute arises in connection with a violation of their international obligations concerning the protection of the missions or the security of the representatives and officials mentioned in paragraph 2 above, to make use of the means available for peaceful settlement of disputes, including the good offices of the Secretary-General, and requests the Secretary-General, when he deems it appropriate, to offer his good offices to the States directly concerned; 10. Requests: (a) All States to report to the Secretary-General as promptly as possible serious violations of the protection, security and safety of diplomatic and consular missions and representatives as well as missions and representatives with diplomatic status to international intergovernmental organizations; (b) The State in which the violation took place — and, to the extent possible, the State where the alleged offender is present — to report to the Secretary-General as promptly as possible on measures taken to bring the offender to justice and eventually to communicate, in accordance with its laws, the final outcome of the proceedings against the offender, and to report on measures adopted with a view to preventing a repetition of such violations; (c) The States so reporting to consider using or taking into account the guidelines prepared by the Secretary-General;? 11. Requests the Secretary-General: (a) To send, without delay, a circular note to all States reminding them of the request contained in paragraph 10 above; (b) To circulate to all States, upon receipt, the reports received by him pursuant to paragraph 10 above, unless the reporting State requests otherwise; (c) To draw the attention, when appropriate, of the States directly concerned to the reporting procedures provided for in paragraph 10 above, when a serious violation has been reported pursuant to subparagraph 10 (a) above; (d) To address reminders to States where such violations have occurred if reports pursuant to subparagraph 10 (a) above or follow-up reports pursuant to subparagraph 10 (b) above have not been made within a reasonable period of time; A/C.6/59/L.14 12. Also requests the Secretary-General to invite States, in the circular note referred to in subparagraph 11 (a) above, to inform him of their views with respect to any measures needed or already undertaken to enhance the protection, security and safety of diplomatic and consular missions and representatives as well as missions and representatives with diplomatic status to international intergovernmental organizations; 13. Further requests the Secretary-General to submit to the General Assembly at its sixty-first session a report containing: (a) Information on the state of ratification of, and accessions to, the instruments referred to in paragraph 8 above; (b) A summary of the reports received and views expressed pursuant to paragraphs 10 and 12 above; 14. Invites the Secretary-General to include in his report to the General Assembly any views he may wish to express on the matters referred to in paragraph 13 above; 15. Decides to include in the provisional agenda of its sixty-first session the item entitled “Consideration of effective measures to enhance the protection, security and safety of diplomatic and consular missions and representatives”.",10/21/2004,2004_533777,Uruguay,N/A,yes
