year,Council,Committee,Session,Agenda item,Agenda detail,cosponsored countries,body title number,body title detail,body text,date,file,filecountry,footnote,scanned
2004,General Assembly,N/A,fifty-ninth session,N/A,N/A,N/A,input,is,n o n e,04/05/2004,2004_518820,Uruguay,N/A,yes
2004,Economic And Social Council,Commission On Human Rights,Sixtieth session,11,CIVIL AND POLITICAL RIGHTS,"Argentina, Brazil, Chile, China, Colombia*, Costa Rica, Cuba, El Salvador¥, Guatemala, India, Romania*, Turkey*, Uruguay*",2004,The incompatibility between democracy and racism,"The Commission on Human Rights, Guided by the Universal Declaration of Human Rights, the Charter of the United Nations, the International Covenants on Human Rights and the International Convention on the Elimination of All Forms of Racial Discrimination, Recalling the commitment reached in the Vienna Declaration and Programme of Action adopted in June 1993 by the World Conference on Human Rights concerning the elimination of racism, racial discrimination, xenophobia and related intolerance, Recalling also its resolutions 2000/40 of 20 April 2000, 2001/43 of 23 April 2001, 2002/39 of 23 April 2002 and 2003/41 of 23 April 2003, Recalling the Durban Declaration and Programme of Action, adopted in September 2001 by the World Conference against Racism, Racial Discrimination, Xenophobia and Related Intolerance, Mindful of the responsibility of Governments to ensure such equality as is established in the relevant international and regional human rights instruments, inter alia, the Universal Declaration of Human Rights, the International Covenants on Human Rights and the International Convention on the Elimination of All Forms of Racial Discrimination, Reaffirming that acts of racial violence and discrimination do not constitute legitimate expressions of opinion, but rather are offences, Remaining alarmed by the rise of racism, racial discrimination, xenophobia and related intolerance in political circles, in the sphere of public opinion and in society at large, Recognizing the fundamental role of education and other active policies in the promotion of tolerance and respect for others and in the construction of pluralistic and inclusive societies, 1. Condemns political platforms and organizations based on racism, xenophobia or doctrines of racial superiority and related discrimination, as well as legislation and practices based on racism, xenophobia and related intolerance as incompatible with democracy and transparent and accountable governance; 2. Reaffirms that racism, racial discrimination, xenophobia and related intolerance condoned by governmental policies violate human rights and may endanger friendly relations among peoples, cooperation among nations, international peace and security and the harmony of persons living side by side within one and the same State; 3. Also reaffirms that any form of impunity condoned by public authorities for crimes motivated by racist and xenophobic attitudes plays a role in weakening the rule of law and democracy and tends to encourage the recurrence of such acts; 4. Condemns the persistence and resurgence of neo-Nazism, neo-fascism and violent nationalist ideologies based on racial or national prejudice, and states that these phenomena can never be justified in any instance or in any circumstances; 5. Recognizes with deep concern the increase in anti-Semitism, and Christianophobia and Islamophobia in various parts of the world, as well as the emergence of racial and violent movements based on racism and discriminatory ideas against Arab, Christian, Jewish and Muslim communities, as well as communities of people of African descent and communities of people of Asian descent, and other communities; 6. Emphasizes that the elimination of all forms of discrimination, especially gender, ethnic and racial discrimination, as well as diverse forms of intolerance, the promotion and protection of human rights of persons of indigenous origin and members of indigenous communities and migrants, and respect for ethnic, cultural and religious diversity contribute to strengthening and promoting democracy and political participation; 7. Urges States to reinforce their commitment to promote tolerance and human rights and to fight against racism, racial discrimination, xenophobia and related intolerance as a way to strengthen democracy, the rule of law and transparent and accountable governance, and in that regard recommends measures such as introducing or reinforcing human rights education in schools and in institutions of higher education; 8. Also urges States to ensure that their political and legal systems reflect the multicultural diversity within their societies through promoting diversity, to improving democratic institutions, making them more fully participatory and inclusive and avoiding marginalization and exclusion of, and discrimination against, specific sectors of society; 9. Underlines the key role that political leaders and political parties can and ought to play in strengthening democracy by combating racism, racial discrimination, xenophobia and related intolerance, and encourages political parties to take concrete steps to promote solidarity, tolerance and respect, inter alia by developing voluntary codes of conduct which include internal disciplinary measures for violations thereof, so their members refrain from public statements and actions that encourage or incite racism, racial discrimination and related intolerance; 10. Invites the Inter-Parliamentary Union and other relevant inter-parliamentary organizations to encourage debate in, and action by, the concerned parliaments on various measures, including laws and policies, to combat racism, racial discrimination, xenophobia and related intolerance; 10. 11. Invites the mechanisms of the Commission and the United Nations treaty bodies to continue to pay particular attention to violations of human rights stemming from the rise of racism and xenophobia in political circles and society at large, especially as regards their incompatibility with democracy; 11. 12. Takes note of the report of the United Nations High Commissioner for Human Rights on the interdependence between democracy and human rights (E/CN.4/2004/54); 12. 13. Takes note of the study on the issue of political platforms which promote or incite racial discrimination prepared by the Special Rapporteur on contemporary forms of racism, racial discrimination, xenophobia and related intolerance (E/CN.4/2004/61) as requested in Commission resolution 2003/41 of 23 April 2003; 13. 14. Recommends the creation, where they do not exist, of monitoring, reporting, documentation and information-processing institutions and procedures in order to contribute to preventing and reducing racial, ethnic or religions tensions; 14. 15. Encourages States to consider developing public information, awareness-raising and education campaigns with a transdisciplinary approach with a view to combating racial 15. prejudice; 16. Encourages political leaders, civil society and the media to remain vigilant against the penetration of racist and xenophobic ideas in the political platforms of democratic parties; 16. 17. Invites the Office of the United Nations High Commissioner for Human Rights, in collaboration with the Special Rapporteur on contemporary forms of racism, racial discrimination, xenophobia and related intolerance, to continue appropriate efforts to analyse further the issue of incitement and promotion of racism, racial discrimination, xenophobia and related intolerance in the political debate; 17. Decides to continue consideration of the matter at its sixty-first session under the 18. — same agenda item.",04/14/2004,2004_519576,Uruguay,"* In accordance with rule 69, paragraph 3, of the rules of procedure of the functional commissions of the Economic and Social Council.",yes
2004,Economic And Social Council,Commission On Human Rights,Sixtieth session,11 (d),"CIVIL AND POLITICAL RIGHTS: INDEPENDENCE OF THE JUDICIARY, ADMINISTRATION OF JUSTICE, IMPUNITY","Argentina, Armenia, Australia, Austria, Belgium*, Bulgaria*, Canada*, Croatia, Cyprus*, Czech Republic*, Estonia*, Finland*, France, Germany, Greece*, Guatemala, Honduras, Hungary, Iceland*, Ireland, Italy, Latvia*, Lithuania*, Luxembourg*, Malta*, Mexico, Netherlands, Paraguay, Poland*, Republic of Korea, Romania*, Serbia and Montenegro*, Slovakia*, Slovenia*, Spain*, Sweden, Switzerland*, Turkey*, United Kingdom of Great Britain and Northern Ireland, Uruguay*",2004,"Independence and impartiality of the judiciary, jurors and assessors and the independence of lawyers","The Commission on Human Rights, Guided by articles 7, 8, 10 and 11 of the Universal Declaration of Human Rights and articles 2, 14 and 26 of the International Covenant on Civil and Political Rights, and bearing in mind the Vienna Declaration and Programme of Action, in particular Part I, paragraph 27, and Part I, paragraphs 88, 90 and 95, thereof, Convinced that an independent and impartial judiciary and an independent legal profession are essential prerequisites for the protection of human rights and for ensuring that there is no discrimination in the administration of justice, Recalling its resolution 1994/41 of 4 March 1994, in which it requested the Chairman of the Commission to appoint, for a period of three years, a special rapporteur on the independence and impartiality of the judiciary, jurors and assessors and the independence of lawyers, and its resolution 2003/43 of 23 April 2003, in which it decided to extend the mandate of the Special Rapporteur for a further period of three years, Recalling also its resolution 1995/36 of 3 March 1995, in which it endorsed the decision of the Special Rapporteur to use, beginning in 1995, the short title “Special Rapporteur on the independence of judges and lawyers”, Recalling further General Assembly resolution 40/32 of 29 November 1985, as well as Assembly resolution 40/146 of 13 December 1985, in which the Assembly endorsed the Basic Principles on the Independence of the Judiciary, adopted by the Seventh United Nations Congress on the Prevention of Crime and the Treatment of Offenders, Recalling General Assembly resolution 45/166 of 18 December 1990, in which the Assembly welcomed the Basic Principles on the Role of Lawyers and the Guidelines on the Role of Prosecutors, adopted by the Eighth United Nations Congress on the Prevention of Crime and the Treatment of Offenders, and invited Governments to respect them and to take them into account within the framework of their national legislation and practice, Noting the Bangalore Principles of Judicial Conduct (E/CN.4/2003/65, annex) adopted at the Round Table Meeting of Chief Justices held in The Hague on 25 and 26 November 2002 and bringing those principles to the attention of Member States, relevant United Nations organs and intergovernmental and non-governmental organizations for their consideration, Recalling the recommendations adopted by the Ninth United Nations Congress on the Prevention of Crime and the Treatment of Offenders regarding, among other things, the invitation addressed to Member States to ensure the independence and impartiality of the judiciary and the proper functioning of prosecutorial and legal services in the field of penal justice and police affairs, taking into account the Basic Principles on the Independence of the Judiciary, Recalling also the Statement of Principles on the Independence of the Judiciary adopted in Beijing in August 1995 by the Sixth Conference of Chief Justices of Asia and the Pacific, and the Cairo Declaration, adopted in November 1995 by the Third Conference of Francophone Ministers of Justice, Acknowledging the importance for the Special Rapporteur of being able to cooperate closely, in the framework of his mandate, with the Office of the United Nations High Commissioner for Human Rights in the field of advisory services and technical cooperation, which could contribute to guaranteeing the independence of judges and lawyers, Recognizing the importance of the role of non-governmental organizations, bar associations and professional associations of judges in the defence of the principles of the independence of lawyers and judges, Noting with concern the increasingly frequent attacks on their independence suffered by judges, lawyers and court officers, and aware of the close link between the weakening of safeguards for judges, lawyers and court officers and the frequency and gravity of violations of human rights, 1. Takes note of the report of the Special Rapporteur on the independence of judges and lawyers on the activities relating to his mandate (E/CN.4/2004/60 and Add.1); 2. Notes the Special Rapporteur’s concern that the situation of the independence of judges and lawyers, which is the bedrock of the rule of law, remains delicate in many parts of the world; 3. Also notes the cooperative working methods that the Special Rapporteur has adopted to draw up his report and implement his mandate, as described in Commission resolution 1994/41 of 4 March 1994; 4. Welcomes the numerous exchanges the Special Rapporteur has had with several intergovernmental and international organizations and United Nations bodies, and encourages him to continue along this path; 5. Notes with appreciation the determination of the Special Rapporteur to achieve as wide dissemination as possible of information about existing standards relating to the independence and impartiality of the judiciary and the independence of the legal profession in conjunction with the publications and promotional activities of the Office of the United Nations High Commissioner for Human Rights; 6. Invites the United Nations High Commissioner for Human Rights to continue to provide technical assistance to train judges and lawyers; 7. Calls upon all Governments to respect and uphold the independence of judges and lawyers and, to that end, to take effective legislative, law enforcement and other appropriate measures that will enable them to carry out their professional duties without harassment or intimidation of any kind; 8. Welcomes the publication of Human Rights in the Administration of Justice: A Manual on Human Rights for Judges, Prosecutors and Lawyers in the context of the United Nations Decade for Human Rights Education; 9. Urges all Governments to assist the Special Rapporteur in the discharge of his mandate and to transmit to him all the information requested; 10. Encourages Governments that face difficulties in guaranteeing the independence of judges and lawyers, or that are determined to take measures to implement these principles further, to consult and to consider the services of the Special Rapporteur, for instance by inviting him to their country if the Government concerned deems it necessary; 10. 11. Requests the Special Rapporteur to submit a report on the activities relating to his mandate to the Commission at its sixty-first session and decides to consider the question at that 11. session, under the same agenda item; 12. Requests the Secretary-General, within the limits of the United Nations regular budget, to provide the Special Rapporteur with any assistance needed for the discharge of his mandate. 12.",04/14/2004,2004_519583,Uruguay,"* In accordance with rule 69, paragraph 3, of the rules of procedure of the functional commissions of the Economic and Social Council.",yes
