year,Council,Committee,Session,Agenda item,Agenda detail,cosponsored countries,body title number,body title detail,body text,date,file,filecountry,footnote,scanned
2004,General Assembly,Special Political And Decolonization Committee,Fifty-ninth session,75,United Nations Relief and Works Agency for Palestine Refugees in the Near East,"Algeria, Bahrain, Brunei Darussalam, Comoros, Djibouti, Egypt, Guinea, Indonesia, Iraq, Jordan, Kuwait, Malaysia, Morocco, Oman, Qatar, Saudi Arabia, Somalia, Sudan, Tunisia, United Arab Emirates, Yemen and Palestine",N/A,Palestine refugees’ properties and their revenues,"The General Assembly, Recalling its resolutions 194 (III) of 11 December 1948, 36/146 C of 16 December 1981 and all its subsequent resolutions on the question, Taking note of the report of the Secretary-General submitted in pursuance of its resolution 58/94 of 9 December 2003,! Taking note also of the report of the United Nations Conciliation Commission for Palestine for the period from 1 September 2003 to 31 August 2004,2 Recalling that the Universal Declaration of Human Rights3 and the principles of international law uphold the principle that no one shall be arbitrarily deprived of his or her property, Recalling in particular its resolution 394 (V) of 14 December 1950, in which it directed the Conciliation Commission, in consultation with the parties concerned, to prescribe measures for the protection of the rights, property and interests of the Palestine refugees, Noting the completion of the programme of identification and evaluation of Arab property, as announced by the Conciliation Commission in its twenty-second 1 A/59/279. 2 A/59/260, annex. 3 Resolution 217 A (I1I). 04-59844 (E) 101104 *0459844-~ progress report,* and the fact that the Land Office had a schedule of Arab owners and file of documents defining the location, area and other particulars of Arab property, Expressing its appreciation for the work done to preserve and modernize the existing records, including the land records, of the Conciliation Commission and the importance of such records for a just resolution of the plight of the Palestine refugees in conformity with resolution 194 (I1I), Recalling that, in the framework of the Middle East peace process, the Palestine Liberation Organization and the Government of Israel agreed, in the Declaration of Principles on Interim Self-Government Arrangements of 13 September 1993,> to commence negotiations on permanent status issues, including the important issue of the refugees, 1. Reaffirms that the Palestine refugees are entitled to their property and to the income derived therefrom, in conformity with the principles of equity and justice; 2. Requests the Secretary-General to take all appropriate steps, in consultation with the United Nations Conciliation Commission for Palestine, for the protection of Arab property, assets and property rights in Israel; 3. Calls once again upon Israel to render all facilities and assistance to the Secretary-General in the implementation of the present resolution; 4. Calls upon all the parties concerned to provide the Secretary-General with any pertinent information in their possession concerning Arab property, assets and property rights in Israel that would assist him in the implementation of the present resolution; 5. Urges the Palestinian and Israeli sides, as agreed between them, to deal with the important issue of Palestine refugees’ properties and their revenues in the framework of the final status negotiations of the Middle East peace process; 6. Requests the Secretary-General to report to the General Assembly at its sixtieth session on the implementation of the present resolution. 4 Official Records of the General Assembly, Nineteenth Session, Annexes, Annex No. 11, document A/5700. 5 A/48/486-S/26560, annex.",11/09/2004,2004_534724,Yemen,N/A,yes
2004,General Assembly,Special Political And Decolonization Committee,Fifty-ninth session,76,Report of the Special Committee to Investigate Israeli Practices Affecting the Human Rights of the Palestinian People,"Algeria, Bahrain, Brunei Darussalam, Comoros, Cuba, Djibouti, Egypt, Guinea, Indonesia, Iraq, Jordan, Kuwait, Malaysia, Morocco, Oman, Qatar, Saudi Arabia, Somalia, Sudan, Tunisia, United Arab Emirates, Yemen and Palestine",N/A,"Israeli settlements in the Occupied Palestinian Territory, including East Jerusalem, and the occupied Syrian Golan","The General Assembly, Guided by the principles of the Charter of the United Nations, and affirming the inadmissibility of the acquisition of territory by force, Recalling its relevant resolutions, including resolution 58/292 of 6 May 2004, as well as those resolutions adopted at its tenth emergency special session, including resolution ES-10/15 of 20 July 2004, Recalling also relevant Security Council resolutions, including resolutions 242 (1967) of 22 November 1967, 446 (1979) of 22 March 1979, 465 (1980) of 1 March 1980, 476 (1980) of 30 June 1980, 478 (1980) of 20 August 1980, 497 (1981) of 17 December 1981 and 904 (1994) of 18 March 1994, Reaffirming the applicability of the Geneva Convention relative to the Protection of Civilian Persons in Time of War, of 12 August 1949,! to the Occupied Palestinian Territory, including East Jerusalem, and to the occupied Syrian Golan, Considering that the transfer by the occupying Power of parts of its own civilian population into the territory it occupies is a violation of the Fourth Geneva Convention' and constitutes a grave breach under Additional Protocol I to the 04-59869 (E) 101104 *0459869* Geneva Conventions? and under the Rome Statute of the International Criminal Court,3 Taking into account the advisory opinion rendered on 9 July 2004 by the International Court of Justice on the Legal Consequences of the Construction of a Wall in the Occupied Palestinian Territory,* Underscoring the conclusion of the Court in its advisory opinion that “the Israeli settlements in the Occupied Palestinian Territory (including East Jerusalem) have been established in breach of international law”,5 Taking note of the recent report of the Special Rapporteur of the Commission on Human Rights on the situation of human rights in the Palestinian territories occupied by Israel since 1967,¢ Recalling the Declaration of Principles on Interim Self-Government Arrangements of 13 September 19937 and the subsequent implementation agreements between the Palestinian and Israeli sides, Recalling also the Quartet road map to a permanent two-State solution to the Israeli-Palestinian conflict,® and noting specifically its call for a freeze on all settlement activity, Aware that Israeli settlement activities in colonization of the land have involved, inter alia, the transfer of nationals of the occupying Power into the occupied territories, the confiscation of land, the exploitation of natural resources and other illegal actions against the Palestinian civilian population, Bearing in mind the detrimental impact of Israeli settlement policies, decisions and activities on efforts to achieve peace in the Middle East, Expressing grave concern about the continuation by Israel, the occupying Power, of settlement activities, in violation of international humanitarian law, relevant United Nations resolutions and the agreements reached between the parties, including the construction and expansion of the settlements in Jabal Abu-Ghneim and Ras Al-Amud in and around Occupied East Jerusalem, Expressing grave concern also about the continuing unlawful construction by Israel of the wall inside the Occupied Palestinian Territory, including in and around East Jerusalem, and expressing its concern in particular about the route of the wall in departure from the Armistice Line of 1949, which could prejudge future negotiations and make the two-State solution physically impossible to implement and which is causing the Palestinian people further humanitarian hardship, Deeply concerned by the finding of the International Court of Justice in its advisory opinion of 9 July 2004 that “the wall’s sinuous route has been traced in 3 See Official Records of the United Nations Diplomatic Conference of Plenipotentiaries on the Establishment of an International Criminal Court, Rome, 15 June-17 July 1998, vol. 1: Final documents (United Nations publication, Sales No. E.02.1.5), sect. A. A/C.4/59/L.16 such a way as to include within that area [the ‘Closed Area’] the great majority of the Israeli settlements in the occupied Palestinian Territory”,® Reiterating its opposition to settlement activities in the Occupied Palestinian Territory, including East Jerusalem, and to any activities involving the confiscation and colonization of land, the disruption of the livelihood of protected persons and the de facto annexation of land, Recalling the need to end all acts of violence, including acts of terror, provocation, incitement and destruction, Gravely concerned about the dangerous situation resulting from actions taken by the illegal armed Israeli settlers in the occupied territory, Taking note of the relevant reports of the Secretary-General,1© 1. Reaffirms that Israeli settlements in the Palestinian territory, including East Jerusalem, and in the occupied Syrian Golan are illegal and an obstacle to peace and economic and social development; 2. Calls upon lIsrael to accept the de jure applicability of the Geneva Convention relative to the Protection of Civilian Persons in Time of War, of 12 August 1949, to the Occupied Palestinian Territory, including East Jerusalem, and to the occupied Syrian Golan and to abide scrupulously by the provisions of the Convention, in particular article 49; 3. Reiterates its demand for the complete cessation of all Israeli settlement activities in the Occupied Palestinian Territory, including East Jerusalem, and in the occupied Syrian Golan, and calls for the full implementation of the relevant Security Council resolutions; 4. Reiterates its demand that Israel comply with its legal obligations under international law, as mentioned in the advisory opinion rendered on 9 July 2004 by the International Court of Justice* and as demanded by the General Assembly in its resolution ES-10/15; 5. Stresses the need for full implementation of Security Council resolution 904 (1994), in which, among other things, the Council called upon Israel, the occupying Power, to continue to take and implement measures, including confiscation of arms, with the aim of preventing illegal acts of violence by Israeli settlers, and called for measures to be taken to guarantee the safety and protection of the Palestinian civilians in the occupied territory; 6. Reiterates its calls for the prevention of all acts of violence by Israeli settlers, especially against Palestinian civilians and property, particularly in the light of recent developments; 7. Requests the Secretary-General to report to the General Assembly at its sixtieth session on the implementation of the present resolution. 9 A/ES-10/273 and Corr.1, para. 119. 10 A/59/338, A/59/339, A/59/343, A/59/344, A/59/345 and A/59/381.",11/09/2004,2004_534725,Yemen,N/A,yes
2004,General Assembly,Third Committee,Fifty-ninth session,104,Right of peoples to self-determination,"Algeria, Bahrain, Bangladesh, Belize, Brunei Darussalam, China, Comoros, Cuba, Democratic Republic of the Congo, Djibouti, Egypt, Eritrea, Guinea, Indonesia, Iraq, Jordan, Kuwait, Lao People’s Democratic Republic, Lebanon, Libyan Arab Jamahiriya, Malaysia, Mali, Malta, Mauritania, Morocco, Namibia, Oman, Pakistan, Qatar, Saint Lucia, Saudi Arabia, Senegal, Somalia, South Africa, Sudan, Timor-Leste, Tunisia, United Arab Emirates, Viet Nam, Yemen and Palestine:!",N/A,The right of the Palestinian people to self-determination,"The General Assembly, Aware that the development of friendly relations among nations, based on respect for the principle of equal rights and self-determination of peoples, is among the purposes and principles of the United Nations, as defined in the Charter, Recalling in this regard its resolution 2625 (XXV) of 24 October 1970, entitled “Declaration on Principles of International Law concerning Friendly Relations and Cooperation among States in accordance with the Charter of the United Nations”, Bearing in mind the International Covenants on Human Rights,2 the Universal Declaration of Human Rights,3 the Declaration on the Granting of Independence to Colonial Countries and Peoples* and the Vienna Declaration and Programme of Action adopted at the World Conference on Human Rights on 25 June 1993,5 Recalling the Declaration on the Occasion of the Fiftieth Anniversary of the United Nations,® ! In accordance with General Assembly resolution 52/250. 2 Resolution 2200 A (XXI), annex. 04-60156 (E) 111104 *0460156°* Recalling also the United Nations Millennium Declaration,” Taking into account the Advisory Opinion of the International Court of Justice on the Legal Consequences of the Construction of a Wall in the Occupied Palestinian Territory, issued on 9 July 2004, and noting in particular the determination of the Court that the “right of peoples to self-determination is today a right erga omnes”, Concerned by the fact that, as concluded by the Court in its Advisory Opinion, the construction of the wall by Israel, the occupying Power, in the Occupied Palestinian Territory, including East Jerusalem, along with measures previously taken, severely impedes the right of the Palestinian people to self-determination, Expressing the urgent need for the resumption of negotiations within the Middle East peace process on its agreed basis and for the speedy achievement of a final settlement between the Palestinian and Israeli sides, Recalling its resolution 58/292 of 6 May 2004, Affirming the right of all States in the region to live in peace within secure and internationally recognized borders, 1. Reaffirms the right of the Palestinian people to self-determination, including the right to their independent State of Palestine; 2. Urges all States and the specialized agencies and organizations of the United Nations system to continue to support and assist the Palestinian people in the early realization of their right to self-determination. 7 See resolution 55/2.",11/10/2004,2004_534778,Yemen,N/A,yes
2004,General Assembly,Special Political And Decolonization Committee,Fifty-ninth session,75,United Nations Relief and Works Agency for,"Algeria, Bahrain, Brunei Darussalam, Comoros, Djibouti, Egypt, Guinea, Indonesia, Iraq, Jordan, Kuwait, Malaysia, Morocco, Oman, Qatar, Saudi Arabia, Somalia, Sudan, Tunisia, United Arab Emirates, Yemen and Palestine",N/A,Operations of the United Nations Relief and Works Agency for Palestine Refugees in the Near East,"The General Assembly, Recalling its resolutions 194 (III) of 11 December 1948, 212 (III) of 19 November 1948, 302 (IV) of 8 December 1949 and all subsequent related resolutions, including resolution 58/93 of 9 December 2003, Recalling also relevant Security Council resolutions, Having considered the report of the Commissioner-General of the United Nations Relief and Works Agency for Palestine Refugees in the Near East covering the period from 1 July 2003 to 30 June 2004,! Taking note of the letter dated 30 September 2004 from the Chairperson of the Advisory Commission of the United Nations Relief and Works Agency for Palestine Refugees in the Near East addressed to the Commissioner-General,2 Deeply concerned about the continuing critical financial situation of the Agency and its effect on the continuing provision of necessary Agency services to the Palestine refugees, including its emergency-related and development programmes, U Official Records of the General Assembly, Fifty-ninth Session, Supplement No. 13 (A/59/13). 2 Ibid., p. viii. 04-59850 (E) 101104 *0459850~* Recalling Articles 100, 104 and 105 of the Charter of the United Nations and the Convention on the Privileges and Immunities of the United Nations,3 Recalling also the Convention on the Safety of United Nations and Associated Personnel, 4 Affirming the applicability of the Geneva Convention relative to the Protection of Civilian Persons in Time of War, of 12 August 1949,5 to the Palestinian territory occupied since 1967, including East Jerusalem, Aware of the continuing needs of the Palestine refugees throughout the Occupied Palestinian Territory and in the other fields of operation, namely in Jordan, Lebanon and the Syrian Arab Republic, Gravely concerned about the increased suffering of the Palestine refugees, including that resulting from loss of life, injury and extensive destruction and damage to their shelters and properties, during the ongoing crisis in the Occupied Palestinian Territory, including East Jerusalem, Expressing grave concern about the grave impact of the events that occurred in the Jenin refugee camp in April 2002, the Rafah refugee camp in May 2004 and the Jabaliya refugee camp in October 2004, including the loss of life, injury, destruction and displacement inflicted on many of the civilian inhabitants, Aware of the extraordinary efforts being undertaken by the Agency for the repair or rebuilding of thousands of destroyed and damaged refugee shelters, Aware also of the valuable work done by the refugee affairs officers of the Agency in providing protection to the Palestinian people, in particular Palestine refugees, Gravely concerned about the endangerment of the safety of the Agency’s staff and about the damage caused to its facilities as a result of Israeli military operations during the reporting period, Deploring the killing of twelve Agency staff members by the Israeli occupying forces since September 2000, Deploring also the killing and wounding of children in the Agency’s schools by the Israeli occupying forces, Expressing deep concern about the continuing policies of closure and severe restrictions, including the curfews, that have been imposed on the movement of persons and goods throughout the Occupied Palestinian Territory, including East Jerusalem, and which have had a grave impact on the socio-economic situation of the Palestine refugees and have greatly contributed to the dire humanitarian crisis facing the Palestinian people, Deeply concerned about the continuing imposition of restrictions on the freedom of movement of the Agency’s staff, vehicles and goods, the continuing harassment and intimidation of its staff and the false accusations levelled against the Agency, which undermine and obstruct its work, including its ability to provide its essential services, notably its education, health and relief and social services, 3 Resolution 22 A (I). 4 Resolution 49/59, annex. A/C.4/59/L.12 Recalling the signing, on 13 September 1993, of the Declaration of Principles on Interim Self-Government Arrangements by the Government of Israel and the Palestine Liberation Organization® and the subsequent implementation agreements, Aware of the agreement between the Agency and the Government of Israel, Taking note of the agreement reached on 24 June 1994, embodied in an exchange of letters between the Agency and the Palestine Liberation Organization,? 1. Expresses its appreciation to the Commissioner-General of the United Nations Relief and Works Agency for Palestine Refugees in the Near East, as well as to all of the staff of the Agency, for their tireless efforts and valuable work, particularly in light of the increasingly difficult conditions during the past year; 2. Also expresses its appreciation to the Advisory Commission of the Agency, and requests it to continue its efforts and to keep the General Assembly informed of its activities, including the full implementation of decision 48/417; 3. Takes note with appreciation of the report of the Working Group on the Financing of the United Nations Relief and Works Agency for Palestine Refugees in the Near East® and its efforts to assist in ensuring the financial security of the Agency, and requests the Secretary-General to provide the necessary services and assistance to the Working Group for the conduct of its work; 4. Commends the continuing efforts of the Commissioner-General to increase the budgetary transparency and efficiency of the Agency, as reflected in the Agency’s programme budget for the biennium 2004-2005;° 5. Acknowledges the support provided by the host Governments to the Agency in the discharge of its duties; 6. Welcomes the convening, on 7 and 8 June 2004, of the Geneva conference by the Agency and the Swiss Agency for Development and Cooperation to increase support for the Agency; 7. Expresses concern about the temporary relocation of the headquarters international staff of the Agency from Gaza City and the disruption of operations at the headquarters; 8. Calls upon Israel, the occupying Power, to comply fully with the provisions of the Geneva Convention relative to the Protection of Civilian Persons in Time of War, of 12 August 1949;° 9. Also calls upon Israel to abide by Articles 100, 104 and 105 of the Charter of the United Nations, the Convention on the Privileges and Immunities of the United Nations® and the Convention on the Safety of United Nations and Associated Personnel® in order to ensure the safety of the personnel of the Agency, the protection of its institutions and the safeguarding of the security of its facilities in the Occupied Palestinian Territory, including East Jerusalem; 7 Official Records of the General Assembly, Forty-ninth Session, Supplement No. 13 (A/49/13), annex [. 8 A/59/442. 9 Official Records of the General Assembly, Fifty-eighth Session, Supplement No. 13, addendum (A/58/13/Add.1). A/C.4/59/L.12 10. Calls upon the Government of Israel speedily to compensate the Agency for damage to its property and facilities resulting from actions by the Israeli side, particularly during the reporting period; 11. Calls upon Israel particularly to cease obstructing the movement of the staff, vehicles and supplies of the Agency and to cease the levying of extra fees and charges, which affect detrimentally the Agency’s operations; 12. Requests the Commissioner-General to proceed with the issuance of identification cards for Palestine refugees and their descendants in the Occupied Palestinian Territory; 13. Affirms that the functioning of the Agency remains essential in all fields of operation; 14. Notes the success of the Agency’s microfinance and microenterprise programmes, and calls upon the Agency, in close cooperation with the relevant agencies, to continue to contribute to the development of the economic and social stability of the Palestine refugees in all fields of operation; 15. Reiterates its request to the Commissioner-General to proceed with the modernization of the archives of the Agency through the Palestine Refugee Records Project, and to indicate the progress made in this regard in his report to the General Assembly at its sixtieth session; 16. Reiterates its previous appeals to all States, specialized agencies and non-governmental organizations to continue and to augment the special allocations for grants and scholarships for higher education to Palestine refugees in addition to their contributions to the regular budget of the Agency and to contribute to the establishment of vocational training centres for Palestine refugees, and requests the Agency to act as the recipient and trustee for the special allocations for grants and scholarships; 17. Urges all States, specialized agencies and non-governmental organizations to continue and to increase their contributions to the Agency so as to ease the ongoing financial constraints, exacerbated by the current humanitarian situation on the ground, and to support the Agency’s valuable work in assisting the Palestine refugees.",11/09/2004,2004_534793,Yemen,N/A,yes
