year,Council,Committee,Session,Agenda item,Agenda detail,cosponsored countries,body title number,body title detail,body text,date,file,filecountry,footnote,scanned
2004,Economic And Social Council,Commission On Human Rights,Sixtieth session,10,"ECONOMIC, SOCIAL AND CULTURAL RIGHTS","Algeria*, Andorra*, Bangladesh*, Belarus*, Bhutan*, Brazil, Burundi*, Cameroon*, China, Congo, Céte d’Ivoire*, Croatia, Cuba, Democratic Republic of the Congo*, Dominican Republic, Ecuador*, El Salvador*, Equatorial Guinea*, Eritrea, Ethiopia, India, Indonesia, Iran (Islamic Republic of)*, Kazakhstan*, Kenya*, Libyan Arab Jamahiriya*, Madagascar*, Malaysia*, Mauritania, Mexico, Mongolia*, Mozambique*, Nepal, Nigeria, Pakistan, Senegal*, Sierra Leone, South Africa*, Sri Lanka, Sudan, Swaziland, Switzerland*, Syrian Arab Republic*, Togo, United Republic of Tanzania*, Venezuela*, Viet Nam*, Yemen*, Zimbabwe",2004,The right to food,"The Commission on Human Rights, Recalling the Universal Declaration of Human Rights, which provides that everyone has the right to a standard of living adequate for her/his health and well-being, including food, Recalling also the provisions of the International Covenant on Economic, Social and Cultural Rights in which the fundamental right of every person to be free from hunger is recognized, Recalling further the Universal Declaration on the Eradication of Hunger and Malnutrition as well as the Millennium Declaration, Bearing in mind the Rome Declaration on World Food Security and the Plan of Action of the World Food Summit, held in Rome from 13 to 17 November 1996, and bearing in mind also the Declaration of the World Food Summit: five years later, held in Rome from Recalling all its previous resolutions in this regard, in particular resolution 2003/25 of 22 April 2003, Recognizing that the problem of hunger and food insecurity has global dimensions and that they are likely to persist and even to increase dramatically in some regions unless urgent, determined and concerted action is taken, given the anticipated increase in the world’s population and the strain on natural resources, Reaffirming that a peaceful, stable and enabling political, social and economic environment, both at a national and an international level, is the essential foundation which will enable States to give adequate priority to food security and poverty eradication, Reiterating, as did the Rome Declaration as well as the Declaration of the World Food Summit: five years later, that food should not be used as an instrument of political or economic pressure, and reaffirming in this regard the importance of international cooperation and solidarity, as well as the necessity of refraining from unilateral measures not in accordance with international law and the Charter of the United Nations which endanger food security, Convinced that each State must adopt a strategy consistent with its resources and capacities to achieve its individual goals in implementing the recommendations contained in the Rome Declaration and Plan of Action of the World Summit and, at the same time, cooperate regionally and internationally in order to organize collective solutions to global issues of food security in a world of increasingly interlinked institutions, societies and economies, where coordinated efforts and shared responsibilities are essential, Stressing the importance of reversing the continuing decline of official development assistance devoted to agriculture and rural development, both in real terms and as a share of total official development assistance, Reaffirming that all human rights are universal, indivisible and interdependent and interrelated, 1. Reaffirms that hunger constitutes an outrage and a violation of human dignity and, therefore, requires the adoption of urgent measures at the national, regional and international levels for its elimination,; 2. Also reaffirms the right of everyone to have access to safe and nutritious food, consistent with the right to adequate food and the fundamental right of everyone to be free from hunger so as to be able fully to develop and maintain their physical and mental capacities; 3. Considers it intolerable that there are around 840 million undernourished people in the world and that every seven seconds a child under the age of 10 dies, directly or indirectly, of hunger somewhere in the world when, according to the Food and Agriculture Organization of the United Nations, the world produces more than enough food to feed its entire population; 4. Stresses the need to make efforts to mobilize and optimize the allocation and utilization of technical and financial resources from all sources, including external debt relief for developing countries, to reinforce national actions to implement sustainable food security policies; 5. Recognizes that the promises made at the World Food Summit in 1996 to halve the number of undernourished persons are not being fulfilled, and invites once again all international financial and developmental institutions, as well as the relevant United Nations agencies and funds, to give priority and provide necessary funding to realize the aim to halve by the year 2015 the proportion of people who suffer from hunger, as well as the right to food; 6. Encourages all States to take steps with a view to achieving progressively the full realization of the right to food, including steps to promote the conditions for everyone to be free from hunger and as soon as possible enjoy fully the right to food, as well as to elaborate and adopt national plans to combat hunger; 7. Requests all States and private actors, as well as international organizations within their respective mandates, to take fully into account the need to promote the effective realization of the right to food for all, including in the ongoing negotiations in different fields; 8. Takes note with interest of the report of the Special Rapporteur on the right to food (E/CN.4/2004/10 and Add.1 and 2) and commends the Special Rapporteur for his valuable work in the promotion of the right to food in all parts of the world; 9. Expresses its appreciation to the Special Rapporteur for his effective contribution to the follow-up process of the World Food Summit: five years later, with the aim of developing voluntary guidelines on the right to food and strengthening the current international protection of this right; 10. Encourages the Special Rapporteur to continue mainstreaming a gender perspective in the fulfilment of his mandate; 10. 11. Requests the United Nations High Commissioner for Human Rights to provide all necessary human and financial resources for the effective fulfilment of the mandate of the Special Rapporteur; 11. 12. Welcomes the work already done by the Committee on Economic, Social and Cultural Rights in promoting the right to adequate food, in particular its general comment No. 12 (1999) on the right to adequate food (article 11 of the International Covenant on Economic, Social and Cultural Rights), in which the Committee affirmed, inter alia, that the right to adequate food is indivisibly linked to the inherent dignity of the human person and is 12. indispensable for the fulfilment of other human rights enshrined in the International Bill of Human Rights and is also inseparable from social justice, requiring the adoption of appropriate economic, environmental and social policies, at both the national and international levels, oriented to the eradication of poverty and the fulfilment of all human rights for all; 13. Takes note of general comment No. 15 (2002) on the right to water (articles 11 and 12 of the Covenant) adopted by the Committee on Economic, Social and Cultural Rights, in which the Committee notes, inter alia, the importance of ensuring sustainable water resources for human consumption and agriculture in the realization of the right to adequate food; 13. 14. Requests the Special Rapporteur to submit a report to the General Assembly at its fifty-ninth session and to report to the Commission at its sixty-first session on the implementation of the present resolution; 14. 15. Invites Governments, relevant United Nations agencies, funds and programmes, treaty bodies, civil society actors, including non-governmental organizations, as well as the private sector, to cooperate fully with the Special Rapporteur in the fulfilment of his mandate, inter alia through the submission of comments and suggestions on ways and means of realizing the right to food; 15. Decides to continue its consideration of this matter at its sixty-first session, under 16. the same agenda item.",04/08/2004,2004_520244,Yemen,"* In accordance with rule 69, paragraph 3, of the rules of procedure of the functional commissions of the Economic and Social Council. 10 to 13 June 2002,",yes
2004,General Assembly,N/A,Fifty-eighth session,38,Question of Palestine,"Algeria, Bahrain, Bangladesh, Comoros, Cuba, Djibouti, Egypt, Indonesia, Jordan, Kuwait, Lebanon, Libyan Arab Jamahiriya, Malaysia, Mauritania, Morocco, Namibia, Oman, Qatar, Saudi Arabia, Senegal, Somalia, South Africa, Sudan, Syrian Arab Republic, Tunisia, United Arab Emirates, Yemen and Palestine",N/A,"Status of the Occupied Palestinian Territory, including East Jerusalem","The General Assembly, Recalling its resolutions 3237 (XXIX) of 22 November 1974, 43/177 of 15 December 1988 and 52/250 of 7 July 1998, Recalling also Security Council resolutions 242 (1967), 338 (1973), 1397 (2002) and 1515 (2003), Recalling further the relevant provisions of international law, as well as relevant United Nations resolutions, with regard to Israeli settlements and to Occupied East Jerusalem, Reaffirming the principle of the inadmissibility of the acquisition of territory by force, Noting that Palestine, in its capacity as observer and pending its attainment of full membership in the United Nations, does not present credentials to the General Assembly, Affirming the need to enable the Palestinian people to exercise sovereignty over the territory occupied by Israel since 1967 and to achieve independence in their State, Palestine, Desirous of contributing to the achievement of the inalienable rights of the Palestinian people and the attainment of a just and comprehensive negotiated peace settlement in the Middle East resulting in two viable, sovereign and independent 04-33752 (E) 040504 *0433752* States, Israel and Palestine, based on the Armistice Line of 1949 and living side by side in peace and security, Affirms that the status of the Palestinian territory occupied since 1967, including East Jerusalem, remains one of military occupation, and affirms, in accordance with the rules and principles of international law, that the Palestinian people have the right to self-determination and to sovereignty over this territory and that Israel, the occupying Power, has no sovereignty over any part of this territory.",05/03/2004,2004_520589,Yemen,N/A,yes
2004,General Assembly,N/A,Fifty-eighth session,38,Question of Palestine,"Algeria, Bahrain, Bangladesh, Brunei Darussalam, Comoros, Cuba, Djibouti, Egypt, Indonesia, Jordan, Kuwait, Lebanon, Libyan Arab Jamahiriya, Malaysia, Mauritania, Morocco, Namibia, Oman, Qatar, Saudi Arabia, Senegal, Somalia, South Africa, Sudan, Syrian Arab Republic, Tunisia, United Arab Emirates, Yemen and Palestine",N/A,"Status of the Occupied Palestinian Territory, including East Jerusalem","The General Assembly, Recalling its resolutions 3237 (XXIX) of 22 November 1974, 43/177 of 15 December 1988 and 52/250 of 7 July 1998, Recalling also Security Council resolutions 242 (1967) of 22 November 1967, 338 (1973) of 22 October 1973, 1397 (2002) of 12 March 2002 and 1515 (2003) of 19 November 2003, Recalling further the relevant provisions of international law as well as relevant United Nations resolutions with regard to Israeli settlements and to Occupied East Jerusalem, Reaffirming the principle of the inadmissibility of the acquisition of territory by force, Noting that Palestine, in its capacity as observer and pending its attainment of full membership in the United Nations, does not present credentials to the General Assembly, Affirming the need to enable the Palestinian people to exercise sovereignty and to achieve independence in their State, Palestine, 1. Affirms that the status of the Palestinian territory occupied since 1967, including East Jerusalem, remains one of military occupation, and affirms, in accordance with the rules and principles of international law and relevant resolutions of the United Nations, including Security Council resolutions, that the Palestinian people have the right to self-determination and to sovereignty over their territory and that Israel, the occupying Power, has only the duties and obligations of 04-34128 (E) 060504 *0434128* an occupying Power under the Fourth Geneva Convention! and the Regulations annexed to the Hague Convention Respecting the Laws and Customs of War of 1907;2 2. Expresses its determination to contribute to the achievement of the inalienable rights of the Palestinian people and the attainment of a just and comprehensive negotiated peace settlement in the Middle East resulting in two viable, sovereign and independent States, Israel and Palestine, based on the pre-1967 borders and living side by side in peace and security. 1 United Nations, Treaty Series, vol. 75, No. 973. 2 See Carnegie Endowment for International Peace, The Hague Conventions and Declarations of 1899 and 1907 (New York, Oxford University Press, 1915).",05/06/2004,2004_520743,Yemen,N/A,yes
2004,Security Council,N/A,N/A,N/A,United Nations S 2004/400,N/A,N/A,N/A,"The Security Council, Reaffirming its previous resolutions 242 (1967), 338 (1973), 446 (1979), 1322 (2000), 1397 (2002), 1402 (2002), 1403 (2002), 1405 (2002), 1435 (2002), and 1515 (2003), Reiterating the obligation of Israel, the occupying Power, to abide scrupulously by its legal obligations and responsibilities under the Fourth Geneva Convention relative to the Protection of Civilian Persons in Time of War of 12 August 1949, Calling on Israel to address its security needs within the boundaries of international law, Expressing its grave concern at the continued deterioration of the situation on the ground in the territory occupied by Israel since 1967, Condemning the killing of Palestinian civilians that took place in the Rafah area, Gravely concerned by the recent demolition of homes committed by Israel, the occupying Power, in the Rafah refugee camp, Recalling the obligations of the Palestinian Authority and the Government of Israel under the Road Map, Condemning all acts of violence, terror and destruction, Reaffirming its support for the Road Map, endorsed in its resolution 1515 (2003), 1. Calls on Israel to respect its obligations under international humanitarian law, and insists, in particular, on its obligation not to undertake demolition of homes contrary to that law; 2. Expresses grave concern regarding the humanitarian situation of Palestinians made homeless in the Rafah area and calls for the provision of emergency assistance to them; 3. Calls for the cessation of violence and for respect of and adherence to legal obligations, including those under international humanitarian law; 4. Calls on both parties to immediately implement their obligations under the Road Map; 5. Decides to remain seized of the matter. 04-35715 (E) 190504 *0435715*",05/19/2004,2004_521557,Yemen,N/A,yes
2004,Economic And Social Council,N/A,Substantive session,11,"Economic and social repercussions of the Israeli occupation on the living conditions of the Palestinian people in the occupied Palestinian territory, including Jerusalem, and the Arab population in the occupied Syrian Golan","Algeria,* Bahrain,* Cuba, Djibouti,* Egypt,* Lebanon,* Qatar, Saudi Arabia, Somalia,* Sudan,* Tunisia and Yemen:*",N/A,"Economic and social repercussions of the Israeli occupation on the living conditions of the Palestinian people in the occupied Palestinian territory, including Jerusalem, and the Arab population in the occupied Syrian Golan","The Economic and Social Council, Recalling General Assembly resolution 58/229 of 23 December 2003, Also recalling its resolution 2003/59 of 24 July 2003, Guided by the principles of the Charter of the United Nations affirming the inadmissibility of the acquisition of territory by force, and recalling relevant Security Council resolutions, including resolutions 242 (1967) of 22 November 1967, 338 (1973) of 22 October 1973, 446 (1979) of 22 March 1979, 452 (1979) of 20 July 1979, 465 (1980) of 1 March 1980, 476 (1980) of 30 June 1980, 478 (1980) of 20 August 1980, 497 (1981) of 17 December 1981, 904 (1994) of 18 March 1994, 1073 (1996) of 28 September 1996, 1397 (2002) of 12 March 2002, 1515 (2003) of 19 November 2003 and 1544 (2004) of 19 May 2004, Recalling the resolutions of the tenth emergency special session of the General Assembly, including resolutions ES-10/13 of 21 October 2003 and ES-10/14 of 8 December 2003, Reaffirming the applicability of the Geneva Convention relative to the Protection of Civilian Persons in Time of War, of 12 August 1949,! to the Occupied 04-42819 (E) 160704 *0442819~* Palestinian Territory, including East Jerusalem, and other Arab territories occupied by Israel since 1967, Stressing the importance of the revival of the Middle East peace process on the basis of Security Council resolutions 242 (1967), 338 (1973), 425 (1978) of 19 March 1978, 1397 (2002), 1515 (2003) and 1544 (2004) and the principle of land for peace, as well as compliance with the agreements reached between the Government of Israel and the Palestine Liberation Organization, the representative of the Palestinian people, Reaffirming the principle of the permanent sovereignty of peoples under foreign occupation over their natural resources, Convinced that the Israeli occupation has gravely impeded the efforts to achieve sustainable development and a sound economic environment in the Occupied Palestinian Territory, including East Jerusalem, and the occupied Syrian Golan, Gravely concerned about the deterioration of the economic and living conditions of the Palestinian people in the Occupied Palestinian Territory, including East Jerusalem, and of the Arab population of the occupied Syrian Golan and the exploitation by Israel, the occupying Power, of their natural resources, Alarmed by the grave impact on the economic and social conditions of the Palestinian people caused by the construction of the wall by Israel inside the Occupied Palestinian Territory and the resulting violation of their economic and social rights, including the rights to work, to health, to education and to an adequate standard of living, Gravely concerned at the extensive destruction by Israel, the occupying Power, of agricultural land and orchards in the Occupied Palestinian Territory, including East Jerusalem, during the recent period, including, and in particular, as a result of the construction of the wall, Welcoming the Advisory Opinion rendered on 9 July 2004 by the International Court of Justice on the Legal Consequences of the Construction of a Wall in the Occupied Palestinian Territory,2 Expressing grave concern about the continuation of the recent tragic and violent events since September 2000 that have led to many deaths and injuries, Aware of the important work being done by the United Nations and the specialized agencies in support of the economic and social development of the Palestinian people, as well as the assistance being provided in the humanitarian field, Conscious of the urgent need for the reconstruction and development of the economic and social infrastructure of the Occupied Palestinian Territory, including East Jerusalem, as well as the urgent need to address the dire humanitarian crisis facing the Palestinian people, 1. Stresses the need to preserve the national unity and the territorial integrity of the Occupied Palestinian Territory, including East Jerusalem, and to guarantee the freedom of movement of persons and goods in the Territory, including E/2004/L.25 the removal of restrictions on going into and from East Jerusalem, and the freedom of movement to and from the outside world; 2. Also stresses the vital importance of the construction and operation of the seaport in Gaza and safe passage for the economic and social development of the Palestinian people; 3. Demands the complete cessation of all acts of violence, including all acts of terror, provocation, incitement and destruction; 4. Calls upon Israel, the occupying Power, to end its occupation of Palestinian cities, towns and other populated centres, to end the imposition of all forms of closure and curfew and to cease its destruction of homes and properties, economic institutions and agricultural fields; 5. Reaffirms the inalienable right of the Palestinian people and the Arab population of the occupied Syrian Golan to all their natural and economic resources, and calls upon Israel, the occupying Power, not to exploit, endanger or cause loss or depletion of these resources; 6. Also reaffirms that Israeli settlements in the Occupied Palestinian Territory, including East Jerusalem, and the occupied Syrian Golan, are illegal and an obstacle to economic and social development; 7. Stresses the importance of the work of the organizations and agencies of the United Nations and of the United Nations Special Coordinator for the Middle East Peace Process and Personal Representative of the Secretary-General to the Palestine Liberation Organization and the Palestinian Authority; 8. Urges Member States to encourage private foreign investment in the Occupied Palestinian Territory, including East Jerusalem, in infrastructure, job- creation projects and social development in order to alleviate the hardship of the Palestinian people and improve their living conditions; 9. Requests the Secretary-General to submit to the General Assembly at its fifty-ninth session, through the Economic and Social Council, a report on the implementation of the present resolution and to continue to include, in the report of the United Nations Special Coordinator, an update on the living conditions of the Palestinian people, in collaboration with relevant United Nations agencies; 10. Decides to include the item entitled “Economic and social repercussions of the Israeli occupation on the living conditions of the Palestinian people in the Occupied Palestinian Territory, including East Jerusalem, and the Arab population in the occupied Syrian Golan” in the agenda of its substantive session of 2005.",07/12/2004,2004_526131,Yemen,"* In accordance with rule 72 of the rules of procedure of the Economic and Social Council. 1 United Nations, Treaty Series, vol. 75, No. 973.",yes
